"No.","Time","Time since first frame in this TCP stream","segment delta","Time delta from previous captured frame","Destination","Delta Time (conv)","Info","Length","Time shift for this packet","Source","Time delta from previous captured frame","Protocol"
"3","1470316186.468397","0.000000000","0.000000000","17.237497000","10.1.1.2","0.000000000","52451  >  8800 [FIN, ACK] Seq=1 Ack=1 Win=4380 Len=0","60","0.000000000","10.22.1.2","17.237497000","TCP"
"6","1470316186.473711","0.005314000","0.005062000","0.005062000","10.1.1.2","0.005062000","52451  >  8800 [ACK] Seq=2 Ack=2 Win=4380 Len=0","60","0.000000000","10.22.1.2","0.005062000","TCP"
"13","1470316196.143437","0.000000000","0.000000000","4.673760000","10.1.1.2","0.000000000","52455  >  8800 [SYN] Seq=0 Win=8192 Len=0 MSS=1460 WS=4 SACK_PERM=1","66","0.000000000","10.22.1.2","4.673760000","TCP"
"15","1470316196.146086","0.002649000","0.002550000","0.002550000","10.1.1.2","0.002550000","52455  >  8800 [ACK] Seq=1 Ack=1 Win=17520 Len=0","60","0.000000000","10.22.1.2","0.002550000","TCP"
"16","1470316196.180710","0.037273000","0.034624000","0.034624000","10.1.1.2","0.034624000","52455  >  8800 [PSH, ACK] Seq=1 Ack=1 Win=17520 Len=313","367","0.000000000","10.22.1.2","0.034624000","TCP"
"18","1470316196.208655","0.065218000","0.010074000","0.010074000","10.1.1.2","0.010074000","52455  >  8800 [PSH, ACK] Seq=314 Ack=933 Win=16588 Len=126","180","0.000000000","10.22.1.2","0.010074000","TCP"
"20","1470316196.217974","0.074537000","0.003932000","0.003932000","10.1.1.2","0.003932000","52455  >  8800 [PSH, ACK] Seq=440 Ack=1159 Win=16360 Len=90","144","0.000000000","10.22.1.2","0.003932000","TCP"
"22","1470316196.241934","0.098497000","0.004242000","0.004242000","10.1.1.2","0.004242000","52455  >  8800 [ACK] Seq=530 Ack=4079 Win=17520 Len=0","60","0.000000000","10.22.1.2","0.004242000","TCP"
"24","1470316196.244592","0.101155000","0.002640000","0.002640000","10.1.1.2","0.002640000","52455  >  8800 [ACK] Seq=530 Ack=6736 Win=17520 Len=0","60","0.000000000","10.22.1.2","0.002640000","TCP"
"27","1470316196.249921","0.106484000","0.003882000","0.003882000","10.1.1.2","0.003882000","52455  >  8800 [ACK] Seq=530 Ack=9656 Win=17520 Len=0","60","0.000000000","10.22.1.2","0.003882000","TCP"
"29","1470316196.251251","0.107814000","0.001305000","0.001305000","10.1.1.2","0.001305000","52455  >  8800 [ACK] Seq=530 Ack=12576 Win=17520 Len=0","60","0.000000000","10.22.1.2","0.001305000","TCP"
"30","1470316196.256575","0.113138000","0.005324000","0.005324000","10.1.1.2","0.005324000","52455  >  8800 [ACK] Seq=530 Ack=16956 Win=17520 Len=0","60","0.000000000","10.22.1.2","0.005324000","TCP"
"33","1470316196.462909","0.319472000","0.206334000","0.011962000","10.1.1.2","0.206334000","52455  >  8800 [ACK] Seq=530 Ack=17654 Win=16820 Len=0","60","0.000000000","10.22.1.2","0.011962000","TCP"
"34","1470316196.819672","0.676235000","0.356763000","0.356763000","10.1.1.2","0.356763000","52455  >  8800 [PSH, ACK] Seq=530 Ack=17654 Win=16820 Len=151","205","0.000000000","10.22.1.2","0.356763000","TCP"
"37","1470316196.884896","0.741459000","0.006722000","0.005005000","10.1.1.2","0.006722000","52455  >  8800 [ACK] Seq=681 Ack=24973 Win=17520 Len=0","60","0.000000000","10.22.1.2","0.005005000","TCP"
"38","1470316196.895547","0.000000000","0.000000000","0.010651000","10.1.1.2","0.000000000","52459  >  12000 [SYN] Seq=0 Win=8192 Len=0 MSS=1460 WS=256 SACK_PERM=1","66","0.000000000","10.22.1.2","0.010651000","TCP"
"40","1470316196.898205","0.002658000","0.002585000","0.002585000","10.1.1.2","0.002585000","52459  >  12000 [ACK] Seq=1 Ack=1 Win=17408 Len=0","60","0.000000000","10.22.1.2","0.002585000","TCP"
"41","1470316196.931500","0.035953000","0.033295000","0.033295000","10.1.1.2","0.033295000","52459  >  12000 [PSH, ACK] Seq=1 Ack=1 Win=17408 Len=313","367","0.000000000","10.22.1.2","0.033295000","TCP"
"43","1470316196.947465","0.051918000","0.009028000","0.009028000","10.1.1.2","0.009028000","52459  >  12000 [PSH, ACK] Seq=314 Ack=933 Win=16384 Len=126","180","0.000000000","10.22.1.2","0.009028000","TCP"
"45","1470316196.955457","0.059910000","0.004530000","0.004530000","10.1.1.2","0.004530000","52459  >  12000 [PSH, ACK] Seq=440 Ack=1159 Win=16128 Len=59","113","0.000000000","10.22.1.2","0.004530000","TCP"
"47","1470316196.959448","0.063901000","0.003692000","0.003692000","10.1.1.2","0.003692000","52459  >  12000 [PSH, ACK] Seq=499 Ack=1204 Win=16128 Len=116","170","0.000000000","10.22.1.2","0.003692000","TCP"
"49","1470316196.995396","0.099849000","0.028479000","0.028479000","10.1.1.2","0.028479000","52459  >  12000 [PSH, ACK] Seq=615 Ack=1536 Win=17408 Len=49","103","0.000000000","10.22.1.2","0.028479000","TCP"
"51","1470316197.002039","0.106492000","0.002656000","0.002656000","10.1.1.2","0.002656000","52459  >  12000 [PSH, ACK] Seq=664 Ack=1769 Win=17152 Len=49","103","0.000000000","10.22.1.2","0.002656000","TCP"
"54","1470316197.204383","0.308836000","0.195327000","0.118466000","10.1.1.2","0.195327000","52459  >  12000 [ACK] Seq=713 Ack=2098 Win=16896 Len=0","60","0.000000000","10.22.1.2","0.118466000","TCP"
"55","1470316198.676679","1.781132000","1.472296000","1.472296000","10.1.1.2","1.472296000","52459  >  12000 [PSH, ACK] Seq=713 Ack=2098 Win=16896 Len=68","122","0.000000000","10.22.1.2","1.472296000","TCP"
"57","1470316198.780505","1.884958000","0.018600000","0.018600000","10.1.1.2","0.018600000","52459  >  12000 [PSH, ACK] Seq=781 Ack=3558 Win=17408 Len=128","182","0.000000000","10.22.1.2","0.018600000","TCP"
"59","1470316198.981515","2.085968000","0.001360000","0.001360000","10.1.1.2","0.001360000","52459  >  12000 [ACK] Seq=909 Ack=4318 Win=16640 Len=0","60","0.000000000","10.22.1.2","0.001360000","TCP"
"61","1470316198.993487","2.097940000","0.011933000","0.011933000","10.1.1.2","0.011933000","52459  >  12000 [PSH, ACK] Seq=909 Ack=4666 Win=16384 Len=50","104","0.000000000","10.22.1.2","0.011933000","TCP"
"63","1470316199.033431","2.137884000","0.019369000","0.019369000","10.1.1.2","0.019369000","52459  >  12000 [PSH, ACK] Seq=959 Ack=5296 Win=17408 Len=50","104","0.000000000","10.22.1.2","0.019369000","TCP"
"65","1470316199.245096","2.349549000","0.197198000","0.197198000","10.1.1.2","0.197198000","52459  >  12000 [ACK] Seq=1009 Ack=6458 Win=16128 Len=0","60","0.000000000","10.22.1.2","0.197198000","TCP"
"66","1470316199.893380","2.997833000","0.648284000","0.648284000","10.1.1.2","0.648284000","52459  >  12000 [PSH, ACK] Seq=1009 Ack=6458 Win=16128 Len=74","128","0.000000000","10.22.1.2","0.648284000","TCP"
"68","1470316200.031821","3.136274000","0.006942000","0.006942000","10.1.1.2","0.006942000","52459  >  12000 [PSH, ACK] Seq=1083 Ack=15218 Win=17408 Len=132","186","0.000000000","10.22.1.2","0.006942000","TCP"
"70","1470316200.034477","3.138930000","0.002594000","0.002594000","10.1.1.2","0.002594000","52459  >  12000 [ACK] Seq=1215 Ack=20304 Win=17408 Len=0","60","0.000000000","10.22.1.2","0.002594000","TCP"
"74","1470316200.106371","3.210824000","0.050730000","0.042606000","10.1.1.2","0.050730000","52459  >  12000 [PSH, ACK] Seq=1215 Ack=20934 Win=16640 Len=64","118","0.000000000","10.22.1.2","0.042606000","TCP"
"76","1470316200.315365","3.419818000","0.196350000","0.196350000","10.1.1.2","0.196350000","52459  >  12000 [ACK] Seq=1279 Ack=22160 Win=17408 Len=0","60","0.000000000","10.22.1.2","0.196350000","TCP"
"79","1470316201.907462","5.011915000","1.592097000","0.665601000","10.1.1.2","1.592097000","52459  >  12000 [PSH, ACK] Seq=1279 Ack=22160 Win=17408 Len=74","128","0.000000000","10.22.1.2","0.665601000","TCP"
"81","1470316202.116461","5.220914000","0.015670000","0.015670000","10.1.1.2","0.015670000","52459  >  12000 [PSH, ACK] Seq=1353 Ack=23620 Win=17408 Len=132","186","0.000000000","10.22.1.2","0.015670000","TCP"
"82","1470316202.116464","5.220917000","0.000003000","0.000003000","10.1.1.2","0.000003000","52459  >  12000 [ACK] Seq=1485 Ack=30920 Win=212992 Len=0","60","0.000000000","10.22.1.2","0.000003000","TCP"
"83","1470316202.116465","5.220918000","0.000001000","0.000001000","10.1.1.2","0.000001000","52459  >  12000 [ACK] Seq=1485 Ack=33298 Win=229120 Len=0","60","0.000000000","10.22.1.2","0.000001000","TCP"
"85","1470316202.208311","5.312764000","0.078348000","0.078348000","10.1.1.2","0.078348000","52459  >  12000 [PSH, ACK] Seq=1485 Ack=33928 Win=228352 Len=64","118","0.000000000","10.22.1.2","0.078348000","TCP"
"87","1470316202.426621","5.531074000","0.205748000","0.205748000","10.1.1.2","0.205748000","52459  >  12000 [ACK] Seq=1549 Ack=35154 Win=227328 Len=0","60","0.000000000","10.22.1.2","0.205748000","TCP"
"90","1470316203.173406","6.277859000","0.005300000","0.005300000","10.1.1.2","0.005300000","52459  >  12000 [PSH, ACK] Seq=1549 Ack=35201 Win=227072 Len=45","99","0.000000000","10.22.1.2","0.005300000","TCP"
"93","1470316203.390387","6.494840000","0.003822000","0.003822000","10.1.1.2","0.003822000","52459  >  12000 [PSH, ACK] Seq=1594 Ack=35201 Win=227072 Len=134","188","0.000000000","10.22.1.2","0.003822000","TCP"
"96","1470316203.599388","6.703841000","0.204358000","0.009652000","10.1.1.2","0.204358000","52459  >  12000 [ACK] Seq=1728 Ack=35283 Win=227072 Len=0","60","0.000000000","10.22.1.2","0.009652000","TCP"
"98","1470316203.793738","6.898191000","0.194306000","0.194306000","10.1.1.2","0.194306000","52459  >  12000 [PSH, ACK] Seq=1728 Ack=35417 Win=227072 Len=68","122","0.000000000","10.22.1.2","0.194306000","TCP"
"100","1470316203.807053","6.911506000","0.005292000","0.005292000","10.1.1.2","0.005292000","52459  >  12000 [PSH, ACK] Seq=1796 Ack=35555 Win=226816 Len=90","144","0.000000000","10.22.1.2","0.005292000","TCP"
"102","1470316204.016045","7.120498000","0.004438000","0.004438000","10.1.1.2","0.004438000","52459  >  12000 [PSH, ACK] Seq=1886 Ack=35555 Win=226816 Len=50","104","0.000000000","10.22.1.2","0.004438000","TCP"
"104","1470316204.050660","7.155113000","0.013055000","0.013055000","10.1.1.2","0.013055000","52459  >  12000 [PSH, ACK] Seq=1936 Ack=36185 Win=226304 Len=68","122","0.000000000","10.22.1.2","0.013055000","TCP"
"106","1470316204.057312","7.161765000","0.003116000","0.003116000","10.1.1.2","0.003116000","52459  >  12000 [PSH, ACK] Seq=2004 Ack=36326 Win=229120 Len=50","104","0.000000000","10.22.1.2","0.003116000","TCP"
"108","1470316204.074625","7.179078000","0.004200000","0.004200000","10.1.1.2","0.004200000","52459  >  12000 [PSH, ACK] Seq=2054 Ack=36930 Win=228608 Len=50","104","0.000000000","10.22.1.2","0.004200000","TCP"
"110","1470316204.086599","7.191052000","0.003826000","0.003826000","10.1.1.2","0.003826000","52459  >  12000 [PSH, ACK] Seq=2104 Ack=37644 Win=227840 Len=68","122","0.000000000","10.22.1.2","0.003826000","TCP"
"112","1470316204.103916","7.208369000","0.012479000","0.012479000","10.1.1.2","0.012479000","52459  >  12000 [PSH, ACK] Seq=2172 Ack=37693 Win=227840 Len=68","122","0.000000000","10.22.1.2","0.012479000","TCP"
"114","1470316204.118555","7.223008000","0.012117000","0.012117000","10.1.1.2","0.012117000","52459  >  12000 [PSH, ACK] Seq=2240 Ack=37742 Win=227584 Len=68","122","0.000000000","10.22.1.2","0.012117000","TCP"
"116","1470316204.147842","7.252295000","0.026510000","0.026510000","10.1.1.2","0.026510000","52459  >  12000 [PSH, ACK] Seq=2308 Ack=37791 Win=227584 Len=68","122","0.000000000","10.22.1.2","0.026510000","TCP"
"118","1470316204.153158","7.257611000","0.002951000","0.002951000","10.1.1.2","0.002951000","52459  >  12000 [PSH, ACK] Seq=2376 Ack=37840 Win=227584 Len=68","122","0.000000000","10.22.1.2","0.002951000","TCP"
"120","1470316204.213070","7.317523000","0.053036000","0.053036000","10.1.1.2","0.053036000","52459  >  12000 [PSH, ACK] Seq=2444 Ack=38027 Win=227328 Len=50","104","0.000000000","10.22.1.2","0.053036000","TCP"
"122","1470316204.428725","7.533178000","0.206411000","0.206411000","10.1.1.2","0.206411000","52459  >  12000 [ACK] Seq=2494 Ack=38741 Win=226560 Len=0","60","0.000000000","10.22.1.2","0.206411000","TCP"
"123","1470316205.393829","9.250392000","8.508933000","0.965104000","10.1.1.2","8.508933000","52455  >  8800 [PSH, ACK] Seq=681 Ack=24973 Win=17520 Len=187","241","0.000000000","10.22.1.2","0.965104000","TCP"
"127","1470316206.196525","10.053088000","0.002471000","0.002471000","10.1.1.2","0.002471000","52455  >  8800 [ACK] Seq=868 Ack=27297 Win=17520 Len=0","60","0.000000000","10.22.1.2","0.002471000","TCP"
"128","1470316206.196526","10.053089000","0.000001000","0.000001000","10.1.1.2","0.000001000","52455  >  8800 [ACK] Seq=868 Ack=29621 Win=17520 Len=0","60","0.000000000","10.22.1.2","0.000001000","TCP"
"129","1470316206.208507","0.000000000","0.000000000","0.011981000","10.1.1.2","0.000000000","52460  >  12003 [SYN] Seq=0 Win=8192 Len=0 MSS=1460 WS=4 SACK_PERM=1","66","0.000000000","10.22.1.2","0.011981000","TCP"
"131","1470316206.213828","0.005321000","0.005180000","0.005180000","10.1.1.2","0.005180000","52460  >  12003 [ACK] Seq=1 Ack=1 Win=65700 Len=0","60","0.000000000","10.22.1.2","0.005180000","TCP"
"132","1470316206.228482","0.019975000","0.014654000","0.014654000","10.1.1.2","0.014654000","52460  >  12003 [PSH, ACK] Seq=1 Ack=1 Win=65700 Len=313","367","0.000000000","10.22.1.2","0.014654000","TCP"
"135","1470316206.244446","10.101009000","0.005238000","0.005238000","10.1.1.2","0.005238000","52455  >  8800 [ACK] Seq=868 Ack=33406 Win=17520 Len=0","60","0.000000000","10.22.1.2","0.005238000","TCP"
"136","1470316206.256433","9.360886000","1.827708000","0.011987000","10.1.1.2","1.827708000","52459  >  12000 [PSH, ACK] Seq=2494 Ack=38741 Win=226560 Len=68","122","0.000000000","10.22.1.2","0.011987000","TCP"
"138","1470316206.273735","9.378188000","0.004628000","0.004628000","10.1.1.2","0.004628000","52459  >  12000 [PSH, ACK] Seq=2562 Ack=38928 Win=226560 Len=600","654","0.000000000","10.22.1.2","0.004628000","TCP"
"145","1470316206.498707","9.603160000","0.197662000","0.030546000","10.1.1.2","0.197662000","52459  >  12000 [ACK] Seq=3162 Ack=39059 Win=226304 Len=0","60","0.000000000","10.22.1.2","0.030546000","TCP"
"147","1470316206.553287","9.657740000","0.054537000","0.054537000","10.1.1.2","0.054537000","52459  >  12000 [PSH, ACK] Seq=3162 Ack=39999 Win=225536 Len=50","104","0.000000000","10.22.1.2","0.054537000","TCP"
"153","1470316206.796889","9.901342000","0.237111000","0.048926000","10.1.1.2","0.237111000","52459  >  12000 [ACK] Seq=3212 Ack=40713 Win=224768 Len=0","60","0.000000000","10.22.1.2","0.048926000","TCP"
"154","1470316206.811529","0.603022000","0.063566000","0.014640000","10.1.1.2","0.063566000","52460  >  12003 [PSH, ACK] Seq=314 Ack=933 Win=64768 Len=126","180","0.000000000","10.22.1.2","0.014640000","TCP"
"157","1470316206.832828","0.000000000","0.000000000","0.007160000","10.1.1.2","0.000000000","52462  >  12002 [SYN] Seq=0 Win=8192 Len=0 MSS=1460 WS=4 SACK_PERM=1","66","0.000000000","10.22.1.2","0.007160000","TCP"
"158","1470316206.832828","0.000000000","0.000000000","0.000000000","10.1.1.2","0.000000000","52461  >  12001 [SYN] Seq=0 Win=8192 Len=0 MSS=1460 WS=4 SACK_PERM=1","66","0.000000000","10.22.1.2","0.000000000","TCP"
"161","1470316206.835490","0.002662000","0.002524000","0.002445000","10.1.1.2","0.002524000","52462  >  12002 [ACK] Seq=1 Ack=1 Win=65700 Len=0","60","0.000000000","10.22.1.2","0.002445000","TCP"
"162","1470316206.835491","0.002663000","0.002446000","0.000001000","10.1.1.2","0.002446000","52461  >  12001 [ACK] Seq=1 Ack=1 Win=65700 Len=0","60","0.000000000","10.22.1.2","0.000001000","TCP"
"164","1470316206.859450","0.026622000","0.023960000","0.005315000","10.1.1.2","0.023960000","52462  >  12002 [PSH, ACK] Seq=1 Ack=1 Win=65700 Len=313","367","0.000000000","10.22.1.2","0.005315000","TCP"
"165","1470316206.878088","0.045260000","0.042597000","0.018638000","10.1.1.2","0.042597000","52461  >  12001 [PSH, ACK] Seq=1 Ack=1 Win=65700 Len=313","367","0.000000000","10.22.1.2","0.018638000","TCP"
"168","1470316206.916695","0.083867000","0.027718000","0.027705000","10.1.1.2","0.027718000","52462  >  12002 [PSH, ACK] Seq=314 Ack=933 Win=64768 Len=126","180","0.000000000","10.22.1.2","0.027705000","TCP"
"169","1470316206.916696","0.083868000","0.027706000","0.000001000","10.1.1.2","0.027706000","52461  >  12001 [PSH, ACK] Seq=314 Ack=933 Win=64768 Len=126","180","0.000000000","10.22.1.2","0.000001000","TCP"
"172","1470316206.926010","0.093182000","0.005761000","0.002480000","10.1.1.2","0.005761000","52462  >  12002 [PSH, ACK] Seq=440 Ack=1219 Win=64480 Len=575","629","0.000000000","10.22.1.2","0.002480000","TCP"
"175","1470316206.980591","0.147763000","0.057061000","0.000333000","10.1.1.2","0.057061000","52461  >  12001 [PSH, ACK] Seq=440 Ack=1219 Win=64480 Len=172","226","0.000000000","10.22.1.2","0.000333000","TCP"
"176","1470316207.024521","0.816014000","0.206360000","0.043930000","10.1.1.2","0.206360000","52460  >  12003 [ACK] Seq=440 Ack=1259 Win=64440 Len=0","60","0.000000000","10.22.1.2","0.043930000","TCP"
"184","1470316207.350662","1.142155000","0.326141000","0.138401000","10.1.1.2","0.326141000","52460  >  12003 [ACK] Seq=440 Ack=1259 Win=64440 Len=1460","1514","0.000000000","10.22.1.2","0.138401000","TCP"
"185","1470316207.354652","1.146145000","0.003990000","0.003990000","10.1.1.2","0.003990000","52460  >  12003 [ACK] Seq=1900 Ack=1259 Win=64440 Len=1460","1514","0.000000000","10.22.1.2","0.003990000","TCP"
"187","1470316207.361311","1.152804000","0.006633000","0.006633000","10.1.1.2","0.006633000","52460  >  12003 [ACK] Seq=3360 Ack=1259 Win=64440 Len=1460","1514","0.000000000","10.22.1.2","0.006633000","TCP"
"188","1470316207.361313","1.152806000","0.000002000","0.000002000","10.1.1.2","0.000002000","52460  >  12003 [ACK] Seq=4820 Ack=1259 Win=64440 Len=1460","1514","0.000000000","10.22.1.2","0.000002000","TCP"
"189","1470316207.361315","1.152808000","0.000002000","0.000002000","10.1.1.2","0.000002000","52460  >  12003 [ACK] Seq=6280 Ack=1259 Win=64440 Len=1460","1514","0.000000000","10.22.1.2","0.000002000","TCP"
"190","1470316207.361316","1.152809000","0.000001000","0.000001000","10.1.1.2","0.000001000","52460  >  12003 [ACK] Seq=7740 Ack=1259 Win=64440 Len=1460","1514","0.000000000","10.22.1.2","0.000001000","TCP"
"192","1470316207.367963","1.159456000","0.006615000","0.006615000","10.1.1.2","0.006615000","52460  >  12003 [ACK] Seq=9200 Ack=1259 Win=64440 Len=1460","1514","0.000000000","10.22.1.2","0.006615000","TCP"
"193","1470316207.381276","1.172769000","0.013313000","0.013313000","10.1.1.2","0.013313000","52460  >  12003 [PSH, ACK] Seq=10660 Ack=1259 Win=64440 Len=1131","1185","0.000000000","10.22.1.2","0.013313000","TCP"
"229","1470316208.211935","2.003428000","0.005312000","0.005312000","10.1.1.2","0.005312000","52460  >  12003 [ACK] Seq=11791 Ack=4179 Win=65700 Len=0","60","0.000000000","10.22.1.2","0.005312000","TCP"
"231","1470316208.219923","2.011416000","0.007956000","0.007956000","10.1.1.2","0.007956000","52460  >  12003 [ACK] Seq=11791 Ack=8559 Win=65700 Len=0","60","0.000000000","10.22.1.2","0.007956000","TCP"
"233","1470316208.223913","2.015406000","0.003963000","0.003963000","10.1.1.2","0.003963000","52460  >  12003 [ACK] Seq=11791 Ack=12585 Win=65700 Len=0","60","0.000000000","10.22.1.2","0.003963000","TCP"
"234","1470316208.290474","2.081967000","0.066561000","0.066561000","10.1.1.2","0.066561000","52460  >  12003 [PSH, ACK] Seq=11791 Ack=12585 Win=65700 Len=106","160","0.000000000","10.22.1.2","0.066561000","TCP"
"242","1470316208.494143","2.285636000","0.003369000","0.003369000","10.1.1.2","0.003369000","52460  >  12003 [PSH, ACK] Seq=11897 Ack=12585 Win=65700 Len=132","186","0.000000000","10.22.1.2","0.003369000","TCP"
"253","1470316208.793660","2.585153000","0.091947000","0.011980000","10.1.1.2","0.091947000","52460  >  12003 [PSH, ACK] Seq=12029 Ack=12585 Win=65700 Len=121","175","0.000000000","10.22.1.2","0.011980000","TCP"
"256","1470316208.821614","2.613107000","0.027954000","0.005294000","10.1.1.2","0.027954000","52460  >  12003 [ACK] Seq=12150 Ack=12585 Win=65700 Len=1460","1514","0.000000000","10.22.1.2","0.005294000","TCP"
"258","1470316208.822954","2.614447000","0.001317000","0.001317000","10.1.1.2","0.001317000","52460  >  12003 [ACK] Seq=13610 Ack=12585 Win=65700 Len=1460","1514","0.000000000","10.22.1.2","0.001317000","TCP"
"259","1470316208.822955","2.614448000","0.000001000","0.000001000","10.1.1.2","0.000001000","52460  >  12003 [ACK] Seq=15070 Ack=12585 Win=65700 Len=1460","1514","0.000000000","10.22.1.2","0.000001000","TCP"
"260","1470316208.822957","2.614450000","0.000002000","0.000002000","10.1.1.2","0.000002000","52460  >  12003 [ACK] Seq=16530 Ack=12585 Win=65700 Len=1460","1514","0.000000000","10.22.1.2","0.000002000","TCP"
"261","1470316208.822961","2.614454000","0.000004000","0.000004000","10.1.1.2","0.000004000","52460  >  12003 [ACK] Seq=17990 Ack=12585 Win=65700 Len=1460","1514","0.000000000","10.22.1.2","0.000004000","TCP"
"262","1470316208.822962","2.614455000","0.000001000","0.000001000","10.1.1.2","0.000001000","52460  >  12003 [ACK] Seq=19450 Ack=12585 Win=65700 Len=1460","1514","0.000000000","10.22.1.2","0.000001000","TCP"
"263","1470316208.822964","2.614457000","0.000002000","0.000002000","10.1.1.2","0.000002000","52460  >  12003 [ACK] Seq=20910 Ack=12585 Win=65700 Len=1460","1514","0.000000000","10.22.1.2","0.000002000","TCP"
"264","1470316208.822966","2.614459000","0.000002000","0.000002000","10.1.1.2","0.000002000","52460  >  12003 [ACK] Seq=22370 Ack=12585 Win=65700 Len=1460","1514","0.000000000","10.22.1.2","0.000002000","TCP"
"265","1470316208.822968","2.614461000","0.000002000","0.000002000","10.1.1.2","0.000002000","52460  >  12003 [ACK] Seq=23830 Ack=12585 Win=65700 Len=1460","1514","0.000000000","10.22.1.2","0.000002000","TCP"
"266","1470316208.822970","2.614463000","0.000002000","0.000002000","10.1.1.2","0.000002000","52460  >  12003 [PSH, ACK] Seq=25290 Ack=12585 Win=65700 Len=725","779","0.000000000","10.22.1.2","0.000002000","TCP"
"278","1470316209.061246","2.228418000","0.204158000","0.029116000","10.1.1.2","0.204158000","52461  >  12001 [ACK] Seq=612 Ack=1391 Win=64308 Len=0","60","0.000000000","10.22.1.2","0.029116000","TCP"
"279","1470316209.061248","2.228420000","0.204059000","0.000002000","10.1.1.2","0.204059000","52462  >  12002 [ACK] Seq=1015 Ack=1395 Win=64304 Len=0","60","0.000000000","10.22.1.2","0.000002000","TCP"
"293","1470316209.149087","2.316259000","0.031024000","0.010620000","10.1.1.2","0.031024000","52461  >  12001 [ACK] Seq=612 Ack=3535 Win=65700 Len=0","60","0.000000000","10.22.1.2","0.010620000","TCP"
"298","1470316209.228958","2.396130000","0.011090000","0.011090000","10.1.1.2","0.011090000","52462  >  12002 [ACK] Seq=1015 Ack=4211 Win=65700 Len=0","60","0.000000000","10.22.1.2","0.011090000","TCP"
"301","1470316209.292856","3.084349000","0.469771000","0.018638000","10.1.1.2","0.469771000","52460  >  12003 [PSH, ACK] Seq=26015 Ack=12585 Win=65700 Len=121","175","0.000000000","10.22.1.2","0.018638000","TCP"
"308","1470316209.326133","2.493305000","0.002914000","0.002914000","10.1.1.2","0.002914000","52461  >  12001 [ACK] Seq=612 Ack=8541 Win=65700 Len=0","60","0.000000000","10.22.1.2","0.002914000","TCP"
"313","1470316209.443279","2.610451000","0.035842000","0.035842000","10.1.1.2","0.035842000","52462  >  12002 [ACK] Seq=1015 Ack=4387 Win=65524 Len=0","60","0.000000000","10.22.1.2","0.035842000","TCP"
"317","1470316209.452603","2.619775000","0.009300000","0.000120000","10.1.1.2","0.009300000","52462  >  12002 [ACK] Seq=1015 Ack=5971 Win=65700 Len=0","60","0.000000000","10.22.1.2","0.000120000","TCP"
"331","1470316209.487211","2.654383000","0.034551000","0.000257000","10.1.1.2","0.034551000","52462  >  12002 [ACK] Seq=1015 Ack=6323 Win=65348 Len=0","60","0.000000000","10.22.1.2","0.000257000","TCP"
"334","1470316209.492532","3.284025000","0.005578000","0.004784000","10.1.1.2","0.005578000","52460  >  12003 [ACK] Seq=26136 Ack=14166 Win=65700 Len=0","60","0.000000000","10.22.1.2","0.004784000","TCP"
"335","1470316209.497855","3.289348000","0.005323000","0.005323000","10.1.1.2","0.005323000","52460  >  12003 [ACK] Seq=26136 Ack=20006 Win=65700 Len=0","60","0.000000000","10.22.1.2","0.005323000","TCP"
"336","1470316209.515163","3.306656000","0.017308000","0.017308000","10.1.1.2","0.017308000","52460  >  12003 [ACK] Seq=26136 Ack=24386 Win=65700 Len=0","60","0.000000000","10.22.1.2","0.017308000","TCP"
"340","1470316209.528477","3.319970000","0.013314000","0.010622000","10.1.1.2","0.013314000","52460  >  12003 [ACK] Seq=26136 Ack=26546 Win=65700 Len=0","60","0.000000000","10.22.1.2","0.010622000","TCP"
"355","1470316209.532467","2.699639000","0.001816000","0.001816000","10.1.1.2","0.001816000","52461  >  12001 [ACK] Seq=612 Ack=11025 Win=65700 Len=0","60","0.000000000","10.22.1.2","0.001816000","TCP"
"356","1470316209.535130","2.702302000","0.002663000","0.002663000","10.1.1.2","0.002663000","52461  >  12001 [ACK] Seq=612 Ack=15253 Win=65700 Len=0","60","0.000000000","10.22.1.2","0.002663000","TCP"
"357","1470316209.535131","2.702303000","0.000001000","0.000001000","10.1.1.2","0.000001000","52461  >  12001 [ACK] Seq=612 Ack=17991 Win=65700 Len=0","60","0.000000000","10.22.1.2","0.000001000","TCP"
"360","1470316209.593715","2.760887000","0.058560000","0.051930000","10.1.1.2","0.058560000","52461  >  12001 [ACK] Seq=612 Ack=19411 Win=64280 Len=1460","1514","0.000000000","10.22.1.2","0.051930000","TCP"
"361","1470316209.593719","2.760891000","0.000004000","0.000004000","10.1.1.2","0.000004000","52461  >  12001 [PSH, ACK] Seq=2072 Ack=19411 Win=64280 Len=342","396","0.000000000","10.22.1.2","0.000004000","TCP"
"364","1470316209.615015","2.782187000","0.021235000","0.020322000","10.1.1.2","0.021235000","52461  >  12001 [ACK] Seq=2414 Ack=19411 Win=64280 Len=1460","1514","0.000000000","10.22.1.2","0.020322000","TCP"
"365","1470316209.615018","2.782190000","0.000003000","0.000003000","10.1.1.2","0.000003000","52461  >  12001 [PSH, ACK] Seq=3874 Ack=19411 Win=64280 Len=1074","1128","0.000000000","10.22.1.2","0.000003000","TCP"
"369","1470316209.648280","2.815452000","0.024560000","0.024560000","10.1.1.2","0.024560000","52462  >  12002 [ACK] Seq=1015 Ack=8083 Win=65700 Len=0","60","0.000000000","10.22.1.2","0.024560000","TCP"
"370","1470316209.648281","2.815453000","0.033192000","0.000001000","10.1.1.2","0.033192000","52461  >  12001 [PSH, ACK] Seq=4948 Ack=19411 Win=64280 Len=636","690","0.000000000","10.22.1.2","0.000001000","TCP"
"377","1470316209.721497","2.888669000","0.073216000","0.003921000","10.1.1.2","0.073216000","52461  >  12001 [PSH, ACK] Seq=5584 Ack=19411 Win=64280 Len=1460","1514","0.000000000","10.22.1.2","0.003921000","TCP"
"378","1470316209.721499","2.888671000","0.000002000","0.000002000","10.1.1.2","0.000002000","52461  >  12001 [ACK] Seq=7044 Ack=19411 Win=64280 Len=1460","1514","0.000000000","10.22.1.2","0.000002000","TCP"
"379","1470316209.721504","2.888676000","0.000005000","0.000005000","10.1.1.2","0.000005000","52461  >  12001 [PSH, ACK] Seq=8504 Ack=19411 Win=64280 Len=162","216","0.000000000","10.22.1.2","0.000005000","TCP"
"404","1470316209.744131","2.911303000","0.006358000","0.005329000","10.1.1.2","0.006358000","52461  >  12001 [ACK] Seq=8666 Ack=19411 Win=64280 Len=1460","1514","0.000000000","10.22.1.2","0.005329000","TCP"
"405","1470316209.744135","2.911307000","0.000004000","0.000004000","10.1.1.2","0.000004000","52461  >  12001 [ACK] Seq=10126 Ack=19411 Win=64280 Len=1460","1514","0.000000000","10.22.1.2","0.000004000","TCP"
"406","1470316209.744137","2.911309000","0.000002000","0.000002000","10.1.1.2","0.000002000","52461  >  12001 [ACK] Seq=11586 Ack=19411 Win=64280 Len=1460","1514","0.000000000","10.22.1.2","0.000002000","TCP"
"407","1470316209.744139","2.911311000","0.000002000","0.000002000","10.1.1.2","0.000002000","52461  >  12001 [ACK] Seq=13046 Ack=19411 Win=64280 Len=1460","1514","0.000000000","10.22.1.2","0.000002000","TCP"
"409","1470316209.758769","2.925941000","0.014597000","0.014597000","10.1.1.2","0.014597000","52461  >  12001 [ACK] Seq=14506 Ack=19411 Win=64280 Len=1460","1514","0.000000000","10.22.1.2","0.014597000","TCP"
"410","1470316209.760104","2.927276000","0.001335000","0.001335000","10.1.1.2","0.001335000","52461  >  12001 [ACK] Seq=15966 Ack=19411 Win=64280 Len=1460","1514","0.000000000","10.22.1.2","0.001335000","TCP"
"411","1470316209.760107","2.927279000","0.000003000","0.000003000","10.1.1.2","0.000003000","52461  >  12001 [ACK] Seq=17426 Ack=19411 Win=64280 Len=1460","1514","0.000000000","10.22.1.2","0.000003000","TCP"
"412","1470316209.760108","2.927280000","0.000001000","0.000001000","10.1.1.2","0.000001000","52461  >  12001 [ACK] Seq=18886 Ack=22065 Win=65700 Len=0","60","0.000000000","10.22.1.2","0.000001000","TCP"
"413","1470316209.760109","2.927281000","0.000001000","0.000001000","10.1.1.2","0.000001000","52461  >  12001 [ACK] Seq=18886 Ack=24007 Win=65700 Len=0","60","0.000000000","10.22.1.2","0.000001000","TCP"
"414","1470316209.760109","2.927281000","0.000000000","0.000000000","10.1.1.2","0.000000000","52461  >  12001 [ACK] Seq=18886 Ack=28124 Win=65700 Len=0","60","0.000000000","10.22.1.2","0.000000000","TCP"
"417","1470316209.761433","2.928605000","0.001149000","0.001149000","10.1.1.2","0.001149000","52461  >  12001 [ACK] Seq=18886 Ack=29713 Win=65700 Len=1460","1514","0.000000000","10.22.1.2","0.001149000","TCP"
"418","1470316209.761435","2.928607000","0.000002000","0.000002000","10.1.1.2","0.000002000","52461  >  12001 [ACK] Seq=20346 Ack=29713 Win=65700 Len=1460","1514","0.000000000","10.22.1.2","0.000002000","TCP"
"419","1470316209.761437","2.928609000","0.000002000","0.000002000","10.1.1.2","0.000002000","52461  >  12001 [PSH, ACK] Seq=21806 Ack=29713 Win=65700 Len=1208","1262","0.000000000","10.22.1.2","0.000002000","TCP"
"421","1470316209.765427","2.932599000","0.003963000","0.003963000","10.1.1.2","0.003963000","52461  >  12001 [ACK] Seq=23014 Ack=32633 Win=65700 Len=0","60","0.000000000","10.22.1.2","0.003963000","TCP"
"422","1470316209.765428","2.932600000","0.000001000","0.000001000","10.1.1.2","0.000001000","52461  >  12001 [ACK] Seq=23014 Ack=35553 Win=65700 Len=0","60","0.000000000","10.22.1.2","0.000001000","TCP"
"423","1470316209.776075","2.943247000","0.010647000","0.010647000","10.1.1.2","0.010647000","52461  >  12001 [ACK] Seq=23014 Ack=39933 Win=64240 Len=0","60","0.000000000","10.22.1.2","0.010647000","TCP"
"424","1470316209.776076","2.943248000","0.000001000","0.000001000","10.1.1.2","0.000001000","52461  >  12001 [ACK] Seq=23014 Ack=40199 Win=65700 Len=0","60","0.000000000","10.22.1.2","0.000001000","TCP"
"425","1470316209.797373","2.964545000","0.021297000","0.021297000","10.1.1.2","0.021297000","52461  >  12001 [PSH, ACK] Seq=23014 Ack=40199 Win=65700 Len=710","764","0.000000000","10.22.1.2","0.021297000","TCP"
"428","1470316209.826659","2.993831000","0.029286000","0.026593000","10.1.1.2","0.029286000","52461  >  12001 [ACK] Seq=23724 Ack=40199 Win=65700 Len=1460","1514","0.000000000","10.22.1.2","0.026593000","TCP"
"431","1470316209.830653","2.997825000","0.003970000","0.002397000","10.1.1.2","0.003970000","52461  >  12001 [ACK] Seq=25184 Ack=40199 Win=65700 Len=1460","1514","0.000000000","10.22.1.2","0.002397000","TCP"
"432","1470316209.830656","2.997828000","0.000003000","0.000003000","10.1.1.2","0.000003000","52461  >  12001 [PSH, ACK] Seq=26644 Ack=40199 Win=65700 Len=247","301","0.000000000","10.22.1.2","0.000003000","TCP"
"434","1470316209.831984","2.999156000","0.003728000","0.001304000","10.1.1.2","0.003728000","52462  >  12002 [ACK] Seq=1015 Ack=9843 Win=65700 Len=0","60","0.000000000","10.22.1.2","0.001304000","TCP"
"436","1470316209.853282","3.020454000","0.022602000","0.008319000","10.1.1.2","0.022602000","52461  >  12001 [PSH, ACK] Seq=26891 Ack=40199 Win=65700 Len=1063","1117","0.000000000","10.22.1.2","0.008319000","TCP"
"438","1470316209.890558","3.057730000","0.037276000","0.030596000","10.1.1.2","0.037276000","52461  >  12001 [ACK] Seq=27954 Ack=40199 Win=65700 Len=1460","1514","0.000000000","10.22.1.2","0.030596000","TCP"
"439","1470316209.890560","3.057732000","0.000002000","0.000002000","10.1.1.2","0.000002000","52461  >  12001 [PSH, ACK] Seq=29414 Ack=40199 Win=65700 Len=680","734","0.000000000","10.22.1.2","0.000002000","TCP"
"444","1470316209.899872","3.691365000","0.241356000","0.002628000","10.1.1.2","0.241356000","52460  >  12003 [ACK] Seq=26136 Ack=27140 Win=65104 Len=0","60","0.000000000","10.22.1.2","0.002628000","TCP"
"445","1470316209.914517","3.081689000","0.023927000","0.014645000","10.1.1.2","0.023927000","52461  >  12001 [PSH, ACK] Seq=30094 Ack=40199 Win=65700 Len=604","658","0.000000000","10.22.1.2","0.014645000","TCP"
"467","1470316209.947797","3.114969000","0.004121000","0.003949000","10.1.1.2","0.004121000","52461  >  12001 [PSH, ACK] Seq=30698 Ack=49103 Win=65316 Len=442","496","0.000000000","10.22.1.2","0.003949000","TCP"
"469","1470316209.955784","3.122956000","0.007786000","0.007786000","10.1.1.2","0.007786000","52461  >  12001 [ACK] Seq=31140 Ack=52023 Win=65700 Len=0","60","0.000000000","10.22.1.2","0.007786000","TCP"
"470","1470316209.955786","3.122958000","0.000002000","0.000002000","10.1.1.2","0.000002000","52461  >  12001 [ACK] Seq=31140 Ack=56403 Win=65700 Len=0","60","0.000000000","10.22.1.2","0.000002000","TCP"
"471","1470316209.994390","3.161562000","0.038604000","0.038604000","10.1.1.2","0.038604000","52461  >  12001 [ACK] Seq=31140 Ack=57661 Win=64440 Len=1460","1514","0.000000000","10.22.1.2","0.038604000","TCP"
"472","1470316209.994392","3.161564000","0.000002000","0.000002000","10.1.1.2","0.000002000","52461  >  12001 [PSH, ACK] Seq=32600 Ack=57661 Win=64440 Len=957","1011","0.000000000","10.22.1.2","0.000002000","TCP"
"476","1470316210.026336","3.193508000","0.031913000","0.021266000","10.1.1.2","0.031913000","52461  >  12001 [PSH, ACK] Seq=33557 Ack=57661 Win=64440 Len=657","711","0.000000000","10.22.1.2","0.021266000","TCP"
"478","1470316210.038316","3.205488000","0.005962000","0.005962000","10.1.1.2","0.005962000","52462  >  12002 [ACK] Seq=1015 Ack=11479 Win=65700 Len=0","60","0.000000000","10.22.1.2","0.005962000","TCP"
"484","1470316210.103547","3.270719000","0.077211000","0.005293000","10.1.1.2","0.077211000","52461  >  12001 [PSH, ACK] Seq=34214 Ack=57661 Win=64440 Len=1460","1514","0.000000000","10.22.1.2","0.005293000","TCP"
"485","1470316210.103549","3.270721000","0.000002000","0.000002000","10.1.1.2","0.000002000","52461  >  12001 [ACK] Seq=35674 Ack=57661 Win=64440 Len=1460","1514","0.000000000","10.22.1.2","0.000002000","TCP"
"486","1470316210.103551","3.270723000","0.000002000","0.000002000","10.1.1.2","0.000002000","52461  >  12001 [ACK] Seq=37134 Ack=57661 Win=64440 Len=1460","1514","0.000000000","10.22.1.2","0.000002000","TCP"
"487","1470316210.103553","3.270725000","0.000002000","0.000002000","10.1.1.2","0.000002000","52461  >  12001 [PSH, ACK] Seq=38594 Ack=57661 Win=64440 Len=17","71","0.000000000","10.22.1.2","0.000002000","TCP"
"489","1470316210.135495","3.302667000","0.031917000","0.031917000","10.1.1.2","0.031917000","52461  >  12001 [ACK] Seq=38611 Ack=57661 Win=64440 Len=1460","1514","0.000000000","10.22.1.2","0.031917000","TCP"
"490","1470316210.135500","3.302672000","0.000005000","0.000005000","10.1.1.2","0.000005000","52461  >  12001 [PSH, ACK] Seq=40071 Ack=57661 Win=64440 Len=74","128","0.000000000","10.22.1.2","0.000005000","TCP"
"504","1470316210.150160","3.317332000","0.014635000","0.000002000","10.1.1.2","0.014635000","52461  >  12001 [ACK] Seq=40145 Ack=57661 Win=64440 Len=1460","1514","0.000000000","10.22.1.2","0.000002000","TCP"
"509","1470316210.151474","3.318646000","0.001314000","0.000001000","10.1.1.2","0.001314000","52461  >  12001 [PSH, ACK] Seq=41605 Ack=57661 Win=64440 Len=985","1039","0.000000000","10.22.1.2","0.000001000","TCP"
"515","1470316210.160788","3.327960000","0.008334000","0.008334000","10.1.1.2","0.008334000","52461  >  12001 [ACK] Seq=42590 Ack=61591 Win=65700 Len=0","60","0.000000000","10.22.1.2","0.008334000","TCP"
"516","1470316210.160790","3.327962000","0.000002000","0.000002000","10.1.1.2","0.000002000","52461  >  12001 [ACK] Seq=42590 Ack=66583 Win=65700 Len=0","60","0.000000000","10.22.1.2","0.000002000","TCP"
"518","1470316210.163447","3.954940000","0.098799000","0.002572000","10.1.1.2","0.098799000","52460  >  12003 [PSH, ACK] Seq=26136 Ack=27261 Win=64984 Len=593","647","0.000000000","10.22.1.2","0.002572000","TCP"
"524","1470316210.175430","3.342602000","0.003048000","0.003048000","10.1.1.2","0.003048000","52461  >  12001 [ACK] Seq=42590 Ack=72572 Win=65700 Len=0","60","0.000000000","10.22.1.2","0.003048000","TCP"
"525","1470316210.175431","3.342603000","0.000001000","0.000001000","10.1.1.2","0.000001000","52461  >  12001 [ACK] Seq=42590 Ack=74895 Win=65700 Len=0","60","0.000000000","10.22.1.2","0.000001000","TCP"
"526","1470316210.195405","3.362577000","0.019974000","0.019974000","10.1.1.2","0.019974000","52461  >  12001 [PSH, ACK] Seq=42590 Ack=74895 Win=65700 Len=531","585","0.000000000","10.22.1.2","0.019974000","TCP"
"536","1470316210.223360","3.390532000","0.027955000","0.004817000","10.1.1.2","0.027955000","52461  >  12001 [ACK] Seq=43121 Ack=74895 Win=65700 Len=1460","1514","0.000000000","10.22.1.2","0.004817000","TCP"
"537","1470316210.223364","3.390536000","0.000004000","0.000004000","10.1.1.2","0.000004000","52461  >  12001 [ACK] Seq=44581 Ack=74895 Win=65700 Len=1460","1514","0.000000000","10.22.1.2","0.000004000","TCP"
"538","1470316210.223366","3.390538000","0.000002000","0.000002000","10.1.1.2","0.000002000","52461  >  12001 [ACK] Seq=46041 Ack=74895 Win=65700 Len=1460","1514","0.000000000","10.22.1.2","0.000002000","TCP"
"539","1470316210.223367","3.390539000","0.000001000","0.000001000","10.1.1.2","0.000001000","52461  >  12001 [ACK] Seq=47501 Ack=74895 Win=65700 Len=1460","1514","0.000000000","10.22.1.2","0.000001000","TCP"
"540","1470316210.223369","3.390541000","0.000002000","0.000002000","10.1.1.2","0.000002000","52461  >  12001 [ACK] Seq=48961 Ack=74895 Win=65700 Len=1460","1514","0.000000000","10.22.1.2","0.000002000","TCP"
"541","1470316210.223370","3.390542000","0.000001000","0.000001000","10.1.1.2","0.000001000","52461  >  12001 [ACK] Seq=50421 Ack=74895 Win=65700 Len=1460","1514","0.000000000","10.22.1.2","0.000001000","TCP"
"542","1470316210.223371","3.390543000","0.000001000","0.000001000","10.1.1.2","0.000001000","52461  >  12001 [ACK] Seq=51881 Ack=74895 Win=65700 Len=1460","1514","0.000000000","10.22.1.2","0.000001000","TCP"
"544","1470316210.224685","3.391857000","0.001266000","0.001266000","10.1.1.2","0.001266000","52461  >  12001 [ACK] Seq=53341 Ack=74895 Win=65700 Len=1460","1514","0.000000000","10.22.1.2","0.001266000","TCP"
"545","1470316210.224688","3.391860000","0.000003000","0.000003000","10.1.1.2","0.000003000","52461  >  12001 [ACK] Seq=54801 Ack=74895 Win=65700 Len=1460","1514","0.000000000","10.22.1.2","0.000003000","TCP"
"546","1470316210.224689","3.391861000","0.000001000","0.000001000","10.1.1.2","0.000001000","52461  >  12001 [PSH, ACK] Seq=56261 Ack=74895 Win=65700 Len=1245","1299","0.000000000","10.22.1.2","0.000001000","TCP"
"547","1470316210.224690","3.391862000","0.006147000","0.000001000","10.1.1.2","0.006147000","52462  >  12002 [ACK] Seq=1015 Ack=13187 Win=65700 Len=0","60","0.000000000","10.22.1.2","0.000001000","TCP"
"551","1470316210.264629","3.431801000","0.039694000","0.029682000","10.1.1.2","0.039694000","52461  >  12001 [ACK] Seq=57506 Ack=74895 Win=65700 Len=1460","1514","0.000000000","10.22.1.2","0.029682000","TCP"
"552","1470316210.264632","3.431804000","0.000003000","0.000003000","10.1.1.2","0.000003000","52461  >  12001 [PSH, ACK] Seq=58966 Ack=74895 Win=65700 Len=37","91","0.000000000","10.22.1.2","0.000003000","TCP"
"557","1470316210.285918","3.453090000","0.021233000","0.007953000","10.1.1.2","0.021233000","52461  >  12001 [PSH, ACK] Seq=59003 Ack=74895 Win=65700 Len=526","580","0.000000000","10.22.1.2","0.007953000","TCP"
