"No.","Time","Time since first frame in this TCP stream","segment delta","Destination","Source","Time shift for this packet","Info","Delta Time (conv)","Length","Protocol","Time delta from previous captured frame","Time delta from previous captured frame"
"1","0.000000","0.000000000","0.000000000","174.143.213.184","192.168.1.2","0.000000000","54841  >  80 [SYN] Seq=0 Win=5840 Len=0 MSS=1460 SACK_PERM=1 TSval=863195 TSecr=0 WS=128","","74","TCP","0.000000000","0.000000000"
"2","0.046770","0.046770000","0.046770000","192.168.1.2","174.143.213.184","0.000000000","80  >  54841 [SYN, ACK] Seq=0 Ack=1 Win=5792 Len=0 MSS=1460 SACK_PERM=1 TSval=315395185 TSecr=863195 WS=64","","74","TCP","0.046770000","0.046770000"
"3","0.046803","0.046803000","0.000033000","174.143.213.184","192.168.1.2","0.000000000","54841  >  80 [ACK] Seq=1 Ack=1 Win=5888 Len=0 TSval=863200 TSecr=315395185","","66","TCP","0.000033000","0.000033000"
"4","0.046841","0.046841000","0.000038000","174.143.213.184","192.168.1.2","0.000000000","GET /images/layout/logo.png HTTP/1.1 ","","791","HTTP","0.000038000","0.000038000"
"5","0.097200","0.097200000","0.050359000","192.168.1.2","174.143.213.184","0.000000000","80  >  54841 [ACK] Seq=1 Ack=726 Win=7296 Len=0 TSval=315395197 TSecr=863200","","66","TCP","0.050359000","0.050359000"
"6","0.099641","0.099641000","0.002441000","192.168.1.2","174.143.213.184","0.000000000","[TCP segment of a reassembled PDU]","","1514","TCP","0.002441000","0.002441000"
"7","0.099652","0.099652000","0.000011000","174.143.213.184","192.168.1.2","0.000000000","54841  >  80 [ACK] Seq=726 Ack=1449 Win=8832 Len=0 TSval=863205 TSecr=315395197","","66","TCP","0.000011000","0.000011000"
"8","0.099766","0.099766000","0.000114000","192.168.1.2","174.143.213.184","0.000000000","80  >  54841 [ACK] Seq=1449 Ack=726 Win=7296 Len=1448 TSval=315395197 TSecr=863200","","1514","TCP","0.000114000","0.000114000"
"9","0.099776","0.099776000","0.000010000","174.143.213.184","192.168.1.2","0.000000000","54841  >  80 [ACK] Seq=726 Ack=2897 Win=11648 Len=0 TSval=863205 TSecr=315395197","","66","TCP","0.000010000","0.000010000"
"10","0.099889","0.099889000","0.000113000","192.168.1.2","174.143.213.184","0.000000000","80  >  54841 [ACK] Seq=2897 Ack=726 Win=7296 Len=1448 TSval=315395197 TSecr=863200","","1514","TCP","0.000113000","0.000113000"
"11","0.099898","0.099898000","0.000009000","174.143.213.184","192.168.1.2","0.000000000","54841  >  80 [ACK] Seq=726 Ack=4345 Win=14592 Len=0 TSval=863205 TSecr=315395197","","66","TCP","0.000009000","0.000009000"
"12","0.149882","0.149882000","0.049984000","192.168.1.2","174.143.213.184","0.000000000","80  >  54841 [ACK] Seq=4345 Ack=726 Win=7296 Len=1448 TSval=315395210 TSecr=863205","","1514","TCP","0.049984000","0.049984000"
"13","0.149916","0.149916000","0.000034000","174.143.213.184","192.168.1.2","0.000000000","54841  >  80 [ACK] Seq=726 Ack=5793 Win=17536 Len=0 TSval=863210 TSecr=315395210","","66","TCP","0.000034000","0.000034000"
"14","0.151992","0.151992000","0.002076000","192.168.1.2","174.143.213.184","0.000000000","80  >  54841 [ACK] Seq=5793 Ack=726 Win=7296 Len=1448 TSval=315395210 TSecr=863205","","1514","TCP","0.002076000","0.002076000"
"15","0.152003","0.152003000","0.000011000","174.143.213.184","192.168.1.2","0.000000000","54841  >  80 [ACK] Seq=726 Ack=7241 Win=20352 Len=0 TSval=863210 TSecr=315395210","","66","TCP","0.000011000","0.000011000"
"16","0.152114","0.152114000","0.000111000","192.168.1.2","174.143.213.184","0.000000000","80  >  54841 [ACK] Seq=7241 Ack=726 Win=7296 Len=1448 TSval=315395210 TSecr=863205","","1514","TCP","0.000111000","0.000111000"
"17","0.152123","0.152123000","0.000009000","174.143.213.184","192.168.1.2","0.000000000","54841  >  80 [ACK] Seq=726 Ack=8689 Win=23296 Len=0 TSval=863210 TSecr=315395210","","66","TCP","0.000009000","0.000009000"
"18","0.152238","0.152238000","0.000115000","192.168.1.2","174.143.213.184","0.000000000","80  >  54841 [ACK] Seq=8689 Ack=726 Win=7296 Len=1448 TSval=315395210 TSecr=863205","","1514","TCP","0.000115000","0.000115000"
"19","0.152247","0.152247000","0.000009000","174.143.213.184","192.168.1.2","0.000000000","54841  >  80 [ACK] Seq=726 Ack=10137 Win=26112 Len=0 TSval=863210 TSecr=315395210","","66","TCP","0.000009000","0.000009000"
"20","0.152361","0.152361000","0.000114000","192.168.1.2","174.143.213.184","0.000000000","80  >  54841 [ACK] Seq=10137 Ack=726 Win=7296 Len=1448 TSval=315395210 TSecr=863205","","1514","TCP","0.000114000","0.000114000"
"21","0.152369","0.152369000","0.000008000","174.143.213.184","192.168.1.2","0.000000000","54841  >  80 [ACK] Seq=726 Ack=11585 Win=29056 Len=0 TSval=863210 TSecr=315395210","","66","TCP","0.000008000","0.000008000"
"22","0.152734","0.152734000","0.000365000","192.168.1.2","174.143.213.184","0.000000000","80  >  54841 [ACK] Seq=11585 Ack=726 Win=7296 Len=1448 TSval=315395210 TSecr=863205","","1514","TCP","0.000365000","0.000365000"
"23","0.152742","0.152742000","0.000008000","174.143.213.184","192.168.1.2","0.000000000","54841  >  80 [ACK] Seq=726 Ack=13033 Win=32000 Len=0 TSval=863210 TSecr=315395210","","66","TCP","0.000008000","0.000008000"
"24","0.199592","0.199592000","0.046850000","192.168.1.2","174.143.213.184","0.000000000","80  >  54841 [ACK] Seq=13033 Ack=726 Win=7296 Len=1448 TSval=315395223 TSecr=863210","","1514","TCP","0.046850000","0.046850000"
"25","0.199620","0.199620000","0.000028000","174.143.213.184","192.168.1.2","0.000000000","54841  >  80 [ACK] Seq=726 Ack=14481 Win=34816 Len=0 TSval=863215 TSecr=315395223","","66","TCP","0.000028000","0.000028000"
"26","0.201724","0.201724000","0.002104000","192.168.1.2","174.143.213.184","0.000000000","80  >  54841 [PSH, ACK] Seq=14481 Ack=726 Win=7296 Len=1448 TSval=315395223 TSecr=863210","","1514","TCP","0.002104000","0.002104000"
"27","0.201735","0.201735000","0.000011000","174.143.213.184","192.168.1.2","0.000000000","54841  >  80 [ACK] Seq=726 Ack=15929 Win=37760 Len=0 TSval=863215 TSecr=315395223","","66","TCP","0.000011000","0.000011000"
"28","0.204571","0.204571000","0.002836000","192.168.1.2","174.143.213.184","0.000000000","80  >  54841 [ACK] Seq=15929 Ack=726 Win=7296 Len=1448 TSval=315395223 TSecr=863210","","1514","TCP","0.002836000","0.002836000"
"29","0.204580","0.204580000","0.000009000","174.143.213.184","192.168.1.2","0.000000000","54841  >  80 [ACK] Seq=726 Ack=17377 Win=40704 Len=0 TSval=863215 TSecr=315395223","","66","TCP","0.000009000","0.000009000"
"30","0.204694","0.204694000","0.000114000","192.168.1.2","174.143.213.184","0.000000000","80  >  54841 [ACK] Seq=17377 Ack=726 Win=7296 Len=1448 TSval=315395223 TSecr=863210","","1514","TCP","0.000114000","0.000114000"
"31","0.204702","0.204702000","0.000008000","174.143.213.184","192.168.1.2","0.000000000","54841  >  80 [ACK] Seq=726 Ack=18825 Win=43520 Len=0 TSval=863215 TSecr=315395223","","66","TCP","0.000008000","0.000008000"
"32","0.204817","0.204817000","0.000115000","192.168.1.2","174.143.213.184","0.000000000","80  >  54841 [ACK] Seq=18825 Ack=726 Win=7296 Len=1448 TSval=315395223 TSecr=863210","","1514","TCP","0.000115000","0.000115000"
"33","0.204825","0.204825000","0.000008000","174.143.213.184","192.168.1.2","0.000000000","54841  >  80 [ACK] Seq=726 Ack=20273 Win=46464 Len=0 TSval=863215 TSecr=315395223","","66","TCP","0.000008000","0.000008000"
"34","0.204940","0.204940000","0.000115000","192.168.1.2","174.143.213.184","0.000000000","80  >  54841 [ACK] Seq=20273 Ack=726 Win=7296 Len=1448 TSval=315395223 TSecr=863210","","1514","TCP","0.000115000","0.000115000"
"35","0.204948","0.204948000","0.000008000","174.143.213.184","192.168.1.2","0.000000000","54841  >  80 [ACK] Seq=726 Ack=21721 Win=49280 Len=0 TSval=863216 TSecr=315395223","","66","TCP","0.000008000","0.000008000"
"36","0.205044","0.205044000","0.000096000","192.168.1.2","174.143.213.184","0.000000000","80  >  54841 [PSH, ACK] Seq=21721 Ack=726 Win=7296 Len=1230 TSval=315395223 TSecr=863210","","1296","TCP","0.000096000","0.000096000"
"37","0.205052","0.205052000","0.000008000","174.143.213.184","192.168.1.2","0.000000000","54841  >  80 [ACK] Seq=726 Ack=22951 Win=52224 Len=0 TSval=863216 TSecr=315395223","","66","TCP","0.000008000","0.000008000"
"38","5.486747","5.486747000","5.281695000","174.143.213.184","192.168.1.2","0.000000000","54841  >  80 [FIN, ACK] Seq=726 Ack=22951 Win=52224 Len=0 TSval=863744 TSecr=315395223","","66","TCP","5.281695000","5.281695000"
"39","5.538632","5.538632000","0.051885000","192.168.1.2","174.143.213.184","0.000000000","80  >  54841 [FIN, ACK] Seq=22951 Ack=727 Win=7296 Len=0 TSval=315396558 TSecr=863744","","66","TCP","0.051885000","0.051885000"
"40","5.538674","5.538674000","0.000042000","174.143.213.184","192.168.1.2","0.000000000","54841  >  80 [ACK] Seq=727 Ack=22952 Win=52224 Len=0 TSval=863749 TSecr=315396558","","66","TCP","0.000042000","0.000042000"
