"No.","Time","Time delta from previous captured frame","Source","Protocol","Length","Destination","Info"
"1","0.000000","0.000000000","192.168.1.2","TCP","74","174.143.213.184","54841  >  80 [SYN] Seq=0 Win=5840 Len=0 MSS=1460 SACK_PERM=1 TSval=863195 TSecr=0 WS=128"
"2","0.046770","0.046770000","174.143.213.184","TCP","74","192.168.1.2","80  >  54841 [SYN, ACK] Seq=0 Ack=1 Win=5792 Len=0 MSS=1460 SACK_PERM=1 TSval=315395185 TSecr=863195 WS=64"
"3","0.046803","0.000033000","192.168.1.2","TCP","66","174.143.213.184","54841  >  80 [ACK] Seq=1 Ack=1 Win=5888 Len=0 TSval=863200 TSecr=315395185"
"4","0.046841","0.000038000","192.168.1.2","HTTP","791","174.143.213.184","GET /images/layout/logo.png HTTP/1.1 "
"5","0.097200","0.050359000","174.143.213.184","TCP","66","192.168.1.2","80  >  54841 [ACK] Seq=1 Ack=726 Win=7296 Len=0 TSval=315395197 TSecr=863200"
"6","0.099641","0.002441000","174.143.213.184","TCP","1514","192.168.1.2","[TCP segment of a reassembled PDU]"
"7","0.099652","0.000011000","192.168.1.2","TCP","66","174.143.213.184","54841  >  80 [ACK] Seq=726 Ack=1449 Win=8832 Len=0 TSval=863205 TSecr=315395197"
"8","0.099766","0.000114000","174.143.213.184","TCP","1514","192.168.1.2","80  >  54841 [ACK] Seq=1449 Ack=726 Win=7296 Len=1448 TSval=315395197 TSecr=863200"
"9","0.099776","0.000010000","192.168.1.2","TCP","66","174.143.213.184","54841  >  80 [ACK] Seq=726 Ack=2897 Win=11648 Len=0 TSval=863205 TSecr=315395197"
"10","0.099889","0.000113000","174.143.213.184","TCP","1514","192.168.1.2","80  >  54841 [ACK] Seq=2897 Ack=726 Win=7296 Len=1448 TSval=315395197 TSecr=863200"
"11","0.099898","0.000009000","192.168.1.2","TCP","66","174.143.213.184","54841  >  80 [ACK] Seq=726 Ack=4345 Win=14592 Len=0 TSval=863205 TSecr=315395197"
"12","0.149882","0.049984000","174.143.213.184","TCP","1514","192.168.1.2","80  >  54841 [ACK] Seq=4345 Ack=726 Win=7296 Len=1448 TSval=315395210 TSecr=863205"
"13","0.149916","0.000034000","192.168.1.2","TCP","66","174.143.213.184","54841  >  80 [ACK] Seq=726 Ack=5793 Win=17536 Len=0 TSval=863210 TSecr=315395210"
"14","0.151992","0.002076000","174.143.213.184","TCP","1514","192.168.1.2","80  >  54841 [ACK] Seq=5793 Ack=726 Win=7296 Len=1448 TSval=315395210 TSecr=863205"
"15","0.152003","0.000011000","192.168.1.2","TCP","66","174.143.213.184","54841  >  80 [ACK] Seq=726 Ack=7241 Win=20352 Len=0 TSval=863210 TSecr=315395210"
"16","0.152114","0.000111000","174.143.213.184","TCP","1514","192.168.1.2","80  >  54841 [ACK] Seq=7241 Ack=726 Win=7296 Len=1448 TSval=315395210 TSecr=863205"
"17","0.152123","0.000009000","192.168.1.2","TCP","66","174.143.213.184","54841  >  80 [ACK] Seq=726 Ack=8689 Win=23296 Len=0 TSval=863210 TSecr=315395210"
"18","0.152238","0.000115000","174.143.213.184","TCP","1514","192.168.1.2","80  >  54841 [ACK] Seq=8689 Ack=726 Win=7296 Len=1448 TSval=315395210 TSecr=863205"
"19","0.152247","0.000009000","192.168.1.2","TCP","66","174.143.213.184","54841  >  80 [ACK] Seq=726 Ack=10137 Win=26112 Len=0 TSval=863210 TSecr=315395210"
"20","0.152361","0.000114000","174.143.213.184","TCP","1514","192.168.1.2","80  >  54841 [ACK] Seq=10137 Ack=726 Win=7296 Len=1448 TSval=315395210 TSecr=863205"
"21","0.152369","0.000008000","192.168.1.2","TCP","66","174.143.213.184","54841  >  80 [ACK] Seq=726 Ack=11585 Win=29056 Len=0 TSval=863210 TSecr=315395210"
"22","0.152734","0.000365000","174.143.213.184","TCP","1514","192.168.1.2","80  >  54841 [ACK] Seq=11585 Ack=726 Win=7296 Len=1448 TSval=315395210 TSecr=863205"
"23","0.152742","0.000008000","192.168.1.2","TCP","66","174.143.213.184","54841  >  80 [ACK] Seq=726 Ack=13033 Win=32000 Len=0 TSval=863210 TSecr=315395210"
"24","0.199592","0.046850000","174.143.213.184","TCP","1514","192.168.1.2","80  >  54841 [ACK] Seq=13033 Ack=726 Win=7296 Len=1448 TSval=315395223 TSecr=863210"
"25","0.199620","0.000028000","192.168.1.2","TCP","66","174.143.213.184","54841  >  80 [ACK] Seq=726 Ack=14481 Win=34816 Len=0 TSval=863215 TSecr=315395223"
"26","0.201724","0.002104000","174.143.213.184","TCP","1514","192.168.1.2","80  >  54841 [PSH, ACK] Seq=14481 Ack=726 Win=7296 Len=1448 TSval=315395223 TSecr=863210"
"27","0.201735","0.000011000","192.168.1.2","TCP","66","174.143.213.184","54841  >  80 [ACK] Seq=726 Ack=15929 Win=37760 Len=0 TSval=863215 TSecr=315395223"
"28","0.204571","0.002836000","174.143.213.184","TCP","1514","192.168.1.2","80  >  54841 [ACK] Seq=15929 Ack=726 Win=7296 Len=1448 TSval=315395223 TSecr=863210"
"29","0.204580","0.000009000","192.168.1.2","TCP","66","174.143.213.184","54841  >  80 [ACK] Seq=726 Ack=17377 Win=40704 Len=0 TSval=863215 TSecr=315395223"
"30","0.204694","0.000114000","174.143.213.184","TCP","1514","192.168.1.2","80  >  54841 [ACK] Seq=17377 Ack=726 Win=7296 Len=1448 TSval=315395223 TSecr=863210"
"31","0.204702","0.000008000","192.168.1.2","TCP","66","174.143.213.184","54841  >  80 [ACK] Seq=726 Ack=18825 Win=43520 Len=0 TSval=863215 TSecr=315395223"
"32","0.204817","0.000115000","174.143.213.184","TCP","1514","192.168.1.2","80  >  54841 [ACK] Seq=18825 Ack=726 Win=7296 Len=1448 TSval=315395223 TSecr=863210"
"33","0.204825","0.000008000","192.168.1.2","TCP","66","174.143.213.184","54841  >  80 [ACK] Seq=726 Ack=20273 Win=46464 Len=0 TSval=863215 TSecr=315395223"
"34","0.204940","0.000115000","174.143.213.184","TCP","1514","192.168.1.2","80  >  54841 [ACK] Seq=20273 Ack=726 Win=7296 Len=1448 TSval=315395223 TSecr=863210"
"35","0.204948","0.000008000","192.168.1.2","TCP","66","174.143.213.184","54841  >  80 [ACK] Seq=726 Ack=21721 Win=49280 Len=0 TSval=863216 TSecr=315395223"
"36","0.205044","0.000096000","174.143.213.184","TCP","1296","192.168.1.2","80  >  54841 [PSH, ACK] Seq=21721 Ack=726 Win=7296 Len=1230 TSval=315395223 TSecr=863210"
"37","0.205052","0.000008000","192.168.1.2","TCP","66","174.143.213.184","54841  >  80 [ACK] Seq=726 Ack=22951 Win=52224 Len=0 TSval=863216 TSecr=315395223"
"38","5.486747","5.281695000","192.168.1.2","TCP","66","174.143.213.184","54841  >  80 [FIN, ACK] Seq=726 Ack=22951 Win=52224 Len=0 TSval=863744 TSecr=315395223"
"39","5.538632","0.051885000","174.143.213.184","TCP","66","192.168.1.2","80  >  54841 [FIN, ACK] Seq=22951 Ack=727 Win=7296 Len=0 TSval=315396558 TSecr=863744"
"40","5.538674","0.000042000","192.168.1.2","TCP","66","174.143.213.184","54841  >  80 [ACK] Seq=727 Ack=22952 Win=52224 Len=0 TSval=863749 TSecr=315396558"
