"No.","Time","Source","Destination","Protocol","Length","Info"
"92","21.616295673","127.0.0.1","127.0.1.1","TCP","76","33342  >  44571 [SYN] Seq=0 Win=43690 Len=0 MSS=65495 SACK_PERM=1 TSval=43930 TSecr=0 WS=128"
"93","21.616346281","127.0.1.1","127.0.0.1","TCP","76","44571  >  33342 [SYN, ACK] Seq=0 Ack=1 Win=43690 Len=0 MSS=65495 SACK_PERM=1 TSval=43930 TSecr=43930 WS=128"
"94","21.616377717","127.0.0.1","127.0.1.1","TCP","68","33342  >  44571 [ACK] Seq=1 Ack=1 Win=43776 Len=0 TSval=43930 TSecr=43930"
"95","21.617013525","127.0.1.1","127.0.0.1","TCP","114","44571  >  33342 [PSH, ACK] Seq=1 Ack=1 Win=43776 Len=46 TSval=43930 TSecr=43930"
"96","21.617042467","127.0.0.1","127.0.1.1","TCP","68","33342  >  44571 [ACK] Seq=1 Ack=47 Win=43776 Len=0 TSval=43930 TSecr=43930"
"97","21.617087674","127.0.1.1","127.0.0.1","TCP","68","44571  >  33342 [FIN, ACK] Seq=47 Ack=1 Win=43776 Len=0 TSval=43930 TSecr=43930"
"98","21.623726769","127.0.0.1","127.0.1.1","TCP","68","33342  >  44571 [FIN, ACK] Seq=1 Ack=48 Win=43776 Len=0 TSval=43932 TSecr=43930"
"99","21.623762062","127.0.1.1","127.0.0.1","TCP","68","44571  >  33342 [ACK] Seq=48 Ack=2 Win=43776 Len=0 TSval=43932 TSecr=43932"
"134","38.033792197","10.210.73.137","10.210.73.137","TCP","76","43158  >  44571 [SYN] Seq=0 Win=43690 Len=0 MSS=65495 SACK_PERM=1 TSval=48034 TSecr=0 WS=128"
"135","38.033824300","10.210.73.137","10.210.73.137","TCP","76","44571  >  43158 [SYN, ACK] Seq=0 Ack=1 Win=43690 Len=0 MSS=65495 SACK_PERM=1 TSval=48034 TSecr=48034 WS=128"
"136","38.033850259","10.210.73.137","10.210.73.137","TCP","68","43158  >  44571 [ACK] Seq=1 Ack=1 Win=43776 Len=0 TSval=48034 TSecr=48034"
"137","38.034309026","10.210.73.137","10.210.73.137","TCP","168","44571  >  43158 [PSH, ACK] Seq=1 Ack=1 Win=43776 Len=100 TSval=48035 TSecr=48034"
"138","38.034328145","10.210.73.137","10.210.73.137","TCP","68","43158  >  44571 [ACK] Seq=1 Ack=101 Win=43776 Len=0 TSval=48035 TSecr=48035"
"139","38.034368066","10.210.73.137","10.210.73.137","TCP","68","44571  >  43158 [FIN, ACK] Seq=101 Ack=1 Win=43776 Len=0 TSval=48035 TSecr=48035"
"140","38.039295905","10.210.73.137","10.210.73.137","TCP","68","43158  >  44571 [FIN, ACK] Seq=1 Ack=102 Win=43776 Len=0 TSval=48036 TSecr=48035"
"141","38.039327572","10.210.73.137","10.210.73.137","TCP","68","44571  >  43158 [ACK] Seq=102 Ack=2 Win=43776 Len=0 TSval=48036 TSecr=48036"
"148","40.413151445","10.210.73.137","10.210.73.137","TCP","76","43160  >  44571 [SYN] Seq=0 Win=43690 Len=0 MSS=65495 SACK_PERM=1 TSval=48629 TSecr=0 WS=128"
"149","40.413197926","10.210.73.137","10.210.73.137","TCP","76","44571  >  43160 [SYN, ACK] Seq=0 Ack=1 Win=43690 Len=0 MSS=65495 SACK_PERM=1 TSval=48629 TSecr=48629 WS=128"
"150","40.413230710","10.210.73.137","10.210.73.137","TCP","68","43160  >  44571 [ACK] Seq=1 Ack=1 Win=43776 Len=0 TSval=48629 TSecr=48629"
"151","40.415269790","10.210.73.137","10.210.73.137","TCP","188","44571  >  43160 [PSH, ACK] Seq=1 Ack=1 Win=43776 Len=120 TSval=48630 TSecr=48629"
"152","40.415299351","10.210.73.137","10.210.73.137","TCP","68","43160  >  44571 [ACK] Seq=1 Ack=121 Win=43776 Len=0 TSval=48630 TSecr=48630"
"153","40.415341085","10.210.73.137","10.210.73.137","TCP","68","44571  >  43160 [FIN, ACK] Seq=121 Ack=1 Win=43776 Len=0 TSval=48630 TSecr=48630"
"154","40.419561146","10.210.73.137","10.210.73.137","TCP","68","43160  >  44571 [FIN, ACK] Seq=1 Ack=122 Win=43776 Len=0 TSval=48631 TSecr=48630"
"155","40.419588404","10.210.73.137","10.210.73.137","TCP","68","44571  >  43160 [ACK] Seq=122 Ack=2 Win=43776 Len=0 TSval=48631 TSecr=48631"
"167","42.373530226","10.210.73.137","10.210.73.137","TCP","76","43162  >  44571 [SYN] Seq=0 Win=43690 Len=0 MSS=65495 SACK_PERM=1 TSval=49119 TSecr=0 WS=128"
"168","42.373561432","10.210.73.137","10.210.73.137","TCP","76","44571  >  43162 [SYN, ACK] Seq=0 Ack=1 Win=43690 Len=0 MSS=65495 SACK_PERM=1 TSval=49119 TSecr=49119 WS=128"
"169","42.373589007","10.210.73.137","10.210.73.137","TCP","68","43162  >  44571 [ACK] Seq=1 Ack=1 Win=43776 Len=0 TSval=49119 TSecr=49119"
"170","42.374017063","10.210.73.137","10.210.73.137","TCP","144","44571  >  43162 [PSH, ACK] Seq=1 Ack=1 Win=43776 Len=76 TSval=49119 TSecr=49119"
"171","42.374032959","10.210.73.137","10.210.73.137","TCP","68","43162  >  44571 [ACK] Seq=1 Ack=77 Win=43776 Len=0 TSval=49119 TSecr=49119"
"172","42.374065727","10.210.73.137","10.210.73.137","TCP","68","44571  >  43162 [FIN, ACK] Seq=77 Ack=1 Win=43776 Len=0 TSval=49119 TSecr=49119"
"173","42.378819356","10.210.73.137","10.210.73.137","TCP","68","43162  >  44571 [FIN, ACK] Seq=1 Ack=78 Win=43776 Len=0 TSval=49121 TSecr=49119"
"174","42.378851830","10.210.73.137","10.210.73.137","TCP","68","44571  >  43162 [ACK] Seq=78 Ack=2 Win=43776 Len=0 TSval=49121 TSecr=49121"
"179","44.324980690","10.210.73.137","10.210.73.137","TCP","76","43164  >  44571 [SYN] Seq=0 Win=43690 Len=0 MSS=65495 SACK_PERM=1 TSval=49607 TSecr=0 WS=128"
"180","44.325009720","10.210.73.137","10.210.73.137","TCP","76","44571  >  43164 [SYN, ACK] Seq=0 Ack=1 Win=43690 Len=0 MSS=65495 SACK_PERM=1 TSval=49607 TSecr=49607 WS=128"
"181","44.325033298","10.210.73.137","10.210.73.137","TCP","68","43164  >  44571 [ACK] Seq=1 Ack=1 Win=43776 Len=0 TSval=49607 TSecr=49607"
"182","44.325472262","10.210.73.137","10.210.73.137","TCP","188","44571  >  43164 [PSH, ACK] Seq=1 Ack=1 Win=43776 Len=120 TSval=49607 TSecr=49607"
"183","44.325493755","10.210.73.137","10.210.73.137","TCP","68","43164  >  44571 [ACK] Seq=1 Ack=121 Win=43776 Len=0 TSval=49607 TSecr=49607"
"184","44.325534327","10.210.73.137","10.210.73.137","TCP","68","44571  >  43164 [FIN, ACK] Seq=121 Ack=1 Win=43776 Len=0 TSval=49607 TSecr=49607"
"185","44.331191818","10.210.73.137","10.210.73.137","TCP","68","43164  >  44571 [FIN, ACK] Seq=1 Ack=122 Win=43776 Len=0 TSval=49609 TSecr=49607"
"186","44.331224768","10.210.73.137","10.210.73.137","TCP","68","44571  >  43164 [ACK] Seq=122 Ack=2 Win=43776 Len=0 TSval=49609 TSecr=49609"
"187","44.487448207","10.210.73.137","10.210.73.137","TCP","76","43166  >  44571 [SYN] Seq=0 Win=43690 Len=0 MSS=65495 SACK_PERM=1 TSval=49648 TSecr=0 WS=128"
"188","44.487484409","10.210.73.137","10.210.73.137","TCP","76","44571  >  43166 [SYN, ACK] Seq=0 Ack=1 Win=43690 Len=0 MSS=65495 SACK_PERM=1 TSval=49648 TSecr=49648 WS=128"
"189","44.487516918","10.210.73.137","10.210.73.137","TCP","68","43166  >  44571 [ACK] Seq=1 Ack=1 Win=43776 Len=0 TSval=49648 TSecr=49648"
"190","44.487994541","10.210.73.137","10.210.73.137","TCP","188","44571  >  43166 [PSH, ACK] Seq=1 Ack=1 Win=43776 Len=120 TSval=49648 TSecr=49648"
"191","44.488015995","10.210.73.137","10.210.73.137","TCP","68","43166  >  44571 [ACK] Seq=1 Ack=121 Win=43776 Len=0 TSval=49648 TSecr=49648"
"192","44.488063117","10.210.73.137","10.210.73.137","TCP","68","44571  >  43166 [FIN, ACK] Seq=121 Ack=1 Win=43776 Len=0 TSval=49648 TSecr=49648"
"193","44.489717984","10.210.73.137","10.210.73.137","TCP","68","43166  >  44571 [FIN, ACK] Seq=1 Ack=122 Win=43776 Len=0 TSval=49648 TSecr=49648"
"194","44.489748067","10.210.73.137","10.210.73.137","TCP","68","44571  >  43166 [ACK] Seq=122 Ack=2 Win=43776 Len=0 TSval=49648 TSecr=49648"
"195","44.489913001","10.210.73.137","10.210.73.137","TCP","76","43168  >  44571 [SYN] Seq=0 Win=43690 Len=0 MSS=65495 SACK_PERM=1 TSval=49648 TSecr=0 WS=128"
"196","44.489932229","10.210.73.137","10.210.73.137","TCP","76","44571  >  43168 [SYN, ACK] Seq=0 Ack=1 Win=43690 Len=0 MSS=65495 SACK_PERM=1 TSval=49648 TSecr=49648 WS=128"
"197","44.489949829","10.210.73.137","10.210.73.137","TCP","68","43168  >  44571 [ACK] Seq=1 Ack=1 Win=43776 Len=0 TSval=49648 TSecr=49648"
"198","44.490543626","10.210.73.137","10.210.73.137","TCP","168","44571  >  43168 [PSH, ACK] Seq=1 Ack=1 Win=43776 Len=100 TSval=49649 TSecr=49648"
"199","44.490579487","10.210.73.137","10.210.73.137","TCP","68","43168  >  44571 [ACK] Seq=1 Ack=101 Win=43776 Len=0 TSval=49649 TSecr=49649"
"200","44.490630192","10.210.73.137","10.210.73.137","TCP","68","44571  >  43168 [FIN, ACK] Seq=101 Ack=1 Win=43776 Len=0 TSval=49649 TSecr=49649"
"201","44.493783000","10.210.73.137","10.210.73.137","TCP","68","43168  >  44571 [FIN, ACK] Seq=1 Ack=102 Win=43776 Len=0 TSval=49649 TSecr=49649"
"202","44.493805541","10.210.73.137","10.210.73.137","TCP","68","44571  >  43168 [ACK] Seq=102 Ack=2 Win=43776 Len=0 TSval=49649 TSecr=49649"
"203","44.837114713","10.210.73.137","10.210.73.137","TCP","76","43170  >  44571 [SYN] Seq=0 Win=43690 Len=0 MSS=65495 SACK_PERM=1 TSval=49735 TSecr=0 WS=128"
"204","44.837147111","10.210.73.137","10.210.73.137","TCP","76","44571  >  43170 [SYN, ACK] Seq=0 Ack=1 Win=43690 Len=0 MSS=65495 SACK_PERM=1 TSval=49735 TSecr=49735 WS=128"
"205","44.837176181","10.210.73.137","10.210.73.137","TCP","68","43170  >  44571 [ACK] Seq=1 Ack=1 Win=43776 Len=0 TSval=49735 TSecr=49735"
"206","44.837545919","10.210.73.137","10.210.73.137","TCP","188","44571  >  43170 [PSH, ACK] Seq=1 Ack=1 Win=43776 Len=120 TSval=49735 TSecr=49735"
"207","44.837565187","10.210.73.137","10.210.73.137","TCP","68","43170  >  44571 [ACK] Seq=1 Ack=121 Win=43776 Len=0 TSval=49735 TSecr=49735"
"208","44.837602135","10.210.73.137","10.210.73.137","TCP","68","44571  >  43170 [FIN, ACK] Seq=121 Ack=1 Win=43776 Len=0 TSval=49735 TSecr=49735"
"209","44.843300014","10.210.73.137","10.210.73.137","TCP","68","43170  >  44571 [FIN, ACK] Seq=1 Ack=122 Win=43776 Len=0 TSval=49737 TSecr=49735"
"210","44.843325849","10.210.73.137","10.210.73.137","TCP","68","44571  >  43170 [ACK] Seq=122 Ack=2 Win=43776 Len=0 TSval=49737 TSecr=49737"
"214","45.165011792","10.210.73.137","10.210.73.137","TCP","76","43172  >  44571 [SYN] Seq=0 Win=43690 Len=0 MSS=65495 SACK_PERM=1 TSval=49817 TSecr=0 WS=128"
"215","45.165047598","10.210.73.137","10.210.73.137","TCP","76","44571  >  43172 [SYN, ACK] Seq=0 Ack=1 Win=43690 Len=0 MSS=65495 SACK_PERM=1 TSval=49817 TSecr=49817 WS=128"
"216","45.165079631","10.210.73.137","10.210.73.137","TCP","68","43172  >  44571 [ACK] Seq=1 Ack=1 Win=43776 Len=0 TSval=49817 TSecr=49817"
"217","45.165896929","10.210.73.137","10.210.73.137","TCP","168","44571  >  43172 [PSH, ACK] Seq=1 Ack=1 Win=43776 Len=100 TSval=49817 TSecr=49817"
"218","45.165918217","10.210.73.137","10.210.73.137","TCP","68","43172  >  44571 [ACK] Seq=1 Ack=101 Win=43776 Len=0 TSval=49817 TSecr=49817"
"219","45.165953748","10.210.73.137","10.210.73.137","TCP","68","44571  >  43172 [FIN, ACK] Seq=101 Ack=1 Win=43776 Len=0 TSval=49817 TSecr=49817"
"220","45.170010982","10.210.73.137","10.210.73.137","TCP","68","43172  >  44571 [FIN, ACK] Seq=1 Ack=102 Win=43776 Len=0 TSval=49818 TSecr=49817"
"221","45.170042859","10.210.73.137","10.210.73.137","TCP","68","44571  >  43172 [ACK] Seq=102 Ack=2 Win=43776 Len=0 TSval=49818 TSecr=49818"
