"No.","Time","Time since first frame in this TCP stream","segment delta","Time delta from previous captured frame","Source","Destination","Delta Time (conv)","Info","Length","Time shift for this packet","Time delta from previous captured frame","Protocol"
"1","0.000000","0.000000000","0.000000000","0.000000000","10.202.1.2","10.1.1.2","0.000000000","51227  >  12001 [ACK] Seq=1 Ack=1 Win=16425 Len=1460","1514","0.000000000","0.000000000","TCP"
"2","0.000002","0.000002000","0.000002000","0.000002000","10.202.1.2","10.1.1.2","0.000002000","51227  >  12001 [PSH, ACK] Seq=1461 Ack=1 Win=16425 Len=1135","1189","0.000000000","0.000002000","TCP"
"4","0.001322","0.000000000","0.000000000","0.001255000","10.202.1.2","10.1.1.2","0.000000000","51228  >  12002 [PSH, ACK] Seq=1 Ack=1 Win=16120 Len=1460","1514","0.000000000","0.001255000","TCP"
"5","0.001324","0.000002000","0.000002000","0.000002000","10.202.1.2","10.1.1.2","0.000002000","51228  >  12002 [PSH, ACK] Seq=1461 Ack=1 Win=16120 Len=124","178","0.000000000","0.000002000","TCP"
"9","0.026612","0.025290000","0.025259000","0.001265000","10.202.1.2","10.1.1.2","0.025259000","51228  >  12002 [PSH, ACK] Seq=1585 Ack=1 Win=16120 Len=176","230","0.000000000","0.001265000","TCP"
"10","0.026613","0.026613000","0.026546000","0.000001000","10.202.1.2","10.1.1.2","0.026546000","51227  >  12001 [PSH, ACK] Seq=2596 Ack=1 Win=16425 Len=702","756","0.000000000","0.000001000","TCP"
"11","0.105159","0.105159000","0.078546000","0.078546000","10.202.1.2","10.1.1.2","0.078546000","51227  >  12001 [PSH, ACK] Seq=3298 Ack=1 Win=16425 Len=1460","1514","0.000000000","0.078546000","TCP"
"12","0.105164","0.105164000","0.000005000","0.000005000","10.202.1.2","10.1.1.2","0.000005000","51227  >  12001 [ACK] Seq=4758 Ack=1 Win=16425 Len=1460","1514","0.000000000","0.000005000","TCP"
"14","0.106486","0.106486000","0.001282000","0.001282000","10.202.1.2","10.1.1.2","0.001282000","51227  >  12001 [ACK] Seq=6218 Ack=1 Win=16425 Len=1460","1514","0.000000000","0.001282000","TCP"
"15","0.106489","0.106489000","0.000003000","0.000003000","10.202.1.2","10.1.1.2","0.000003000","51227  >  12001 [PSH, ACK] Seq=7678 Ack=1 Win=16425 Len=279","333","0.000000000","0.000003000","TCP"
"17","0.122460","0.122460000","0.015942000","0.015942000","10.202.1.2","10.1.1.2","0.015942000","51227  >  12001 [PSH, ACK] Seq=7957 Ack=1 Win=16425 Len=893","947","0.000000000","0.015942000","TCP"
"26","0.133111","0.133111000","0.003382000","0.003382000","10.202.1.2","10.1.1.2","0.003382000","51227  >  12001 [ACK] Seq=8850 Ack=1612 Win=16425 Len=0","60","0.000000000","0.003382000","TCP"
"27","0.134439","0.134439000","0.001328000","0.001328000","10.202.1.2","10.1.1.2","0.001328000","51227  >  12001 [ACK] Seq=8850 Ack=6229 Win=16425 Len=0","60","0.000000000","0.001328000","TCP"
"34","0.173044","0.173044000","0.038605000","0.008569000","10.202.1.2","10.1.1.2","0.038605000","51227  >  12001 [ACK] Seq=8850 Ack=6229 Win=16425 Len=1460","1514","0.000000000","0.008569000","TCP"
"35","0.173047","0.173047000","0.000003000","0.000003000","10.202.1.2","10.1.1.2","0.000003000","51227  >  12001 [ACK] Seq=10310 Ack=6229 Win=16425 Len=1460","1514","0.000000000","0.000003000","TCP"
"37","0.174379","0.174379000","0.001288000","0.001288000","10.202.1.2","10.1.1.2","0.001288000","51227  >  12001 [ACK] Seq=11770 Ack=6229 Win=16425 Len=1460","1514","0.000000000","0.001288000","TCP"
"38","0.174380","0.174380000","0.000001000","0.000001000","10.202.1.2","10.1.1.2","0.000001000","51227  >  12001 [ACK] Seq=13230 Ack=6229 Win=16425 Len=1460","1514","0.000000000","0.000001000","TCP"
"39","0.174382","0.174382000","0.000002000","0.000002000","10.202.1.2","10.1.1.2","0.000002000","51227  >  12001 [ACK] Seq=14690 Ack=6229 Win=16425 Len=1460","1514","0.000000000","0.000002000","TCP"
"41","0.175708","0.175708000","0.001310000","0.001310000","10.202.1.2","10.1.1.2","0.001310000","51227  >  12001 [ACK] Seq=16150 Ack=6229 Win=16425 Len=1460","1514","0.000000000","0.001310000","TCP"
"42","0.175709","0.175709000","0.000001000","0.000001000","10.202.1.2","10.1.1.2","0.000001000","51227  >  12001 [ACK] Seq=17610 Ack=6229 Win=16425 Len=1460","1514","0.000000000","0.000001000","TCP"
"43","0.175711","0.175711000","0.000002000","0.000002000","10.202.1.2","10.1.1.2","0.000002000","51227  >  12001 [ACK] Seq=19070 Ack=6229 Win=16425 Len=1460","1514","0.000000000","0.000002000","TCP"
"44","0.175713","0.175713000","0.000002000","0.000002000","10.202.1.2","10.1.1.2","0.000002000","51227  >  12001 [ACK] Seq=20530 Ack=6229 Win=16425 Len=1460","1514","0.000000000","0.000002000","TCP"
"45","0.175715","0.175715000","0.000002000","0.000002000","10.202.1.2","10.1.1.2","0.000002000","51227  >  12001 [PSH, ACK] Seq=21990 Ack=6229 Win=16425 Len=500","554","0.000000000","0.000002000","TCP"
"47","0.198338","0.198338000","0.022596000","0.022596000","10.202.1.2","10.1.1.2","0.022596000","51227  >  12001 [PSH, ACK] Seq=22490 Ack=6229 Win=16425 Len=905","959","0.000000000","0.022596000","TCP"
"48","0.206324","0.205002000","0.179712000","0.007986000","10.202.1.2","10.1.1.2","0.179712000","51228  >  12002 [PSH, ACK] Seq=1761 Ack=1 Win=16120 Len=1460","1514","0.000000000","0.007986000","TCP"
"49","0.206328","0.205006000","0.000004000","0.000004000","10.202.1.2","10.1.1.2","0.000004000","51228  >  12002 [PSH, ACK] Seq=3221 Ack=1 Win=16120 Len=124","178","0.000000000","0.000004000","TCP"
"51","0.219635","0.218313000","0.013271000","0.013271000","10.202.1.2","10.1.1.2","0.013271000","51228  >  12002 [PSH, ACK] Seq=3345 Ack=1 Win=16120 Len=176","230","0.000000000","0.013271000","TCP"
"54","0.287523","0.287523000","0.003211000","0.003211000","10.202.1.2","10.1.1.2","0.003211000","51227  >  12001 [PSH, ACK] Seq=23395 Ack=6865 Win=16266 Len=738","792","0.000000000","0.003211000","TCP"
"58","0.292851","0.292851000","0.005296000","0.001299000","10.202.1.2","10.1.1.2","0.005296000","51227  >  12001 [ACK] Seq=24133 Ack=7368 Win=16140 Len=1460","1514","0.000000000","0.001299000","TCP"
"59","0.292853","0.292853000","0.000002000","0.000002000","10.202.1.2","10.1.1.2","0.000002000","51227  >  12001 [PSH, ACK] Seq=25593 Ack=7368 Win=16140 Len=610","664","0.000000000","0.000002000","TCP"
"66","0.335447","0.335447000","0.042562000","0.013271000","10.202.1.2","10.1.1.2","0.042562000","51227  >  12001 [PSH, ACK] Seq=26203 Ack=7524 Win=16101 Len=575","629","0.000000000","0.013271000","TCP"
"67","0.399346","0.398024000","0.179711000","0.063899000","10.202.1.2","10.1.1.2","0.179711000","51228  >  12002 [PSH, ACK] Seq=3521 Ack=1 Win=16120 Len=1460","1514","0.000000000","0.063899000","TCP"
"68","0.399348","0.398026000","0.000002000","0.000002000","10.202.1.2","10.1.1.2","0.000002000","51228  >  12002 [PSH, ACK] Seq=4981 Ack=1 Win=16120 Len=124","178","0.000000000","0.000002000","TCP"
"70","0.402005","0.402005000","0.066558000","0.002627000","10.202.1.2","10.1.1.2","0.066558000","51227  >  12001 [PSH, ACK] Seq=26778 Ack=7524 Win=16101 Len=1460","1514","0.000000000","0.002627000","TCP"
"72","0.403340","0.403340000","0.001310000","0.001310000","10.202.1.2","10.1.1.2","0.001310000","51227  >  12001 [ACK] Seq=28238 Ack=7524 Win=16101 Len=1460","1514","0.000000000","0.001310000","TCP"
"73","0.403342","0.403342000","0.000002000","0.000002000","10.202.1.2","10.1.1.2","0.000002000","51227  >  12001 [ACK] Seq=29698 Ack=7524 Win=16101 Len=1460","1514","0.000000000","0.000002000","TCP"
"74","0.403345","0.403345000","0.000003000","0.000003000","10.202.1.2","10.1.1.2","0.000003000","51227  >  12001 [PSH, ACK] Seq=31158 Ack=7524 Win=16101 Len=42","96","0.000000000","0.000003000","TCP"
"76","0.420642","0.419320000","0.021264000","0.017269000","10.202.1.2","10.1.1.2","0.021264000","51228  >  12002 [PSH, ACK] Seq=5105 Ack=1 Win=16120 Len=176","230","0.000000000","0.017269000","TCP"
"77","0.431292","0.431292000","0.027919000","0.010650000","10.202.1.2","10.1.1.2","0.027919000","51227  >  12001 [ACK] Seq=31200 Ack=7524 Win=16101 Len=1460","1514","0.000000000","0.010650000","TCP"
"78","0.431294","0.431294000","0.000002000","0.000002000","10.202.1.2","10.1.1.2","0.000002000","51227  >  12001 [PSH, ACK] Seq=32660 Ack=7524 Win=16101 Len=1206","1260","0.000000000","0.000002000","TCP"
"88","0.481877","0.481877000","0.035287000","0.018599000","10.202.1.2","10.1.1.2","0.035287000","51227  >  12001 [PSH, ACK] Seq=33866 Ack=7909 Win=16425 Len=412","466","0.000000000","0.018599000","TCP"
"91","0.503176","0.503176000","0.021266000","0.015002000","10.202.1.2","10.1.1.2","0.021266000","51227  >  12001 [PSH, ACK] Seq=34278 Ack=8987 Win=16155 Len=309","363","0.000000000","0.015002000","TCP"
"92","0.539120","0.539120000","0.035944000","0.035944000","10.202.1.2","10.1.1.2","0.035944000","51227  >  12001 [ACK] Seq=34587 Ack=8987 Win=16155 Len=1460","1514","0.000000000","0.035944000","TCP"
"93","0.539122","0.539122000","0.000002000","0.000002000","10.202.1.2","10.1.1.2","0.000002000","51227  >  12001 [PSH, ACK] Seq=36047 Ack=8987 Win=16155 Len=1122","1176","0.000000000","0.000002000","TCP"
"95","0.559088","0.559088000","0.019937000","0.019937000","10.202.1.2","10.1.1.2","0.019937000","51227  >  12001 [PSH, ACK] Seq=37169 Ack=8987 Win=16155 Len=673","727","0.000000000","0.019937000","TCP"
"98","0.597689","0.597689000","0.004556000","0.004556000","10.202.1.2","10.1.1.2","0.004556000","51227  >  12001 [PSH, ACK] Seq=37842 Ack=9397 Win=16425 Len=382","436","0.000000000","0.004556000","TCP"
"104","0.601694","0.600372000","0.181052000","0.000001000","10.202.1.2","10.1.1.2","0.181052000","51228  >  12002 [PSH, ACK] Seq=5281 Ack=1 Win=16120 Len=1460","1514","0.000000000","0.000001000","TCP"
"105","0.601696","0.600374000","0.000002000","0.000002000","10.202.1.2","10.1.1.2","0.000002000","51228  >  12002 [PSH, ACK] Seq=6741 Ack=1 Win=16120 Len=124","178","0.000000000","0.000002000","TCP"
"109","0.606490","0.606490000","0.003562000","0.003562000","10.202.1.2","10.1.1.2","0.003562000","51227  >  12001 [ACK] Seq=38224 Ack=11177 Win=16425 Len=0","60","0.000000000","0.003562000","TCP"
"110","0.607843","0.607843000","0.001353000","0.001353000","10.202.1.2","10.1.1.2","0.001353000","51227  >  12001 [ACK] Seq=38224 Ack=14919 Win=16425 Len=0","60","0.000000000","0.001353000","TCP"
"111","0.630473","0.629151000","0.028730000","0.022630000","10.202.1.2","10.1.1.2","0.028730000","51228  >  12002 [PSH, ACK] Seq=6865 Ack=1 Win=16120 Len=176","230","0.000000000","0.022630000","TCP"
"120","0.634470","0.634470000","0.000507000","0.000507000","10.202.1.2","10.1.1.2","0.000507000","51227  >  12001 [ACK] Seq=38224 Ack=14919 Win=16425 Len=1460","1514","0.000000000","0.000507000","TCP"
"121","0.634472","0.634472000","0.000002000","0.000002000","10.202.1.2","10.1.1.2","0.000002000","51227  >  12001 [ACK] Seq=39684 Ack=14919 Win=16425 Len=1460","1514","0.000000000","0.000002000","TCP"
"122","0.634474","0.634474000","0.000002000","0.000002000","10.202.1.2","10.1.1.2","0.000002000","51227  >  12001 [ACK] Seq=41144 Ack=14919 Win=16425 Len=1460","1514","0.000000000","0.000002000","TCP"
"123","0.634476","0.634476000","0.000002000","0.000002000","10.202.1.2","10.1.1.2","0.000002000","51227  >  12001 [ACK] Seq=42604 Ack=14919 Win=16425 Len=1460","1514","0.000000000","0.000002000","TCP"
"125","0.635800","0.635800000","0.001294000","0.001294000","10.202.1.2","10.1.1.2","0.001294000","51227  >  12001 [ACK] Seq=44064 Ack=14919 Win=16425 Len=1460","1514","0.000000000","0.001294000","TCP"
"126","0.635802","0.635802000","0.000002000","0.000002000","10.202.1.2","10.1.1.2","0.000002000","51227  >  12001 [ACK] Seq=45524 Ack=14919 Win=16425 Len=1460","1514","0.000000000","0.000002000","TCP"
"127","0.635806","0.635806000","0.000004000","0.000004000","10.202.1.2","10.1.1.2","0.000004000","51227  >  12001 [ACK] Seq=46984 Ack=14919 Win=16425 Len=1460","1514","0.000000000","0.000004000","TCP"
"128","0.635807","0.635807000","0.000001000","0.000001000","10.202.1.2","10.1.1.2","0.000001000","51227  >  12001 [ACK] Seq=48444 Ack=14919 Win=16425 Len=1460","1514","0.000000000","0.000001000","TCP"
"129","0.635809","0.635809000","0.000002000","0.000002000","10.202.1.2","10.1.1.2","0.000002000","51227  >  12001 [ACK] Seq=49904 Ack=14919 Win=16425 Len=1460","1514","0.000000000","0.000002000","TCP"
"130","0.635811","0.635811000","0.000002000","0.000002000","10.202.1.2","10.1.1.2","0.000002000","51227  >  12001 [PSH, ACK] Seq=51364 Ack=14919 Win=16425 Len=1193","1247","0.000000000","0.000002000","TCP"
"134","0.663754","0.663754000","0.027914000","0.022588000","10.202.1.2","10.1.1.2","0.027914000","51227  >  12001 [ACK] Seq=52557 Ack=15300 Win=16329 Len=1460","1514","0.000000000","0.022588000","TCP"
"135","0.663756","0.663756000","0.000002000","0.000002000","10.202.1.2","10.1.1.2","0.000002000","51227  >  12001 [PSH, ACK] Seq=54017 Ack=15300 Win=16329 Len=1012","1066","0.000000000","0.000002000","TCP"
"137","0.701027","0.701027000","0.037239000","0.037239000","10.202.1.2","10.1.1.2","0.037239000","51227  >  12001 [ACK] Seq=55029 Ack=15300 Win=16329 Len=1460","1514","0.000000000","0.037239000","TCP"
"138","0.701030","0.701030000","0.000003000","0.000003000","10.202.1.2","10.1.1.2","0.000003000","51227  >  12001 [PSH, ACK] Seq=56489 Ack=15300 Win=16329 Len=721","775","0.000000000","0.000003000","TCP"
"140","0.732974","0.732974000","0.031916000","0.031916000","10.202.1.2","10.1.1.2","0.031916000","51227  >  12001 [PSH, ACK] Seq=57210 Ack=15300 Win=16329 Len=396","450","0.000000000","0.031916000","TCP"
"143","0.759601","0.759601000","0.003730000","0.003730000","10.202.1.2","10.1.1.2","0.003730000","51227  >  12001 [PSH, ACK] Seq=57606 Ack=16075 Win=16136 Len=307","361","0.000000000","0.003730000","TCP"
"154","0.806195","0.806195000","0.020466000","0.017314000","10.202.1.2","10.1.1.2","0.020466000","51227  >  12001 [ACK] Seq=57913 Ack=16557 Win=16425 Len=1460","1514","0.000000000","0.017314000","TCP"
"155","0.806197","0.806197000","0.000002000","0.000002000","10.202.1.2","10.1.1.2","0.000002000","51227  >  12001 [PSH, ACK] Seq=59373 Ack=16557 Win=16425 Len=1074","1128","0.000000000","0.000002000","TCP"
"157","0.807531","0.806209000","0.177058000","0.001287000","10.202.1.2","10.1.1.2","0.177058000","51228  >  12002 [PSH, ACK] Seq=7041 Ack=1 Win=16120 Len=1460","1514","0.000000000","0.001287000","TCP"
"158","0.807536","0.806214000","0.000005000","0.000005000","10.202.1.2","10.1.1.2","0.000005000","51228  >  12002 [PSH, ACK] Seq=8501 Ack=1 Win=16120 Len=124","178","0.000000000","0.000005000","TCP"
"176","0.822499","0.821177000","0.014912000","0.001544000","10.202.1.2","10.1.1.2","0.014912000","51228  >  12002 [PSH, ACK] Seq=8625 Ack=1 Win=16120 Len=176","230","0.000000000","0.001544000","TCP"
"177","0.823852","0.823852000","0.017608000","0.001353000","10.202.1.2","10.1.1.2","0.017608000","51227  >  12001 [PSH, ACK] Seq=60447 Ack=16729 Win=16382 Len=606","660","0.000000000","0.001353000","TCP"
"179","0.855811","0.855811000","0.031933000","0.031933000","10.202.1.2","10.1.1.2","0.031933000","51227  >  12001 [PSH, ACK] Seq=61053 Ack=16906 Win=16337 Len=304","358","0.000000000","0.031933000","TCP"
"180","0.905068","0.905068000","0.049257000","0.049257000","10.202.1.2","10.1.1.2","0.049257000","51227  >  12001 [ACK] Seq=61357 Ack=16906 Win=16337 Len=1460","1514","0.000000000","0.049257000","TCP"
"181","0.905070","0.905070000","0.000002000","0.000002000","10.202.1.2","10.1.1.2","0.000002000","51227  >  12001 [PSH, ACK] Seq=62817 Ack=16906 Win=16337 Len=878","932","0.000000000","0.000002000","TCP"
"183","0.930352","0.930352000","0.025227000","0.025227000","10.202.1.2","10.1.1.2","0.025227000","51227  >  12001 [ACK] Seq=63695 Ack=16906 Win=16337 Len=1460","1514","0.000000000","0.025227000","TCP"
"184","0.930354","0.930354000","0.000002000","0.000002000","10.202.1.2","10.1.1.2","0.000002000","51227  >  12001 [ACK] Seq=65155 Ack=16906 Win=16337 Len=1460","1514","0.000000000","0.000002000","TCP"
"185","0.930356","0.930356000","0.000002000","0.000002000","10.202.1.2","10.1.1.2","0.000002000","51227  >  12001 [PSH, ACK] Seq=66615 Ack=16906 Win=16337 Len=1391","1445","0.000000000","0.000002000","TCP"
"190","0.958309","0.958309000","0.027917000","0.000002000","10.202.1.2","10.1.1.2","0.027917000","51227  >  12001 [ACK] Seq=68006 Ack=16906 Win=16337 Len=1460","1514","0.000000000","0.000002000","TCP"
"191","0.958310","0.958310000","0.000001000","0.000001000","10.202.1.2","10.1.1.2","0.000001000","51227  >  12001 [PSH, ACK] Seq=69466 Ack=16906 Win=16337 Len=924","978","0.000000000","0.000001000","TCP"
"201","0.986258","0.986258000","0.027880000","0.011925000","10.202.1.2","10.1.1.2","0.027880000","51227  >  12001 [PSH, ACK] Seq=70390 Ack=16906 Win=16337 Len=487","541","0.000000000","0.011925000","TCP"
"204","1.002230","1.000908000","0.179731000","0.011952000","10.202.1.2","10.1.1.2","0.179731000","51228  >  12002 [PSH, ACK] Seq=8801 Ack=1 Win=16120 Len=1460","1514","0.000000000","0.011952000","TCP"
"205","1.002232","1.000910000","0.000002000","0.000002000","10.202.1.2","10.1.1.2","0.000002000","51228  >  12002 [PSH, ACK] Seq=10261 Ack=1 Win=16120 Len=124","178","0.000000000","0.000002000","TCP"
"207","1.019537","1.018215000","0.017279000","0.017279000","10.202.1.2","10.1.1.2","0.017279000","51228  >  12002 [PSH, ACK] Seq=10385 Ack=1 Win=16120 Len=176","230","0.000000000","0.017279000","TCP"
"208","1.054151","1.054151000","0.067893000","0.034614000","10.202.1.2","10.1.1.2","0.067893000","51227  >  12001 [PSH, ACK] Seq=70877 Ack=16906 Win=16337 Len=1460","1514","0.000000000","0.034614000","TCP"
"209","1.054153","1.054153000","0.000002000","0.000002000","10.202.1.2","10.1.1.2","0.000002000","51227  >  12001 [ACK] Seq=72337 Ack=16906 Win=16337 Len=1460","1514","0.000000000","0.000002000","TCP"
"210","1.054156","1.054156000","0.000003000","0.000003000","10.202.1.2","10.1.1.2","0.000003000","51227  >  12001 [PSH, ACK] Seq=73797 Ack=16906 Win=16337 Len=396","450","0.000000000","0.000003000","TCP"
"222","1.088766","1.088766000","0.034579000","0.029195000","10.202.1.2","10.1.1.2","0.034579000","51227  >  12001 [ACK] Seq=74193 Ack=16906 Win=16337 Len=1460","1514","0.000000000","0.029195000","TCP"
"223","1.088770","1.088770000","0.000004000","0.000004000","10.202.1.2","10.1.1.2","0.000004000","51227  >  12001 [ACK] Seq=75653 Ack=16906 Win=16337 Len=1460","1514","0.000000000","0.000004000","TCP"
"224","1.088771","1.088771000","0.000001000","0.000001000","10.202.1.2","10.1.1.2","0.000001000","51227  >  12001 [ACK] Seq=77113 Ack=16906 Win=16337 Len=1460","1514","0.000000000","0.000001000","TCP"
"225","1.088773","1.088773000","0.000002000","0.000002000","10.202.1.2","10.1.1.2","0.000002000","51227  >  12001 [ACK] Seq=78573 Ack=16906 Win=16337 Len=1460","1514","0.000000000","0.000002000","TCP"
"226","1.088775","1.088775000","0.000002000","0.000002000","10.202.1.2","10.1.1.2","0.000002000","51227  >  12001 [ACK] Seq=80033 Ack=16906 Win=16337 Len=1460","1514","0.000000000","0.000002000","TCP"
"227","1.088777","1.088777000","0.000002000","0.000002000","10.202.1.2","10.1.1.2","0.000002000","51227  >  12001 [ACK] Seq=81493 Ack=16906 Win=16337 Len=1460","1514","0.000000000","0.000002000","TCP"
"228","1.088778","1.088778000","0.000001000","0.000001000","10.202.1.2","10.1.1.2","0.000001000","51227  >  12001 [ACK] Seq=82953 Ack=16906 Win=16337 Len=1460","1514","0.000000000","0.000001000","TCP"
"229","1.088780","1.088780000","0.000002000","0.000002000","10.202.1.2","10.1.1.2","0.000002000","51227  >  12001 [ACK] Seq=84413 Ack=16906 Win=16337 Len=1460","1514","0.000000000","0.000002000","TCP"
"230","1.088782","1.088782000","0.000002000","0.000002000","10.202.1.2","10.1.1.2","0.000002000","51227  >  12001 [ACK] Seq=85873 Ack=16906 Win=16337 Len=1460","1514","0.000000000","0.000002000","TCP"
"231","1.088784","1.088784000","0.000002000","0.000002000","10.202.1.2","10.1.1.2","0.000002000","51227  >  12001 [PSH, ACK] Seq=87333 Ack=16906 Win=16337 Len=1157","1211","0.000000000","0.000002000","TCP"
"234","1.122039","1.122039000","0.033165000","0.033165000","10.202.1.2","10.1.1.2","0.033165000","51227  >  12001 [PSH, ACK] Seq=88490 Ack=16906 Win=16337 Len=823","877","0.000000000","0.033165000","TCP"
"249","1.193925","1.193925000","0.071886000","0.034553000","10.202.1.2","10.1.1.2","0.071886000","51227  >  12001 [PSH, ACK] Seq=89313 Ack=16906 Win=16337 Len=1460","1514","0.000000000","0.034553000","TCP"
"250","1.193927","1.193927000","0.000002000","0.000002000","10.202.1.2","10.1.1.2","0.000002000","51227  >  12001 [ACK] Seq=90773 Ack=16906 Win=16337 Len=1460","1514","0.000000000","0.000002000","TCP"
"251","1.193929","1.193929000","0.000002000","0.000002000","10.202.1.2","10.1.1.2","0.000002000","51227  >  12001 [ACK] Seq=92233 Ack=16906 Win=16337 Len=1460","1514","0.000000000","0.000002000","TCP"
"252","1.193931","1.193931000","0.000002000","0.000002000","10.202.1.2","10.1.1.2","0.000002000","51227  >  12001 [PSH, ACK] Seq=93693 Ack=16906 Win=16337 Len=1055","1109","0.000000000","0.000002000","TCP"
"254","1.199245","1.197923000","0.179708000","0.005281000","10.202.1.2","10.1.1.2","0.179708000","51228  >  12002 [PSH, ACK] Seq=10561 Ack=1 Win=16120 Len=1460","1514","0.000000000","0.005281000","TCP"
"255","1.199247","1.197925000","0.000002000","0.000002000","10.202.1.2","10.1.1.2","0.000002000","51228  >  12002 [PSH, ACK] Seq=12021 Ack=1 Win=16120 Len=124","178","0.000000000","0.000002000","TCP"
"262","1.217882","1.217882000","0.002438000","0.002438000","10.202.1.2","10.1.1.2","0.002438000","51227  >  12001 [ACK] Seq=94748 Ack=18806 Win=16425 Len=0","60","0.000000000","0.002438000","TCP"
"264","1.219215","1.217893000","0.019941000","0.001306000","10.202.1.2","10.1.1.2","0.019941000","51228  >  12002 [PSH, ACK] Seq=12145 Ack=1 Win=16120 Len=176","230","0.000000000","0.001306000","TCP"
"265","1.219216","1.219216000","0.001307000","0.000001000","10.202.1.2","10.1.1.2","0.001307000","51227  >  12001 [ACK] Seq=94748 Ack=23200 Win=16425 Len=0","60","0.000000000","0.000001000","TCP"
"266","1.221875","1.221875000","0.002659000","0.002659000","10.202.1.2","10.1.1.2","0.002659000","51227  >  12001 [ACK] Seq=94748 Ack=24602 Win=16074 Len=0","60","0.000000000","0.002659000","TCP"
"267","1.225868","1.225868000","0.003993000","0.003993000","10.202.1.2","10.1.1.2","0.003993000","51227  >  12001 [ACK] Seq=94748 Ack=24602 Win=16074 Len=1460","1514","0.000000000","0.003993000","TCP"
"268","1.225870","1.225870000","0.000002000","0.000002000","10.202.1.2","10.1.1.2","0.000002000","51227  >  12001 [PSH, ACK] Seq=96208 Ack=24602 Win=16074 Len=988","1042","0.000000000","0.000002000","TCP"
"270","1.265805","1.265805000","0.039913000","0.039913000","10.202.1.2","10.1.1.2","0.039913000","51227  >  12001 [PSH, ACK] Seq=97196 Ack=24602 Win=16074 Len=455","509","0.000000000","0.039913000","TCP"
"283","1.344346","1.344346000","0.078541000","0.019952000","10.202.1.2","10.1.1.2","0.078541000","51227  >  12001 [PSH, ACK] Seq=97651 Ack=24602 Win=16074 Len=1460","1514","0.000000000","0.019952000","TCP"
"284","1.344348","1.344348000","0.000002000","0.000002000","10.202.1.2","10.1.1.2","0.000002000","51227  >  12001 [PSH, ACK] Seq=99111 Ack=24602 Win=16074 Len=1310","1364","0.000000000","0.000002000","TCP"
"286","1.358990","1.358990000","0.014613000","0.014613000","10.202.1.2","10.1.1.2","0.014613000","51227  >  12001 [PSH, ACK] Seq=100421 Ack=24602 Win=16074 Len=743","797","0.000000000","0.014613000","TCP"
"291","1.405588","1.404266000","0.186373000","0.038533000","10.202.1.2","10.1.1.2","0.186373000","51228  >  12002 [PSH, ACK] Seq=12321 Ack=1 Win=16120 Len=1460","1514","0.000000000","0.038533000","TCP"
"292","1.405589","1.404267000","0.000001000","0.000001000","10.202.1.2","10.1.1.2","0.000001000","51228  >  12002 [PSH, ACK] Seq=13781 Ack=1 Win=16120 Len=124","178","0.000000000","0.000001000","TCP"
"294","1.418892","1.417570000","0.013258000","0.013258000","10.202.1.2","10.1.1.2","0.013258000","51228  >  12002 [PSH, ACK] Seq=13905 Ack=1 Win=16120 Len=176","230","0.000000000","0.013258000","TCP"
"295","1.436211","1.436211000","0.077221000","0.017319000","10.202.1.2","10.1.1.2","0.077221000","51227  >  12001 [PSH, ACK] Seq=101164 Ack=24602 Win=16074 Len=1460","1514","0.000000000","0.017319000","TCP"
"296","1.436214","1.436214000","0.000003000","0.000003000","10.202.1.2","10.1.1.2","0.000003000","51227  >  12001 [ACK] Seq=102624 Ack=24602 Win=16074 Len=1460","1514","0.000000000","0.000003000","TCP"
"297","1.436215","1.436215000","0.000001000","0.000001000","10.202.1.2","10.1.1.2","0.000001000","51227  >  12001 [PSH, ACK] Seq=104084 Ack=24602 Win=16074 Len=1376","1430","0.000000000","0.000001000","TCP"
"307","1.482785","1.482785000","0.046508000","0.005213000","10.202.1.2","10.1.1.2","0.046508000","51227  >  12001 [PSH, ACK] Seq=105460 Ack=24602 Win=16074 Len=826","880","0.000000000","0.005213000","TCP"
"308","1.490777","1.490777000","0.007992000","0.007992000","10.202.1.2","10.1.1.2","0.007992000","51227  >  12001 [ACK] Seq=106286 Ack=24602 Win=16074 Len=1460","1514","0.000000000","0.007992000","TCP"
"309","1.490779","1.490779000","0.000002000","0.000002000","10.202.1.2","10.1.1.2","0.000002000","51227  >  12001 [PSH, ACK] Seq=107746 Ack=24602 Win=16074 Len=1153","1207","0.000000000","0.000002000","TCP"
"317","1.520063","1.520063000","0.001802000","0.001802000","10.202.1.2","10.1.1.2","0.001802000","51227  >  12001 [PSH, ACK] Seq=108899 Ack=24602 Win=16074 Len=371","425","0.000000000","0.001802000","TCP"
"320","1.522724","1.522724000","0.002535000","0.002535000","10.202.1.2","10.1.1.2","0.002535000","51227  >  12001 [ACK] Seq=109270 Ack=25188 Win=16425 Len=0","60","0.000000000","0.002535000","TCP"
"322","1.524053","1.524053000","0.001303000","0.001303000","10.202.1.2","10.1.1.2","0.001303000","51227  >  12001 [ACK] Seq=109270 Ack=26832 Win=16425 Len=0","60","0.000000000","0.001303000","TCP"
"331","1.538695","1.538695000","0.004157000","0.004157000","10.202.1.2","10.1.1.2","0.004157000","51227  >  12001 [ACK] Seq=109270 Ack=29235 Win=16425 Len=0","60","0.000000000","0.004157000","TCP"
"332","1.540026","1.540026000","0.001331000","0.001331000","10.202.1.2","10.1.1.2","0.001331000","51227  >  12001 [ACK] Seq=109270 Ack=33793 Win=16425 Len=0","60","0.000000000","0.001331000","TCP"
"333","1.565330","1.565330000","0.025304000","0.025304000","10.202.1.2","10.1.1.2","0.025304000","51227  >  12001 [ACK] Seq=109270 Ack=33793 Win=16425 Len=1460","1514","0.000000000","0.025304000","TCP"
"334","1.565333","1.565333000","0.000003000","0.000003000","10.202.1.2","10.1.1.2","0.000003000","51227  >  12001 [ACK] Seq=110730 Ack=33793 Win=16425 Len=1460","1514","0.000000000","0.000003000","TCP"
"335","1.565335","1.565335000","0.000002000","0.000002000","10.202.1.2","10.1.1.2","0.000002000","51227  >  12001 [ACK] Seq=112190 Ack=33793 Win=16425 Len=1460","1514","0.000000000","0.000002000","TCP"
"336","1.565337","1.565337000","0.000002000","0.000002000","10.202.1.2","10.1.1.2","0.000002000","51227  >  12001 [ACK] Seq=113650 Ack=33793 Win=16425 Len=1460","1514","0.000000000","0.000002000","TCP"
"338","1.566656","1.566656000","0.001274000","0.001274000","10.202.1.2","10.1.1.2","0.001274000","51227  >  12001 [ACK] Seq=115110 Ack=33793 Win=16425 Len=1460","1514","0.000000000","0.001274000","TCP"
"339","1.566658","1.566658000","0.000002000","0.000002000","10.202.1.2","10.1.1.2","0.000002000","51227  >  12001 [ACK] Seq=116570 Ack=33793 Win=16425 Len=1460","1514","0.000000000","0.000002000","TCP"
"340","1.566660","1.566660000","0.000002000","0.000002000","10.202.1.2","10.1.1.2","0.000002000","51227  >  12001 [ACK] Seq=118030 Ack=33793 Win=16425 Len=1460","1514","0.000000000","0.000002000","TCP"
"341","1.566662","1.566662000","0.000002000","0.000002000","10.202.1.2","10.1.1.2","0.000002000","51227  >  12001 [ACK] Seq=119490 Ack=33793 Win=16425 Len=1460","1514","0.000000000","0.000002000","TCP"
"342","1.566664","1.566664000","0.000002000","0.000002000","10.202.1.2","10.1.1.2","0.000002000","51227  >  12001 [ACK] Seq=120950 Ack=33793 Win=16425 Len=1460","1514","0.000000000","0.000002000","TCP"
"343","1.566666","1.566666000","0.000002000","0.000002000","10.202.1.2","10.1.1.2","0.000002000","51227  >  12001 [PSH, ACK] Seq=122410 Ack=33793 Win=16425 Len=813","867","0.000000000","0.000002000","TCP"
"345","1.595942","1.595942000","0.029247000","0.029247000","10.202.1.2","10.1.1.2","0.029247000","51227  >  12001 [PSH, ACK] Seq=123223 Ack=33793 Win=16425 Len=1270","1324","0.000000000","0.029247000","TCP"
"348","1.607920","1.606598000","0.189028000","0.010606000","10.202.1.2","10.1.1.2","0.189028000","51228  >  12002 [PSH, ACK] Seq=14081 Ack=1 Win=16120 Len=1460","1514","0.000000000","0.010606000","TCP"
"349","1.607922","1.606600000","0.000002000","0.000002000","10.202.1.2","10.1.1.2","0.000002000","51228  >  12002 [PSH, ACK] Seq=15541 Ack=1 Win=16120 Len=124","178","0.000000000","0.000002000","TCP"
"351","1.622562","1.621240000","0.014610000","0.014610000","10.202.1.2","10.1.1.2","0.014610000","51228  >  12002 [PSH, ACK] Seq=15665 Ack=1 Win=16120 Len=176","230","0.000000000","0.014610000","TCP"
"363","1.687788","1.687788000","0.004626000","0.002637000","10.202.1.2","10.1.1.2","0.004626000","51227  >  12001 [PSH, ACK] Seq=124493 Ack=34146 Win=16336 Len=824","878","0.000000000","0.002637000","TCP"
"365","1.702434","1.702434000","0.014613000","0.014613000","10.202.1.2","10.1.1.2","0.014613000","51227  >  12001 [PSH, ACK] Seq=125317 Ack=35023 Win=16117 Len=1368","1422","0.000000000","0.014613000","TCP"
"367","1.745034","1.745034000","0.042600000","0.038587000","10.202.1.2","10.1.1.2","0.042600000","51227  >  12001 [ACK] Seq=126685 Ack=35023 Win=16117 Len=1460","1514","0.000000000","0.038587000","TCP"
"368","1.745037","1.745037000","0.000003000","0.000003000","10.202.1.2","10.1.1.2","0.000003000","51227  >  12001 [ACK] Seq=128145 Ack=35023 Win=16117 Len=1460","1514","0.000000000","0.000003000","TCP"
"370","1.746362","1.746362000","0.001289000","0.001289000","10.202.1.2","10.1.1.2","0.001289000","51227  >  12001 [PSH, ACK] Seq=129605 Ack=35023 Win=16117 Len=1130","1184","0.000000000","0.001289000","TCP"
"374","1.766339","1.766339000","0.014565000","0.014565000","10.202.1.2","10.1.1.2","0.014565000","51227  >  12001 [ACK] Seq=130735 Ack=35660 Win=16425 Len=1460","1514","0.000000000","0.014565000","TCP"
"375","1.766343","1.766343000","0.000004000","0.000004000","10.202.1.2","10.1.1.2","0.000004000","51227  >  12001 [PSH, ACK] Seq=132195 Ack=35660 Win=16425 Len=794","848","0.000000000","0.000004000","TCP"
"377","1.791625","1.791625000","0.025220000","0.025220000","10.202.1.2","10.1.1.2","0.025220000","51227  >  12001 [PSH, ACK] Seq=132989 Ack=35660 Win=16425 Len=440","494","0.000000000","0.025220000","TCP"
"378","1.802276","1.800954000","0.179714000","0.010651000","10.202.1.2","10.1.1.2","0.179714000","51228  >  12002 [PSH, ACK] Seq=15841 Ack=1 Win=16120 Len=1460","1514","0.000000000","0.010651000","TCP"
"379","1.802279","1.800957000","0.000003000","0.000003000","10.202.1.2","10.1.1.2","0.000003000","51228  >  12002 [PSH, ACK] Seq=17301 Ack=1 Win=16120 Len=124","178","0.000000000","0.000003000","TCP"
"381","1.819586","1.818264000","0.017263000","0.017263000","10.202.1.2","10.1.1.2","0.017263000","51228  >  12002 [PSH, ACK] Seq=17425 Ack=1 Win=16120 Len=176","230","0.000000000","0.017263000","TCP"
"387","1.828896","1.828896000","0.003255000","0.003255000","10.202.1.2","10.1.1.2","0.003255000","51227  >  12001 [PSH, ACK] Seq=133429 Ack=36341 Win=16254 Len=293","347","0.000000000","0.003255000","TCP"
"391","1.870165","1.870165000","0.041269000","0.013301000","10.202.1.2","10.1.1.2","0.041269000","51227  >  12001 [ACK] Seq=133722 Ack=36341 Win=16254 Len=1460","1514","0.000000000","0.013301000","TCP"
"392","1.870170","1.870170000","0.000005000","0.000005000","10.202.1.2","10.1.1.2","0.000005000","51227  >  12001 [PSH, ACK] Seq=135182 Ack=36341 Win=16254 Len=1099","1153","0.000000000","0.000005000","TCP"
"394","1.890130","1.890130000","0.019905000","0.019905000","10.202.1.2","10.1.1.2","0.019905000","51227  >  12001 [PSH, ACK] Seq=136281 Ack=36341 Win=16254 Len=701","755","0.000000000","0.019905000","TCP"
"400","1.932731","1.932731000","0.029944000","0.019941000","10.202.1.2","10.1.1.2","0.029944000","51227  >  12001 [PSH, ACK] Seq=136982 Ack=36512 Win=16212 Len=432","486","0.000000000","0.019941000","TCP"
"402","1.977993","1.977993000","0.045212000","0.045212000","10.202.1.2","10.1.1.2","0.045212000","51227  >  12001 [ACK] Seq=137414 Ack=36664 Win=16174 Len=1460","1514","0.000000000","0.045212000","TCP"
"403","1.979322","1.979322000","0.001329000","0.001329000","10.202.1.2","10.1.1.2","0.001329000","51227  >  12001 [ACK] Seq=138874 Ack=36664 Win=16174 Len=1460","1514","0.000000000","0.001329000","TCP"
"404","1.979324","1.979324000","0.000002000","0.000002000","10.202.1.2","10.1.1.2","0.000002000","51227  >  12001 [PSH, ACK] Seq=140334 Ack=36664 Win=16174 Len=1249","1303","0.000000000","0.000002000","TCP"
"414","1.997954","1.997954000","0.017740000","0.010621000","10.202.1.2","10.1.1.2","0.017740000","51227  >  12001 [PSH, ACK] Seq=141583 Ack=37118 Win=16060 Len=813","867","0.000000000","0.010621000","TCP"
"416","2.001950","2.000628000","0.182364000","0.003969000","10.202.1.2","10.1.1.2","0.182364000","51228  >  12002 [PSH, ACK] Seq=17601 Ack=1 Win=16120 Len=1460","1514","0.000000000","0.003969000","TCP"
"417","2.001952","2.000630000","0.000002000","0.000002000","10.202.1.2","10.1.1.2","0.000002000","51228  >  12002 [PSH, ACK] Seq=19061 Ack=1 Win=16120 Len=124","178","0.000000000","0.000002000","TCP"
"419","2.019254","2.017932000","0.017274000","0.017274000","10.202.1.2","10.1.1.2","0.017274000","51228  >  12002 [PSH, ACK] Seq=19185 Ack=1 Win=16120 Len=176","230","0.000000000","0.017274000","TCP"
"427","2.028570","2.028570000","0.004146000","0.004146000","10.202.1.2","10.1.1.2","0.004146000","51227  >  12001 [ACK] Seq=142396 Ack=38725 Win=16425 Len=0","60","0.000000000","0.004146000","TCP"
"428","2.031235","2.031235000","0.002665000","0.002665000","10.202.1.2","10.1.1.2","0.002665000","51227  >  12001 [ACK] Seq=142396 Ack=38725 Win=16425 Len=1460","1514","0.000000000","0.002665000","TCP"
"429","2.031237","2.031237000","0.000002000","0.000002000","10.202.1.2","10.1.1.2","0.000002000","51227  >  12001 [ACK] Seq=143856 Ack=38725 Win=16425 Len=1460","1514","0.000000000","0.000002000","TCP"
"430","2.031239","2.031239000","0.000002000","0.000002000","10.202.1.2","10.1.1.2","0.000002000","51227  >  12001 [ACK] Seq=145316 Ack=38725 Win=16425 Len=1460","1514","0.000000000","0.000002000","TCP"
"431","2.031240","2.031240000","0.000001000","0.000001000","10.202.1.2","10.1.1.2","0.000001000","51227  >  12001 [ACK] Seq=146776 Ack=38725 Win=16425 Len=1460","1514","0.000000000","0.000001000","TCP"
"433","2.032570","2.032570000","0.001304000","0.001304000","10.202.1.2","10.1.1.2","0.001304000","51227  >  12001 [ACK] Seq=148236 Ack=38725 Win=16425 Len=1460","1514","0.000000000","0.001304000","TCP"
"434","2.032572","2.032572000","0.000002000","0.000002000","10.202.1.2","10.1.1.2","0.000002000","51227  >  12001 [ACK] Seq=149696 Ack=38725 Win=16425 Len=1460","1514","0.000000000","0.000002000","TCP"
"435","2.032575","2.032575000","0.000003000","0.000003000","10.202.1.2","10.1.1.2","0.000003000","51227  >  12001 [ACK] Seq=151156 Ack=38725 Win=16425 Len=1460","1514","0.000000000","0.000003000","TCP"
"436","2.032577","2.032577000","0.000002000","0.000002000","10.202.1.2","10.1.1.2","0.000002000","51227  >  12001 [ACK] Seq=152616 Ack=38725 Win=16425 Len=1460","1514","0.000000000","0.000002000","TCP"
"437","2.032578","2.032578000","0.000001000","0.000001000","10.202.1.2","10.1.1.2","0.000001000","51227  >  12001 [ACK] Seq=154076 Ack=38725 Win=16425 Len=1460","1514","0.000000000","0.000001000","TCP"
"438","2.032580","2.032580000","0.000002000","0.000002000","10.202.1.2","10.1.1.2","0.000002000","51227  >  12001 [PSH, ACK] Seq=155536 Ack=38725 Win=16425 Len=433","487","0.000000000","0.000002000","TCP"
"439","2.032581","2.032581000","0.000001000","0.000001000","10.202.1.2","10.1.1.2","0.000001000","51227  >  12001 [ACK] Seq=155969 Ack=42653 Win=16425 Len=0","60","0.000000000","0.000001000","TCP"
"441","2.065847","2.065847000","0.033231000","0.033231000","10.202.1.2","10.1.1.2","0.033231000","51227  >  12001 [PSH, ACK] Seq=155969 Ack=42653 Win=16425 Len=875","929","0.000000000","0.033231000","TCP"
"446","2.104451","2.104451000","0.028602000","0.028602000","10.202.1.2","10.1.1.2","0.028602000","51227  >  12001 [PSH, ACK] Seq=156844 Ack=43069 Win=16321 Len=388","442","0.000000000","0.028602000","TCP"
"448","2.123087","2.123087000","0.018605000","0.018605000","10.202.1.2","10.1.1.2","0.018605000","51227  >  12001 [PSH, ACK] Seq=157232 Ack=43225 Win=16282 Len=330","384","0.000000000","0.018605000","TCP"
"457","2.176339","2.176339000","0.031222000","0.000002000","10.202.1.2","10.1.1.2","0.031222000","51227  >  12001 [ACK] Seq=157562 Ack=43544 Win=16202 Len=1460","1514","0.000000000","0.000002000","TCP"
"458","2.176341","2.176341000","0.000002000","0.000002000","10.202.1.2","10.1.1.2","0.000002000","51227  >  12001 [PSH, ACK] Seq=159022 Ack=43544 Win=16202 Len=510","564","0.000000000","0.000002000","TCP"
"461","2.200296","2.198974000","0.181042000","0.023902000","10.202.1.2","10.1.1.2","0.181042000","51228  >  12002 [PSH, ACK] Seq=19361 Ack=1 Win=16120 Len=1460","1514","0.000000000","0.023902000","TCP"
"462","2.200298","2.198976000","0.000002000","0.000002000","10.202.1.2","10.1.1.2","0.000002000","51228  >  12002 [PSH, ACK] Seq=20821 Ack=1 Win=16120 Len=124","178","0.000000000","0.000002000","TCP"
"464","2.202955","2.202955000","0.026561000","0.002631000","10.202.1.2","10.1.1.2","0.026561000","51227  >  12001 [PSH, ACK] Seq=159532 Ack=43696 Win=16164 Len=520","574","0.000000000","0.002631000","TCP"
"466","2.226922","2.225600000","0.026598000","0.023939000","10.202.1.2","10.1.1.2","0.026598000","51228  >  12002 [PSH, ACK] Seq=20945 Ack=1 Win=16120 Len=176","230","0.000000000","0.023939000","TCP"
"467","2.226923","2.226923000","0.023940000","0.000001000","10.202.1.2","10.1.1.2","0.023940000","51227  >  12001 [PSH, ACK] Seq=160052 Ack=43848 Win=16126 Len=390","444","0.000000000","0.000001000","TCP"
"471","2.288156","2.288156000","0.060419000","0.060419000","10.202.1.2","10.1.1.2","0.060419000","51227  >  12001 [ACK] Seq=160442 Ack=44250 Win=16425 Len=1460","1514","0.000000000","0.060419000","TCP"
"472","2.288158","2.288158000","0.000002000","0.000002000","10.202.1.2","10.1.1.2","0.000002000","51227  >  12001 [ACK] Seq=161902 Ack=44250 Win=16425 Len=1460","1514","0.000000000","0.000002000","TCP"
"473","2.288160","2.288160000","0.000002000","0.000002000","10.202.1.2","10.1.1.2","0.000002000","51227  >  12001 [PSH, ACK] Seq=163362 Ack=44250 Win=16425 Len=1114","1168","0.000000000","0.000002000","TCP"
"478","2.312114","2.312114000","0.023917000","0.004585000","10.202.1.2","10.1.1.2","0.023917000","51227  >  12001 [ACK] Seq=164476 Ack=44423 Win=16381 Len=1460","1514","0.000000000","0.004585000","TCP"
"479","2.312116","2.312116000","0.000002000","0.000002000","10.202.1.2","10.1.1.2","0.000002000","51227  >  12001 [PSH, ACK] Seq=165936 Ack=44423 Win=16381 Len=777","831","0.000000000","0.000002000","TCP"
"483","2.334743","2.334743000","0.022594000","0.005292000","10.202.1.2","10.1.1.2","0.022594000","51227  >  12001 [PSH, ACK] Seq=166713 Ack=45046 Win=16226 Len=466","520","0.000000000","0.005292000","TCP"
"485","2.369364","2.369364000","0.034591000","0.034591000","10.202.1.2","10.1.1.2","0.034591000","51227  >  12001 [PSH, ACK] Seq=167179 Ack=45322 Win=16157 Len=319","373","0.000000000","0.034591000","TCP"
"489","2.399974","2.398652000","0.173052000","0.016824000","10.202.1.2","10.1.1.2","0.173052000","51228  >  12002 [PSH, ACK] Seq=21121 Ack=1 Win=16120 Len=1460","1514","0.000000000","0.016824000","TCP"
"490","2.399977","2.398655000","0.000003000","0.000003000","10.202.1.2","10.1.1.2","0.000003000","51228  >  12002 [PSH, ACK] Seq=22581 Ack=1 Win=16120 Len=124","178","0.000000000","0.000003000","TCP"
