"No.","Time","Time since first frame in this TCP stream","segment delta","Time delta from previous captured frame","Destination","Source","Delta Time (conv)","Info","Length","Time shift for this packet","Time delta from previous captured frame","Protocol"
"7","0.025287","0.000000000","0.000000000","0.023934000","10.1.1.2","10.22.1.2","0.000000000","51723  >  12002 [ACK] Seq=1 Ack=1 Win=16425 Len=0","60","0.000000000","0.023934000","TCP"
"18","0.126460","0.000000000","0.000000000","0.004000000","10.1.1.2","10.22.1.2","0.000000000","51722  >  12001 [PSH, ACK] Seq=1 Ack=1 Win=65335 Len=1460","1514","0.000000000","0.004000000","TCP"
"19","0.126463","0.000003000","0.000003000","0.000003000","10.1.1.2","10.22.1.2","0.000003000","51722  >  12001 [ACK] Seq=1461 Ack=1 Win=65335 Len=1460","1514","0.000000000","0.000003000","TCP"
"20","0.126465","0.000005000","0.000002000","0.000002000","10.1.1.2","10.22.1.2","0.000002000","51722  >  12001 [ACK] Seq=2921 Ack=1 Win=65335 Len=1460","1514","0.000000000","0.000002000","TCP"
"21","0.126466","0.000006000","0.000001000","0.000001000","10.1.1.2","10.22.1.2","0.000001000","51722  >  12001 [ACK] Seq=4381 Ack=1 Win=65335 Len=1460","1514","0.000000000","0.000001000","TCP"
"22","0.126471","0.000011000","0.000005000","0.000005000","10.1.1.2","10.22.1.2","0.000005000","51722  >  12001 [PSH, ACK] Seq=5841 Ack=1 Win=65335 Len=417","471","0.000000000","0.000005000","TCP"
"28","0.138433","0.011973000","0.011916000","0.003994000","10.1.1.2","10.22.1.2","0.011916000","51722  >  12001 [ACK] Seq=6258 Ack=4381 Win=65335 Len=0","60","0.000000000","0.003994000","TCP"
"30","0.146431","0.019971000","0.007957000","0.007957000","10.1.1.2","10.22.1.2","0.007957000","51722  >  12001 [ACK] Seq=6258 Ack=10221 Win=65335 Len=0","60","0.000000000","0.007957000","TCP"
"31","0.146433","0.019973000","0.000002000","0.000002000","10.1.1.2","10.22.1.2","0.000002000","51722  >  12001 [ACK] Seq=6258 Ack=14601 Win=65335 Len=0","60","0.000000000","0.000002000","TCP"
"52","0.282207","0.155747000","0.135715000","0.062572000","10.1.1.2","10.22.1.2","0.135715000","51722  >  12001 [PSH, ACK] Seq=6258 Ack=14601 Win=65335 Len=1197","1251","0.000000000","0.062572000","TCP"
"56","0.291516","0.165056000","0.009309000","0.003961000","10.1.1.2","10.22.1.2","0.009309000","51722  >  12001 [PSH, ACK] Seq=7455 Ack=18981 Win=65335 Len=156","210","0.000000000","0.003961000","TCP"
"61","0.307493","0.181033000","0.015941000","0.014608000","10.1.1.2","10.22.1.2","0.015941000","51722  >  12001 [ACK] Seq=7611 Ack=29201 Win=64970 Len=0","60","0.000000000","0.014608000","TCP"
"62","0.307495","0.181035000","0.000002000","0.000002000","10.1.1.2","10.22.1.2","0.000002000","[TCP Window Update] 51722  >  12001 [ACK] Seq=7611 Ack=29201 Win=65335 Len=0","60","0.000000000","0.000002000","TCP"
"64","0.322135","0.296848000","0.157660000","0.014603000","10.1.1.2","10.22.1.2","0.157660000","51723  >  12002 [ACK] Seq=1 Ack=2817 Win=16425 Len=0","60","0.000000000","0.014603000","TCP"
"80","0.445935","0.319475000","0.138403000","0.014617000","10.1.1.2","10.22.1.2","0.138403000","51722  >  12001 [PSH, ACK] Seq=7611 Ack=30661 Win=65335 Len=1236","1290","0.000000000","0.014617000","TCP"
"83","0.453923","0.327463000","0.007954000","0.007333000","10.1.1.2","10.22.1.2","0.007954000","51722  >  12001 [ACK] Seq=8847 Ack=35041 Win=65335 Len=0","60","0.000000000","0.007333000","TCP"
"85","0.463240","0.336780000","0.009290000","0.009290000","10.1.1.2","10.22.1.2","0.009290000","51722  >  12001 [PSH, ACK] Seq=8847 Ack=36501 Win=65335 Len=227","281","0.000000000","0.009290000","TCP"
"86","0.463241","0.336781000","0.000001000","0.000001000","10.1.1.2","10.22.1.2","0.000001000","51722  >  12001 [ACK] Seq=9074 Ack=45261 Win=65335 Len=0","60","0.000000000","0.000001000","TCP"
"96","0.592367","0.465907000","0.129089000","0.033279000","10.1.1.2","10.22.1.2","0.129089000","51722  >  12001 [PSH, ACK] Seq=9074 Ack=45261 Win=65335 Len=1460","1514","0.000000000","0.033279000","TCP"
"100","0.601687","0.475227000","0.009320000","0.003965000","10.1.1.2","10.22.1.2","0.009320000","51722  >  12001 [ACK] Seq=10534 Ack=45261 Win=65335 Len=1460","1514","0.000000000","0.003965000","TCP"
"101","0.601689","0.475229000","0.000002000","0.000002000","10.1.1.2","10.22.1.2","0.000002000","51722  >  12001 [ACK] Seq=11994 Ack=45261 Win=65335 Len=1460","1514","0.000000000","0.000002000","TCP"
"102","0.601691","0.475231000","0.000002000","0.000002000","10.1.1.2","10.22.1.2","0.000002000","51722  >  12001 [ACK] Seq=13454 Ack=45261 Win=65335 Len=1460","1514","0.000000000","0.000002000","TCP"
"103","0.601693","0.475233000","0.000002000","0.000002000","10.1.1.2","10.22.1.2","0.000002000","51722  >  12001 [PSH, ACK] Seq=14914 Ack=45261 Win=65335 Len=92","146","0.000000000","0.000002000","TCP"
"112","0.633143","0.506683000","0.031410000","0.002670000","10.1.1.2","10.22.1.2","0.031410000","51722  >  12001 [ACK] Seq=15006 Ack=51101 Win=65335 Len=0","60","0.000000000","0.002670000","TCP"
"113","0.633146","0.506686000","0.000003000","0.000003000","10.1.1.2","10.22.1.2","0.000003000","51722  >  12001 [ACK] Seq=15006 Ack=54021 Win=65335 Len=0","60","0.000000000","0.000003000","TCP"
"114","0.633146","0.506686000","0.000000000","0.000000000","10.1.1.2","10.22.1.2","0.000000000","51722  >  12001 [ACK] Seq=15006 Ack=56941 Win=64605 Len=0","60","0.000000000","0.000000000","TCP"
"115","0.633147","0.506687000","0.000001000","0.000001000","10.1.1.2","10.22.1.2","0.000001000","51722  >  12001 [ACK] Seq=15006 Ack=59861 Win=65335 Len=0","60","0.000000000","0.000001000","TCP"
"116","0.633147","0.506687000","0.000000000","0.000000000","10.1.1.2","10.22.1.2","0.000000000","[TCP Window Update] 51722  >  12001 [ACK] Seq=15006 Ack=59861 Win=63875 Len=0","60","0.000000000","0.000000000","TCP"
"117","0.633148","0.506688000","0.000001000","0.000001000","10.1.1.2","10.22.1.2","0.000001000","51722  >  12001 [PSH, ACK] Seq=15006 Ack=62781 Win=65335 Len=381","435","0.000000000","0.000001000","TCP"
"132","0.641123","0.615836000","0.152949000","0.005283000","10.1.1.2","10.22.1.2","0.152949000","51723  >  12002 [ACK] Seq=1 Ack=5509 Win=16425 Len=0","60","0.000000000","0.005283000","TCP"
"141","0.754282","0.627822000","0.121075000","0.021308000","10.1.1.2","10.22.1.2","0.121075000","51722  >  12001 [PSH, ACK] Seq=15387 Ack=62781 Win=65335 Len=833","887","0.000000000","0.021308000","TCP"
"144","0.784899","0.658439000","0.030617000","0.025298000","10.1.1.2","10.22.1.2","0.030617000","[TCP Dup ACK 117#1] 51722  >  12001 [ACK] Seq=16220 Ack=62781 Win=65335 Len=0 SLE=64241 SRE=65701","66","0.000000000","0.025298000","TCP"
"145","0.784901","0.658441000","0.000002000","0.000002000","10.1.1.2","10.22.1.2","0.000002000","51722  >  12001 [PSH, ACK] Seq=16220 Ack=62781 Win=65335 Len=482","536","0.000000000","0.000002000","TCP"
"148","0.786224","0.659764000","0.001270000","0.000495000","10.1.1.2","10.22.1.2","0.001270000","[TCP Dup ACK 117#2] 51722  >  12001 [ACK] Seq=16702 Ack=62781 Win=65335 Len=0 SLE=64241 SRE=67161","66","0.000000000","0.000495000","TCP"
"149","0.786225","0.659765000","0.000001000","0.000001000","10.1.1.2","10.22.1.2","0.000001000","[TCP Dup ACK 117#3] 51722  >  12001 [ACK] Seq=16702 Ack=62781 Win=65335 Len=0 SLE=64241 SRE=68621","66","0.000000000","0.000001000","TCP"
"151","0.787551","0.661091000","0.001294000","0.001294000","10.1.1.2","10.22.1.2","0.001294000","[TCP Dup ACK 117#4] 51722  >  12001 [ACK] Seq=16702 Ack=62781 Win=65335 Len=0 SLE=64241 SRE=70081","66","0.000000000","0.001294000","TCP"
"153","0.788881","0.662421000","0.001308000","0.001308000","10.1.1.2","10.22.1.2","0.001308000","51722  >  12001 [PSH, ACK] Seq=16702 Ack=62781 Win=65335 Len=172","226","0.000000000","0.001308000","TCP"
"161","0.820842","0.694382000","0.031961000","0.009916000","10.1.1.2","10.22.1.2","0.031961000","[TCP Dup ACK 117#5] 51722  >  12001 [ACK] Seq=16874 Ack=62781 Win=65335 Len=0 SLE=71541 SRE=73001 SLE=64241 SRE=70081","74","0.000000000","0.009916000","TCP"
"162","0.820843","0.694383000","0.000001000","0.000001000","10.1.1.2","10.22.1.2","0.000001000","[TCP Dup ACK 117#6] 51722  >  12001 [ACK] Seq=16874 Ack=62781 Win=65335 Len=0 SLE=71541 SRE=74461 SLE=64241 SRE=70081","74","0.000000000","0.000001000","TCP"
"163","0.820844","0.694384000","0.000001000","0.000001000","10.1.1.2","10.22.1.2","0.000001000","[TCP Dup ACK 117#7] 51722  >  12001 [ACK] Seq=16874 Ack=62781 Win=65335 Len=0 SLE=71541 SRE=75921 SLE=64241 SRE=70081","74","0.000000000","0.000001000","TCP"
"164","0.820844","0.694384000","0.000000000","0.000000000","10.1.1.2","10.22.1.2","0.000000000","[TCP Dup ACK 117#8] 51722  >  12001 [ACK] Seq=16874 Ack=62781 Win=65335 Len=0 SLE=71541 SRE=77381 SLE=64241 SRE=70081","74","0.000000000","0.000000000","TCP"
"165","0.820845","0.694385000","0.000001000","0.000001000","10.1.1.2","10.22.1.2","0.000001000","[TCP Dup ACK 117#9] 51722  >  12001 [ACK] Seq=16874 Ack=62781 Win=65335 Len=0 SLE=71541 SRE=78841 SLE=64241 SRE=70081","74","0.000000000","0.000001000","TCP"
"166","0.820845","0.694385000","0.000000000","0.000000000","10.1.1.2","10.22.1.2","0.000000000","[TCP Dup ACK 117#10] 51722  >  12001 [ACK] Seq=16874 Ack=62781 Win=65335 Len=0 SLE=71541 SRE=80301 SLE=64241 SRE=70081","74","0.000000000","0.000000000","TCP"
"167","0.820846","0.694386000","0.000001000","0.000001000","10.1.1.2","10.22.1.2","0.000001000","[TCP Dup ACK 117#11] 51722  >  12001 [ACK] Seq=16874 Ack=62781 Win=65335 Len=0 SLE=71541 SRE=81761 SLE=64241 SRE=70081","74","0.000000000","0.000001000","TCP"
"168","0.820846","0.694386000","0.000000000","0.000000000","10.1.1.2","10.22.1.2","0.000000000","51722  >  12001 [PSH, ACK] Seq=16874 Ack=62781 Win=65335 Len=177","231","0.000000000","0.000000000","TCP"
"169","0.820847","0.795560000","0.009921000","0.000001000","10.1.1.2","10.22.1.2","0.009921000","51723  >  12002 [ACK] Seq=1 Ack=6689 Win=16130 Len=0","60","0.000000000","0.000001000","TCP"
"187","0.937002","0.810542000","0.116047000","0.006610000","10.1.1.2","10.22.1.2","0.116047000","[TCP Dup ACK 117#12] 51722  >  12001 [ACK] Seq=17051 Ack=62781 Win=65335 Len=0 SLE=71541 SRE=83221 SLE=64241 SRE=70081","74","0.000000000","0.006610000","TCP"
"189","0.958307","0.831847000","0.021261000","0.021261000","10.1.1.2","10.22.1.2","0.021261000","[TCP Previous segment not captured] 51722  >  12001 [ACK] Seq=17819 Ack=70081 Win=65335 Len=0 SLE=71541 SRE=84681","66","0.000000000","0.021261000","TCP"
"195","0.966287","0.941000000","0.002513000","0.002513000","10.1.1.2","10.22.1.2","0.002513000","51723  >  12002 [ACK] Seq=1 Ack=8273 Win=16425 Len=0","60","0.000000000","0.002513000","TCP"
"196","0.974277","0.847817000","0.015927000","0.007990000","10.1.1.2","10.22.1.2","0.015927000","51722  >  12001 [ACK] Seq=17819 Ack=84681 Win=65335 Len=0","60","0.000000000","0.007990000","TCP"
"197","0.974278","0.847818000","0.000001000","0.000001000","10.1.1.2","10.22.1.2","0.000001000","51722  >  12001 [PSH, ACK] Seq=17819 Ack=89061 Win=64240 Len=493","547","0.000000000","0.000001000","TCP"
"198","0.974281","0.847821000","0.000003000","0.000003000","10.1.1.2","10.22.1.2","0.000003000","[TCP Window Update] 51722  >  12001 [ACK] Seq=18312 Ack=89061 Win=65108 Len=0","60","0.000000000","0.000003000","TCP"
"202","0.990250","0.863790000","0.015917000","0.003992000","10.1.1.2","10.22.1.2","0.015917000","51722  >  12001 [ACK] Seq=18312 Ack=91981 Win=65335 Len=0","60","0.000000000","0.003992000","TCP"
"212","1.059475","0.933015000","0.069197000","0.005288000","10.1.1.2","10.22.1.2","0.069197000","51722  >  12001 [PSH, ACK] Seq=18312 Ack=91981 Win=65335 Len=1460","1514","0.000000000","0.005288000","TCP"
"213","1.059477","0.933017000","0.000002000","0.000002000","10.1.1.2","10.22.1.2","0.000002000","51722  >  12001 [ACK] Seq=19772 Ack=91981 Win=65335 Len=1460","1514","0.000000000","0.000002000","TCP"
"214","1.059479","0.933019000","0.000002000","0.000002000","10.1.1.2","10.22.1.2","0.000002000","51722  >  12001 [ACK] Seq=21232 Ack=91981 Win=65335 Len=1460","1514","0.000000000","0.000002000","TCP"
"215","1.059481","0.933021000","0.000002000","0.000002000","10.1.1.2","10.22.1.2","0.000002000","51722  >  12001 [ACK] Seq=22692 Ack=91981 Win=65335 Len=1460","1514","0.000000000","0.000002000","TCP"
"216","1.059482","0.933022000","0.000001000","0.000001000","10.1.1.2","10.22.1.2","0.000001000","51722  >  12001 [PSH, ACK] Seq=24152 Ack=91981 Win=65335 Len=40","94","0.000000000","0.000001000","TCP"
"235","1.135354","1.008894000","0.075783000","0.013315000","10.1.1.2","10.22.1.2","0.075783000","51722  >  12001 [ACK] Seq=24192 Ack=93441 Win=65335 Len=0 SLE=94901 SRE=96361","66","0.000000000","0.013315000","TCP"
"236","1.135355","1.008895000","0.000001000","0.000001000","10.1.1.2","10.22.1.2","0.000001000","[TCP Dup ACK 235#1] 51722  >  12001 [ACK] Seq=24192 Ack=93441 Win=65335 Len=0 SLE=94901 SRE=97821","66","0.000000000","0.000001000","TCP"
"237","1.135356","1.110069000","0.169069000","0.000001000","10.1.1.2","10.22.1.2","0.169069000","51723  >  12002 [ACK] Seq=1 Ack=9857 Win=16425 Len=0","60","0.000000000","0.000001000","TCP"
"238","1.135356","1.008896000","0.000001000","0.000000000","10.1.1.2","10.22.1.2","0.000001000","51722  >  12001 [PSH, ACK] Seq=24192 Ack=93441 Win=65335 Len=555","609","0.000000000","0.000000000","TCP"
"239","1.135358","1.008898000","0.000002000","0.000002000","10.1.1.2","10.22.1.2","0.000002000","[TCP Dup ACK 235#2] 51722  >  12001 [ACK] Seq=24747 Ack=93441 Win=65335 Len=0 SLE=94901 SRE=99281","66","0.000000000","0.000002000","TCP"
"244","1.159311","1.032851000","0.023863000","0.023845000","10.1.1.2","10.22.1.2","0.023863000","[TCP Dup ACK 235#3] 51722  >  12001 [ACK] Seq=24747 Ack=93441 Win=65335 Len=0 SLE=94901 SRE=100741","66","0.000000000","0.023845000","TCP"
"245","1.159313","1.032853000","0.000002000","0.000002000","10.1.1.2","10.22.1.2","0.000002000","[TCP Dup ACK 235#4] 51722  >  12001 [ACK] Seq=24747 Ack=93441 Win=65335 Len=0 SLE=94901 SRE=102201","66","0.000000000","0.000002000","TCP"
"257","1.212558","1.086098000","0.053186000","0.013284000","10.1.1.2","10.22.1.2","0.053186000","[TCP Retransmission] 51722  >  12001 [PSH, ACK] Seq=17051 Ack=93441 Win=65335 Len=1460","1514","0.000000000","0.013284000","TCP"
"271","1.288439","1.161979000","0.075839000","0.022634000","10.1.1.2","10.22.1.2","0.075839000","[TCP Previous segment not captured] 51722  >  12001 [ACK] Seq=24908 Ack=93441 Win=65335 Len=0 SLE=94901 SRE=103661","66","0.000000000","0.022634000","TCP"
"272","1.288440","1.161980000","0.000001000","0.000001000","10.1.1.2","10.22.1.2","0.000001000","51722  >  12001 [PSH, ACK] Seq=24908 Ack=93441 Win=65335 Len=425","479","0.000000000","0.000001000","TCP"
"273","1.288442","1.161982000","0.000002000","0.000002000","10.1.1.2","10.22.1.2","0.000002000","[TCP Dup ACK 235#5] 51722  >  12001 [ACK] Seq=25333 Ack=93441 Win=65335 Len=0 SLE=94901 SRE=105121","66","0.000000000","0.000002000","TCP"
"278","1.323047","1.196587000","0.034536000","0.019434000","10.1.1.2","10.22.1.2","0.034536000","[TCP Dup ACK 235#6] 51722  >  12001 [ACK] Seq=25333 Ack=93441 Win=65335 Len=0 SLE=94901 SRE=106581","66","0.000000000","0.019434000","TCP"
"279","1.323049","1.196589000","0.000002000","0.000002000","10.1.1.2","10.22.1.2","0.000002000","51722  >  12001 [ACK] Seq=25333 Ack=106581 Win=65335 Len=0","60","0.000000000","0.000002000","TCP"
"281","1.324375","1.197915000","0.001299000","0.001299000","10.1.1.2","10.22.1.2","0.001299000","51722  >  12001 [ACK] Seq=25333 Ack=108041 Win=65335 Len=0","60","0.000000000","0.001299000","TCP"
"287","1.366982","1.240522000","0.042588000","0.007992000","10.1.1.2","10.22.1.2","0.042588000","51722  >  12001 [ACK] Seq=25333 Ack=108041 Win=65335 Len=1460","1514","0.000000000","0.007992000","TCP"
"288","1.366987","1.240527000","0.000005000","0.000005000","10.1.1.2","10.22.1.2","0.000005000","51722  >  12001 [PSH, ACK] Seq=26793 Ack=108041 Win=65335 Len=450","504","0.000000000","0.000005000","TCP"
"299","1.444190","1.317730000","0.077135000","0.007913000","10.1.1.2","10.22.1.2","0.077135000","51722  >  12001 [PSH, ACK] Seq=27243 Ack=110961 Win=65335 Len=643","697","0.000000000","0.007913000","TCP"
"302","1.460164","1.434877000","0.156551000","0.015910000","10.1.1.2","10.22.1.2","0.156551000","[TCP Dup ACK 237#1] 51723  >  12002 [ACK] Seq=1 Ack=9857 Win=16425 Len=0 SLE=11265 SRE=12725","66","0.000000000","0.015910000","TCP"
"303","1.460165","1.434878000","0.000001000","0.000001000","10.1.1.2","10.22.1.2","0.000001000","[TCP Dup ACK 237#2] 51723  >  12002 [ACK] Seq=1 Ack=9857 Win=16425 Len=0 SLE=11265 SRE=12849","66","0.000000000","0.000001000","TCP"
"304","1.477476","1.351016000","0.033222000","0.017311000","10.1.1.2","10.22.1.2","0.033222000","51722  >  12001 [PSH, ACK] Seq=27886 Ack=112421 Win=65335 Len=150","204","0.000000000","0.017311000","TCP"
"313","1.517397","1.390937000","0.039825000","0.010229000","10.1.1.2","10.22.1.2","0.039825000","[TCP Retransmission] 51722  >  12001 [PSH, ACK] Seq=24747 Ack=113881 Win=65335 Len=161","215","0.000000000","0.010229000","TCP"
"323","1.529380","1.402920000","0.011934000","0.005327000","10.1.1.2","10.22.1.2","0.011934000","51722  >  12001 [PSH, ACK] Seq=28036 Ack=113881 Win=65335 Len=1460","1514","0.000000000","0.005327000","TCP"
"324","1.529383","1.402923000","0.000003000","0.000003000","10.1.1.2","10.22.1.2","0.000003000","51722  >  12001 [ACK] Seq=29496 Ack=113881 Win=65335 Len=1460","1514","0.000000000","0.000003000","TCP"
"326","1.533374","1.406914000","0.003960000","0.003960000","10.1.1.2","10.22.1.2","0.003960000","51722  >  12001 [ACK] Seq=30956 Ack=113881 Win=65335 Len=1460","1514","0.000000000","0.003960000","TCP"
"327","1.533378","1.406918000","0.000004000","0.000004000","10.1.1.2","10.22.1.2","0.000004000","51722  >  12001 [ACK] Seq=32416 Ack=113881 Win=65335 Len=1460","1514","0.000000000","0.000004000","TCP"
"328","1.533380","1.406920000","0.000002000","0.000002000","10.1.1.2","10.22.1.2","0.000002000","51722  >  12001 [PSH, ACK] Seq=33876 Ack=113881 Win=65335 Len=178","232","0.000000000","0.000002000","TCP"
"346","1.597270","1.470810000","0.063861000","0.001328000","10.1.1.2","10.22.1.2","0.063861000","51722  >  12001 [ACK] Seq=34054 Ack=116801 Win=65335 Len=0","60","0.000000000","0.001328000","TCP"
"352","1.659836","1.634549000","0.152668000","0.037274000","10.1.1.2","10.22.1.2","0.152668000","[TCP Dup ACK 237#3] 51723  >  12002 [ACK] Seq=1 Ack=9857 Win=16425 Len=0 SLE=11265 SRE=14309","66","0.000000000","0.037274000","TCP"
"353","1.659840","1.634553000","0.000004000","0.000004000","10.1.1.2","10.22.1.2","0.000004000","[TCP Dup ACK 237#4] 51723  >  12002 [ACK] Seq=1 Ack=9857 Win=16425 Len=0 SLE=11265 SRE=14433","66","0.000000000","0.000004000","TCP"
"355","1.669152","1.542692000","0.071838000","0.009265000","10.1.1.2","10.22.1.2","0.071838000","51722  >  12001 [ACK] Seq=34054 Ack=119721 Win=65335 Len=0","60","0.000000000","0.009265000","TCP"
"359","1.682463","1.556003000","0.013287000","0.004816000","10.1.1.2","10.22.1.2","0.013287000","51722  >  12001 [PSH, ACK] Seq=34054 Ack=119721 Win=65335 Len=1071","1125","0.000000000","0.004816000","TCP"
"361","1.685127","1.558667000","0.002664000","0.001965000","10.1.1.2","10.22.1.2","0.002664000","51722  >  12001 [PSH, ACK] Seq=35125 Ack=119721 Win=65335 Len=159","213","0.000000000","0.001965000","TCP"
"371","1.750357","1.623897000","0.065206000","0.003995000","10.1.1.2","10.22.1.2","0.065206000","51722  >  12001 [PSH, ACK] Seq=35284 Ack=122641 Win=65335 Len=666","720","0.000000000","0.003995000","TCP"
"382","1.822239","1.796952000","0.115792000","0.002653000","10.1.1.2","10.22.1.2","0.115792000","51723  >  12002 [ACK] Seq=1 Ack=14433 Win=16425 Len=0 SLE=11265 SRE=11317","66","0.000000000","0.002653000","TCP"
"384","1.824900","1.698440000","0.074496000","0.002586000","10.1.1.2","10.22.1.2","0.074496000","51722  >  12001 [PSH, ACK] Seq=35950 Ack=127021 Win=65335 Len=710","764","0.000000000","0.002586000","TCP"
"388","1.838216","1.812929000","0.015902000","0.009320000","10.1.1.2","10.22.1.2","0.015902000","51723  >  12002 [ACK] Seq=1 Ack=16017 Win=16425 Len=0","60","0.000000000","0.009320000","TCP"
"390","1.856864","1.831577000","0.018606000","0.018606000","10.1.1.2","10.22.1.2","0.018606000","[TCP Dup ACK 388#1] 51723  >  12002 [ACK] Seq=1 Ack=16017 Win=16425 Len=0 SLE=9857 SRE=11317","66","0.000000000","0.018606000","TCP"
"395","1.902110","1.775650000","0.077171000","0.011980000","10.1.1.2","10.22.1.2","0.077171000","51722  >  12001 [PSH, ACK] Seq=36660 Ack=128481 Win=65335 Len=323","377","0.000000000","0.011980000","TCP"
"398","1.912759","1.786299000","0.010603000","0.009972000","10.1.1.2","10.22.1.2","0.010603000","51722  >  12001 [ACK] Seq=36983 Ack=131401 Win=65335 Len=0","60","0.000000000","0.009972000","TCP"
"405","1.979326","1.954039000","0.122462000","0.000002000","10.1.1.2","10.22.1.2","0.122462000","[TCP Dup ACK 388#2] 51723  >  12002 [ACK] Seq=1 Ack=16017 Win=16425 Len=0 SLE=14433 SRE=15893","66","0.000000000","0.000002000","TCP"
"406","1.979327","1.954040000","0.000001000","0.000001000","10.1.1.2","10.22.1.2","0.000001000","[TCP ACKed unseen segment] 51723  >  12002 [ACK] Seq=1 Ack=17073 Win=16161 Len=0 SLE=15893 SRE=16017","66","0.000000000","0.000001000","TCP"
"407","1.979327","1.852867000","0.066537000","0.000000000","10.1.1.2","10.22.1.2","0.066537000","51722  >  12001 [PSH, ACK] Seq=36983 Ack=132861 Win=65335 Len=601","655","0.000000000","0.000000000","TCP"
"412","1.987306","1.860846000","0.007867000","0.007092000","10.1.1.2","10.22.1.2","0.007867000","51722  >  12001 [ACK] Seq=37584 Ack=135781 Win=65335 Len=0","60","0.000000000","0.007092000","TCP"
"420","2.021917","1.895457000","0.034584000","0.002663000","10.1.1.2","10.22.1.2","0.034584000","51722  >  12001 [ACK] Seq=37584 Ack=135781 Win=65335 Len=1460","1514","0.000000000","0.002663000","TCP"
"421","2.021918","1.895458000","0.000001000","0.000001000","10.1.1.2","10.22.1.2","0.000001000","51722  >  12001 [ACK] Seq=39044 Ack=135781 Win=65335 Len=1460","1514","0.000000000","0.000001000","TCP"
"423","2.023249","1.896789000","0.001303000","0.001303000","10.1.1.2","10.22.1.2","0.001303000","51722  >  12001 [ACK] Seq=40504 Ack=135781 Win=65335 Len=1460","1514","0.000000000","0.001303000","TCP"
"424","2.023251","1.896791000","0.000002000","0.000002000","10.1.1.2","10.22.1.2","0.000002000","51722  >  12001 [PSH, ACK] Seq=41964 Ack=135781 Win=65335 Len=1008","1062","0.000000000","0.000002000","TCP"
"442","2.075166","1.948706000","0.051892000","0.009319000","10.1.1.2","10.22.1.2","0.051892000","51722  >  12001 [PSH, ACK] Seq=42972 Ack=137241 Win=65335 Len=572","626","0.000000000","0.009319000","TCP"
"443","2.075167","1.948707000","0.000001000","0.000001000","10.1.1.2","10.22.1.2","0.000001000","51722  >  12001 [ACK] Seq=43544 Ack=140161 Win=65335 Len=0","60","0.000000000","0.000001000","TCP"
"449","2.144387","2.119100000","0.164965000","0.021300000","10.1.1.2","10.22.1.2","0.164965000","51723  >  12002 [ACK] Seq=1 Ack=18657 Win=16425 Len=0","60","0.000000000","0.021300000","TCP"
"450","2.144388","2.017928000","0.069184000","0.000001000","10.1.1.2","10.22.1.2","0.069184000","51722  >  12001 [PSH, ACK] Seq=43544 Ack=143081 Win=65335 Len=319","373","0.000000000","0.000001000","TCP"
"454","2.148378","2.021918000","0.003924000","0.003261000","10.1.1.2","10.22.1.2","0.003924000","51722  >  12001 [PSH, ACK] Seq=43863 Ack=144541 Win=65335 Len=152","206","0.000000000","0.003261000","TCP"
"456","2.176337","2.049877000","0.027931000","0.027931000","10.1.1.2","10.22.1.2","0.027931000","51722  >  12001 [PSH, ACK] Seq=44015 Ack=146001 Win=65335 Len=152","206","0.000000000","0.027931000","TCP"
"468","2.226925","2.100465000","0.050544000","0.000002000","10.1.1.2","10.22.1.2","0.050544000","51722  >  12001 [PSH, ACK] Seq=44167 Ack=148921 Win=65335 Len=575","629","0.000000000","0.000002000","TCP"
"475","2.300133","2.173673000","0.073159000","0.011936000","10.1.1.2","10.22.1.2","0.073159000","51722  >  12001 [PSH, ACK] Seq=44742 Ack=154761 Win=65335 Len=623","677","0.000000000","0.011936000","TCP"
"481","2.329420","2.202960000","0.029252000","0.017271000","10.1.1.2","10.22.1.2","0.029252000","51722  >  12001 [PSH, ACK] Seq=45365 Ack=157681 Win=65335 Len=276","330","0.000000000","0.017271000","TCP"
"486","2.382668","2.256208000","0.053217000","0.013304000","10.1.1.2","10.22.1.2","0.053217000","51722  >  12001 [PSH, ACK] Seq=45641 Ack=160601 Win=65335 Len=367","421","0.000000000","0.013304000","TCP"
"497","2.457217","2.330757000","0.074508000","0.030621000","10.1.1.2","10.22.1.2","0.074508000","51722  >  12001 [PSH, ACK] Seq=46008 Ack=164981 Win=65335 Len=316","370","0.000000000","0.030621000","TCP"
"500","2.459874","2.434587000","0.152345000","0.001923000","10.1.1.2","10.22.1.2","0.152345000","51723  >  12002 [ACK] Seq=1 Ack=21649 Win=16425 Len=0","60","0.000000000","0.001923000","TCP"
"502","2.470527","2.344067000","0.013261000","0.010618000","10.1.1.2","10.22.1.2","0.013261000","51722  >  12001 [ACK] Seq=46324 Ack=166441 Win=65335 Len=1460","1514","0.000000000","0.010618000","TCP"
"503","2.470530","2.344070000","0.000003000","0.000003000","10.1.1.2","10.22.1.2","0.000003000","51722  >  12001 [ACK] Seq=47784 Ack=166441 Win=65335 Len=1460","1514","0.000000000","0.000003000","TCP"
"504","2.470531","2.344071000","0.000001000","0.000001000","10.1.1.2","10.22.1.2","0.000001000","51722  >  12001 [ACK] Seq=49244 Ack=166441 Win=65335 Len=1460","1514","0.000000000","0.000001000","TCP"
"505","2.470532","2.344072000","0.000001000","0.000001000","10.1.1.2","10.22.1.2","0.000001000","51722  >  12001 [PSH, ACK] Seq=50704 Ack=166441 Win=65335 Len=866","920","0.000000000","0.000001000","TCP"
"509","2.479844","2.353384000","0.009263000","0.008170000","10.1.1.2","10.22.1.2","0.009263000","[TCP Dup ACK 502#1] 51722  >  12001 [ACK] Seq=51570 Ack=166441 Win=65335 Len=0 SLE=167901 SRE=169361","66","0.000000000","0.008170000","TCP"
"513","2.493160","2.366700000","0.013279000","0.006662000","10.1.1.2","10.22.1.2","0.013279000","[TCP Dup ACK 502#2] 51722  >  12001 [ACK] Seq=51570 Ack=166441 Win=65335 Len=0 SLE=167901 SRE=170821","66","0.000000000","0.006662000","TCP"
"531","2.549066","2.422606000","0.055860000","0.010602000","10.1.1.2","10.22.1.2","0.055860000","[TCP Dup ACK 502#3] 51722  >  12001 [ACK] Seq=51570 Ack=166441 Win=65335 Len=0 SLE=172281 SRE=173741 SLE=167901 SRE=170821","74","0.000000000","0.010602000","TCP"
"532","2.549068","2.422608000","0.000002000","0.000002000","10.1.1.2","10.22.1.2","0.000002000","51722  >  12001 [PSH, ACK] Seq=51570 Ack=166441 Win=65335 Len=494","548","0.000000000","0.000002000","TCP"
"542","2.611630","2.485170000","0.062522000","0.006622000","10.1.1.2","10.22.1.2","0.062522000","[TCP Dup ACK 502#4] 51722  >  12001 [ACK] Seq=52064 Ack=166441 Win=65335 Len=0 SLE=172281 SRE=175201 SLE=167901 SRE=170821","74","0.000000000","0.006622000","TCP"
"543","2.611632","2.485172000","0.000002000","0.000002000","10.1.1.2","10.22.1.2","0.000002000","[TCP Dup ACK 502#5] 51722  >  12001 [ACK] Seq=52064 Ack=166441 Win=65335 Len=0 SLE=172281 SRE=176661 SLE=167901 SRE=170821","74","0.000000000","0.000002000","TCP"
"544","2.611632","2.485172000","0.000000000","0.000000000","10.1.1.2","10.22.1.2","0.000000000","[TCP Dup ACK 502#6] 51722  >  12001 [ACK] Seq=52064 Ack=166441 Win=65335 Len=0 SLE=172281 SRE=178121 SLE=167901 SRE=170821","74","0.000000000","0.000000000","TCP"
"548","2.612961","2.486501000","0.001264000","0.001264000","10.1.1.2","10.22.1.2","0.001264000","51722  >  12001 [PSH, ACK] Seq=52064 Ack=166441 Win=65335 Len=690","744","0.000000000","0.001264000","TCP"
"550","2.622281","2.495821000","0.009320000","0.008589000","10.1.1.2","10.22.1.2","0.009320000","[TCP Dup ACK 502#7] 51722  >  12001 [ACK] Seq=52754 Ack=166441 Win=65335 Len=0 SLE=172281 SRE=179581 SLE=167901 SRE=170821","74","0.000000000","0.008589000","TCP"
"551","2.622282","2.495822000","0.000001000","0.000001000","10.1.1.2","10.22.1.2","0.000001000","[TCP Dup ACK 502#8] 51722  >  12001 [ACK] Seq=52754 Ack=166441 Win=65335 Len=0 SLE=172281 SRE=180892 SLE=167901 SRE=170821","74","0.000000000","0.000001000","TCP"
"556","2.632930","2.506470000","0.010618000","0.005300000","10.1.1.2","10.22.1.2","0.010618000","51722  >  12001 [PSH, ACK] Seq=52754 Ack=166441 Win=65335 Len=377","431","0.000000000","0.005300000","TCP"
"558","2.652895","2.526435000","0.019965000","0.005502000","10.1.1.2","10.22.1.2","0.019965000","[TCP Dup ACK 502#9] 51722  >  12001 [ACK] Seq=53131 Ack=166441 Win=65335 Len=0 SLE=172281 SRE=183812 SLE=167901 SRE=170821","74","0.000000000","0.005502000","TCP"
"564","2.700820","2.574360000","0.047899000","0.011980000","10.1.1.2","10.22.1.2","0.047899000","51722  >  12001 [ACK] Seq=53131 Ack=170821 Win=65335 Len=0 SLE=172281 SRE=183812","66","0.000000000","0.011980000","TCP"
"566","2.767381","2.640921000","0.066529000","0.066529000","10.1.1.2","10.22.1.2","0.066529000","51722  >  12001 [ACK] Seq=53131 Ack=183812 Win=65335 Len=0","60","0.000000000","0.066529000","TCP"
"567","2.767383","2.640923000","0.000002000","0.000002000","10.1.1.2","10.22.1.2","0.000002000","51722  >  12001 [PSH, ACK] Seq=53131 Ack=183812 Win=65335 Len=927","981","0.000000000","0.000002000","TCP"
"568","2.767385","2.640925000","0.000002000","0.000002000","10.1.1.2","10.22.1.2","0.000002000","51722  >  12001 [ACK] Seq=54058 Ack=186732 Win=65335 Len=0","60","0.000000000","0.000002000","TCP"
"583","2.823291","2.798004000","0.175898000","0.015949000","10.1.1.2","10.22.1.2","0.175898000","51723  >  12002 [ACK] Seq=1 Ack=24341 Win=16425 Len=0","60","0.000000000","0.015949000","TCP"
"584","2.823292","2.696832000","0.055863000","0.000001000","10.1.1.2","10.22.1.2","0.055863000","51722  >  12001 [PSH, ACK] Seq=54058 Ack=189652 Win=65335 Len=171","225","0.000000000","0.000001000","TCP"
"592","2.861893","2.735433000","0.038521000","0.030587000","10.1.1.2","10.22.1.2","0.038521000","51722  >  12001 [PSH, ACK] Seq=54229 Ack=191112 Win=65335 Len=471","525","0.000000000","0.030587000","TCP"
"596","2.916472","2.790012000","0.054547000","0.053249000","10.1.1.2","10.22.1.2","0.054547000","51722  >  12001 [PSH, ACK] Seq=54700 Ack=191112 Win=65335 Len=1460","1514","0.000000000","0.053249000","TCP"
"597","2.917806","2.791346000","0.001334000","0.001334000","10.1.1.2","10.22.1.2","0.001334000","51722  >  12001 [ACK] Seq=56160 Ack=191112 Win=65335 Len=1460","1514","0.000000000","0.001334000","TCP"
"598","2.917811","2.791351000","0.000005000","0.000005000","10.1.1.2","10.22.1.2","0.000005000","51722  >  12001 [ACK] Seq=57620 Ack=191112 Win=65335 Len=1460","1514","0.000000000","0.000005000","TCP"
"599","2.917812","2.791352000","0.000001000","0.000001000","10.1.1.2","10.22.1.2","0.000001000","51722  >  12001 [ACK] Seq=59080 Ack=191112 Win=65335 Len=1460","1514","0.000000000","0.000001000","TCP"
"600","2.917814","2.791354000","0.000002000","0.000002000","10.1.1.2","10.22.1.2","0.000002000","51722  >  12001 [PSH, ACK] Seq=60540 Ack=191112 Win=65335 Len=12","66","0.000000000","0.000002000","TCP"
"603","2.924457","2.797997000","0.006613000","0.005220000","10.1.1.2","10.22.1.2","0.006613000","51722  >  12001 [ACK] Seq=60552 Ack=194032 Win=65335 Len=0","60","0.000000000","0.005220000","TCP"
"623","2.975043","2.949756000","0.005293000","0.005293000","10.1.1.2","10.22.1.2","0.005293000","51723  >  12002 [ACK] Seq=1 Ack=25873 Win=16425 Len=0","60","0.000000000","0.005293000","TCP"
"624","2.975045","2.848585000","0.050563000","0.000002000","10.1.1.2","10.22.1.2","0.050563000","51722  >  12001 [PSH, ACK] Seq=60552 Ack=195492 Win=65335 Len=372","426","0.000000000","0.000002000","TCP"
"632","3.068236","2.941776000","0.093142000","0.046596000","10.1.1.2","10.22.1.2","0.093142000","[TCP Previous segment not captured] 51722  >  12001 [PSH, ACK] Seq=61076 Ack=198412 Win=65335 Len=554","608","0.000000000","0.046596000","TCP"
"639","3.093524","2.967064000","0.025215000","0.017227000","10.1.1.2","10.22.1.2","0.025215000","51722  >  12001 [ACK] Seq=61630 Ack=202792 Win=65335 Len=0","60","0.000000000","0.017227000","TCP"
"645","3.133454","3.108167000","0.158411000","0.010646000","10.1.1.2","10.22.1.2","0.158411000","51723  >  12002 [ACK] Seq=1 Ack=27457 Win=16425 Len=0","60","0.000000000","0.010646000","TCP"
"647","3.134782","3.008322000","0.041209000","0.001288000","10.1.1.2","10.22.1.2","0.041209000","51722  >  12001 [PSH, ACK] Seq=61630 Ack=204252 Win=65335 Len=836","890","0.000000000","0.001288000","TCP"
"657","3.227970","3.101510000","0.093139000","0.009319000","10.1.1.2","10.22.1.2","0.093139000","51722  >  12001 [PSH, ACK] Seq=62466 Ack=207172 Win=65335 Len=740","794","0.000000000","0.009319000","TCP"
"660","3.257254","3.130794000","0.029231000","0.029231000","10.1.1.2","10.22.1.2","0.029231000","51722  >  12001 [ACK] Seq=63206 Ack=213012 Win=65335 Len=0","60","0.000000000","0.029231000","TCP"
"666","3.309169","3.182709000","0.051880000","0.015936000","10.1.1.2","10.22.1.2","0.051880000","51722  >  12001 [PSH, ACK] Seq=63206 Ack=214472 Win=65335 Len=669","723","0.000000000","0.015936000","TCP"
"677","3.381061","3.254601000","0.071846000","0.021274000","10.1.1.2","10.22.1.2","0.071846000","51722  >  12001 [PSH, ACK] Seq=63875 Ack=217392 Win=65335 Len=721","775","0.000000000","0.021274000","TCP"
"681","3.391707","3.265247000","0.010575000","0.003992000","10.1.1.2","10.22.1.2","0.010575000","51722  >  12001 [ACK] Seq=64596 Ack=217392 Win=65335 Len=1460","1514","0.000000000","0.003992000","TCP"
"682","3.391710","3.265250000","0.000003000","0.000003000","10.1.1.2","10.22.1.2","0.000003000","51722  >  12001 [ACK] Seq=66056 Ack=217392 Win=65335 Len=1460","1514","0.000000000","0.000003000","TCP"
"685","3.393036","3.266576000","0.001267000","0.001267000","10.1.1.2","10.22.1.2","0.001267000","51722  >  12001 [ACK] Seq=67516 Ack=217392 Win=65335 Len=1460","1514","0.000000000","0.001267000","TCP"
"686","3.393038","3.266578000","0.000002000","0.000002000","10.1.1.2","10.22.1.2","0.000002000","51722  >  12001 [PSH, ACK] Seq=68976 Ack=217392 Win=65335 Len=945","999","0.000000000","0.000002000","TCP"
"692","3.418332","3.291872000","0.025251000","0.017281000","10.1.1.2","10.22.1.2","0.025251000","51722  >  12001 [ACK] Seq=69921 Ack=221772 Win=65335 Len=0","60","0.000000000","0.017281000","TCP"
"703","3.427654","3.301194000","0.009281000","0.000001000","10.1.1.2","10.22.1.2","0.009281000","[TCP Dup ACK 692#1] 51722  >  12001 [ACK] Seq=69921 Ack=221772 Win=65335 Len=0 SLE=223232 SRE=224692","66","0.000000000","0.000001000","TCP"
"711","3.459595","3.333135000","0.031876000","0.003985000","10.1.1.2","10.22.1.2","0.031876000","[TCP Dup ACK 692#2] 51722  >  12001 [ACK] Seq=69921 Ack=221772 Win=65335 Len=0 SLE=223232 SRE=226152","66","0.000000000","0.003985000","TCP"
"713","3.472909","3.447622000","0.162371000","0.013274000","10.1.1.2","10.22.1.2","0.162371000","51723  >  12002 [ACK] Seq=1 Ack=30325 Win=16425 Len=0","60","0.000000000","0.013274000","TCP"
"715","3.535484","3.409024000","0.075849000","0.062529000","10.1.1.2","10.22.1.2","0.075849000","[TCP Dup ACK 692#3] 51722  >  12001 [ACK] Seq=69921 Ack=221772 Win=65335 Len=0 SLE=223232 SRE=227612","66","0.000000000","0.062529000","TCP"
"716","3.535487","3.409027000","0.000003000","0.000003000","10.1.1.2","10.22.1.2","0.000003000","[TCP Dup ACK 692#4] 51722  >  12001 [ACK] Seq=69921 Ack=221772 Win=65335 Len=0 SLE=223232 SRE=229072","66","0.000000000","0.000003000","TCP"
"719","3.544788","3.418328000","0.009217000","0.009217000","10.1.1.2","10.22.1.2","0.009217000","[TCP Fast Retransmission] 51722  >  12001 [PSH, ACK] Seq=60924 Ack=221772 Win=65335 Len=1460","1514","0.000000000","0.009217000","TCP"
"728","3.570085","3.443625000","0.025249000","0.003995000","10.1.1.2","10.22.1.2","0.025249000","[TCP Dup ACK 692#5] 51722  >  12001 [ACK] Seq=69921 Ack=221772 Win=65335 Len=0 SLE=223232 SRE=230532","66","0.000000000","0.003995000","TCP"
"729","3.570086","3.443626000","0.000001000","0.000001000","10.1.1.2","10.22.1.2","0.000001000","[TCP Dup ACK 692#6] 51722  >  12001 [ACK] Seq=69921 Ack=221772 Win=65335 Len=0 SLE=223232 SRE=231992","66","0.000000000","0.000001000","TCP"
"730","3.570087","3.443627000","0.000001000","0.000001000","10.1.1.2","10.22.1.2","0.000001000","[TCP Dup ACK 692#7] 51722  >  12001 [ACK] Seq=69921 Ack=221772 Win=65335 Len=0 SLE=223232 SRE=233452","66","0.000000000","0.000001000","TCP"
"734","3.579397","3.452937000","0.009234000","0.009234000","10.1.1.2","10.22.1.2","0.009234000","[TCP Dup ACK 692#8] 51722  >  12001 [ACK] Seq=69921 Ack=221772 Win=65335 Len=0 SLE=223232 SRE=234912","66","0.000000000","0.009234000","TCP"
"739","3.612678","3.486218000","0.033261000","0.010614000","10.1.1.2","10.22.1.2","0.033261000","[TCP Dup ACK 692#9] 51722  >  12001 [ACK] Seq=69921 Ack=221772 Win=65335 Len=0 SLE=223232 SRE=236372","66","0.000000000","0.010614000","TCP"
"746","3.629984","3.604697000","0.157029000","0.009276000","10.1.1.2","10.22.1.2","0.157029000","51723  >  12002 [ACK] Seq=1 Ack=31681 Win=16086 Len=0","60","0.000000000","0.009276000","TCP"
"748","3.635309","3.508849000","0.022605000","0.005289000","10.1.1.2","10.22.1.2","0.022605000","[TCP Spurious Retransmission] 51722  >  12001 [PSH, ACK] Seq=60924 Ack=221772 Win=65335 Len=1460","1514","0.000000000","0.005289000","TCP"
"754","3.688557","3.562097000","0.053225000","0.027953000","10.1.1.2","10.22.1.2","0.053225000","51722  >  12001 [ACK] Seq=62384 Ack=236372 Win=65335 Len=0","60","0.000000000","0.027953000","TCP"
"755","3.708526","3.582066000","0.019969000","0.019969000","10.1.1.2","10.22.1.2","0.019969000","51722  >  12001 [ACK] Seq=69921 Ack=237832 Win=65335 Len=1460","1514","0.000000000","0.019969000","TCP"
"756","3.708528","3.582068000","0.000002000","0.000002000","10.1.1.2","10.22.1.2","0.000002000","51722  >  12001 [PSH, ACK] Seq=71381 Ack=237832 Win=65335 Len=1224","1278","0.000000000","0.000002000","TCP"
"763","3.732484","3.606024000","0.023922000","0.014640000","10.1.1.2","10.22.1.2","0.023922000","51722  >  12001 [ACK] Seq=72605 Ack=242212 Win=65335 Len=0","60","0.000000000","0.014640000","TCP"
"765","3.733815","3.607355000","0.001307000","0.001307000","10.1.1.2","10.22.1.2","0.001307000","51722  >  12001 [PSH, ACK] Seq=72605 Ack=243672 Win=65335 Len=167","221","0.000000000","0.001307000","TCP"
"771","3.768428","3.641968000","0.034586000","0.030588000","10.1.1.2","10.22.1.2","0.034586000","51722  >  12001 [PSH, ACK] Seq=72772 Ack=245132 Win=65335 Len=160","214","0.000000000","0.030588000","TCP"
"786","3.858948","3.732488000","0.090487000","0.001331000","10.1.1.2","10.22.1.2","0.090487000","51722  >  12001 [PSH, ACK] Seq=72932 Ack=245132 Win=65335 Len=1460","1514","0.000000000","0.001331000","TCP"
"788","3.860279","3.733819000","0.001331000","0.000697000","10.1.1.2","10.22.1.2","0.001331000","51722  >  12001 [ACK] Seq=74392 Ack=245132 Win=65335 Len=1460","1514","0.000000000","0.000697000","TCP"
"790","3.861612","3.735152000","0.001306000","0.001306000","10.1.1.2","10.22.1.2","0.001306000","51722  >  12001 [ACK] Seq=75852 Ack=245132 Win=65335 Len=1460","1514","0.000000000","0.001306000","TCP"
"791","3.861615","3.735155000","0.000003000","0.000003000","10.1.1.2","10.22.1.2","0.000003000","51722  >  12001 [ACK] Seq=77312 Ack=245132 Win=65335 Len=1460","1514","0.000000000","0.000003000","TCP"
"792","3.861617","3.735157000","0.000002000","0.000002000","10.1.1.2","10.22.1.2","0.000002000","51722  >  12001 [PSH, ACK] Seq=78772 Ack=245132 Win=65335 Len=62","116","0.000000000","0.000002000","TCP"
"797","3.886905","3.760445000","0.025263000","0.019969000","10.1.1.2","10.22.1.2","0.025263000","51722  >  12001 [ACK] Seq=78834 Ack=248052 Win=65335 Len=0","60","0.000000000","0.019969000","TCP"
"798","3.886907","3.760447000","0.000002000","0.000002000","10.1.1.2","10.22.1.2","0.000002000","[TCP Dup ACK 797#1] 51722  >  12001 [ACK] Seq=78834 Ack=248052 Win=65335 Len=0 SLE=249512 SRE=250972","66","0.000000000","0.000002000","TCP"
