"No.","Time","Time since first frame in this TCP stream","segment delta","Time delta from previous captured frame","Destination","Source","Delta Time (conv)","Info","Length","Time shift for this packet","Time delta from previous captured frame","Protocol"
"8","0.025347","0.000060000","0.000060000","0.000060000","10.22.1.2","10.1.1.2","0.000060000","12002  >  51723 [PSH, ACK] Seq=1 Ack=1 Win=253 Len=1232","1286","0.000000000","0.000060000","TCP"
"23","0.126517","0.000057000","0.000046000","0.000046000","10.22.1.2","10.1.1.2","0.000046000","12001  >  51722 [ACK] Seq=14601 Ack=6258 Win=256 Len=0","54","0.000000000","0.000046000","TCP"
"29","0.138474","0.012014000","0.000041000","0.000041000","10.22.1.2","10.1.1.2","0.000041000","12001  >  51722 [ACK] Seq=14601 Ack=6258 Win=256 Len=4380","4434","0.000000000","0.000041000","TCP"
"32","0.146492","0.020032000","0.000059000","0.000059000","10.22.1.2","10.1.1.2","0.000059000","12001  >  51722 [ACK] Seq=18981 Ack=6258 Win=256 Len=10220","10274","0.000000000","0.000059000","TCP"
"33","0.164475","0.139188000","0.139128000","0.017983000","10.22.1.2","10.1.1.2","0.139128000","12002  >  51723 [PSH, ACK] Seq=1233 Ack=1 Win=253 Len=1584","1638","0.000000000","0.017983000","TCP"
"57","0.291552","0.165092000","0.000036000","0.000036000","10.22.1.2","10.1.1.2","0.000036000","12001  >  51722 [ACK] Seq=29201 Ack=7611 Win=251 Len=5840","5894","0.000000000","0.000036000","TCP"
"63","0.307532","0.181072000","0.000037000","0.000037000","10.22.1.2","10.1.1.2","0.000037000","12001  >  51722 [ACK] Seq=35041 Ack=7611 Win=251 Len=10220","10274","0.000000000","0.000037000","TCP"
"65","0.322176","0.296889000","0.000041000","0.000041000","10.22.1.2","10.1.1.2","0.000041000","12002  >  51723 [PSH, ACK] Seq=2817 Ack=1 Win=253 Len=1232","1286","0.000000000","0.000041000","TCP"
"81","0.445969","0.319509000","0.000034000","0.000034000","10.22.1.2","10.1.1.2","0.000034000","12001  >  51722 [ACK] Seq=45261 Ack=8847 Win=256 Len=1460","1514","0.000000000","0.000034000","TCP"
"84","0.453950","0.327490000","0.000027000","0.000027000","10.22.1.2","10.1.1.2","0.000027000","12001  >  51722 [ACK] Seq=46721 Ack=8847 Win=256 Len=4380","4434","0.000000000","0.000027000","TCP"
"87","0.463278","0.336818000","0.000037000","0.000037000","10.22.1.2","10.1.1.2","0.000037000","12001  >  51722 [PSH, ACK] Seq=51101 Ack=9074 Win=255 Len=11680","11734","0.000000000","0.000037000","TCP"
"90","0.488174","0.462887000","0.165998000","0.006264000","10.22.1.2","10.1.1.2","0.165998000","12002  >  51723 [PSH, ACK] Seq=4049 Ack=1 Win=253 Len=1584","1638","0.000000000","0.006264000","TCP"
"106","0.601733","0.475273000","0.000040000","0.000037000","10.22.1.2","10.1.1.2","0.000040000","12001  >  51722 [ACK] Seq=62781 Ack=15006 Win=256 Len=0","54","0.000000000","0.000037000","TCP"
"118","0.633207","0.506747000","0.000059000","0.000059000","10.22.1.2","10.1.1.2","0.000059000","12001  >  51722 [ACK] Seq=62781 Ack=15387 Win=255 Len=18980","19034","0.000000000","0.000059000","TCP"
"133","0.641166","0.615879000","0.000043000","0.000043000","10.22.1.2","10.1.1.2","0.000043000","12002  >  51723 [PSH, ACK] Seq=5633 Ack=1 Win=253 Len=1056","1110","0.000000000","0.000043000","TCP"
"146","0.784954","0.658494000","0.000053000","0.000053000","10.22.1.2","10.1.1.2","0.000053000","12001  >  51722 [ACK] Seq=81761 Ack=16220 Win=251 Len=1460","1514","0.000000000","0.000053000","TCP"
"150","0.786257","0.659797000","0.000032000","0.000032000","10.22.1.2","10.1.1.2","0.000032000","12001  >  51722 [ACK] Seq=83221 Ack=16702 Win=256 Len=1460","1514","0.000000000","0.000032000","TCP"
"152","0.787573","0.661113000","0.000022000","0.000022000","10.22.1.2","10.1.1.2","0.000022000","[TCP Fast Retransmission] 12001  >  51722 [ACK] Seq=62781 Ack=16702 Win=256 Len=1460","1514","0.000000000","0.000022000","TCP"
"160","0.810926","0.785639000","0.169760000","0.003339000","10.22.1.2","10.1.1.2","0.169760000","12002  >  51723 [PSH, ACK] Seq=6689 Ack=1 Win=253 Len=1584","1638","0.000000000","0.003339000","TCP"
"170","0.820901","0.694441000","0.000055000","0.000054000","10.22.1.2","10.1.1.2","0.000055000","[TCP Retransmission] 12001  >  51722 [ACK] Seq=70081 Ack=16874 Win=255 Len=1460","1514","0.000000000","0.000054000","TCP"
"171","0.820911","0.694451000","0.000010000","0.000010000","10.22.1.2","10.1.1.2","0.000010000","12001  >  51722 [ACK] Seq=84681 Ack=16874 Win=255 Len=1460","1514","0.000000000","0.000010000","TCP"
"172","0.820921","0.694461000","0.000010000","0.000010000","10.22.1.2","10.1.1.2","0.000010000","12001  >  51722 [ACK] Seq=86141 Ack=16874 Win=255 Len=1460","1514","0.000000000","0.000010000","TCP"
"173","0.820934","0.694474000","0.000013000","0.000013000","10.22.1.2","10.1.1.2","0.000013000","12001  >  51722 [ACK] Seq=87601 Ack=16874 Win=255 Len=1460","1514","0.000000000","0.000013000","TCP"
"174","0.820945","0.694485000","0.000011000","0.000011000","10.22.1.2","10.1.1.2","0.000011000","12001  >  51722 [ACK] Seq=89061 Ack=16874 Win=255 Len=1460","1514","0.000000000","0.000011000","TCP"
"175","0.820955","0.694495000","0.000010000","0.000010000","10.22.1.2","10.1.1.2","0.000010000","12001  >  51722 [ACK] Seq=90521 Ack=16874 Win=255 Len=1460","1514","0.000000000","0.000010000","TCP"
"188","0.937046","0.810586000","0.000044000","0.000044000","10.22.1.2","10.1.1.2","0.000044000","12001  >  51722 [ACK] Seq=91981 Ack=17051 Win=255 Len=1460","1514","0.000000000","0.000044000","TCP"
"192","0.958350","0.831890000","0.000043000","0.000040000","10.22.1.2","10.1.1.2","0.000043000","12001  >  51722 [ACK] Seq=93441 Ack=17051 Win=255 Len=1460","1514","0.000000000","0.000040000","TCP"
"194","0.963774","0.938487000","0.142927000","0.005396000","10.22.1.2","10.1.1.2","0.142927000","12002  >  51723 [PSH, ACK] Seq=8273 Ack=1 Win=253 Len=1584","1638","0.000000000","0.005396000","TCP"
"199","0.974312","0.847852000","0.000031000","0.000031000","10.22.1.2","10.1.1.2","0.000031000","[TCP Dup ACK 188#1] 12001  >  51722 [ACK] Seq=94901 Ack=17051 Win=255 Len=0 SLE=17819 SRE=18312","66","0.000000000","0.000031000","TCP"
"200","0.974333","0.847873000","0.000021000","0.000021000","10.22.1.2","10.1.1.2","0.000021000","12001  >  51722 [ACK] Seq=94901 Ack=17051 Win=255 Len=4380","4434","0.000000000","0.000021000","TCP"
"203","0.990278","0.863818000","0.000028000","0.000028000","10.22.1.2","10.1.1.2","0.000028000","12001  >  51722 [ACK] Seq=99281 Ack=17051 Win=255 Len=2920","2974","0.000000000","0.000028000","TCP"
"217","1.059514","0.933054000","0.000032000","0.000032000","10.22.1.2","10.1.1.2","0.000032000","[TCP Dup ACK 188#2] 12001  >  51722 [ACK] Seq=102201 Ack=17051 Win=255 Len=0 SLE=17819 SRE=19772","66","0.000000000","0.000032000","TCP"
"218","1.059531","0.933071000","0.000017000","0.000017000","10.22.1.2","10.1.1.2","0.000017000","[TCP Dup ACK 188#3] 12001  >  51722 [ACK] Seq=102201 Ack=17051 Win=255 Len=0 SLE=17819 SRE=21232","66","0.000000000","0.000017000","TCP"
"219","1.059545","0.933085000","0.000014000","0.000014000","10.22.1.2","10.1.1.2","0.000014000","[TCP Dup ACK 188#4] 12001  >  51722 [ACK] Seq=102201 Ack=17051 Win=255 Len=0 SLE=17819 SRE=22692","66","0.000000000","0.000014000","TCP"
"220","1.059558","0.933098000","0.000013000","0.000013000","10.22.1.2","10.1.1.2","0.000013000","[TCP Dup ACK 188#5] 12001  >  51722 [ACK] Seq=102201 Ack=17051 Win=255 Len=0 SLE=17819 SRE=24152","66","0.000000000","0.000013000","TCP"
"221","1.059571","0.933111000","0.000013000","0.000013000","10.22.1.2","10.1.1.2","0.000013000","[TCP Dup ACK 188#6] 12001  >  51722 [ACK] Seq=102201 Ack=17051 Win=255 Len=0 SLE=17819 SRE=24192","66","0.000000000","0.000013000","TCP"
"240","1.135397","1.008937000","0.000039000","0.000039000","10.22.1.2","10.1.1.2","0.000039000","12001  >  51722 [ACK] Seq=102201 Ack=17051 Win=255 Len=1460","1514","0.000000000","0.000039000","TCP"
"241","1.135431","1.008971000","0.000034000","0.000034000","10.22.1.2","10.1.1.2","0.000034000","[TCP Dup ACK 188#7] 12001  >  51722 [ACK] Seq=103661 Ack=17051 Win=255 Len=0 SLE=17819 SRE=24747","66","0.000000000","0.000034000","TCP"
"242","1.135448","1.008988000","0.000017000","0.000017000","10.22.1.2","10.1.1.2","0.000017000","12001  >  51722 [ACK] Seq=103661 Ack=17051 Win=255 Len=1460","1514","0.000000000","0.000017000","TCP"
"243","1.135466","1.110179000","0.000110000","0.000018000","10.22.1.2","10.1.1.2","0.000110000","12002  >  51723 [PSH, ACK] Seq=9857 Ack=1 Win=253 Len=1408","1462","0.000000000","0.000018000","TCP"
"246","1.159339","1.032879000","0.000026000","0.000026000","10.22.1.2","10.1.1.2","0.000026000","12001  >  51722 [ACK] Seq=105121 Ack=17051 Win=255 Len=1460","1514","0.000000000","0.000026000","TCP"
"247","1.159361","1.032901000","0.000022000","0.000022000","10.22.1.2","10.1.1.2","0.000022000","[TCP Fast Retransmission] 12001  >  51722 [ACK] Seq=93441 Ack=17051 Win=255 Len=1460","1514","0.000000000","0.000022000","TCP"
"248","1.159372","1.032912000","0.000011000","0.000011000","10.22.1.2","10.1.1.2","0.000011000","12001  >  51722 [ACK] Seq=106581 Ack=17051 Win=255 Len=1460","1514","0.000000000","0.000011000","TCP"
"258","1.212600","1.086140000","0.000042000","0.000042000","10.22.1.2","10.1.1.2","0.000042000","12001  >  51722 [ACK] Seq=108041 Ack=24747 Win=256 Len=0 SLE=17819 SRE=18511","66","0.000000000","0.000042000","TCP"
"274","1.288474","1.162014000","0.000032000","0.000032000","10.22.1.2","10.1.1.2","0.000032000","12001  >  51722 [ACK] Seq=108041 Ack=24747 Win=256 Len=1460","1514","0.000000000","0.000032000","TCP"
"275","1.288495","1.162035000","0.000021000","0.000021000","10.22.1.2","10.1.1.2","0.000021000","[TCP Dup ACK 258#1] 12001  >  51722 [ACK] Seq=109501 Ack=24747 Win=256 Len=0 SLE=24908 SRE=25333","66","0.000000000","0.000021000","TCP"
"276","1.288511","1.162051000","0.000016000","0.000016000","10.22.1.2","10.1.1.2","0.000016000","12001  >  51722 [ACK] Seq=109501 Ack=24747 Win=256 Len=1460","1514","0.000000000","0.000016000","TCP"
"277","1.303613","1.278326000","0.168147000","0.015102000","10.22.1.2","10.1.1.2","0.168147000","12002  >  51723 [PSH, ACK] Seq=11265 Ack=1 Win=253 Len=1584","1638","0.000000000","0.015102000","TCP"
"280","1.323076","1.196616000","0.000027000","0.000027000","10.22.1.2","10.1.1.2","0.000027000","12001  >  51722 [ACK] Seq=110961 Ack=24747 Win=256 Len=1460","1514","0.000000000","0.000027000","TCP"
"282","1.324394","1.197934000","0.000019000","0.000019000","10.22.1.2","10.1.1.2","0.000019000","12001  >  51722 [ACK] Seq=112421 Ack=24747 Win=256 Len=1460","1514","0.000000000","0.000019000","TCP"
"289","1.367035","1.240575000","0.000048000","0.000048000","10.22.1.2","10.1.1.2","0.000048000","[TCP Dup ACK 258#2] 12001  >  51722 [ACK] Seq=113881 Ack=24747 Win=256 Len=0 SLE=24908 SRE=26793","66","0.000000000","0.000048000","TCP"
"290","1.367055","1.240595000","0.000020000","0.000020000","10.22.1.2","10.1.1.2","0.000020000","[TCP Dup ACK 258#3] 12001  >  51722 [ACK] Seq=113881 Ack=24747 Win=256 Len=0 SLE=24908 SRE=27243","66","0.000000000","0.000020000","TCP"
"300","1.444233","1.317773000","0.000043000","0.000043000","10.22.1.2","10.1.1.2","0.000043000","[TCP Dup ACK 258#4] 12001  >  51722 [ACK] Seq=113881 Ack=24747 Win=256 Len=0 SLE=24908 SRE=27886","66","0.000000000","0.000043000","TCP"
"301","1.444254","1.317794000","0.000021000","0.000021000","10.22.1.2","10.1.1.2","0.000021000","12001  >  51722 [PSH, ACK] Seq=113881 Ack=24747 Win=256 Len=2920","2974","0.000000000","0.000021000","TCP"
"305","1.477542","1.351082000","0.000066000","0.000066000","10.22.1.2","10.1.1.2","0.000066000","[TCP Dup ACK 258#5] 12001  >  51722 [ACK] Seq=116801 Ack=24747 Win=256 Len=0 SLE=24908 SRE=28036","66","0.000000000","0.000066000","TCP"
"306","1.477572","1.351112000","0.000030000","0.000030000","10.22.1.2","10.1.1.2","0.000030000","12001  >  51722 [ACK] Seq=116801 Ack=24747 Win=256 Len=1460","1514","0.000000000","0.000030000","TCP"
"311","1.507164","1.481877000","0.046999000","0.016356000","10.22.1.2","10.1.1.2","0.046999000","12002  >  51723 [PSH, ACK] Seq=12849 Ack=1 Win=253 Len=1460","1514","0.000000000","0.016356000","TCP"
"312","1.507168","1.481881000","0.000004000","0.000004000","10.22.1.2","10.1.1.2","0.000004000","12002  >  51723 [PSH, ACK] Seq=14309 Ack=1 Win=253 Len=124","178","0.000000000","0.000004000","TCP"
"314","1.517431","1.390971000","0.000034000","0.000034000","10.22.1.2","10.1.1.2","0.000034000","12001  >  51722 [ACK] Seq=118261 Ack=28036 Win=256 Len=0","54","0.000000000","0.000034000","TCP"
"315","1.517446","1.390986000","0.000015000","0.000015000","10.22.1.2","10.1.1.2","0.000015000","12001  >  51722 [ACK] Seq=118261 Ack=28036 Win=256 Len=1460","1514","0.000000000","0.000015000","TCP"
"325","1.529414","1.402954000","0.000031000","0.000031000","10.22.1.2","10.1.1.2","0.000031000","12001  >  51722 [ACK] Seq=119721 Ack=30956 Win=256 Len=0","54","0.000000000","0.000031000","TCP"
"329","1.533409","1.406949000","0.000029000","0.000029000","10.22.1.2","10.1.1.2","0.000029000","12001  >  51722 [ACK] Seq=119721 Ack=34054 Win=256 Len=0","54","0.000000000","0.000029000","TCP"
"347","1.597314","1.470854000","0.000044000","0.000044000","10.22.1.2","10.1.1.2","0.000044000","12001  >  51722 [ACK] Seq=119721 Ack=34054 Win=256 Len=4380","4434","0.000000000","0.000044000","TCP"
"354","1.659887","1.634600000","0.000047000","0.000047000","10.22.1.2","10.1.1.2","0.000047000","[TCP Fast Retransmission] 12002  >  51723 [PSH, ACK] Seq=9857 Ack=1 Win=253 Len=1460","1514","0.000000000","0.000047000","TCP"
"356","1.669176","1.542716000","0.000024000","0.000024000","10.22.1.2","10.1.1.2","0.000024000","12001  >  51722 [ACK] Seq=124101 Ack=34054 Win=256 Len=2920","2974","0.000000000","0.000024000","TCP"
"357","1.677641","1.652354000","0.017754000","0.008465000","10.22.1.2","10.1.1.2","0.017754000","12002  >  51723 [PSH, ACK] Seq=14433 Ack=1 Win=253 Len=1460","1514","0.000000000","0.008465000","TCP"
"358","1.677647","1.652360000","0.000006000","0.000006000","10.22.1.2","10.1.1.2","0.000006000","12002  >  51723 [PSH, ACK] Seq=15893 Ack=1 Win=253 Len=124","178","0.000000000","0.000006000","TCP"
"362","1.685151","1.558691000","0.000024000","0.000024000","10.22.1.2","10.1.1.2","0.000024000","12001  >  51722 [ACK] Seq=127021 Ack=35284 Win=251 Len=0","54","0.000000000","0.000024000","TCP"
"366","1.706447","1.681160000","0.028800000","0.004013000","10.22.1.2","10.1.1.2","0.028800000","[TCP Retransmission] 12002  >  51723 [PSH, ACK] Seq=9857 Ack=1 Win=253 Len=1460","1514","0.000000000","0.004013000","TCP"
"372","1.750404","1.623944000","0.000047000","0.000047000","10.22.1.2","10.1.1.2","0.000047000","12001  >  51722 [ACK] Seq=127021 Ack=35950 Win=256 Len=4380","4434","0.000000000","0.000047000","TCP"
"383","1.822314","1.797027000","0.000075000","0.000075000","10.22.1.2","10.1.1.2","0.000075000","[TCP Retransmission] 12002  >  51723 [PSH, ACK] Seq=14433 Ack=1 Win=253 Len=2640","2694","0.000000000","0.000075000","TCP"
"385","1.824939","1.698479000","0.000039000","0.000039000","10.22.1.2","10.1.1.2","0.000039000","12001  >  51722 [ACK] Seq=131401 Ack=36660 Win=253 Len=4380","4434","0.000000000","0.000039000","TCP"
"389","1.838258","1.812971000","0.000042000","0.000042000","10.22.1.2","10.1.1.2","0.000042000","12002  >  51723 [PSH, ACK] Seq=17073 Ack=1 Win=253 Len=176","230","0.000000000","0.000042000","TCP"
"396","1.902156","1.775696000","0.000046000","0.000046000","10.22.1.2","10.1.1.2","0.000046000","12001  >  51722 [ACK] Seq=135781 Ack=36983 Win=252 Len=1460","1514","0.000000000","0.000046000","TCP"
"399","1.912790","1.786330000","0.000031000","0.000031000","10.22.1.2","10.1.1.2","0.000031000","12001  >  51722 [ACK] Seq=137241 Ack=36983 Win=252 Len=4380","4434","0.000000000","0.000031000","TCP"
"409","1.979422","1.954135000","0.000095000","0.000060000","10.22.1.2","10.1.1.2","0.000095000","12002  >  51723 [PSH, ACK] Seq=17249 Ack=1 Win=253 Len=1408","1462","0.000000000","0.000060000","TCP"
"410","1.979439","1.852979000","0.000112000","0.000017000","10.22.1.2","10.1.1.2","0.000112000","12001  >  51722 [ACK] Seq=141621 Ack=37584 Win=256 Len=1460","1514","0.000000000","0.000017000","TCP"
"413","1.987333","1.860873000","0.000027000","0.000027000","10.22.1.2","10.1.1.2","0.000027000","12001  >  51722 [ACK] Seq=143081 Ack=37584 Win=256 Len=2920","2974","0.000000000","0.000027000","TCP"
"422","2.021946","1.895486000","0.000028000","0.000028000","10.22.1.2","10.1.1.2","0.000028000","12001  >  51722 [ACK] Seq=146001 Ack=40504 Win=256 Len=0","54","0.000000000","0.000028000","TCP"
"425","2.023274","1.896814000","0.000023000","0.000023000","10.22.1.2","10.1.1.2","0.000023000","12001  >  51722 [ACK] Seq=146001 Ack=42972 Win=256 Len=0","54","0.000000000","0.000023000","TCP"
"444","2.075204","1.948744000","0.000037000","0.000037000","10.22.1.2","10.1.1.2","0.000037000","12001  >  51722 [ACK] Seq=146001 Ack=43544 Win=254 Len=4380","4434","0.000000000","0.000037000","TCP"
"451","2.144434","2.119147000","0.000047000","0.000046000","10.22.1.2","10.1.1.2","0.000047000","12002  >  51723 [PSH, ACK] Seq=18657 Ack=1 Win=253 Len=1408","1462","0.000000000","0.000046000","TCP"
"452","2.144454","2.017994000","0.000066000","0.000020000","10.22.1.2","10.1.1.2","0.000066000","12001  >  51722 [ACK] Seq=150381 Ack=43863 Win=253 Len=4380","4434","0.000000000","0.000020000","TCP"
"455","2.148406","2.021946000","0.000028000","0.000028000","10.22.1.2","10.1.1.2","0.000028000","12001  >  51722 [ACK] Seq=154761 Ack=44015 Win=252 Len=1460","1514","0.000000000","0.000028000","TCP"
"459","2.176381","2.049921000","0.000044000","0.000040000","10.22.1.2","10.1.1.2","0.000044000","12001  >  51722 [ACK] Seq=156221 Ack=44167 Win=251 Len=1460","1514","0.000000000","0.000040000","TCP"
"469","2.226974","2.100514000","0.000049000","0.000049000","10.22.1.2","10.1.1.2","0.000049000","12001  >  51722 [ACK] Seq=157681 Ack=44742 Win=256 Len=2920","2974","0.000000000","0.000049000","TCP"
"476","2.300168","2.173708000","0.000035000","0.000035000","10.22.1.2","10.1.1.2","0.000035000","12001  >  51722 [ACK] Seq=160601 Ack=45365 Win=254 Len=7300","7354","0.000000000","0.000035000","TCP"
"477","2.307529","2.282242000","0.163095000","0.007361000","10.22.1.2","10.1.1.2","0.163095000","12002  >  51723 [PSH, ACK] Seq=20065 Ack=1 Win=253 Len=1584","1638","0.000000000","0.007361000","TCP"
"482","2.329451","2.202991000","0.000031000","0.000031000","10.22.1.2","10.1.1.2","0.000031000","12001  >  51722 [ACK] Seq=167901 Ack=45641 Win=253 Len=2920","2974","0.000000000","0.000031000","TCP"
"487","2.382709","2.256249000","0.000041000","0.000041000","10.22.1.2","10.1.1.2","0.000041000","12001  >  51722 [ACK] Seq=170821 Ack=46008 Win=251 Len=2920","2974","0.000000000","0.000041000","TCP"
"498","2.457266","2.330806000","0.000049000","0.000049000","10.22.1.2","10.1.1.2","0.000049000","12001  >  51722 [ACK] Seq=173741 Ack=46324 Win=256 Len=4380","4434","0.000000000","0.000049000","TCP"
"501","2.459909","2.434622000","0.000035000","0.000035000","10.22.1.2","10.1.1.2","0.000035000","12002  >  51723 [PSH, ACK] Seq=21649 Ack=1 Win=253 Len=1232","1286","0.000000000","0.000035000","TCP"
"506","2.470577","2.344117000","0.000045000","0.000045000","10.22.1.2","10.1.1.2","0.000045000","12001  >  51722 [ACK] Seq=178121 Ack=51570 Win=256 Len=1460","1514","0.000000000","0.000045000","TCP"
"507","2.470581","2.344121000","0.000004000","0.000004000","10.22.1.2","10.1.1.2","0.000004000","12001  >  51722 [PSH, ACK] Seq=179581 Ack=51570 Win=256 Len=1311","1365","0.000000000","0.000004000","TCP"
"510","2.479881","2.353421000","0.000037000","0.000037000","10.22.1.2","10.1.1.2","0.000037000","12001  >  51722 [ACK] Seq=180892 Ack=51570 Win=256 Len=1460","1514","0.000000000","0.000037000","TCP"
"514","2.493206","2.366746000","0.000046000","0.000046000","10.22.1.2","10.1.1.2","0.000046000","12001  >  51722 [ACK] Seq=182352 Ack=51570 Win=256 Len=1460","1514","0.000000000","0.000046000","TCP"
"533","2.549108","2.422648000","0.000040000","0.000040000","10.22.1.2","10.1.1.2","0.000040000","[TCP Fast Retransmission] 12001  >  51722 [ACK] Seq=166441 Ack=51570 Win=256 Len=1460","1514","0.000000000","0.000040000","TCP"
"545","2.611669","2.485209000","0.000037000","0.000037000","10.22.1.2","10.1.1.2","0.000037000","[TCP Retransmission] 12001  >  51722 [ACK] Seq=170821 Ack=52064 Win=254 Len=1460","1514","0.000000000","0.000037000","TCP"
"546","2.611682","2.485222000","0.000013000","0.000013000","10.22.1.2","10.1.1.2","0.000013000","12001  >  51722 [ACK] Seq=183812 Ack=52064 Win=254 Len=1460","1514","0.000000000","0.000013000","TCP"
"547","2.611697","2.485237000","0.000015000","0.000015000","10.22.1.2","10.1.1.2","0.000015000","12001  >  51722 [ACK] Seq=185272 Ack=52064 Win=254 Len=1460","1514","0.000000000","0.000015000","TCP"
"553","2.622312","2.495852000","0.000030000","0.000029000","10.22.1.2","10.1.1.2","0.000030000","12001  >  51722 [ACK] Seq=186732 Ack=52754 Win=252 Len=1460","1514","0.000000000","0.000029000","TCP"
"557","2.647393","2.622106000","0.187484000","0.014463000","10.22.1.2","10.1.1.2","0.187484000","12002  >  51723 [PSH, ACK] Seq=22881 Ack=1 Win=253 Len=1584","1638","0.000000000","0.014463000","TCP"
"559","2.652921","2.526461000","0.000026000","0.000026000","10.22.1.2","10.1.1.2","0.000026000","12001  >  51722 [ACK] Seq=188192 Ack=53131 Win=256 Len=1460","1514","0.000000000","0.000026000","TCP"
"565","2.700852","2.574392000","0.000032000","0.000032000","10.22.1.2","10.1.1.2","0.000032000","12001  >  51722 [ACK] Seq=189652 Ack=53131 Win=256 Len=1460","1514","0.000000000","0.000032000","TCP"
"569","2.767429","2.640969000","0.000044000","0.000044000","10.22.1.2","10.1.1.2","0.000044000","12001  >  51722 [ACK] Seq=191112 Ack=54058 Win=253 Len=2920","2974","0.000000000","0.000044000","TCP"
"586","2.823350","2.798063000","0.000059000","0.000057000","10.22.1.2","10.1.1.2","0.000059000","12002  >  51723 [PSH, ACK] Seq=24465 Ack=1 Win=253 Len=1408","1462","0.000000000","0.000057000","TCP"
"587","2.823372","2.696912000","0.000080000","0.000022000","10.22.1.2","10.1.1.2","0.000080000","12001  >  51722 [ACK] Seq=194032 Ack=54229 Win=252 Len=2920","2974","0.000000000","0.000022000","TCP"
"593","2.861925","2.735465000","0.000032000","0.000032000","10.22.1.2","10.1.1.2","0.000032000","12001  >  51722 [ACK] Seq=196952 Ack=54700 Win=256 Len=1460","1514","0.000000000","0.000032000","TCP"
"601","2.917844","2.791384000","0.000030000","0.000030000","10.22.1.2","10.1.1.2","0.000030000","12001  >  51722 [ACK] Seq=198412 Ack=60552 Win=256 Len=0","54","0.000000000","0.000030000","TCP"
"604","2.924482","2.798022000","0.000025000","0.000025000","10.22.1.2","10.1.1.2","0.000025000","12001  >  51722 [ACK] Seq=198412 Ack=60552 Win=256 Len=4380","4434","0.000000000","0.000025000","TCP"
"622","2.969750","2.944463000","0.146400000","0.006649000","10.22.1.2","10.1.1.2","0.146400000","12002  >  51723 [PSH, ACK] Seq=25873 Ack=1 Win=253 Len=1584","1638","0.000000000","0.006649000","TCP"
"625","2.975094","2.848634000","0.000049000","0.000049000","10.22.1.2","10.1.1.2","0.000049000","12001  >  51722 [ACK] Seq=202792 Ack=60924 Win=255 Len=1460","1514","0.000000000","0.000049000","TCP"
"633","3.068288","2.941828000","0.000052000","0.000052000","10.22.1.2","10.1.1.2","0.000052000","[TCP Dup ACK 625#1] 12001  >  51722 [ACK] Seq=204252 Ack=60924 Win=255 Len=0 SLE=61076 SRE=61630","66","0.000000000","0.000052000","TCP"
"634","3.068309","2.941849000","0.000021000","0.000021000","10.22.1.2","10.1.1.2","0.000021000","12001  >  51722 [ACK] Seq=204252 Ack=60924 Win=255 Len=2920","2974","0.000000000","0.000021000","TCP"
"640","3.093573","2.967113000","0.000049000","0.000049000","10.22.1.2","10.1.1.2","0.000049000","12001  >  51722 [ACK] Seq=207172 Ack=60924 Win=255 Len=5840","5894","0.000000000","0.000049000","TCP"
"646","3.133494","3.108207000","0.000040000","0.000040000","10.22.1.2","10.1.1.2","0.000040000","12002  >  51723 [PSH, ACK] Seq=27457 Ack=1 Win=253 Len=1408","1462","0.000000000","0.000040000","TCP"
"648","3.134815","3.008355000","0.000033000","0.000033000","10.22.1.2","10.1.1.2","0.000033000","[TCP Dup ACK 625#2] 12001  >  51722 [ACK] Seq=213012 Ack=60924 Win=255 Len=0 SLE=61076 SRE=62466","66","0.000000000","0.000033000","TCP"
"649","3.134831","3.008371000","0.000016000","0.000016000","10.22.1.2","10.1.1.2","0.000016000","12001  >  51722 [ACK] Seq=213012 Ack=60924 Win=255 Len=1460","1514","0.000000000","0.000016000","TCP"
"658","3.228003","3.101543000","0.000033000","0.000033000","10.22.1.2","10.1.1.2","0.000033000","[TCP Dup ACK 625#3] 12001  >  51722 [ACK] Seq=214472 Ack=60924 Win=255 Len=0 SLE=61076 SRE=63206","66","0.000000000","0.000033000","TCP"
"659","3.228023","3.101563000","0.000020000","0.000020000","10.22.1.2","10.1.1.2","0.000020000","12001  >  51722 [ACK] Seq=214472 Ack=60924 Win=255 Len=2920","2974","0.000000000","0.000020000","TCP"
"661","3.257289","3.130829000","0.000035000","0.000035000","10.22.1.2","10.1.1.2","0.000035000","12001  >  51722 [ACK] Seq=217392 Ack=60924 Win=255 Len=7300","7354","0.000000000","0.000035000","TCP"
"667","3.309198","3.182738000","0.000029000","0.000029000","10.22.1.2","10.1.1.2","0.000029000","[TCP Dup ACK 625#4] 12001  >  51722 [ACK] Seq=224692 Ack=60924 Win=255 Len=0 SLE=61076 SRE=63875","66","0.000000000","0.000029000","TCP"
"668","3.309215","3.182755000","0.000017000","0.000017000","10.22.1.2","10.1.1.2","0.000017000","12001  >  51722 [ACK] Seq=224692 Ack=60924 Win=255 Len=1460","1514","0.000000000","0.000017000","TCP"
"669","3.310538","3.285251000","0.177044000","0.001323000","10.22.1.2","10.1.1.2","0.177044000","12002  >  51723 [PSH, ACK] Seq=28865 Ack=1 Win=253 Len=1584","1638","0.000000000","0.001323000","TCP"
"678","3.381109","3.254649000","0.000048000","0.000048000","10.22.1.2","10.1.1.2","0.000048000","[TCP Dup ACK 625#5] 12001  >  51722 [ACK] Seq=226152 Ack=60924 Win=255 Len=0 SLE=61076 SRE=64596","66","0.000000000","0.000048000","TCP"
"679","3.381132","3.254672000","0.000023000","0.000023000","10.22.1.2","10.1.1.2","0.000023000","12001  >  51722 [ACK] Seq=226152 Ack=60924 Win=255 Len=2920","2974","0.000000000","0.000023000","TCP"
"683","3.391748","3.265288000","0.000038000","0.000038000","10.22.1.2","10.1.1.2","0.000038000","[TCP Dup ACK 625#6] 12001  >  51722 [ACK] Seq=229072 Ack=60924 Win=255 Len=0 SLE=61076 SRE=66056","66","0.000000000","0.000038000","TCP"
"684","3.391769","3.265309000","0.000021000","0.000021000","10.22.1.2","10.1.1.2","0.000021000","[TCP Dup ACK 625#7] 12001  >  51722 [ACK] Seq=229072 Ack=60924 Win=255 Len=0 SLE=61076 SRE=67516","66","0.000000000","0.000021000","TCP"
"687","3.393064","3.266604000","0.000026000","0.000026000","10.22.1.2","10.1.1.2","0.000026000","[TCP Dup ACK 625#8] 12001  >  51722 [ACK] Seq=229072 Ack=60924 Win=255 Len=0 SLE=61076 SRE=68976","66","0.000000000","0.000026000","TCP"
"688","3.393081","3.266621000","0.000017000","0.000017000","10.22.1.2","10.1.1.2","0.000017000","[TCP Dup ACK 625#9] 12001  >  51722 [ACK] Seq=229072 Ack=60924 Win=255 Len=0 SLE=61076 SRE=69921","66","0.000000000","0.000017000","TCP"
"693","3.418373","3.291913000","0.000041000","0.000041000","10.22.1.2","10.1.1.2","0.000041000","12001  >  51722 [ACK] Seq=229072 Ack=60924 Win=255 Len=4380","4434","0.000000000","0.000041000","TCP"
"708","3.427719","3.301259000","0.000065000","0.000029000","10.22.1.2","10.1.1.2","0.000065000","12001  >  51722 [ACK] Seq=233452 Ack=60924 Win=255 Len=1460","1514","0.000000000","0.000029000","TCP"
"712","3.459635","3.333175000","0.000040000","0.000040000","10.22.1.2","10.1.1.2","0.000040000","12001  >  51722 [ACK] Seq=234912 Ack=60924 Win=255 Len=1460","1514","0.000000000","0.000040000","TCP"
"714","3.472955","3.447668000","0.000046000","0.000046000","10.22.1.2","10.1.1.2","0.000046000","12002  >  51723 [PSH, ACK] Seq=30449 Ack=1 Win=253 Len=1232","1286","0.000000000","0.000046000","TCP"
"717","3.535547","3.409087000","0.000060000","0.000060000","10.22.1.2","10.1.1.2","0.000060000","[TCP Fast Retransmission] 12001  >  51722 [ACK] Seq=221772 Ack=60924 Win=255 Len=1460","1514","0.000000000","0.000060000","TCP"
"718","3.535571","3.409111000","0.000024000","0.000024000","10.22.1.2","10.1.1.2","0.000024000","12001  >  51722 [ACK] Seq=236372 Ack=60924 Win=255 Len=1460","1514","0.000000000","0.000024000","TCP"
"720","3.544836","3.418376000","0.000048000","0.000048000","10.22.1.2","10.1.1.2","0.000048000","12001  >  51722 [ACK] Seq=237832 Ack=69921 Win=256 Len=0 SLE=61076 SRE=62384","66","0.000000000","0.000048000","TCP"
"731","3.570127","3.443667000","0.000040000","0.000040000","10.22.1.2","10.1.1.2","0.000040000","12001  >  51722 [ACK] Seq=237832 Ack=69921 Win=256 Len=1460","1514","0.000000000","0.000040000","TCP"
"732","3.570148","3.443688000","0.000021000","0.000021000","10.22.1.2","10.1.1.2","0.000021000","12001  >  51722 [ACK] Seq=239292 Ack=69921 Win=256 Len=1460","1514","0.000000000","0.000021000","TCP"
"733","3.570163","3.443703000","0.000015000","0.000015000","10.22.1.2","10.1.1.2","0.000015000","12001  >  51722 [ACK] Seq=240752 Ack=69921 Win=256 Len=1460","1514","0.000000000","0.000015000","TCP"
"735","3.579417","3.452957000","0.000020000","0.000020000","10.22.1.2","10.1.1.2","0.000020000","12001  >  51722 [ACK] Seq=242212 Ack=69921 Win=256 Len=1460","1514","0.000000000","0.000020000","TCP"
"740","3.612704","3.486244000","0.000026000","0.000026000","10.22.1.2","10.1.1.2","0.000026000","12001  >  51722 [ACK] Seq=243672 Ack=69921 Win=256 Len=1460","1514","0.000000000","0.000026000","TCP"
"747","3.630020","3.604733000","0.000036000","0.000036000","10.22.1.2","10.1.1.2","0.000036000","12002  >  51723 [PSH, ACK] Seq=31681 Ack=1 Win=253 Len=1232","1286","0.000000000","0.000036000","TCP"
"749","3.635332","3.508872000","0.000023000","0.000023000","10.22.1.2","10.1.1.2","0.000023000","[TCP Dup ACK 720#1] 12001  >  51722 [ACK] Seq=245132 Ack=69921 Win=256 Len=0 SLE=60924 SRE=62384","66","0.000000000","0.000023000","TCP"
"757","3.708562","3.582102000","0.000034000","0.000034000","10.22.1.2","10.1.1.2","0.000034000","12001  >  51722 [ACK] Seq=245132 Ack=72605 Win=256 Len=0","54","0.000000000","0.000034000","TCP"
"764","3.732508","3.606048000","0.000024000","0.000024000","10.22.1.2","10.1.1.2","0.000024000","12001  >  51722 [PSH, ACK] Seq=245132 Ack=72605 Win=256 Len=4380","4434","0.000000000","0.000024000","TCP"
"766","3.733842","3.607382000","0.000027000","0.000027000","10.22.1.2","10.1.1.2","0.000027000","12001  >  51722 [ACK] Seq=249512 Ack=72772 Win=255 Len=1460","1514","0.000000000","0.000027000","TCP"
"772","3.768461","3.642001000","0.000033000","0.000033000","10.22.1.2","10.1.1.2","0.000033000","12001  >  51722 [ACK] Seq=250972 Ack=72932 Win=255 Len=1460","1514","0.000000000","0.000033000","TCP"
"773","3.769553","3.744266000","0.139533000","0.001092000","10.22.1.2","10.1.1.2","0.139533000","12002  >  51723 [PSH, ACK] Seq=32913 Ack=1 Win=253 Len=1584","1638","0.000000000","0.001092000","TCP"
"789","3.860306","3.733846000","0.000027000","0.000027000","10.22.1.2","10.1.1.2","0.000027000","12001  >  51722 [ACK] Seq=252432 Ack=75852 Win=256 Len=0","54","0.000000000","0.000027000","TCP"
"793","3.861642","3.735182000","0.000025000","0.000025000","10.22.1.2","10.1.1.2","0.000025000","12001  >  51722 [ACK] Seq=252432 Ack=78834 Win=256 Len=0","54","0.000000000","0.000025000","TCP"
"799","3.886943","3.760483000","0.000036000","0.000036000","10.22.1.2","10.1.1.2","0.000036000","12001  >  51722 [ACK] Seq=252432 Ack=78834 Win=256 Len=4380","4434","0.000000000","0.000036000","TCP"
"800","3.886985","3.760525000","0.000042000","0.000042000","10.22.1.2","10.1.1.2","0.000042000","12001  >  51722 [ACK] Seq=256812 Ack=78834 Win=256 Len=1460","1514","0.000000000","0.000042000","TCP"
"817","3.932200","3.805740000","0.000033000","0.000032000","10.22.1.2","10.1.1.2","0.000033000","12001  >  51722 [ACK] Seq=258272 Ack=78834 Win=256 Len=1460","1514","0.000000000","0.000032000","TCP"
"818","3.932245","3.906958000","0.000077000","0.000045000","10.22.1.2","10.1.1.2","0.000077000","12002  >  51723 [PSH, ACK] Seq=34497 Ack=1 Win=253 Len=1232","1286","0.000000000","0.000045000","TCP"
"827","4.013420","3.886960000","0.000047000","0.000047000","10.22.1.2","10.1.1.2","0.000047000","12001  >  51722 [ACK] Seq=259732 Ack=80047 Win=251 Len=0","54","0.000000000","0.000047000","TCP"
"838","4.057382","3.930922000","0.000068000","0.000068000","10.22.1.2","10.1.1.2","0.000068000","[TCP Fast Retransmission] 12001  >  51722 [ACK] Seq=248052 Ack=80201 Win=251 Len=1460","1514","0.000000000","0.000068000","TCP"
"839","4.057396","3.930936000","0.000014000","0.000014000","10.22.1.2","10.1.1.2","0.000014000","12001  >  51722 [ACK] Seq=259732 Ack=80201 Win=251 Len=1460","1514","0.000000000","0.000014000","TCP"
"840","4.057408","3.930948000","0.000012000","0.000012000","10.22.1.2","10.1.1.2","0.000012000","12001  >  51722 [ACK] Seq=261192 Ack=80201 Win=251 Len=1460","1514","0.000000000","0.000012000","TCP"
"844","4.091835","4.066548000","0.159590000","0.015302000","10.22.1.2","10.1.1.2","0.159590000","12002  >  51723 [PSH, ACK] Seq=35729 Ack=1 Win=253 Len=1584","1638","0.000000000","0.015302000","TCP"
"851","4.163823","4.037363000","0.000033000","0.000033000","10.22.1.2","10.1.1.2","0.000033000","12001  >  51722 [ACK] Seq=262652 Ack=81409 Win=256 Len=0","54","0.000000000","0.000033000","TCP"
"861","4.209081","4.082621000","0.000033000","0.000033000","10.22.1.2","10.1.1.2","0.000033000","12001  >  51722 [ACK] Seq=262652 Ack=81409 Win=256 Len=1460","1514","0.000000000","0.000033000","TCP"
"864","4.210415","4.083955000","0.000031000","0.000031000","10.22.1.2","10.1.1.2","0.000031000","12001  >  51722 [ACK] Seq=264112 Ack=81409 Win=256 Len=1460","1514","0.000000000","0.000031000","TCP"
"865","4.210440","4.083980000","0.000025000","0.000025000","10.22.1.2","10.1.1.2","0.000025000","12001  >  51722 [ACK] Seq=265572 Ack=81409 Win=256 Len=1460","1514","0.000000000","0.000025000","TCP"
"868","4.246362","4.221075000","0.000040000","0.000040000","10.22.1.2","10.1.1.2","0.000040000","12002  >  51723 [PSH, ACK] Seq=37313 Ack=1 Win=253 Len=1232","1286","0.000000000","0.000040000","TCP"
"873","4.314243","4.187783000","0.000029000","0.000029000","10.22.1.2","10.1.1.2","0.000029000","[TCP Dup ACK 851#1] 12001  >  51722 [ACK] Seq=267032 Ack=81409 Win=256 Len=0 SLE=81679 SRE=82396","66","0.000000000","0.000029000","TCP"
"876","4.316899","4.190439000","0.000022000","0.000022000","10.22.1.2","10.1.1.2","0.000022000","[TCP Dup ACK 851#2] 12001  >  51722 [ACK] Seq=267032 Ack=81409 Win=256 Len=0 SLE=81679 SRE=83856","66","0.000000000","0.000022000","TCP"
"877","4.316914","4.190454000","0.000015000","0.000015000","10.22.1.2","10.1.1.2","0.000015000","[TCP Dup ACK 851#3] 12001  >  51722 [ACK] Seq=267032 Ack=81409 Win=256 Len=0 SLE=81679 SRE=85316","66","0.000000000","0.000015000","TCP"
"880","4.326219","4.199759000","0.000024000","0.000024000","10.22.1.2","10.1.1.2","0.000024000","[TCP Dup ACK 851#4] 12001  >  51722 [ACK] Seq=267032 Ack=81409 Win=256 Len=0 SLE=81679 SRE=86776","66","0.000000000","0.000024000","TCP"
"881","4.326235","4.199775000","0.000016000","0.000016000","10.22.1.2","10.1.1.2","0.000016000","[TCP Dup ACK 851#5] 12001  >  51722 [ACK] Seq=267032 Ack=81409 Win=256 Len=0 SLE=81679 SRE=87607","66","0.000000000","0.000016000","TCP"
"896","4.360838","4.234378000","0.000034000","0.000034000","10.22.1.2","10.1.1.2","0.000034000","[TCP Fast Retransmission] 12001  >  51722 [ACK] Seq=258272 Ack=81409 Win=256 Len=1460","1514","0.000000000","0.000034000","TCP"
"897","4.360851","4.234391000","0.000013000","0.000013000","10.22.1.2","10.1.1.2","0.000013000","12001  >  51722 [ACK] Seq=267032 Ack=81409 Win=256 Len=1460","1514","0.000000000","0.000013000","TCP"
"900","4.362163","4.235703000","0.000026000","0.000026000","10.22.1.2","10.1.1.2","0.000026000","12001  >  51722 [ACK] Seq=268492 Ack=81409 Win=256 Len=1460","1514","0.000000000","0.000026000","TCP"
"901","4.362182","4.235722000","0.000019000","0.000019000","10.22.1.2","10.1.1.2","0.000019000","[TCP Dup ACK 851#6] 12001  >  51722 [ACK] Seq=269952 Ack=81409 Win=256 Len=0 SLE=81679 SRE=87967","66","0.000000000","0.000019000","TCP"
"903","4.403435","4.378148000","0.000033000","0.000033000","10.22.1.2","10.1.1.2","0.000033000","12002  >  51723 [PSH, ACK] Seq=38545 Ack=1 Win=253 Len=1232","1286","0.000000000","0.000033000","TCP"
"916","4.477990","4.351530000","0.000042000","0.000042000","10.22.1.2","10.1.1.2","0.000042000","12001  >  51722 [ACK] Seq=269952 Ack=87967 Win=256 Len=0 SLE=81679 SRE=82869","66","0.000000000","0.000042000","TCP"
"924","4.513936","4.387476000","0.000042000","0.000042000","10.22.1.2","10.1.1.2","0.000042000","12001  >  51722 [ACK] Seq=269952 Ack=87967 Win=256 Len=1460","1514","0.000000000","0.000042000","TCP"
"927","4.515255","4.388795000","0.000033000","0.000033000","10.22.1.2","10.1.1.2","0.000033000","12001  >  51722 [ACK] Seq=271412 Ack=89185 Win=251 Len=1460","1514","0.000000000","0.000033000","TCP"
"931","4.550842","4.525555000","0.147407000","0.002299000","10.22.1.2","10.1.1.2","0.147407000","12002  >  51723 [PSH, ACK] Seq=39777 Ack=1 Win=253 Len=1584","1638","0.000000000","0.002299000","TCP"
"949","4.696329","4.569869000","0.000054000","0.000054000","10.22.1.2","10.1.1.2","0.000054000","12001  >  51722 [ACK] Seq=272872 Ack=90212 Win=256 Len=0","54","0.000000000","0.000054000","TCP"
"953","4.707015","4.681728000","0.000092000","0.000089000","10.22.1.2","10.1.1.2","0.000092000","12002  >  51723 [PSH, ACK] Seq=41361 Ack=1 Win=253 Len=1232","1286","0.000000000","0.000089000","TCP"
"960","4.785482","4.659022000","0.000028000","0.000028000","10.22.1.2","10.1.1.2","0.000028000","12001  >  51722 [ACK] Seq=272872 Ack=93132 Win=256 Len=0","54","0.000000000","0.000028000","TCP"
"984","4.874055","4.848768000","0.167040000","0.007401000","10.22.1.2","10.1.1.2","0.167040000","12002  >  51723 [PSH, ACK] Seq=42593 Ack=1 Win=253 Len=1584","1638","0.000000000","0.007401000","TCP"
"993","4.935905","4.809445000","0.000029000","0.000029000","10.22.1.2","10.1.1.2","0.000029000","12001  >  51722 [ACK] Seq=272872 Ack=97512 Win=256 Len=0","54","0.000000000","0.000029000","TCP"
"1005","5.014220","4.887760000","0.063704000","0.010419000","10.22.1.2","10.1.1.2","0.063704000","[TCP Retransmission] 12001  >  51722 [ACK] Seq=265572 Ack=97937 Win=254 Len=1460","1514","0.000000000","0.010419000","TCP"
"1008","5.027796","5.002509000","0.000065000","0.000065000","10.22.1.2","10.1.1.2","0.000065000","12002  >  51723 [PSH, ACK] Seq=44177 Ack=1 Win=253 Len=1232","1286","0.000000000","0.000065000","TCP"
"1014","5.086354","4.959894000","0.000048000","0.000048000","10.22.1.2","10.1.1.2","0.000048000","12001  >  51722 [ACK] Seq=267032 Ack=99467 Win=256 Len=0","54","0.000000000","0.000048000","TCP"
"1018","5.164916","5.038456000","0.000066000","0.000066000","10.22.1.2","10.1.1.2","0.000066000","12001  >  51722 [ACK] Seq=272872 Ack=99467 Win=256 Len=7300","7354","0.000000000","0.000066000","TCP"
"1033","5.213958","5.188671000","0.186162000","0.005153000","10.22.1.2","10.1.1.2","0.186162000","12002  >  51723 [PSH, ACK] Seq=45409 Ack=1 Win=253 Len=1584","1638","0.000000000","0.005153000","TCP"
"1039","5.242083","5.115623000","0.000036000","0.000036000","10.22.1.2","10.1.1.2","0.000036000","12001  >  51722 [ACK] Seq=280172 Ack=100765 Win=251 Len=0","54","0.000000000","0.000036000","TCP"
"1044","5.259429","5.132969000","0.000061000","0.000061000","10.22.1.2","10.1.1.2","0.000061000","12001  >  51722 [ACK] Seq=280172 Ack=105145 Win=256 Len=0","54","0.000000000","0.000061000","TCP"
"1064","5.316658","5.190198000","0.000058000","0.000058000","10.22.1.2","10.1.1.2","0.000058000","12001  >  51722 [ACK] Seq=280172 Ack=106517 Win=251 Len=2920","2974","0.000000000","0.000058000","TCP"
"1068","5.327285","5.200825000","0.000041000","0.000041000","10.22.1.2","10.1.1.2","0.000041000","12001  >  51722 [ACK] Seq=283092 Ack=106673 Win=256 Len=4380","4434","0.000000000","0.000041000","TCP"
