"No.","Time","Time since first frame in this TCP stream","segment delta","Time delta from previous captured frame","Destination","Source","Delta Time (conv)","Info","Length","Time shift for this packet","Time delta from previous captured frame","Protocol"
"3","0.000067","0.000067000","0.000065000","0.000065000","10.202.1.2","10.1.1.2","0.000065000","12001  >  51227 [ACK] Seq=1 Ack=2596 Win=256 Len=0","54","0.000000000","0.000065000","TCP"
"6","0.001353","0.000031000","0.000029000","0.000029000","10.202.1.2","10.1.1.2","0.000029000","12002  >  51228 [ACK] Seq=1 Ack=1585 Win=256 Len=0","54","0.000000000","0.000029000","TCP"
"13","0.105204","0.105204000","0.000040000","0.000040000","10.202.1.2","10.1.1.2","0.000040000","12001  >  51227 [ACK] Seq=1 Ack=6218 Win=256 Len=0","54","0.000000000","0.000040000","TCP"
"16","0.106518","0.106518000","0.000029000","0.000029000","10.202.1.2","10.1.1.2","0.000029000","12001  >  51227 [ACK] Seq=1 Ack=7957 Win=256 Len=0","54","0.000000000","0.000029000","TCP"
"24","0.127956","0.127956000","0.005496000","0.001439000","10.202.1.2","10.1.1.2","0.005496000","12001  >  51227 [PSH, ACK] Seq=1 Ack=8850 Win=253 Len=151","205","0.000000000","0.001439000","TCP"
"25","0.129729","0.129729000","0.001773000","0.001773000","10.202.1.2","10.1.1.2","0.001773000","12001  >  51227 [PSH, ACK] Seq=152 Ack=8850 Win=253 Len=6077","6131","0.000000000","0.001773000","TCP"
"36","0.173091","0.173091000","0.000044000","0.000044000","10.202.1.2","10.1.1.2","0.000044000","12001  >  51227 [ACK] Seq=6229 Ack=11770 Win=256 Len=0","54","0.000000000","0.000044000","TCP"
"40","0.174398","0.174398000","0.000016000","0.000016000","10.202.1.2","10.1.1.2","0.000016000","12001  >  51227 [ACK] Seq=6229 Ack=16150 Win=256 Len=0","54","0.000000000","0.000016000","TCP"
"46","0.175742","0.175742000","0.000027000","0.000027000","10.202.1.2","10.1.1.2","0.000027000","12001  >  51227 [ACK] Seq=6229 Ack=22490 Win=256 Len=0","54","0.000000000","0.000027000","TCP"
"50","0.206364","0.205042000","0.000036000","0.000036000","10.202.1.2","10.1.1.2","0.000036000","12002  >  51228 [ACK] Seq=1 Ack=3345 Win=256 Len=0","54","0.000000000","0.000036000","TCP"
"53","0.284312","0.284312000","0.085974000","0.002105000","10.202.1.2","10.1.1.2","0.085974000","12001  >  51227 [PSH, ACK] Seq=6229 Ack=23395 Win=253 Len=636","690","0.000000000","0.002105000","TCP"
"55","0.287555","0.287555000","0.000032000","0.000032000","10.202.1.2","10.1.1.2","0.000032000","12001  >  51227 [PSH, ACK] Seq=6865 Ack=24133 Win=256 Len=503","557","0.000000000","0.000032000","TCP"
"60","0.292885","0.292885000","0.000032000","0.000032000","10.202.1.2","10.1.1.2","0.000032000","12001  >  51227 [PSH, ACK] Seq=7368 Ack=26203 Win=256 Len=156","210","0.000000000","0.000032000","TCP"
"69","0.399378","0.398056000","0.000030000","0.000030000","10.202.1.2","10.1.1.2","0.000030000","12002  >  51228 [ACK] Seq=1 Ack=5105 Win=256 Len=0","54","0.000000000","0.000030000","TCP"
"71","0.402030","0.402030000","0.000025000","0.000025000","10.202.1.2","10.1.1.2","0.000025000","12001  >  51227 [ACK] Seq=7524 Ack=28238 Win=256 Len=0","54","0.000000000","0.000025000","TCP"
"75","0.403373","0.403373000","0.000028000","0.000028000","10.202.1.2","10.1.1.2","0.000028000","12001  >  51227 [ACK] Seq=7524 Ack=31200 Win=256 Len=0","54","0.000000000","0.000028000","TCP"
"79","0.431318","0.431318000","0.000024000","0.000024000","10.202.1.2","10.1.1.2","0.000024000","12001  >  51227 [ACK] Seq=7524 Ack=33866 Win=256 Len=0","54","0.000000000","0.000024000","TCP"
"82","0.446590","0.446590000","0.015272000","0.000621000","10.202.1.2","10.1.1.2","0.015272000","12001  >  51227 [PSH, ACK] Seq=7524 Ack=33866 Win=256 Len=385","439","0.000000000","0.000621000","TCP"
"89","0.481910","0.481910000","0.000033000","0.000033000","10.202.1.2","10.1.1.2","0.000033000","12001  >  51227 [PSH, ACK] Seq=7909 Ack=34278 Win=255 Len=1078","1132","0.000000000","0.000033000","TCP"
"94","0.539151","0.539151000","0.000029000","0.000029000","10.202.1.2","10.1.1.2","0.000029000","12001  >  51227 [ACK] Seq=8987 Ack=37169 Win=256 Len=0","54","0.000000000","0.000029000","TCP"
"97","0.593133","0.593133000","0.034045000","0.000766000","10.202.1.2","10.1.1.2","0.034045000","12001  >  51227 [PSH, ACK] Seq=8987 Ack=37842 Win=254 Len=410","464","0.000000000","0.000766000","TCP"
"99","0.597722","0.597722000","0.000033000","0.000033000","10.202.1.2","10.1.1.2","0.000033000","12001  >  51227 [PSH, ACK] Seq=9397 Ack=38224 Win=252 Len=320","374","0.000000000","0.000033000","TCP"
"107","0.601743","0.600421000","0.000047000","0.000010000","10.202.1.2","10.1.1.2","0.000047000","12002  >  51228 [ACK] Seq=1 Ack=6865 Win=256 Len=0","54","0.000000000","0.000010000","TCP"
"108","0.602928","0.602928000","0.005206000","0.001185000","10.202.1.2","10.1.1.2","0.005206000","12001  >  51227 [PSH, ACK] Seq=9717 Ack=38224 Win=252 Len=5202","5256","0.000000000","0.001185000","TCP"
"119","0.633963","0.633963000","0.026120000","0.000756000","10.202.1.2","10.1.1.2","0.026120000","12001  >  51227 [PSH, ACK] Seq=14919 Ack=38224 Win=252 Len=381","435","0.000000000","0.000756000","TCP"
"124","0.634506","0.634506000","0.000030000","0.000030000","10.202.1.2","10.1.1.2","0.000030000","12001  >  51227 [ACK] Seq=15300 Ack=44064 Win=256 Len=0","54","0.000000000","0.000030000","TCP"
"131","0.635840","0.635840000","0.000029000","0.000029000","10.202.1.2","10.1.1.2","0.000029000","12001  >  51227 [ACK] Seq=15300 Ack=52557 Win=256 Len=0","54","0.000000000","0.000029000","TCP"
"136","0.663788","0.663788000","0.000032000","0.000032000","10.202.1.2","10.1.1.2","0.000032000","12001  >  51227 [ACK] Seq=15300 Ack=55029 Win=256 Len=0","54","0.000000000","0.000032000","TCP"
"139","0.701058","0.701058000","0.000028000","0.000028000","10.202.1.2","10.1.1.2","0.000028000","12001  >  51227 [ACK] Seq=15300 Ack=57210 Win=256 Len=0","54","0.000000000","0.000028000","TCP"
"142","0.755871","0.755871000","0.022897000","0.001589000","10.202.1.2","10.1.1.2","0.022897000","12001  >  51227 [PSH, ACK] Seq=15300 Ack=57606 Win=255 Len=775","829","0.000000000","0.001589000","TCP"
"147","0.785729","0.785729000","0.026128000","0.000775000","10.202.1.2","10.1.1.2","0.026128000","12001  >  51227 [PSH, ACK] Seq=16075 Ack=57913 Win=253 Len=482","536","0.000000000","0.000775000","TCP"
"156","0.806244","0.806244000","0.000047000","0.000047000","10.202.1.2","10.1.1.2","0.000047000","12001  >  51227 [PSH, ACK] Seq=16557 Ack=60447 Win=256 Len=172","226","0.000000000","0.000047000","TCP"
"159","0.807587","0.806265000","0.000051000","0.000051000","10.202.1.2","10.1.1.2","0.000051000","12002  >  51228 [ACK] Seq=1 Ack=8625 Win=256 Len=0","54","0.000000000","0.000051000","TCP"
"178","0.823878","0.823878000","0.000026000","0.000026000","10.202.1.2","10.1.1.2","0.000026000","12001  >  51227 [PSH, ACK] Seq=16729 Ack=61053 Win=254 Len=177","231","0.000000000","0.000026000","TCP"
"182","0.905125","0.905125000","0.000055000","0.000055000","10.202.1.2","10.1.1.2","0.000055000","12001  >  51227 [ACK] Seq=16906 Ack=63695 Win=256 Len=0","54","0.000000000","0.000055000","TCP"
"186","0.930392","0.930392000","0.000036000","0.000036000","10.202.1.2","10.1.1.2","0.000036000","12001  >  51227 [ACK] Seq=16906 Ack=68006 Win=256 Len=0","54","0.000000000","0.000036000","TCP"
"193","0.958378","0.958378000","0.000068000","0.000028000","10.202.1.2","10.1.1.2","0.000068000","12001  >  51227 [ACK] Seq=16906 Ack=70390 Win=256 Len=0","54","0.000000000","0.000028000","TCP"
"206","1.002258","1.000936000","0.000026000","0.000026000","10.202.1.2","10.1.1.2","0.000026000","12002  >  51228 [ACK] Seq=1 Ack=10385 Win=256 Len=0","54","0.000000000","0.000026000","TCP"
"211","1.054187","1.054187000","0.000031000","0.000031000","10.202.1.2","10.1.1.2","0.000031000","12001  >  51227 [ACK] Seq=16906 Ack=74193 Win=256 Len=0","54","0.000000000","0.000031000","TCP"
"232","1.088832","1.088832000","0.000048000","0.000048000","10.202.1.2","10.1.1.2","0.000048000","12001  >  51227 [ACK] Seq=16906 Ack=88490 Win=235 Len=0","54","0.000000000","0.000048000","TCP"
"233","1.088874","1.088874000","0.000042000","0.000042000","10.202.1.2","10.1.1.2","0.000042000","[TCP Window Update] 12001  >  51227 [ACK] Seq=16906 Ack=88490 Win=256 Len=0","54","0.000000000","0.000042000","TCP"
"253","1.193964","1.193964000","0.000033000","0.000033000","10.202.1.2","10.1.1.2","0.000033000","12001  >  51227 [ACK] Seq=16906 Ack=94748 Win=256 Len=0","54","0.000000000","0.000033000","TCP"
"256","1.199274","1.197952000","0.000027000","0.000027000","10.202.1.2","10.1.1.2","0.000027000","12002  >  51228 [ACK] Seq=1 Ack=12145 Win=256 Len=0","54","0.000000000","0.000027000","TCP"
"259","1.213543","1.213543000","0.019579000","0.000943000","10.202.1.2","10.1.1.2","0.019579000","12001  >  51227 [PSH, ACK] Seq=16906 Ack=94748 Win=256 Len=440","494","0.000000000","0.000943000","TCP"
"260","1.214879","1.214879000","0.001336000","0.001336000","10.202.1.2","10.1.1.2","0.001336000","12001  >  51227 [PSH, ACK] Seq=17346 Ack=94748 Win=256 Len=1474","1528","0.000000000","0.001336000","TCP"
"261","1.215444","1.215444000","0.000565000","0.000565000","10.202.1.2","10.1.1.2","0.000565000","12001  >  51227 [PSH, ACK] Seq=18820 Ack=94748 Win=256 Len=5227","5281","0.000000000","0.000565000","TCP"
"263","1.217909","1.217909000","0.000027000","0.000027000","10.202.1.2","10.1.1.2","0.000027000","12001  >  51227 [PSH, ACK] Seq=24047 Ack=94748 Win=256 Len=555","609","0.000000000","0.000027000","TCP"
"269","1.225892","1.225892000","0.000022000","0.000022000","10.202.1.2","10.1.1.2","0.000022000","12001  >  51227 [ACK] Seq=24602 Ack=97196 Win=256 Len=0","54","0.000000000","0.000022000","TCP"
"285","1.344377","1.344377000","0.000029000","0.000029000","10.202.1.2","10.1.1.2","0.000029000","12001  >  51227 [ACK] Seq=24602 Ack=100421 Win=256 Len=0","54","0.000000000","0.000029000","TCP"
"293","1.405634","1.404312000","0.000045000","0.000045000","10.202.1.2","10.1.1.2","0.000045000","12002  >  51228 [ACK] Seq=1 Ack=13905 Win=256 Len=0","54","0.000000000","0.000045000","TCP"
"298","1.436277","1.436277000","0.000062000","0.000062000","10.202.1.2","10.1.1.2","0.000062000","12001  >  51227 [ACK] Seq=24602 Ack=105460 Win=256 Len=0","54","0.000000000","0.000062000","TCP"
"310","1.490808","1.490808000","0.000029000","0.000029000","10.202.1.2","10.1.1.2","0.000029000","12001  >  51227 [ACK] Seq=24602 Ack=108899 Win=256 Len=0","54","0.000000000","0.000029000","TCP"
"316","1.518261","1.518261000","0.027453000","0.000815000","10.202.1.2","10.1.1.2","0.027453000","12001  >  51227 [PSH, ACK] Seq=24602 Ack=108899 Win=256 Len=161","215","0.000000000","0.000815000","TCP"
"318","1.520099","1.520099000","0.000036000","0.000036000","10.202.1.2","10.1.1.2","0.000036000","12001  >  51227 [PSH, ACK] Seq=24763 Ack=109270 Win=255 Len=425","479","0.000000000","0.000036000","TCP"
"319","1.520189","1.520189000","0.000090000","0.000090000","10.202.1.2","10.1.1.2","0.000090000","12001  >  51227 [PSH, ACK] Seq=25188 Ack=109270 Win=255 Len=1644","1698","0.000000000","0.000090000","TCP"
"321","1.522750","1.522750000","0.000026000","0.000026000","10.202.1.2","10.1.1.2","0.000026000","12001  >  51227 [PSH, ACK] Seq=26832 Ack=109270 Win=255 Len=943","997","0.000000000","0.000026000","TCP"
"330","1.534538","1.534538000","0.010485000","0.001129000","10.202.1.2","10.1.1.2","0.010485000","12001  >  51227 [PSH, ACK] Seq=27775 Ack=109270 Win=255 Len=6018","6072","0.000000000","0.001129000","TCP"
"337","1.565382","1.565382000","0.000045000","0.000045000","10.202.1.2","10.1.1.2","0.000045000","12001  >  51227 [ACK] Seq=33793 Ack=115110 Win=256 Len=0","54","0.000000000","0.000045000","TCP"
"344","1.566695","1.566695000","0.000029000","0.000029000","10.202.1.2","10.1.1.2","0.000029000","12001  >  51227 [ACK] Seq=33793 Ack=123223 Win=256 Len=0","54","0.000000000","0.000029000","TCP"
"350","1.607952","1.606630000","0.000030000","0.000030000","10.202.1.2","10.1.1.2","0.000030000","12002  >  51228 [ACK] Seq=1 Ack=15665 Win=256 Len=0","54","0.000000000","0.000030000","TCP"
"360","1.683162","1.683162000","0.087220000","0.000699000","10.202.1.2","10.1.1.2","0.087220000","12001  >  51227 [PSH, ACK] Seq=33793 Ack=124493 Win=251 Len=353","407","0.000000000","0.000699000","TCP"
"364","1.687821","1.687821000","0.000033000","0.000033000","10.202.1.2","10.1.1.2","0.000033000","12001  >  51227 [PSH, ACK] Seq=34146 Ack=125317 Win=256 Len=877","931","0.000000000","0.000033000","TCP"
"369","1.745073","1.745073000","0.000036000","0.000036000","10.202.1.2","10.1.1.2","0.000036000","12001  >  51227 [ACK] Seq=35023 Ack=129605 Win=256 Len=0","54","0.000000000","0.000036000","TCP"
"373","1.751774","1.751774000","0.005412000","0.001370000","10.202.1.2","10.1.1.2","0.005412000","12001  >  51227 [PSH, ACK] Seq=35023 Ack=130735 Win=252 Len=637","691","0.000000000","0.001370000","TCP"
"376","1.766405","1.766405000","0.000062000","0.000062000","10.202.1.2","10.1.1.2","0.000062000","12001  >  51227 [ACK] Seq=35660 Ack=132989 Win=256 Len=0","54","0.000000000","0.000062000","TCP"
"380","1.802323","1.801001000","0.000044000","0.000044000","10.202.1.2","10.1.1.2","0.000044000","12002  >  51228 [ACK] Seq=1 Ack=17425 Win=256 Len=0","54","0.000000000","0.000044000","TCP"
"386","1.825641","1.825641000","0.034016000","0.000702000","10.202.1.2","10.1.1.2","0.034016000","12001  >  51227 [PSH, ACK] Seq=35660 Ack=133429 Win=254 Len=681","735","0.000000000","0.000702000","TCP"
"393","1.870225","1.870225000","0.000055000","0.000055000","10.202.1.2","10.1.1.2","0.000055000","12001  >  51227 [ACK] Seq=36341 Ack=136281 Win=256 Len=0","54","0.000000000","0.000055000","TCP"
"397","1.902787","1.902787000","0.012657000","0.000631000","10.202.1.2","10.1.1.2","0.012657000","12001  >  51227 [PSH, ACK] Seq=36341 Ack=136982 Win=253 Len=171","225","0.000000000","0.000631000","TCP"
"401","1.932781","1.932781000","0.000050000","0.000050000","10.202.1.2","10.1.1.2","0.000050000","12001  >  51227 [PSH, ACK] Seq=36512 Ack=137414 Win=252 Len=152","206","0.000000000","0.000050000","TCP"
"408","1.979362","1.979362000","0.000038000","0.000035000","10.202.1.2","10.1.1.2","0.000038000","12001  >  51227 [ACK] Seq=36664 Ack=141583 Win=256 Len=0","54","0.000000000","0.000035000","TCP"
"411","1.980214","1.980214000","0.000852000","0.000775000","10.202.1.2","10.1.1.2","0.000852000","12001  >  51227 [PSH, ACK] Seq=36664 Ack=141583 Win=256 Len=454","508","0.000000000","0.000775000","TCP"
"415","1.997981","1.997981000","0.000027000","0.000027000","10.202.1.2","10.1.1.2","0.000027000","12001  >  51227 [PSH, ACK] Seq=37118 Ack=142396 Win=253 Len=147","201","0.000000000","0.000027000","TCP"
"418","2.001980","2.000658000","0.000028000","0.000028000","10.202.1.2","10.1.1.2","0.000028000","12002  >  51228 [ACK] Seq=1 Ack=19185 Win=256 Len=0","54","0.000000000","0.000028000","TCP"
"426","2.024424","2.024424000","0.026443000","0.001150000","10.202.1.2","10.1.1.2","0.026443000","12001  >  51227 [PSH, ACK] Seq=37265 Ack=142396 Win=253 Len=5388","5442","0.000000000","0.001150000","TCP"
"432","2.031266","2.031266000","0.000026000","0.000026000","10.202.1.2","10.1.1.2","0.000026000","12001  >  51227 [ACK] Seq=42653 Ack=148236 Win=256 Len=0","54","0.000000000","0.000026000","TCP"
"440","2.032616","2.032616000","0.000035000","0.000035000","10.202.1.2","10.1.1.2","0.000035000","12001  >  51227 [ACK] Seq=42653 Ack=155969 Win=256 Len=0","54","0.000000000","0.000035000","TCP"
"445","2.075849","2.075849000","0.010002000","0.000645000","10.202.1.2","10.1.1.2","0.010002000","12001  >  51227 [PSH, ACK] Seq=42653 Ack=156844 Win=253 Len=416","470","0.000000000","0.000645000","TCP"
"447","2.104482","2.104482000","0.000031000","0.000031000","10.202.1.2","10.1.1.2","0.000031000","12001  >  51227 [PSH, ACK] Seq=43069 Ack=157232 Win=251 Len=156","210","0.000000000","0.000031000","TCP"
"453","2.145117","2.145117000","0.022030000","0.000663000","10.202.1.2","10.1.1.2","0.022030000","12001  >  51227 [PSH, ACK] Seq=43225 Ack=157562 Win=256 Len=319","373","0.000000000","0.000663000","TCP"
"460","2.176394","2.176394000","0.000053000","0.000013000","10.202.1.2","10.1.1.2","0.000053000","12001  >  51227 [PSH, ACK] Seq=43544 Ack=159532 Win=256 Len=152","206","0.000000000","0.000013000","TCP"
"463","2.200324","2.199002000","0.000026000","0.000026000","10.202.1.2","10.1.1.2","0.000026000","12002  >  51228 [ACK] Seq=1 Ack=20945 Win=256 Len=0","54","0.000000000","0.000026000","TCP"
"465","2.202983","2.202983000","0.000028000","0.000028000","10.202.1.2","10.1.1.2","0.000028000","12001  >  51227 [PSH, ACK] Seq=43696 Ack=160052 Win=254 Len=152","206","0.000000000","0.000028000","TCP"
"470","2.227737","2.227737000","0.000814000","0.000763000","10.202.1.2","10.1.1.2","0.000814000","12001  >  51227 [PSH, ACK] Seq=43848 Ack=160442 Win=253 Len=402","456","0.000000000","0.000763000","TCP"
"474","2.288197","2.288197000","0.000037000","0.000037000","10.202.1.2","10.1.1.2","0.000037000","12001  >  51227 [PSH, ACK] Seq=44250 Ack=164476 Win=256 Len=173","227","0.000000000","0.000037000","TCP"
"480","2.312149","2.312149000","0.000033000","0.000033000","10.202.1.2","10.1.1.2","0.000033000","12001  >  51227 [PSH, ACK] Seq=44423 Ack=166713 Win=256 Len=623","677","0.000000000","0.000033000","TCP"
"484","2.334773","2.334773000","0.000030000","0.000030000","10.202.1.2","10.1.1.2","0.000030000","12001  >  51227 [PSH, ACK] Seq=45046 Ack=167179 Win=254 Len=276","330","0.000000000","0.000030000","TCP"
"488","2.383150","2.383150000","0.013786000","0.000441000","10.202.1.2","10.1.1.2","0.013786000","12001  >  51227 [PSH, ACK] Seq=45322 Ack=167498 Win=253 Len=367","421","0.000000000","0.000441000","TCP"
"491","2.400006","2.398684000","0.000029000","0.000029000","10.202.1.2","10.1.1.2","0.000029000","12002  >  51228 [ACK] Seq=1 Ack=22705 Win=256 Len=0","54","0.000000000","0.000029000","TCP"
"494","2.412004","2.412004000","0.000041000","0.000041000","10.202.1.2","10.1.1.2","0.000041000","12001  >  51227 [ACK] Seq=45689 Ack=170076 Win=256 Len=0","54","0.000000000","0.000041000","TCP"
"499","2.457951","2.457951000","0.031355000","0.000685000","10.202.1.2","10.1.1.2","0.031355000","12001  >  51227 [PSH, ACK] Seq=45689 Ack=170801 Win=253 Len=287","341","0.000000000","0.000685000","TCP"
"508","2.471674","2.471674000","0.013723000","0.001093000","10.202.1.2","10.1.1.2","0.013723000","12001  >  51227 [PSH, ACK] Seq=45976 Ack=170801 Win=253 Len=5246","5300","0.000000000","0.001093000","TCP"
"516","2.495848","2.495848000","0.000032000","0.000032000","10.202.1.2","10.1.1.2","0.000032000","12001  >  51227 [ACK] Seq=51222 Ack=172723 Win=256 Len=0","54","0.000000000","0.000032000","TCP"
"526","2.497212","2.497212000","0.000042000","0.000042000","10.202.1.2","10.1.1.2","0.000042000","12001  >  51227 [ACK] Seq=51222 Ack=185453 Win=241 Len=0","54","0.000000000","0.000042000","TCP"
"527","2.497258","2.497258000","0.000046000","0.000046000","10.202.1.2","10.1.1.2","0.000046000","[TCP Window Update] 12001  >  51227 [ACK] Seq=51222 Ack=185453 Win=256 Len=0","54","0.000000000","0.000046000","TCP"
"530","2.538464","2.538464000","0.000040000","0.000040000","10.202.1.2","10.1.1.2","0.000040000","12001  >  51227 [ACK] Seq=51222 Ack=187883 Win=256 Len=0","54","0.000000000","0.000040000","TCP"
"534","2.549863","2.549863000","0.011399000","0.000755000","10.202.1.2","10.1.1.2","0.011399000","12001  >  51227 [PSH, ACK] Seq=51222 Ack=187883 Win=256 Len=346","400","0.000000000","0.000755000","TCP"
"537","2.569081","2.569081000","0.000042000","0.000042000","10.202.1.2","10.1.1.2","0.000042000","12001  >  51227 [PSH, ACK] Seq=51568 Ack=190146 Win=256 Len=148","202","0.000000000","0.000042000","TCP"
"541","2.605008","2.603686000","0.000029000","0.000029000","10.202.1.2","10.1.1.2","0.000029000","12002  >  51228 [ACK] Seq=1 Ack=24465 Win=256 Len=0","54","0.000000000","0.000029000","TCP"
"549","2.613692","2.613692000","0.015374000","0.000731000","10.202.1.2","10.1.1.2","0.015374000","12001  >  51227 [PSH, ACK] Seq=51716 Ack=190559 Win=255 Len=487","541","0.000000000","0.000731000","TCP"
"555","2.627630","2.627630000","0.000027000","0.000027000","10.202.1.2","10.1.1.2","0.000027000","12001  >  51227 [PSH, ACK] Seq=52203 Ack=190876 Win=253 Len=203","257","0.000000000","0.000027000","TCP"
"562","2.667579","2.667579000","0.000035000","0.000035000","10.202.1.2","10.1.1.2","0.000035000","12001  >  51227 [PSH, ACK] Seq=52406 Ack=193174 Win=256 Len=377","431","0.000000000","0.000035000","TCP"
"570","2.768082","2.768082000","0.079242000","0.000653000","10.202.1.2","10.1.1.2","0.079242000","12001  >  51227 [PSH, ACK] Seq=52783 Ack=193764 Win=254 Len=170","224","0.000000000","0.000653000","TCP"
"574","2.770081","2.770081000","0.000033000","0.000033000","10.202.1.2","10.1.1.2","0.000033000","12001  >  51227 [PSH, ACK] Seq=52953 Ack=196813 Win=256 Len=757","811","0.000000000","0.000033000","TCP"
"578","2.802017","2.800695000","0.000026000","0.000026000","10.202.1.2","10.1.1.2","0.000026000","12002  >  51228 [ACK] Seq=1 Ack=26225 Win=256 Len=0","54","0.000000000","0.000026000","TCP"
"582","2.807342","2.807342000","0.000025000","0.000025000","10.202.1.2","10.1.1.2","0.000025000","12001  >  51227 [ACK] Seq=53710 Ack=200927 Win=256 Len=0","54","0.000000000","0.000025000","TCP"
"588","2.824188","2.824188000","0.016846000","0.000816000","10.202.1.2","10.1.1.2","0.016846000","12001  >  51227 [PSH, ACK] Seq=53710 Ack=200927 Win=256 Len=171","225","0.000000000","0.000816000","TCP"
"591","2.831306","2.831306000","0.000029000","0.000029000","10.202.1.2","10.1.1.2","0.000029000","12001  >  51227 [ACK] Seq=53881 Ack=203208 Win=256 Len=0","54","0.000000000","0.000029000","TCP"
"594","2.862551","2.862551000","0.031245000","0.000626000","10.202.1.2","10.1.1.2","0.031245000","12001  >  51227 [PSH, ACK] Seq=53881 Ack=203208 Win=256 Len=471","525","0.000000000","0.000626000","TCP"
"602","2.919237","2.919237000","0.056014000","0.001393000","10.202.1.2","10.1.1.2","0.056014000","12001  >  51227 [PSH, ACK] Seq=54352 Ack=203731 Win=254 Len=5852","5906","0.000000000","0.001393000","TCP"
"609","2.936471","2.936471000","0.000029000","0.000029000","10.202.1.2","10.1.1.2","0.000029000","12001  >  51227 [ACK] Seq=60204 Ack=206756 Win=256 Len=0","54","0.000000000","0.000029000","TCP"
"616","2.961792","2.961792000","0.000041000","0.000041000","10.202.1.2","10.1.1.2","0.000041000","12001  >  51227 [ACK] Seq=60204 Ack=215516 Win=256 Len=0","54","0.000000000","0.000041000","TCP"
"621","2.963101","2.963101000","0.000029000","0.000029000","10.202.1.2","10.1.1.2","0.000029000","12001  >  51227 [ACK] Seq=60204 Ack=220825 Win=256 Len=0","54","0.000000000","0.000029000","TCP"
"626","2.976026","2.976026000","0.012925000","0.000932000","10.202.1.2","10.1.1.2","0.012925000","12001  >  51227 [PSH, ACK] Seq=60204 Ack=220825 Win=256 Len=372","426","0.000000000","0.000932000","TCP"
"630","2.999054","2.997732000","0.000042000","0.000042000","10.202.1.2","10.1.1.2","0.000042000","12002  >  51228 [ACK] Seq=1 Ack=27985 Win=256 Len=0","54","0.000000000","0.000042000","TCP"
"638","3.076297","3.076297000","0.000064000","0.000064000","10.202.1.2","10.1.1.2","0.000064000","12001  >  51227 [ACK] Seq=60576 Ack=225918 Win=256 Len=0","54","0.000000000","0.000064000","TCP"
"643","3.094880","3.094880000","0.000030000","0.000030000","10.202.1.2","10.1.1.2","0.000030000","12001  >  51227 [ACK] Seq=60576 Ack=228455 Win=256 Len=0","54","0.000000000","0.000030000","TCP"
"651","3.194723","3.194723000","0.000033000","0.000033000","10.202.1.2","10.1.1.2","0.000033000","12001  >  51227 [ACK] Seq=60576 Ack=230392 Win=256 Len=0","54","0.000000000","0.000033000","TCP"
"655","3.201377","3.200055000","0.000029000","0.000029000","10.202.1.2","10.1.1.2","0.000029000","12002  >  51228 [ACK] Seq=1 Ack=29745 Win=256 Len=0","54","0.000000000","0.000029000","TCP"
"665","3.293233","3.293233000","0.000030000","0.000030000","10.202.1.2","10.1.1.2","0.000030000","12001  >  51227 [ACK] Seq=60576 Ack=235347 Win=256 Len=0","54","0.000000000","0.000030000","TCP"
"673","3.334494","3.334494000","0.000028000","0.000028000","10.202.1.2","10.1.1.2","0.000028000","12001  >  51227 [ACK] Seq=60576 Ack=239607 Win=256 Len=0","54","0.000000000","0.000028000","TCP"
"676","3.359787","3.359787000","0.000028000","0.000028000","10.202.1.2","10.1.1.2","0.000028000","12001  >  51227 [ACK] Seq=60576 Ack=241932 Win=256 Len=0","54","0.000000000","0.000028000","TCP"
"691","3.401051","3.399729000","0.000028000","0.000028000","10.202.1.2","10.1.1.2","0.000028000","12002  >  51228 [ACK] Seq=1 Ack=31505 Win=256 Len=0","54","0.000000000","0.000028000","TCP"
"698","3.426348","3.426348000","0.000029000","0.000029000","10.202.1.2","10.1.1.2","0.000029000","12001  >  51227 [ACK] Seq=60576 Ack=246635 Win=256 Len=0","54","0.000000000","0.000029000","TCP"
"707","3.427690","3.427690000","0.000032000","0.000032000","10.202.1.2","10.1.1.2","0.000032000","12001  >  51227 [ACK] Seq=60576 Ack=252475 Win=256 Len=0","54","0.000000000","0.000032000","TCP"
"709","3.427733","3.427733000","0.000043000","0.000014000","10.202.1.2","10.1.1.2","0.000043000","12001  >  51227 [ACK] Seq=60576 Ack=256092 Win=253 Len=0","54","0.000000000","0.000014000","TCP"
"721","3.546204","3.546204000","0.090594000","0.001368000","10.202.1.2","10.1.1.2","0.090594000","12001  >  51227 [PSH, ACK] Seq=60576 Ack=257383 Win=256 Len=288","342","0.000000000","0.001368000","TCP"
"722","3.548379","3.548379000","0.002175000","0.002175000","10.202.1.2","10.1.1.2","0.002175000","12001  >  51227 [PSH, ACK] Seq=60864 Ack=257383 Win=256 Len=1849","1903","0.000000000","0.002175000","TCP"
"724","3.548816","3.548816000","0.000034000","0.000034000","10.202.1.2","10.1.1.2","0.000034000","12001  >  51227 [PSH, ACK] Seq=62713 Ack=258217 Win=253 Len=669","723","0.000000000","0.000034000","TCP"
"725","3.550292","3.550292000","0.001476000","0.001476000","10.202.1.2","10.1.1.2","0.001476000","12001  >  51227 [PSH, ACK] Seq=63382 Ack=258217 Win=253 Len=6046","6100","0.000000000","0.001476000","TCP"
"738","3.602064","3.600742000","0.000031000","0.000031000","10.202.1.2","10.1.1.2","0.000031000","12002  >  51228 [ACK] Seq=1 Ack=33265 Win=256 Len=0","54","0.000000000","0.000031000","TCP"
"745","3.620708","3.620708000","0.000034000","0.000034000","10.202.1.2","10.1.1.2","0.000034000","12001  >  51227 [ACK] Seq=69428 Ack=263562 Win=256 Len=0","54","0.000000000","0.000034000","TCP"
"752","3.637996","3.637996000","0.000023000","0.000023000","10.202.1.2","10.1.1.2","0.000023000","12001  >  51227 [ACK] Seq=69428 Ack=265990 Win=256 Len=0","54","0.000000000","0.000023000","TCP"
"758","3.709455","3.709455000","0.048851000","0.000893000","10.202.1.2","10.1.1.2","0.048851000","12001  >  51227 [PSH, ACK] Seq=69428 Ack=266392 Win=255 Len=392","446","0.000000000","0.000893000","TCP"
"759","3.711309","3.711309000","0.001854000","0.001854000","10.202.1.2","10.1.1.2","0.001854000","12001  >  51227 [PSH, ACK] Seq=69820 Ack=266392 Win=255 Len=1659","1713","0.000000000","0.001854000","TCP"
"761","3.712550","3.712550000","0.000032000","0.000032000","10.202.1.2","10.1.1.2","0.000032000","12001  >  51227 [PSH, ACK] Seq=71479 Ack=266699 Win=253 Len=633","687","0.000000000","0.000032000","TCP"
"767","3.734817","3.734817000","0.016973000","0.000975000","10.202.1.2","10.1.1.2","0.016973000","12001  >  51227 [PSH, ACK] Seq=72112 Ack=266699 Win=253 Len=167","221","0.000000000","0.000975000","TCP"
"770","3.737840","3.737840000","0.000026000","0.000026000","10.202.1.2","10.1.1.2","0.000026000","12001  >  51227 [ACK] Seq=72279 Ack=269073 Win=256 Len=0","54","0.000000000","0.000026000","TCP"
"775","3.771117","3.771117000","0.000029000","0.000029000","10.202.1.2","10.1.1.2","0.000029000","12001  >  51227 [PSH, ACK] Seq=72279 Ack=269715 Win=254 Len=160","214","0.000000000","0.000029000","TCP"
"779","3.807062","3.805740000","0.000026000","0.000026000","10.202.1.2","10.1.1.2","0.000026000","12002  >  51228 [ACK] Seq=1 Ack=35025 Win=256 Len=0","54","0.000000000","0.000026000","TCP"
"784","3.843011","3.843011000","0.000030000","0.000030000","10.202.1.2","10.1.1.2","0.000030000","12001  >  51227 [ACK] Seq=72439 Ack=274280 Win=256 Len=0","54","0.000000000","0.000030000","TCP"
"787","3.859582","3.859582000","0.001965000","0.000634000","10.202.1.2","10.1.1.2","0.001965000","12001  >  51227 [PSH, ACK] Seq=72439 Ack=275143 Win=253 Len=453","507","0.000000000","0.000634000","TCP"
"794","3.862754","3.862754000","0.003172000","0.001112000","10.202.1.2","10.1.1.2","0.003172000","12001  >  51227 [PSH, ACK] Seq=72892 Ack=275143 Win=253 Len=5449","5503","0.000000000","0.001112000","TCP"
"811","3.898955","3.898955000","0.000046000","0.000046000","10.202.1.2","10.1.1.2","0.000046000","12001  >  51227 [ACK] Seq=78341 Ack=288644 Win=238 Len=0","54","0.000000000","0.000046000","TCP"
"812","3.898992","3.898992000","0.000037000","0.000037000","10.202.1.2","10.1.1.2","0.000037000","[TCP Window Update] 12001  >  51227 [ACK] Seq=78341 Ack=288644 Win=256 Len=0","54","0.000000000","0.000037000","TCP"
"819","3.932891","3.932891000","0.006052000","0.000646000","10.202.1.2","10.1.1.2","0.006052000","12001  >  51227 [PSH, ACK] Seq=78341 Ack=289565 Win=253 Len=455","509","0.000000000","0.000646000","TCP"
"821","3.964154","3.964154000","0.000039000","0.000039000","10.202.1.2","10.1.1.2","0.000039000","12001  >  51227 [PSH, ACK] Seq=78796 Ack=289957 Win=251 Len=191","245","0.000000000","0.000039000","TCP"
"825","4.000123","3.998801000","0.000057000","0.000057000","10.202.1.2","10.1.1.2","0.000057000","12002  >  51228 [ACK] Seq=1 Ack=36785 Win=256 Len=0","54","0.000000000","0.000057000","TCP"
"828","4.014582","4.014582000","0.025174000","0.001162000","10.202.1.2","10.1.1.2","0.025174000","12001  >  51227 [PSH, ACK] Seq=78987 Ack=290275 Win=256 Len=538","592","0.000000000","0.001162000","TCP"
"834","4.044015","4.044015000","0.000031000","0.000031000","10.202.1.2","10.1.1.2","0.000031000","12001  >  51227 [PSH, ACK] Seq=79525 Ack=292281 Win=256 Len=154","208","0.000000000","0.000031000","TCP"
"843","4.076533","4.076533000","0.017906000","0.000598000","10.202.1.2","10.1.1.2","0.017906000","12001  >  51227 [PSH, ACK] Seq=79679 Ack=292754 Win=254 Len=475","529","0.000000000","0.000598000","TCP"
"849","4.143874","4.143874000","0.000040000","0.000040000","10.202.1.2","10.1.1.2","0.000040000","12001  >  51227 [ACK] Seq=80154 Ack=297009 Win=256 Len=0","54","0.000000000","0.000040000","TCP"
"852","4.164551","4.164551000","0.020677000","0.000728000","10.202.1.2","10.1.1.2","0.020677000","12001  >  51227 [PSH, ACK] Seq=80154 Ack=297009 Win=256 Len=161","215","0.000000000","0.000728000","TCP"
"855","4.178471","4.178471000","0.000035000","0.000035000","10.202.1.2","10.1.1.2","0.000035000","12001  >  51227 [PSH, ACK] Seq=80315 Ack=299455 Win=256 Len=572","626","0.000000000","0.000035000","TCP"
"859","4.203755","4.202433000","0.000027000","0.000027000","10.202.1.2","10.1.1.2","0.000027000","12002  >  51228 [ACK] Seq=1 Ack=38545 Win=256 Len=0","54","0.000000000","0.000027000","TCP"
"870","4.268974","4.268974000","0.000023000","0.000023000","10.202.1.2","10.1.1.2","0.000023000","12001  >  51227 [ACK] Seq=80887 Ack=301372 Win=256 Len=0","54","0.000000000","0.000023000","TCP"
"887","4.358192","4.358192000","0.000035000","0.000035000","10.202.1.2","10.1.1.2","0.000035000","12001  >  51227 [ACK] Seq=80887 Ack=310130 Win=256 Len=0","54","0.000000000","0.000035000","TCP"
"894","4.359524","4.359524000","0.000036000","0.000036000","10.202.1.2","10.1.1.2","0.000036000","12001  >  51227 [ACK] Seq=80887 Ack=318128 Win=256 Len=0","54","0.000000000","0.000036000","TCP"
"908","4.408775","4.408775000","0.000045000","0.000042000","10.202.1.2","10.1.1.2","0.000045000","12001  >  51227 [ACK] Seq=80887 Ack=320543 Win=256 Len=0","54","0.000000000","0.000042000","TCP"
"909","4.408784","4.407462000","0.000051000","0.000009000","10.202.1.2","10.1.1.2","0.000051000","12002  >  51228 [ACK] Seq=1 Ack=40305 Win=256 Len=0","54","0.000000000","0.000009000","TCP"
"913","4.426059","4.426059000","0.000024000","0.000024000","10.202.1.2","10.1.1.2","0.000024000","12001  >  51227 [ACK] Seq=80887 Ack=322689 Win=256 Len=0","54","0.000000000","0.000024000","TCP"
"917","4.478779","4.478779000","0.023461000","0.000789000","10.202.1.2","10.1.1.2","0.023461000","12001  >  51227 [PSH, ACK] Seq=80887 Ack=323060 Win=255 Len=270","324","0.000000000","0.000789000","TCP"
"918","4.480238","4.480238000","0.001459000","0.001459000","10.202.1.2","10.1.1.2","0.001459000","12001  >  51227 [PSH, ACK] Seq=81157 Ack=323060 Win=255 Len=5928","5982","0.000000000","0.001459000","TCP"
"920","4.485966","4.485966000","0.000031000","0.000031000","10.202.1.2","10.1.1.2","0.000031000","12001  >  51227 [PSH, ACK] Seq=87085 Ack=323060 Win=255 Len=360","414","0.000000000","0.000031000","TCP"
"930","4.548543","4.548543000","0.000038000","0.000038000","10.202.1.2","10.1.1.2","0.000038000","12001  >  51227 [PSH, ACK] Seq=87445 Ack=325860 Win=256 Len=1189","1243","0.000000000","0.000038000","TCP"
"935","4.609781","4.608459000","0.000038000","0.000038000","10.202.1.2","10.1.1.2","0.000038000","12002  >  51228 [ACK] Seq=1 Ack=42065 Win=256 Len=0","54","0.000000000","0.000038000","TCP"
"938","4.632865","4.632865000","0.059067000","0.000499000","10.202.1.2","10.1.1.2","0.059067000","12001  >  51227 [PSH, ACK] Seq=88634 Ack=326450 Win=254 Len=180","234","0.000000000","0.000499000","TCP"
"940","4.636385","4.636385000","0.000027000","0.000027000","10.202.1.2","10.1.1.2","0.000027000","12001  >  51227 [PSH, ACK] Seq=88814 Ack=326828 Win=252 Len=534","588","0.000000000","0.000027000","TCP"
"944","4.661773","4.661773000","0.000087000","0.000087000","10.202.1.2","10.1.1.2","0.000087000","12001  >  51227 [ACK] Seq=89348 Ack=330599 Win=256 Len=0","54","0.000000000","0.000087000","TCP"
"950","4.697070","4.697070000","0.028757000","0.000741000","10.202.1.2","10.1.1.2","0.028757000","12001  >  51227 [PSH, ACK] Seq=89348 Ack=331363 Win=253 Len=284","338","0.000000000","0.000741000","TCP"
"955","4.708264","4.708264000","0.000022000","0.000022000","10.202.1.2","10.1.1.2","0.000022000","12001  >  51227 [ACK] Seq=89632 Ack=333880 Win=256 Len=0","54","0.000000000","0.000022000","TCP"
"958","4.784940","4.784940000","0.054064000","0.000817000","10.202.1.2","10.1.1.2","0.054064000","12001  >  51227 [PSH, ACK] Seq=89632 Ack=334387 Win=254 Len=521","575","0.000000000","0.000817000","TCP"
"962","4.788142","4.788142000","0.000030000","0.000030000","10.202.1.2","10.1.1.2","0.000030000","12001  >  51227 [PSH, ACK] Seq=90153 Ack=334703 Win=253 Len=702","756","0.000000000","0.000030000","TCP"
"965","4.801455","4.800133000","0.000027000","0.000027000","10.202.1.2","10.1.1.2","0.000027000","12002  >  51228 [ACK] Seq=1 Ack=43825 Win=256 Len=0","54","0.000000000","0.000027000","TCP"
"968","4.820097","4.820097000","0.000031000","0.000031000","10.202.1.2","10.1.1.2","0.000031000","12001  >  51227 [ACK] Seq=90855 Ack=337522 Win=256 Len=0","54","0.000000000","0.000031000","TCP"
"973","4.841388","4.841388000","0.000024000","0.000024000","10.202.1.2","10.1.1.2","0.000024000","12001  >  51227 [ACK] Seq=90855 Ack=341902 Win=256 Len=0","54","0.000000000","0.000024000","TCP"
"981","4.842744","4.842744000","0.000035000","0.000035000","10.202.1.2","10.1.1.2","0.000035000","12001  >  51227 [ACK] Seq=90855 Ack=351509 Win=253 Len=0","54","0.000000000","0.000035000","TCP"
"987","4.929252","4.929252000","0.000029000","0.000029000","10.202.1.2","10.1.1.2","0.000029000","12001  >  51227 [ACK] Seq=90855 Ack=355263 Win=256 Len=0","54","0.000000000","0.000029000","TCP"
"990","4.930581","4.930581000","0.000027000","0.000027000","10.202.1.2","10.1.1.2","0.000027000","12001  >  51227 [ACK] Seq=90855 Ack=357671 Win=256 Len=0","54","0.000000000","0.000027000","TCP"
"994","4.937059","4.937059000","0.006478000","0.001154000","10.202.1.2","10.1.1.2","0.006478000","12001  >  51227 [PSH, ACK] Seq=90855 Ack=357671 Win=256 Len=5284","5338","0.000000000","0.001154000","TCP"
"996","4.941227","4.941227000","0.000025000","0.000025000","10.202.1.2","10.1.1.2","0.000025000","12001  >  51227 [PSH, ACK] Seq=96139 Ack=357671 Win=256 Len=632","686","0.000000000","0.000025000","TCP"
"1000","4.966541","4.966541000","0.000042000","0.000042000","10.202.1.2","10.1.1.2","0.000042000","12001  >  51227 [PSH, ACK] Seq=96771 Ack=360115 Win=256 Len=586","640","0.000000000","0.000042000","TCP"
"1004","5.003801","5.002479000","0.000031000","0.000031000","10.202.1.2","10.1.1.2","0.000031000","12002  >  51228 [ACK] Seq=1 Ack=45585 Win=256 Len=0","54","0.000000000","0.000031000","TCP"
"1010","5.075714","5.075714000","0.000058000","0.000058000","10.202.1.2","10.1.1.2","0.000058000","12001  >  51227 [ACK] Seq=97357 Ack=362044 Win=256 Len=0","54","0.000000000","0.000058000","TCP"
"1015","5.087738","5.087738000","0.010760000","0.001384000","10.202.1.2","10.1.1.2","0.010760000","12001  >  51227 [PSH, ACK] Seq=97357 Ack=363358 Win=251 Len=1414","1468","0.000000000","0.001384000","TCP"
"1020","5.166688","5.166688000","0.072399000","0.000518000","10.202.1.2","10.1.1.2","0.072399000","12001  >  51227 [PSH, ACK] Seq=98771 Ack=363993 Win=256 Len=372","426","0.000000000","0.000518000","TCP"
"1022","5.171529","5.171529000","0.000036000","0.000036000","10.202.1.2","10.1.1.2","0.000036000","12001  >  51227 [PSH, ACK] Seq=99143 Ack=364399 Win=255 Len=172","226","0.000000000","0.000036000","TCP"
"1025","5.174193","5.174193000","0.000033000","0.000033000","10.202.1.2","10.1.1.2","0.000033000","12001  >  51227 [ACK] Seq=99315 Ack=366693 Win=256 Len=0","54","0.000000000","0.000033000","TCP"
"1028","5.206144","5.204822000","0.000034000","0.000034000","10.202.1.2","10.1.1.2","0.000034000","12002  >  51228 [ACK] Seq=1 Ack=47345 Win=256 Len=0","54","0.000000000","0.000034000","TCP"
"1032","5.208805","5.208805000","0.000032000","0.000032000","10.202.1.2","10.1.1.2","0.000032000","12001  >  51227 [ACK] Seq=99315 Ack=370924 Win=256 Len=0","54","0.000000000","0.000032000","TCP"
"1037","5.230097","5.230097000","0.000029000","0.000029000","10.202.1.2","10.1.1.2","0.000029000","12001  >  51227 [ACK] Seq=99315 Ack=373325 Win=256 Len=0","54","0.000000000","0.000029000","TCP"
"1040","5.242725","5.242725000","0.012628000","0.000642000","10.202.1.2","10.1.1.2","0.012628000","12001  >  51227 [PSH, ACK] Seq=99315 Ack=373325 Win=256 Len=167","221","0.000000000","0.000642000","TCP"
"1046","5.263232","5.263232000","0.020507000","0.001219000","10.202.1.2","10.1.1.2","0.020507000","12001  >  51227 [PSH, ACK] Seq=99482 Ack=373325 Win=256 Len=5913","5967","0.000000000","0.001219000","TCP"
"1051","5.303344","5.303344000","0.000054000","0.000054000","10.202.1.2","10.1.1.2","0.000054000","12001  >  51227 [ACK] Seq=105395 Ack=375148 Win=256 Len=0","54","0.000000000","0.000054000","TCP"
"1057","5.304665","5.304665000","0.000039000","0.000039000","10.202.1.2","10.1.1.2","0.000039000","12001  >  51227 [ACK] Seq=105395 Ack=382448 Win=256 Len=0","54","0.000000000","0.000039000","TCP"
"1062","5.305986","5.305986000","0.000033000","0.000033000","10.202.1.2","10.1.1.2","0.000033000","12001  >  51227 [ACK] Seq=105395 Ack=387702 Win=256 Len=0","54","0.000000000","0.000033000","TCP"
"1065","5.317343","5.317343000","0.011357000","0.000685000","10.202.1.2","10.1.1.2","0.011357000","12001  >  51227 [PSH, ACK] Seq=105395 Ack=387702 Win=256 Len=426","480","0.000000000","0.000685000","TCP"
"1070","5.340636","5.340636000","0.000070000","0.000070000","10.202.1.2","10.1.1.2","0.000070000","12001  >  51227 [PSH, ACK] Seq=105821 Ack=388914 Win=251 Len=156","210","0.000000000","0.000070000","TCP"
"1075","5.395784","5.395784000","0.032597000","0.000652000","10.202.1.2","10.1.1.2","0.032597000","12001  >  51227 [PSH, ACK] Seq=105977 Ack=389350 Win=256 Len=166","220","0.000000000","0.000652000","TCP"
"1077","5.399155","5.399155000","0.000030000","0.000030000","10.202.1.2","10.1.1.2","0.000030000","12001  >  51227 [PSH, ACK] Seq=106143 Ack=389670 Win=255 Len=371","425","0.000000000","0.000030000","TCP"
