"No.","Time","Source","Destination","Protocol","Length","Info"
"109","15.682248562","10.210.73.137","13.107.6.152","TCP","68","45022  >  443 [ACK] Seq=5 Ack=70 Win=1444 Len=0 TSval=3683961 TSecr=20839203"
"111","15.683493811","10.210.73.137","13.107.6.152","TCP","68","45022  >  443 [ACK] Seq=1 Ack=187 Win=1444 Len=0 TSval=3683961 TSecr=20839203"
"109","16.682248562","10.210.73.137","13.107.6.152","TCP","68","45022  >  443 [ACK] Seq=3 Ack=70 Win=1444 Len=0 TSval=3683961 TSecr=20839203"
"111","18.683493811","10.210.73.137","13.107.6.152","TCP","68","45022  >  443 [ACK] Seq=1 Ack=187 Win=1444 Len=0 TSval=3683961 TSecr=20839203"
