"No.","Time","Time since first frame in this TCP stream","segment delta","Time delta from previous captured frame","Destination","Delta Time (conv)","Info","Length","Time shift for this packet","Source","Time delta from previous captured frame","Protocol"
"1","0.000000","0.000000000","0.000000000","0.000000000","10.1.1.2","0.000000000","53639  >  12003 [ACK] Seq=1 Ack=1 Win=65335 Len=0","60","0.000000000","10.22.1.2","0.000000000","TCP"
"7","0.089188","0.000000000","0.000000000","0.089077000","10.1.1.2","0.000000000","53640  >  12002 [ACK] Seq=1 Ack=1 Win=16425 Len=0","60","0.000000000","10.22.1.2","0.089077000","TCP"
"10","0.211650","0.211650000","0.211558000","0.103169000","10.1.1.2","0.211558000","53639  >  12003 [ACK] Seq=1 Ack=2921 Win=65335 Len=0","60","0.000000000","10.22.1.2","0.103169000","TCP"
"13","0.280864","0.191676000","0.172383000","0.021299000","10.1.1.2","0.172383000","53640  >  12002 [ACK] Seq=1 Ack=125 Win=16394 Len=0","60","0.000000000","10.22.1.2","0.021299000","TCP"
"15","0.286186","0.286186000","0.074490000","0.005283000","10.1.1.2","0.074490000","53639  >  12003 [ACK] Seq=1 Ack=7301 Win=65335 Len=0","60","0.000000000","10.22.1.2","0.005283000","TCP"
"20","0.360742","0.360742000","0.074529000","0.046562000","10.1.1.2","0.074529000","53639  >  12003 [ACK] Seq=1 Ack=8761 Win=65335 Len=1460","1514","0.000000000","10.22.1.2","0.046562000","TCP"
"21","0.360745","0.360745000","0.000003000","0.000003000","10.1.1.2","0.000003000","53639  >  12003 [ACK] Seq=1461 Ack=8761 Win=65335 Len=1460","1514","0.000000000","10.22.1.2","0.000003000","TCP"
"23","0.362067","0.362067000","0.001254000","0.001254000","10.1.1.2","0.001254000","53639  >  12003 [ACK] Seq=2921 Ack=8761 Win=65335 Len=1460","1514","0.000000000","10.22.1.2","0.001254000","TCP"
"24","0.362070","0.362070000","0.000003000","0.000003000","10.1.1.2","0.000003000","53639  >  12003 [ACK] Seq=4381 Ack=8761 Win=65335 Len=1460","1514","0.000000000","10.22.1.2","0.000003000","TCP"
"25","0.362073","0.362073000","0.000003000","0.000003000","10.1.1.2","0.000003000","53639  >  12003 [ACK] Seq=5841 Ack=8761 Win=65335 Len=1460","1514","0.000000000","10.22.1.2","0.000003000","TCP"
"27","0.363401","0.363401000","0.001297000","0.001297000","10.1.1.2","0.001297000","53639  >  12003 [ACK] Seq=7301 Ack=8761 Win=65335 Len=1460","1514","0.000000000","10.22.1.2","0.001297000","TCP"
"28","0.363403","0.363403000","0.000002000","0.000002000","10.1.1.2","0.000002000","53639  >  12003 [ACK] Seq=8761 Ack=8761 Win=65335 Len=1460","1514","0.000000000","10.22.1.2","0.000002000","TCP"
"29","0.363405","0.363405000","0.000002000","0.000002000","10.1.1.2","0.000002000","53639  >  12003 [ACK] Seq=10221 Ack=8761 Win=65335 Len=1460","1514","0.000000000","10.22.1.2","0.000002000","TCP"
"30","0.363406","0.363406000","0.000001000","0.000001000","10.1.1.2","0.000001000","53639  >  12003 [ACK] Seq=11681 Ack=8761 Win=65335 Len=1460","1514","0.000000000","10.22.1.2","0.000001000","TCP"
"32","0.364728","0.364728000","0.001287000","0.001287000","10.1.1.2","0.001287000","53639  >  12003 [ACK] Seq=13141 Ack=8761 Win=65335 Len=1460","1514","0.000000000","10.22.1.2","0.001287000","TCP"
"33","0.364730","0.364730000","0.000002000","0.000002000","10.1.1.2","0.000002000","53639  >  12003 [ACK] Seq=14601 Ack=8761 Win=65335 Len=1460","1514","0.000000000","10.22.1.2","0.000002000","TCP"
"35","0.366059","0.366059000","0.001302000","0.001302000","10.1.1.2","0.001302000","53639  >  12003 [ACK] Seq=16061 Ack=8761 Win=65335 Len=1460","1514","0.000000000","10.22.1.2","0.001302000","TCP"
"36","0.366061","0.366061000","0.000002000","0.000002000","10.1.1.2","0.000002000","53639  >  12003 [ACK] Seq=17521 Ack=8761 Win=65335 Len=1460","1514","0.000000000","10.22.1.2","0.000002000","TCP"
"51","0.609665","0.520477000","0.328762000","0.022593000","10.1.1.2","0.328762000","53640  >  12002 [ACK] Seq=1 Ack=2113 Win=16425 Len=0","60","0.000000000","10.22.1.2","0.022593000","TCP"
"54","0.610996","0.521808000","0.001238000","0.001238000","10.1.1.2","0.001238000","53640  >  12002 [ACK] Seq=1 Ack=4877 Win=16425 Len=0","60","0.000000000","10.22.1.2","0.001238000","TCP"
"62","0.911847","0.822659000","0.300851000","0.106442000","10.1.1.2","0.300851000","53640  >  12002 [ACK] Seq=1 Ack=6989 Win=16425 Len=0","60","0.000000000","10.22.1.2","0.106442000","TCP"
"65","1.005028","1.005028000","0.638942000","0.093067000","10.1.1.2","0.638942000","53639  >  12003 [ACK] Seq=18981 Ack=10221 Win=65335 Len=0","60","0.000000000","10.22.1.2","0.093067000","TCP"
"67","1.022332","1.022332000","0.017277000","0.017277000","10.1.1.2","0.017277000","53639  >  12003 [ACK] Seq=18981 Ack=13141 Win=65335 Len=0","60","0.000000000","10.22.1.2","0.017277000","TCP"
"69","1.092895","1.092895000","0.070535000","0.070535000","10.1.1.2","0.070535000","53639  >  12003 [ACK] Seq=18981 Ack=17521 Win=65335 Len=0","60","0.000000000","10.22.1.2","0.070535000","TCP"
"75","1.167441","1.167441000","0.074499000","0.047902000","10.1.1.2","0.074499000","53639  >  12003 [ACK] Seq=18981 Ack=18981 Win=65335 Len=1460","1514","0.000000000","10.22.1.2","0.047902000","TCP"
"77","1.168768","1.168768000","0.001245000","0.001245000","10.1.1.2","0.001245000","53639  >  12003 [ACK] Seq=20441 Ack=18981 Win=65335 Len=1460","1514","0.000000000","10.22.1.2","0.001245000","TCP"
"78","1.168771","1.168771000","0.000003000","0.000003000","10.1.1.2","0.000003000","53639  >  12003 [ACK] Seq=21901 Ack=18981 Win=65335 Len=1460","1514","0.000000000","10.22.1.2","0.000003000","TCP"
"79","1.168773","1.168773000","0.000002000","0.000002000","10.1.1.2","0.000002000","53639  >  12003 [ACK] Seq=23361 Ack=18981 Win=65335 Len=1460","1514","0.000000000","10.22.1.2","0.000002000","TCP"
"80","1.168774","1.168774000","0.000001000","0.000001000","10.1.1.2","0.000001000","53639  >  12003 [ACK] Seq=24821 Ack=18981 Win=65335 Len=1460","1514","0.000000000","10.22.1.2","0.000001000","TCP"
"81","1.168776","1.168776000","0.000002000","0.000002000","10.1.1.2","0.000002000","53639  >  12003 [ACK] Seq=26281 Ack=18981 Win=65335 Len=1460","1514","0.000000000","10.22.1.2","0.000002000","TCP"
"82","1.168778","1.168778000","0.000002000","0.000002000","10.1.1.2","0.000002000","53639  >  12003 [ACK] Seq=27741 Ack=18981 Win=65335 Len=1460","1514","0.000000000","10.22.1.2","0.000002000","TCP"
"84","1.171422","1.171422000","0.002601000","0.002601000","10.1.1.2","0.002601000","53639  >  12003 [ACK] Seq=29201 Ack=18981 Win=65335 Len=1460","1514","0.000000000","10.22.1.2","0.002601000","TCP"
"85","1.171424","1.171424000","0.000002000","0.000002000","10.1.1.2","0.000002000","53639  >  12003 [PSH, ACK] Seq=30661 Ack=18981 Win=65335 Len=1460","1514","0.000000000","10.22.1.2","0.000002000","TCP"
"86","1.171426","1.171426000","0.000002000","0.000002000","10.1.1.2","0.000002000","53639  >  12003 [ACK] Seq=32121 Ack=18981 Win=65335 Len=1460","1514","0.000000000","10.22.1.2","0.000002000","TCP"
"87","1.171427","1.171427000","0.000001000","0.000001000","10.1.1.2","0.000001000","53639  >  12003 [ACK] Seq=33581 Ack=18981 Win=65335 Len=1460","1514","0.000000000","10.22.1.2","0.000001000","TCP"
"89","1.180748","1.180748000","0.009299000","0.009299000","10.1.1.2","0.009299000","53639  >  12003 [ACK] Seq=35041 Ack=18981 Win=65335 Len=1460","1514","0.000000000","10.22.1.2","0.009299000","TCP"
"90","1.180751","1.180751000","0.000003000","0.000003000","10.1.1.2","0.000003000","53639  >  12003 [ACK] Seq=36501 Ack=18981 Win=65335 Len=1460","1514","0.000000000","10.22.1.2","0.000003000","TCP"
"91","1.180755","1.180755000","0.000004000","0.000004000","10.1.1.2","0.000004000","53639  >  12003 [ACK] Seq=37961 Ack=18981 Win=65335 Len=1460","1514","0.000000000","10.22.1.2","0.000004000","TCP"
"103","1.281913","1.192725000","0.369952000","0.010599000","10.1.1.2","0.369952000","53640  >  12002 [ACK] Seq=1 Ack=8221 Win=16117 Len=0","60","0.000000000","10.22.1.2","0.010599000","TCP"
"107","1.412369","1.323181000","0.130359000","0.021298000","10.1.1.2","0.130359000","53640  >  12002 [ACK] Seq=1 Ack=10033 Win=16425 Len=0","60","0.000000000","10.22.1.2","0.021298000","TCP"
"108","1.417691","1.328503000","0.005322000","0.005322000","10.1.1.2","0.005322000","53640  >  12002 [ACK] Seq=1 Ack=11741 Win=16425 Len=0","60","0.000000000","10.22.1.2","0.005322000","TCP"
"123","1.719883","1.630695000","0.279317000","0.025231000","10.1.1.2","0.279317000","53640  >  12002 [ACK] Seq=1 Ack=14733 Win=16425 Len=0","60","0.000000000","10.22.1.2","0.025231000","TCP"
"126","1.829041","1.829041000","0.648241000","0.108943000","10.1.1.2","0.648241000","53639  >  12003 [ACK] Seq=39421 Ack=24821 Win=65335 Len=0","60","0.000000000","10.22.1.2","0.108943000","TCP"
"128","1.906246","1.906246000","0.077142000","0.077142000","10.1.1.2","0.077142000","53639  >  12003 [ACK] Seq=39421 Ack=29201 Win=65335 Len=0","60","0.000000000","10.22.1.2","0.077142000","TCP"
"134","1.986122","1.986122000","0.079824000","0.061214000","10.1.1.2","0.079824000","53639  >  12003 [ACK] Seq=39421 Ack=30661 Win=65335 Len=1460","1514","0.000000000","10.22.1.2","0.061214000","TCP"
"135","1.986127","1.986127000","0.000005000","0.000005000","10.1.1.2","0.000005000","53639  >  12003 [ACK] Seq=40881 Ack=30661 Win=65335 Len=1460","1514","0.000000000","10.22.1.2","0.000005000","TCP"
"136","1.986129","1.986129000","0.000002000","0.000002000","10.1.1.2","0.000002000","53639  >  12003 [ACK] Seq=42341 Ack=30661 Win=65335 Len=1460","1514","0.000000000","10.22.1.2","0.000002000","TCP"
"137","1.986131","1.986131000","0.000002000","0.000002000","10.1.1.2","0.000002000","53639  >  12003 [ACK] Seq=43801 Ack=30661 Win=65335 Len=1460","1514","0.000000000","10.22.1.2","0.000002000","TCP"
"138","1.986132","1.986132000","0.000001000","0.000001000","10.1.1.2","0.000001000","53639  >  12003 [ACK] Seq=45261 Ack=30661 Win=65335 Len=1460","1514","0.000000000","10.22.1.2","0.000001000","TCP"
"140","1.991435","1.991435000","0.005217000","0.005217000","10.1.1.2","0.005217000","53639  >  12003 [ACK] Seq=46721 Ack=30661 Win=65335 Len=1460","1514","0.000000000","10.22.1.2","0.005217000","TCP"
"141","1.991438","1.991438000","0.000003000","0.000003000","10.1.1.2","0.000003000","53639  >  12003 [ACK] Seq=48181 Ack=30661 Win=65335 Len=1460","1514","0.000000000","10.22.1.2","0.000003000","TCP"
"142","1.991439","1.991439000","0.000001000","0.000001000","10.1.1.2","0.000001000","53639  >  12003 [ACK] Seq=49641 Ack=30661 Win=65335 Len=1460","1514","0.000000000","10.22.1.2","0.000001000","TCP"
"143","1.991440","1.991440000","0.000001000","0.000001000","10.1.1.2","0.000001000","53639  >  12003 [ACK] Seq=51101 Ack=30661 Win=65335 Len=1460","1514","0.000000000","10.22.1.2","0.000001000","TCP"
"145","1.992764","1.992764000","0.001287000","0.001287000","10.1.1.2","0.001287000","53639  >  12003 [ACK] Seq=52561 Ack=30661 Win=65335 Len=1460","1514","0.000000000","10.22.1.2","0.001287000","TCP"
"146","2.024713","2.024713000","0.031949000","0.031949000","10.1.1.2","0.031949000","[TCP Previous segment not captured] 53639  >  12003 [ACK] Seq=55481 Ack=30661 Win=65335 Len=1460","1514","0.000000000","10.22.1.2","0.031949000","TCP"
"148","2.030035","2.030035000","0.005281000","0.005281000","10.1.1.2","0.005281000","53639  >  12003 [ACK] Seq=56941 Ack=30661 Win=65335 Len=1460","1514","0.000000000","10.22.1.2","0.005281000","TCP"
"150","2.031367","2.031367000","0.001307000","0.001307000","10.1.1.2","0.001307000","53639  >  12003 [ACK] Seq=58401 Ack=30661 Win=65335 Len=1460","1514","0.000000000","10.22.1.2","0.001307000","TCP"
"151","2.031369","2.031369000","0.000002000","0.000002000","10.1.1.2","0.000002000","53639  >  12003 [ACK] Seq=59861 Ack=30661 Win=65335 Len=1460","1514","0.000000000","10.22.1.2","0.000002000","TCP"
"165","2.091275","2.002087000","0.371177000","0.005299000","10.1.1.2","0.371177000","53640  >  12002 [ACK] Seq=1 Ack=16721 Win=16425 Len=0","60","0.000000000","10.22.1.2","0.005299000","TCP"
"172","2.245689","2.156501000","0.154285000","0.001290000","10.1.1.2","0.154285000","53640  >  12002 [ACK] Seq=1 Ack=18957 Win=16425 Len=0","60","0.000000000","10.22.1.2","0.001290000","TCP"
"182","2.527912","2.438724000","0.169343000","0.027955000","10.1.1.2","0.169343000","53640  >  12002 [ACK] Seq=1 Ack=21473 Win=16425 Len=0","60","0.000000000","10.22.1.2","0.027955000","TCP"
"187","2.646386","2.646386000","0.614982000","0.085199000","10.1.1.2","0.614982000","53639  >  12003 [ACK] Seq=61321 Ack=37961 Win=65335 Len=0","60","0.000000000","10.22.1.2","0.085199000","TCP"
"189","2.724919","2.724919000","0.078463000","0.078463000","10.1.1.2","0.078463000","53639  >  12003 [ACK] Seq=61321 Ack=40881 Win=65335 Len=0","60","0.000000000","10.22.1.2","0.078463000","TCP"
"190","2.724921","2.635733000","0.196936000","0.000002000","10.1.1.2","0.196936000","53640  >  12002 [ACK] Seq=1 Ack=21597 Win=16394 Len=0","60","0.000000000","10.22.1.2","0.000002000","TCP"
"196","2.803455","2.803455000","0.078474000","0.071858000","10.1.1.2","0.078474000","53639  >  12003 [ACK] Seq=61321 Ack=43801 Win=65335 Len=1460","1514","0.000000000","10.22.1.2","0.071858000","TCP"
"199","2.804792","2.804792000","0.001276000","0.001276000","10.1.1.2","0.001276000","53639  >  12003 [ACK] Seq=62781 Ack=43801 Win=65335 Len=1460","1514","0.000000000","10.22.1.2","0.001276000","TCP"
"200","2.804794","2.804794000","0.000002000","0.000002000","10.1.1.2","0.000002000","53639  >  12003 [ACK] Seq=64241 Ack=43801 Win=65335 Len=1460","1514","0.000000000","10.22.1.2","0.000002000","TCP"
"201","2.804796","2.804796000","0.000002000","0.000002000","10.1.1.2","0.000002000","53639  >  12003 [ACK] Seq=65701 Ack=43801 Win=65335 Len=1460","1514","0.000000000","10.22.1.2","0.000002000","TCP"
"202","2.804798","2.804798000","0.000002000","0.000002000","10.1.1.2","0.000002000","53639  >  12003 [ACK] Seq=67161 Ack=43801 Win=65335 Len=1460","1514","0.000000000","10.22.1.2","0.000002000","TCP"
"203","2.804799","2.804799000","0.000001000","0.000001000","10.1.1.2","0.000001000","53639  >  12003 [ACK] Seq=68621 Ack=43801 Win=65335 Len=1460","1514","0.000000000","10.22.1.2","0.000001000","TCP"
"204","2.804801","2.804801000","0.000002000","0.000002000","10.1.1.2","0.000002000","53639  >  12003 [ACK] Seq=70081 Ack=43801 Win=65335 Len=1460","1514","0.000000000","10.22.1.2","0.000002000","TCP"
"205","2.804805","2.804805000","0.000004000","0.000004000","10.1.1.2","0.000004000","53639  >  12003 [ACK] Seq=71541 Ack=43801 Win=65335 Len=1460","1514","0.000000000","10.22.1.2","0.000004000","TCP"
"213","2.806117","2.806117000","0.001196000","0.001196000","10.1.1.2","0.001196000","53639  >  12003 [ACK] Seq=73001 Ack=43801 Win=65335 Len=1460","1514","0.000000000","10.22.1.2","0.001196000","TCP"
"214","2.806120","2.806120000","0.000003000","0.000003000","10.1.1.2","0.000003000","53639  >  12003 [ACK] Seq=74461 Ack=43801 Win=65335 Len=1460","1514","0.000000000","10.22.1.2","0.000003000","TCP"
"220","2.835405","2.835405000","0.029244000","0.021263000","10.1.1.2","0.029244000","53639  >  12003 [ACK] Seq=75921 Ack=43801 Win=65335 Len=1460","1514","0.000000000","10.22.1.2","0.021263000","TCP"
"221","2.835407","2.835407000","0.000002000","0.000002000","10.1.1.2","0.000002000","53639  >  12003 [ACK] Seq=77381 Ack=43801 Win=65335 Len=1460","1514","0.000000000","10.22.1.2","0.000002000","TCP"
"222","2.835411","2.835411000","0.000004000","0.000004000","10.1.1.2","0.000004000","53639  >  12003 [ACK] Seq=78841 Ack=43801 Win=65335 Len=1460","1514","0.000000000","10.22.1.2","0.000004000","TCP"
"223","2.835412","2.835412000","0.000001000","0.000001000","10.1.1.2","0.000001000","[TCP Out-Of-Order] 53639  >  12003 [ACK] Seq=54021 Ack=43801 Win=65335 Len=1460","1514","0.000000000","10.22.1.2","0.000001000","TCP"
"241","2.895310","2.806122000","0.170247000","0.005302000","10.1.1.2","0.170247000","[TCP Dup ACK 190#1] 53640  >  12002 [ACK] Seq=1 Ack=21597 Win=16394 Len=0 SLE=23005 SRE=24465","66","0.000000000","10.22.1.2","0.005302000","TCP"
"242","2.897970","2.808782000","0.002660000","0.002660000","10.1.1.2","0.002660000","[TCP Dup ACK 190#2] 53640  >  12002 [ACK] Seq=1 Ack=21597 Win=16394 Len=0 SLE=23005 SRE=25293","66","0.000000000","10.22.1.2","0.002660000","TCP"
"254","3.161554","3.072366000","0.263584000","0.082485000","10.1.1.2","0.263584000","[TCP Dup ACK 190#3] 53640  >  12002 [ACK] Seq=1 Ack=21597 Win=16394 Len=0 SLE=23005 SRE=26753","66","0.000000000","10.22.1.2","0.082485000","TCP"
"255","3.161556","3.072368000","0.000002000","0.000002000","10.1.1.2","0.000002000","[TCP Dup ACK 190#4] 53640  >  12002 [ACK] Seq=1 Ack=21597 Win=16394 Len=0 SLE=23005 SRE=26877","66","0.000000000","10.22.1.2","0.000002000","TCP"
"257","3.330606","3.241418000","0.168980000","0.168980000","10.1.1.2","0.168980000","[TCP Dup ACK 190#5] 53640  >  12002 [ACK] Seq=1 Ack=21597 Win=16394 Len=0 SLE=23005 SRE=27229","66","0.000000000","10.22.1.2","0.168980000","TCP"
"262","3.458398","3.458398000","0.622891000","0.098462000","10.1.1.2","0.622891000","53639  >  12003 [ACK] Seq=80301 Ack=49641 Win=65335 Len=0","60","0.000000000","10.22.1.2","0.098462000","TCP"
"263","3.458400","3.458400000","0.000002000","0.000002000","10.1.1.2","0.000002000","53639  >  12003 [ACK] Seq=80301 Ack=52561 Win=65335 Len=0","60","0.000000000","10.22.1.2","0.000002000","TCP"
"267","3.548926","3.548926000","0.090354000","0.005320000","10.1.1.2","0.090354000","53639  >  12003 [ACK] Seq=80301 Ack=55481 Win=65335 Len=0","60","0.000000000","10.22.1.2","0.005320000","TCP"
"268","3.548928","3.459740000","0.218322000","0.000002000","10.1.1.2","0.218322000","[TCP Dup ACK 190#6] 53640  >  12002 [ACK] Seq=1 Ack=21597 Win=16394 Len=0 SLE=23005 SRE=28461","66","0.000000000","10.22.1.2","0.000002000","TCP"
"269","3.548929","3.459741000","0.000001000","0.000001000","10.1.1.2","0.000001000","[TCP Dup ACK 190#7] 53640  >  12002 [ACK] Seq=1 Ack=21597 Win=16394 Len=0 SLE=23005 SRE=29921","66","0.000000000","10.22.1.2","0.000001000","TCP"
"270","3.548930","3.459742000","0.000001000","0.000001000","10.1.1.2","0.000001000","[TCP Dup ACK 190#8] 53640  >  12002 [ACK] Seq=1 Ack=21597 Win=16394 Len=0 SLE=23005 SRE=30397","66","0.000000000","10.22.1.2","0.000001000","TCP"
"274","3.619470","3.619470000","0.070491000","0.001255000","10.1.1.2","0.070491000","53639  >  12003 [ACK] Seq=80301 Ack=58401 Win=65335 Len=1460","1514","0.000000000","10.22.1.2","0.001255000","TCP"
"275","3.619475","3.619475000","0.000005000","0.000005000","10.1.1.2","0.000005000","53639  >  12003 [ACK] Seq=81761 Ack=58401 Win=65335 Len=1460","1514","0.000000000","10.22.1.2","0.000005000","TCP"
"277","3.622130","3.622130000","0.002595000","0.002595000","10.1.1.2","0.002595000","53639  >  12003 [ACK] Seq=83221 Ack=58401 Win=65335 Len=1460","1514","0.000000000","10.22.1.2","0.002595000","TCP"
"278","3.624794","3.624794000","0.002664000","0.002664000","10.1.1.2","0.002664000","53639  >  12003 [ACK] Seq=84681 Ack=58401 Win=65335 Len=1460","1514","0.000000000","10.22.1.2","0.002664000","TCP"
"279","3.624797","3.624797000","0.000003000","0.000003000","10.1.1.2","0.000003000","53639  >  12003 [ACK] Seq=86141 Ack=58401 Win=65335 Len=1460","1514","0.000000000","10.22.1.2","0.000003000","TCP"
"281","3.626125","3.626125000","0.001298000","0.001298000","10.1.1.2","0.001298000","53639  >  12003 [ACK] Seq=87601 Ack=58401 Win=65335 Len=1460","1514","0.000000000","10.22.1.2","0.001298000","TCP"
"282","3.626128","3.626128000","0.000003000","0.000003000","10.1.1.2","0.000003000","53639  >  12003 [PSH, ACK] Seq=89061 Ack=58401 Win=65335 Len=1460","1514","0.000000000","10.22.1.2","0.000003000","TCP"
"284","3.648759","3.648759000","0.022601000","0.022601000","10.1.1.2","0.022601000","53639  >  12003 [ACK] Seq=90521 Ack=58401 Win=65335 Len=1460","1514","0.000000000","10.22.1.2","0.022601000","TCP"
"285","3.648763","3.648763000","0.000004000","0.000004000","10.1.1.2","0.000004000","53639  >  12003 [ACK] Seq=91981 Ack=58401 Win=65335 Len=1460","1514","0.000000000","10.22.1.2","0.000004000","TCP"
"286","3.648764","3.648764000","0.000001000","0.000001000","10.1.1.2","0.000001000","53639  >  12003 [ACK] Seq=93441 Ack=58401 Win=65335 Len=1460","1514","0.000000000","10.22.1.2","0.000001000","TCP"
"314","3.966908","3.877720000","0.041342000","0.031895000","10.1.1.2","0.041342000","53640  >  12002 [ACK] Seq=1 Ack=30397 Win=16425 Len=0 SLE=23005 SRE=23057","66","0.000000000","10.22.1.2","0.031895000","TCP"
"320","4.266429","4.266429000","0.617626000","0.101124000","10.1.1.2","0.617626000","53639  >  12003 [ACK] Seq=94901 Ack=62781 Win=65335 Len=0","60","0.000000000","10.22.1.2","0.101124000","TCP"
"322","4.269084","4.269084000","0.002601000","0.002601000","10.1.1.2","0.002601000","53639  >  12003 [ACK] Seq=94901 Ack=67533 Win=65335 Len=0","60","0.000000000","10.22.1.2","0.002601000","TCP"
"324","4.364932","4.364932000","0.095800000","0.095800000","10.1.1.2","0.095800000","53639  >  12003 [ACK] Seq=94901 Ack=70453 Win=65335 Len=0","60","0.000000000","10.22.1.2","0.095800000","TCP"
"327","4.426165","4.426165000","0.061199000","0.003995000","10.1.1.2","0.061199000","53639  >  12003 [ACK] Seq=94901 Ack=73373 Win=65335 Len=0","60","0.000000000","10.22.1.2","0.003995000","TCP"
"329","4.432825","4.432825000","0.006632000","0.006632000","10.1.1.2","0.006632000","53639  >  12003 [ACK] Seq=94901 Ack=74833 Win=65335 Len=1460","1514","0.000000000","10.22.1.2","0.006632000","TCP"
"330","4.432827","4.432827000","0.000002000","0.000002000","10.1.1.2","0.000002000","53639  >  12003 [ACK] Seq=96361 Ack=74833 Win=65335 Len=1460","1514","0.000000000","10.22.1.2","0.000002000","TCP"
"331","4.432829","4.432829000","0.000002000","0.000002000","10.1.1.2","0.000002000","53639  >  12003 [ACK] Seq=97821 Ack=74833 Win=65335 Len=1460","1514","0.000000000","10.22.1.2","0.000002000","TCP"
"332","4.432831","4.432831000","0.000002000","0.000002000","10.1.1.2","0.000002000","53639  >  12003 [ACK] Seq=99281 Ack=74833 Win=65335 Len=1460","1514","0.000000000","10.22.1.2","0.000002000","TCP"
"334","4.439476","4.439476000","0.006590000","0.006590000","10.1.1.2","0.006590000","53639  >  12003 [ACK] Seq=100741 Ack=74833 Win=65335 Len=1460","1514","0.000000000","10.22.1.2","0.006590000","TCP"
"335","4.470098","4.470098000","0.030622000","0.030622000","10.1.1.2","0.030622000","53639  >  12003 [ACK] Seq=102201 Ack=74833 Win=65335 Len=1460","1514","0.000000000","10.22.1.2","0.030622000","TCP"
"336","4.470101","4.470101000","0.000003000","0.000003000","10.1.1.2","0.000003000","53639  >  12003 [ACK] Seq=103661 Ack=74833 Win=65335 Len=1460","1514","0.000000000","10.22.1.2","0.000003000","TCP"
"337","4.470102","4.470102000","0.000001000","0.000001000","10.1.1.2","0.000001000","53639  >  12003 [ACK] Seq=105121 Ack=74833 Win=65335 Len=1460","1514","0.000000000","10.22.1.2","0.000001000","TCP"
"338","4.470104","4.470104000","0.000002000","0.000002000","10.1.1.2","0.000002000","53639  >  12003 [ACK] Seq=106581 Ack=74833 Win=65335 Len=1460","1514","0.000000000","10.22.1.2","0.000002000","TCP"
"366","4.732340","4.643152000","0.765297000","0.033241000","10.1.1.2","0.765297000","[TCP Dup ACK 314#1] 53640  >  12002 [ACK] Seq=1 Ack=30397 Win=16425 Len=0 SLE=21597 SRE=23057","66","0.000000000","10.22.1.2","0.033241000","TCP"
"367","4.774936","4.685748000","0.042596000","0.042596000","10.1.1.2","0.042596000","53640  >  12002 [ACK] Seq=1 Ack=33317 Win=16425 Len=0","60","0.000000000","10.22.1.2","0.042596000","TCP"
"369","4.781588","4.692400000","0.006609000","0.006609000","10.1.1.2","0.006609000","53640  >  12002 [ACK] Seq=1 Ack=37697 Win=16425 Len=0","60","0.000000000","10.22.1.2","0.006609000","TCP"
"376","5.070457","5.070457000","0.600309000","0.015924000","10.1.1.2","0.600309000","53639  >  12003 [ACK] Seq=108041 Ack=79213 Win=65335 Len=0","60","0.000000000","10.22.1.2","0.015924000","TCP"
"378","5.078444","5.078444000","0.007949000","0.007949000","10.1.1.2","0.007949000","53639  >  12003 [ACK] Seq=108041 Ack=83593 Win=65335 Len=0","60","0.000000000","10.22.1.2","0.007949000","TCP"
"380","5.171640","5.171640000","0.093167000","0.093167000","10.1.1.2","0.093167000","53639  >  12003 [ACK] Seq=108041 Ack=87973 Win=65335 Len=0","60","0.000000000","10.22.1.2","0.093167000","TCP"
"382","5.235535","5.235535000","0.063824000","0.063824000","10.1.1.2","0.063824000","53639  >  12003 [ACK] Seq=108041 Ack=90893 Win=65335 Len=0","60","0.000000000","10.22.1.2","0.063824000","TCP"
"384","5.238187","5.238187000","0.002591000","0.002591000","10.1.1.2","0.002591000","53639  >  12003 [ACK] Seq=108041 Ack=92353 Win=65335 Len=1460","1514","0.000000000","10.22.1.2","0.002591000","TCP"
"385","5.238189","5.238189000","0.000002000","0.000002000","10.1.1.2","0.000002000","53639  >  12003 [ACK] Seq=109501 Ack=92353 Win=65335 Len=1460","1514","0.000000000","10.22.1.2","0.000002000","TCP"
"387","5.240848","5.240848000","0.002600000","0.002600000","10.1.1.2","0.002600000","53639  >  12003 [ACK] Seq=110961 Ack=92353 Win=65335 Len=1460","1514","0.000000000","10.22.1.2","0.002600000","TCP"
"388","5.240850","5.240850000","0.000002000","0.000002000","10.1.1.2","0.000002000","53639  >  12003 [ACK] Seq=112421 Ack=92353 Win=65335 Len=1460","1514","0.000000000","10.22.1.2","0.000002000","TCP"
"394","5.280785","5.280785000","0.039898000","0.002607000","10.1.1.2","0.039898000","53639  >  12003 [ACK] Seq=113881 Ack=92353 Win=65335 Len=1460","1514","0.000000000","10.22.1.2","0.002607000","TCP"
"395","5.280787","5.280787000","0.000002000","0.000002000","10.1.1.2","0.000002000","53639  >  12003 [ACK] Seq=115341 Ack=92353 Win=65335 Len=1460","1514","0.000000000","10.22.1.2","0.000002000","TCP"
"397","5.282115","5.282115000","0.001290000","0.001290000","10.1.1.2","0.001290000","53639  >  12003 [ACK] Seq=116801 Ack=92353 Win=65335 Len=1460","1514","0.000000000","10.22.1.2","0.001290000","TCP"
"398","5.283447","5.283447000","0.001332000","0.001332000","10.1.1.2","0.001332000","53639  >  12003 [ACK] Seq=118261 Ack=92353 Win=65335 Len=1460","1514","0.000000000","10.22.1.2","0.001332000","TCP"
"399","5.283449","5.283449000","0.000002000","0.000002000","10.1.1.2","0.000002000","53639  >  12003 [ACK] Seq=119721 Ack=92353 Win=65335 Len=1460","1514","0.000000000","10.22.1.2","0.000002000","TCP"
"400","5.283451","5.283451000","0.000002000","0.000002000","10.1.1.2","0.000002000","53639  >  12003 [ACK] Seq=121181 Ack=92353 Win=65335 Len=1460","1514","0.000000000","10.22.1.2","0.000002000","TCP"
"424","5.580301","5.491113000","0.798713000","0.069170000","10.1.1.2","0.798713000","53640  >  12002 [ACK] Seq=1 Ack=41661 Win=16425 Len=0","60","0.000000000","10.22.1.2","0.069170000","TCP"
"433","5.877157","5.877157000","0.593672000","0.058476000","10.1.1.2","0.593672000","53639  >  12003 [ACK] Seq=122641 Ack=95273 Win=65335 Len=0","60","0.000000000","10.22.1.2","0.058476000","TCP"
"435","5.883807","5.883807000","0.006602000","0.006602000","10.1.1.2","0.006602000","53639  >  12003 [ACK] Seq=122641 Ack=101113 Win=65335 Len=0","60","0.000000000","10.22.1.2","0.006602000","TCP"
"437","5.988974","5.988974000","0.105138000","0.105138000","10.1.1.2","0.105138000","53639  >  12003 [ACK] Seq=122641 Ack=104033 Win=65335 Len=0","60","0.000000000","10.22.1.2","0.105138000","TCP"
"442","6.028908","6.028908000","0.039902000","0.034565000","10.1.1.2","0.039902000","53639  >  12003 [ACK] Seq=122641 Ack=106953 Win=65335 Len=0","60","0.000000000","10.22.1.2","0.034565000","TCP"
"444","6.042223","6.042223000","0.013286000","0.013286000","10.1.1.2","0.013286000","53639  >  12003 [ACK] Seq=122641 Ack=109873 Win=65335 Len=0","60","0.000000000","10.22.1.2","0.013286000","TCP"
"445","6.042225","6.042225000","0.000002000","0.000002000","10.1.1.2","0.000002000","53639  >  12003 [ACK] Seq=122641 Ack=111333 Win=65335 Len=1460","1514","0.000000000","10.22.1.2","0.000002000","TCP"
"446","6.042227","6.042227000","0.000002000","0.000002000","10.1.1.2","0.000002000","53639  >  12003 [ACK] Seq=124101 Ack=111333 Win=65335 Len=1460","1514","0.000000000","10.22.1.2","0.000002000","TCP"
"448","6.043551","6.043551000","0.001269000","0.001269000","10.1.1.2","0.001269000","53639  >  12003 [ACK] Seq=125561 Ack=111333 Win=65335 Len=1460","1514","0.000000000","10.22.1.2","0.001269000","TCP"
"449","6.044882","6.044882000","0.001331000","0.001331000","10.1.1.2","0.001331000","53639  >  12003 [ACK] Seq=127021 Ack=111333 Win=65335 Len=1460","1514","0.000000000","10.22.1.2","0.001331000","TCP"
"451","6.092812","6.092812000","0.047899000","0.047899000","10.1.1.2","0.047899000","53639  >  12003 [ACK] Seq=128481 Ack=111333 Win=65335 Len=1460","1514","0.000000000","10.22.1.2","0.047899000","TCP"
"452","6.092814","6.092814000","0.000002000","0.000002000","10.1.1.2","0.000002000","53639  >  12003 [ACK] Seq=129941 Ack=111333 Win=65335 Len=1460","1514","0.000000000","10.22.1.2","0.000002000","TCP"
"453","6.092816","6.092816000","0.000002000","0.000002000","10.1.1.2","0.000002000","53639  >  12003 [ACK] Seq=131401 Ack=111333 Win=65335 Len=1460","1514","0.000000000","10.22.1.2","0.000002000","TCP"
"454","6.092818","6.092818000","0.000002000","0.000002000","10.1.1.2","0.000002000","53639  >  12003 [ACK] Seq=132861 Ack=111333 Win=65335 Len=1460","1514","0.000000000","10.22.1.2","0.000002000","TCP"
"455","6.092821","6.092821000","0.000003000","0.000003000","10.1.1.2","0.000003000","53639  >  12003 [ACK] Seq=134321 Ack=111333 Win=65335 Len=1460","1514","0.000000000","10.22.1.2","0.000003000","TCP"
"456","6.092823","6.092823000","0.000002000","0.000002000","10.1.1.2","0.000002000","53639  >  12003 [ACK] Seq=135781 Ack=111333 Win=65335 Len=1460","1514","0.000000000","10.22.1.2","0.000002000","TCP"
"457","6.092825","6.092825000","0.000002000","0.000002000","10.1.1.2","0.000002000","53639  >  12003 [ACK] Seq=137241 Ack=111333 Win=65335 Len=1460","1514","0.000000000","10.22.1.2","0.000002000","TCP"
"483","6.397647","6.308459000","0.817228000","0.078476000","10.1.1.2","0.817228000","53640  >  12002 [ACK] Seq=1 Ack=46041 Win=16425 Len=0","60","0.000000000","10.22.1.2","0.078476000","TCP"
"489","6.405634","6.316446000","0.007948000","0.001296000","10.1.1.2","0.007948000","53640  >  12002 [ACK] Seq=1 Ack=48961 Win=16425 Len=0","60","0.000000000","10.22.1.2","0.001296000","TCP"
"490","6.405636","6.316448000","0.000002000","0.000002000","10.1.1.2","0.000002000","53640  >  12002 [ACK] Seq=1 Ack=51881 Win=16425 Len=0","60","0.000000000","10.22.1.2","0.000002000","TCP"
"492","6.682520","6.682520000","0.589584000","0.058571000","10.1.1.2","0.589584000","53639  >  12003 [ACK] Seq=138701 Ack=114253 Win=65335 Len=0","60","0.000000000","10.22.1.2","0.058571000","TCP"
"494","6.693165","6.693165000","0.010609000","0.010609000","10.1.1.2","0.010609000","53639  >  12003 [ACK] Seq=138701 Ack=118633 Win=65335 Len=0","60","0.000000000","10.22.1.2","0.010609000","TCP"
"500","6.828956","6.828956000","0.135766000","0.030611000","10.1.1.2","0.135766000","53639  >  12003 [ACK] Seq=138701 Ack=123013 Win=65335 Len=0","60","0.000000000","10.22.1.2","0.030611000","TCP"
"502","6.840932","6.840932000","0.011924000","0.011924000","10.1.1.2","0.011924000","53639  >  12003 [ACK] Seq=138701 Ack=125933 Win=65335 Len=0","60","0.000000000","10.22.1.2","0.011924000","TCP"
"504","6.850256","6.850256000","0.009290000","0.009290000","10.1.1.2","0.009290000","53639  >  12003 [ACK] Seq=138701 Ack=128853 Win=65335 Len=1460","1514","0.000000000","10.22.1.2","0.009290000","TCP"
"506","6.859572","6.859572000","0.009219000","0.009219000","10.1.1.2","0.009219000","53639  >  12003 [PSH, ACK] Seq=140161 Ack=128853 Win=65335 Len=1460","1514","0.000000000","10.22.1.2","0.009219000","TCP"
"507","6.859574","6.859574000","0.000002000","0.000002000","10.1.1.2","0.000002000","53639  >  12003 [ACK] Seq=141621 Ack=131773 Win=65335 Len=0","60","0.000000000","10.22.1.2","0.000002000","TCP"
"508","6.859574","6.859574000","0.000000000","0.000000000","10.1.1.2","0.000000000","53639  >  12003 [ACK] Seq=141621 Ack=131773 Win=65335 Len=1460","1514","0.000000000","10.22.1.2","0.000000000","TCP"
"509","6.859578","6.859578000","0.000004000","0.000004000","10.1.1.2","0.000004000","53639  >  12003 [ACK] Seq=143081 Ack=131773 Win=65335 Len=1460","1514","0.000000000","10.22.1.2","0.000004000","TCP"
"511","6.914151","6.914151000","0.054516000","0.054516000","10.1.1.2","0.054516000","53639  >  12003 [ACK] Seq=144541 Ack=131773 Win=65335 Len=1460","1514","0.000000000","10.22.1.2","0.054516000","TCP"
"512","6.914154","6.914154000","0.000003000","0.000003000","10.1.1.2","0.000003000","53639  >  12003 [ACK] Seq=146001 Ack=131773 Win=65335 Len=1460","1514","0.000000000","10.22.1.2","0.000003000","TCP"
"513","6.914157","6.914157000","0.000003000","0.000003000","10.1.1.2","0.000003000","53639  >  12003 [ACK] Seq=147461 Ack=131773 Win=65335 Len=1460","1514","0.000000000","10.22.1.2","0.000003000","TCP"
"514","6.914158","6.914158000","0.000001000","0.000001000","10.1.1.2","0.000001000","53639  >  12003 [ACK] Seq=148921 Ack=131773 Win=65335 Len=1460","1514","0.000000000","10.22.1.2","0.000001000","TCP"
"515","6.914160","6.914160000","0.000002000","0.000002000","10.1.1.2","0.000002000","53639  >  12003 [ACK] Seq=150381 Ack=131773 Win=65335 Len=1460","1514","0.000000000","10.22.1.2","0.000002000","TCP"
"516","6.914162","6.914162000","0.000002000","0.000002000","10.1.1.2","0.000002000","53639  >  12003 [ACK] Seq=151841 Ack=131773 Win=65335 Len=1460","1514","0.000000000","10.22.1.2","0.000002000","TCP"
"518","6.915476","6.915476000","0.001257000","0.001257000","10.1.1.2","0.001257000","53639  >  12003 [ACK] Seq=153301 Ack=131773 Win=65335 Len=1460","1514","0.000000000","10.22.1.2","0.001257000","TCP"
"552","7.215005","7.125817000","0.809369000","0.073161000","10.1.1.2","0.809369000","53640  >  12002 [ACK] Seq=1 Ack=54801 Win=16425 Len=0","60","0.000000000","10.22.1.2","0.073161000","TCP"
"556","7.410677","7.321489000","0.195672000","0.097101000","10.1.1.2","0.195672000","53640  >  12002 [ACK] Seq=1 Ack=55917 Win=16146 Len=0","60","0.000000000","10.22.1.2","0.097101000","TCP"
"558","7.486554","7.486554000","0.370452000","0.075761000","10.1.1.2","0.370452000","53639  >  12003 [ACK] Seq=154761 Ack=134693 Win=65335 Len=0","60","0.000000000","10.22.1.2","0.075761000","TCP"
"560","7.499862","7.499862000","0.013272000","0.013272000","10.1.1.2","0.013272000","53639  >  12003 [ACK] Seq=154761 Ack=137613 Win=65335 Len=0","60","0.000000000","10.22.1.2","0.013272000","TCP"
"566","7.642302","7.642302000","0.142415000","0.117144000","10.1.1.2","0.142415000","53639  >  12003 [ACK] Seq=154761 Ack=143453 Win=65335 Len=0","60","0.000000000","10.22.1.2","0.117144000","TCP"
"568","7.644961","7.644961000","0.002624000","0.002624000","10.1.1.2","0.002624000","53639  >  12003 [ACK] Seq=154761 Ack=146373 Win=65335 Len=0","60","0.000000000","10.22.1.2","0.002624000","TCP"
"570","7.667596","7.667596000","0.022613000","0.022613000","10.1.1.2","0.022613000","53639  >  12003 [ACK] Seq=154761 Ack=147833 Win=65335 Len=1460","1514","0.000000000","10.22.1.2","0.022613000","TCP"
"571","7.667599","7.667599000","0.000003000","0.000003000","10.1.1.2","0.000003000","53639  >  12003 [ACK] Seq=156221 Ack=150753 Win=65335 Len=0","60","0.000000000","10.22.1.2","0.000003000","TCP"
"573","7.684897","7.684897000","0.017246000","0.017246000","10.1.1.2","0.017246000","53639  >  12003 [ACK] Seq=156221 Ack=152213 Win=65335 Len=1460","1514","0.000000000","10.22.1.2","0.017246000","TCP"
"575","7.686230","7.686230000","0.001293000","0.001293000","10.1.1.2","0.001293000","53639  >  12003 [ACK] Seq=157681 Ack=152213 Win=65335 Len=1460","1514","0.000000000","10.22.1.2","0.001293000","TCP"
"576","7.694218","7.694218000","0.007988000","0.007988000","10.1.1.2","0.007988000","53639  >  12003 [ACK] Seq=159141 Ack=152213 Win=65335 Len=1460","1514","0.000000000","10.22.1.2","0.007988000","TCP"
"577","7.694221","7.694221000","0.000003000","0.000003000","10.1.1.2","0.000003000","53639  >  12003 [ACK] Seq=160601 Ack=152213 Win=65335 Len=1460","1514","0.000000000","10.22.1.2","0.000003000","TCP"
"579","7.718179","7.718179000","0.023920000","0.023920000","10.1.1.2","0.023920000","53639  >  12003 [ACK] Seq=162061 Ack=153673 Win=65335 Len=1460","1514","0.000000000","10.22.1.2","0.023920000","TCP"
"581","7.719512","7.719512000","0.001293000","0.001293000","10.1.1.2","0.001293000","53639  >  12003 [ACK] Seq=163521 Ack=153673 Win=65335 Len=1460","1514","0.000000000","10.22.1.2","0.001293000","TCP"
"582","7.719516","7.719516000","0.000004000","0.000004000","10.1.1.2","0.000004000","53639  >  12003 [ACK] Seq=164981 Ack=153673 Win=65335 Len=1460","1514","0.000000000","10.22.1.2","0.000004000","TCP"
"583","7.719518","7.719518000","0.000002000","0.000002000","10.1.1.2","0.000002000","53639  >  12003 [ACK] Seq=166441 Ack=153673 Win=65335 Len=1460","1514","0.000000000","10.22.1.2","0.000002000","TCP"
"585","7.726171","7.726171000","0.006616000","0.006616000","10.1.1.2","0.006616000","53639  >  12003 [ACK] Seq=167901 Ack=153673 Win=65335 Len=1460","1514","0.000000000","10.22.1.2","0.006616000","TCP"
"586","7.726174","7.726174000","0.000003000","0.000003000","10.1.1.2","0.000003000","53639  >  12003 [ACK] Seq=169361 Ack=153673 Win=65335 Len=1460","1514","0.000000000","10.22.1.2","0.000003000","TCP"
"620","7.921175","7.921175000","0.194949000","0.082425000","10.1.1.2","0.194949000","53639  >  12003 [ACK] Seq=170821 Ack=153673 Win=65335 Len=1460","1514","0.000000000","10.22.1.2","0.082425000","TCP"
"644","8.219358","8.130170000","0.808565000","0.056336000","10.1.1.2","0.808565000","53640  >  12002 [ACK] Seq=1 Ack=58837 Win=16425 Len=0","60","0.000000000","10.22.1.2","0.056336000","TCP"
"645","8.219360","8.130172000","0.000002000","0.000002000","10.1.1.2","0.000002000","53640  >  12002 [ACK] Seq=1 Ack=61757 Win=16425 Len=0","60","0.000000000","10.22.1.2","0.000002000","TCP"
"647","8.227341","8.138153000","0.007937000","0.007937000","10.1.1.2","0.007937000","53640  >  12002 [ACK] Seq=1 Ack=67597 Win=16425 Len=0","60","0.000000000","10.22.1.2","0.007937000","TCP"
"651","8.293902","8.293902000","0.170922000","0.059869000","10.1.1.2","0.170922000","53639  >  12003 [ACK] Seq=172281 Ack=156593 Win=65335 Len=0","60","0.000000000","10.22.1.2","0.059869000","TCP"
"653","8.319195","8.319195000","0.025247000","0.025247000","10.1.1.2","0.025247000","53639  >  12003 [ACK] Seq=172281 Ack=159513 Win=65335 Len=0","60","0.000000000","10.22.1.2","0.025247000","TCP"
"655","8.448331","8.448331000","0.129106000","0.129106000","10.1.1.2","0.129106000","53639  >  12003 [ACK] Seq=172281 Ack=163893 Win=65335 Len=0","60","0.000000000","10.22.1.2","0.129106000","TCP"
"657","8.454974","8.454974000","0.006565000","0.006565000","10.1.1.2","0.006565000","53639  >  12003 [ACK] Seq=172281 Ack=166813 Win=65335 Len=0","60","0.000000000","10.22.1.2","0.006565000","TCP"
"659","8.477607","8.477607000","0.022604000","0.022604000","10.1.1.2","0.022604000","53639  >  12003 [ACK] Seq=172281 Ack=169733 Win=65335 Len=1460","1514","0.000000000","10.22.1.2","0.022604000","TCP"
"660","8.477609","8.477609000","0.000002000","0.000002000","10.1.1.2","0.000002000","53639  >  12003 [ACK] Seq=173741 Ack=172653 Win=65335 Len=0","60","0.000000000","10.22.1.2","0.000002000","TCP"
"662","8.505560","8.505560000","0.027886000","0.027886000","10.1.1.2","0.027886000","53639  >  12003 [ACK] Seq=173741 Ack=175573 Win=65335 Len=1460","1514","0.000000000","10.22.1.2","0.027886000","TCP"
"663","8.505563","8.505563000","0.000003000","0.000003000","10.1.1.2","0.000003000","53639  >  12003 [ACK] Seq=175201 Ack=175573 Win=65335 Len=1460","1514","0.000000000","10.22.1.2","0.000003000","TCP"
"665","8.506892","8.506892000","0.001285000","0.001285000","10.1.1.2","0.001285000","53639  >  12003 [ACK] Seq=176661 Ack=175573 Win=65335 Len=1460","1514","0.000000000","10.22.1.2","0.001285000","TCP"
"666","8.506894","8.506894000","0.000002000","0.000002000","10.1.1.2","0.000002000","53639  >  12003 [ACK] Seq=178121 Ack=175573 Win=65335 Len=1460","1514","0.000000000","10.22.1.2","0.000002000","TCP"
