"No.","Time","Time since first frame in this TCP stream","segment delta","Time delta from previous captured frame","Destination","Delta Time (conv)","Info","Length","Time shift for this packet","Source","Time delta from previous captured frame","Protocol"
"1","0.000000","0.000000000","0.000000000","0.000000000","10.1.1.2","0.000000000","53633  >  8800 [SYN] Seq=0 Win=8192 Len=0 MSS=1460 WS=4 SACK_PERM=1","66","0.000000000","10.22.1.2","0.000000000","TCP"
"3","0.804034","0.804034000","0.803923000","0.803923000","10.1.1.2","0.803923000","53633  >  8800 [ACK] Seq=1 Ack=1 Win=65700 Len=0","60","0.000000000","10.22.1.2","0.803923000","TCP"
"4","0.854616","0.854616000","0.050582000","0.050582000","10.1.1.2","0.050582000","53633  >  8800 [PSH, ACK] Seq=1 Ack=1 Win=65700 Len=313","367","0.000000000","10.22.1.2","0.050582000","TCP"
"6","1.681284","1.681284000","0.819861000","0.819861000","10.1.1.2","0.819861000","53633  >  8800 [PSH, ACK] Seq=314 Ack=933 Win=64768 Len=126","180","0.000000000","10.22.1.2","0.819861000","TCP"
"8","2.498632","2.498632000","0.807680000","0.807680000","10.1.1.2","0.807680000","53633  >  8800 [PSH, ACK] Seq=440 Ack=1159 Win=64540 Len=90","144","0.000000000","10.22.1.2","0.807680000","TCP"
"15","3.345249","3.345249000","0.818808000","0.005324000","10.1.1.2","0.818808000","53633  >  8800 [ACK] Seq=530 Ack=4079 Win=65700 Len=0","60","0.000000000","10.22.1.2","0.005324000","TCP"
"19","4.154622","4.154622000","0.809337000","0.607031000","10.1.1.2","0.809337000","53633  >  8800 [ACK] Seq=530 Ack=6999 Win=65700 Len=0","60","0.000000000","10.22.1.2","0.607031000","TCP"
"21","4.158601","4.158601000","0.003909000","0.003909000","10.1.1.2","0.003909000","53633  >  8800 [ACK] Seq=530 Ack=9919 Win=65700 Len=0","60","0.000000000","10.22.1.2","0.003909000","TCP"
"23","4.749660","4.749660000","0.591040000","0.591040000","10.1.1.2","0.591040000","53633  >  8800 [PSH, ACK] Seq=530 Ack=9919 Win=65700 Len=151","205","0.000000000","10.22.1.2","0.591040000","TCP"
"26","4.963972","4.963972000","0.173443000","0.171817000","10.1.1.2","0.173443000","53633  >  8800 [ACK] Seq=681 Ack=12839 Win=65700 Len=0","60","0.000000000","10.22.1.2","0.171817000","TCP"
"27","4.977280","4.977280000","0.013308000","0.013308000","10.1.1.2","0.013308000","53633  >  8800 [ACK] Seq=681 Ack=15759 Win=65700 Len=0","60","0.000000000","10.22.1.2","0.013308000","TCP"
"28","4.977281","4.977281000","0.000001000","0.000001000","10.1.1.2","0.000001000","53633  >  8800 [ACK] Seq=681 Ack=17654 Win=65700 Len=0","60","0.000000000","10.22.1.2","0.000001000","TCP"
"33","5.604266","5.604266000","0.626896000","0.006642000","10.1.1.2","0.626896000","53633  >  8800 [ACK] Seq=681 Ack=21328 Win=65700 Len=0","60","0.000000000","10.22.1.2","0.006642000","TCP"
"34","5.610922","0.000000000","0.000000000","0.006656000","10.1.1.2","0.000000000","53637  >  12000 [SYN] Seq=0 Win=8192 Len=0 MSS=1460 WS=256 SACK_PERM=1","66","0.000000000","10.22.1.2","0.006656000","TCP"
"36","5.786641","5.786641000","0.182375000","0.175636000","10.1.1.2","0.182375000","53633  >  8800 [ACK] Seq=681 Ack=25002 Win=65700 Len=0","60","0.000000000","10.22.1.2","0.175636000","TCP"
"37","6.413637","0.802715000","0.802632000","0.626996000","10.1.1.2","0.802632000","53637  >  12000 [ACK] Seq=1 Ack=1 Win=65536 Len=0","60","0.000000000","10.22.1.2","0.626996000","TCP"
"38","6.456239","0.845317000","0.042602000","0.042602000","10.1.1.2","0.042602000","53637  >  12000 [PSH, ACK] Seq=1 Ack=1 Win=65536 Len=313","367","0.000000000","10.22.1.2","0.042602000","TCP"
"40","7.285562","1.674640000","0.820081000","0.820081000","10.1.1.2","0.820081000","53637  >  12000 [PSH, ACK] Seq=314 Ack=933 Win=64768 Len=126","180","0.000000000","10.22.1.2","0.820081000","TCP"
"42","8.100245","2.489323000","0.808370000","0.808370000","10.1.1.2","0.808370000","53637  >  12000 [PSH, ACK] Seq=440 Ack=1159 Win=64512 Len=59","113","0.000000000","10.22.1.2","0.808370000","TCP"
"44","8.906943","3.296021000","0.806243000","0.806243000","10.1.1.2","0.806243000","53637  >  12000 [PSH, ACK] Seq=499 Ack=1204 Win=64256 Len=116","170","0.000000000","10.22.1.2","0.806243000","TCP"
"46","9.766889","4.155967000","0.837759000","0.837759000","10.1.1.2","0.837759000","53637  >  12000 [PSH, ACK] Seq=615 Ack=1536 Win=65536 Len=49","103","0.000000000","10.22.1.2","0.837759000","TCP"
"48","10.590893","4.979971000","0.820647000","0.820647000","10.1.1.2","0.820647000","53637  >  12000 [PSH, ACK] Seq=664 Ack=1769 Win=65280 Len=49","103","0.000000000","10.22.1.2","0.820647000","TCP"
"51","12.676851","7.065929000","0.809097000","0.809097000","10.1.1.2","0.809097000","53637  >  12000 [ACK] Seq=713 Ack=2098 Win=65024 Len=0 SLE=1769 SRE=2098","66","0.000000000","10.22.1.2","0.809097000","TCP"
"52","13.439611","7.828689000","0.762760000","0.762760000","10.1.1.2","0.762760000","53637  >  12000 [PSH, ACK] Seq=713 Ack=2098 Win=65024 Len=68","122","0.000000000","10.22.1.2","0.762760000","TCP"
"54","14.539178","8.928256000","1.004537000","1.004537000","10.1.1.2","1.004537000","53637  >  12000 [ACK] Seq=781 Ack=3558 Win=65536 Len=0","60","0.000000000","10.22.1.2","1.004537000","TCP"
"56","15.542887","9.931965000","1.003636000","1.003636000","10.1.1.2","1.003636000","53637  >  12000 [ACK] Seq=781 Ack=4318 Win=64768 Len=0","60","0.000000000","10.22.1.2","1.003636000","TCP"
"57","16.497343","10.886421000","0.954456000","0.954456000","10.1.1.2","0.954456000","53637  >  12000 [PSH, ACK] Seq=781 Ack=4318 Win=64768 Len=74","128","0.000000000","10.22.1.2","0.954456000","TCP"
"59","17.510376","11.899454000","0.808657000","0.808657000","10.1.1.2","0.808657000","53637  >  12000 [PSH, ACK] Seq=855 Ack=5778 Win=65536 Len=132","186","0.000000000","10.22.1.2","0.808657000","TCP"
"61","17.707388","12.096466000","0.196923000","0.196923000","10.1.1.2","0.196923000","53637  >  12000 [ACK] Seq=987 Ack=7238 Win=65536 Len=0","60","0.000000000","10.22.1.2","0.196923000","TCP"
"65","18.520731","12.909809000","0.813289000","0.292855000","10.1.1.2","0.813289000","53637  >  12000 [ACK] Seq=987 Ack=11618 Win=65536 Len=0","60","0.000000000","10.22.1.2","0.292855000","TCP"
"67","19.331430","13.720508000","0.810653000","0.810653000","10.1.1.2","0.810653000","53637  >  12000 [ACK] Seq=987 Ack=16338 Win=65536 Len=0","60","0.000000000","10.22.1.2","0.810653000","TCP"
"68","19.557735","13.946813000","0.226305000","0.226305000","10.1.1.2","0.226305000","53637  >  12000 [PSH, ACK] Seq=987 Ack=16338 Win=65536 Len=64","118","0.000000000","10.22.1.2","0.226305000","TCP"
"70","20.577420","14.966498000","1.006812000","1.006812000","10.1.1.2","1.006812000","53637  >  12000 [ACK] Seq=1051 Ack=17564 Win=64256 Len=0","60","0.000000000","10.22.1.2","1.006812000","TCP"
"71","23.100008","17.489086000","2.522588000","2.522588000","10.1.1.2","2.522588000","53637  >  12000 [PSH, ACK] Seq=1051 Ack=17564 Win=64256 Len=68","122","0.000000000","10.22.1.2","2.522588000","TCP"
"73","23.912032","18.301110000","0.803304000","0.803304000","10.1.1.2","0.803304000","53637  >  12000 [PSH, ACK] Seq=1119 Ack=17728 Win=64256 Len=90","144","0.000000000","10.22.1.2","0.803304000","TCP"
"75","24.921067","19.310145000","0.802806000","0.802806000","10.1.1.2","0.802806000","53637  >  12000 [PSH, ACK] Seq=1209 Ack=17728 Win=64256 Len=50","104","0.000000000","10.22.1.2","0.802806000","TCP"
"77","25.749063","20.138141000","0.806290000","0.806290000","10.1.1.2","0.806290000","53637  >  12000 [PSH, ACK] Seq=1259 Ack=18358 Win=65536 Len=68","122","0.000000000","10.22.1.2","0.806290000","TCP"
"79","26.561085","20.950163000","0.805869000","0.805869000","10.1.1.2","0.805869000","53637  >  12000 [PSH, ACK] Seq=1327 Ack=18499 Win=65536 Len=50","104","0.000000000","10.22.1.2","0.805869000","TCP"
"81","27.393072","21.782150000","0.814407000","0.814407000","10.1.1.2","0.814407000","53637  >  12000 [PSH, ACK] Seq=1377 Ack=19103 Win=64768 Len=50","104","0.000000000","10.22.1.2","0.814407000","TCP"
"83","28.207755","22.596833000","0.804540000","0.804540000","10.1.1.2","0.804540000","53637  >  12000 [PSH, ACK] Seq=1427 Ack=19817 Win=64000 Len=68","122","0.000000000","10.22.1.2","0.804540000","TCP"
"85","29.033089","23.422167000","0.821394000","0.821394000","10.1.1.2","0.821394000","53637  >  12000 [PSH, ACK] Seq=1495 Ack=20070 Win=65536 Len=68","122","0.000000000","10.22.1.2","0.821394000","TCP"
"87","29.847773","24.236851000","0.810929000","0.810929000","10.1.1.2","0.810929000","53637  >  12000 [PSH, ACK] Seq=1563 Ack=20119 Win=65536 Len=68","122","0.000000000","10.22.1.2","0.810929000","TCP"
"89","30.670442","25.059520000","0.818571000","0.818571000","10.1.1.2","0.818571000","53637  >  12000 [PSH, ACK] Seq=1631 Ack=20168 Win=65536 Len=68","122","0.000000000","10.22.1.2","0.818571000","TCP"
"91","31.486457","25.875535000","0.812261000","0.812261000","10.1.1.2","0.812261000","53637  >  12000 [PSH, ACK] Seq=1699 Ack=20217 Win=65536 Len=68","122","0.000000000","10.22.1.2","0.812261000","TCP"
"93","32.301145","26.690223000","0.808454000","0.808454000","10.1.1.2","0.808454000","53637  >  12000 [PSH, ACK] Seq=1767 Ack=20404 Win=65280 Len=50","104","0.000000000","10.22.1.2","0.808454000","TCP"
"95","32.526110","32.526110000","26.739469000","0.218841000","10.1.1.2","26.739469000","53633  >  8800 [PSH, ACK] Seq=681 Ack=25002 Win=65700 Len=187","241","0.000000000","10.22.1.2","0.218841000","TCP"
"97","33.318165","27.707243000","1.010896000","0.574566000","10.1.1.2","1.010896000","53637  >  12000 [ACK] Seq=1817 Ack=21118 Win=64512 Len=0","60","0.000000000","10.22.1.2","0.574566000","TCP"
"101","34.154147","34.154147000","0.778865000","0.778569000","10.1.1.2","0.778865000","53633  >  8800 [ACK] Seq=868 Ack=29621 Win=65700 Len=0","60","0.000000000","10.22.1.2","0.778569000","TCP"
"102","34.155466","0.000000000","0.000000000","0.001319000","10.1.1.2","0.000000000","53638  >  12001 [SYN] Seq=0 Win=8192 Len=0 MSS=1460 WS=4 SACK_PERM=1","66","0.000000000","10.22.1.2","0.001319000","TCP"
"106","34.190077","34.190077000","0.035930000","0.006657000","10.1.1.2","0.035930000","53633  >  8800 [ACK] Seq=868 Ack=33406 Win=65700 Len=0","60","0.000000000","10.22.1.2","0.006657000","TCP"
"109","34.210044","28.599122000","0.891879000","0.006607000","10.1.1.2","0.891879000","53637  >  12000 [PSH, ACK] Seq=1817 Ack=21118 Win=64512 Len=68","122","0.000000000","10.22.1.2","0.006607000","TCP"
"111","34.958182","0.802716000","0.802570000","0.741853000","10.1.1.2","0.802570000","53638  >  12001 [ACK] Seq=1 Ack=1 Win=65700 Len=0","60","0.000000000","10.22.1.2","0.741853000","TCP"
"112","34.978150","0.822684000","0.019968000","0.019968000","10.1.1.2","0.019968000","53638  >  12001 [PSH, ACK] Seq=1 Ack=1 Win=65700 Len=313","367","0.000000000","10.22.1.2","0.019968000","TCP"
"114","35.026067","29.415145000","0.809738000","0.007985000","10.1.1.2","0.809738000","53637  >  12000 [PSH, ACK] Seq=1885 Ack=21305 Win=64256 Len=626","680","0.000000000","10.22.1.2","0.007985000","TCP"
"122","35.882017","30.271095000","0.803345000","0.388663000","10.1.1.2","0.803345000","53637  >  12000 [PSH, ACK] Seq=2511 Ack=21436 Win=64256 Len=50","104","0.000000000","10.22.1.2","0.388663000","TCP"
"126","36.309321","2.153855000","0.815967000","0.003985000","10.1.1.2","0.815967000","53638  >  12001 [PSH, ACK] Seq=314 Ack=933 Win=64768 Len=126","180","0.000000000","10.22.1.2","0.003985000","TCP"
"129","36.887066","31.276144000","1.004986000","0.569277000","10.1.1.2","1.004986000","53637  >  12000 [ACK] Seq=2561 Ack=22402 Win=65536 Len=0","60","0.000000000","10.22.1.2","0.569277000","TCP"
"131","37.125340","0.000000000","0.000000000","0.238208000","10.1.1.2","0.000000000","53640  >  12002 [SYN] Seq=0 Win=8192 Len=0 MSS=1460 WS=4 SACK_PERM=1","66","0.000000000","10.22.1.2","0.238208000","TCP"
"132","37.125342","0.000000000","0.000000000","0.000002000","10.1.1.2","0.000000000","53639  >  12003 [SYN] Seq=0 Win=8192 Len=0 MSS=1460 WS=4 SACK_PERM=1","66","0.000000000","10.22.1.2","0.000002000","TCP"
"140","37.326341","3.170875000","1.008552000","0.007984000","10.1.1.2","1.008552000","53638  >  12001 [ACK] Seq=440 Ack=1259 Win=64440 Len=0","60","0.000000000","10.22.1.2","0.007984000","TCP"
"141","37.653829","3.498363000","0.327488000","0.327488000","10.1.1.2","0.327488000","53638  >  12001 [ACK] Seq=440 Ack=1259 Win=64440 Len=1460","1514","0.000000000","10.22.1.2","0.327488000","TCP"
"142","37.653832","3.498366000","0.000003000","0.000003000","10.1.1.2","0.000003000","53638  >  12001 [ACK] Seq=1900 Ack=1259 Win=64440 Len=1460","1514","0.000000000","10.22.1.2","0.000003000","TCP"
"147","37.889438","32.278516000","1.002306000","0.228933000","10.1.1.2","1.002306000","53637  >  12000 [ACK] Seq=2561 Ack=23116 Win=64768 Len=0","60","0.000000000","10.22.1.2","0.228933000","TCP"
"148","37.932033","0.806693000","0.806545000","0.042595000","10.1.1.2","0.806545000","53640  >  12002 [ACK] Seq=1 Ack=1 Win=65700 Len=0","60","0.000000000","10.22.1.2","0.042595000","TCP"
"151","37.941355","0.816013000","0.815783000","0.003995000","10.1.1.2","0.815783000","53639  >  12003 [ACK] Seq=1 Ack=1 Win=65700 Len=0","60","0.000000000","10.22.1.2","0.003995000","TCP"
"152","37.958658","0.833316000","0.017303000","0.017303000","10.1.1.2","0.017303000","53639  >  12003 [PSH, ACK] Seq=1 Ack=1 Win=65700 Len=313","367","0.000000000","10.22.1.2","0.017303000","TCP"
"153","37.961316","0.835976000","0.029283000","0.002658000","10.1.1.2","0.029283000","53640  >  12002 [PSH, ACK] Seq=1 Ack=1 Win=65700 Len=313","367","0.000000000","10.22.1.2","0.002658000","TCP"
"160","38.461856","4.306390000","0.807950000","0.449596000","10.1.1.2","0.807950000","53638  >  12001 [ACK] Seq=3360 Ack=1259 Win=64440 Len=1460","1514","0.000000000","10.22.1.2","0.449596000","TCP"
"161","38.463176","4.307710000","0.001320000","0.001320000","10.1.1.2","0.001320000","53638  >  12001 [ACK] Seq=4820 Ack=1259 Win=64440 Len=1460","1514","0.000000000","10.22.1.2","0.001320000","TCP"
"162","38.463179","4.307713000","0.000003000","0.000003000","10.1.1.2","0.000003000","53638  >  12001 [ACK] Seq=6280 Ack=1259 Win=64440 Len=1460","1514","0.000000000","10.22.1.2","0.000003000","TCP"
"163","38.463180","4.307714000","0.000001000","0.000001000","10.1.1.2","0.000001000","53638  >  12001 [ACK] Seq=7740 Ack=1259 Win=64440 Len=1460","1514","0.000000000","10.22.1.2","0.000001000","TCP"
"171","38.791979","1.666639000","0.817101000","0.312803000","10.1.1.2","0.817101000","53640  >  12002 [PSH, ACK] Seq=314 Ack=933 Win=64768 Len=126","180","0.000000000","10.22.1.2","0.312803000","TCP"
"177","38.825254","1.699912000","0.812994000","0.007090000","10.1.1.2","0.812994000","53639  >  12003 [PSH, ACK] Seq=314 Ack=933 Win=64768 Len=126","180","0.000000000","10.22.1.2","0.007090000","TCP"
"181","39.267216","5.111750000","0.803994000","0.111785000","10.1.1.2","0.803994000","53638  >  12001 [ACK] Seq=9200 Ack=1259 Win=64440 Len=1460","1514","0.000000000","10.22.1.2","0.111785000","TCP"
"182","39.267218","5.111752000","0.000002000","0.000002000","10.1.1.2","0.000002000","53638  >  12001 [PSH, ACK] Seq=10660 Ack=1259 Win=64440 Len=1131","1185","0.000000000","10.22.1.2","0.000002000","TCP"
"190","39.617310","2.491970000","0.818989000","0.007975000","10.1.1.2","0.818989000","53640  >  12002 [PSH, ACK] Seq=440 Ack=1219 Win=64480 Len=575","629","0.000000000","10.22.1.2","0.007975000","TCP"
"192","39.707830","2.582488000","0.876373000","0.021292000","10.1.1.2","0.876373000","53639  >  12003 [PSH, ACK] Seq=440 Ack=1219 Win=64480 Len=172","226","0.000000000","10.22.1.2","0.021292000","TCP"
"203","40.123156","5.967690000","0.810762000","0.001841000","10.1.1.2","0.810762000","53638  >  12001 [ACK] Seq=11791 Ack=4179 Win=65700 Len=0","60","0.000000000","10.22.1.2","0.001841000","TCP"
"215","40.928523","6.773057000","0.805338000","0.003954000","10.1.1.2","0.805338000","53638  >  12001 [ACK] Seq=11791 Ack=8559 Win=65700 Len=0","60","0.000000000","10.22.1.2","0.003954000","TCP"
"217","41.140187","6.984721000","0.211639000","0.211639000","10.1.1.2","0.211639000","53638  >  12001 [ACK] Seq=11791 Ack=10019 Win=65700 Len=0","60","0.000000000","10.22.1.2","0.211639000","TCP"
"225","41.735228","7.579762000","0.595041000","0.188049000","10.1.1.2","0.595041000","53638  >  12001 [ACK] Seq=11791 Ack=12585 Win=65700 Len=0","60","0.000000000","10.22.1.2","0.188049000","TCP"
"231","41.800448","7.644982000","0.065220000","0.062528000","10.1.1.2","0.065220000","53638  >  12001 [PSH, ACK] Seq=11791 Ack=12585 Win=65700 Len=106","160","0.000000000","10.22.1.2","0.062528000","TCP"
"253","42.334260","8.178794000","0.336868000","0.017252000","10.1.1.2","0.336868000","53638  >  12001 [PSH, ACK] Seq=11897 Ack=12585 Win=65700 Len=1460","1514","0.000000000","10.22.1.2","0.017252000","TCP"
"254","42.334263","8.178797000","0.000003000","0.000003000","10.1.1.2","0.000003000","53638  >  12001 [ACK] Seq=13357 Ack=12585 Win=65700 Len=1460","1514","0.000000000","10.22.1.2","0.000003000","TCP"
"256","42.335585","8.180119000","0.001270000","0.001270000","10.1.1.2","0.001270000","[TCP Previous segment not captured] 53638  >  12001 [ACK] Seq=16277 Ack=12585 Win=65700 Len=1460","1514","0.000000000","10.22.1.2","0.001270000","TCP"
"257","42.335588","8.180122000","0.000003000","0.000003000","10.1.1.2","0.000003000","53638  >  12001 [ACK] Seq=17737 Ack=12585 Win=65700 Len=1460","1514","0.000000000","10.22.1.2","0.000003000","TCP"
"258","42.335590","8.180124000","0.000002000","0.000002000","10.1.1.2","0.000002000","53638  >  12001 [ACK] Seq=19197 Ack=12585 Win=65700 Len=1460","1514","0.000000000","10.22.1.2","0.000002000","TCP"
"262","42.338245","8.182779000","0.002579000","0.002579000","10.1.1.2","0.002579000","53638  >  12001 [ACK] Seq=20657 Ack=12585 Win=65700 Len=1460","1514","0.000000000","10.22.1.2","0.002579000","TCP"
"265","42.347568","8.192102000","0.004630000","0.004630000","10.1.1.2","0.004630000","53638  >  12001 [ACK] Seq=22117 Ack=12585 Win=65700 Len=1460","1514","0.000000000","10.22.1.2","0.004630000","TCP"
"266","42.347571","8.192105000","0.000003000","0.000003000","10.1.1.2","0.000003000","53638  >  12001 [ACK] Seq=23577 Ack=12585 Win=65700 Len=1460","1514","0.000000000","10.22.1.2","0.000003000","TCP"
"267","42.347573","8.192107000","0.000002000","0.000002000","10.1.1.2","0.000002000","53638  >  12001 [PSH, ACK] Seq=25037 Ack=12585 Win=65700 Len=978","1032","0.000000000","10.22.1.2","0.000002000","TCP"
"285","43.143612","8.988146000","0.795971000","0.021297000","10.1.1.2","0.795971000","[TCP Out-Of-Order] 53638  >  12001 [ACK] Seq=14817 Ack=12585 Win=65700 Len=1460","1514","0.000000000","10.22.1.2","0.021297000","TCP"
"287","43.154263","8.998797000","0.010605000","0.010605000","10.1.1.2","0.010605000","53638  >  12001 [PSH, ACK] Seq=26015 Ack=15505 Win=65700 Len=121","175","0.000000000","10.22.1.2","0.010605000","TCP"
"289","43.156923","9.001457000","0.002614000","0.002614000","10.1.1.2","0.002614000","53638  >  12001 [ACK] Seq=26136 Ack=18425 Win=65700 Len=0","60","0.000000000","10.22.1.2","0.002614000","TCP"
"290","43.162251","9.006785000","0.005328000","0.005328000","10.1.1.2","0.005328000","53638  >  12001 [ACK] Seq=26136 Ack=22805 Win=65700 Len=0","60","0.000000000","10.22.1.2","0.005328000","TCP"
"291","43.162252","9.006786000","0.000001000","0.000001000","10.1.1.2","0.000001000","53638  >  12001 [ACK] Seq=26136 Ack=25725 Win=65700 Len=0","60","0.000000000","10.22.1.2","0.000001000","TCP"
"296","43.212841","6.087499000","0.033144000","0.033144000","10.1.1.2","0.033144000","53639  >  12003 [PSH, ACK] Seq=612 Ack=1219 Win=64480 Len=347","401","0.000000000","10.22.1.2","0.033144000","TCP"
"297","43.247459","6.122117000","0.034618000","0.034618000","10.1.1.2","0.034618000","53639  >  12003 [ACK] Seq=959 Ack=1219 Win=64480 Len=1460","1514","0.000000000","10.22.1.2","0.034618000","TCP"
"298","43.247463","6.122121000","0.000004000","0.000004000","10.1.1.2","0.000004000","53639  >  12003 [PSH, ACK] Seq=2419 Ack=1219 Win=64480 Len=996","1050","0.000000000","10.22.1.2","0.000004000","TCP"
"305","43.347282","6.221940000","0.099753000","0.008531000","10.1.1.2","0.099753000","53639  >  12003 [PSH, ACK] Seq=3415 Ack=1219 Win=64480 Len=728","782","0.000000000","10.22.1.2","0.008531000","TCP"
"308","43.361923","9.206457000","0.199671000","0.002660000","10.1.1.2","0.199671000","53638  >  12001 [ACK] Seq=26136 Ack=26425 Win=65000 Len=0","60","0.000000000","10.22.1.2","0.002660000","TCP"
"321","43.964964","9.809498000","0.603041000","0.199650000","10.1.1.2","0.603041000","53638  >  12001 [PSH, ACK] Seq=26136 Ack=26546 Win=64876 Len=242","296","0.000000000","10.22.1.2","0.199650000","TCP"
"330","44.059464","6.934122000","0.504415000","0.005324000","10.1.1.2","0.504415000","53639  >  12003 [PSH, ACK] Seq=4143 Ack=1391 Win=64308 Len=1460","1514","0.000000000","10.22.1.2","0.005324000","TCP"
"331","44.059466","6.934124000","0.000002000","0.000002000","10.1.1.2","0.000002000","53639  >  12003 [PSH, ACK] Seq=5603 Ack=1391 Win=64308 Len=1460","1514","0.000000000","10.22.1.2","0.000002000","TCP"
"334","44.060798","6.935456000","0.001295000","0.000194000","10.1.1.2","0.001295000","53639  >  12003 [ACK] Seq=7063 Ack=1391 Win=64308 Len=1460","1514","0.000000000","10.22.1.2","0.000194000","TCP"
"344","44.144660","7.019320000","0.481717000","0.011978000","10.1.1.2","0.481717000","53640  >  12002 [ACK] Seq=1015 Ack=2855 Win=65700 Len=0","60","0.000000000","10.22.1.2","0.011978000","TCP"
"348","44.305737","7.180397000","0.160947000","0.042599000","10.1.1.2","0.160947000","53640  >  12002 [ACK] Seq=1015 Ack=4439 Win=65700 Len=0","60","0.000000000","10.22.1.2","0.042599000","TCP"
"351","44.360312","7.234970000","0.298741000","0.024956000","10.1.1.2","0.298741000","53639  >  12003 [ACK] Seq=8523 Ack=1391 Win=64308 Len=1460","1514","0.000000000","10.22.1.2","0.024956000","TCP"
"357","44.465489","7.340149000","0.159689000","0.089178000","10.1.1.2","0.159689000","53640  >  12002 [ACK] Seq=1015 Ack=5357 Win=64780 Len=0","60","0.000000000","10.22.1.2","0.089178000","TCP"
"363","44.788959","10.633493000","0.823927000","0.212959000","10.1.1.2","0.823927000","53638  >  12001 [PSH, ACK] Seq=26378 Ack=26667 Win=64756 Len=714","768","0.000000000","10.22.1.2","0.212959000","TCP"
"370","44.868827","7.743485000","0.508479000","0.003997000","10.1.1.2","0.508479000","53639  >  12003 [ACK] Seq=9983 Ack=1846 Win=65700 Len=1460","1514","0.000000000","10.22.1.2","0.003997000","TCP"
"371","44.868828","7.743486000","0.000001000","0.000001000","10.1.1.2","0.000001000","53639  >  12003 [ACK] Seq=11443 Ack=1846 Win=65700 Len=1460","1514","0.000000000","10.22.1.2","0.000001000","TCP"
"372","44.868830","7.743488000","0.000002000","0.000002000","10.1.1.2","0.000002000","53639  >  12003 [ACK] Seq=12903 Ack=1846 Win=65700 Len=1460","1514","0.000000000","10.22.1.2","0.000002000","TCP"
"378","44.878142","7.752800000","0.008152000","0.008152000","10.1.1.2","0.008152000","53639  >  12003 [ACK] Seq=14363 Ack=1846 Win=65700 Len=1460","1514","0.000000000","10.22.1.2","0.008152000","TCP"
"379","44.878145","7.752803000","0.000003000","0.000003000","10.1.1.2","0.000003000","53639  >  12003 [ACK] Seq=15823 Ack=3306 Win=65700 Len=1460","1514","0.000000000","10.22.1.2","0.000003000","TCP"
"380","44.878147","7.752805000","0.000002000","0.000002000","10.1.1.2","0.000002000","53639  >  12003 [ACK] Seq=17283 Ack=3306 Win=65700 Len=1460","1514","0.000000000","10.22.1.2","0.000002000","TCP"
"386","44.951358","7.826018000","0.485809000","0.063864000","10.1.1.2","0.485809000","53640  >  12002 [ACK] Seq=1015 Ack=8277 Win=65700 Len=0","60","0.000000000","10.22.1.2","0.063864000","TCP"
"389","45.079166","7.953824000","0.200983000","0.127674000","10.1.1.2","0.200983000","53639  >  12003 [ACK] Seq=18743 Ack=3401 Win=65604 Len=0","60","0.000000000","10.22.1.2","0.127674000","TCP"
"390","45.120422","7.995082000","0.168930000","0.041256000","10.1.1.2","0.168930000","53640  >  12002 [ACK] Seq=1015 Ack=10089 Win=65700 Len=0","60","0.000000000","10.22.1.2","0.041256000","TCP"
"396","45.163015","8.037673000","0.021697000","0.021697000","10.1.1.2","0.021697000","53639  >  12003 [ACK] Seq=18743 Ack=3740 Win=65264 Len=1460","1514","0.000000000","10.22.1.2","0.021697000","TCP"
"398","45.164345","8.039003000","0.001290000","0.001290000","10.1.1.2","0.001290000","53639  >  12003 [ACK] Seq=20203 Ack=3740 Win=65264 Len=1460","1514","0.000000000","10.22.1.2","0.001290000","TCP"
"399","45.167007","8.041665000","0.002662000","0.002662000","10.1.1.2","0.002662000","53639  >  12003 [PSH, ACK] Seq=21663 Ack=3740 Win=65264 Len=1222","1276","0.000000000","10.22.1.2","0.002662000","TCP"
"406","45.269511","8.144171000","0.148875000","0.073182000","10.1.1.2","0.148875000","53640  >  12002 [ACK] Seq=1015 Ack=12659 Win=65700 Len=0","60","0.000000000","10.22.1.2","0.073182000","TCP"
"415","45.598310","11.442844000","0.001853000","0.001853000","10.1.1.2","0.001853000","53638  >  12001 [PSH, ACK] Seq=27092 Ack=26909 Win=64516 Len=835","889","0.000000000","10.22.1.2","0.001853000","TCP"
"417","45.675530","8.550188000","0.508497000","0.001330000","10.1.1.2","0.508497000","53639  >  12003 [ACK] Seq=22885 Ack=3830 Win=65176 Len=1460","1514","0.000000000","10.22.1.2","0.001330000","TCP"
"418","45.675532","8.550190000","0.000002000","0.000002000","10.1.1.2","0.000002000","53639  >  12003 [ACK] Seq=24345 Ack=3830 Win=65176 Len=1460","1514","0.000000000","10.22.1.2","0.000002000","TCP"
"419","45.675534","8.550192000","0.000002000","0.000002000","10.1.1.2","0.000002000","53639  >  12003 [ACK] Seq=25805 Ack=3830 Win=65176 Len=1460","1514","0.000000000","10.22.1.2","0.000002000","TCP"
"420","45.675535","8.550193000","0.000001000","0.000001000","10.1.1.2","0.000001000","53639  >  12003 [ACK] Seq=27265 Ack=3830 Win=65176 Len=1460","1514","0.000000000","10.22.1.2","0.000001000","TCP"
"421","45.675537","8.550195000","0.000002000","0.000002000","10.1.1.2","0.000002000","53639  >  12003 [ACK] Seq=28725 Ack=3830 Win=65176 Len=1460","1514","0.000000000","10.22.1.2","0.000002000","TCP"
"427","45.683512","8.558170000","0.007903000","0.007885000","10.1.1.2","0.007903000","53639  >  12003 [ACK] Seq=30185 Ack=3830 Win=65176 Len=1460","1514","0.000000000","10.22.1.2","0.007885000","TCP"
"428","45.687504","8.562162000","0.003992000","0.003992000","10.1.1.2","0.003992000","53639  >  12003 [ACK] Seq=31645 Ack=7620 Win=65700 Len=1460","1514","0.000000000","10.22.1.2","0.003992000","TCP"
"429","45.687506","8.562164000","0.000002000","0.000002000","10.1.1.2","0.000002000","53639  >  12003 [ACK] Seq=33105 Ack=7620 Win=65700 Len=1460","1514","0.000000000","10.22.1.2","0.000002000","TCP"
"430","45.687508","8.562166000","0.000002000","0.000002000","10.1.1.2","0.000002000","53639  >  12003 [ACK] Seq=34565 Ack=7620 Win=65700 Len=1460","1514","0.000000000","10.22.1.2","0.000002000","TCP"
"433","45.695492","8.570150000","0.007930000","0.004000000","10.1.1.2","0.007930000","53639  >  12003 [ACK] Seq=36025 Ack=7620 Win=65700 Len=1460","1514","0.000000000","10.22.1.2","0.004000000","TCP"
"434","45.695494","8.570152000","0.000002000","0.000002000","10.1.1.2","0.000002000","53639  >  12003 [ACK] Seq=37485 Ack=7620 Win=65700 Len=1460","1514","0.000000000","10.22.1.2","0.000002000","TCP"
"435","45.695496","8.570154000","0.000002000","0.000002000","10.1.1.2","0.000002000","53639  >  12003 [ACK] Seq=38945 Ack=7620 Win=65700 Len=1460","1514","0.000000000","10.22.1.2","0.000002000","TCP"
"440","45.756733","8.631393000","0.473601000","0.061164000","10.1.1.2","0.473601000","53640  >  12002 [ACK] Seq=1015 Ack=15175 Win=65700 Len=0","60","0.000000000","10.22.1.2","0.061164000","TCP"
"443","45.779357","8.654017000","0.022468000","0.022468000","10.1.1.2","0.022468000","53640  >  12002 [ACK] Seq=1015 Ack=17587 Win=65700 Len=0","60","0.000000000","10.22.1.2","0.022468000","TCP"
"445","45.928447","8.803107000","0.149090000","0.133063000","10.1.1.2","0.149090000","53640  >  12002 [ACK] Seq=1015 Ack=19171 Win=65700 Len=0","60","0.000000000","10.22.1.2","0.133063000","TCP"
"454","45.968379","8.843037000","0.023042000","0.022595000","10.1.1.2","0.023042000","53639  >  12003 [ACK] Seq=40405 Ack=10399 Win=65700 Len=1460","1514","0.000000000","10.22.1.2","0.022595000","TCP"
"455","45.969711","8.844369000","0.001332000","0.001332000","10.1.1.2","0.001332000","53639  >  12003 [ACK] Seq=41865 Ack=10399 Win=65700 Len=1460","1514","0.000000000","10.22.1.2","0.001332000","TCP"
"457","45.975040","8.849698000","0.005303000","0.005303000","10.1.1.2","0.005303000","53639  >  12003 [ACK] Seq=43325 Ack=10399 Win=65700 Len=1460","1514","0.000000000","10.22.1.2","0.005303000","TCP"
"458","45.975042","8.849700000","0.000002000","0.000002000","10.1.1.2","0.000002000","53639  >  12003 [ACK] Seq=44785 Ack=10399 Win=65700 Len=1460","1514","0.000000000","10.22.1.2","0.000002000","TCP"
"459","45.975046","8.849704000","0.000004000","0.000004000","10.1.1.2","0.000004000","53639  >  12003 [ACK] Seq=46245 Ack=10399 Win=65700 Len=1460","1514","0.000000000","10.22.1.2","0.000004000","TCP"
"476","46.086864","8.961524000","0.047446000","0.047446000","10.1.1.2","0.047446000","53640  >  12002 [ACK] Seq=1015 Ack=20755 Win=65700 Len=0","60","0.000000000","10.22.1.2","0.047446000","TCP"
"484","46.423648","12.268182000","0.628264000","0.019915000","10.1.1.2","0.628264000","53638  >  12001 [PSH, ACK] Seq=27927 Ack=28460 Win=65700 Len=1428","1482","0.000000000","10.22.1.2","0.019915000","TCP"
"485","46.423651","12.268185000","0.000003000","0.000003000","10.1.1.2","0.000003000","53638  >  12001 [PSH, ACK] Seq=29355 Ack=28460 Win=65700 Len=1460","1514","0.000000000","10.22.1.2","0.000003000","TCP"
"486","46.423653","12.268187000","0.000002000","0.000002000","10.1.1.2","0.000002000","53638  >  12001 [PSH, ACK] Seq=30815 Ack=28460 Win=65700 Len=319","373","0.000000000","10.22.1.2","0.000002000","TCP"
"494","46.483549","9.358207000","0.508472000","0.001275000","10.1.1.2","0.508472000","53639  >  12003 [ACK] Seq=47705 Ack=10579 Win=65520 Len=1460","1514","0.000000000","10.22.1.2","0.001275000","TCP"
"502","46.491534","9.366192000","0.005841000","0.003964000","10.1.1.2","0.005841000","53639  >  12003 [ACK] Seq=49165 Ack=10579 Win=65520 Len=1460","1514","0.000000000","10.22.1.2","0.003964000","TCP"
"503","46.491536","9.366194000","0.000002000","0.000002000","10.1.1.2","0.000002000","53639  >  12003 [ACK] Seq=50625 Ack=10579 Win=65520 Len=1460","1514","0.000000000","10.22.1.2","0.000002000","TCP"
"505","46.492870","9.367528000","0.001305000","0.001305000","10.1.1.2","0.001305000","53639  >  12003 [ACK] Seq=52085 Ack=10579 Win=65520 Len=1460","1514","0.000000000","10.22.1.2","0.001305000","TCP"
"506","46.492872","9.367530000","0.000002000","0.000002000","10.1.1.2","0.000002000","53639  >  12003 [ACK] Seq=53545 Ack=10579 Win=65520 Len=1460","1514","0.000000000","10.22.1.2","0.000002000","TCP"
"507","46.492876","9.367534000","0.000004000","0.000004000","10.1.1.2","0.000004000","53639  >  12003 [ACK] Seq=55005 Ack=10579 Win=65520 Len=1460","1514","0.000000000","10.22.1.2","0.000004000","TCP"
"508","46.492878","9.367536000","0.000002000","0.000002000","10.1.1.2","0.000002000","53639  >  12003 [ACK] Seq=56465 Ack=10579 Win=65520 Len=1460","1514","0.000000000","10.22.1.2","0.000002000","TCP"
"509","46.492880","9.367538000","0.000002000","0.000002000","10.1.1.2","0.000002000","53639  >  12003 [ACK] Seq=57925 Ack=10579 Win=65520 Len=1460","1514","0.000000000","10.22.1.2","0.000002000","TCP"
"510","46.492881","9.367539000","0.000001000","0.000001000","10.1.1.2","0.000001000","53639  >  12003 [ACK] Seq=59385 Ack=10579 Win=65520 Len=1460","1514","0.000000000","10.22.1.2","0.000001000","TCP"
"512","46.495534","9.370192000","0.002618000","0.002618000","10.1.1.2","0.002618000","53639  >  12003 [ACK] Seq=60845 Ack=12039 Win=65700 Len=1460","1514","0.000000000","10.22.1.2","0.002618000","TCP"
"513","46.495536","9.370194000","0.000002000","0.000002000","10.1.1.2","0.000002000","53639  >  12003 [ACK] Seq=62305 Ack=12039 Win=65700 Len=1460","1514","0.000000000","10.22.1.2","0.000002000","TCP"
"514","46.495538","9.370196000","0.000002000","0.000002000","10.1.1.2","0.000002000","53639  >  12003 [ACK] Seq=63765 Ack=12039 Win=65700 Len=1460","1514","0.000000000","10.22.1.2","0.000002000","TCP"
"515","46.495540","9.370198000","0.000002000","0.000002000","10.1.1.2","0.000002000","53639  >  12003 [ACK] Seq=65225 Ack=12039 Win=65700 Len=1460","1514","0.000000000","10.22.1.2","0.000002000","TCP"
"516","46.495542","9.370200000","0.000002000","0.000002000","10.1.1.2","0.000002000","53639  >  12003 [ACK] Seq=66685 Ack=12039 Win=65700 Len=1460","1514","0.000000000","10.22.1.2","0.000002000","TCP"
"517","46.495543","9.370201000","0.000001000","0.000001000","10.1.1.2","0.000001000","53639  >  12003 [ACK] Seq=68145 Ack=12039 Win=65700 Len=1460","1514","0.000000000","10.22.1.2","0.000001000","TCP"
"518","46.495547","9.370205000","0.000004000","0.000004000","10.1.1.2","0.000004000","53639  >  12003 [ACK] Seq=69605 Ack=12039 Win=65700 Len=1460","1514","0.000000000","10.22.1.2","0.000004000","TCP"
"521","46.499521","9.374179000","0.003439000","0.003439000","10.1.1.2","0.003439000","53639  >  12003 [PSH, ACK] Seq=71065 Ack=12039 Win=65700 Len=1460","1514","0.000000000","10.22.1.2","0.003439000","TCP"
"523","46.511508","9.386166000","0.011987000","0.010655000","10.1.1.2","0.011987000","53639  >  12003 [ACK] Seq=72525 Ack=14257 Win=65700 Len=1460","1514","0.000000000","10.22.1.2","0.010655000","TCP"
"524","46.511511","9.386169000","0.000003000","0.000003000","10.1.1.2","0.000003000","53639  >  12003 [ACK] Seq=73985 Ack=14257 Win=65700 Len=1460","1514","0.000000000","10.22.1.2","0.000003000","TCP"
"525","46.511512","9.386170000","0.000001000","0.000001000","10.1.1.2","0.000001000","53639  >  12003 [ACK] Seq=75445 Ack=14257 Win=65700 Len=1460","1514","0.000000000","10.22.1.2","0.000001000","TCP"
"526","46.511514","9.386172000","0.000002000","0.000002000","10.1.1.2","0.000002000","53639  >  12003 [ACK] Seq=76905 Ack=14257 Win=65700 Len=1460","1514","0.000000000","10.22.1.2","0.000002000","TCP"
"527","46.511518","9.386176000","0.000004000","0.000004000","10.1.1.2","0.000004000","53639  >  12003 [ACK] Seq=78365 Ack=14257 Win=65700 Len=1460","1514","0.000000000","10.22.1.2","0.000004000","TCP"
"528","46.511520","9.386178000","0.000002000","0.000002000","10.1.1.2","0.000002000","53639  >  12003 [ACK] Seq=79825 Ack=14257 Win=65700 Len=1460","1514","0.000000000","10.22.1.2","0.000002000","TCP"
"530","46.567412","9.442072000","0.366241000","0.055845000","10.1.1.2","0.366241000","53640  >  12002 [ACK] Seq=1015 Ack=25331 Win=65700 Len=0","60","0.000000000","10.22.1.2","0.055845000","TCP"
"546","46.760435","9.635093000","0.248868000","0.009269000","10.1.1.2","0.248868000","53639  >  12003 [ACK] Seq=81285 Ack=16675 Win=65700 Len=0","60","0.000000000","10.22.1.2","0.009269000","TCP"
"548","46.773745","9.648403000","0.013204000","0.013204000","10.1.1.2","0.013204000","53639  >  12003 [ACK] Seq=81285 Ack=16675 Win=65700 Len=1460","1514","0.000000000","10.22.1.2","0.013204000","TCP"
"549","46.775079","9.649737000","0.001334000","0.001334000","10.1.1.2","0.001334000","53639  >  12003 [ACK] Seq=82745 Ack=16675 Win=65700 Len=1460","1514","0.000000000","10.22.1.2","0.001334000","TCP"
"550","46.775081","9.649739000","0.000002000","0.000002000","10.1.1.2","0.000002000","53639  >  12003 [ACK] Seq=84205 Ack=16675 Win=65700 Len=1460","1514","0.000000000","10.22.1.2","0.000002000","TCP"
"551","46.775084","9.649742000","0.000003000","0.000003000","10.1.1.2","0.000003000","53639  >  12003 [ACK] Seq=85665 Ack=16675 Win=65700 Len=1460","1514","0.000000000","10.22.1.2","0.000003000","TCP"
"553","46.777740","9.652398000","0.002626000","0.002626000","10.1.1.2","0.002626000","53639  >  12003 [ACK] Seq=87125 Ack=16675 Win=65700 Len=1460","1514","0.000000000","10.22.1.2","0.002626000","TCP"
"554","46.783069","9.657727000","0.005329000","0.005329000","10.1.1.2","0.005329000","53639  >  12003 [ACK] Seq=88585 Ack=16675 Win=65700 Len=1460","1514","0.000000000","10.22.1.2","0.005329000","TCP"
"555","46.783072","9.657730000","0.000003000","0.000003000","10.1.1.2","0.000003000","53639  >  12003 [ACK] Seq=90045 Ack=16675 Win=65700 Len=1460","1514","0.000000000","10.22.1.2","0.000003000","TCP"
"556","46.783074","9.657732000","0.000002000","0.000002000","10.1.1.2","0.000002000","53639  >  12003 [ACK] Seq=91505 Ack=16675 Win=65700 Len=1460","1514","0.000000000","10.22.1.2","0.000002000","TCP"
"557","46.783075","9.657733000","0.000001000","0.000001000","10.1.1.2","0.000001000","53639  >  12003 [ACK] Seq=92965 Ack=16675 Win=65700 Len=1460","1514","0.000000000","10.22.1.2","0.000001000","TCP"
"558","46.783077","9.657735000","0.000002000","0.000002000","10.1.1.2","0.000002000","53639  >  12003 [ACK] Seq=94425 Ack=16675 Win=65700 Len=1460","1514","0.000000000","10.22.1.2","0.000002000","TCP"
"571","46.844299","9.718959000","0.276808000","0.027921000","10.1.1.2","0.276808000","53640  >  12002 [ACK] Seq=1015 Ack=27443 Win=65700 Len=0","60","0.000000000","10.22.1.2","0.027921000","TCP"
"574","47.005378","9.880038000","0.138193000","0.138193000","10.1.1.2","0.138193000","53640  >  12002 [ACK] Seq=1015 Ack=29027 Win=65700 Len=0","60","0.000000000","10.22.1.2","0.138193000","TCP"
"584","47.234339","13.078873000","0.810634000","0.001330000","10.1.1.2","0.810634000","53638  >  12001 [PSH, ACK] Seq=31134 Ack=29296 Win=64864 Len=593","647","0.000000000","10.22.1.2","0.001330000","TCP"
"586","47.294250","10.168908000","0.511135000","0.059854000","10.1.1.2","0.511135000","53639  >  12003 [ACK] Seq=95885 Ack=18135 Win=65700 Len=1460","1514","0.000000000","10.22.1.2","0.059854000","TCP"
"588","47.295571","10.170229000","0.001235000","0.001235000","10.1.1.2","0.001235000","53639  >  12003 [ACK] Seq=97345 Ack=18135 Win=65700 Len=1460","1514","0.000000000","10.22.1.2","0.001235000","TCP"
"589","47.295573","10.170231000","0.000002000","0.000002000","10.1.1.2","0.000002000","53639  >  12003 [ACK] Seq=98805 Ack=23975 Win=65700 Len=0","60","0.000000000","10.22.1.2","0.000002000","TCP"
"590","47.295574","10.170232000","0.000001000","0.000001000","10.1.1.2","0.000001000","53639  >  12003 [ACK] Seq=98805 Ack=23975 Win=65700 Len=1460","1514","0.000000000","10.22.1.2","0.000001000","TCP"
"597","47.298230","10.172888000","0.002614000","0.001281000","10.1.1.2","0.002614000","53639  >  12003 [ACK] Seq=100265 Ack=23975 Win=65700 Len=1460","1514","0.000000000","10.22.1.2","0.001281000","TCP"
"598","47.298231","10.172889000","0.000001000","0.000001000","10.1.1.2","0.000001000","53639  >  12003 [ACK] Seq=101725 Ack=23975 Win=65700 Len=1460","1514","0.000000000","10.22.1.2","0.000001000","TCP"
"599","47.298234","10.172892000","0.000003000","0.000003000","10.1.1.2","0.000003000","53639  >  12003 [ACK] Seq=103185 Ack=23975 Win=65700 Len=1460","1514","0.000000000","10.22.1.2","0.000003000","TCP"
"616","47.302226","10.176884000","0.003973000","0.001171000","10.1.1.2","0.003973000","53639  >  12003 [ACK] Seq=104645 Ack=25435 Win=65700 Len=1460","1514","0.000000000","10.22.1.2","0.001171000","TCP"
"617","47.302227","10.176885000","0.000001000","0.000001000","10.1.1.2","0.000001000","53639  >  12003 [ACK] Seq=106105 Ack=25435 Win=65700 Len=1460","1514","0.000000000","10.22.1.2","0.000001000","TCP"
"618","47.302229","10.176887000","0.000002000","0.000002000","10.1.1.2","0.000002000","53639  >  12003 [ACK] Seq=107565 Ack=25435 Win=65700 Len=1460","1514","0.000000000","10.22.1.2","0.000002000","TCP"
"619","47.302229","10.176887000","0.000000000","0.000000000","10.1.1.2","0.000000000","53639  >  12003 [ACK] Seq=109025 Ack=25435 Win=65700 Len=1460","1514","0.000000000","10.22.1.2","0.000000000","TCP"
"620","47.302231","10.176889000","0.000002000","0.000002000","10.1.1.2","0.000002000","53639  >  12003 [ACK] Seq=110485 Ack=25435 Win=65700 Len=1460","1514","0.000000000","10.22.1.2","0.000002000","TCP"
"621","47.302232","10.176890000","0.000001000","0.000001000","10.1.1.2","0.000001000","53639  >  12003 [ACK] Seq=111945 Ack=25435 Win=65700 Len=1460","1514","0.000000000","10.22.1.2","0.000001000","TCP"
