"No.","Time","Time since first frame in this TCP stream","segment delta","Time delta from previous captured frame","Destination","Delta Time (conv)","Info","Length","Time shift for this packet","Source","Time delta from previous captured frame","Protocol"
"5","9.267033","0.000000000","0.000000000","4.735021000","10.1.1.2","0.000000000","53626  >  12000 [PSH, ACK] Seq=1 Ack=1 Win=251 Len=134","188","0.000000000","10.22.1.2","4.735021000","TCP"
"7","9.944608","0.677575000","0.604007000","0.604007000","10.1.1.2","0.604007000","53626  >  12000 [ACK] Seq=135 Ack=83 Win=251 Len=0","60","0.000000000","10.22.1.2","0.604007000","TCP"
"9","10.547634","1.280601000","0.602972000","0.602972000","10.1.1.2","0.602972000","53626  >  12000 [ACK] Seq=135 Ack=217 Win=250 Len=0","60","0.000000000","10.22.1.2","0.602972000","TCP"
"10","10.579583","1.312550000","0.031949000","0.031949000","10.1.1.2","0.031949000","53626  >  12000 [PSH, ACK] Seq=135 Ack=217 Win=250 Len=74","128","0.000000000","10.22.1.2","0.031949000","TCP"
"12","11.174618","1.907585000","0.403544000","0.403544000","10.1.1.2","0.403544000","53626  >  12000 [PSH, ACK] Seq=209 Ack=1677 Win=245 Len=158","212","0.000000000","10.22.1.2","0.403544000","TCP"
"14","11.183936","1.916903000","0.009250000","0.009250000","10.1.1.2","0.009250000","53626  >  12000 [ACK] Seq=367 Ack=4597 Win=233 Len=0","60","0.000000000","10.22.1.2","0.009250000","TCP"
"16","11.195905","1.928872000","0.011930000","0.011930000","10.1.1.2","0.011930000","53626  >  12000 [ACK] Seq=367 Ack=7517 Win=222 Len=0","60","0.000000000","10.22.1.2","0.011930000","TCP"
"17","11.588618","2.321585000","0.392713000","0.392713000","10.1.1.2","0.392713000","53626  >  12000 [ACK] Seq=367 Ack=11607 Win=206 Len=0","60","0.000000000","10.22.1.2","0.392713000","TCP"
"19","11.997281","2.730248000","0.408607000","0.408607000","10.1.1.2","0.408607000","53626  >  12000 [PSH, ACK] Seq=367 Ack=11745 Win=205 Len=50","104","0.000000000","10.22.1.2","0.408607000","TCP"
"21","12.435251","3.168218000","0.416385000","0.416385000","10.1.1.2","0.416385000","53626  >  12000 [PSH, ACK] Seq=417 Ack=12375 Win=203 Len=68","122","0.000000000","10.22.1.2","0.416385000","TCP"
"23","12.843920","3.576887000","0.402636000","0.402636000","10.1.1.2","0.402636000","53626  >  12000 [PSH, ACK] Seq=485 Ack=12516 Win=202 Len=50","104","0.000000000","10.22.1.2","0.402636000","TCP"
"25","13.268571","4.001538000","0.407320000","0.407320000","10.1.1.2","0.407320000","53626  >  12000 [PSH, ACK] Seq=535 Ack=13120 Win=200 Len=50","104","0.000000000","10.22.1.2","0.407320000","TCP"
"27","13.682572","4.415539000","0.403922000","0.403922000","10.1.1.2","0.403922000","53626  >  12000 [PSH, ACK] Seq=585 Ack=13834 Win=197 Len=68","122","0.000000000","10.22.1.2","0.403922000","TCP"
"29","14.101886","4.834853000","0.415121000","0.415121000","10.1.1.2","0.415121000","53626  >  12000 [PSH, ACK] Seq=653 Ack=13883 Win=197 Len=68","122","0.000000000","10.22.1.2","0.415121000","TCP"
"33","14.518552","5.251519000","0.412820000","0.251566000","10.1.1.2","0.412820000","53626  >  12000 [PSH, ACK] Seq=721 Ack=13932 Win=197 Len=68","122","0.000000000","10.22.1.2","0.251566000","TCP"
"35","14.980467","5.713434000","0.427577000","0.427577000","10.1.1.2","0.427577000","53626  >  12000 [PSH, ACK] Seq=789 Ack=13981 Win=197 Len=68","122","0.000000000","10.22.1.2","0.427577000","TCP"
"37","15.417099","6.150066000","0.402408000","0.402408000","10.1.1.2","0.402408000","53626  >  12000 [PSH, ACK] Seq=857 Ack=14030 Win=196 Len=68","122","0.000000000","10.22.1.2","0.402408000","TCP"
"39","15.836422","6.569389000","0.412963000","0.412963000","10.1.1.2","0.412963000","53626  >  12000 [PSH, ACK] Seq=925 Ack=14217 Win=196 Len=50","104","0.000000000","10.22.1.2","0.412963000","TCP"
"41","16.455419","7.188386000","0.608089000","0.608089000","10.1.1.2","0.608089000","53626  >  12000 [ACK] Seq=975 Ack=14931 Win=193 Len=0","60","0.000000000","10.22.1.2","0.608089000","TCP"
"42","16.892049","0.000000000","0.000000000","0.436630000","10.1.1.2","0.000000000","53622  >  8800 [PSH, ACK] Seq=1 Ack=1 Win=16236 Len=187","241","0.000000000","10.22.1.2","0.436630000","TCP"
"47","18.738401","1.846352000","0.381247000","0.380989000","10.1.1.2","0.381247000","53622  >  8800 [ACK] Seq=188 Ack=4381 Win=16425 Len=0","60","0.000000000","10.22.1.2","0.380989000","TCP"
"48","18.742383","0.000000000","0.000000000","0.003982000","10.1.1.2","0.000000000","53627  >  12003 [SYN] Seq=0 Win=8192 Len=0 MSS=1460 WS=4 SACK_PERM=1","66","0.000000000","10.22.1.2","0.003982000","TCP"
"50","18.761428","1.869379000","0.023027000","0.018874000","10.1.1.2","0.023027000","53622  >  8800 [ACK] Seq=188 Ack=8405 Win=16425 Len=0","60","0.000000000","10.22.1.2","0.018874000","TCP"
"53","18.806717","9.539684000","2.351298000","0.041268000","10.1.1.2","2.351298000","53626  >  12000 [PSH, ACK] Seq=975 Ack=14931 Win=193 Len=68","122","0.000000000","10.22.1.2","0.041268000","TCP"
"57","19.150167","0.407784000","0.407613000","0.283432000","10.1.1.2","0.407613000","53627  >  12003 [ACK] Seq=1 Ack=1 Win=65700 Len=0","60","0.000000000","10.22.1.2","0.283432000","TCP"
"58","19.171473","0.429090000","0.021306000","0.021306000","10.1.1.2","0.021306000","53627  >  12003 [PSH, ACK] Seq=1 Ack=1 Win=65700 Len=313","367","0.000000000","10.22.1.2","0.021306000","TCP"
"59","19.220727","9.953694000","0.407696000","0.049254000","10.1.1.2","0.407696000","53626  >  12000 [PSH, ACK] Seq=1043 Ack=15118 Win=192 Len=600","654","0.000000000","10.22.1.2","0.049254000","TCP"
"68","19.726567","10.459534000","0.408454000","0.035477000","10.1.1.2","0.408454000","53626  >  12000 [PSH, ACK] Seq=1643 Ack=15249 Win=192 Len=50","104","0.000000000","10.22.1.2","0.035477000","TCP"
"72","20.105952","1.363569000","0.414862000","0.001330000","10.1.1.2","0.414862000","53627  >  12003 [PSH, ACK] Seq=314 Ack=933 Win=64768 Len=126","180","0.000000000","10.22.1.2","0.001330000","TCP"
"75","20.338922","11.071889000","0.612298000","0.221847000","10.1.1.2","0.612298000","53626  >  12000 [ACK] Seq=1693 Ack=16189 Win=188 Len=0","60","0.000000000","10.22.1.2","0.221847000","TCP"
"81","20.529270","0.000000000","0.000000000","0.007719000","10.1.1.2","0.000000000","53628  >  12001 [SYN] Seq=0 Win=8192 Len=0 MSS=1460 WS=4 SACK_PERM=1","66","0.000000000","10.22.1.2","0.007719000","TCP"
"82","20.529272","0.000000000","0.000000000","0.000002000","10.1.1.2","0.000000000","53629  >  12002 [SYN] Seq=0 Win=8192 Len=0 MSS=1460 WS=4 SACK_PERM=1","66","0.000000000","10.22.1.2","0.000002000","TCP"
"85","20.715635","1.973252000","0.598560000","0.186282000","10.1.1.2","0.598560000","53627  >  12003 [ACK] Seq=440 Ack=1259 Win=64440 Len=0","60","0.000000000","10.22.1.2","0.186282000","TCP"
"88","20.936622","0.407352000","0.407302000","0.010658000","10.1.1.2","0.407302000","53628  >  12001 [ACK] Seq=1 Ack=1 Win=65700 Len=0","60","0.000000000","10.22.1.2","0.010658000","TCP"
"89","20.937947","0.408675000","0.408594000","0.001325000","10.1.1.2","0.408594000","53629  >  12002 [ACK] Seq=1 Ack=1 Win=65700 Len=0","60","0.000000000","10.22.1.2","0.001325000","TCP"
"90","20.940608","11.673575000","0.601627000","0.002661000","10.1.1.2","0.601627000","53626  >  12000 [ACK] Seq=1693 Ack=16903 Win=185 Len=0","60","0.000000000","10.22.1.2","0.002661000","TCP"
"93","20.967232","0.437962000","0.030610000","0.021303000","10.1.1.2","0.030610000","53628  >  12001 [PSH, ACK] Seq=1 Ack=1 Win=65700 Len=313","367","0.000000000","10.22.1.2","0.021303000","TCP"
"94","20.967234","0.437962000","0.029287000","0.000002000","10.1.1.2","0.029287000","53629  >  12002 [PSH, ACK] Seq=1 Ack=1 Win=65700 Len=313","367","0.000000000","10.22.1.2","0.000002000","TCP"
"102","21.061751","2.319368000","0.346116000","0.031908000","10.1.1.2","0.346116000","53627  >  12003 [ACK] Seq=440 Ack=1259 Win=64440 Len=1460","1514","0.000000000","10.22.1.2","0.031908000","TCP"
"103","21.063073","2.320690000","0.001322000","0.001322000","10.1.1.2","0.001322000","53627  >  12003 [ACK] Seq=1900 Ack=1259 Win=64440 Len=1460","1514","0.000000000","10.22.1.2","0.001322000","TCP"
"114","21.441127","0.911857000","0.426891000","0.005292000","10.1.1.2","0.426891000","53628  >  12001 [PSH, ACK] Seq=314 Ack=933 Win=64768 Len=126","180","0.000000000","10.22.1.2","0.005292000","TCP"
"115","21.441129","0.911857000","0.419961000","0.000002000","10.1.1.2","0.419961000","53629  >  12002 [PSH, ACK] Seq=314 Ack=933 Win=64768 Len=126","180","0.000000000","10.22.1.2","0.000002000","TCP"
"118","21.469086","2.726703000","0.405982000","0.015880000","10.1.1.2","0.405982000","53627  >  12003 [ACK] Seq=3360 Ack=1259 Win=64440 Len=1460","1514","0.000000000","10.22.1.2","0.015880000","TCP"
"119","21.469090","2.726707000","0.000004000","0.000004000","10.1.1.2","0.000004000","53627  >  12003 [ACK] Seq=4820 Ack=1259 Win=64440 Len=1460","1514","0.000000000","10.22.1.2","0.000004000","TCP"
"120","21.469092","2.726709000","0.000002000","0.000002000","10.1.1.2","0.000002000","53627  >  12003 [ACK] Seq=6280 Ack=1259 Win=64440 Len=1460","1514","0.000000000","10.22.1.2","0.000002000","TCP"
"121","21.469093","2.726710000","0.000001000","0.000001000","10.1.1.2","0.000001000","53627  >  12003 [ACK] Seq=7740 Ack=1259 Win=64440 Len=1460","1514","0.000000000","10.22.1.2","0.000001000","TCP"
"123","21.860463","1.331191000","0.407257000","0.391336000","10.1.1.2","0.407257000","53629  >  12002 [PSH, ACK] Seq=440 Ack=1219 Win=64480 Len=575","629","0.000000000","10.22.1.2","0.391336000","TCP"
"127","21.873768","3.131385000","0.404641000","0.003937000","10.1.1.2","0.404641000","53627  >  12003 [ACK] Seq=9200 Ack=1259 Win=64440 Len=1460","1514","0.000000000","10.22.1.2","0.003937000","TCP"
"128","21.873771","3.131388000","0.000003000","0.000003000","10.1.1.2","0.000003000","53627  >  12003 [PSH, ACK] Seq=10660 Ack=1259 Win=64440 Len=1131","1185","0.000000000","10.22.1.2","0.000003000","TCP"
"132","21.929676","1.400406000","0.482090000","0.011758000","10.1.1.2","0.482090000","53628  >  12001 [PSH, ACK] Seq=440 Ack=1219 Win=64480 Len=172","226","0.000000000","10.22.1.2","0.011758000","TCP"
"146","22.327696","3.585313000","0.415421000","0.003952000","10.1.1.2","0.415421000","53627  >  12003 [ACK] Seq=11791 Ack=4179 Win=65700 Len=0","60","0.000000000","10.22.1.2","0.003952000","TCP"
"155","22.693777","5.801728000","0.602951000","0.066471000","10.1.1.2","0.602951000","53622  >  8800 [ACK] Seq=188 Ack=8465 Win=16410 Len=0","60","0.000000000","10.22.1.2","0.066471000","TCP"
"158","22.739031","3.996648000","0.411300000","0.009287000","10.1.1.2","0.411300000","53627  >  12003 [ACK] Seq=11791 Ack=10019 Win=65700 Len=0","60","0.000000000","10.22.1.2","0.009287000","TCP"
"166","23.143709","4.401326000","0.404657000","0.007983000","10.1.1.2","0.404657000","53627  >  12003 [ACK] Seq=11791 Ack=12585 Win=65700 Len=0","60","0.000000000","10.22.1.2","0.007983000","TCP"
"171","23.212932","4.470549000","0.069223000","0.006608000","10.1.1.2","0.069223000","53627  >  12003 [PSH, ACK] Seq=11791 Ack=12585 Win=65700 Len=106","160","0.000000000","10.22.1.2","0.006608000","TCP"
"199","23.790666","5.048283000","0.003339000","0.002331000","10.1.1.2","0.003339000","53627  >  12003 [PSH, ACK] Seq=11897 Ack=12585 Win=65700 Len=1460","1514","0.000000000","10.22.1.2","0.002331000","TCP"
"200","23.791997","5.049614000","0.001331000","0.001331000","10.1.1.2","0.001331000","53627  >  12003 [ACK] Seq=13357 Ack=12585 Win=65700 Len=1460","1514","0.000000000","10.22.1.2","0.001331000","TCP"
"201","23.791999","5.049616000","0.000002000","0.000002000","10.1.1.2","0.000002000","53627  >  12003 [ACK] Seq=14817 Ack=12585 Win=65700 Len=1460","1514","0.000000000","10.22.1.2","0.000002000","TCP"
"203","23.794658","5.052275000","0.002638000","0.002638000","10.1.1.2","0.002638000","53627  >  12003 [ACK] Seq=16277 Ack=12585 Win=65700 Len=1460","1514","0.000000000","10.22.1.2","0.002638000","TCP"
"204","23.794659","5.052276000","0.000001000","0.000001000","10.1.1.2","0.000001000","53627  >  12003 [ACK] Seq=17737 Ack=12585 Win=65700 Len=1460","1514","0.000000000","10.22.1.2","0.000001000","TCP"
"206","23.795992","5.053609000","0.001314000","0.001314000","10.1.1.2","0.001314000","53627  >  12003 [ACK] Seq=19197 Ack=12585 Win=65700 Len=1460","1514","0.000000000","10.22.1.2","0.001314000","TCP"
"207","23.795995","5.053612000","0.000003000","0.000003000","10.1.1.2","0.000003000","53627  >  12003 [ACK] Seq=20657 Ack=12585 Win=65700 Len=1460","1514","0.000000000","10.22.1.2","0.000003000","TCP"
"208","23.795996","5.053613000","0.000001000","0.000001000","10.1.1.2","0.000001000","53627  >  12003 [ACK] Seq=22117 Ack=12585 Win=65700 Len=1460","1514","0.000000000","10.22.1.2","0.000001000","TCP"
"209","23.795998","5.053615000","0.000002000","0.000002000","10.1.1.2","0.000002000","53627  >  12003 [ACK] Seq=23577 Ack=12585 Win=65700 Len=1460","1514","0.000000000","10.22.1.2","0.000002000","TCP"
"210","23.795999","5.053616000","0.000001000","0.000001000","10.1.1.2","0.000001000","53627  >  12003 [PSH, ACK] Seq=25037 Ack=12585 Win=65700 Len=857","911","0.000000000","10.22.1.2","0.000001000","TCP"
"224","24.192682","5.450299000","0.396663000","0.002663000","10.1.1.2","0.396663000","53627  >  12003 [ACK] Seq=25894 Ack=20006 Win=65700 Len=0","60","0.000000000","10.22.1.2","0.002663000","TCP"
"225","24.198006","5.455623000","0.005324000","0.005324000","10.1.1.2","0.005324000","53627  >  12003 [ACK] Seq=25894 Ack=22926 Win=65700 Len=0","60","0.000000000","10.22.1.2","0.005324000","TCP"
"226","24.202002","5.459619000","0.003996000","0.003996000","10.1.1.2","0.003996000","53627  >  12003 [ACK] Seq=25894 Ack=25846 Win=65700 Len=0","60","0.000000000","10.22.1.2","0.003996000","TCP"
"227","24.202003","5.459620000","0.000001000","0.000001000","10.1.1.2","0.000001000","53627  >  12003 [PSH, ACK] Seq=25894 Ack=26546 Win=65000 Len=121","175","0.000000000","10.22.1.2","0.000001000","TCP"
"233","24.227292","3.698022000","0.410429000","0.003991000","10.1.1.2","0.410429000","53628  >  12001 [PSH, ACK] Seq=612 Ack=1391 Win=64308 Len=364","418","0.000000000","10.22.1.2","0.003991000","TCP"
"237","24.268562","3.739292000","0.024642000","0.024642000","10.1.1.2","0.024642000","53628  >  12001 [ACK] Seq=976 Ack=1391 Win=64308 Len=1460","1514","0.000000000","10.22.1.2","0.024642000","TCP"
"238","24.268564","3.739294000","0.000002000","0.000002000","10.1.1.2","0.000002000","53628  >  12001 [ACK] Seq=2436 Ack=1391 Win=64308 Len=1460","1514","0.000000000","10.22.1.2","0.000002000","TCP"
"247","24.395042","3.865770000","0.043110000","0.023979000","10.1.1.2","0.043110000","53629  >  12002 [ACK] Seq=1015 Ack=2855 Win=65700 Len=0","60","0.000000000","10.22.1.2","0.023979000","TCP"
"252","24.586715","4.057443000","0.025715000","0.025715000","10.1.1.2","0.025715000","53629  >  12002 [ACK] Seq=1015 Ack=4563 Win=65700 Len=0","60","0.000000000","10.22.1.2","0.025715000","TCP"
"254","24.625317","5.882934000","0.403689000","0.038558000","10.1.1.2","0.403689000","53627  >  12003 [PSH, ACK] Seq=26015 Ack=26667 Win=64876 Len=121","175","0.000000000","10.22.1.2","0.038558000","TCP"
"261","24.647947","4.118677000","0.379354000","0.017606000","10.1.1.2","0.379354000","53628  >  12001 [PSH, ACK] Seq=3896 Ack=1733 Win=65700 Len=975","1029","0.000000000","10.22.1.2","0.017606000","TCP"
"263","24.671912","4.142642000","0.023965000","0.022962000","10.1.1.2","0.023965000","53628  >  12001 [PSH, ACK] Seq=4871 Ack=1733 Win=65700 Len=1460","1514","0.000000000","10.22.1.2","0.022962000","TCP"
"264","24.671915","4.142645000","0.000003000","0.000003000","10.1.1.2","0.000003000","53628  >  12001 [ACK] Seq=6331 Ack=1733 Win=65700 Len=1460","1514","0.000000000","10.22.1.2","0.000003000","TCP"
"265","24.671917","4.142647000","0.000002000","0.000002000","10.1.1.2","0.000002000","53628  >  12001 [PSH, ACK] Seq=7791 Ack=1733 Win=65700 Len=1460","1514","0.000000000","10.22.1.2","0.000002000","TCP"
"267","24.673241","4.143971000","0.001295000","0.001295000","10.1.1.2","0.001295000","53628  >  12001 [ACK] Seq=9251 Ack=1733 Win=65700 Len=1460","1514","0.000000000","10.22.1.2","0.001295000","TCP"
"277","24.799702","4.270430000","0.029776000","0.023962000","10.1.1.2","0.029776000","53629  >  12002 [ACK] Seq=1015 Ack=6499 Win=65700 Len=0","60","0.000000000","10.22.1.2","0.023962000","TCP"
"282","24.979419","4.450147000","0.019051000","0.019051000","10.1.1.2","0.019051000","53629  >  12002 [ACK] Seq=1015 Ack=8083 Win=65700 Len=0","60","0.000000000","10.22.1.2","0.019051000","TCP"
"288","25.036654","6.294271000","0.406313000","0.002663000","10.1.1.2","0.406313000","53627  >  12003 [PSH, ACK] Seq=26136 Ack=27261 Win=64284 Len=714","768","0.000000000","10.22.1.2","0.002663000","TCP"
"293","25.077937","4.548667000","0.390373000","0.022606000","10.1.1.2","0.390373000","53628  >  12001 [ACK] Seq=10711 Ack=1733 Win=65700 Len=1460","1514","0.000000000","10.22.1.2","0.022606000","TCP"
"294","25.077940","4.548670000","0.000003000","0.000003000","10.1.1.2","0.000003000","53628  >  12001 [ACK] Seq=12171 Ack=1733 Win=65700 Len=1460","1514","0.000000000","10.22.1.2","0.000003000","TCP"
"295","25.077945","4.548675000","0.000005000","0.000005000","10.1.1.2","0.000005000","53628  >  12001 [ACK] Seq=13631 Ack=1733 Win=65700 Len=1460","1514","0.000000000","10.22.1.2","0.000005000","TCP"
"296","25.077946","4.548676000","0.000001000","0.000001000","10.1.1.2","0.000001000","53628  >  12001 [ACK] Seq=15091 Ack=1733 Win=65700 Len=1460","1514","0.000000000","10.22.1.2","0.000001000","TCP"
"297","25.077948","4.548678000","0.000002000","0.000002000","10.1.1.2","0.000002000","53628  >  12001 [ACK] Seq=16551 Ack=1733 Win=65700 Len=1460","1514","0.000000000","10.22.1.2","0.000002000","TCP"
"298","25.077950","4.548680000","0.000002000","0.000002000","10.1.1.2","0.000002000","53628  >  12001 [ACK] Seq=18011 Ack=1733 Win=65700 Len=1460","1514","0.000000000","10.22.1.2","0.000002000","TCP"
"299","25.077951","4.548681000","0.000001000","0.000001000","10.1.1.2","0.000001000","53628  >  12001 [ACK] Seq=19471 Ack=1733 Win=65700 Len=1460","1514","0.000000000","10.22.1.2","0.000001000","TCP"
"302","25.092560","4.563290000","0.014456000","0.014456000","10.1.1.2","0.014456000","53628  >  12001 [PSH, ACK] Seq=20931 Ack=3193 Win=65700 Len=1460","1514","0.000000000","10.22.1.2","0.014456000","TCP"
"303","25.092562","4.563292000","0.000002000","0.000002000","10.1.1.2","0.000002000","53628  >  12001 [ACK] Seq=22391 Ack=3193 Win=65700 Len=1460","1514","0.000000000","10.22.1.2","0.000002000","TCP"
"306","25.093892","4.564622000","0.001302000","0.000113000","10.1.1.2","0.001302000","53628  >  12001 [ACK] Seq=23851 Ack=5755 Win=65700 Len=0","60","0.000000000","10.22.1.2","0.000113000","TCP"
"320","25.173764","4.644492000","0.004150000","0.004150000","10.1.1.2","0.004150000","53629  >  12002 [ACK] Seq=1015 Ack=9719 Win=65700 Len=0","60","0.000000000","10.22.1.2","0.004150000","TCP"
"321","25.205713","4.676441000","0.031949000","0.031949000","10.1.1.2","0.031949000","53629  >  12002 [ACK] Seq=1015 Ack=10019 Win=65400 Len=0","60","0.000000000","10.22.1.2","0.031949000","TCP"
"328","25.378768","4.849496000","0.000270000","0.000270000","10.1.1.2","0.000270000","53629  >  12002 [ACK] Seq=1015 Ack=11603 Win=65700 Len=0","60","0.000000000","10.22.1.2","0.000270000","TCP"
"333","25.445326","6.702943000","0.408631000","0.003962000","10.1.1.2","0.408631000","53627  >  12003 [PSH, ACK] Seq=26850 Ack=27382 Win=65700 Len=593","647","0.000000000","10.22.1.2","0.003962000","TCP"
"337","25.485267","4.955997000","0.388041000","0.023932000","10.1.1.2","0.388041000","53628  >  12001 [ACK] Seq=23851 Ack=5755 Win=65700 Len=1460","1514","0.000000000","10.22.1.2","0.023932000","TCP"
"338","25.485269","4.955999000","0.000002000","0.000002000","10.1.1.2","0.000002000","53628  >  12001 [ACK] Seq=25311 Ack=5755 Win=65700 Len=1460","1514","0.000000000","10.22.1.2","0.000002000","TCP"
"339","25.485271","4.956001000","0.000002000","0.000002000","10.1.1.2","0.000002000","53628  >  12001 [ACK] Seq=26771 Ack=5755 Win=65700 Len=1460","1514","0.000000000","10.22.1.2","0.000002000","TCP"
"340","25.485272","4.956002000","0.000001000","0.000001000","10.1.1.2","0.000001000","53628  >  12001 [ACK] Seq=28231 Ack=5755 Win=65700 Len=1460","1514","0.000000000","10.22.1.2","0.000001000","TCP"
"341","25.485274","4.956004000","0.000002000","0.000002000","10.1.1.2","0.000002000","53628  >  12001 [ACK] Seq=29691 Ack=5755 Win=65700 Len=1460","1514","0.000000000","10.22.1.2","0.000002000","TCP"
"343","25.486595","4.957325000","0.001283000","0.001283000","10.1.1.2","0.001283000","53628  >  12001 [ACK] Seq=31151 Ack=5755 Win=65700 Len=1460","1514","0.000000000","10.22.1.2","0.001283000","TCP"
"344","25.486597","4.957327000","0.000002000","0.000002000","10.1.1.2","0.000002000","53628  >  12001 [ACK] Seq=32611 Ack=5755 Win=65700 Len=1460","1514","0.000000000","10.22.1.2","0.000002000","TCP"
"345","25.486599","4.957329000","0.000002000","0.000002000","10.1.1.2","0.000002000","53628  >  12001 [ACK] Seq=34071 Ack=5755 Win=65700 Len=1460","1514","0.000000000","10.22.1.2","0.000002000","TCP"
"347","25.487925","4.958655000","0.001295000","0.001295000","10.1.1.2","0.001295000","53628  >  12001 [ACK] Seq=35531 Ack=5755 Win=65700 Len=1460","1514","0.000000000","10.22.1.2","0.001295000","TCP"
"348","25.487928","4.958658000","0.000003000","0.000003000","10.1.1.2","0.000003000","53628  >  12001 [ACK] Seq=36991 Ack=5755 Win=65700 Len=1460","1514","0.000000000","10.22.1.2","0.000003000","TCP"
"350","25.489255","4.959985000","0.001299000","0.001299000","10.1.1.2","0.001299000","53628  >  12001 [ACK] Seq=38451 Ack=5755 Win=65700 Len=1460","1514","0.000000000","10.22.1.2","0.001299000","TCP"
"351","25.499905","4.970635000","0.010650000","0.010650000","10.1.1.2","0.010650000","53628  >  12001 [ACK] Seq=39911 Ack=8675 Win=65700 Len=1460","1514","0.000000000","10.22.1.2","0.010650000","TCP"
"370","25.514550","4.985280000","0.003778000","0.003778000","10.1.1.2","0.003778000","53628  >  12001 [ACK] Seq=41371 Ack=8675 Win=65700 Len=1460","1514","0.000000000","10.22.1.2","0.003778000","TCP"
"371","25.514554","4.985284000","0.000004000","0.000004000","10.1.1.2","0.000004000","53628  >  12001 [ACK] Seq=42831 Ack=8675 Win=65700 Len=1460","1514","0.000000000","10.22.1.2","0.000004000","TCP"
"372","25.514556","4.985286000","0.000002000","0.000002000","10.1.1.2","0.000002000","53628  >  12001 [ACK] Seq=44291 Ack=8675 Win=65700 Len=1460","1514","0.000000000","10.22.1.2","0.000002000","TCP"
"373","25.514558","4.985288000","0.000002000","0.000002000","10.1.1.2","0.000002000","53628  >  12001 [ACK] Seq=45751 Ack=11375 Win=65700 Len=0","60","0.000000000","10.22.1.2","0.000002000","TCP"
"376","25.575783","5.046511000","0.026504000","0.026504000","10.1.1.2","0.026504000","53629  >  12002 [ACK] Seq=1015 Ack=13363 Win=65700 Len=0","60","0.000000000","10.22.1.2","0.026504000","TCP"
"381","25.707583","5.178313000","0.192981000","0.099787000","10.1.1.2","0.192981000","53628  >  12001 [ACK] Seq=45751 Ack=12436 Win=64636 Len=0","60","0.000000000","10.22.1.2","0.099787000","TCP"
"384","25.784779","5.255507000","0.026531000","0.026531000","10.1.1.2","0.026531000","53629  >  12002 [ACK] Seq=1015 Ack=15123 Win=65700 Len=0","60","0.000000000","10.22.1.2","0.026531000","TCP"
"390","25.855330","7.112947000","0.409973000","0.014642000","10.1.1.2","0.409973000","53627  >  12003 [PSH, ACK] Seq=27443 Ack=28097 Win=64984 Len=593","647","0.000000000","10.22.1.2","0.014642000","TCP"
"395","25.889942","5.360672000","0.182303000","0.016343000","10.1.1.2","0.182303000","53628  >  12001 [ACK] Seq=45751 Ack=12850 Win=65700 Len=1460","1514","0.000000000","10.22.1.2","0.016343000","TCP"
"396","25.889945","5.360675000","0.000003000","0.000003000","10.1.1.2","0.000003000","53628  >  12001 [ACK] Seq=47211 Ack=12850 Win=65700 Len=1460","1514","0.000000000","10.22.1.2","0.000003000","TCP"
"398","25.891277","5.362007000","0.001295000","0.001295000","10.1.1.2","0.001295000","53628  >  12001 [ACK] Seq=48671 Ack=12850 Win=65700 Len=1460","1514","0.000000000","10.22.1.2","0.001295000","TCP"
"399","25.891280","5.362010000","0.000003000","0.000003000","10.1.1.2","0.000003000","53628  >  12001 [ACK] Seq=50131 Ack=12850 Win=65700 Len=1460","1514","0.000000000","10.22.1.2","0.000003000","TCP"
"400","25.891281","5.362011000","0.000001000","0.000001000","10.1.1.2","0.000001000","53628  >  12001 [ACK] Seq=51591 Ack=12850 Win=65700 Len=1460","1514","0.000000000","10.22.1.2","0.000001000","TCP"
"401","25.891283","5.362013000","0.000002000","0.000002000","10.1.1.2","0.000002000","53628  >  12001 [ACK] Seq=53051 Ack=12850 Win=65700 Len=1460","1514","0.000000000","10.22.1.2","0.000002000","TCP"
"402","25.891284","5.362014000","0.000001000","0.000001000","10.1.1.2","0.000001000","53628  >  12001 [ACK] Seq=54511 Ack=12850 Win=65700 Len=1460","1514","0.000000000","10.22.1.2","0.000001000","TCP"
"404","25.892603","5.363333000","0.001285000","0.001285000","10.1.1.2","0.001285000","53628  >  12001 [ACK] Seq=55971 Ack=12850 Win=65700 Len=1460","1514","0.000000000","10.22.1.2","0.001285000","TCP"
"405","25.892606","5.363336000","0.000003000","0.000003000","10.1.1.2","0.000003000","53628  >  12001 [ACK] Seq=57431 Ack=12850 Win=65700 Len=1460","1514","0.000000000","10.22.1.2","0.000003000","TCP"
"407","25.897930","5.368660000","0.005301000","0.005301000","10.1.1.2","0.005301000","53628  >  12001 [ACK] Seq=58891 Ack=12850 Win=65700 Len=1460","1514","0.000000000","10.22.1.2","0.005301000","TCP"
"408","25.897932","5.368662000","0.000002000","0.000002000","10.1.1.2","0.000002000","53628  >  12001 [ACK] Seq=60351 Ack=12850 Win=65700 Len=1460","1514","0.000000000","10.22.1.2","0.000002000","TCP"
"410","25.899262","5.369992000","0.001300000","0.001300000","10.1.1.2","0.001300000","53628  >  12001 [PSH, ACK] Seq=61811 Ack=12850 Win=65700 Len=1460","1514","0.000000000","10.22.1.2","0.001300000","TCP"
"411","25.899264","5.369994000","0.000002000","0.000002000","10.1.1.2","0.000002000","53628  >  12001 [ACK] Seq=63271 Ack=12850 Win=65700 Len=1460","1514","0.000000000","10.22.1.2","0.000002000","TCP"
"412","25.899266","5.369996000","0.000002000","0.000002000","10.1.1.2","0.000002000","53628  >  12001 [ACK] Seq=64731 Ack=12850 Win=65700 Len=1460","1514","0.000000000","10.22.1.2","0.000002000","TCP"
"413","25.899268","5.369998000","0.000002000","0.000002000","10.1.1.2","0.000002000","53628  >  12001 [ACK] Seq=66191 Ack=12850 Win=65700 Len=1460","1514","0.000000000","10.22.1.2","0.000002000","TCP"
"415","25.905922","5.376652000","0.006621000","0.006621000","10.1.1.2","0.006621000","53628  >  12001 [ACK] Seq=67651 Ack=12850 Win=65700 Len=1460","1514","0.000000000","10.22.1.2","0.006621000","TCP"
"416","25.905924","5.376654000","0.000002000","0.000002000","10.1.1.2","0.000002000","53628  >  12001 [ACK] Seq=69111 Ack=12850 Win=65700 Len=1460","1514","0.000000000","10.22.1.2","0.000002000","TCP"
"417","25.905926","5.376656000","0.000002000","0.000002000","10.1.1.2","0.000002000","53628  >  12001 [ACK] Seq=70571 Ack=12850 Win=65700 Len=1460","1514","0.000000000","10.22.1.2","0.000002000","TCP"
"418","25.905928","5.376658000","0.000002000","0.000002000","10.1.1.2","0.000002000","53628  >  12001 [ACK] Seq=72031 Ack=12850 Win=65700 Len=1460","1514","0.000000000","10.22.1.2","0.000002000","TCP"
"419","25.905930","5.376660000","0.000002000","0.000002000","10.1.1.2","0.000002000","53628  >  12001 [ACK] Seq=73491 Ack=12850 Win=65700 Len=1460","1514","0.000000000","10.22.1.2","0.000002000","TCP"
"420","25.905931","5.376661000","0.000001000","0.000001000","10.1.1.2","0.000001000","53628  >  12001 [ACK] Seq=74951 Ack=12850 Win=65700 Len=1460","1514","0.000000000","10.22.1.2","0.000001000","TCP"
"421","25.905935","5.376665000","0.000004000","0.000004000","10.1.1.2","0.000004000","53628  >  12001 [ACK] Seq=76411 Ack=12850 Win=65700 Len=1460","1514","0.000000000","10.22.1.2","0.000004000","TCP"
"422","25.905936","5.376666000","0.000001000","0.000001000","10.1.1.2","0.000001000","53628  >  12001 [ACK] Seq=77871 Ack=12850 Win=65700 Len=1460","1514","0.000000000","10.22.1.2","0.000001000","TCP"
"438","25.919244","5.389974000","0.013207000","0.000001000","10.1.1.2","0.013207000","53628  >  12001 [ACK] Seq=79331 Ack=15770 Win=65700 Len=0","60","0.000000000","10.22.1.2","0.000001000","TCP"
"455","25.924553","5.395283000","0.005243000","0.001221000","10.1.1.2","0.005243000","53628  >  12001 [ACK] Seq=79331 Ack=18690 Win=65700 Len=0","60","0.000000000","10.22.1.2","0.001221000","TCP"
"457","25.931210","5.401940000","0.006629000","0.006629000","10.1.1.2","0.006629000","53628  >  12001 [ACK] Seq=79331 Ack=21610 Win=65700 Len=1460","1514","0.000000000","10.22.1.2","0.006629000","TCP"
"458","25.931212","5.401942000","0.000002000","0.000002000","10.1.1.2","0.000002000","53628  >  12001 [ACK] Seq=80791 Ack=21610 Win=65700 Len=1460","1514","0.000000000","10.22.1.2","0.000002000","TCP"
"459","25.931214","5.401944000","0.000002000","0.000002000","10.1.1.2","0.000002000","53628  >  12001 [ACK] Seq=82251 Ack=21610 Win=65700 Len=1460","1514","0.000000000","10.22.1.2","0.000002000","TCP"
"461","25.932539","5.403269000","0.001290000","0.001290000","10.1.1.2","0.001290000","53628  >  12001 [ACK] Seq=83711 Ack=21610 Win=65700 Len=1460","1514","0.000000000","10.22.1.2","0.001290000","TCP"
"462","25.932542","5.403272000","0.000003000","0.000003000","10.1.1.2","0.000003000","53628  >  12001 [ACK] Seq=85171 Ack=21610 Win=65700 Len=1460","1514","0.000000000","10.22.1.2","0.000003000","TCP"
"463","25.932545","5.403275000","0.000003000","0.000003000","10.1.1.2","0.000003000","53628  >  12001 [ACK] Seq=86631 Ack=21610 Win=65700 Len=1460","1514","0.000000000","10.22.1.2","0.000003000","TCP"
"465","25.936531","5.407261000","0.003960000","0.003960000","10.1.1.2","0.003960000","53628  >  12001 [ACK] Seq=88091 Ack=24530 Win=65700 Len=0","60","0.000000000","10.22.1.2","0.003960000","TCP"
"467","25.953836","5.424564000","0.005126000","0.005126000","10.1.1.2","0.005126000","53629  >  12002 [ACK] Seq=1015 Ack=16707 Win=65700 Len=0","60","0.000000000","10.22.1.2","0.005126000","TCP"
"471","26.116246","5.586976000","0.179715000","0.109130000","10.1.1.2","0.179715000","53628  >  12001 [ACK] Seq=88091 Ack=27450 Win=65700 Len=0","60","0.000000000","10.22.1.2","0.109130000","TCP"
"473","26.166826","5.637554000","0.028661000","0.028661000","10.1.1.2","0.028661000","53629  >  12002 [ACK] Seq=1015 Ack=18343 Win=65700 Len=0","60","0.000000000","10.22.1.2","0.028661000","TCP"
"475","26.188129","5.658857000","0.021269000","0.021269000","10.1.1.2","0.021269000","53629  >  12002 [ACK] Seq=1015 Ack=18643 Win=65400 Len=0","60","0.000000000","10.22.1.2","0.021269000","TCP"
"480","26.293304","5.764034000","0.177058000","0.105121000","10.1.1.2","0.177058000","53628  >  12001 [ACK] Seq=88091 Ack=27858 Win=65292 Len=1460","1514","0.000000000","10.22.1.2","0.105121000","TCP"
"482","26.294620","5.765350000","0.001068000","0.001068000","10.1.1.2","0.001068000","53628  >  12001 [ACK] Seq=89551 Ack=27858 Win=65292 Len=1460","1514","0.000000000","10.22.1.2","0.001068000","TCP"
"483","26.296694","5.767424000","0.002074000","0.002074000","10.1.1.2","0.002074000","53628  >  12001 [ACK] Seq=91011 Ack=27858 Win=65292 Len=1460","1514","0.000000000","10.22.1.2","0.002074000","TCP"
"485","26.298068","5.768798000","0.001345000","0.001345000","10.1.1.2","0.001345000","53628  >  12001 [ACK] Seq=92471 Ack=27858 Win=65292 Len=1460","1514","0.000000000","10.22.1.2","0.001345000","TCP"
"486","26.302064","5.772794000","0.003996000","0.003996000","10.1.1.2","0.003996000","53628  >  12001 [ACK] Seq=93931 Ack=27858 Win=65292 Len=1460","1514","0.000000000","10.22.1.2","0.003996000","TCP"
"487","26.302067","5.772797000","0.000003000","0.000003000","10.1.1.2","0.000003000","53628  >  12001 [ACK] Seq=95391 Ack=27858 Win=65292 Len=1460","1514","0.000000000","10.22.1.2","0.000003000","TCP"
"488","26.302068","5.772798000","0.000001000","0.000001000","10.1.1.2","0.000001000","53628  >  12001 [PSH, ACK] Seq=96851 Ack=27858 Win=65292 Len=1274","1328","0.000000000","10.22.1.2","0.000001000","TCP"
"490","26.307386","5.778116000","0.005287000","0.005287000","10.1.1.2","0.005287000","53628  >  12001 [ACK] Seq=98125 Ack=27858 Win=65292 Len=1460","1514","0.000000000","10.22.1.2","0.005287000","TCP"
"491","26.308721","5.779451000","0.001335000","0.001335000","10.1.1.2","0.001335000","53628  >  12001 [ACK] Seq=99585 Ack=27858 Win=65292 Len=1460","1514","0.000000000","10.22.1.2","0.001335000","TCP"
"492","26.308724","5.779454000","0.000003000","0.000003000","10.1.1.2","0.000003000","53628  >  12001 [ACK] Seq=101045 Ack=27858 Win=65292 Len=1460","1514","0.000000000","10.22.1.2","0.000003000","TCP"
"493","26.308726","5.779456000","0.000002000","0.000002000","10.1.1.2","0.000002000","53628  >  12001 [ACK] Seq=102505 Ack=27858 Win=65292 Len=1460","1514","0.000000000","10.22.1.2","0.000002000","TCP"
"494","26.308727","5.779457000","0.000001000","0.000001000","10.1.1.2","0.000001000","53628  >  12001 [ACK] Seq=103965 Ack=27858 Win=65292 Len=1460","1514","0.000000000","10.22.1.2","0.000001000","TCP"
"495","26.308729","5.779459000","0.000002000","0.000002000","10.1.1.2","0.000002000","53628  >  12001 [ACK] Seq=105425 Ack=27858 Win=65292 Len=1460","1514","0.000000000","10.22.1.2","0.000002000","TCP"
"497","26.310057","5.780787000","0.001292000","0.001292000","10.1.1.2","0.001292000","53628  >  12001 [ACK] Seq=106885 Ack=27858 Win=65292 Len=1460","1514","0.000000000","10.22.1.2","0.001292000","TCP"
"498","26.310060","5.780790000","0.000003000","0.000003000","10.1.1.2","0.000003000","53628  >  12001 [ACK] Seq=108345 Ack=27858 Win=65292 Len=1460","1514","0.000000000","10.22.1.2","0.000003000","TCP"
"499","26.310061","5.780791000","0.000001000","0.000001000","10.1.1.2","0.000001000","53628  >  12001 [ACK] Seq=109805 Ack=27858 Win=65292 Len=1460","1514","0.000000000","10.22.1.2","0.000001000","TCP"
"500","26.310063","5.780793000","0.000002000","0.000002000","10.1.1.2","0.000002000","53628  >  12001 [ACK] Seq=111265 Ack=27858 Win=65292 Len=1460","1514","0.000000000","10.22.1.2","0.000002000","TCP"
"501","26.310065","5.780795000","0.000002000","0.000002000","10.1.1.2","0.000002000","53628  >  12001 [ACK] Seq=112725 Ack=27858 Win=65292 Len=1460","1514","0.000000000","10.22.1.2","0.000002000","TCP"
"502","26.310067","5.780797000","0.000002000","0.000002000","10.1.1.2","0.000002000","53628  >  12001 [ACK] Seq=114185 Ack=27858 Win=65292 Len=1460","1514","0.000000000","10.22.1.2","0.000002000","TCP"
"503","26.310070","5.780800000","0.000003000","0.000003000","10.1.1.2","0.000003000","53628  >  12001 [ACK] Seq=115645 Ack=27858 Win=65292 Len=1460","1514","0.000000000","10.22.1.2","0.000003000","TCP"
"504","26.310072","5.780802000","0.000002000","0.000002000","10.1.1.2","0.000002000","53628  >  12001 [ACK] Seq=117105 Ack=27858 Win=65292 Len=1460","1514","0.000000000","10.22.1.2","0.000002000","TCP"
"505","26.310074","5.780804000","0.000002000","0.000002000","10.1.1.2","0.000002000","53628  >  12001 [ACK] Seq=118565 Ack=27858 Win=65292 Len=1460","1514","0.000000000","10.22.1.2","0.000002000","TCP"
"506","26.310075","5.780805000","0.000001000","0.000001000","10.1.1.2","0.000001000","53628  >  12001 [ACK] Seq=120025 Ack=27858 Win=65292 Len=1460","1514","0.000000000","10.22.1.2","0.000001000","TCP"
"509","26.311384","5.782114000","0.001201000","0.001201000","10.1.1.2","0.001201000","53628  >  12001 [ACK] Seq=121485 Ack=27858 Win=65292 Len=1460","1514","0.000000000","10.22.1.2","0.001201000","TCP"
"510","26.311387","5.782117000","0.000003000","0.000003000","10.1.1.2","0.000003000","53628  >  12001 [ACK] Seq=122945 Ack=27858 Win=65292 Len=1460","1514","0.000000000","10.22.1.2","0.000003000","TCP"
"511","26.311388","5.782118000","0.000001000","0.000001000","10.1.1.2","0.000001000","53628  >  12001 [ACK] Seq=124405 Ack=27858 Win=65292 Len=1460","1514","0.000000000","10.22.1.2","0.000001000","TCP"
"512","26.311390","5.782120000","0.000002000","0.000002000","10.1.1.2","0.000002000","53628  >  12001 [ACK] Seq=125865 Ack=27858 Win=65292 Len=1460","1514","0.000000000","10.22.1.2","0.000002000","TCP"
"513","26.311392","5.782122000","0.000002000","0.000002000","10.1.1.2","0.000002000","53628  >  12001 [ACK] Seq=127325 Ack=27858 Win=65292 Len=1460","1514","0.000000000","10.22.1.2","0.000002000","TCP"
"515","26.312710","5.783440000","0.001286000","0.001286000","10.1.1.2","0.001286000","53628  >  12001 [ACK] Seq=128785 Ack=27858 Win=65292 Len=1460","1514","0.000000000","10.22.1.2","0.001286000","TCP"
"516","26.312712","5.783442000","0.000002000","0.000002000","10.1.1.2","0.000002000","53628  >  12001 [ACK] Seq=130245 Ack=27858 Win=65292 Len=1460","1514","0.000000000","10.22.1.2","0.000002000","TCP"
"517","26.312714","5.783444000","0.000002000","0.000002000","10.1.1.2","0.000002000","53628  >  12001 [ACK] Seq=131705 Ack=27858 Win=65292 Len=1460","1514","0.000000000","10.22.1.2","0.000002000","TCP"
"518","26.312715","5.783445000","0.000001000","0.000001000","10.1.1.2","0.000001000","53628  >  12001 [ACK] Seq=133165 Ack=27858 Win=65292 Len=1460","1514","0.000000000","10.22.1.2","0.000001000","TCP"
"520","26.315375","5.786105000","0.002643000","0.002643000","10.1.1.2","0.002643000","53628  >  12001 [ACK] Seq=134625 Ack=27858 Win=65292 Len=1460","1514","0.000000000","10.22.1.2","0.002643000","TCP"
"521","26.315379","5.786109000","0.000004000","0.000004000","10.1.1.2","0.000004000","53628  >  12001 [ACK] Seq=136085 Ack=27858 Win=65292 Len=1460","1514","0.000000000","10.22.1.2","0.000004000","TCP"
"522","26.315381","5.786111000","0.000002000","0.000002000","10.1.1.2","0.000002000","53628  >  12001 [ACK] Seq=137545 Ack=27858 Win=65292 Len=1460","1514","0.000000000","10.22.1.2","0.000002000","TCP"
"523","26.315382","5.786112000","0.000001000","0.000001000","10.1.1.2","0.000001000","53628  >  12001 [ACK] Seq=139005 Ack=27858 Win=65292 Len=1460","1514","0.000000000","10.22.1.2","0.000001000","TCP"
"524","26.315384","5.786114000","0.000002000","0.000002000","10.1.1.2","0.000002000","53628  >  12001 [ACK] Seq=140465 Ack=27858 Win=65292 Len=1460","1514","0.000000000","10.22.1.2","0.000002000","TCP"
"526","26.320698","5.791428000","0.005282000","0.005282000","10.1.1.2","0.005282000","53628  >  12001 [ACK] Seq=141925 Ack=27858 Win=65292 Len=1460","1514","0.000000000","10.22.1.2","0.005282000","TCP"
"527","26.320701","5.791431000","0.000003000","0.000003000","10.1.1.2","0.000003000","53628  >  12001 [ACK] Seq=143385 Ack=27858 Win=65292 Len=1460","1514","0.000000000","10.22.1.2","0.000003000","TCP"
"588","26.336685","5.807415000","0.015957000","0.000002000","10.1.1.2","0.015957000","53628  >  12001 [ACK] Seq=144845 Ack=30778 Win=65700 Len=0","60","0.000000000","10.22.1.2","0.000002000","TCP"
"589","26.336686","5.807416000","0.000001000","0.000001000","10.1.1.2","0.000001000","53628  >  12001 [ACK] Seq=144845 Ack=35008 Win=65700 Len=0","60","0.000000000","10.22.1.2","0.000001000","TCP"
"590","26.336686","5.807416000","0.000000000","0.000000000","10.1.1.2","0.000000000","53628  >  12001 [ACK] Seq=144845 Ack=35008 Win=65700 Len=1460","1514","0.000000000","10.22.1.2","0.000000000","TCP"
"591","26.336688","5.807418000","0.000002000","0.000002000","10.1.1.2","0.000002000","53628  >  12001 [ACK] Seq=146305 Ack=35008 Win=65700 Len=1460","1514","0.000000000","10.22.1.2","0.000002000","TCP"
"592","26.336690","5.807420000","0.000002000","0.000002000","10.1.1.2","0.000002000","53628  >  12001 [ACK] Seq=147765 Ack=35008 Win=65700 Len=1460","1514","0.000000000","10.22.1.2","0.000002000","TCP"
"593","26.336691","5.807421000","0.000001000","0.000001000","10.1.1.2","0.000001000","53628  >  12001 [ACK] Seq=149225 Ack=35008 Win=65700 Len=1460","1514","0.000000000","10.22.1.2","0.000001000","TCP"
"594","26.336695","5.807425000","0.000004000","0.000004000","10.1.1.2","0.000004000","53628  >  12001 [ACK] Seq=150685 Ack=35008 Win=65700 Len=1460","1514","0.000000000","10.22.1.2","0.000004000","TCP"
