"No.","Time","Time since first frame in this TCP stream","segment delta","Time delta from previous captured frame","Destination","Delta Time (conv)","Info","Length","Time shift for this packet","Source","Time delta from previous captured frame","Protocol"
"13","3.338607","0.803885000","0.803885000","0.485890000","10.1.1.2","0.803885000","51351  >  8800 [ACK] Seq=1 Ack=2921 Win=16425 Len=0","60","0.000000000","10.202.1.2","0.485890000","TCP"
"14","3.339925","0.805203000","0.001318000","0.001318000","10.1.1.2","0.001318000","51351  >  8800 [ACK] Seq=1 Ack=5841 Win=16425 Len=0","60","0.000000000","10.202.1.2","0.001318000","TCP"
"17","3.346580","0.811858000","0.006655000","0.001295000","10.1.1.2","0.006655000","51351  >  8800 [ACK] Seq=1 Ack=10221 Win=16425 Len=0","60","0.000000000","10.202.1.2","0.001295000","TCP"
"18","3.547591","1.012869000","0.201011000","0.201011000","10.1.1.2","0.201011000","51351  >  8800 [ACK] Seq=1 Ack=10919 Win=16250 Len=0","60","0.000000000","10.202.1.2","0.201011000","TCP"
"32","5.597624","3.062902000","0.805469000","0.597697000","10.1.1.2","0.805469000","51351  >  8800 [ACK] Seq=1 Ack=14593 Win=16425 Len=0","60","0.000000000","10.202.1.2","0.597697000","TCP"
"104","34.182092","31.647370000","0.806514000","0.026480000","10.1.1.2","0.806514000","51351  >  8800 [ACK] Seq=1 Ack=20433 Win=16425 Len=0","60","0.000000000","10.202.1.2","0.026480000","TCP"
"105","34.183420","31.648698000","0.001328000","0.001328000","10.1.1.2","0.001328000","51351  >  8800 [ACK] Seq=1 Ack=22134 Win=16425 Len=0","60","0.000000000","10.202.1.2","0.001328000","TCP"
"107","34.203388","0.000000000","0.000000000","0.013311000","10.1.1.2","0.000000000","51356  >  12001 [SYN] Seq=0 Win=8192 Len=0 MSS=1460 WS=4 SACK_PERM=1","66","0.000000000","10.202.1.2","0.013311000","TCP"
"113","35.018082","0.814694000","0.814645000","0.039932000","10.1.1.2","0.814645000","51356  >  12001 [ACK] Seq=1 Ack=1 Win=65700 Len=0","60","0.000000000","10.202.1.2","0.039932000","TCP"
"115","35.034075","0.830687000","0.015993000","0.008008000","10.1.1.2","0.015993000","51356  >  12001 [PSH, ACK] Seq=1 Ack=1 Win=65700 Len=313","367","0.000000000","10.202.1.2","0.008008000","TCP"
"124","36.109655","0.999030000","0.999030000","0.227575000","10.1.1.2","0.999030000","51355  >  12000 [ACK] Seq=1 Ack=709 Win=16425 Len=0","60","0.000000000","10.202.1.2","0.227575000","TCP"
"125","36.305336","2.101948000","0.811982000","0.195681000","10.1.1.2","0.811982000","51356  >  12001 [PSH, ACK] Seq=314 Ack=933 Win=64768 Len=126","180","0.000000000","10.202.1.2","0.195681000","TCP"
"135","37.129329","0.000000000","0.000000000","0.003757000","10.1.1.2","0.000000000","51357  >  12003 [SYN] Seq=0 Win=8192 Len=0 MSS=1460 WS=4 SACK_PERM=1","66","0.000000000","10.202.1.2","0.003757000","TCP"
"136","37.129330","0.000000000","0.000000000","0.000001000","10.1.1.2","0.000000000","51358  >  12002 [SYN] Seq=0 Win=8192 Len=0 MSS=1460 WS=4 SACK_PERM=1","66","0.000000000","10.202.1.2","0.000001000","TCP"
"139","37.318357","3.114969000","1.006262000","0.188954000","10.1.1.2","1.006262000","51356  >  12001 [ACK] Seq=440 Ack=1259 Win=64440 Len=0","60","0.000000000","10.202.1.2","0.188954000","TCP"
"144","37.660471","3.457083000","0.342114000","0.006565000","10.1.1.2","0.342114000","51356  >  12001 [ACK] Seq=440 Ack=1259 Win=64440 Len=1460","1514","0.000000000","10.202.1.2","0.006565000","TCP"
"145","37.660472","3.457084000","0.000001000","0.000001000","10.1.1.2","0.000001000","51356  >  12001 [ACK] Seq=1900 Ack=1259 Win=64440 Len=1460","1514","0.000000000","10.202.1.2","0.000001000","TCP"
"149","37.936028","0.806699000","0.806659000","0.003995000","10.1.1.2","0.806659000","51357  >  12003 [ACK] Seq=1 Ack=1 Win=65700 Len=0","60","0.000000000","10.202.1.2","0.003995000","TCP"
"150","37.937360","0.808030000","0.807957000","0.001332000","10.1.1.2","0.807957000","51358  >  12002 [ACK] Seq=1 Ack=1 Win=65700 Len=0","60","0.000000000","10.202.1.2","0.001332000","TCP"
"154","37.961317","0.831988000","0.025289000","0.000001000","10.1.1.2","0.025289000","51357  >  12003 [PSH, ACK] Seq=1 Ack=1 Win=65700 Len=313","367","0.000000000","10.202.1.2","0.000001000","TCP"
"155","37.961317","0.831987000","0.023957000","0.000000000","10.1.1.2","0.023957000","51358  >  12002 [PSH, ACK] Seq=1 Ack=1 Win=65700 Len=313","367","0.000000000","10.202.1.2","0.000000000","TCP"
"165","38.465835","4.262447000","0.805330000","0.002613000","10.1.1.2","0.805330000","51356  >  12001 [ACK] Seq=3360 Ack=1259 Win=64440 Len=1460","1514","0.000000000","10.202.1.2","0.002613000","TCP"
"166","38.465838","4.262450000","0.000003000","0.000003000","10.1.1.2","0.000003000","51356  >  12001 [ACK] Seq=4820 Ack=1259 Win=64440 Len=1460","1514","0.000000000","10.202.1.2","0.000003000","TCP"
"168","38.479148","4.275760000","0.013278000","0.013278000","10.1.1.2","0.013278000","51356  >  12001 [ACK] Seq=6280 Ack=1259 Win=64440 Len=1460","1514","0.000000000","10.202.1.2","0.013278000","TCP"
"169","38.479150","4.275762000","0.000002000","0.000002000","10.1.1.2","0.000002000","51356  >  12001 [ACK] Seq=7740 Ack=1259 Win=64440 Len=1460","1514","0.000000000","10.202.1.2","0.000002000","TCP"
"172","38.793307","1.663977000","0.812913000","0.001328000","10.1.1.2","0.812913000","51358  >  12002 [PSH, ACK] Seq=314 Ack=933 Win=64768 Len=126","180","0.000000000","10.202.1.2","0.001328000","TCP"
"175","38.811942","1.682613000","0.810497000","0.007892000","10.1.1.2","0.810497000","51357  >  12003 [PSH, ACK] Seq=314 Ack=933 Win=64768 Len=126","180","0.000000000","10.202.1.2","0.007892000","TCP"
"184","39.293841","5.090453000","0.814665000","0.026556000","10.1.1.2","0.814665000","51356  >  12001 [ACK] Seq=9200 Ack=1259 Win=64440 Len=1460","1514","0.000000000","10.202.1.2","0.026556000","TCP"
"185","39.293845","5.090457000","0.000004000","0.000004000","10.1.1.2","0.000004000","51356  >  12001 [PSH, ACK] Seq=10660 Ack=1259 Win=64440 Len=1106","1160","0.000000000","10.202.1.2","0.000004000","TCP"
"189","39.609335","2.480005000","0.805285000","0.296941000","10.1.1.2","0.805285000","51358  >  12002 [PSH, ACK] Seq=440 Ack=1219 Win=64480 Len=575","629","0.000000000","10.202.1.2","0.296941000","TCP"
"191","39.686538","2.557209000","0.868374000","0.069228000","10.1.1.2","0.868374000","51357  >  12003 [PSH, ACK] Seq=440 Ack=1219 Win=64480 Len=172","226","0.000000000","10.202.1.2","0.069228000","TCP"
"193","39.734457","2.605127000","0.125122000","0.026627000","10.1.1.2","0.125122000","51358  >  12002 [PSH, ACK] Seq=1015 Ack=1219 Win=64480 Len=1460","1514","0.000000000","10.202.1.2","0.026627000","TCP"
"194","39.734460","2.605130000","0.000003000","0.000003000","10.1.1.2","0.000003000","51358  >  12002 [PSH, ACK] Seq=2475 Ack=1219 Win=64480 Len=95","149","0.000000000","10.202.1.2","0.000003000","TCP"
"199","39.920818","2.791488000","0.186314000","0.009476000","10.1.1.2","0.186314000","51358  >  12002 [PSH, ACK] Seq=2570 Ack=1219 Win=64480 Len=1229","1283","0.000000000","10.202.1.2","0.009476000","TCP"
"200","40.116506","5.913118000","0.806191000","0.195688000","10.1.1.2","0.806191000","51356  >  12001 [ACK] Seq=11766 Ack=4179 Win=65700 Len=0","60","0.000000000","10.202.1.2","0.195688000","TCP"
"205","40.539828","3.410498000","0.418513000","0.416643000","10.1.1.2","0.418513000","51358  >  12002 [PSH, ACK] Seq=3799 Ack=1219 Win=64480 Len=1460","1514","0.000000000","10.202.1.2","0.416643000","TCP"
"206","40.541152","3.411822000","0.001324000","0.001324000","10.1.1.2","0.001324000","51358  >  12002 [PSH, ACK] Seq=5259 Ack=1219 Win=64480 Len=1460","1514","0.000000000","10.202.1.2","0.001324000","TCP"
"207","40.541154","3.411824000","0.000002000","0.000002000","10.1.1.2","0.000002000","51358  >  12002 [PSH, ACK] Seq=6719 Ack=1219 Win=64480 Len=1340","1394","0.000000000","10.202.1.2","0.000002000","TCP"
"209","40.921881","6.718493000","0.805333000","0.380694000","10.1.1.2","0.805333000","51356  >  12001 [ACK] Seq=11766 Ack=7099 Win=65700 Len=0","60","0.000000000","10.202.1.2","0.380694000","TCP"
"211","40.923197","6.719809000","0.001260000","0.001260000","10.1.1.2","0.001260000","51356  >  12001 [ACK] Seq=11766 Ack=10019 Win=65700 Len=0","60","0.000000000","10.202.1.2","0.001260000","TCP"
"212","40.924529","3.795199000","0.383342000","0.001332000","10.1.1.2","0.383342000","51358  >  12002 [PSH, ACK] Seq=8059 Ack=1219 Win=64480 Len=1460","1514","0.000000000","10.202.1.2","0.001332000","TCP"
"213","40.924531","3.795201000","0.000002000","0.000002000","10.1.1.2","0.000002000","51358  >  12002 [PSH, ACK] Seq=9519 Ack=1219 Win=64480 Len=998","1052","0.000000000","10.202.1.2","0.000002000","TCP"
"218","41.346518","4.217188000","0.421949000","0.206331000","10.1.1.2","0.421949000","51358  >  12002 [PSH, ACK] Seq=10517 Ack=1219 Win=64480 Len=1460","1514","0.000000000","10.202.1.2","0.206331000","TCP"
"219","41.346521","4.217191000","0.000003000","0.000003000","10.1.1.2","0.000003000","51358  >  12002 [PSH, ACK] Seq=11977 Ack=1219 Win=64480 Len=977","1031","0.000000000","10.202.1.2","0.000003000","TCP"
"220","41.346523","4.217193000","0.000002000","0.000002000","10.1.1.2","0.000002000","51358  >  12002 [ACK] Seq=12954 Ack=1219 Win=64480 Len=1460","1514","0.000000000","10.202.1.2","0.000002000","TCP"
"221","41.346524","4.217194000","0.000001000","0.000001000","10.1.1.2","0.000001000","51358  >  12002 [ACK] Seq=14414 Ack=1219 Win=64480 Len=1460","1514","0.000000000","10.202.1.2","0.000001000","TCP"
"223","41.349178","4.219848000","0.002605000","0.002605000","10.1.1.2","0.002605000","51358  >  12002 [PSH, ACK] Seq=15874 Ack=1219 Win=64480 Len=776","830","0.000000000","10.202.1.2","0.002605000","TCP"
"226","41.735229","7.531841000","0.812032000","0.000001000","10.1.1.2","0.812032000","51356  >  12001 [ACK] Seq=11766 Ack=12610 Win=65700 Len=0","60","0.000000000","10.202.1.2","0.000001000","TCP"
"227","41.736550","4.607220000","0.189371000","0.001321000","10.1.1.2","0.189371000","51358  >  12002 [ACK] Seq=16650 Ack=1219 Win=64480 Len=1460","1514","0.000000000","10.202.1.2","0.001321000","TCP"
"228","41.737884","4.608554000","0.001334000","0.001334000","10.1.1.2","0.001334000","51358  >  12002 [ACK] Seq=18110 Ack=1219 Win=64480 Len=1460","1514","0.000000000","10.202.1.2","0.001334000","TCP"
"229","41.737886","4.608556000","0.000002000","0.000002000","10.1.1.2","0.000002000","51358  >  12002 [PSH, ACK] Seq=19570 Ack=1219 Win=64480 Len=600","654","0.000000000","10.202.1.2","0.000002000","TCP"
"232","41.813760","7.610372000","0.078531000","0.013312000","10.1.1.2","0.078531000","51356  >  12001 [PSH, ACK] Seq=11766 Ack=12610 Win=65700 Len=106","160","0.000000000","10.202.1.2","0.013312000","TCP"
"233","41.922917","6.812292000","5.813262000","0.109157000","10.1.1.2","5.813262000","51355  >  12000 [PSH, ACK] Seq=1 Ack=709 Win=16425 Len=136","190","0.000000000","10.202.1.2","0.109157000","TCP"
"237","42.154552","5.025222000","0.416632000","0.147402000","10.1.1.2","0.416632000","51358  >  12002 [ACK] Seq=20170 Ack=1219 Win=64480 Len=1460","1514","0.000000000","10.202.1.2","0.147402000","TCP"
"238","42.154555","5.025225000","0.000003000","0.000003000","10.1.1.2","0.000003000","51358  >  12002 [ACK] Seq=21630 Ack=1219 Win=64480 Len=1460","1514","0.000000000","10.202.1.2","0.000003000","TCP"
"239","42.154557","5.025227000","0.000002000","0.000002000","10.1.1.2","0.000002000","51358  >  12002 [PSH, ACK] Seq=23090 Ack=1219 Win=64480 Len=600","654","0.000000000","10.202.1.2","0.000002000","TCP"
"241","42.315620","8.112232000","0.308470000","0.160999000","10.1.1.2","0.308470000","51356  >  12001 [PSH, ACK] Seq=11872 Ack=12610 Win=65700 Len=1460","1514","0.000000000","10.202.1.2","0.160999000","TCP"
"242","42.315623","8.112235000","0.000003000","0.000003000","10.1.1.2","0.000003000","51356  >  12001 [ACK] Seq=13332 Ack=12610 Win=65700 Len=1460","1514","0.000000000","10.202.1.2","0.000003000","TCP"
"243","42.315624","8.112236000","0.000001000","0.000001000","10.1.1.2","0.000001000","51356  >  12001 [ACK] Seq=14792 Ack=12610 Win=65700 Len=1460","1514","0.000000000","10.202.1.2","0.000001000","TCP"
"245","42.316953","8.113565000","0.001287000","0.001287000","10.1.1.2","0.001287000","51356  >  12001 [ACK] Seq=16252 Ack=12610 Win=65700 Len=1460","1514","0.000000000","10.202.1.2","0.001287000","TCP"
"246","42.316955","8.113567000","0.000002000","0.000002000","10.1.1.2","0.000002000","51356  >  12001 [ACK] Seq=17712 Ack=12610 Win=65700 Len=1460","1514","0.000000000","10.202.1.2","0.000002000","TCP"
"247","42.316957","8.113569000","0.000002000","0.000002000","10.1.1.2","0.000002000","51356  >  12001 [ACK] Seq=19172 Ack=12610 Win=65700 Len=1460","1514","0.000000000","10.202.1.2","0.000002000","TCP"
"248","42.316960","8.113572000","0.000003000","0.000003000","10.1.1.2","0.000003000","51356  >  12001 [ACK] Seq=20632 Ack=12610 Win=65700 Len=1460","1514","0.000000000","10.202.1.2","0.000003000","TCP"
"249","42.316962","8.113574000","0.000002000","0.000002000","10.1.1.2","0.000002000","51356  >  12001 [ACK] Seq=22092 Ack=12610 Win=65700 Len=1460","1514","0.000000000","10.202.1.2","0.000002000","TCP"
"250","42.316964","8.113576000","0.000002000","0.000002000","10.1.1.2","0.000002000","51356  >  12001 [ACK] Seq=23552 Ack=12610 Win=65700 Len=1460","1514","0.000000000","10.202.1.2","0.000002000","TCP"
"251","42.316966","8.113578000","0.000002000","0.000002000","10.1.1.2","0.000002000","51356  >  12001 [PSH, ACK] Seq=25012 Ack=12610 Win=65700 Len=877","931","0.000000000","10.202.1.2","0.000002000","TCP"
"273","42.360877","5.231547000","0.206256000","0.006779000","10.1.1.2","0.206256000","51358  >  12002 [ACK] Seq=23690 Ack=1219 Win=64480 Len=1460","1514","0.000000000","10.202.1.2","0.006779000","TCP"
"274","42.360880","5.231550000","0.000003000","0.000003000","10.1.1.2","0.000003000","51358  >  12002 [PSH, ACK] Seq=25150 Ack=1219 Win=64480 Len=300","354","0.000000000","10.202.1.2","0.000003000","TCP"
"276","42.543257","5.413927000","0.182337000","0.182337000","10.1.1.2","0.182337000","51358  >  12002 [ACK] Seq=25450 Ack=1219 Win=64480 Len=1460","1514","0.000000000","10.202.1.2","0.182337000","TCP"
"277","42.543260","5.413930000","0.000003000","0.000003000","10.1.1.2","0.000003000","51358  >  12002 [PSH, ACK] Seq=26910 Ack=1219 Win=64480 Len=300","354","0.000000000","10.202.1.2","0.000003000","TCP"
"279","42.931968","7.821343000","1.005557000","0.388652000","10.1.1.2","1.005557000","51355  >  12000 [ACK] Seq=137 Ack=910 Win=16374 Len=0","60","0.000000000","10.202.1.2","0.388652000","TCP"
"280","42.958577","5.829247000","0.415261000","0.026609000","10.1.1.2","0.415261000","51358  >  12002 [PSH, ACK] Seq=27210 Ack=1219 Win=64480 Len=1232","1286","0.000000000","10.202.1.2","0.026609000","TCP"
"281","42.959910","5.830580000","0.001333000","0.001333000","10.1.1.2","0.001333000","51358  >  12002 [ACK] Seq=28442 Ack=1219 Win=64480 Len=1460","1514","0.000000000","10.202.1.2","0.001333000","TCP"
"282","42.959913","5.830583000","0.000003000","0.000003000","10.1.1.2","0.000003000","51358  >  12002 [PSH, ACK] Seq=29902 Ack=1219 Win=64480 Len=1004","1058","0.000000000","10.202.1.2","0.000003000","TCP"
"284","43.122315","8.918927000","0.768217000","0.162369000","10.1.1.2","0.768217000","51356  >  12001 [PSH, ACK] Seq=25889 Ack=12610 Win=65700 Len=598","652","0.000000000","10.202.1.2","0.162369000","TCP"
"292","43.166242","6.036912000","0.206296000","0.003990000","10.1.1.2","0.206296000","51358  >  12002 [PSH, ACK] Seq=30906 Ack=1219 Win=64480 Len=1056","1110","0.000000000","10.202.1.2","0.003990000","TCP"
"301","43.255430","6.126100000","0.089188000","0.007264000","10.1.1.2","0.089188000","51358  >  12002 [PSH, ACK] Seq=31962 Ack=1219 Win=64480 Len=1460","1514","0.000000000","10.202.1.2","0.007264000","TCP"
"302","43.255432","6.126102000","0.000002000","0.000002000","10.1.1.2","0.000002000","51358  >  12002 [PSH, ACK] Seq=33422 Ack=1219 Win=64480 Len=124","178","0.000000000","10.202.1.2","0.000002000","TCP"
"306","43.347284","6.217954000","0.091819000","0.000002000","10.1.1.2","0.091819000","51358  >  12002 [PSH, ACK] Seq=33546 Ack=1219 Win=64480 Len=176","230","0.000000000","10.202.1.2","0.000002000","TCP"
"307","43.359263","9.155875000","0.182010000","0.011979000","10.1.1.2","0.182010000","51356  >  12001 [ACK] Seq=26487 Ack=12731 Win=65576 Len=0","60","0.000000000","10.202.1.2","0.011979000","TCP"
"309","43.364586","6.235257000","0.116420000","0.002663000","10.1.1.2","0.116420000","51357  >  12003 [ACK] Seq=612 Ack=1391 Win=64308 Len=0","60","0.000000000","10.202.1.2","0.002663000","TCP"
"311","43.457772","6.328442000","0.110488000","0.093164000","10.1.1.2","0.110488000","51358  >  12002 [PSH, ACK] Seq=33722 Ack=1219 Win=64480 Len=1460","1514","0.000000000","10.202.1.2","0.093164000","TCP"
"312","43.457774","6.328444000","0.000002000","0.000002000","10.1.1.2","0.000002000","51358  >  12002 [PSH, ACK] Seq=35182 Ack=1219 Win=64480 Len=124","178","0.000000000","10.202.1.2","0.000002000","TCP"
"317","43.762616","6.633286000","0.304811000","0.099673000","10.1.1.2","0.304811000","51358  >  12002 [PSH, ACK] Seq=35306 Ack=1219 Win=64480 Len=176","230","0.000000000","10.202.1.2","0.099673000","TCP"
"318","43.765275","6.635945000","0.002659000","0.002659000","10.1.1.2","0.002659000","51358  >  12002 [ACK] Seq=35482 Ack=1219 Win=64480 Len=1460","1514","0.000000000","10.202.1.2","0.002659000","TCP"
"319","43.765277","6.635947000","0.000002000","0.000002000","10.1.1.2","0.000002000","51358  >  12002 [PSH, ACK] Seq=36942 Ack=1219 Win=64480 Len=1004","1058","0.000000000","10.202.1.2","0.000002000","TCP"
"323","43.984920","9.781532000","0.625657000","0.019888000","10.1.1.2","0.625657000","51356  >  12001 [PSH, ACK] Seq=26487 Ack=14191 Win=65700 Len=242","296","0.000000000","10.202.1.2","0.019888000","TCP"
"325","43.986250","9.782862000","0.001295000","0.001295000","10.1.1.2","0.001295000","51356  >  12001 [ACK] Seq=26729 Ack=18571 Win=65700 Len=0","60","0.000000000","10.202.1.2","0.001295000","TCP"
"326","43.987581","9.784193000","0.001331000","0.001331000","10.1.1.2","0.001331000","51356  >  12001 [ACK] Seq=26729 Ack=26688 Win=65700 Len=0","60","0.000000000","10.202.1.2","0.001331000","TCP"
"327","44.024856","6.895527000","0.660248000","0.037275000","10.1.1.2","0.660248000","51357  >  12003 [PSH, ACK] Seq=612 Ack=1391 Win=64308 Len=365","419","0.000000000","10.202.1.2","0.037275000","TCP"
"329","44.054140","6.924811000","0.029249000","0.029249000","10.1.1.2","0.029249000","51357  >  12003 [ACK] Seq=977 Ack=4194 Win=65700 Len=0","60","0.000000000","10.202.1.2","0.029249000","TCP"
"335","44.060800","6.931471000","0.000196000","0.000002000","10.1.1.2","0.000196000","51357  >  12003 [ACK] Seq=977 Ack=4194 Win=65700 Len=1460","1514","0.000000000","10.202.1.2","0.000002000","TCP"
"336","44.060802","6.931473000","0.000002000","0.000002000","10.1.1.2","0.000002000","51357  >  12003 [PSH, ACK] Seq=2437 Ack=4194 Win=65700 Len=95","149","0.000000000","10.202.1.2","0.000002000","TCP"
"339","44.063456","6.934126000","0.298142000","0.001885000","10.1.1.2","0.298142000","51358  >  12002 [PSH, ACK] Seq=37946 Ack=1219 Win=64480 Len=1232","1286","0.000000000","10.202.1.2","0.001885000","TCP"
"340","44.075440","6.946110000","0.011984000","0.011984000","10.1.1.2","0.011984000","51358  >  12002 [PSH, ACK] Seq=39178 Ack=1219 Win=64480 Len=1460","1514","0.000000000","10.202.1.2","0.011984000","TCP"
"341","44.075442","6.946112000","0.000002000","0.000002000","10.1.1.2","0.000002000","51358  >  12002 [PSH, ACK] Seq=40638 Ack=1219 Win=64480 Len=124","178","0.000000000","10.202.1.2","0.000002000","TCP"
"343","44.132682","7.003353000","0.071843000","0.057211000","10.1.1.2","0.071843000","51357  >  12003 [PSH, ACK] Seq=2532 Ack=4194 Win=65700 Len=1460","1514","0.000000000","10.202.1.2","0.057211000","TCP"
"347","44.263138","7.133808000","0.187667000","0.118348000","10.1.1.2","0.187667000","51358  >  12002 [PSH, ACK] Seq=40762 Ack=1219 Win=64480 Len=1056","1110","0.000000000","10.202.1.2","0.118348000","TCP"
"353","44.372292","7.242963000","0.036936000","0.011944000","10.1.1.2","0.036936000","51357  >  12003 [ACK] Seq=3992 Ack=4719 Win=65172 Len=0","60","0.000000000","10.202.1.2","0.011944000","TCP"
"354","44.376285","7.246955000","0.113147000","0.003993000","10.1.1.2","0.113147000","51358  >  12002 [PSH, ACK] Seq=41818 Ack=1219 Win=64480 Len=1460","1514","0.000000000","10.202.1.2","0.003993000","TCP"
"355","44.376287","7.246957000","0.000002000","0.000002000","10.1.1.2","0.000002000","51358  >  12002 [PSH, ACK] Seq=43278 Ack=1219 Win=64480 Len=124","178","0.000000000","10.202.1.2","0.000002000","TCP"
"359","44.567982","7.438652000","0.191671000","0.102433000","10.1.1.2","0.191671000","51358  >  12002 [PSH, ACK] Seq=43402 Ack=1219 Win=64480 Len=176","230","0.000000000","10.202.1.2","0.102433000","TCP"
"360","44.575964","7.446634000","0.007982000","0.007982000","10.1.1.2","0.007982000","51358  >  12002 [PSH, ACK] Seq=43578 Ack=1219 Win=64480 Len=1460","1514","0.000000000","10.202.1.2","0.007982000","TCP"
"361","44.575966","7.446636000","0.000002000","0.000002000","10.1.1.2","0.000002000","51358  >  12002 [PSH, ACK] Seq=45038 Ack=1219 Win=64480 Len=124","178","0.000000000","10.202.1.2","0.000002000","TCP"
"364","44.788962","10.585574000","0.801381000","0.000003000","10.1.1.2","0.801381000","51356  >  12001 [PSH, ACK] Seq=26729 Ack=26809 Win=65576 Len=715","769","0.000000000","10.202.1.2","0.000003000","TCP"
"369","44.864830","7.735501000","0.492538000","0.006654000","10.1.1.2","0.492538000","51357  >  12003 [ACK] Seq=3992 Ack=6269 Win=65700 Len=0","60","0.000000000","10.202.1.2","0.006654000","TCP"
"373","44.868832","7.739503000","0.004002000","0.000002000","10.1.1.2","0.004002000","51357  >  12003 [ACK] Seq=3992 Ack=7686 Win=64280 Len=1460","1514","0.000000000","10.202.1.2","0.000002000","TCP"
"374","44.868835","7.739506000","0.000003000","0.000003000","10.1.1.2","0.000003000","51357  >  12003 [PSH, ACK] Seq=5452 Ack=7686 Win=64280 Len=1460","1514","0.000000000","10.202.1.2","0.000003000","TCP"
"382","44.887460","7.758130000","0.311460000","0.009277000","10.1.1.2","0.311460000","51358  >  12002 [PSH, ACK] Seq=45162 Ack=1219 Win=64480 Len=1056","1110","0.000000000","10.202.1.2","0.009277000","TCP"
"383","44.887463","7.758133000","0.000003000","0.000003000","10.1.1.2","0.000003000","51358  >  12002 [ACK] Seq=46218 Ack=1219 Win=64480 Len=1460","1514","0.000000000","10.202.1.2","0.000003000","TCP"
"384","44.887465","7.758135000","0.000002000","0.000002000","10.1.1.2","0.000002000","51358  >  12002 [PSH, ACK] Seq=47678 Ack=1219 Win=64480 Len=124","178","0.000000000","10.202.1.2","0.000002000","TCP"
"392","45.140386","8.011057000","0.271486000","0.019750000","10.1.1.2","0.271486000","51357  >  12003 [ACK] Seq=6912 Ack=7686 Win=64280 Len=1460","1514","0.000000000","10.202.1.2","0.019750000","TCP"
"393","45.140389","8.011060000","0.000003000","0.000003000","10.1.1.2","0.000003000","51357  >  12003 [PSH, ACK] Seq=8372 Ack=7686 Win=64280 Len=1460","1514","0.000000000","10.202.1.2","0.000003000","TCP"
"402","45.180319","8.050989000","0.292825000","0.011099000","10.1.1.2","0.292825000","51358  >  12002 [PSH, ACK] Seq=47802 Ack=1219 Win=64480 Len=1232","1286","0.000000000","10.202.1.2","0.011099000","TCP"
"403","45.196296","8.066966000","0.015977000","0.015977000","10.1.1.2","0.015977000","51358  >  12002 [PSH, ACK] Seq=49034 Ack=1219 Win=64480 Len=1460","1514","0.000000000","10.202.1.2","0.015977000","TCP"
"404","45.196298","8.066968000","0.000002000","0.000002000","10.1.1.2","0.000002000","51358  >  12002 [PSH, ACK] Seq=50494 Ack=1219 Win=64480 Len=124","178","0.000000000","10.202.1.2","0.000002000","TCP"
"408","45.381333","8.252003000","0.185004000","0.098201000","10.1.1.2","0.185004000","51358  >  12002 [PSH, ACK] Seq=50618 Ack=1219 Win=64480 Len=1056","1110","0.000000000","10.202.1.2","0.098201000","TCP"
"409","45.495813","8.366483000","0.114480000","0.114480000","10.1.1.2","0.114480000","51358  >  12002 [PSH, ACK] Seq=51674 Ack=1219 Win=64480 Len=1460","1514","0.000000000","10.202.1.2","0.114480000","TCP"
"410","45.495816","8.366486000","0.000003000","0.000003000","10.1.1.2","0.000003000","51358  >  12002 [PSH, ACK] Seq=53134 Ack=1219 Win=64480 Len=124","178","0.000000000","10.202.1.2","0.000003000","TCP"
"412","45.594318","11.390930000","0.805273000","0.098465000","10.1.1.2","0.805273000","51356  >  12001 [PSH, ACK] Seq=27444 Ack=26930 Win=65456 Len=836","890","0.000000000","10.202.1.2","0.098465000","TCP"
"416","45.674200","8.544871000","0.504980000","0.075890000","10.1.1.2","0.504980000","51357  >  12003 [ACK] Seq=9832 Ack=7686 Win=64280 Len=1460","1514","0.000000000","10.202.1.2","0.075890000","TCP"
"422","45.675540","8.546211000","0.001340000","0.000003000","10.1.1.2","0.001340000","51357  >  12003 [ACK] Seq=11292 Ack=7686 Win=64280 Len=1460","1514","0.000000000","10.202.1.2","0.000003000","TCP"
"423","45.675542","8.546213000","0.000002000","0.000002000","10.1.1.2","0.000002000","51357  >  12003 [ACK] Seq=12752 Ack=7686 Win=64280 Len=1460","1514","0.000000000","10.202.1.2","0.000002000","TCP"
"424","45.675543","8.546214000","0.000001000","0.000001000","10.1.1.2","0.000001000","51357  >  12003 [ACK] Seq=14212 Ack=7686 Win=64280 Len=1460","1514","0.000000000","10.202.1.2","0.000001000","TCP"
"432","45.691492","8.562162000","0.195639000","0.003930000","10.1.1.2","0.195639000","51358  >  12002 [PSH, ACK] Seq=53258 Ack=1219 Win=64480 Len=176","230","0.000000000","10.202.1.2","0.003930000","TCP"
"436","45.695498","8.566168000","0.004006000","0.000002000","10.1.1.2","0.004006000","51358  >  12002 [PSH, ACK] Seq=53434 Ack=1219 Win=64480 Len=1460","1514","0.000000000","10.202.1.2","0.000002000","TCP"
"437","45.695499","8.566169000","0.000001000","0.000001000","10.1.1.2","0.000001000","51358  >  12002 [PSH, ACK] Seq=54894 Ack=1219 Win=64480 Len=124","178","0.000000000","10.202.1.2","0.000001000","TCP"
"447","45.944418","8.815089000","0.268791000","0.015928000","10.1.1.2","0.268791000","51357  >  12003 [ACK] Seq=15672 Ack=7686 Win=64280 Len=1460","1514","0.000000000","10.202.1.2","0.015928000","TCP"
"448","45.944421","8.815092000","0.000003000","0.000003000","10.1.1.2","0.000003000","51357  >  12003 [ACK] Seq=17132 Ack=7686 Win=64280 Len=1460","1514","0.000000000","10.202.1.2","0.000003000","TCP"
"451","45.945753","8.816424000","0.001295000","0.000416000","10.1.1.2","0.001295000","51357  >  12003 [ACK] Seq=18592 Ack=7686 Win=64280 Len=1460","1514","0.000000000","10.202.1.2","0.000416000","TCP"
"452","45.945755","8.816426000","0.000002000","0.000002000","10.1.1.2","0.000002000","51357  >  12003 [ACK] Seq=20052 Ack=7686 Win=64280 Len=1460","1514","0.000000000","10.202.1.2","0.000002000","TCP"
"460","45.975047","8.845718000","0.029263000","0.000001000","10.1.1.2","0.029263000","51357  >  12003 [ACK] Seq=21512 Ack=9146 Win=65700 Len=0 SLE=10606 SRE=12066","66","0.000000000","10.202.1.2","0.000001000","TCP"
"461","45.975049","8.845720000","0.000002000","0.000002000","10.1.1.2","0.000002000","[TCP Dup ACK 460#1] 51357  >  12003 [ACK] Seq=21512 Ack=9146 Win=65700 Len=0 SLE=10606 SRE=13526","66","0.000000000","10.202.1.2","0.000002000","TCP"
"462","45.975050","8.845721000","0.000001000","0.000001000","10.1.1.2","0.000001000","[TCP Dup ACK 460#2] 51357  >  12003 [ACK] Seq=21512 Ack=9146 Win=65700 Len=0 SLE=10606 SRE=14986","66","0.000000000","10.202.1.2","0.000001000","TCP"
"463","45.975051","8.845722000","0.000001000","0.000001000","10.1.1.2","0.000001000","[TCP Dup ACK 460#3] 51357  >  12003 [ACK] Seq=21512 Ack=9146 Win=65700 Len=0 SLE=10606 SRE=16446","66","0.000000000","10.202.1.2","0.000001000","TCP"
"469","45.976367","8.847038000","0.001194000","0.001194000","10.1.1.2","0.001194000","[TCP Dup ACK 460#4] 51357  >  12003 [ACK] Seq=21512 Ack=9146 Win=65700 Len=0 SLE=10606 SRE=17906","66","0.000000000","10.202.1.2","0.001194000","TCP"
"471","46.000329","8.870999000","0.304760000","0.023935000","10.1.1.2","0.304760000","51358  >  12002 [PSH, ACK] Seq=55018 Ack=1219 Win=64480 Len=1056","1110","0.000000000","10.202.1.2","0.023935000","TCP"
"472","46.000331","8.871001000","0.000002000","0.000002000","10.1.1.2","0.000002000","51358  >  12002 [ACK] Seq=56074 Ack=1219 Win=64480 Len=1460","1514","0.000000000","10.202.1.2","0.000002000","TCP"
"473","46.000333","8.871003000","0.000002000","0.000002000","10.1.1.2","0.000002000","51358  >  12002 [PSH, ACK] Seq=57534 Ack=1219 Win=64480 Len=124","178","0.000000000","10.202.1.2","0.000002000","TCP"
"478","46.301178","9.171848000","0.300816000","0.100007000","10.1.1.2","0.300816000","51358  >  12002 [PSH, ACK] Seq=57658 Ack=1219 Win=64480 Len=1232","1286","0.000000000","10.202.1.2","0.100007000","TCP"
"479","46.315820","9.186490000","0.014642000","0.014642000","10.1.1.2","0.014642000","51358  >  12002 [PSH, ACK] Seq=58890 Ack=1219 Win=64480 Len=1460","1514","0.000000000","10.202.1.2","0.014642000","TCP"
"480","46.315823","9.186493000","0.000003000","0.000003000","10.1.1.2","0.000003000","51358  >  12002 [PSH, ACK] Seq=60350 Ack=1219 Win=64480 Len=124","178","0.000000000","10.202.1.2","0.000003000","TCP"
"482","46.403680","12.200292000","0.809304000","0.087823000","10.1.1.2","0.809304000","51356  >  12001 [PSH, ACK] Seq=28280 Ack=27644 Win=64744 Len=836","890","0.000000000","10.202.1.2","0.087823000","TCP"
"489","46.482221","9.352892000","0.505827000","0.055462000","10.1.1.2","0.505827000","51357  >  12003 [ACK] Seq=21512 Ack=9146 Win=65700 Len=1460","1514","0.000000000","10.202.1.2","0.055462000","TCP"
"490","46.482224","9.352895000","0.000003000","0.000003000","10.1.1.2","0.000003000","51357  >  12003 [ACK] Seq=22972 Ack=9146 Win=65700 Len=1460","1514","0.000000000","10.202.1.2","0.000003000","TCP"
"491","46.482226","9.352897000","0.000002000","0.000002000","10.1.1.2","0.000002000","51357  >  12003 [ACK] Seq=24432 Ack=9146 Win=65700 Len=1460","1514","0.000000000","10.202.1.2","0.000002000","TCP"
"492","46.482227","9.352898000","0.000001000","0.000001000","10.1.1.2","0.000001000","51357  >  12003 [ACK] Seq=25892 Ack=9146 Win=65700 Len=1460","1514","0.000000000","10.202.1.2","0.000001000","TCP"
"495","46.483553","9.354224000","0.001279000","0.000004000","10.1.1.2","0.001279000","51357  >  12003 [ACK] Seq=27352 Ack=9146 Win=65700 Len=1460","1514","0.000000000","10.202.1.2","0.000004000","TCP"
"496","46.483555","9.354226000","0.000002000","0.000002000","10.1.1.2","0.000002000","51357  >  12003 [ACK] Seq=28812 Ack=9146 Win=65700 Len=1460","1514","0.000000000","10.202.1.2","0.000002000","TCP"
"499","46.486209","9.356880000","0.002614000","0.000516000","10.1.1.2","0.002614000","51357  >  12003 [ACK] Seq=30272 Ack=9146 Win=65700 Len=1460","1514","0.000000000","10.202.1.2","0.000516000","TCP"
"500","46.487541","9.358212000","0.001332000","0.001332000","10.1.1.2","0.001332000","51357  >  12003 [ACK] Seq=31732 Ack=9146 Win=65700 Len=1460","1514","0.000000000","10.202.1.2","0.001332000","TCP"
"522","46.500853","9.371523000","0.184996000","0.001332000","10.1.1.2","0.184996000","51358  >  12002 [PSH, ACK] Seq=60474 Ack=1219 Win=64480 Len=1056","1110","0.000000000","10.202.1.2","0.001332000","TCP"
"532","46.615336","9.486006000","0.114483000","0.047845000","10.1.1.2","0.114483000","51358  >  12002 [PSH, ACK] Seq=61530 Ack=1219 Win=64480 Len=1460","1514","0.000000000","10.202.1.2","0.047845000","TCP"
"533","46.615341","9.486011000","0.000005000","0.000005000","10.1.1.2","0.000005000","51358  >  12002 [PSH, ACK] Seq=62990 Ack=1219 Win=64480 Len=124","178","0.000000000","10.202.1.2","0.000005000","TCP"
"535","46.748466","9.619137000","0.260896000","0.133096000","10.1.1.2","0.260896000","51357  >  12003 [ACK] Seq=33192 Ack=9146 Win=65700 Len=1460","1514","0.000000000","10.202.1.2","0.133096000","TCP"
"536","46.748469","9.619140000","0.000003000","0.000003000","10.1.1.2","0.000003000","51357  >  12003 [ACK] Seq=34652 Ack=9146 Win=65700 Len=1460","1514","0.000000000","10.202.1.2","0.000003000","TCP"
"538","46.749788","9.620459000","0.001251000","0.001251000","10.1.1.2","0.001251000","51357  >  12003 [ACK] Seq=36112 Ack=9146 Win=65700 Len=1460","1514","0.000000000","10.202.1.2","0.001251000","TCP"
"539","46.749790","9.620461000","0.000002000","0.000002000","10.1.1.2","0.000002000","51357  >  12003 [ACK] Seq=37572 Ack=9146 Win=65700 Len=1460","1514","0.000000000","10.202.1.2","0.000002000","TCP"
"541","46.751121","9.621792000","0.001294000","0.001294000","10.1.1.2","0.001294000","51357  >  12003 [ACK] Seq=39032 Ack=9146 Win=65700 Len=1460","1514","0.000000000","10.202.1.2","0.001294000","TCP"
"542","46.751123","9.621794000","0.000002000","0.000002000","10.1.1.2","0.000002000","51357  >  12003 [ACK] Seq=40492 Ack=9146 Win=65700 Len=1460","1514","0.000000000","10.202.1.2","0.000002000","TCP"
"543","46.751128","9.621799000","0.000005000","0.000005000","10.1.1.2","0.000005000","51357  >  12003 [ACK] Seq=41952 Ack=9146 Win=65700 Len=1460","1514","0.000000000","10.202.1.2","0.000005000","TCP"
"544","46.751130","9.621801000","0.000002000","0.000002000","10.1.1.2","0.000002000","51357  >  12003 [ACK] Seq=43412 Ack=9146 Win=65700 Len=1460","1514","0.000000000","10.202.1.2","0.000002000","TCP"
"559","46.783081","9.653752000","0.031915000","0.000004000","10.1.1.2","0.031915000","[TCP Dup ACK 460#5] 51357  >  12003 [ACK] Seq=44872 Ack=9146 Win=65700 Len=0 SLE=10606 SRE=19366","66","0.000000000","10.202.1.2","0.000004000","TCP"
"561","46.784397","9.655068000","0.001316000","0.001282000","10.1.1.2","0.001316000","[TCP Dup ACK 460#6] 51357  >  12003 [ACK] Seq=44872 Ack=9146 Win=65700 Len=0 SLE=10606 SRE=20826","66","0.000000000","10.202.1.2","0.001282000","TCP"
"562","46.784399","9.655070000","0.000002000","0.000002000","10.1.1.2","0.000002000","51357  >  12003 [ACK] Seq=44872 Ack=20826 Win=65700 Len=0","60","0.000000000","10.202.1.2","0.000002000","TCP"
"563","46.784399","9.655070000","0.000000000","0.000000000","10.1.1.2","0.000000000","51357  >  12003 [ACK] Seq=44872 Ack=23746 Win=62780 Len=0","60","0.000000000","10.202.1.2","0.000000000","TCP"
"564","46.784400","9.655071000","0.000001000","0.000001000","10.1.1.2","0.000001000","[TCP Window Update] 51357  >  12003 [ACK] Seq=44872 Ack=23746 Win=65700 Len=0","60","0.000000000","10.202.1.2","0.000001000","TCP"
"567","46.803031","9.673701000","0.187661000","0.018497000","10.1.1.2","0.187661000","51358  >  12002 [PSH, ACK] Seq=63114 Ack=1219 Win=64480 Len=176","230","0.000000000","10.202.1.2","0.018497000","TCP"
"568","46.816345","9.687015000","0.013314000","0.013314000","10.1.1.2","0.013314000","51358  >  12002 [PSH, ACK] Seq=63290 Ack=1219 Win=64480 Len=1460","1514","0.000000000","10.202.1.2","0.013314000","TCP"
"569","46.816348","9.687018000","0.000003000","0.000003000","10.1.1.2","0.000003000","51358  >  12002 [PSH, ACK] Seq=64750 Ack=1219 Win=64480 Len=124","178","0.000000000","10.202.1.2","0.000003000","TCP"
"576","47.119860","9.990530000","0.303482000","0.114433000","10.1.1.2","0.303482000","51358  >  12002 [PSH, ACK] Seq=64874 Ack=1219 Win=64480 Len=1056","1110","0.000000000","10.202.1.2","0.114433000","TCP"
"577","47.121188","9.991858000","0.001328000","0.001328000","10.1.1.2","0.001328000","51358  >  12002 [ACK] Seq=65930 Ack=1219 Win=64480 Len=1460","1514","0.000000000","10.202.1.2","0.001328000","TCP"
"578","47.121190","9.991860000","0.000002000","0.000002000","10.1.1.2","0.000002000","51358  >  12002 [PSH, ACK] Seq=67390 Ack=1219 Win=64480 Len=124","178","0.000000000","10.202.1.2","0.000002000","TCP"
"581","47.207713","13.004325000","0.780954000","0.034811000","10.1.1.2","0.780954000","51356  >  12001 [PSH, ACK] Seq=29116 Ack=28479 Win=65700 Len=594","648","0.000000000","10.202.1.2","0.034811000","TCP"
"583","47.233009","13.029621000","0.025239000","0.025239000","10.1.1.2","0.025239000","51356  >  12001 [PSH, ACK] Seq=29710 Ack=29939 Win=65700 Len=1188","1242","0.000000000","10.202.1.2","0.025239000","TCP"
"592","47.296904","10.167575000","0.512370000","0.001288000","10.1.1.2","0.512370000","51357  >  12003 [PSH, ACK] Seq=44872 Ack=23746 Win=65700 Len=1460","1514","0.000000000","10.202.1.2","0.001288000","TCP"
"593","47.296906","10.167577000","0.000002000","0.000002000","10.1.1.2","0.000002000","51357  >  12003 [ACK] Seq=46332 Ack=23746 Win=65700 Len=1460","1514","0.000000000","10.202.1.2","0.000002000","TCP"
"594","47.296908","10.167579000","0.000002000","0.000002000","10.1.1.2","0.000002000","51357  >  12003 [ACK] Seq=47792 Ack=23746 Win=65700 Len=1460","1514","0.000000000","10.202.1.2","0.000002000","TCP"
"595","47.296909","10.167580000","0.000001000","0.000001000","10.1.1.2","0.000001000","51357  >  12003 [ACK] Seq=49252 Ack=23746 Win=65700 Len=1460","1514","0.000000000","10.202.1.2","0.000001000","TCP"
"601","47.299565","10.170236000","0.002616000","0.001312000","10.1.1.2","0.002616000","51357  >  12003 [ACK] Seq=50712 Ack=23746 Win=65700 Len=1460","1514","0.000000000","10.202.1.2","0.001312000","TCP"
"602","47.299568","10.170239000","0.000003000","0.000003000","10.1.1.2","0.000003000","51357  >  12003 [ACK] Seq=52172 Ack=23746 Win=65700 Len=1460","1514","0.000000000","10.202.1.2","0.000003000","TCP"
"604","47.300902","10.171573000","0.001300000","0.001300000","10.1.1.2","0.001300000","51357  >  12003 [ACK] Seq=53632 Ack=23746 Win=65700 Len=1460","1514","0.000000000","10.202.1.2","0.001300000","TCP"
"605","47.300904","10.171575000","0.000002000","0.000002000","10.1.1.2","0.000002000","51357  >  12003 [ACK] Seq=55092 Ack=23746 Win=65700 Len=1460","1514","0.000000000","10.202.1.2","0.000002000","TCP"
"606","47.300906","10.171577000","0.000002000","0.000002000","10.1.1.2","0.000002000","51357  >  12003 [ACK] Seq=56552 Ack=23746 Win=65700 Len=1460","1514","0.000000000","10.202.1.2","0.000002000","TCP"
"607","47.300908","10.171579000","0.000002000","0.000002000","10.1.1.2","0.000002000","51357  >  12003 [ACK] Seq=58012 Ack=23746 Win=65700 Len=1460","1514","0.000000000","10.202.1.2","0.000002000","TCP"
"608","47.300911","10.171582000","0.000003000","0.000003000","10.1.1.2","0.000003000","51357  >  12003 [ACK] Seq=59472 Ack=23746 Win=65700 Len=1460","1514","0.000000000","10.202.1.2","0.000003000","TCP"
"609","47.300913","10.171584000","0.000002000","0.000002000","10.1.1.2","0.000002000","51357  >  12003 [ACK] Seq=60932 Ack=23746 Win=65700 Len=1460","1514","0.000000000","10.202.1.2","0.000002000","TCP"
"610","47.300916","10.171587000","0.000003000","0.000003000","10.1.1.2","0.000003000","51357  >  12003 [ACK] Seq=62392 Ack=23746 Win=65700 Len=1460","1514","0.000000000","10.202.1.2","0.000003000","TCP"
"611","47.300917","10.171588000","0.000001000","0.000001000","10.1.1.2","0.000001000","51357  >  12003 [ACK] Seq=63852 Ack=23746 Win=65700 Len=1460","1514","0.000000000","10.202.1.2","0.000001000","TCP"
"612","47.300920","10.171591000","0.000003000","0.000003000","10.1.1.2","0.000003000","51357  >  12003 [ACK] Seq=65312 Ack=23746 Win=65700 Len=1460","1514","0.000000000","10.202.1.2","0.000003000","TCP"
"613","47.300922","10.171593000","0.000002000","0.000002000","10.1.1.2","0.000002000","51357  >  12003 [ACK] Seq=66772 Ack=23746 Win=65700 Len=1460","1514","0.000000000","10.202.1.2","0.000002000","TCP"
"661","47.419369","10.290039000","0.298140000","0.046505000","10.1.1.2","0.298140000","51358  >  12002 [PSH, ACK] Seq=67514 Ack=1219 Win=64480 Len=1232","1286","0.000000000","10.202.1.2","0.046505000","TCP"
"662","47.431350","13.227962000","0.198341000","0.011981000","10.1.1.2","0.198341000","51356  >  12001 [ACK] Seq=30898 Ack=30471 Win=65168 Len=0","60","0.000000000","10.202.1.2","0.011981000","TCP"
"664","47.436673","10.307343000","0.017304000","0.005297000","10.1.1.2","0.017304000","51358  >  12002 [PSH, ACK] Seq=68746 Ack=1219 Win=64480 Len=1460","1514","0.000000000","10.202.1.2","0.005297000","TCP"
"665","47.436675","10.307345000","0.000002000","0.000002000","10.1.1.2","0.000002000","51358  >  12002 [PSH, ACK] Seq=70206 Ack=1219 Win=64480 Len=124","178","0.000000000","10.202.1.2","0.000002000","TCP"
