"No.","Time","Time since first frame in this TCP stream","segment delta","Time delta from previous captured frame","Destination","Delta Time (conv)","Info","Length","Time shift for this packet","Source","Time delta from previous captured frame","Protocol"
"2","0.000003","0.000000000","0.000000000","0.000003000","10.1.1.2","0.000000000","51358  >  12002 [PSH, ACK] Seq=1 Ack=1 Win=16120 Len=1232","1286","0.000000000","10.202.1.2","0.000003000","TCP"
"3","0.000004","0.000001000","0.000001000","0.000001000","10.1.1.2","0.000001000","51358  >  12002 [ACK] Seq=1233 Ack=1 Win=16120 Len=1460","1514","0.000000000","10.202.1.2","0.000001000","TCP"
"4","0.000006","0.000003000","0.000002000","0.000002000","10.1.1.2","0.000002000","51358  >  12002 [PSH, ACK] Seq=2693 Ack=1 Win=16120 Len=124","178","0.000000000","10.202.1.2","0.000002000","TCP"
"12","0.259565","0.259562000","0.259454000","0.047869000","10.1.1.2","0.259454000","51358  >  12002 [PSH, ACK] Seq=2817 Ack=1 Win=16120 Len=1232","1286","0.000000000","10.202.1.2","0.047869000","TCP"
"17","0.314145","0.314142000","0.054580000","0.027932000","10.1.1.2","0.054580000","51358  >  12002 [PSH, ACK] Seq=4049 Ack=1 Win=16120 Len=1460","1514","0.000000000","10.202.1.2","0.027932000","TCP"
"18","0.314148","0.314145000","0.000003000","0.000003000","10.1.1.2","0.000003000","51358  >  12002 [PSH, ACK] Seq=5509 Ack=1 Win=16120 Len=124","178","0.000000000","10.202.1.2","0.000003000","TCP"
"38","0.461905","0.000000000","0.000000000","0.095819000","10.1.1.2","0.000000000","51357  >  12003 [ACK] Seq=1 Ack=1 Win=65335 Len=1460","1514","0.000000000","10.202.1.2","0.095819000","TCP"
"40","0.463239","0.001334000","0.001286000","0.001286000","10.1.1.2","0.001286000","51357  >  12003 [ACK] Seq=1461 Ack=1 Win=65335 Len=1460","1514","0.000000000","10.202.1.2","0.001286000","TCP"
"41","0.463241","0.001336000","0.000002000","0.000002000","10.1.1.2","0.000002000","51357  >  12003 [ACK] Seq=2921 Ack=1 Win=65335 Len=1460","1514","0.000000000","10.202.1.2","0.000002000","TCP"
"42","0.463244","0.001339000","0.000003000","0.000003000","10.1.1.2","0.000003000","51357  >  12003 [ACK] Seq=4381 Ack=7301 Win=65335 Len=1460","1514","0.000000000","10.202.1.2","0.000003000","TCP"
"43","0.463246","0.001341000","0.000002000","0.000002000","10.1.1.2","0.000002000","51357  >  12003 [ACK] Seq=5841 Ack=7301 Win=65335 Len=1460","1514","0.000000000","10.202.1.2","0.000002000","TCP"
"44","0.463248","0.001343000","0.000002000","0.000002000","10.1.1.2","0.000002000","51357  >  12003 [ACK] Seq=7301 Ack=7301 Win=65335 Len=1460","1514","0.000000000","10.202.1.2","0.000002000","TCP"
"46","0.464567","0.002662000","0.001275000","0.001275000","10.1.1.2","0.001275000","51357  >  12003 [ACK] Seq=8761 Ack=7301 Win=65335 Len=1460","1514","0.000000000","10.202.1.2","0.001275000","TCP"
"47","0.503173","0.503170000","0.188993000","0.038606000","10.1.1.2","0.188993000","51358  >  12002 [PSH, ACK] Seq=5633 Ack=1 Win=16120 Len=704","758","0.000000000","10.202.1.2","0.038606000","TCP"
"48","0.587037","0.587034000","0.083864000","0.083864000","10.1.1.2","0.083864000","51358  >  12002 [PSH, ACK] Seq=6337 Ack=1 Win=16120 Len=1460","1514","0.000000000","10.202.1.2","0.083864000","TCP"
"49","0.587040","0.587037000","0.000003000","0.000003000","10.1.1.2","0.000003000","51358  >  12002 [PSH, ACK] Seq=7797 Ack=1 Win=16120 Len=124","178","0.000000000","10.202.1.2","0.000003000","TCP"
"55","0.641624","0.179719000","0.177057000","0.030628000","10.1.1.2","0.177057000","51357  >  12003 [ACK] Seq=10221 Ack=7301 Win=65335 Len=1460","1514","0.000000000","10.202.1.2","0.030628000","TCP"
"56","0.641630","0.179725000","0.000006000","0.000006000","10.1.1.2","0.000006000","51357  >  12003 [ACK] Seq=11681 Ack=7301 Win=65335 Len=1460","1514","0.000000000","10.202.1.2","0.000006000","TCP"
"58","0.804032","0.804029000","0.216960000","0.162344000","10.1.1.2","0.216960000","51358  >  12002 [PSH, ACK] Seq=7921 Ack=1 Win=16120 Len=352","406","0.000000000","10.202.1.2","0.162344000","TCP"
"59","0.805351","0.805348000","0.001319000","0.001319000","10.1.1.2","0.001319000","51358  >  12002 [ACK] Seq=8273 Ack=1 Win=16120 Len=1460","1514","0.000000000","10.202.1.2","0.001319000","TCP"
"60","0.805353","0.805350000","0.000002000","0.000002000","10.1.1.2","0.000002000","51358  >  12002 [PSH, ACK] Seq=9733 Ack=1 Win=16120 Len=124","178","0.000000000","10.202.1.2","0.000002000","TCP"
"71","1.118186","1.118183000","0.312781000","0.025244000","10.1.1.2","0.312781000","51358  >  12002 [PSH, ACK] Seq=9857 Ack=1 Win=16120 Len=1232","1286","0.000000000","10.202.1.2","0.025244000","TCP"
"72","1.119508","1.119505000","0.001322000","0.001322000","10.1.1.2","0.001322000","51358  >  12002 [ACK] Seq=11089 Ack=1 Win=16120 Len=1460","1514","0.000000000","10.202.1.2","0.001322000","TCP"
"73","1.119510","1.119507000","0.000002000","0.000002000","10.1.1.2","0.000002000","51358  >  12002 [PSH, ACK] Seq=12549 Ack=1 Win=16120 Len=124","178","0.000000000","10.202.1.2","0.000002000","TCP"
"93","1.267271","0.805366000","0.625583000","0.086471000","10.1.1.2","0.625583000","51357  >  12003 [ACK] Seq=13141 Ack=8761 Win=65335 Len=1460","1514","0.000000000","10.202.1.2","0.086471000","TCP"
"95","1.269931","0.808026000","0.002609000","0.002609000","10.1.1.2","0.002609000","51357  >  12003 [ACK] Seq=14601 Ack=10221 Win=65335 Len=1460","1514","0.000000000","10.202.1.2","0.002609000","TCP"
"96","1.269934","0.808029000","0.000003000","0.000003000","10.1.1.2","0.000003000","51357  >  12003 [ACK] Seq=16061 Ack=10221 Win=65335 Len=1460","1514","0.000000000","10.202.1.2","0.000003000","TCP"
"98","1.271266","0.809361000","0.001298000","0.001298000","10.1.1.2","0.001298000","51357  >  12003 [ACK] Seq=17521 Ack=10221 Win=65335 Len=1460","1514","0.000000000","10.202.1.2","0.001298000","TCP"
"99","1.271268","0.809363000","0.000002000","0.000002000","10.1.1.2","0.000002000","51357  >  12003 [ACK] Seq=18981 Ack=10221 Win=65335 Len=1460","1514","0.000000000","10.202.1.2","0.000002000","TCP"
"100","1.271269","0.809364000","0.000001000","0.000001000","10.1.1.2","0.000001000","51357  >  12003 [ACK] Seq=20441 Ack=10221 Win=65335 Len=1460","1514","0.000000000","10.202.1.2","0.000001000","TCP"
"101","1.271271","0.809366000","0.000002000","0.000002000","10.1.1.2","0.000002000","51357  >  12003 [ACK] Seq=21901 Ack=16061 Win=65335 Len=0","60","0.000000000","10.202.1.2","0.000002000","TCP"
"106","1.391071","1.391068000","0.271532000","0.109061000","10.1.1.2","0.271532000","51358  >  12002 [PSH, ACK] Seq=12673 Ack=1 Win=16120 Len=1232","1286","0.000000000","10.202.1.2","0.109061000","TCP"
"109","1.434999","1.434996000","0.043928000","0.017308000","10.1.1.2","0.043928000","51358  >  12002 [PSH, ACK] Seq=13905 Ack=1 Win=16120 Len=1460","1514","0.000000000","10.202.1.2","0.017308000","TCP"
"110","1.435001","1.434998000","0.000002000","0.000002000","10.1.1.2","0.000002000","51358  >  12002 [PSH, ACK] Seq=15365 Ack=1 Win=16120 Len=124","178","0.000000000","10.202.1.2","0.000002000","TCP"
"113","1.446980","0.985075000","0.175666000","0.006414000","10.1.1.2","0.175666000","51357  >  12003 [ACK] Seq=21901 Ack=16061 Win=65335 Len=1460","1514","0.000000000","10.202.1.2","0.006414000","TCP"
"114","1.446983","0.985078000","0.000003000","0.000003000","10.1.1.2","0.000003000","51357  >  12003 [ACK] Seq=23361 Ack=16061 Win=65335 Len=1460","1514","0.000000000","10.202.1.2","0.000003000","TCP"
"116","1.449641","0.987736000","0.002621000","0.002621000","10.1.1.2","0.002621000","51357  >  12003 [ACK] Seq=24821 Ack=16061 Win=65335 Len=1460","1514","0.000000000","10.202.1.2","0.002621000","TCP"
"117","1.452303","0.990398000","0.002662000","0.002662000","10.1.1.2","0.002662000","51357  >  12003 [ACK] Seq=26281 Ack=16061 Win=65335 Len=1460","1514","0.000000000","10.202.1.2","0.002662000","TCP"
"119","1.609394","1.609391000","0.174362000","0.157063000","10.1.1.2","0.174362000","51358  >  12002 [PSH, ACK] Seq=15489 Ack=1 Win=16120 Len=704","758","0.000000000","10.202.1.2","0.157063000","TCP"
"120","1.694589","1.694586000","0.085195000","0.085195000","10.1.1.2","0.085195000","51358  >  12002 [PSH, ACK] Seq=16193 Ack=1 Win=16120 Len=1460","1514","0.000000000","10.202.1.2","0.085195000","TCP"
"121","1.694593","1.694590000","0.000004000","0.000004000","10.1.1.2","0.000004000","51358  >  12002 [PSH, ACK] Seq=17653 Ack=1 Win=16120 Len=124","178","0.000000000","10.202.1.2","0.000004000","TCP"
"130","1.923548","1.923545000","0.228896000","0.017250000","10.1.1.2","0.228896000","51358  >  12002 [PSH, ACK] Seq=17777 Ack=1 Win=16120 Len=352","406","0.000000000","10.202.1.2","0.017250000","TCP"
"131","1.924875","1.924872000","0.001327000","0.001327000","10.1.1.2","0.001327000","51358  >  12002 [ACK] Seq=18129 Ack=1 Win=16120 Len=1460","1514","0.000000000","10.202.1.2","0.001327000","TCP"
"132","1.924878","1.924875000","0.000003000","0.000003000","10.1.1.2","0.000003000","51358  >  12002 [PSH, ACK] Seq=19589 Ack=1 Win=16120 Len=124","178","0.000000000","10.202.1.2","0.000003000","TCP"
"154","2.073971","1.612066000","0.621640000","0.042567000","10.1.1.2","0.621640000","51357  >  12003 [ACK] Seq=27741 Ack=17521 Win=65335 Len=1460","1514","0.000000000","10.202.1.2","0.042567000","TCP"
"156","2.076628","1.614723000","0.002591000","0.002591000","10.1.1.2","0.002591000","51357  >  12003 [ACK] Seq=29201 Ack=20441 Win=65335 Len=1460","1514","0.000000000","10.202.1.2","0.002591000","TCP"
"157","2.076632","1.614727000","0.000004000","0.000004000","10.1.1.2","0.000004000","51357  >  12003 [ACK] Seq=30661 Ack=20441 Win=65335 Len=1460","1514","0.000000000","10.202.1.2","0.000004000","TCP"
"159","2.079292","1.617387000","0.002622000","0.002622000","10.1.1.2","0.002622000","51357  >  12003 [ACK] Seq=32121 Ack=21901 Win=65335 Len=1460","1514","0.000000000","10.202.1.2","0.002622000","TCP"
"160","2.079294","1.617389000","0.000002000","0.000002000","10.1.1.2","0.000002000","51357  >  12003 [ACK] Seq=33581 Ack=21901 Win=65335 Len=1460","1514","0.000000000","10.202.1.2","0.000002000","TCP"
"161","2.079296","1.617391000","0.000002000","0.000002000","10.1.1.2","0.000002000","51357  >  12003 [ACK] Seq=35041 Ack=21901 Win=65335 Len=1460","1514","0.000000000","10.202.1.2","0.000002000","TCP"
"163","2.085945","1.624040000","0.006610000","0.006610000","10.1.1.2","0.006610000","51357  >  12003 [ACK] Seq=36501 Ack=24821 Win=65335 Len=0","60","0.000000000","10.202.1.2","0.006610000","TCP"
"168","2.243037","2.243034000","0.318129000","0.151633000","10.1.1.2","0.318129000","51358  >  12002 [PSH, ACK] Seq=19713 Ack=1 Win=16120 Len=1232","1286","0.000000000","10.202.1.2","0.151633000","TCP"
"169","2.244360","2.244357000","0.001323000","0.001323000","10.1.1.2","0.001323000","51358  >  12002 [ACK] Seq=20945 Ack=1 Win=16120 Len=1460","1514","0.000000000","10.202.1.2","0.001323000","TCP"
"170","2.244362","2.244359000","0.000002000","0.000002000","10.1.1.2","0.000002000","51358  >  12002 [PSH, ACK] Seq=22405 Ack=1 Win=16120 Len=124","178","0.000000000","10.202.1.2","0.000002000","TCP"
"173","2.261666","1.799761000","0.175690000","0.015977000","10.1.1.2","0.175690000","51357  >  12003 [ACK] Seq=36501 Ack=27447 Win=65335 Len=1460","1514","0.000000000","10.202.1.2","0.015977000","TCP"
"174","2.261669","1.799764000","0.000003000","0.000003000","10.1.1.2","0.000003000","51357  >  12003 [ACK] Seq=37961 Ack=27447 Win=65335 Len=1460","1514","0.000000000","10.202.1.2","0.000003000","TCP"
"176","2.262997","1.801092000","0.001265000","0.001265000","10.1.1.2","0.001265000","51357  >  12003 [ACK] Seq=39421 Ack=27447 Win=65335 Len=1460","1514","0.000000000","10.202.1.2","0.001265000","TCP"
"177","2.262999","1.801094000","0.000002000","0.000002000","10.1.1.2","0.000002000","51357  >  12003 [ACK] Seq=40881 Ack=27447 Win=65335 Len=1460","1514","0.000000000","10.202.1.2","0.000002000","TCP"
"178","2.263001","1.801096000","0.000002000","0.000002000","10.1.1.2","0.000002000","51357  >  12003 [ACK] Seq=42341 Ack=27447 Win=65335 Len=1460","1514","0.000000000","10.202.1.2","0.000002000","TCP"
"181","2.499957","2.499954000","0.255558000","0.141388000","10.1.1.2","0.255558000","51358  >  12002 [PSH, ACK] Seq=22529 Ack=1 Win=16120 Len=1232","1286","0.000000000","10.202.1.2","0.141388000","TCP"
"184","2.554527","2.554524000","0.054570000","0.026542000","10.1.1.2","0.054570000","51358  >  12002 [PSH, ACK] Seq=23761 Ack=1 Win=16120 Len=1460","1514","0.000000000","10.202.1.2","0.026542000","TCP"
"186","2.561187","2.561184000","0.006614000","0.006614000","10.1.1.2","0.006614000","51358  >  12002 [PSH, ACK] Seq=25221 Ack=1 Win=16120 Len=124","178","0.000000000","10.202.1.2","0.006614000","TCP"
"194","2.731568","2.731565000","0.170381000","0.006505000","10.1.1.2","0.170381000","51358  >  12002 [PSH, ACK] Seq=25345 Ack=1 Win=16120 Len=704","758","0.000000000","10.202.1.2","0.006505000","TCP"
"217","2.814104","2.814101000","0.082507000","0.007943000","10.1.1.2","0.082507000","51358  >  12002 [PSH, ACK] Seq=26049 Ack=1 Win=16120 Len=1460","1514","0.000000000","10.202.1.2","0.007943000","TCP"
"218","2.814107","2.814104000","0.000003000","0.000003000","10.1.1.2","0.000003000","51358  >  12002 [PSH, ACK] Seq=27509 Ack=1 Win=16120 Len=124","178","0.000000000","10.202.1.2","0.000003000","TCP"
"228","2.880674","2.418769000","0.617638000","0.045167000","10.1.1.2","0.617638000","51357  >  12003 [ACK] Seq=43801 Ack=28907 Win=65335 Len=1460","1514","0.000000000","10.202.1.2","0.045167000","TCP"
"230","2.881996","2.420091000","0.001243000","0.001243000","10.1.1.2","0.001243000","51357  >  12003 [ACK] Seq=45261 Ack=30367 Win=65335 Len=1460","1514","0.000000000","10.202.1.2","0.001243000","TCP"
"232","2.883327","2.421422000","0.001294000","0.001294000","10.1.1.2","0.001294000","51357  >  12003 [ACK] Seq=46721 Ack=30367 Win=65335 Len=1460","1514","0.000000000","10.202.1.2","0.001294000","TCP"
"233","2.883329","2.421424000","0.000002000","0.000002000","10.1.1.2","0.000002000","51357  >  12003 [PSH, ACK] Seq=48181 Ack=30367 Win=65335 Len=474","528","0.000000000","10.202.1.2","0.000002000","TCP"
"235","2.885990","2.424085000","0.002626000","0.002626000","10.1.1.2","0.002626000","51357  >  12003 [ACK] Seq=48655 Ack=33287 Win=65335 Len=1460","1514","0.000000000","10.202.1.2","0.002626000","TCP"
"236","2.885993","2.424088000","0.000003000","0.000003000","10.1.1.2","0.000003000","51357  >  12003 [ACK] Seq=50115 Ack=33287 Win=65335 Len=1460","1514","0.000000000","10.202.1.2","0.000003000","TCP"
"237","2.885995","2.424090000","0.000002000","0.000002000","10.1.1.2","0.000002000","51357  >  12003 [ACK] Seq=51575 Ack=33287 Win=65335 Len=1460","1514","0.000000000","10.202.1.2","0.000002000","TCP"
"239","2.889981","2.428076000","0.003940000","0.003940000","10.1.1.2","0.003940000","51357  >  12003 [ACK] Seq=53035 Ack=36207 Win=65335 Len=0","60","0.000000000","10.202.1.2","0.003940000","TCP"
"243","3.051066","3.051063000","0.236924000","0.153096000","10.1.1.2","0.236924000","51358  >  12002 [PSH, ACK] Seq=27633 Ack=1 Win=16120 Len=352","406","0.000000000","10.202.1.2","0.153096000","TCP"
"244","3.056386","3.056383000","0.005320000","0.005320000","10.1.1.2","0.005320000","51358  >  12002 [PSH, ACK] Seq=27985 Ack=1 Win=16120 Len=1460","1514","0.000000000","10.202.1.2","0.005320000","TCP"
"245","3.056389","3.056386000","0.000003000","0.000003000","10.1.1.2","0.000003000","51358  >  12002 [PSH, ACK] Seq=29445 Ack=1 Win=16120 Len=124","178","0.000000000","10.202.1.2","0.000003000","TCP"
"247","3.068368","2.606463000","0.178360000","0.011932000","10.1.1.2","0.178360000","51357  >  12003 [ACK] Seq=53035 Ack=37667 Win=65335 Len=1460","1514","0.000000000","10.202.1.2","0.011932000","TCP"
"248","3.068371","2.606466000","0.000003000","0.000003000","10.1.1.2","0.000003000","51357  >  12003 [ACK] Seq=54495 Ack=37667 Win=65335 Len=1460","1514","0.000000000","10.202.1.2","0.000003000","TCP"
"250","3.079015","2.617110000","0.010577000","0.010577000","10.1.1.2","0.010577000","51357  >  12003 [ACK] Seq=55955 Ack=39127 Win=65335 Len=1460","1514","0.000000000","10.202.1.2","0.010577000","TCP"
"251","3.079017","2.617112000","0.000002000","0.000002000","10.1.1.2","0.000002000","51357  >  12003 [ACK] Seq=57415 Ack=39127 Win=65335 Len=1460","1514","0.000000000","10.202.1.2","0.000002000","TCP"
"252","3.079019","2.617114000","0.000002000","0.000002000","10.1.1.2","0.000002000","51357  >  12003 [ACK] Seq=58875 Ack=39127 Win=65335 Len=1460","1514","0.000000000","10.202.1.2","0.000002000","TCP"
"258","3.359889","3.359886000","0.303453000","0.029283000","10.1.1.2","0.303453000","51358  >  12002 [PSH, ACK] Seq=29569 Ack=1 Win=16120 Len=1232","1286","0.000000000","10.202.1.2","0.029283000","TCP"
"259","3.359891","3.359888000","0.000002000","0.000002000","10.1.1.2","0.000002000","51358  >  12002 [ACK] Seq=30801 Ack=1 Win=16120 Len=1460","1514","0.000000000","10.202.1.2","0.000002000","TCP"
"260","3.359893","3.359890000","0.000002000","0.000002000","10.1.1.2","0.000002000","51358  >  12002 [PSH, ACK] Seq=32261 Ack=1 Win=16120 Len=124","178","0.000000000","10.202.1.2","0.000002000","TCP"
"266","3.543606","3.543603000","0.183670000","0.085034000","10.1.1.2","0.183670000","51358  >  12002 [PSH, ACK] Seq=32385 Ack=1 Win=16120 Len=1056","1110","0.000000000","10.202.1.2","0.085034000","TCP"
"272","3.618150","3.618147000","0.074544000","0.069171000","10.1.1.2","0.074544000","51358  >  12002 [PSH, ACK] Seq=33441 Ack=1 Win=16120 Len=880","934","0.000000000","10.202.1.2","0.069171000","TCP"
"288","3.690029","3.228124000","0.610960000","0.041226000","10.1.1.2","0.610960000","51357  >  12003 [ACK] Seq=60335 Ack=40587 Win=65335 Len=1460","1514","0.000000000","10.202.1.2","0.041226000","TCP"
"289","3.690031","3.228126000","0.000002000","0.000002000","10.1.1.2","0.000002000","51357  >  12003 [ACK] Seq=61795 Ack=42047 Win=65335 Len=1460","1514","0.000000000","10.202.1.2","0.000002000","TCP"
"291","3.692684","3.230779000","0.002595000","0.002595000","10.1.1.2","0.002595000","51357  >  12003 [ACK] Seq=63255 Ack=43507 Win=65335 Len=1460","1514","0.000000000","10.202.1.2","0.002595000","TCP"
"292","3.692686","3.230781000","0.000002000","0.000002000","10.1.1.2","0.000002000","51357  >  12003 [ACK] Seq=64715 Ack=43507 Win=65335 Len=1460","1514","0.000000000","10.202.1.2","0.000002000","TCP"
"293","3.692689","3.230784000","0.000003000","0.000003000","10.1.1.2","0.000003000","51357  >  12003 [ACK] Seq=66175 Ack=43507 Win=65335 Len=1460","1514","0.000000000","10.202.1.2","0.000003000","TCP"
"295","3.694015","3.232110000","0.001300000","0.001300000","10.1.1.2","0.001300000","51357  >  12003 [ACK] Seq=67635 Ack=43507 Win=65335 Len=1460","1514","0.000000000","10.202.1.2","0.001300000","TCP"
"296","3.694017","3.232112000","0.000002000","0.000002000","10.1.1.2","0.000002000","51357  >  12003 [ACK] Seq=69095 Ack=43507 Win=65335 Len=1460","1514","0.000000000","10.202.1.2","0.000002000","TCP"
"297","3.694018","3.232113000","0.000001000","0.000001000","10.1.1.2","0.000001000","51357  >  12003 [ACK] Seq=70555 Ack=46427 Win=65335 Len=0","60","0.000000000","10.202.1.2","0.000001000","TCP"
"298","3.694019","3.232114000","0.000001000","0.000001000","10.1.1.2","0.000001000","51357  >  12003 [ACK] Seq=70555 Ack=49347 Win=65335 Len=0","60","0.000000000","10.202.1.2","0.000001000","TCP"
"300","3.757921","3.757918000","0.139706000","0.063877000","10.1.1.2","0.139706000","51358  >  12002 [PSH, ACK] Seq=34321 Ack=1 Win=16120 Len=1460","1514","0.000000000","10.202.1.2","0.063877000","TCP"
"301","3.757924","3.757921000","0.000003000","0.000003000","10.1.1.2","0.000003000","51358  >  12002 [PSH, ACK] Seq=35781 Ack=1 Win=16120 Len=124","178","0.000000000","10.202.1.2","0.000003000","TCP"
"303","3.875057","3.413152000","0.181013000","0.117075000","10.1.1.2","0.181013000","51357  >  12003 [ACK] Seq=70555 Ack=50807 Win=65335 Len=1460","1514","0.000000000","10.202.1.2","0.117075000","TCP"
"305","3.876386","3.414481000","0.001278000","0.001278000","10.1.1.2","0.001278000","51357  >  12003 [ACK] Seq=72015 Ack=50807 Win=65335 Len=1460","1514","0.000000000","10.202.1.2","0.001278000","TCP"
"306","3.885712","3.423807000","0.009326000","0.009326000","10.1.1.2","0.009326000","51357  >  12003 [ACK] Seq=73475 Ack=52267 Win=65335 Len=1460","1514","0.000000000","10.202.1.2","0.009326000","TCP"
"307","3.885716","3.423811000","0.000004000","0.000004000","10.1.1.2","0.000004000","51357  >  12003 [ACK] Seq=74935 Ack=52267 Win=65335 Len=1460","1514","0.000000000","10.202.1.2","0.000004000","TCP"
"308","3.885719","3.423814000","0.000003000","0.000003000","10.1.1.2","0.000003000","51357  >  12003 [ACK] Seq=76395 Ack=52267 Win=65335 Len=1460","1514","0.000000000","10.202.1.2","0.000003000","TCP"
"311","3.934959","3.934956000","0.176977000","0.009393000","10.1.1.2","0.176977000","51358  >  12002 [PSH, ACK] Seq=35905 Ack=1 Win=16120 Len=1460","1514","0.000000000","10.202.1.2","0.009393000","TCP"
"312","3.934962","3.934959000","0.000003000","0.000003000","10.1.1.2","0.000003000","51358  >  12002 [PSH, ACK] Seq=37365 Ack=1 Win=16120 Len=95","149","0.000000000","10.202.1.2","0.000003000","TCP"
"316","4.163935","4.163932000","0.228922000","0.196892000","10.1.1.2","0.228922000","51358  >  12002 [PSH, ACK] Seq=37460 Ack=1 Win=16120 Len=352","406","0.000000000","10.202.1.2","0.196892000","TCP"
"317","4.165255","4.165252000","0.001320000","0.001320000","10.1.1.2","0.001320000","51358  >  12002 [ACK] Seq=37812 Ack=1 Win=16120 Len=1460","1514","0.000000000","10.202.1.2","0.001320000","TCP"
"318","4.165257","4.165254000","0.000002000","0.000002000","10.1.1.2","0.000002000","51358  >  12002 [PSH, ACK] Seq=39272 Ack=1 Win=16120 Len=124","178","0.000000000","10.202.1.2","0.000002000","TCP"
"326","4.422170","4.422167000","0.256865000","0.057204000","10.1.1.2","0.256865000","51358  >  12002 [PSH, ACK] Seq=39396 Ack=1 Win=16120 Len=1232","1286","0.000000000","10.202.1.2","0.057204000","TCP"
"340","4.474088","4.474085000","0.051918000","0.003940000","10.1.1.2","0.051918000","51358  >  12002 [PSH, ACK] Seq=40628 Ack=1 Win=16120 Len=1460","1514","0.000000000","10.202.1.2","0.003940000","TCP"
"341","4.474090","4.474087000","0.000002000","0.000002000","10.1.1.2","0.000002000","51358  >  12002 [PSH, ACK] Seq=42088 Ack=1 Win=16120 Len=124","178","0.000000000","10.202.1.2","0.000002000","TCP"
"343","4.496718","4.034813000","0.610943000","0.022595000","10.1.1.2","0.610943000","51357  >  12003 [ACK] Seq=77855 Ack=53727 Win=65335 Len=1460","1514","0.000000000","10.202.1.2","0.022595000","TCP"
"345","4.506050","4.044145000","0.009282000","0.009282000","10.1.1.2","0.009282000","51357  >  12003 [ACK] Seq=79315 Ack=53727 Win=65335 Len=1460","1514","0.000000000","10.202.1.2","0.009282000","TCP"
"346","4.506053","4.044148000","0.000003000","0.000003000","10.1.1.2","0.000003000","51357  >  12003 [ACK] Seq=80775 Ack=53727 Win=65335 Len=1460","1514","0.000000000","10.202.1.2","0.000003000","TCP"
"347","4.506055","4.044150000","0.000002000","0.000002000","10.1.1.2","0.000002000","51357  >  12003 [ACK] Seq=82235 Ack=56647 Win=65335 Len=1460","1514","0.000000000","10.202.1.2","0.000002000","TCP"
"348","4.506057","4.044152000","0.000002000","0.000002000","10.1.1.2","0.000002000","51357  >  12003 [ACK] Seq=83695 Ack=56647 Win=65335 Len=1460","1514","0.000000000","10.202.1.2","0.000002000","TCP"
"349","4.506061","4.044156000","0.000004000","0.000004000","10.1.1.2","0.000004000","51357  >  12003 [ACK] Seq=85155 Ack=56647 Win=65335 Len=1460","1514","0.000000000","10.202.1.2","0.000004000","TCP"
"350","4.506063","4.044158000","0.000002000","0.000002000","10.1.1.2","0.000002000","51357  >  12003 [ACK] Seq=86615 Ack=58107 Win=65335 Len=1460","1514","0.000000000","10.202.1.2","0.000002000","TCP"
"351","4.506065","4.044160000","0.000002000","0.000002000","10.1.1.2","0.000002000","51357  >  12003 [ACK] Seq=88075 Ack=58107 Win=65335 Len=1460","1514","0.000000000","10.202.1.2","0.000002000","TCP"
"352","4.506067","4.044162000","0.000002000","0.000002000","10.1.1.2","0.000002000","51357  >  12003 [ACK] Seq=89535 Ack=63947 Win=65335 Len=0","60","0.000000000","10.202.1.2","0.000002000","TCP"
"354","4.561955","4.561952000","0.087832000","0.055796000","10.1.1.2","0.087832000","51358  >  12002 [PSH, ACK] Seq=42212 Ack=1 Win=16120 Len=352","406","0.000000000","10.202.1.2","0.055796000","TCP"
"355","4.680434","4.218529000","0.174275000","0.118479000","10.1.1.2","0.174275000","51357  >  12003 [ACK] Seq=89535 Ack=65407 Win=65335 Len=1460","1514","0.000000000","10.202.1.2","0.118479000","TCP"
"357","4.691069","4.229164000","0.010562000","0.010562000","10.1.1.2","0.010562000","51357  >  12003 [ACK] Seq=90995 Ack=66867 Win=65335 Len=1460","1514","0.000000000","10.202.1.2","0.010562000","TCP"
"359","4.697729","4.235824000","0.006610000","0.006610000","10.1.1.2","0.006610000","51357  >  12003 [ACK] Seq=92455 Ack=66867 Win=65335 Len=1460","1514","0.000000000","10.202.1.2","0.006610000","TCP"
"360","4.697734","4.235829000","0.000005000","0.000005000","10.1.1.2","0.000005000","51357  >  12003 [ACK] Seq=93915 Ack=66867 Win=65335 Len=1460","1514","0.000000000","10.202.1.2","0.000005000","TCP"
"361","4.697736","4.235831000","0.000002000","0.000002000","10.1.1.2","0.000002000","51357  >  12003 [ACK] Seq=95375 Ack=66867 Win=65335 Len=1460","1514","0.000000000","10.202.1.2","0.000002000","TCP"
"363","4.699059","4.699056000","0.137104000","0.001284000","10.1.1.2","0.137104000","51358  >  12002 [PSH, ACK] Seq=42564 Ack=1 Win=16120 Len=1460","1514","0.000000000","10.202.1.2","0.001284000","TCP"
"364","4.699061","4.699058000","0.000002000","0.000002000","10.1.1.2","0.000002000","51358  >  12002 [PSH, ACK] Seq=44024 Ack=1 Win=16120 Len=124","178","0.000000000","10.202.1.2","0.000002000","TCP"
"370","4.876105","4.876102000","0.177006000","0.094517000","10.1.1.2","0.177006000","51358  >  12002 [PSH, ACK] Seq=44148 Ack=1 Win=16120 Len=1460","1514","0.000000000","10.202.1.2","0.094517000","TCP"
"371","4.884092","4.884089000","0.007987000","0.007987000","10.1.1.2","0.007987000","51358  >  12002 [PSH, ACK] Seq=45608 Ack=1 Win=16120 Len=124","178","0.000000000","10.202.1.2","0.007987000","TCP"
"373","5.054487","5.054484000","0.170364000","0.170364000","10.1.1.2","0.170364000","51358  >  12002 [PSH, ACK] Seq=45732 Ack=1 Win=16120 Len=1460","1514","0.000000000","10.202.1.2","0.170364000","TCP"
"374","5.054489","5.054486000","0.000002000","0.000002000","10.1.1.2","0.000002000","51358  >  12002 [PSH, ACK] Seq=47192 Ack=1 Win=16120 Len=124","178","0.000000000","10.202.1.2","0.000002000","TCP"
"390","5.278125","5.278122000","0.223592000","0.037238000","10.1.1.2","0.223592000","51358  >  12002 [PSH, ACK] Seq=47316 Ack=1 Win=16120 Len=352","406","0.000000000","10.202.1.2","0.037238000","TCP"
"391","5.278129","5.278126000","0.000004000","0.000004000","10.1.1.2","0.000004000","51358  >  12002 [ACK] Seq=47668 Ack=1 Win=16120 Len=1460","1514","0.000000000","10.202.1.2","0.000004000","TCP"
"392","5.278130","5.278127000","0.000001000","0.000001000","10.1.1.2","0.000001000","51358  >  12002 [PSH, ACK] Seq=49128 Ack=1 Win=16120 Len=124","178","0.000000000","10.202.1.2","0.000001000","TCP"
"402","5.316728","4.854823000","0.618953000","0.033243000","10.1.1.2","0.618953000","51357  >  12003 [ACK] Seq=96835 Ack=68327 Win=65335 Len=1460","1514","0.000000000","10.202.1.2","0.033243000","TCP"
"403","5.316731","4.854826000","0.000003000","0.000003000","10.1.1.2","0.000003000","[TCP Previous segment not captured] 51357  >  12003 [ACK] Seq=109975 Ack=80007 Win=65335 Len=0","60","0.000000000","10.202.1.2","0.000003000","TCP"
"405","5.318059","4.856154000","0.001260000","0.001260000","10.1.1.2","0.001260000","[TCP Out-Of-Order] 51357  >  12003 [ACK] Seq=98295 Ack=80007 Win=64605 Len=1460","1514","0.000000000","10.202.1.2","0.001260000","TCP"
"406","5.318061","4.856156000","0.000002000","0.000002000","10.1.1.2","0.000002000","[TCP Out-Of-Order] 51357  >  12003 [ACK] Seq=99755 Ack=80007 Win=64605 Len=1460","1514","0.000000000","10.202.1.2","0.000002000","TCP"
"408","5.322057","4.860152000","0.003960000","0.003960000","10.1.1.2","0.003960000","[TCP Retransmission] 51357  >  12003 [ACK] Seq=101215 Ack=80007 Win=64605 Len=1460","1514","0.000000000","10.202.1.2","0.003960000","TCP"
"409","5.322059","4.860154000","0.000002000","0.000002000","10.1.1.2","0.000002000","[TCP Retransmission] 51357  >  12003 [PSH, ACK] Seq=102675 Ack=80007 Win=64605 Len=1460","1514","0.000000000","10.202.1.2","0.000002000","TCP"
"410","5.322061","4.860156000","0.000002000","0.000002000","10.1.1.2","0.000002000","[TCP Retransmission] 51357  >  12003 [ACK] Seq=104135 Ack=80007 Win=64605 Len=1460","1514","0.000000000","10.202.1.2","0.000002000","TCP"
"411","5.322063","4.860158000","0.000002000","0.000002000","10.1.1.2","0.000002000","[TCP Retransmission] 51357  >  12003 [ACK] Seq=105595 Ack=80007 Win=64605 Len=1460","1514","0.000000000","10.202.1.2","0.000002000","TCP"
"412","5.322066","4.860161000","0.000003000","0.000003000","10.1.1.2","0.000003000","[TCP Retransmission] 51357  >  12003 [ACK] Seq=107055 Ack=80007 Win=64605 Len=1460","1514","0.000000000","10.202.1.2","0.000003000","TCP"
"413","5.322068","4.860163000","0.000002000","0.000002000","10.1.1.2","0.000002000","[TCP Retransmission] 51357  >  12003 [ACK] Seq=108515 Ack=80007 Win=64605 Len=1460","1514","0.000000000","10.202.1.2","0.000002000","TCP"
"415","5.487119","5.025214000","0.165012000","0.165012000","10.1.1.2","0.165012000","51357  >  12003 [ACK] Seq=109975 Ack=81467 Win=65335 Len=1460","1514","0.000000000","10.202.1.2","0.165012000","TCP"
"417","5.496434","5.034529000","0.009265000","0.009265000","10.1.1.2","0.009265000","51357  >  12003 [ACK] Seq=111435 Ack=82927 Win=65335 Len=1460","1514","0.000000000","10.202.1.2","0.009265000","TCP"
"419","5.511081","5.049176000","0.014609000","0.014609000","10.1.1.2","0.014609000","51357  >  12003 [ACK] Seq=112895 Ack=82927 Win=65335 Len=1460","1514","0.000000000","10.202.1.2","0.014609000","TCP"
"420","5.511084","5.049179000","0.000003000","0.000003000","10.1.1.2","0.000003000","51357  >  12003 [ACK] Seq=114355 Ack=82927 Win=65335 Len=1460","1514","0.000000000","10.202.1.2","0.000003000","TCP"
"421","5.511087","5.049182000","0.000003000","0.000003000","10.1.1.2","0.000003000","51357  >  12003 [ACK] Seq=115815 Ack=82927 Win=65335 Len=1460","1514","0.000000000","10.202.1.2","0.000003000","TCP"
"422","5.511089","5.511086000","0.232911000","0.000002000","10.1.1.2","0.232911000","51358  >  12002 [PSH, ACK] Seq=49252 Ack=1 Win=16120 Len=1232","1286","0.000000000","10.202.1.2","0.000002000","TCP"
"426","5.597605","5.597602000","0.086516000","0.017186000","10.1.1.2","0.086516000","51358  >  12002 [PSH, ACK] Seq=50484 Ack=1 Win=16120 Len=1460","1514","0.000000000","10.202.1.2","0.017186000","TCP"
"427","5.597608","5.597605000","0.000003000","0.000003000","10.1.1.2","0.000003000","51358  >  12002 [PSH, ACK] Seq=51944 Ack=1 Win=16120 Len=124","178","0.000000000","10.202.1.2","0.000003000","TCP"
"429","5.688126","5.688123000","0.090488000","0.090488000","10.1.1.2","0.090488000","51358  >  12002 [PSH, ACK] Seq=52068 Ack=1 Win=16120 Len=352","406","0.000000000","10.202.1.2","0.090488000","TCP"
"430","5.818596","5.818593000","0.130470000","0.130470000","10.1.1.2","0.130470000","51358  >  12002 [PSH, ACK] Seq=52420 Ack=1 Win=16120 Len=1460","1514","0.000000000","10.202.1.2","0.130470000","TCP"
"431","5.818600","5.818597000","0.000004000","0.000004000","10.1.1.2","0.000004000","51358  >  12002 [PSH, ACK] Seq=53880 Ack=1 Win=16120 Len=124","178","0.000000000","10.202.1.2","0.000004000","TCP"
"439","5.994299","5.994296000","0.175618000","0.005293000","10.1.1.2","0.175618000","51358  >  12002 [PSH, ACK] Seq=54004 Ack=1 Win=16120 Len=1460","1514","0.000000000","10.202.1.2","0.005293000","TCP"
"440","5.994301","5.994298000","0.000002000","0.000002000","10.1.1.2","0.000002000","51358  >  12002 [PSH, ACK] Seq=55464 Ack=1 Win=16120 Len=124","178","0.000000000","10.202.1.2","0.000002000","TCP"
"460","6.127430","5.665525000","0.616299000","0.034494000","10.1.1.2","0.616299000","51357  >  12003 [ACK] Seq=117275 Ack=84387 Win=65335 Len=1460","1514","0.000000000","10.202.1.2","0.034494000","TCP"
"461","6.127432","5.665527000","0.000002000","0.000002000","10.1.1.2","0.000002000","51357  >  12003 [ACK] Seq=118735 Ack=90227 Win=65335 Len=0","60","0.000000000","10.202.1.2","0.000002000","TCP"
"462","6.127433","5.665528000","0.000001000","0.000001000","10.1.1.2","0.000001000","51357  >  12003 [ACK] Seq=118735 Ack=96067 Win=65335 Len=1460","1514","0.000000000","10.202.1.2","0.000001000","TCP"
"463","6.127435","5.665530000","0.000002000","0.000002000","10.1.1.2","0.000002000","51357  >  12003 [ACK] Seq=120195 Ack=96067 Win=65335 Len=1460","1514","0.000000000","10.202.1.2","0.000002000","TCP"
"464","6.127437","5.665532000","0.000002000","0.000002000","10.1.1.2","0.000002000","51357  >  12003 [ACK] Seq=121655 Ack=96067 Win=65335 Len=1460","1514","0.000000000","10.202.1.2","0.000002000","TCP"
"466","6.128753","5.666848000","0.001209000","0.001209000","10.1.1.2","0.001209000","51357  >  12003 [ACK] Seq=123115 Ack=96067 Win=65335 Len=1460","1514","0.000000000","10.202.1.2","0.001209000","TCP"
"467","6.128755","5.666850000","0.000002000","0.000002000","10.1.1.2","0.000002000","51357  >  12003 [ACK] Seq=124575 Ack=96067 Win=65335 Len=1460","1514","0.000000000","10.202.1.2","0.000002000","TCP"
"468","6.128757","5.666852000","0.000002000","0.000002000","10.1.1.2","0.000002000","51357  >  12003 [ACK] Seq=126035 Ack=96067 Win=65335 Len=1460","1514","0.000000000","10.202.1.2","0.000002000","TCP"
"469","6.128759","5.666854000","0.000002000","0.000002000","10.1.1.2","0.000002000","51357  >  12003 [ACK] Seq=127495 Ack=96067 Win=65335 Len=1460","1514","0.000000000","10.202.1.2","0.000002000","TCP"
"470","6.128761","5.666856000","0.000002000","0.000002000","10.1.1.2","0.000002000","51357  >  12003 [ACK] Seq=128955 Ack=96067 Win=65335 Len=1460","1514","0.000000000","10.202.1.2","0.000002000","TCP"
"472","6.180677","6.180674000","0.186334000","0.051872000","10.1.1.2","0.186334000","51358  >  12002 [PSH, ACK] Seq=55588 Ack=1 Win=16120 Len=1460","1514","0.000000000","10.202.1.2","0.051872000","TCP"
"473","6.180684","6.180681000","0.000007000","0.000007000","10.1.1.2","0.000007000","51358  >  12002 [PSH, ACK] Seq=57048 Ack=1 Win=16120 Len=124","178","0.000000000","10.202.1.2","0.000007000","TCP"
"475","6.315124","5.853219000","0.186319000","0.134360000","10.1.1.2","0.186319000","51357  >  12003 [ACK] Seq=130415 Ack=97527 Win=65335 Len=1460","1514","0.000000000","10.202.1.2","0.134360000","TCP"
"477","6.316444","5.854539000","0.001231000","0.001231000","10.1.1.2","0.001231000","51357  >  12003 [ACK] Seq=131875 Ack=97527 Win=65335 Len=1460","1514","0.000000000","10.202.1.2","0.001231000","TCP"
"478","6.319111","5.857206000","0.002667000","0.002667000","10.1.1.2","0.002667000","51357  >  12003 [ACK] Seq=133335 Ack=100447 Win=65335 Len=1460","1514","0.000000000","10.202.1.2","0.002667000","TCP"
"479","6.319113","5.857208000","0.000002000","0.000002000","10.1.1.2","0.000002000","51357  >  12003 [ACK] Seq=134795 Ack=100447 Win=65335 Len=1460","1514","0.000000000","10.202.1.2","0.000002000","TCP"
"480","6.319115","5.857210000","0.000002000","0.000002000","10.1.1.2","0.000002000","51357  >  12003 [ACK] Seq=136255 Ack=100447 Win=65335 Len=1460","1514","0.000000000","10.202.1.2","0.000002000","TCP"
"481","6.319118","5.857213000","0.000003000","0.000003000","10.1.1.2","0.000003000","51357  >  12003 [ACK] Seq=137715 Ack=100447 Win=65335 Len=1460","1514","0.000000000","10.202.1.2","0.000003000","TCP"
"485","6.401636","6.401633000","0.220872000","0.003950000","10.1.1.2","0.220872000","51358  >  12002 [PSH, ACK] Seq=57172 Ack=1 Win=16120 Len=352","406","0.000000000","10.202.1.2","0.003950000","TCP"
"486","6.404303","6.404300000","0.002667000","0.002667000","10.1.1.2","0.002667000","51358  >  12002 [ACK] Seq=57524 Ack=1 Win=16120 Len=1460","1514","0.000000000","10.202.1.2","0.002667000","TCP"
"487","6.404305","6.404302000","0.000002000","0.000002000","10.1.1.2","0.000002000","51358  >  12002 [PSH, ACK] Seq=58984 Ack=1 Win=16120 Len=124","178","0.000000000","10.202.1.2","0.000002000","TCP"
"491","6.623949","6.623946000","0.219611000","0.218313000","10.1.1.2","0.219611000","51358  >  12002 [PSH, ACK] Seq=59108 Ack=1 Win=16120 Len=1232","1286","0.000000000","10.202.1.2","0.218313000","TCP"
"496","6.713138","6.713135000","0.089189000","0.019948000","10.1.1.2","0.089189000","51358  >  12002 [PSH, ACK] Seq=60340 Ack=1 Win=16120 Len=1460","1514","0.000000000","10.202.1.2","0.019948000","TCP"
"497","6.713140","6.713137000","0.000002000","0.000002000","10.1.1.2","0.000002000","51358  >  12002 [PSH, ACK] Seq=61800 Ack=1 Win=16120 Len=124","178","0.000000000","10.202.1.2","0.000002000","TCP"
"499","6.798345","6.798342000","0.085171000","0.085171000","10.1.1.2","0.085171000","51358  >  12002 [PSH, ACK] Seq=61924 Ack=1 Win=16120 Len=352","406","0.000000000","10.202.1.2","0.085171000","TCP"
"519","6.934113","6.934110000","0.135768000","0.018637000","10.1.1.2","0.135768000","51358  >  12002 [PSH, ACK] Seq=62276 Ack=1 Win=16120 Len=1460","1514","0.000000000","10.202.1.2","0.018637000","TCP"
"520","6.934116","6.934113000","0.000003000","0.000003000","10.1.1.2","0.000003000","51358  >  12002 [PSH, ACK] Seq=63736 Ack=1 Win=16120 Len=124","178","0.000000000","10.202.1.2","0.000003000","TCP"
"522","6.935447","6.473542000","0.616276000","0.001295000","10.1.1.2","0.616276000","51357  >  12003 [ACK] Seq=139175 Ack=101907 Win=65335 Len=1460","1514","0.000000000","10.202.1.2","0.001295000","TCP"
"523","6.935449","6.473544000","0.000002000","0.000002000","10.1.1.2","0.000002000","51357  >  12003 [ACK] Seq=140635 Ack=101907 Win=65335 Len=1460","1514","0.000000000","10.202.1.2","0.000002000","TCP"
"524","6.935451","6.473546000","0.000002000","0.000002000","10.1.1.2","0.000002000","51357  >  12003 [ACK] Seq=142095 Ack=101907 Win=65335 Len=1460","1514","0.000000000","10.202.1.2","0.000002000","TCP"
"525","6.935453","6.473548000","0.000002000","0.000002000","10.1.1.2","0.000002000","51357  >  12003 [ACK] Seq=143555 Ack=101907 Win=65335 Len=1460","1514","0.000000000","10.202.1.2","0.000002000","TCP"
"527","6.936777","6.474872000","0.001270000","0.001270000","10.1.1.2","0.001270000","51357  >  12003 [ACK] Seq=145015 Ack=113587 Win=64605 Len=1460","1514","0.000000000","10.202.1.2","0.001270000","TCP"
"528","6.936779","6.474874000","0.000002000","0.000002000","10.1.1.2","0.000002000","51357  >  12003 [ACK] Seq=146475 Ack=113587 Win=64605 Len=1460","1514","0.000000000","10.202.1.2","0.000002000","TCP"
"529","6.936781","6.474876000","0.000002000","0.000002000","10.1.1.2","0.000002000","51357  >  12003 [ACK] Seq=147935 Ack=113587 Win=64605 Len=1460","1514","0.000000000","10.202.1.2","0.000002000","TCP"
"531","6.938108","6.476203000","0.001278000","0.001278000","10.1.1.2","0.001278000","51357  >  12003 [ACK] Seq=149395 Ack=113587 Win=64605 Len=1460","1514","0.000000000","10.202.1.2","0.001278000","TCP"
"532","6.938110","6.476205000","0.000002000","0.000002000","10.1.1.2","0.000002000","51357  >  12003 [ACK] Seq=150855 Ack=113587 Win=64605 Len=1460","1514","0.000000000","10.202.1.2","0.000002000","TCP"
"533","6.938112","6.476207000","0.000002000","0.000002000","10.1.1.2","0.000002000","[TCP Window Update] 51357  >  12003 [ACK] Seq=152315 Ack=113587 Win=65335 Len=0","60","0.000000000","10.202.1.2","0.000002000","TCP"
"536","7.121808","7.121805000","0.187656000","0.005706000","10.1.1.2","0.187656000","51358  >  12002 [PSH, ACK] Seq=63860 Ack=1 Win=16120 Len=1460","1514","0.000000000","10.202.1.2","0.005706000","TCP"
"537","7.121811","7.121808000","0.000003000","0.000003000","10.1.1.2","0.000003000","51358  >  12002 [PSH, ACK] Seq=65320 Ack=1 Win=16120 Len=124","178","0.000000000","10.202.1.2","0.000003000","TCP"
"539","7.123140","6.661235000","0.184990000","0.001289000","10.1.1.2","0.184990000","51357  >  12003 [ACK] Seq=152315 Ack=115047 Win=65335 Len=1460","1514","0.000000000","10.202.1.2","0.001289000","TCP"
