"No.","Time","Time since first frame in this TCP stream","segment delta","Time delta from previous captured frame","Destination","Delta Time (conv)","Info","Length","Time shift for this packet","Source","Time delta from previous captured frame","Protocol"
"51","18.764119","0.406707000","0.406707000","0.002691000","10.1.1.2","0.406707000","51343  >  8800 [ACK] Seq=1 Ack=5841 Win=16425 Len=0","60","0.000000000","10.202.1.2","0.002691000","TCP"
"52","18.765449","0.408037000","0.001330000","0.001330000","10.1.1.2","0.001330000","51343  >  8800 [ACK] Seq=1 Ack=7542 Win=16425 Len=0","60","0.000000000","10.202.1.2","0.001330000","TCP"
"55","18.866632","0.000000000","0.000000000","0.053601000","10.1.1.2","0.000000000","51348  >  12003 [SYN] Seq=0 Win=8192 Len=0 MSS=1460 WS=4 SACK_PERM=1","66","0.000000000","10.202.1.2","0.053601000","TCP"
"60","19.272642","0.406010000","0.405907000","0.051915000","10.1.1.2","0.405907000","51348  >  12003 [ACK] Seq=1 Ack=1 Win=65700 Len=0","60","0.000000000","10.202.1.2","0.051915000","TCP"
"61","19.291277","0.424645000","0.018635000","0.018635000","10.1.1.2","0.018635000","51348  >  12003 [PSH, ACK] Seq=1 Ack=1 Win=65700 Len=313","367","0.000000000","10.202.1.2","0.018635000","TCP"
"70","19.942228","0.608015000","0.608015000","0.215604000","10.1.1.2","0.608015000","51347  >  12000 [ACK] Seq=1 Ack=709 Win=16425 Len=0","60","0.000000000","10.202.1.2","0.215604000","TCP"
"71","20.104622","1.237990000","0.413532000","0.162394000","10.1.1.2","0.413532000","51348  >  12003 [PSH, ACK] Seq=314 Ack=933 Win=64768 Len=126","180","0.000000000","10.202.1.2","0.162394000","TCP"
"77","20.521295","0.000000000","0.000000000","0.182314000","10.1.1.2","0.000000000","51349  >  12001 [SYN] Seq=0 Win=8192 Len=0 MSS=1460 WS=4 SACK_PERM=1","66","0.000000000","10.202.1.2","0.182314000","TCP"
"78","20.521298","0.000000000","0.000000000","0.000003000","10.1.1.2","0.000000000","51350  >  12002 [SYN] Seq=0 Win=8192 Len=0 MSS=1460 WS=4 SACK_PERM=1","66","0.000000000","10.202.1.2","0.000003000","TCP"
"86","20.924642","0.403347000","0.403179000","0.209007000","10.1.1.2","0.403179000","51349  >  12001 [ACK] Seq=1 Ack=1 Win=65700 Len=0","60","0.000000000","10.202.1.2","0.209007000","TCP"
"87","20.925964","0.404666000","0.404413000","0.001322000","10.1.1.2","0.404413000","51350  >  12002 [ACK] Seq=1 Ack=1 Win=65700 Len=0","60","0.000000000","10.202.1.2","0.001322000","TCP"
"91","20.944598","0.423300000","0.018634000","0.003990000","10.1.1.2","0.018634000","51350  >  12002 [PSH, ACK] Seq=1 Ack=1 Win=65700 Len=313","367","0.000000000","10.202.1.2","0.003990000","TCP"
"92","20.945929","0.424634000","0.021287000","0.001331000","10.1.1.2","0.021287000","51349  >  12001 [PSH, ACK] Seq=1 Ack=1 Win=65700 Len=313","367","0.000000000","10.202.1.2","0.001331000","TCP"
"99","21.029795","2.163163000","0.918579000","0.008627000","10.1.1.2","0.918579000","51348  >  12003 [ACK] Seq=440 Ack=1259 Win=64440 Len=1460","1514","0.000000000","10.202.1.2","0.008627000","TCP"
"100","21.029798","2.163166000","0.000003000","0.000003000","10.1.1.2","0.000003000","51348  >  12003 [ACK] Seq=1900 Ack=1259 Win=64440 Len=1460","1514","0.000000000","10.202.1.2","0.000003000","TCP"
"105","21.390546","0.869251000","0.418508000","0.327442000","10.1.1.2","0.418508000","51349  >  12001 [PSH, ACK] Seq=314 Ack=933 Win=64768 Len=126","180","0.000000000","10.202.1.2","0.327442000","TCP"
"106","21.390547","0.869249000","0.410276000","0.000001000","10.1.1.2","0.410276000","51350  >  12002 [PSH, ACK] Seq=314 Ack=933 Win=64768 Len=126","180","0.000000000","10.202.1.2","0.000001000","TCP"
"109","21.434473","2.567841000","0.404630000","0.031740000","10.1.1.2","0.404630000","51348  >  12003 [ACK] Seq=3360 Ack=1259 Win=64440 Len=1460","1514","0.000000000","10.202.1.2","0.031740000","TCP"
"110","21.435805","2.569173000","0.001332000","0.001332000","10.1.1.2","0.001332000","51348  >  12003 [ACK] Seq=4820 Ack=1259 Win=64440 Len=1460","1514","0.000000000","10.202.1.2","0.001332000","TCP"
"111","21.435807","2.569175000","0.000002000","0.000002000","10.1.1.2","0.000002000","51348  >  12003 [ACK] Seq=6280 Ack=1259 Win=64440 Len=1460","1514","0.000000000","10.202.1.2","0.000002000","TCP"
"112","21.435809","2.569177000","0.000002000","0.000002000","10.1.1.2","0.000002000","51348  >  12003 [ACK] Seq=7740 Ack=1259 Win=64440 Len=1460","1514","0.000000000","10.202.1.2","0.000002000","TCP"
"124","21.869775","3.003143000","0.433940000","0.009312000","10.1.1.2","0.433940000","51348  >  12003 [ACK] Seq=9200 Ack=1259 Win=64440 Len=1460","1514","0.000000000","10.202.1.2","0.009312000","TCP"
"125","21.869778","3.003146000","0.000003000","0.000003000","10.1.1.2","0.000003000","51348  >  12003 [PSH, ACK] Seq=10660 Ack=1259 Win=64440 Len=1106","1160","0.000000000","10.202.1.2","0.000003000","TCP"
"133","21.941656","1.420358000","0.538923000","0.011980000","10.1.1.2","0.538923000","51350  >  12002 [PSH, ACK] Seq=440 Ack=1219 Win=64480 Len=575","629","0.000000000","10.202.1.2","0.011980000","TCP"
"134","22.002894","1.481599000","0.605773000","0.061238000","10.1.1.2","0.605773000","51349  >  12001 [ACK] Seq=440 Ack=1219 Win=64480 Len=0","60","0.000000000","10.202.1.2","0.061238000","TCP"
"135","22.041491","1.520196000","0.038597000","0.038597000","10.1.1.2","0.038597000","51349  >  12001 [PSH, ACK] Seq=440 Ack=1219 Win=64480 Len=172","226","0.000000000","10.202.1.2","0.038597000","TCP"
"137","22.068116","1.546818000","0.126460000","0.005811000","10.1.1.2","0.126460000","51350  >  12002 [PSH, ACK] Seq=1015 Ack=1219 Win=64480 Len=1460","1514","0.000000000","10.202.1.2","0.005811000","TCP"
"138","22.068119","1.546821000","0.000003000","0.000003000","10.1.1.2","0.000003000","51350  >  12002 [PSH, ACK] Seq=2475 Ack=1219 Win=64480 Len=95","149","0.000000000","10.202.1.2","0.000003000","TCP"
"143","22.247824","1.726526000","0.179676000","0.004860000","10.1.1.2","0.179676000","51350  >  12002 [PSH, ACK] Seq=2570 Ack=1219 Win=64480 Len=1229","1283","0.000000000","10.202.1.2","0.004860000","TCP"
"144","22.323704","3.457072000","0.405786000","0.075880000","10.1.1.2","0.405786000","51348  >  12003 [ACK] Seq=11766 Ack=4179 Win=65700 Len=0","60","0.000000000","10.202.1.2","0.075880000","TCP"
"149","22.472805","1.951507000","0.028632000","0.028632000","10.1.1.2","0.028632000","51350  >  12002 [PSH, ACK] Seq=3799 Ack=1219 Win=64480 Len=1460","1514","0.000000000","10.202.1.2","0.028632000","TCP"
"150","22.472809","1.951511000","0.000004000","0.000004000","10.1.1.2","0.000004000","51350  >  12002 [PSH, ACK] Seq=5259 Ack=1219 Win=64480 Len=655","709","0.000000000","10.202.1.2","0.000004000","TCP"
"152","22.627230","2.105932000","0.154358000","0.154358000","10.1.1.2","0.154358000","51350  >  12002 [PSH, ACK] Seq=5914 Ack=1219 Win=64480 Len=1460","1514","0.000000000","10.202.1.2","0.154358000","TCP"
"153","22.627235","2.105937000","0.000005000","0.000005000","10.1.1.2","0.000005000","51350  >  12002 [PSH, ACK] Seq=7374 Ack=1219 Win=64480 Len=124","178","0.000000000","10.202.1.2","0.000005000","TCP"
"156","22.729713","3.863081000","0.405969000","0.035936000","10.1.1.2","0.405969000","51348  >  12003 [ACK] Seq=11766 Ack=10019 Win=65700 Len=0","60","0.000000000","10.202.1.2","0.035936000","TCP"
"160","22.805590","2.284292000","0.178284000","0.066538000","10.1.1.2","0.178284000","51350  >  12002 [PSH, ACK] Seq=7498 Ack=1219 Win=64480 Len=561","615","0.000000000","10.202.1.2","0.066538000","TCP"
"161","22.870821","2.349523000","0.065231000","0.065231000","10.1.1.2","0.065231000","51350  >  12002 [PSH, ACK] Seq=8059 Ack=1219 Win=64480 Len=1460","1514","0.000000000","10.202.1.2","0.065231000","TCP"
"162","22.870823","2.349525000","0.000002000","0.000002000","10.1.1.2","0.000002000","51350  >  12002 [PSH, ACK] Seq=9519 Ack=1219 Win=64480 Len=91","145","0.000000000","10.202.1.2","0.000002000","TCP"
"164","23.031905","2.510607000","0.161053000","0.161053000","10.1.1.2","0.161053000","51350  >  12002 [PSH, ACK] Seq=9610 Ack=1219 Win=64480 Len=1408","1462","0.000000000","10.202.1.2","0.161053000","TCP"
"165","23.135726","4.269094000","0.405982000","0.103821000","10.1.1.2","0.405982000","51348  >  12003 [ACK] Seq=11766 Ack=12610 Win=65700 Len=0","60","0.000000000","10.202.1.2","0.103821000","TCP"
"167","23.206279","2.684981000","0.174374000","0.062570000","10.1.1.2","0.174374000","51350  >  12002 [PSH, ACK] Seq=11018 Ack=1219 Win=64480 Len=1460","1514","0.000000000","10.202.1.2","0.062570000","TCP"
"168","23.206281","2.684983000","0.000002000","0.000002000","10.1.1.2","0.000002000","51350  >  12002 [PSH, ACK] Seq=12478 Ack=1219 Win=64480 Len=124","178","0.000000000","10.202.1.2","0.000002000","TCP"
"169","23.206282","4.339650000","0.070556000","0.000001000","10.1.1.2","0.070556000","51348  >  12003 [PSH, ACK] Seq=11766 Ack=12610 Win=65700 Len=106","160","0.000000000","10.202.1.2","0.000001000","TCP"
"172","23.278160","2.756862000","0.071836000","0.065228000","10.1.1.2","0.071836000","51350  >  12002 [PSH, ACK] Seq=12602 Ack=1219 Win=64480 Len=528","582","0.000000000","10.202.1.2","0.065228000","TCP"
"173","23.323421","3.989208000","3.381193000","0.045261000","10.1.1.2","3.381193000","51347  >  12000 [PSH, ACK] Seq=1 Ack=709 Win=16425 Len=136","190","0.000000000","10.202.1.2","0.045261000","TCP"
"177","23.449885","2.928587000","0.171725000","0.036908000","10.1.1.2","0.171725000","51350  >  12002 [PSH, ACK] Seq=13130 Ack=1219 Win=64480 Len=1460","1514","0.000000000","10.202.1.2","0.036908000","TCP"
"178","23.449888","2.928590000","0.000003000","0.000003000","10.1.1.2","0.000003000","51350  >  12002 [PSH, ACK] Seq=14590 Ack=1219 Win=64480 Len=124","178","0.000000000","10.202.1.2","0.000003000","TCP"
"180","23.610960","3.089662000","0.161027000","0.161027000","10.1.1.2","0.161027000","51350  >  12002 [PSH, ACK] Seq=14714 Ack=1219 Win=64480 Len=1408","1462","0.000000000","10.202.1.2","0.161027000","TCP"
"181","23.757394","4.890762000","0.344417000","0.146434000","10.1.1.2","0.344417000","51348  >  12003 [PSH, ACK] Seq=11872 Ack=12610 Win=65700 Len=1460","1514","0.000000000","10.202.1.2","0.146434000","TCP"
"182","23.758723","4.892091000","0.001329000","0.001329000","10.1.1.2","0.001329000","51348  >  12003 [ACK] Seq=13332 Ack=12610 Win=65700 Len=1460","1514","0.000000000","10.202.1.2","0.001329000","TCP"
"183","23.758725","4.892093000","0.000002000","0.000002000","10.1.1.2","0.000002000","51348  >  12003 [ACK] Seq=14792 Ack=12610 Win=65700 Len=1460","1514","0.000000000","10.202.1.2","0.000002000","TCP"
"186","23.760056","4.893424000","0.001291000","0.001018000","10.1.1.2","0.001291000","51348  >  12003 [ACK] Seq=16252 Ack=12610 Win=65700 Len=1460","1514","0.000000000","10.202.1.2","0.001018000","TCP"
"187","23.760059","4.893427000","0.000003000","0.000003000","10.1.1.2","0.000003000","51348  >  12003 [ACK] Seq=17712 Ack=12610 Win=65700 Len=1460","1514","0.000000000","10.202.1.2","0.000003000","TCP"
"188","23.760063","4.893431000","0.000004000","0.000004000","10.1.1.2","0.000004000","51348  >  12003 [ACK] Seq=19172 Ack=12610 Win=65700 Len=1460","1514","0.000000000","10.202.1.2","0.000004000","TCP"
"189","23.760064","4.893432000","0.000001000","0.000001000","10.1.1.2","0.000001000","51348  >  12003 [ACK] Seq=20632 Ack=12610 Win=65700 Len=1460","1514","0.000000000","10.202.1.2","0.000001000","TCP"
"190","23.760066","4.893434000","0.000002000","0.000002000","10.1.1.2","0.000002000","51348  >  12003 [ACK] Seq=22092 Ack=12610 Win=65700 Len=1460","1514","0.000000000","10.202.1.2","0.000002000","TCP"
"191","23.760068","4.893436000","0.000002000","0.000002000","10.1.1.2","0.000002000","51348  >  12003 [ACK] Seq=23552 Ack=12610 Win=65700 Len=1460","1514","0.000000000","10.202.1.2","0.000002000","TCP"
"192","23.760070","4.893438000","0.000002000","0.000002000","10.1.1.2","0.000002000","51348  >  12003 [PSH, ACK] Seq=25012 Ack=12610 Win=65700 Len=998","1052","0.000000000","10.202.1.2","0.000002000","TCP"
"194","23.786681","3.265383000","0.175721000","0.026565000","10.1.1.2","0.175721000","51350  >  12002 [PSH, ACK] Seq=16122 Ack=1219 Win=64480 Len=1460","1514","0.000000000","10.202.1.2","0.026565000","TCP"
"195","23.786684","3.265386000","0.000003000","0.000003000","10.1.1.2","0.000003000","51350  >  12002 [PSH, ACK] Seq=17582 Ack=1219 Win=64480 Len=95","149","0.000000000","10.202.1.2","0.000003000","TCP"
"215","23.891848","3.370550000","0.105116000","0.072753000","10.1.1.2","0.105116000","51350  >  12002 [PSH, ACK] Seq=17677 Ack=1219 Win=64480 Len=704","758","0.000000000","10.202.1.2","0.072753000","TCP"
"216","23.935769","4.601556000","0.608786000","0.043921000","10.1.1.2","0.608786000","51347  >  12000 [ACK] Seq=137 Ack=910 Win=16374 Len=0","60","0.000000000","10.202.1.2","0.043921000","TCP"
"218","24.047588","3.526290000","0.155740000","0.055999000","10.1.1.2","0.155740000","51350  >  12002 [PSH, ACK] Seq=18381 Ack=1219 Win=64480 Len=1460","1514","0.000000000","10.202.1.2","0.055999000","TCP"
"219","24.047591","3.526293000","0.000003000","0.000003000","10.1.1.2","0.000003000","51350  >  12002 [PSH, ACK] Seq=19841 Ack=1219 Win=64480 Len=124","178","0.000000000","10.202.1.2","0.000003000","TCP"
"221","24.164730","5.298098000","0.353780000","0.117103000","10.1.1.2","0.353780000","51348  >  12003 [PSH, ACK] Seq=26010 Ack=12610 Win=65700 Len=327","381","0.000000000","10.202.1.2","0.117103000","TCP"
"223","24.190019","3.668721000","0.142392000","0.008967000","10.1.1.2","0.142392000","51350  >  12002 [PSH, ACK] Seq=19965 Ack=1219 Win=64480 Len=1232","1286","0.000000000","10.202.1.2","0.008967000","TCP"
"228","24.220638","5.354006000","0.055908000","0.018635000","10.1.1.2","0.055908000","51348  >  12003 [PSH, ACK] Seq=26337 Ack=15530 Win=65700 Len=121","175","0.000000000","10.202.1.2","0.018635000","TCP"
"231","24.223300","5.356668000","0.002633000","0.001672000","10.1.1.2","0.002633000","51348  >  12003 [ACK] Seq=26458 Ack=26475 Win=63512 Len=0","60","0.000000000","10.202.1.2","0.001672000","TCP"
"232","24.223301","5.356669000","0.000001000","0.000001000","10.1.1.2","0.000001000","[TCP Window Update] 51348  >  12003 [ACK] Seq=26458 Ack=26475 Win=65700 Len=0","60","0.000000000","10.202.1.2","0.000001000","TCP"
"234","24.243268","3.721973000","0.454933000","0.015976000","10.1.1.2","0.454933000","51349  >  12001 [PSH, ACK] Seq=612 Ack=1391 Win=64308 Len=342","396","0.000000000","10.202.1.2","0.015976000","TCP"
"240","24.280541","3.759246000","0.037241000","0.011948000","10.1.1.2","0.037241000","51349  >  12001 [ACK] Seq=954 Ack=1391 Win=64308 Len=1460","1514","0.000000000","10.202.1.2","0.011948000","TCP"
"241","24.281872","3.760577000","0.001331000","0.001331000","10.1.1.2","0.001331000","51349  >  12001 [ACK] Seq=2414 Ack=1391 Win=64308 Len=1460","1514","0.000000000","10.202.1.2","0.001331000","TCP"
"244","24.368403","3.847105000","0.178384000","0.016471000","10.1.1.2","0.178384000","51350  >  12002 [PSH, ACK] Seq=21197 Ack=1219 Win=64480 Len=1460","1514","0.000000000","10.202.1.2","0.016471000","TCP"
"246","24.371063","3.849765000","0.002613000","0.002613000","10.1.1.2","0.002613000","51350  >  12002 [PSH, ACK] Seq=22657 Ack=1219 Win=64480 Len=124","178","0.000000000","10.202.1.2","0.002613000","TCP"
"249","24.450945","3.929647000","0.079882000","0.055807000","10.1.1.2","0.079882000","51350  >  12002 [PSH, ACK] Seq=22781 Ack=1219 Win=64480 Len=704","758","0.000000000","10.202.1.2","0.055807000","TCP"
"255","24.627980","4.106682000","0.176983000","0.002663000","10.1.1.2","0.176983000","51350  >  12002 [PSH, ACK] Seq=23485 Ack=1219 Win=64480 Len=1460","1514","0.000000000","10.202.1.2","0.002663000","TCP"
"256","24.629311","4.108013000","0.001331000","0.001331000","10.1.1.2","0.001331000","51350  >  12002 [PSH, ACK] Seq=24945 Ack=1219 Win=64480 Len=124","178","0.000000000","10.202.1.2","0.001331000","TCP"
"257","24.629312","5.762680000","0.406011000","0.000001000","10.1.1.2","0.406011000","51348  >  12003 [PSH, ACK] Seq=26458 Ack=26596 Win=65576 Len=594","648","0.000000000","10.202.1.2","0.000001000","TCP"
"268","24.686552","4.165257000","0.037602000","0.013311000","10.1.1.2","0.037602000","51349  >  12001 [PSH, ACK] Seq=3874 Ack=1755 Win=65700 Len=1460","1514","0.000000000","10.202.1.2","0.013311000","TCP"
"271","24.687886","4.166591000","0.001302000","0.000322000","10.1.1.2","0.001302000","51349  >  12001 [PSH, ACK] Seq=5334 Ack=1755 Win=65700 Len=1460","1514","0.000000000","10.202.1.2","0.000322000","TCP"
"272","24.687888","4.166593000","0.000002000","0.000002000","10.1.1.2","0.000002000","51349  >  12001 [PSH, ACK] Seq=6794 Ack=1755 Win=65700 Len=1460","1514","0.000000000","10.202.1.2","0.000002000","TCP"
"273","24.687889","4.166594000","0.000001000","0.000001000","10.1.1.2","0.000001000","51349  >  12001 [PSH, ACK] Seq=8254 Ack=1755 Win=65700 Len=1460","1514","0.000000000","10.202.1.2","0.000001000","TCP"
"276","24.775740","4.254442000","0.146396000","0.005814000","10.1.1.2","0.146396000","51350  >  12002 [PSH, ACK] Seq=25069 Ack=1219 Win=64480 Len=1232","1286","0.000000000","10.202.1.2","0.005814000","TCP"
"279","24.872917","4.351619000","0.097177000","0.073180000","10.1.1.2","0.097177000","51350  >  12002 [PSH, ACK] Seq=26301 Ack=1219 Win=64480 Len=704","758","0.000000000","10.202.1.2","0.073180000","TCP"
"284","25.027348","4.506050000","0.154406000","0.047876000","10.1.1.2","0.154406000","51350  >  12002 [PSH, ACK] Seq=27005 Ack=1219 Win=64480 Len=1460","1514","0.000000000","10.202.1.2","0.047876000","TCP"
"285","25.027352","4.506054000","0.000004000","0.000004000","10.1.1.2","0.000004000","51350  >  12002 [PSH, ACK] Seq=28465 Ack=1219 Win=64480 Len=124","178","0.000000000","10.202.1.2","0.000004000","TCP"
"287","25.033991","6.167359000","0.404633000","0.006570000","10.1.1.2","0.404633000","51348  >  12003 [PSH, ACK] Seq=27052 Ack=26717 Win=65456 Len=121","175","0.000000000","10.202.1.2","0.006570000","TCP"
"291","25.055294","4.533999000","0.367377000","0.017966000","10.1.1.2","0.367377000","51349  >  12001 [ACK] Seq=9714 Ack=5306 Win=65700 Len=0","60","0.000000000","10.202.1.2","0.017966000","TCP"
"308","25.096562","4.575267000","0.002783000","0.002650000","10.1.1.2","0.002783000","51349  >  12001 [ACK] Seq=9714 Ack=6429 Win=64576 Len=1460","1514","0.000000000","10.202.1.2","0.002650000","TCP"
"309","25.096564","4.575269000","0.000002000","0.000002000","10.1.1.2","0.000002000","51349  >  12001 [ACK] Seq=11174 Ack=6429 Win=64576 Len=1460","1514","0.000000000","10.202.1.2","0.000002000","TCP"
"310","25.096566","4.575271000","0.000002000","0.000002000","10.1.1.2","0.000002000","51349  >  12001 [ACK] Seq=12634 Ack=6429 Win=64576 Len=1460","1514","0.000000000","10.202.1.2","0.000002000","TCP"
"311","25.096567","4.575272000","0.000001000","0.000001000","10.1.1.2","0.000001000","51349  >  12001 [ACK] Seq=14094 Ack=6429 Win=64576 Len=1460","1514","0.000000000","10.202.1.2","0.000001000","TCP"
"312","25.096569","4.575274000","0.000002000","0.000002000","10.1.1.2","0.000002000","51349  >  12001 [ACK] Seq=15554 Ack=6429 Win=64576 Len=1460","1514","0.000000000","10.202.1.2","0.000002000","TCP"
"313","25.096573","4.575278000","0.000004000","0.000004000","10.1.1.2","0.000004000","51349  >  12001 [ACK] Seq=17014 Ack=6429 Win=64576 Len=1460","1514","0.000000000","10.202.1.2","0.000004000","TCP"
"314","25.096574","4.575279000","0.000001000","0.000001000","10.1.1.2","0.000001000","51349  >  12001 [ACK] Seq=18474 Ack=6429 Win=64576 Len=1460","1514","0.000000000","10.202.1.2","0.000001000","TCP"
"315","25.096576","4.575281000","0.000002000","0.000002000","10.1.1.2","0.000002000","51349  >  12001 [ACK] Seq=19934 Ack=6429 Win=64576 Len=1460","1514","0.000000000","10.202.1.2","0.000002000","TCP"
"323","25.207044","4.685746000","0.179623000","0.001308000","10.1.1.2","0.179623000","51350  >  12002 [PSH, ACK] Seq=28589 Ack=1219 Win=64480 Len=1460","1514","0.000000000","10.202.1.2","0.001308000","TCP"
"324","25.207047","4.685749000","0.000003000","0.000003000","10.1.1.2","0.000003000","51350  >  12002 [PSH, ACK] Seq=30049 Ack=1219 Win=64480 Len=124","178","0.000000000","10.202.1.2","0.000003000","TCP"
"326","25.276266","4.754968000","0.069192000","0.069192000","10.1.1.2","0.069192000","51350  >  12002 [PSH, ACK] Seq=30173 Ack=1219 Win=64480 Len=528","582","0.000000000","10.202.1.2","0.069192000","TCP"
"329","25.432014","4.910716000","0.155748000","0.053246000","10.1.1.2","0.155748000","51350  >  12002 [PSH, ACK] Seq=30701 Ack=1219 Win=64480 Len=1408","1462","0.000000000","10.202.1.2","0.053246000","TCP"
"331","25.441332","6.574700000","0.404004000","0.009292000","10.1.1.2","0.404004000","51348  >  12003 [PSH, ACK] Seq=27173 Ack=27310 Win=64864 Len=715","769","0.000000000","10.202.1.2","0.009292000","TCP"
"335","25.461300","4.940005000","0.364600000","0.015943000","10.1.1.2","0.364600000","51349  >  12001 [ACK] Seq=21394 Ack=8838 Win=65700 Len=0","60","0.000000000","10.202.1.2","0.015943000","TCP"
"353","25.507895","4.986600000","0.046560000","0.007958000","10.1.1.2","0.046560000","51349  >  12001 [ACK] Seq=21394 Ack=14678 Win=65700 Len=1460","1514","0.000000000","10.202.1.2","0.007958000","TCP"
"354","25.507897","4.986602000","0.000002000","0.000002000","10.1.1.2","0.000002000","51349  >  12001 [ACK] Seq=22854 Ack=14678 Win=65700 Len=1460","1514","0.000000000","10.202.1.2","0.000002000","TCP"
"355","25.507899","4.986604000","0.000002000","0.000002000","10.1.1.2","0.000002000","51349  >  12001 [ACK] Seq=24314 Ack=14678 Win=65700 Len=1460","1514","0.000000000","10.202.1.2","0.000002000","TCP"
"356","25.507901","4.986606000","0.000002000","0.000002000","10.1.1.2","0.000002000","51349  >  12001 [ACK] Seq=25774 Ack=14678 Win=65700 Len=1460","1514","0.000000000","10.202.1.2","0.000002000","TCP"
"357","25.507903","4.986608000","0.000002000","0.000002000","10.1.1.2","0.000002000","51349  >  12001 [ACK] Seq=27234 Ack=14678 Win=65700 Len=1460","1514","0.000000000","10.202.1.2","0.000002000","TCP"
"358","25.507905","4.986610000","0.000002000","0.000002000","10.1.1.2","0.000002000","51349  >  12001 [ACK] Seq=28694 Ack=14678 Win=65700 Len=1460","1514","0.000000000","10.202.1.2","0.000002000","TCP"
"361","25.509227","4.987932000","0.001213000","0.001213000","10.1.1.2","0.001213000","51349  >  12001 [ACK] Seq=30154 Ack=14678 Win=65700 Len=1460","1514","0.000000000","10.202.1.2","0.001213000","TCP"
"362","25.509230","4.987935000","0.000003000","0.000003000","10.1.1.2","0.000003000","51349  >  12001 [ACK] Seq=31614 Ack=14678 Win=65700 Len=1460","1514","0.000000000","10.202.1.2","0.000003000","TCP"
"363","25.509231","4.987936000","0.000001000","0.000001000","10.1.1.2","0.000001000","51349  >  12001 [PSH, ACK] Seq=33074 Ack=14678 Win=65700 Len=1460","1514","0.000000000","10.202.1.2","0.000001000","TCP"
"364","25.509233","4.987938000","0.000002000","0.000002000","10.1.1.2","0.000002000","51349  >  12001 [ACK] Seq=34534 Ack=14678 Win=65700 Len=1460","1514","0.000000000","10.202.1.2","0.000002000","TCP"
"365","25.509235","4.987940000","0.000002000","0.000002000","10.1.1.2","0.000002000","51349  >  12001 [ACK] Seq=35994 Ack=14678 Win=65700 Len=1460","1514","0.000000000","10.202.1.2","0.000002000","TCP"
"366","25.509237","4.987942000","0.000002000","0.000002000","10.1.1.2","0.000002000","51349  >  12001 [ACK] Seq=37454 Ack=14678 Win=65700 Len=1460","1514","0.000000000","10.202.1.2","0.000002000","TCP"
"378","25.607741","5.086443000","0.175701000","0.031905000","10.1.1.2","0.175701000","51350  >  12002 [PSH, ACK] Seq=32109 Ack=1219 Win=64480 Len=1460","1514","0.000000000","10.202.1.2","0.031905000","TCP"
"379","25.607744","5.086446000","0.000003000","0.000003000","10.1.1.2","0.000003000","51350  >  12002 [PSH, ACK] Seq=33569 Ack=1219 Win=64480 Len=124","178","0.000000000","10.202.1.2","0.000003000","TCP"
"386","25.788770","5.267472000","0.180974000","0.003954000","10.1.1.2","0.180974000","51350  >  12002 [PSH, ACK] Seq=33693 Ack=1219 Win=64480 Len=1460","1514","0.000000000","10.202.1.2","0.003954000","TCP"
"387","25.788772","5.267474000","0.000002000","0.000002000","10.1.1.2","0.000002000","51350  >  12002 [PSH, ACK] Seq=35153 Ack=1219 Win=64480 Len=124","178","0.000000000","10.202.1.2","0.000002000","TCP"
"389","25.840688","5.319390000","0.051888000","0.051888000","10.1.1.2","0.051888000","51350  >  12002 [PSH, ACK] Seq=35277 Ack=1219 Win=64480 Len=352","406","0.000000000","10.202.1.2","0.051888000","TCP"
"391","25.869973","5.348678000","0.360619000","0.014643000","10.1.1.2","0.360619000","51349  >  12001 [ACK] Seq=38914 Ack=20518 Win=65700 Len=0","60","0.000000000","10.202.1.2","0.014643000","TCP"
"392","25.872635","7.006003000","0.431271000","0.002662000","10.1.1.2","0.431271000","51348  >  12003 [PSH, ACK] Seq=27888 Ack=27431 Win=64744 Len=594","648","0.000000000","10.202.1.2","0.002662000","TCP"
"425","25.913904","5.392609000","0.043931000","0.007867000","10.1.1.2","0.043931000","51349  >  12001 [ACK] Seq=38914 Ack=21978 Win=65700 Len=1460","1514","0.000000000","10.202.1.2","0.007867000","TCP"
"426","25.913906","5.392611000","0.000002000","0.000002000","10.1.1.2","0.000002000","51349  >  12001 [ACK] Seq=40374 Ack=21978 Win=65700 Len=1460","1514","0.000000000","10.202.1.2","0.000002000","TCP"
"428","25.915233","5.393938000","0.001292000","0.001292000","10.1.1.2","0.001292000","51349  >  12001 [ACK] Seq=41834 Ack=21978 Win=65700 Len=1460","1514","0.000000000","10.202.1.2","0.001292000","TCP"
"429","25.917897","5.396602000","0.002664000","0.002664000","10.1.1.2","0.002664000","51349  >  12001 [ACK] Seq=43294 Ack=21978 Win=65700 Len=1460","1514","0.000000000","10.202.1.2","0.002664000","TCP"
"430","25.917899","5.396604000","0.000002000","0.000002000","10.1.1.2","0.000002000","51349  >  12001 [ACK] Seq=44754 Ack=21978 Win=65700 Len=1460","1514","0.000000000","10.202.1.2","0.000002000","TCP"
"432","25.919233","5.397938000","0.001306000","0.001306000","10.1.1.2","0.001306000","51349  >  12001 [ACK] Seq=46214 Ack=21978 Win=65700 Len=1460","1514","0.000000000","10.202.1.2","0.001306000","TCP"
"433","25.919236","5.397941000","0.000003000","0.000003000","10.1.1.2","0.000003000","51349  >  12001 [ACK] Seq=47674 Ack=21978 Win=65700 Len=1460","1514","0.000000000","10.202.1.2","0.000003000","TCP"
"434","25.919238","5.397943000","0.000002000","0.000002000","10.1.1.2","0.000002000","51349  >  12001 [ACK] Seq=49134 Ack=21978 Win=65700 Len=1460","1514","0.000000000","10.202.1.2","0.000002000","TCP"
"435","25.919240","5.397945000","0.000002000","0.000002000","10.1.1.2","0.000002000","51349  >  12001 [ACK] Seq=50594 Ack=21978 Win=65700 Len=1460","1514","0.000000000","10.202.1.2","0.000002000","TCP"
"436","25.919242","5.397947000","0.000002000","0.000002000","10.1.1.2","0.000002000","51349  >  12001 [ACK] Seq=52054 Ack=21978 Win=65700 Len=1460","1514","0.000000000","10.202.1.2","0.000002000","TCP"
"437","25.919243","5.397948000","0.000001000","0.000001000","10.1.1.2","0.000001000","51349  >  12001 [ACK] Seq=53514 Ack=24349 Win=65700 Len=0","60","0.000000000","10.202.1.2","0.000001000","TCP"
"442","25.921891","5.400596000","0.002156000","0.002156000","10.1.1.2","0.002156000","51349  >  12001 [ACK] Seq=53514 Ack=24349 Win=65700 Len=1460","1514","0.000000000","10.202.1.2","0.002156000","TCP"
"443","25.921894","5.400599000","0.000003000","0.000003000","10.1.1.2","0.000003000","51349  >  12001 [ACK] Seq=54974 Ack=24349 Win=65700 Len=1460","1514","0.000000000","10.202.1.2","0.000003000","TCP"
"445","25.923225","5.401930000","0.001301000","0.001301000","10.1.1.2","0.001301000","51349  >  12001 [ACK] Seq=56434 Ack=24349 Win=65700 Len=1460","1514","0.000000000","10.202.1.2","0.001301000","TCP"
"446","25.923228","5.401933000","0.000003000","0.000003000","10.1.1.2","0.000003000","51349  >  12001 [ACK] Seq=57894 Ack=24349 Win=65700 Len=1460","1514","0.000000000","10.202.1.2","0.000003000","TCP"
"447","25.923230","5.401935000","0.000002000","0.000002000","10.1.1.2","0.000002000","51349  >  12001 [ACK] Seq=59354 Ack=24349 Win=65700 Len=1460","1514","0.000000000","10.202.1.2","0.000002000","TCP"
"448","25.923232","5.401937000","0.000002000","0.000002000","10.1.1.2","0.000002000","51349  >  12001 [ACK] Seq=60814 Ack=24349 Win=65700 Len=1460","1514","0.000000000","10.202.1.2","0.000002000","TCP"
"449","25.923235","5.401940000","0.000003000","0.000003000","10.1.1.2","0.000003000","51349  >  12001 [ACK] Seq=62274 Ack=24349 Win=65700 Len=1460","1514","0.000000000","10.202.1.2","0.000003000","TCP"
"450","25.923237","5.401942000","0.000002000","0.000002000","10.1.1.2","0.000002000","51349  >  12001 [PSH, ACK] Seq=63734 Ack=24349 Win=65700 Len=323","377","0.000000000","10.202.1.2","0.000002000","TCP"
"451","25.923238","5.401943000","0.000001000","0.000001000","10.1.1.2","0.000001000","51349  >  12001 [ACK] Seq=64057 Ack=24349 Win=65700 Len=1460","1514","0.000000000","10.202.1.2","0.000001000","TCP"
"452","25.923240","5.401945000","0.000002000","0.000002000","10.1.1.2","0.000002000","51349  >  12001 [ACK] Seq=65517 Ack=24349 Win=65700 Len=1460","1514","0.000000000","10.202.1.2","0.000002000","TCP"
"468","26.007087","5.485789000","0.166399000","0.053251000","10.1.1.2","0.166399000","51350  >  12002 [PSH, ACK] Seq=35629 Ack=1219 Win=64480 Len=1460","1514","0.000000000","10.202.1.2","0.053251000","TCP"
"469","26.007089","5.485791000","0.000002000","0.000002000","10.1.1.2","0.000002000","51350  >  12002 [PSH, ACK] Seq=37089 Ack=1219 Win=64480 Len=124","178","0.000000000","10.202.1.2","0.000002000","TCP"
"476","26.188130","5.666832000","0.181014000","0.000001000","10.1.1.2","0.181014000","51350  >  12002 [PSH, ACK] Seq=37213 Ack=1219 Win=64480 Len=1460","1514","0.000000000","10.202.1.2","0.000001000","TCP"
"477","26.188132","5.666834000","0.000002000","0.000002000","10.1.1.2","0.000002000","51350  >  12002 [PSH, ACK] Seq=38673 Ack=1219 Win=64480 Len=124","178","0.000000000","10.202.1.2","0.000002000","TCP"
"529","26.322032","5.800737000","0.398700000","0.001304000","10.1.1.2","0.398700000","[TCP Previous segment not captured] 51349  >  12001 [ACK] Seq=68437 Ack=24349 Win=65700 Len=1460","1514","0.000000000","10.202.1.2","0.001304000","TCP"
"530","26.322035","5.800740000","0.000003000","0.000003000","10.1.1.2","0.000003000","51349  >  12001 [ACK] Seq=69897 Ack=24349 Win=65700 Len=1460","1514","0.000000000","10.202.1.2","0.000003000","TCP"
"531","26.322036","5.800741000","0.000001000","0.000001000","10.1.1.2","0.000001000","51349  >  12001 [ACK] Seq=71357 Ack=24349 Win=65700 Len=1460","1514","0.000000000","10.202.1.2","0.000001000","TCP"
"532","26.322038","5.800743000","0.000002000","0.000002000","10.1.1.2","0.000002000","51349  >  12001 [ACK] Seq=72817 Ack=24349 Win=65700 Len=1460","1514","0.000000000","10.202.1.2","0.000002000","TCP"
"537","26.323360","5.802065000","0.001235000","0.001235000","10.1.1.2","0.001235000","51349  >  12001 [ACK] Seq=74277 Ack=24349 Win=65700 Len=1460","1514","0.000000000","10.202.1.2","0.001235000","TCP"
"538","26.323363","5.802068000","0.000003000","0.000003000","10.1.1.2","0.000003000","51349  >  12001 [ACK] Seq=75737 Ack=24349 Win=65700 Len=1460","1514","0.000000000","10.202.1.2","0.000003000","TCP"
"539","26.323365","5.802070000","0.000002000","0.000002000","10.1.1.2","0.000002000","51349  >  12001 [ACK] Seq=77197 Ack=24349 Win=65700 Len=1460","1514","0.000000000","10.202.1.2","0.000002000","TCP"
"543","26.324695","5.803400000","0.001282000","0.001282000","10.1.1.2","0.001282000","51349  >  12001 [ACK] Seq=78657 Ack=24349 Win=65700 Len=1460","1514","0.000000000","10.202.1.2","0.001282000","TCP"
"544","26.324696","5.803401000","0.000001000","0.000001000","10.1.1.2","0.000001000","51349  >  12001 [ACK] Seq=80117 Ack=24349 Win=65700 Len=1460","1514","0.000000000","10.202.1.2","0.000001000","TCP"
"545","26.324699","5.803404000","0.000003000","0.000003000","10.1.1.2","0.000003000","51349  >  12001 [ACK] Seq=81577 Ack=24349 Win=65700 Len=1460","1514","0.000000000","10.202.1.2","0.000003000","TCP"
"549","26.326023","5.804728000","0.001268000","0.001268000","10.1.1.2","0.001268000","51349  >  12001 [ACK] Seq=83037 Ack=24349 Win=65700 Len=1460","1514","0.000000000","10.202.1.2","0.001268000","TCP"
"550","26.326025","5.804730000","0.000002000","0.000002000","10.1.1.2","0.000002000","51349  >  12001 [ACK] Seq=84497 Ack=24349 Win=65700 Len=1460","1514","0.000000000","10.202.1.2","0.000002000","TCP"
"551","26.326026","5.804731000","0.000001000","0.000001000","10.1.1.2","0.000001000","51349  >  12001 [ACK] Seq=85957 Ack=24349 Win=65700 Len=1460","1514","0.000000000","10.202.1.2","0.000001000","TCP"
"552","26.326029","5.804734000","0.000003000","0.000003000","10.1.1.2","0.000003000","51349  >  12001 [ACK] Seq=87417 Ack=24349 Win=65700 Len=1460","1514","0.000000000","10.202.1.2","0.000003000","TCP"
"557","26.330019","5.808724000","0.003927000","0.003927000","10.1.1.2","0.003927000","51349  >  12001 [ACK] Seq=88877 Ack=24349 Win=65700 Len=1460","1514","0.000000000","10.202.1.2","0.003927000","TCP"
"558","26.330021","5.808726000","0.000002000","0.000002000","10.1.1.2","0.000002000","51349  >  12001 [ACK] Seq=90337 Ack=24349 Win=65700 Len=1460","1514","0.000000000","10.202.1.2","0.000002000","TCP"
"559","26.330022","5.808727000","0.000001000","0.000001000","10.1.1.2","0.000001000","51349  >  12001 [ACK] Seq=91797 Ack=24349 Win=65700 Len=1460","1514","0.000000000","10.202.1.2","0.000001000","TCP"
"563","26.331348","5.810053000","0.001268000","0.001268000","10.1.1.2","0.001268000","51349  >  12001 [ACK] Seq=93257 Ack=24349 Win=65700 Len=1460","1514","0.000000000","10.202.1.2","0.001268000","TCP"
"564","26.331350","5.810055000","0.000002000","0.000002000","10.1.1.2","0.000002000","51349  >  12001 [ACK] Seq=94717 Ack=24349 Win=65700 Len=1460","1514","0.000000000","10.202.1.2","0.000002000","TCP"
"565","26.331352","5.810057000","0.000002000","0.000002000","10.1.1.2","0.000002000","51349  >  12001 [ACK] Seq=96177 Ack=43329 Win=56940 Len=0","60","0.000000000","10.202.1.2","0.000002000","TCP"
"566","26.331354","5.810059000","0.000002000","0.000002000","10.1.1.2","0.000002000","[TCP Window Update] 51349  >  12001 [ACK] Seq=96177 Ack=43329 Win=65700 Len=0","60","0.000000000","10.202.1.2","0.000002000","TCP"
"570","26.332678","5.811383000","0.001248000","0.001248000","10.1.1.2","0.001248000","51349  >  12001 [ACK] Seq=96177 Ack=50629 Win=65700 Len=1460","1514","0.000000000","10.202.1.2","0.001248000","TCP"
"572","26.334008","5.812713000","0.001305000","0.001305000","10.1.1.2","0.001305000","51349  >  12001 [ACK] Seq=97637 Ack=50629 Win=65700 Len=1460","1514","0.000000000","10.202.1.2","0.001305000","TCP"
"574","26.335343","5.814048000","0.001317000","0.001317000","10.1.1.2","0.001317000","51349  >  12001 [ACK] Seq=99097 Ack=50629 Win=65700 Len=1460","1514","0.000000000","10.202.1.2","0.001317000","TCP"
"575","26.335345","5.814050000","0.000002000","0.000002000","10.1.1.2","0.000002000","51349  >  12001 [ACK] Seq=100557 Ack=50629 Win=65700 Len=1460","1514","0.000000000","10.202.1.2","0.000002000","TCP"
"576","26.335347","5.814052000","0.000002000","0.000002000","10.1.1.2","0.000002000","51349  >  12001 [ACK] Seq=102017 Ack=50629 Win=65700 Len=1460","1514","0.000000000","10.202.1.2","0.000002000","TCP"
"577","26.335349","5.814054000","0.000002000","0.000002000","10.1.1.2","0.000002000","51349  >  12001 [ACK] Seq=103477 Ack=50629 Win=65700 Len=1460","1514","0.000000000","10.202.1.2","0.000002000","TCP"
"578","26.335352","5.814057000","0.000003000","0.000003000","10.1.1.2","0.000003000","51349  >  12001 [ACK] Seq=104937 Ack=50629 Win=65700 Len=1460","1514","0.000000000","10.202.1.2","0.000003000","TCP"
"579","26.335354","5.814059000","0.000002000","0.000002000","10.1.1.2","0.000002000","51349  >  12001 [ACK] Seq=106397 Ack=50629 Win=65700 Len=1460","1514","0.000000000","10.202.1.2","0.000002000","TCP"
"586","26.336681","5.815386000","0.001235000","0.001235000","10.1.1.2","0.001235000","51349  >  12001 [ACK] Seq=107857 Ack=50629 Win=65700 Len=1460","1514","0.000000000","10.202.1.2","0.001235000","TCP"
"587","26.336683","5.815388000","0.000002000","0.000002000","10.1.1.2","0.000002000","51349  >  12001 [ACK] Seq=109317 Ack=50629 Win=65700 Len=1460","1514","0.000000000","10.202.1.2","0.000002000","TCP"
"595","26.336696","5.815401000","0.000013000","0.000001000","10.1.1.2","0.000013000","51349  >  12001 [ACK] Seq=110777 Ack=50629 Win=65700 Len=1460","1514","0.000000000","10.202.1.2","0.000001000","TCP"
"596","26.336698","5.815403000","0.000002000","0.000002000","10.1.1.2","0.000002000","51349  >  12001 [ACK] Seq=112237 Ack=50629 Win=65700 Len=1460","1514","0.000000000","10.202.1.2","0.000002000","TCP"
"597","26.336699","5.815404000","0.000001000","0.000001000","10.1.1.2","0.000001000","51349  >  12001 [ACK] Seq=113697 Ack=50629 Win=65700 Len=1460","1514","0.000000000","10.202.1.2","0.000001000","TCP"
"604","26.338003","5.816708000","0.001189000","0.001169000","10.1.1.2","0.001189000","51349  >  12001 [ACK] Seq=115157 Ack=50629 Win=65700 Len=1460","1514","0.000000000","10.202.1.2","0.001169000","TCP"
"605","26.338006","5.816711000","0.000003000","0.000003000","10.1.1.2","0.000003000","51349  >  12001 [ACK] Seq=116617 Ack=50629 Win=65700 Len=1460","1514","0.000000000","10.202.1.2","0.000003000","TCP"
"611","26.384595","5.863297000","0.196412000","0.003995000","10.1.1.2","0.196412000","51350  >  12002 [PSH, ACK] Seq=38797 Ack=1219 Win=64480 Len=1460","1514","0.000000000","10.202.1.2","0.003995000","TCP"
"612","26.384597","5.863299000","0.000002000","0.000002000","10.1.1.2","0.000002000","51350  >  12002 [PSH, ACK] Seq=40257 Ack=1219 Win=64480 Len=95","149","0.000000000","10.202.1.2","0.000002000","TCP"
"615","26.485764","7.619132000","0.613095000","0.007987000","10.1.1.2","0.613095000","51348  >  12003 [ACK] Seq=28482 Ack=28617 Win=65700 Len=0","60","0.000000000","10.202.1.2","0.007987000","TCP"
"619","26.558981","6.037683000","0.174359000","0.013276000","10.1.1.2","0.174359000","51350  >  12002 [PSH, ACK] Seq=40352 Ack=1219 Win=64480 Len=1460","1514","0.000000000","10.202.1.2","0.013276000","TCP"
"620","26.558983","6.037685000","0.000002000","0.000002000","10.1.1.2","0.000002000","51350  >  12002 [PSH, ACK] Seq=41812 Ack=1219 Win=64480 Len=66","120","0.000000000","10.202.1.2","0.000002000","TCP"
"623","26.590930","6.069632000","0.031920000","0.000001000","10.1.1.2","0.031920000","51350  >  12002 [PSH, ACK] Seq=41878 Ack=1219 Win=64480 Len=176","230","0.000000000","10.202.1.2","0.000001000","TCP"
"646","26.728040","6.206745000","0.389994000","0.007948000","10.1.1.2","0.389994000","51349  >  12001 [ACK] Seq=118077 Ack=50629 Win=65700 Len=1460","1514","0.000000000","10.202.1.2","0.007948000","TCP"
"648","26.729370","6.208075000","0.001295000","0.001295000","10.1.1.2","0.001295000","51349  >  12001 [ACK] Seq=119537 Ack=50629 Win=65700 Len=1460","1514","0.000000000","10.202.1.2","0.001295000","TCP"
"649","26.729373","6.208078000","0.000003000","0.000003000","10.1.1.2","0.000003000","[TCP Fast Retransmission] 51349  >  12001 [ACK] Seq=66977 Ack=50629 Win=65700 Len=1460","1514","0.000000000","10.202.1.2","0.000003000","TCP"
"653","26.738694","6.217399000","0.009248000","0.008221000","10.1.1.2","0.009248000","51349  >  12001 [ACK] Seq=120997 Ack=50629 Win=65700 Len=1460","1514","0.000000000","10.202.1.2","0.008221000","TCP"
"654","26.738696","6.217401000","0.000002000","0.000002000","10.1.1.2","0.000002000","51349  >  12001 [ACK] Seq=122457 Ack=50629 Win=65700 Len=1460","1514","0.000000000","10.202.1.2","0.000002000","TCP"
"655","26.738698","6.217403000","0.000002000","0.000002000","10.1.1.2","0.000002000","51349  >  12001 [ACK] Seq=123917 Ack=53549 Win=65700 Len=0","60","0.000000000","10.202.1.2","0.000002000","TCP"
"656","26.738699","6.217404000","0.000001000","0.000001000","10.1.1.2","0.000001000","51349  >  12001 [ACK] Seq=123917 Ack=69609 Win=58400 Len=0","60","0.000000000","10.202.1.2","0.000001000","TCP"
"658","26.741349","6.220054000","0.002615000","0.002615000","10.1.1.2","0.002615000","51349  >  12001 [ACK] Seq=123917 Ack=73989 Win=54020 Len=0","60","0.000000000","10.202.1.2","0.002615000","TCP"
