"No.","Time","Time since first frame in this TCP stream","segment delta","Time delta from previous captured frame","Destination","Delta Time (conv)","Info","Length","Time shift for this packet","Source","Time delta from previous captured frame","Protocol"
"2","0.000111","0.000111000","0.000111000","0.000111000","10.22.1.2","0.000111000","8800  >  53633 [SYN, ACK] Seq=0 Ack=1 Win=8192 Len=0 MSS=1460 WS=256 SACK_PERM=1","66","0.000000000","10.1.1.2","0.000111000","TCP"
"5","0.861423","0.861423000","0.006807000","0.006807000","10.22.1.2","0.006807000","8800  >  53633 [PSH, ACK] Seq=1 Ack=314 Win=65536 Len=932","986","0.000000000","10.1.1.2","0.006807000","TCP"
"7","1.690952","1.690952000","0.009668000","0.009668000","10.22.1.2","0.009668000","8800  >  53633 [PSH, ACK] Seq=933 Ack=440 Win=65536 Len=226","280","0.000000000","10.1.1.2","0.009668000","TCP"
"9","2.526441","2.526441000","0.027809000","0.027809000","10.22.1.2","0.027809000","8800  >  53633 [ACK] Seq=1159 Ack=530 Win=65280 Len=2920","2974","0.000000000","10.1.1.2","0.027809000","TCP"
"16","3.345285","3.345285000","0.000036000","0.000036000","10.22.1.2","0.000036000","8800  >  53633 [PSH, ACK] Seq=4079 Ack=530 Win=65280 Len=5840","5894","0.000000000","10.1.1.2","0.000036000","TCP"
"20","4.154692","4.154692000","0.000070000","0.000070000","10.22.1.2","0.000070000","8800  >  53633 [ACK] Seq=9919 Ack=530 Win=65280 Len=5840","5894","0.000000000","10.1.1.2","0.000070000","TCP"
"22","4.158620","4.158620000","0.000019000","0.000019000","10.22.1.2","0.000019000","8800  >  53633 [PSH, ACK] Seq=15759 Ack=530 Win=65280 Len=1895","1949","0.000000000","10.1.1.2","0.000019000","TCP"
"24","4.790529","4.790529000","0.040869000","0.040869000","10.22.1.2","0.040869000","8800  >  53633 [PSH, ACK] Seq=17654 Ack=681 Win=65280 Len=3674","3728","0.000000000","10.1.1.2","0.040869000","TCP"
"29","4.977370","4.977370000","0.000089000","0.000089000","10.22.1.2","0.000089000","8800  >  53633 [PSH, ACK] Seq=21328 Ack=681 Win=65280 Len=3674","3728","0.000000000","10.1.1.2","0.000089000","TCP"
"35","5.611005","0.000083000","0.000083000","0.000083000","10.22.1.2","0.000083000","12000  >  53637 [SYN, ACK] Seq=0 Ack=1 Win=8192 Len=0 MSS=1460 WS=256 SACK_PERM=1","66","0.000000000","10.1.1.2","0.000083000","TCP"
"39","6.465481","0.854559000","0.009242000","0.009242000","10.22.1.2","0.009242000","12000  >  53637 [PSH, ACK] Seq=1 Ack=314 Win=65536 Len=932","986","0.000000000","10.1.1.2","0.009242000","TCP"
"41","7.291875","1.680953000","0.006313000","0.006313000","10.22.1.2","0.006313000","12000  >  53637 [PSH, ACK] Seq=933 Ack=440 Win=65536 Len=226","280","0.000000000","10.1.1.2","0.006313000","TCP"
"43","8.100700","2.489778000","0.000455000","0.000455000","10.22.1.2","0.000455000","12000  >  53637 [PSH, ACK] Seq=1159 Ack=499 Win=65280 Len=45","99","0.000000000","10.1.1.2","0.000455000","TCP"
"45","8.929130","3.318208000","0.022187000","0.022187000","10.22.1.2","0.022187000","12000  >  53637 [PSH, ACK] Seq=1204 Ack=615 Win=65280 Len=332","386","0.000000000","10.1.1.2","0.022187000","TCP"
"47","9.770246","4.159324000","0.003357000","0.003357000","10.22.1.2","0.003357000","12000  >  53637 [PSH, ACK] Seq=1536 Ack=664 Win=65280 Len=233","287","0.000000000","10.1.1.2","0.003357000","TCP"
"49","10.600226","4.989304000","0.009333000","0.009333000","10.22.1.2","0.009333000","12000  >  53637 [PSH, ACK] Seq=1769 Ack=713 Win=65280 Len=329","383","0.000000000","10.1.1.2","0.009333000","TCP"
"50","11.867754","6.256832000","1.267528000","1.267528000","10.22.1.2","1.267528000","[TCP Retransmission] 12000  >  53637 [PSH, ACK] Seq=1769 Ack=713 Win=65280 Len=329","383","0.000000000","10.1.1.2","1.267528000","TCP"
"53","13.534641","7.923719000","0.095030000","0.095030000","10.22.1.2","0.095030000","12000  >  53637 [ACK] Seq=2098 Ack=781 Win=65024 Len=1460","1514","0.000000000","10.1.1.2","0.095030000","TCP"
"55","14.539251","8.928329000","0.000073000","0.000073000","10.22.1.2","0.000073000","12000  >  53637 [PSH, ACK] Seq=3558 Ack=781 Win=65024 Len=760","814","0.000000000","10.1.1.2","0.000073000","TCP"
"58","16.701719","11.090797000","0.204376000","0.204376000","10.22.1.2","0.204376000","12000  >  53637 [ACK] Seq=4318 Ack=855 Win=65024 Len=2920","2974","0.000000000","10.1.1.2","0.204376000","TCP"
"60","17.510465","11.899543000","0.000089000","0.000089000","10.22.1.2","0.000089000","12000  >  53637 [ACK] Seq=7238 Ack=987 Win=65024 Len=1460","1514","0.000000000","10.1.1.2","0.000089000","TCP"
"62","17.707442","12.096520000","0.000054000","0.000054000","10.22.1.2","0.000054000","12000  >  53637 [ACK] Seq=8698 Ack=987 Win=65024 Len=2920","2974","0.000000000","10.1.1.2","0.000054000","TCP"
"66","18.520777","12.909855000","0.000046000","0.000046000","10.22.1.2","0.000046000","12000  >  53637 [PSH, ACK] Seq=11618 Ack=987 Win=65024 Len=4720","4774","0.000000000","10.1.1.2","0.000046000","TCP"
"69","19.570608","13.959686000","0.012873000","0.012873000","10.22.1.2","0.012873000","12000  >  53637 [PSH, ACK] Seq=16338 Ack=1051 Win=64768 Len=1226","1280","0.000000000","10.1.1.2","0.012873000","TCP"
"72","23.108728","17.497806000","0.008720000","0.008720000","10.22.1.2","0.008720000","12000  >  53637 [PSH, ACK] Seq=17564 Ack=1119 Win=64768 Len=164","218","0.000000000","10.1.1.2","0.008720000","TCP"
"74","24.118261","18.507339000","0.206229000","0.206229000","10.22.1.2","0.206229000","12000  >  53637 [ACK] Seq=17728 Ack=1209 Win=64768 Len=0","54","0.000000000","10.1.1.2","0.206229000","TCP"
"76","24.942773","19.331851000","0.021706000","0.021706000","10.22.1.2","0.021706000","12000  >  53637 [PSH, ACK] Seq=17728 Ack=1259 Win=64512 Len=630","684","0.000000000","10.1.1.2","0.021706000","TCP"
"78","25.755216","20.144294000","0.006153000","0.006153000","10.22.1.2","0.006153000","12000  >  53637 [PSH, ACK] Seq=18358 Ack=1327 Win=64512 Len=141","195","0.000000000","10.1.1.2","0.006153000","TCP"
"80","26.578665","20.967743000","0.017580000","0.017580000","10.22.1.2","0.017580000","12000  >  53637 [PSH, ACK] Seq=18499 Ack=1377 Win=64512 Len=604","658","0.000000000","10.1.1.2","0.017580000","TCP"
"82","27.403215","21.792293000","0.010143000","0.010143000","10.22.1.2","0.010143000","12000  >  53637 [PSH, ACK] Seq=19103 Ack=1427 Win=64512 Len=714","768","0.000000000","10.1.1.2","0.010143000","TCP"
"84","28.211695","22.600773000","0.003940000","0.003940000","10.22.1.2","0.003940000","12000  >  53637 [PSH, ACK] Seq=19817 Ack=1495 Win=64512 Len=253","307","0.000000000","10.1.1.2","0.003940000","TCP"
"86","29.036844","23.425922000","0.003755000","0.003755000","10.22.1.2","0.003755000","12000  >  53637 [PSH, ACK] Seq=20070 Ack=1563 Win=64256 Len=49","103","0.000000000","10.1.1.2","0.003755000","TCP"
"88","29.851871","24.240949000","0.004098000","0.004098000","10.22.1.2","0.004098000","12000  >  53637 [PSH, ACK] Seq=20119 Ack=1631 Win=64256 Len=49","103","0.000000000","10.1.1.2","0.004098000","TCP"
"90","30.674196","25.063274000","0.003754000","0.003754000","10.22.1.2","0.003754000","12000  >  53637 [PSH, ACK] Seq=20168 Ack=1699 Win=64256 Len=49","103","0.000000000","10.1.1.2","0.003754000","TCP"
"92","31.492691","25.881769000","0.006234000","0.006234000","10.22.1.2","0.006234000","12000  >  53637 [PSH, ACK] Seq=20217 Ack=1767 Win=64000 Len=187","241","0.000000000","10.1.1.2","0.006234000","TCP"
"94","32.307269","26.696347000","0.006124000","0.006124000","10.22.1.2","0.006124000","12000  >  53637 [PSH, ACK] Seq=20404 Ack=1817 Win=65536 Len=714","768","0.000000000","10.1.1.2","0.006124000","TCP"
"96","32.743599","32.743599000","0.217489000","0.217489000","10.22.1.2","0.217489000","8800  >  53633 [ACK] Seq=25002 Ack=868 Win=65024 Len=0","54","0.000000000","10.1.1.2","0.217489000","TCP"
"98","33.341712","33.341712000","0.598113000","0.023547000","10.22.1.2","0.598113000","8800  >  53633 [PSH, ACK] Seq=25002 Ack=868 Win=65024 Len=4619","4673","0.000000000","10.1.1.2","0.023547000","TCP"
"99","33.375282","33.375282000","0.033570000","0.033570000","10.22.1.2","0.033570000","8800  >  53633 [PSH, ACK] Seq=29621 Ack=868 Win=65024 Len=3785","3839","0.000000000","10.1.1.2","0.033570000","TCP"
"103","34.155612","0.000146000","0.000146000","0.000146000","10.22.1.2","0.000146000","12001  >  53638 [SYN, ACK] Seq=0 Ack=1 Win=8192 Len=0 MSS=1460 WS=256 SACK_PERM=1","66","0.000000000","10.1.1.2","0.000146000","TCP"
"110","34.216329","28.605407000","0.006285000","0.006285000","10.22.1.2","0.006285000","12000  >  53637 [PSH, ACK] Seq=21118 Ack=1885 Win=65536 Len=187","241","0.000000000","10.1.1.2","0.006285000","TCP"
"116","35.078672","29.467750000","0.052605000","0.044597000","10.22.1.2","0.052605000","12000  >  53637 [PSH, ACK] Seq=21305 Ack=2511 Win=64768 Len=131","185","0.000000000","10.1.1.2","0.044597000","TCP"
"118","35.178755","1.023289000","0.200605000","0.068130000","10.22.1.2","0.200605000","12001  >  53638 [ACK] Seq=1 Ack=314 Win=65536 Len=0","54","0.000000000","10.1.1.2","0.068130000","TCP"
"120","35.493354","1.337888000","0.314599000","0.263825000","10.22.1.2","0.314599000","12001  >  53638 [PSH, ACK] Seq=1 Ack=314 Win=65536 Len=932","986","0.000000000","10.1.1.2","0.263825000","TCP"
"123","35.882080","30.271158000","0.000063000","0.000063000","10.22.1.2","0.000063000","12000  >  53637 [PSH, ACK] Seq=21436 Ack=2561 Win=64768 Len=966","1020","0.000000000","10.1.1.2","0.000063000","TCP"
"128","36.317789","2.162323000","0.008468000","0.005694000","10.22.1.2","0.008468000","12001  >  53638 [PSH, ACK] Seq=933 Ack=440 Win=65536 Len=326","380","0.000000000","10.1.1.2","0.005694000","TCP"
"130","36.887132","31.276210000","0.000066000","0.000066000","10.22.1.2","0.000066000","12000  >  53637 [PSH, ACK] Seq=22402 Ack=2561 Win=64768 Len=714","768","0.000000000","10.1.1.2","0.000066000","TCP"
"133","37.125488","0.000148000","0.000148000","0.000146000","10.22.1.2","0.000148000","12002  >  53640 [SYN, ACK] Seq=0 Ack=1 Win=8192 Len=0 MSS=1460 WS=256 SACK_PERM=1","66","0.000000000","10.1.1.2","0.000146000","TCP"
"134","37.125572","0.000230000","0.000230000","0.000084000","10.22.1.2","0.000230000","12003  >  53639 [SYN, ACK] Seq=0 Ack=1 Win=8192 Len=0 MSS=1460 WS=256 SACK_PERM=1","66","0.000000000","10.1.1.2","0.000084000","TCP"
"143","37.653906","3.498440000","0.000074000","0.000074000","10.22.1.2","0.000074000","12001  >  53638 [ACK] Seq=1259 Ack=3360 Win=65536 Len=0","54","0.000000000","10.1.1.2","0.000074000","TCP"
"156","37.974878","0.849538000","0.013562000","0.013561000","10.22.1.2","0.013562000","12002  >  53640 [PSH, ACK] Seq=1 Ack=314 Win=65536 Len=932","986","0.000000000","10.1.1.2","0.013561000","TCP"
"159","38.012260","0.886918000","0.053602000","0.010815000","10.22.1.2","0.053602000","12003  >  53639 [PSH, ACK] Seq=1 Ack=314 Win=65536 Len=932","986","0.000000000","10.1.1.2","0.010815000","TCP"
"164","38.463222","4.307756000","0.000042000","0.000042000","10.22.1.2","0.000042000","12001  >  53638 [ACK] Seq=1259 Ack=9200 Win=65536 Len=0","54","0.000000000","10.1.1.2","0.000042000","TCP"
"173","38.798321","1.672981000","0.006342000","0.005014000","10.22.1.2","0.006342000","12002  >  53640 [PSH, ACK] Seq=933 Ack=440 Win=65536 Len=286","340","0.000000000","10.1.1.2","0.005014000","TCP"
"178","38.831457","1.706115000","0.006203000","0.006203000","10.22.1.2","0.006203000","12003  >  53639 [PSH, ACK] Seq=933 Ack=440 Win=65536 Len=286","340","0.000000000","10.1.1.2","0.006203000","TCP"
"183","39.267285","5.111819000","0.000067000","0.000067000","10.22.1.2","0.000067000","12001  >  53638 [ACK] Seq=1259 Ack=11791 Win=65536 Len=0","54","0.000000000","10.1.1.2","0.000067000","TCP"
"188","39.312394","5.156928000","0.045109000","0.002079000","10.22.1.2","0.045109000","12001  >  53638 [ACK] Seq=1259 Ack=11791 Win=65536 Len=2920","2974","0.000000000","10.1.1.2","0.002079000","TCP"
"196","39.820524","2.695184000","0.203214000","0.086020000","10.22.1.2","0.203214000","12002  >  53640 [ACK] Seq=1219 Ack=1015 Win=64768 Len=0","54","0.000000000","10.1.1.2","0.086020000","TCP"
"198","39.911342","2.786000000","0.203512000","0.020507000","10.22.1.2","0.203512000","12003  >  53639 [ACK] Seq=1219 Ack=612 Win=65280 Len=0","54","0.000000000","10.1.1.2","0.020507000","TCP"
"204","40.123185","5.967719000","0.000029000","0.000029000","10.22.1.2","0.000029000","12001  >  53638 [ACK] Seq=4179 Ack=11791 Win=65536 Len=5840","5894","0.000000000","10.1.1.2","0.000029000","TCP"
"216","40.928548","6.773082000","0.000025000","0.000025000","10.22.1.2","0.000025000","12001  >  53638 [PSH, ACK] Seq=10019 Ack=11791 Win=65536 Len=2566","2620","0.000000000","10.1.1.2","0.000025000","TCP"
"235","41.997392","7.841926000","0.196944000","0.070981000","10.22.1.2","0.196944000","12001  >  53638 [ACK] Seq=12585 Ack=11897 Win=65536 Len=0","54","0.000000000","10.1.1.2","0.070981000","TCP"
"255","42.334315","8.178849000","0.000052000","0.000052000","10.22.1.2","0.000052000","12001  >  53638 [ACK] Seq=12585 Ack=14817 Win=65536 Len=0","54","0.000000000","10.1.1.2","0.000052000","TCP"
"259","42.335626","8.180160000","0.000036000","0.000036000","10.22.1.2","0.000036000","[TCP Dup ACK 255#1] 12001  >  53638 [ACK] Seq=12585 Ack=14817 Win=65536 Len=0 SLE=16277 SRE=17737","66","0.000000000","10.1.1.2","0.000036000","TCP"
"260","42.335645","8.180179000","0.000019000","0.000019000","10.22.1.2","0.000019000","[TCP Dup ACK 255#2] 12001  >  53638 [ACK] Seq=12585 Ack=14817 Win=65536 Len=0 SLE=16277 SRE=19197","66","0.000000000","10.1.1.2","0.000019000","TCP"
"261","42.335666","8.180200000","0.000021000","0.000021000","10.22.1.2","0.000021000","[TCP Dup ACK 255#3] 12001  >  53638 [ACK] Seq=12585 Ack=14817 Win=65536 Len=0 SLE=16277 SRE=20657","66","0.000000000","10.1.1.2","0.000021000","TCP"
"263","42.338271","8.182805000","0.000026000","0.000026000","10.22.1.2","0.000026000","[TCP Dup ACK 255#4] 12001  >  53638 [ACK] Seq=12585 Ack=14817 Win=65536 Len=0 SLE=16277 SRE=22117","66","0.000000000","10.1.1.2","0.000026000","TCP"
"264","42.342938","8.187472000","0.004667000","0.004667000","10.22.1.2","0.004667000","12001  >  53638 [PSH, ACK] Seq=12585 Ack=14817 Win=65536 Len=13840","13894","0.000000000","10.1.1.2","0.004667000","TCP"
"268","42.347608","8.192142000","0.000035000","0.000035000","10.22.1.2","0.000035000","[TCP Dup ACK 255#5] 12001  >  53638 [ACK] Seq=26425 Ack=14817 Win=65536 Len=0 SLE=16277 SRE=23577","66","0.000000000","10.1.1.2","0.000035000","TCP"
"269","42.347627","8.192161000","0.000019000","0.000019000","10.22.1.2","0.000019000","[TCP Dup ACK 255#6] 12001  >  53638 [ACK] Seq=26425 Ack=14817 Win=65536 Len=0 SLE=16277 SRE=25037","66","0.000000000","10.1.1.2","0.000019000","TCP"
"270","42.347641","8.192175000","0.000014000","0.000014000","10.22.1.2","0.000014000","[TCP Dup ACK 255#7] 12001  >  53638 [ACK] Seq=26425 Ack=14817 Win=65536 Len=0 SLE=16277 SRE=26015","66","0.000000000","10.1.1.2","0.000014000","TCP"
"286","43.143658","8.988192000","0.000046000","0.000046000","10.22.1.2","0.000046000","12001  >  53638 [ACK] Seq=26425 Ack=26015 Win=65536 Len=0","54","0.000000000","10.1.1.2","0.000046000","TCP"
"288","43.154309","8.998843000","0.000046000","0.000046000","10.22.1.2","0.000046000","12001  >  53638 [PSH, ACK] Seq=26425 Ack=26136 Win=65536 Len=121","175","0.000000000","10.1.1.2","0.000046000","TCP"
"293","43.176738","6.051398000","3.356214000","0.010496000","10.22.1.2","3.356214000","12002  >  53640 [PSH, ACK] Seq=1219 Ack=1015 Win=64768 Len=176","230","0.000000000","10.1.1.2","0.010496000","TCP"
"295","43.179697","6.054355000","3.268355000","0.002444000","10.22.1.2","3.268355000","12003  >  53639 [PSH, ACK] Seq=1219 Ack=612 Win=65280 Len=172","226","0.000000000","10.1.1.2","0.002444000","TCP"
"299","43.247529","6.122187000","0.000066000","0.000066000","10.22.1.2","0.000066000","12003  >  53639 [ACK] Seq=1391 Ack=3415 Win=65536 Len=0","54","0.000000000","10.1.1.2","0.000066000","TCP"
"304","43.338751","6.213411000","0.162013000","0.083286000","10.22.1.2","0.162013000","12002  >  53640 [PSH, ACK] Seq=1395 Ack=1015 Win=64768 Len=1584","1638","0.000000000","10.1.1.2","0.083286000","TCP"
"314","43.500836","6.375496000","0.162085000","0.043031000","10.22.1.2","0.162085000","12002  >  53640 [PSH, ACK] Seq=2979 Ack=1015 Win=64768 Len=1584","1638","0.000000000","10.1.1.2","0.043031000","TCP"
"315","43.555049","6.429707000","0.207767000","0.054213000","10.22.1.2","0.207767000","12003  >  53639 [ACK] Seq=1391 Ack=4143 Win=64768 Len=0","54","0.000000000","10.1.1.2","0.054213000","TCP"
"316","43.662943","6.537603000","0.162107000","0.107894000","10.22.1.2","0.162107000","12002  >  53640 [PSH, ACK] Seq=4563 Ack=1015 Win=64768 Len=794","848","0.000000000","10.1.1.2","0.107894000","TCP"
"322","43.965032","9.809566000","0.000068000","0.000068000","10.22.1.2","0.000068000","12001  >  53638 [PSH, ACK] Seq=26546 Ack=26378 Win=65280 Len=121","175","0.000000000","10.1.1.2","0.000068000","TCP"
"332","44.059503","6.934161000","0.000037000","0.000037000","10.22.1.2","0.000037000","12003  >  53639 [PSH, ACK] Seq=1391 Ack=7063 Win=65536 Len=455","509","0.000000000","10.1.1.2","0.000037000","TCP"
"338","44.061571","6.936229000","0.000773000","0.000732000","10.22.1.2","0.000773000","12003  >  53639 [PSH, ACK] Seq=1846 Ack=8523 Win=65536 Len=1555","1609","0.000000000","10.1.1.2","0.000732000","TCP"
"345","44.144733","7.019393000","0.000073000","0.000073000","10.22.1.2","0.000073000","12002  >  53640 [PSH, ACK] Seq=5357 Ack=1015 Win=64768 Len=2920","2974","0.000000000","10.1.1.2","0.000073000","TCP"
"346","44.144790","7.019450000","0.000057000","0.000057000","10.22.1.2","0.000057000","12002  >  53640 [PSH, ACK] Seq=8277 Ack=1015 Win=64768 Len=352","406","0.000000000","10.1.1.2","0.000057000","TCP"
"349","44.305800","7.180460000","0.000063000","0.000063000","10.22.1.2","0.000063000","12002  >  53640 [PSH, ACK] Seq=8629 Ack=1015 Win=64768 Len=2446","2500","0.000000000","10.1.1.2","0.000063000","TCP"
"352","44.360348","7.235006000","0.000036000","0.000036000","10.22.1.2","0.000036000","12003  >  53639 [PSH, ACK] Seq=3401 Ack=9983 Win=65536 Len=339","393","0.000000000","10.1.1.2","0.000036000","TCP"
"358","44.465549","7.340209000","0.000060000","0.000060000","10.22.1.2","0.000060000","12002  >  53640 [PSH, ACK] Seq=11075 Ack=1015 Win=64768 Len=1584","1638","0.000000000","10.1.1.2","0.000060000","TCP"
"365","44.789029","10.633563000","0.000070000","0.000067000","10.22.1.2","0.000070000","12001  >  53638 [PSH, ACK] Seq=26667 Ack=27092 Win=64512 Len=242","296","0.000000000","10.1.1.2","0.000067000","TCP"
"375","44.868888","7.743546000","0.000058000","0.000053000","10.22.1.2","0.000058000","12003  >  53639 [PSH, ACK] Seq=3740 Ack=14363 Win=65536 Len=90","144","0.000000000","10.1.1.2","0.000053000","TCP"
"377","44.869990","7.744648000","0.001102000","0.001090000","10.22.1.2","0.001102000","12003  >  53639 [ACK] Seq=3830 Ack=14363 Win=65536 Len=1460","1514","0.000000000","10.1.1.2","0.001090000","TCP"
"381","44.878183","7.752841000","0.000036000","0.000036000","10.22.1.2","0.000036000","12003  >  53639 [PSH, ACK] Seq=5290 Ack=18743 Win=65536 Len=2330","2384","0.000000000","10.1.1.2","0.000036000","TCP"
"387","44.951429","7.826089000","0.000071000","0.000071000","10.22.1.2","0.000071000","12002  >  53640 [PSH, ACK] Seq=12659 Ack=1015 Win=64768 Len=1056","1110","0.000000000","10.1.1.2","0.000071000","TCP"
"388","44.951492","7.826152000","0.000063000","0.000063000","10.22.1.2","0.000063000","12002  >  53640 [PSH, ACK] Seq=13715 Ack=1015 Win=64768 Len=3872","3926","0.000000000","10.1.1.2","0.000063000","TCP"
"391","45.120636","7.995296000","0.000214000","0.000214000","10.22.1.2","0.000214000","12002  >  53640 [PSH, ACK] Seq=17587 Ack=1015 Win=64768 Len=1584","1638","0.000000000","10.1.1.2","0.000214000","TCP"
"395","45.141318","8.015976000","0.062152000","0.000883000","10.22.1.2","0.062152000","12003  >  53639 [ACK] Seq=7620 Ack=18743 Win=65536 Len=1460","1514","0.000000000","10.1.1.2","0.000883000","TCP"
"397","45.163055","8.037713000","0.000040000","0.000040000","10.22.1.2","0.000040000","12003  >  53639 [PSH, ACK] Seq=9080 Ack=20203 Win=65536 Len=1319","1373","0.000000000","10.1.1.2","0.000040000","TCP"
"400","45.167033","8.041691000","0.000026000","0.000026000","10.22.1.2","0.000026000","12003  >  53639 [ACK] Seq=10399 Ack=22885 Win=65536 Len=0","54","0.000000000","10.1.1.2","0.000026000","TCP"
"407","45.283132","8.157792000","0.013621000","0.013621000","10.22.1.2","0.013621000","12002  >  53640 [PSH, ACK] Seq=19171 Ack=1015 Win=64768 Len=1584","1638","0.000000000","10.1.1.2","0.013621000","TCP"
"414","45.596457","11.440991000","0.807428000","0.002081000","10.22.1.2","0.807428000","12001  >  53638 [PSH, ACK] Seq=26909 Ack=27092 Win=64512 Len=1551","1605","0.000000000","10.1.1.2","0.002081000","TCP"
"425","45.675609","8.550267000","0.000072000","0.000066000","10.22.1.2","0.000072000","12003  >  53639 [PSH, ACK] Seq=10399 Ack=30185 Win=65536 Len=180","234","0.000000000","10.1.1.2","0.000066000","TCP"
"431","45.687562","8.562220000","0.000054000","0.000054000","10.22.1.2","0.000054000","12003  >  53639 [PSH, ACK] Seq=10579 Ack=36025 Win=65536 Len=2742","2796","0.000000000","10.1.1.2","0.000054000","TCP"
"438","45.695556","8.570214000","0.000060000","0.000057000","10.22.1.2","0.000060000","12003  >  53639 [PSH, ACK] Seq=13321 Ack=40405 Win=65536 Len=936","990","0.000000000","10.1.1.2","0.000057000","TCP"
"441","45.756803","8.631463000","0.000070000","0.000070000","10.22.1.2","0.000070000","12002  >  53640 [PSH, ACK] Seq=20755 Ack=1015 Win=64768 Len=176","230","0.000000000","10.1.1.2","0.000070000","TCP"
"442","45.756889","8.631549000","0.000086000","0.000086000","10.22.1.2","0.000086000","12002  >  53640 [PSH, ACK] Seq=20931 Ack=1015 Win=64768 Len=4400","4454","0.000000000","10.1.1.2","0.000086000","TCP"
"444","45.795384","11.639918000","0.197074000","0.016027000","10.22.1.2","0.197074000","12001  >  53638 [ACK] Seq=28460 Ack=27927 Win=65536 Len=0","54","0.000000000","10.1.1.2","0.016027000","TCP"
"446","45.928490","8.803150000","0.000043000","0.000043000","10.22.1.2","0.000043000","12002  >  53640 [PSH, ACK] Seq=25331 Ack=1015 Win=64768 Len=528","582","0.000000000","10.1.1.2","0.000043000","TCP"
"450","45.945337","8.819995000","0.249781000","0.000879000","10.22.1.2","0.249781000","12003  >  53639 [PSH, ACK] Seq=14257 Ack=40405 Win=65536 Len=2418","2472","0.000000000","10.1.1.2","0.000879000","TCP"
"456","45.969737","8.844395000","0.000026000","0.000026000","10.22.1.2","0.000026000","12003  >  53639 [ACK] Seq=16675 Ack=43325 Win=65536 Len=0","54","0.000000000","10.1.1.2","0.000026000","TCP"
"464","45.975077","8.849735000","0.000031000","0.000026000","10.22.1.2","0.000031000","12003  >  53639 [ACK] Seq=16675 Ack=47705 Win=65536 Len=0","54","0.000000000","10.1.1.2","0.000026000","TCP"
"475","46.039418","8.914078000","0.110928000","0.039056000","10.22.1.2","0.110928000","12002  >  53640 [PSH, ACK] Seq=25859 Ack=1015 Win=64768 Len=1584","1638","0.000000000","10.1.1.2","0.039056000","TCP"
"477","46.201171","9.075831000","0.114307000","0.114307000","10.22.1.2","0.114307000","12002  >  53640 [PSH, ACK] Seq=27443 Ack=1015 Win=64768 Len=1584","1638","0.000000000","10.1.1.2","0.114307000","TCP"
"487","46.423705","12.268239000","0.000052000","0.000052000","10.22.1.2","0.000052000","12001  >  53638 [PSH, ACK] Seq=28460 Ack=31134 Win=65536 Len=836","890","0.000000000","10.1.1.2","0.000052000","TCP"
"498","46.485693","9.360351000","0.002144000","0.002098000","10.22.1.2","0.002144000","12003  >  53639 [ACK] Seq=16675 Ack=49165 Win=65536 Len=7300","7354","0.000000000","10.1.1.2","0.002098000","TCP"
"504","46.491565","9.366223000","0.000029000","0.000029000","10.22.1.2","0.000029000","12003  >  53639 [ACK] Seq=23975 Ack=52085 Win=65536 Len=0","54","0.000000000","10.1.1.2","0.000029000","TCP"
"511","46.492916","9.367574000","0.000035000","0.000035000","10.22.1.2","0.000035000","12003  >  53639 [ACK] Seq=23975 Ack=60845 Win=65536 Len=0","54","0.000000000","10.1.1.2","0.000035000","TCP"
"519","46.495601","9.370259000","0.000054000","0.000054000","10.22.1.2","0.000054000","12003  >  53639 [ACK] Seq=23975 Ack=71065 Win=64000 Len=2920","2974","0.000000000","10.1.1.2","0.000054000","TCP"
"520","46.496082","9.370740000","0.000481000","0.000481000","10.22.1.2","0.000481000","[TCP Window Update] 12003  >  53639 [ACK] Seq=26895 Ack=71065 Win=65536 Len=0","54","0.000000000","10.1.1.2","0.000481000","TCP"
"529","46.511567","9.386225000","0.000047000","0.000047000","10.22.1.2","0.000047000","12003  >  53639 [PSH, ACK] Seq=26895 Ack=81285 Win=65536 Len=3652","3706","0.000000000","10.1.1.2","0.000047000","TCP"
"531","46.567491","9.442151000","0.000079000","0.000079000","10.22.1.2","0.000079000","12002  >  53640 [PSH, ACK] Seq=29027 Ack=1015 Win=64768 Len=3168","3222","0.000000000","10.1.1.2","0.000079000","TCP"
"547","46.760541","9.635199000","0.000106000","0.000106000","10.22.1.2","0.000106000","12003  >  53639 [ACK] Seq=30547 Ack=81285 Win=65536 Len=4380","4434","0.000000000","10.1.1.2","0.000106000","TCP"
"552","46.775114","9.649772000","0.000030000","0.000030000","10.22.1.2","0.000030000","12003  >  53639 [ACK] Seq=34927 Ack=87125 Win=65536 Len=0","54","0.000000000","10.1.1.2","0.000030000","TCP"
"560","46.783115","9.657773000","0.000038000","0.000034000","10.22.1.2","0.000038000","12003  >  53639 [ACK] Seq=34927 Ack=95885 Win=65536 Len=0","54","0.000000000","10.1.1.2","0.000034000","TCP"
"572","46.844347","9.719007000","0.000048000","0.000048000","10.22.1.2","0.000048000","12002  >  53640 [PSH, ACK] Seq=32195 Ack=1015 Win=64768 Len=1408","1462","0.000000000","10.1.1.2","0.000048000","TCP"
"573","46.867185","9.741845000","0.022838000","0.022838000","10.22.1.2","0.022838000","12002  >  53640 [PSH, ACK] Seq=33603 Ack=1015 Win=64768 Len=1584","1638","0.000000000","10.1.1.2","0.022838000","TCP"
"575","47.005427","9.880087000","0.000049000","0.000049000","10.22.1.2","0.000049000","12002  >  53640 [PSH, ACK] Seq=35187 Ack=1015 Win=64768 Len=528","582","0.000000000","10.1.1.2","0.000049000","TCP"
"580","47.172902","10.047562000","0.167475000","0.051673000","10.22.1.2","0.167475000","12002  >  53640 [PSH, ACK] Seq=35715 Ack=1015 Win=64768 Len=1584","1638","0.000000000","10.1.1.2","0.051673000","TCP"
"585","47.234396","13.078930000","0.000057000","0.000057000","10.22.1.2","0.000057000","12001  >  53638 [PSH, ACK] Seq=29296 Ack=31727 Win=65024 Len=594","648","0.000000000","10.1.1.2","0.000057000","TCP"
"587","47.294336","10.168994000","0.000086000","0.000086000","10.22.1.2","0.000086000","12003  >  53639 [ACK] Seq=34927 Ack=97345 Win=65536 Len=2920","2974","0.000000000","10.1.1.2","0.000086000","TCP"
"591","47.295616","10.170274000","0.000042000","0.000042000","10.22.1.2","0.000042000","12003  >  53639 [PSH, ACK] Seq=37847 Ack=100265 Win=65536 Len=6584","6638","0.000000000","10.1.1.2","0.000042000","TCP"
"600","47.298253","10.172911000","0.000019000","0.000019000","10.22.1.2","0.000019000","12003  >  53639 [ACK] Seq=44431 Ack=104645 Win=65536 Len=0","54","0.000000000","10.1.1.2","0.000019000","TCP"
"623","47.302261","10.176919000","0.000027000","0.000027000","10.22.1.2","0.000027000","12003  >  53639 [ACK] Seq=44431 Ack=114865 Win=64000 Len=0","54","0.000000000","10.1.1.2","0.000027000","TCP"
"624","47.302666","10.177324000","0.000405000","0.000405000","10.22.1.2","0.000405000","[TCP Window Update] 12003  >  53639 [ACK] Seq=44431 Ack=114865 Win=65536 Len=0","54","0.000000000","10.1.1.2","0.000405000","TCP"
"632","47.303587","10.178245000","0.000022000","0.000022000","10.22.1.2","0.000022000","12003  >  53639 [ACK] Seq=44431 Ack=125085 Win=62720 Len=0","54","0.000000000","10.1.1.2","0.000022000","TCP"
"633","47.303634","10.178292000","0.000047000","0.000047000","10.22.1.2","0.000047000","[TCP Window Update] 12003  >  53639 [ACK] Seq=44431 Ack=125085 Win=65536 Len=0","54","0.000000000","10.1.1.2","0.000047000","TCP"
"640","47.306267","10.180925000","0.000038000","0.000038000","10.22.1.2","0.000038000","12003  >  53639 [ACK] Seq=44431 Ack=133845 Win=62720 Len=0","54","0.000000000","10.1.1.2","0.000038000","TCP"
"641","47.306337","10.180995000","0.000070000","0.000070000","10.22.1.2","0.000070000","[TCP Window Update] 12003  >  53639 [ACK] Seq=44431 Ack=133845 Win=65536 Len=0","54","0.000000000","10.1.1.2","0.000070000","TCP"
"643","47.308918","10.183576000","0.000038000","0.000038000","10.22.1.2","0.000038000","[TCP Dup ACK 640#1] 12003  >  53639 [ACK] Seq=44431 Ack=133845 Win=65536 Len=0 SLE=135305 SRE=135939","66","0.000000000","10.1.1.2","0.000038000","TCP"
"652","47.322235","10.196893000","0.000026000","0.000026000","10.22.1.2","0.000026000","[TCP Dup ACK 640#2] 12003  >  53639 [ACK] Seq=44431 Ack=133845 Win=65536 Len=0 SLE=135305 SRE=137399","66","0.000000000","10.1.1.2","0.000026000","TCP"
"653","47.322253","10.196911000","0.000018000","0.000018000","10.22.1.2","0.000018000","[TCP Dup ACK 640#3] 12003  >  53639 [ACK] Seq=44431 Ack=133845 Win=65536 Len=0 SLE=135305 SRE=138859","66","0.000000000","10.1.1.2","0.000018000","TCP"
"654","47.322267","10.196925000","0.000014000","0.000014000","10.22.1.2","0.000014000","[TCP Dup ACK 640#4] 12003  >  53639 [ACK] Seq=44431 Ack=133845 Win=65536 Len=0 SLE=135305 SRE=140319","66","0.000000000","10.1.1.2","0.000014000","TCP"
"655","47.322282","10.196940000","0.000015000","0.000015000","10.22.1.2","0.000015000","[TCP Dup ACK 640#5] 12003  >  53639 [ACK] Seq=44431 Ack=133845 Win=65536 Len=0 SLE=135305 SRE=141779","66","0.000000000","10.1.1.2","0.000015000","TCP"
"656","47.322297","10.196955000","0.000015000","0.000015000","10.22.1.2","0.000015000","[TCP Dup ACK 640#6] 12003  >  53639 [ACK] Seq=44431 Ack=133845 Win=65536 Len=0 SLE=135305 SRE=143239","66","0.000000000","10.1.1.2","0.000015000","TCP"
"657","47.322312","10.196970000","0.000015000","0.000015000","10.22.1.2","0.000015000","[TCP Dup ACK 640#7] 12003  >  53639 [ACK] Seq=44431 Ack=133845 Win=65536 Len=0 SLE=135305 SRE=144699","66","0.000000000","10.1.1.2","0.000015000","TCP"
"658","47.322327","10.196985000","0.000015000","0.000015000","10.22.1.2","0.000015000","[TCP Dup ACK 640#8] 12003  >  53639 [ACK] Seq=44431 Ack=133845 Win=65536 Len=0 SLE=135305 SRE=146159","66","0.000000000","10.1.1.2","0.000015000","TCP"
"660","47.372864","10.247524000","0.000085000","0.000085000","10.22.1.2","0.000085000","12002  >  53640 [PSH, ACK] Seq=37299 Ack=1015 Win=64768 Len=1936","1990","0.000000000","10.1.1.2","0.000085000","TCP"
"668","47.516676","10.391334000","0.000127000","0.000127000","10.22.1.2","0.000127000","12003  >  53639 [ACK] Seq=44431 Ack=133845 Win=65536 Len=18980","19034","0.000000000","10.1.1.2","0.000127000","TCP"
"683","47.576478","10.451136000","0.000029000","0.000029000","10.22.1.2","0.000029000","12003  >  53639 [PSH, ACK] Seq=63411 Ack=133845 Win=65536 Len=4499","4553","0.000000000","10.1.1.2","0.000029000","TCP"
"685","47.580467","10.455125000","0.000028000","0.000028000","10.22.1.2","0.000028000","[TCP Dup ACK 640#9] 12003  >  53639 [ACK] Seq=67910 Ack=133845 Win=65536 Len=0 SLE=135305 SRE=147619","66","0.000000000","10.1.1.2","0.000028000","TCP"
"691","47.600435","10.475093000","0.000029000","0.000029000","10.22.1.2","0.000029000","[TCP Dup ACK 640#10] 12003  >  53639 [ACK] Seq=67910 Ack=133845 Win=65536 Len=0 SLE=149079 SRE=150539 SLE=135305 SRE=147619","74","0.000000000","10.1.1.2","0.000029000","TCP"
"698","47.601777","10.476435000","0.000023000","0.000023000","10.22.1.2","0.000023000","[TCP Dup ACK 640#11] 12003  >  53639 [ACK] Seq=67910 Ack=133845 Win=65536 Len=0 SLE=149079 SRE=151999 SLE=135305 SRE=147619","74","0.000000000","10.1.1.2","0.000023000","TCP"
"699","47.601794","10.476452000","0.000017000","0.000017000","10.22.1.2","0.000017000","[TCP Dup ACK 640#12] 12003  >  53639 [ACK] Seq=67910 Ack=133845 Win=65536 Len=0 SLE=149079 SRE=153459 SLE=135305 SRE=147619","74","0.000000000","10.1.1.2","0.000017000","TCP"
"700","47.601809","10.476467000","0.000015000","0.000015000","10.22.1.2","0.000015000","[TCP Dup ACK 640#13] 12003  >  53639 [ACK] Seq=67910 Ack=133845 Win=65536 Len=0 SLE=149079 SRE=154919 SLE=135305 SRE=147619","74","0.000000000","10.1.1.2","0.000015000","TCP"
"701","47.601824","10.476482000","0.000015000","0.000015000","10.22.1.2","0.000015000","[TCP Dup ACK 640#14] 12003  >  53639 [ACK] Seq=67910 Ack=133845 Win=65536 Len=0 SLE=149079 SRE=156379 SLE=135305 SRE=147619","74","0.000000000","10.1.1.2","0.000015000","TCP"
"702","47.601839","10.476497000","0.000015000","0.000015000","10.22.1.2","0.000015000","[TCP Dup ACK 640#15] 12003  >  53639 [ACK] Seq=67910 Ack=133845 Win=65536 Len=0 SLE=149079 SRE=157839 SLE=135305 SRE=147619","74","0.000000000","10.1.1.2","0.000015000","TCP"
"703","47.601855","10.476513000","0.000016000","0.000016000","10.22.1.2","0.000016000","[TCP Dup ACK 640#16] 12003  >  53639 [ACK] Seq=67910 Ack=133845 Win=65536 Len=0 SLE=159299 SRE=160759 SLE=149079 SRE=157839 SLE=135305 SRE=147619","82","0.000000000","10.1.1.2","0.000016000","TCP"
"706","47.672386","10.547046000","0.000082000","0.000082000","10.22.1.2","0.000082000","12002  >  53640 [PSH, ACK] Seq=39235 Ack=1015 Win=64768 Len=1232","1286","0.000000000","10.1.1.2","0.000082000","TCP"
"707","47.676178","10.550838000","0.003792000","0.003792000","10.22.1.2","0.003792000","12002  >  53640 [PSH, ACK] Seq=40467 Ack=1015 Win=64768 Len=1584","1638","0.000000000","10.1.1.2","0.003792000","TCP"
"712","47.808128","10.682788000","0.000048000","0.000048000","10.22.1.2","0.000048000","12002  >  53640 [PSH, ACK] Seq=42051 Ack=1015 Win=64768 Len=1232","1286","0.000000000","10.1.1.2","0.000048000","TCP"
"719","47.978508","10.853168000","0.000042000","0.000042000","10.22.1.2","0.000042000","12002  >  53640 [PSH, ACK] Seq=43283 Ack=1015 Win=64768 Len=704","758","0.000000000","10.1.1.2","0.000042000","TCP"
"721","48.014124","13.858658000","0.779728000","0.001046000","10.22.1.2","0.779728000","12001  >  53638 [PSH, ACK] Seq=29890 Ack=31727 Win=65024 Len=1753","1807","0.000000000","10.1.1.2","0.001046000","TCP"
"723","48.037077","13.881611000","0.000038000","0.000038000","10.22.1.2","0.000038000","12001  >  53638 [PSH, ACK] Seq=31643 Ack=32320 Win=64512 Len=594","648","0.000000000","10.1.1.2","0.000038000","TCP"
"724","48.037218","10.911878000","0.058710000","0.000141000","10.22.1.2","0.058710000","12002  >  53640 [PSH, ACK] Seq=43987 Ack=1015 Win=64768 Len=1584","1638","0.000000000","10.1.1.2","0.000141000","TCP"
"728","48.100993","10.975651000","0.000049000","0.000049000","10.22.1.2","0.000049000","[TCP Dup ACK 640#17] 12003  >  53639 [ACK] Seq=67910 Ack=133845 Win=65536 Len=0 SLE=159299 SRE=162219 SLE=149079 SRE=157839 SLE=135305 SRE=147619","82","0.000000000","10.1.1.2","0.000049000","TCP"
"729","48.101012","10.975670000","0.000019000","0.000019000","10.22.1.2","0.000019000","[TCP Dup ACK 640#18] 12003  >  53639 [ACK] Seq=67910 Ack=133845 Win=65536 Len=0 SLE=159299 SRE=163679 SLE=149079 SRE=157839 SLE=135305 SRE=147619","82","0.000000000","10.1.1.2","0.000019000","TCP"
"730","48.101028","10.975686000","0.000016000","0.000016000","10.22.1.2","0.000016000","[TCP Dup ACK 640#19] 12003  >  53639 [ACK] Seq=67910 Ack=133845 Win=65536 Len=0 SLE=159299 SRE=165139 SLE=149079 SRE=157839 SLE=135305 SRE=147619","82","0.000000000","10.1.1.2","0.000016000","TCP"
"755","48.109000","10.983658000","0.000054000","0.000054000","10.22.1.2","0.000054000","[TCP Dup ACK 640#20] 12003  >  53639 [ACK] Seq=67910 Ack=133845 Win=65536 Len=0 SLE=159299 SRE=166599 SLE=149079 SRE=157839 SLE=135305 SRE=147619","82","0.000000000","10.1.1.2","0.000054000","TCP"
"758","48.111525","10.986183000","0.002525000","0.001756000","10.22.1.2","0.002525000","12003  >  53639 [PSH, ACK] Seq=67910 Ack=133845 Win=65536 Len=16448","16502","0.000000000","10.1.1.2","0.001756000","TCP"
"774","48.119627","10.994285000","0.000037000","0.000034000","10.22.1.2","0.000037000","[TCP Dup ACK 640#21] 12003  >  53639 [ACK] Seq=84358 Ack=133845 Win=65536 Len=0 SLE=159299 SRE=168059 SLE=149079 SRE=157839 SLE=135305 SRE=147619","82","0.000000000","10.1.1.2","0.000034000","TCP"
"775","48.119645","10.994303000","0.000018000","0.000018000","10.22.1.2","0.000018000","[TCP Dup ACK 640#22] 12003  >  53639 [ACK] Seq=84358 Ack=133845 Win=65536 Len=0 SLE=159299 SRE=169519 SLE=149079 SRE=157839 SLE=135305 SRE=147619","82","0.000000000","10.1.1.2","0.000018000","TCP"
"776","48.119660","10.994318000","0.000015000","0.000015000","10.22.1.2","0.000015000","[TCP Dup ACK 640#23] 12003  >  53639 [ACK] Seq=84358 Ack=133845 Win=65536 Len=0 SLE=159299 SRE=170979 SLE=149079 SRE=157839 SLE=135305 SRE=147619","82","0.000000000","10.1.1.2","0.000015000","TCP"
"777","48.119678","10.994336000","0.000018000","0.000018000","10.22.1.2","0.000018000","[TCP Dup ACK 640#24] 12003  >  53639 [ACK] Seq=84358 Ack=133845 Win=65536 Len=0 SLE=159299 SRE=172439 SLE=149079 SRE=157839 SLE=135305 SRE=147619","82","0.000000000","10.1.1.2","0.000018000","TCP"
"778","48.119693","10.994351000","0.000015000","0.000015000","10.22.1.2","0.000015000","[TCP Dup ACK 640#25] 12003  >  53639 [ACK] Seq=84358 Ack=133845 Win=65536 Len=0 SLE=159299 SRE=173899 SLE=149079 SRE=157839 SLE=135305 SRE=147619","82","0.000000000","10.1.1.2","0.000015000","TCP"
"779","48.119708","10.994366000","0.000015000","0.000015000","10.22.1.2","0.000015000","[TCP Dup ACK 640#26] 12003  >  53639 [ACK] Seq=84358 Ack=133845 Win=65536 Len=0 SLE=159299 SRE=175359 SLE=149079 SRE=157839 SLE=135305 SRE=147619","82","0.000000000","10.1.1.2","0.000015000","TCP"
"780","48.119723","10.994381000","0.000015000","0.000015000","10.22.1.2","0.000015000","[TCP Dup ACK 640#27] 12003  >  53639 [ACK] Seq=84358 Ack=133845 Win=65536 Len=0 SLE=159299 SRE=176057 SLE=149079 SRE=157839 SLE=135305 SRE=147619","82","0.000000000","10.1.1.2","0.000015000","TCP"
"786","48.131595","11.006253000","0.000043000","0.000043000","10.22.1.2","0.000043000","12003  >  53639 [ACK] Seq=84358 Ack=147619 Win=65536 Len=0 SLE=159299 SRE=176057 SLE=149079 SRE=157839","74","0.000000000","10.1.1.2","0.000043000","TCP"
"793","48.288578","11.163238000","0.110435000","0.045175000","10.22.1.2","0.110435000","12002  >  53640 [PSH, ACK] Seq=45571 Ack=1015 Win=64768 Len=1584","1638","0.000000000","10.1.1.2","0.045175000","TCP"
"809","48.384537","11.259195000","0.000053000","0.000053000","10.22.1.2","0.000053000","[TCP Fast Retransmission] 12003  >  53639 [ACK] Seq=57571 Ack=147619 Win=65536 Len=1460","1514","0.000000000","10.1.1.2","0.000053000","TCP"
"814","48.412482","11.287140000","0.000054000","0.000054000","10.22.1.2","0.000054000","12003  >  53639 [ACK] Seq=84358 Ack=157839 Win=65536 Len=0 SLE=159299 SRE=176057","66","0.000000000","10.1.1.2","0.000054000","TCP"
"818","48.483025","11.357685000","0.000041000","0.000041000","10.22.1.2","0.000041000","12002  >  53640 [PSH, ACK] Seq=47155 Ack=1015 Win=64768 Len=352","406","0.000000000","10.1.1.2","0.000041000","TCP"
"819","48.487367","11.362027000","0.004342000","0.004342000","10.22.1.2","0.004342000","12002  >  53640 [PSH, ACK] Seq=47507 Ack=1015 Win=64768 Len=1584","1638","0.000000000","10.1.1.2","0.004342000","TCP"
"825","48.612146","11.486806000","0.000037000","0.000037000","10.22.1.2","0.000037000","12002  >  53640 [PSH, ACK] Seq=49091 Ack=1015 Win=64768 Len=704","758","0.000000000","10.1.1.2","0.000037000","TCP"
"829","48.756992","11.631652000","0.144846000","0.014387000","10.22.1.2","0.144846000","12002  >  53640 [PSH, ACK] Seq=49795 Ack=1015 Win=64768 Len=1584","1638","0.000000000","10.1.1.2","0.014387000","TCP"
"832","48.842442","11.717102000","0.000039000","0.000039000","10.22.1.2","0.000039000","12002  >  53640 [PSH, ACK] Seq=51379 Ack=1015 Win=64768 Len=176","230","0.000000000","10.1.1.2","0.000039000","TCP"
"834","48.906352","11.781010000","0.000051000","0.000051000","10.22.1.2","0.000051000","12003  >  53639 [ACK] Seq=84358 Ack=176057 Win=65536 Len=0","54","0.000000000","10.1.1.2","0.000051000","TCP"
"856","48.937627","11.812287000","0.095185000","0.002000000","10.22.1.2","0.095185000","12002  >  53640 [PSH, ACK] Seq=51555 Ack=1015 Win=64768 Len=1584","1638","0.000000000","10.1.1.2","0.002000000","TCP"
