"No.","Time","Time since first frame in this TCP stream","segment delta","Time delta from previous captured frame","Destination","Delta Time (conv)","Info","Length","Time shift for this packet","Source","Time delta from previous captured frame","Protocol"
"5","0.000092","0.000092000","0.000092000","0.000086000","10.22.1.2","0.000092000","12003  >  53639 [ACK] Seq=8761 Ack=1 Win=1745 Len=1460","1514","0.000000000","10.1.1.2","0.000086000","TCP"
"8","0.089270","0.000082000","0.000082000","0.000082000","10.22.1.2","0.000082000","12002  >  53640 [PSH, ACK] Seq=4877 Ack=1 Win=253 Len=528","582","0.000000000","10.1.1.2","0.000082000","TCP"
"9","0.108481","0.019293000","0.019211000","0.019211000","10.22.1.2","0.019211000","12002  >  53640 [PSH, ACK] Seq=5405 Ack=1 Win=253 Len=1584","1638","0.000000000","10.1.1.2","0.019211000","TCP"
"11","0.211696","0.211696000","0.000046000","0.000046000","10.22.1.2","0.000046000","12003  >  53639 [ACK] Seq=10221 Ack=1 Win=1745 Len=2920","2974","0.000000000","10.1.1.2","0.000046000","TCP"
"14","0.280903","0.191715000","0.000039000","0.000039000","10.22.1.2","0.000039000","12002  >  53640 [PSH, ACK] Seq=6989 Ack=1 Win=253 Len=1232","1286","0.000000000","10.1.1.2","0.000039000","TCP"
"16","0.286213","0.286213000","0.000027000","0.000027000","10.22.1.2","0.000027000","12003  >  53639 [ACK] Seq=13141 Ack=1 Win=1745 Len=4380","4434","0.000000000","10.1.1.2","0.000027000","TCP"
"22","0.360813","0.360813000","0.000068000","0.000068000","10.22.1.2","0.000068000","12003  >  53639 [ACK] Seq=17521 Ack=2921 Win=1785 Len=1460","1514","0.000000000","10.1.1.2","0.000068000","TCP"
"26","0.362104","0.362104000","0.000031000","0.000031000","10.22.1.2","0.000031000","12003  >  53639 [ACK] Seq=18981 Ack=7301 Win=1785 Len=0","54","0.000000000","10.1.1.2","0.000031000","TCP"
"31","0.363441","0.363441000","0.000035000","0.000035000","10.22.1.2","0.000035000","12003  >  53639 [ACK] Seq=18981 Ack=13141 Win=1785 Len=0","54","0.000000000","10.1.1.2","0.000035000","TCP"
"34","0.364757","0.364757000","0.000027000","0.000027000","10.22.1.2","0.000027000","12003  >  53639 [ACK] Seq=18981 Ack=16061 Win=1785 Len=0","54","0.000000000","10.1.1.2","0.000027000","TCP"
"37","0.366086","0.366086000","0.000025000","0.000025000","10.22.1.2","0.000025000","12003  >  53639 [ACK] Seq=18981 Ack=18981 Win=1785 Len=0","54","0.000000000","10.1.1.2","0.000025000","TCP"
"52","0.609702","0.520514000","0.000037000","0.000037000","10.22.1.2","0.000037000","12002  >  53640 [PSH, ACK] Seq=8221 Ack=1 Win=253 Len=352","406","0.000000000","10.1.1.2","0.000037000","TCP"
"53","0.609758","0.520570000","0.000056000","0.000056000","10.22.1.2","0.000056000","12002  >  53640 [PSH, ACK] Seq=8573 Ack=1 Win=253 Len=3168","3222","0.000000000","10.1.1.2","0.000056000","TCP"
"63","0.911903","0.822715000","0.000056000","0.000056000","10.22.1.2","0.000056000","12002  >  53640 [PSH, ACK] Seq=11741 Ack=1 Win=253 Len=1408","1462","0.000000000","10.1.1.2","0.000056000","TCP"
"64","0.911961","0.822773000","0.000058000","0.000058000","10.22.1.2","0.000058000","12002  >  53640 [PSH, ACK] Seq=13149 Ack=1 Win=253 Len=1584","1638","0.000000000","10.1.1.2","0.000058000","TCP"
"66","1.005055","1.005055000","0.000027000","0.000027000","10.22.1.2","0.000027000","12003  >  53639 [ACK] Seq=18981 Ack=18981 Win=1785 Len=1460","1514","0.000000000","10.1.1.2","0.000027000","TCP"
"68","1.022360","1.022360000","0.000028000","0.000028000","10.22.1.2","0.000028000","12003  >  53639 [ACK] Seq=20441 Ack=18981 Win=1785 Len=4380","4434","0.000000000","10.1.1.2","0.000028000","TCP"
"70","1.092942","1.092942000","0.000047000","0.000047000","10.22.1.2","0.000047000","12003  >  53639 [ACK] Seq=24821 Ack=18981 Win=1785 Len=4380","4434","0.000000000","10.1.1.2","0.000047000","TCP"
"76","1.167523","1.167523000","0.000082000","0.000082000","10.22.1.2","0.000082000","12003  >  53639 [ACK] Seq=29201 Ack=20441 Win=1876 Len=1460","1514","0.000000000","10.1.1.2","0.000082000","TCP"
"83","1.168821","1.168821000","0.000043000","0.000043000","10.22.1.2","0.000043000","12003  >  53639 [ACK] Seq=30661 Ack=29201 Win=1876 Len=0","54","0.000000000","10.1.1.2","0.000043000","TCP"
"88","1.171449","1.171449000","0.000022000","0.000022000","10.22.1.2","0.000022000","12003  >  53639 [ACK] Seq=30661 Ack=35041 Win=1876 Len=0","54","0.000000000","10.1.1.2","0.000022000","TCP"
"92","1.180800","1.180800000","0.000045000","0.000045000","10.22.1.2","0.000045000","12003  >  53639 [ACK] Seq=30661 Ack=39421 Win=1876 Len=0","54","0.000000000","10.1.1.2","0.000045000","TCP"
"104","1.281957","1.192769000","0.000044000","0.000044000","10.22.1.2","0.000044000","12002  >  53640 [PSH, ACK] Seq=14733 Ack=1 Win=253 Len=528","582","0.000000000","10.1.1.2","0.000044000","TCP"
"105","1.282010","1.192822000","0.000053000","0.000053000","10.22.1.2","0.000053000","12002  >  53640 [PSH, ACK] Seq=15261 Ack=1 Win=253 Len=2112","2166","0.000000000","10.1.1.2","0.000053000","TCP"
"112","1.440566","1.351378000","0.022875000","0.005534000","10.22.1.2","0.022875000","12002  >  53640 [PSH, ACK] Seq=17373 Ack=1 Win=253 Len=1584","1638","0.000000000","10.1.1.2","0.005534000","TCP"
"124","1.719962","1.630774000","0.000079000","0.000079000","10.22.1.2","0.000079000","12002  >  53640 [PSH, ACK] Seq=18957 Ack=1 Win=253 Len=1056","1110","0.000000000","10.1.1.2","0.000079000","TCP"
"125","1.720098","1.630910000","0.000136000","0.000136000","10.22.1.2","0.000136000","12002  >  53640 [PSH, ACK] Seq=20013 Ack=1 Win=253 Len=1584","1638","0.000000000","10.1.1.2","0.000136000","TCP"
"127","1.829104","1.829104000","0.000063000","0.000063000","10.22.1.2","0.000063000","12003  >  53639 [ACK] Seq=30661 Ack=39421 Win=1876 Len=7300","7354","0.000000000","10.1.1.2","0.000063000","TCP"
"129","1.906298","1.906298000","0.000052000","0.000052000","10.22.1.2","0.000052000","12003  >  53639 [ACK] Seq=37961 Ack=39421 Win=1876 Len=4380","4434","0.000000000","10.1.1.2","0.000052000","TCP"
"139","1.986218","1.986218000","0.000086000","0.000086000","10.22.1.2","0.000086000","12003  >  53639 [ACK] Seq=42341 Ack=46721 Win=1927 Len=1460","1514","0.000000000","10.1.1.2","0.000086000","TCP"
"144","1.991477","1.991477000","0.000037000","0.000037000","10.22.1.2","0.000037000","12003  >  53639 [ACK] Seq=43801 Ack=52561 Win=1927 Len=0","54","0.000000000","10.1.1.2","0.000037000","TCP"
"147","2.024754","2.024754000","0.000041000","0.000041000","10.22.1.2","0.000041000","12003  >  53639 [ACK] Seq=43801 Ack=54021 Win=1927 Len=0 SLE=55481 SRE=56941","66","0.000000000","10.1.1.2","0.000041000","TCP"
"149","2.030060","2.030060000","0.000025000","0.000025000","10.22.1.2","0.000025000","[TCP Dup ACK 147#1] 12003  >  53639 [ACK] Seq=43801 Ack=54021 Win=1927 Len=0 SLE=55481 SRE=58401","66","0.000000000","10.1.1.2","0.000025000","TCP"
"152","2.031389","2.031389000","0.000020000","0.000020000","10.22.1.2","0.000020000","[TCP Dup ACK 147#2] 12003  >  53639 [ACK] Seq=43801 Ack=54021 Win=1927 Len=0 SLE=55481 SRE=59861","66","0.000000000","10.1.1.2","0.000020000","TCP"
"153","2.031404","2.031404000","0.000015000","0.000015000","10.22.1.2","0.000015000","[TCP Dup ACK 147#3] 12003  >  53639 [ACK] Seq=43801 Ack=54021 Win=1927 Len=0 SLE=55481 SRE=61321","66","0.000000000","10.1.1.2","0.000015000","TCP"
"166","2.091333","2.002145000","0.000058000","0.000058000","10.22.1.2","0.000058000","12002  >  53640 [PSH, ACK] Seq=21597 Ack=1 Win=253 Len=1408","1462","0.000000000","10.1.1.2","0.000058000","TCP"
"167","2.091404","2.002216000","0.000071000","0.000071000","10.22.1.2","0.000071000","12002  >  53640 [PSH, ACK] Seq=23005 Ack=1 Win=253 Len=2288","2342","0.000000000","10.1.1.2","0.000071000","TCP"
"180","2.358569","2.269381000","0.112880000","0.095533000","10.22.1.2","0.112880000","12002  >  53640 [PSH, ACK] Seq=25293 Ack=1 Win=253 Len=1584","1638","0.000000000","10.1.1.2","0.095533000","TCP"
"183","2.527985","2.438797000","0.000073000","0.000073000","10.22.1.2","0.000073000","12002  >  53640 [PSH, ACK] Seq=26877 Ack=1 Win=253 Len=352","406","0.000000000","10.1.1.2","0.000073000","TCP"
"188","2.646456","2.646456000","0.000070000","0.000070000","10.22.1.2","0.000070000","12003  >  53639 [PSH, ACK] Seq=43801 Ack=54021 Win=1927 Len=8760","8814","0.000000000","10.1.1.2","0.000070000","TCP"
"191","2.724981","2.724981000","0.000062000","0.000060000","10.22.1.2","0.000062000","12003  >  53639 [ACK] Seq=52561 Ack=54021 Win=1927 Len=2920","2974","0.000000000","10.1.1.2","0.000060000","TCP"
"192","2.725001","2.635813000","0.000080000","0.000020000","10.22.1.2","0.000080000","12002  >  53640 [PSH, ACK] Seq=27229 Ack=1 Win=253 Len=1232","1286","0.000000000","10.1.1.2","0.000020000","TCP"
"193","2.725063","2.635875000","0.000062000","0.000062000","10.22.1.2","0.000062000","12002  >  53640 [PSH, ACK] Seq=28461 Ack=1 Win=253 Len=1936","1990","0.000000000","10.1.1.2","0.000062000","TCP"
"197","2.803497","2.803497000","0.000042000","0.000042000","10.22.1.2","0.000042000","[TCP Dup ACK 147#4] 12003  >  53639 [ACK] Seq=55481 Ack=54021 Win=1927 Len=0 SLE=55481 SRE=62781","66","0.000000000","10.1.1.2","0.000042000","TCP"
"198","2.803516","2.803516000","0.000019000","0.000019000","10.22.1.2","0.000019000","12003  >  53639 [ACK] Seq=55481 Ack=54021 Win=1927 Len=2920","2974","0.000000000","10.1.1.2","0.000019000","TCP"
"206","2.804833","2.804833000","0.000028000","0.000028000","10.22.1.2","0.000028000","[TCP Dup ACK 147#5] 12003  >  53639 [ACK] Seq=58401 Ack=54021 Win=1927 Len=0 SLE=55481 SRE=64241","66","0.000000000","10.1.1.2","0.000028000","TCP"
"207","2.804850","2.804850000","0.000017000","0.000017000","10.22.1.2","0.000017000","[TCP Dup ACK 147#6] 12003  >  53639 [ACK] Seq=58401 Ack=54021 Win=1927 Len=0 SLE=55481 SRE=65701","66","0.000000000","10.1.1.2","0.000017000","TCP"
"208","2.804864","2.804864000","0.000014000","0.000014000","10.22.1.2","0.000014000","[TCP Dup ACK 147#7] 12003  >  53639 [ACK] Seq=58401 Ack=54021 Win=1927 Len=0 SLE=55481 SRE=67161","66","0.000000000","10.1.1.2","0.000014000","TCP"
"209","2.804879","2.804879000","0.000015000","0.000015000","10.22.1.2","0.000015000","[TCP Dup ACK 147#8] 12003  >  53639 [ACK] Seq=58401 Ack=54021 Win=1927 Len=0 SLE=55481 SRE=68621","66","0.000000000","10.1.1.2","0.000015000","TCP"
"210","2.804893","2.804893000","0.000014000","0.000014000","10.22.1.2","0.000014000","[TCP Dup ACK 147#9] 12003  >  53639 [ACK] Seq=58401 Ack=54021 Win=1927 Len=0 SLE=55481 SRE=70081","66","0.000000000","10.1.1.2","0.000014000","TCP"
"211","2.804907","2.804907000","0.000014000","0.000014000","10.22.1.2","0.000014000","[TCP Dup ACK 147#10] 12003  >  53639 [ACK] Seq=58401 Ack=54021 Win=1927 Len=0 SLE=55481 SRE=71541","66","0.000000000","10.1.1.2","0.000014000","TCP"
"212","2.804921","2.804921000","0.000014000","0.000014000","10.22.1.2","0.000014000","[TCP Dup ACK 147#11] 12003  >  53639 [ACK] Seq=58401 Ack=54021 Win=1927 Len=0 SLE=55481 SRE=73001","66","0.000000000","10.1.1.2","0.000014000","TCP"
"215","2.806145","2.806145000","0.000025000","0.000025000","10.22.1.2","0.000025000","[TCP Dup ACK 147#12] 12003  >  53639 [ACK] Seq=58401 Ack=54021 Win=1927 Len=0 SLE=55481 SRE=74461","66","0.000000000","10.1.1.2","0.000025000","TCP"
"216","2.806161","2.806161000","0.000016000","0.000016000","10.22.1.2","0.000016000","[TCP Dup ACK 147#13] 12003  >  53639 [ACK] Seq=58401 Ack=54021 Win=1927 Len=0 SLE=55481 SRE=75921","66","0.000000000","10.1.1.2","0.000016000","TCP"
"224","2.835442","2.835442000","0.000030000","0.000030000","10.22.1.2","0.000030000","[TCP Dup ACK 147#14] 12003  >  53639 [ACK] Seq=58401 Ack=54021 Win=1927 Len=0 SLE=55481 SRE=77381","66","0.000000000","10.1.1.2","0.000030000","TCP"
"225","2.835459","2.835459000","0.000017000","0.000017000","10.22.1.2","0.000017000","[TCP Dup ACK 147#15] 12003  >  53639 [ACK] Seq=58401 Ack=54021 Win=1927 Len=0 SLE=55481 SRE=78841","66","0.000000000","10.1.1.2","0.000017000","TCP"
"226","2.835474","2.835474000","0.000015000","0.000015000","10.22.1.2","0.000015000","[TCP Dup ACK 147#16] 12003  >  53639 [ACK] Seq=58401 Ack=54021 Win=1927 Len=0 SLE=55481 SRE=80301","66","0.000000000","10.1.1.2","0.000015000","TCP"
"227","2.835507","2.835507000","0.000033000","0.000033000","10.22.1.2","0.000033000","12003  >  53639 [ACK] Seq=58401 Ack=80301 Win=2047 Len=0","54","0.000000000","10.1.1.2","0.000033000","TCP"
"256","3.161626","3.072438000","0.000070000","0.000070000","10.22.1.2","0.000070000","[TCP Fast Retransmission] 12002  >  53640 [PSH, ACK] Seq=21597 Ack=1 Win=253 Len=1460","1514","0.000000000","10.1.1.2","0.000070000","TCP"
"264","3.458457","3.458457000","0.000057000","0.000057000","10.22.1.2","0.000057000","12003  >  53639 [PSH, ACK] Seq=58401 Ack=80301 Win=2047 Len=7672","7726","0.000000000","10.1.1.2","0.000057000","TCP"
"265","3.458572","3.458572000","0.000115000","0.000115000","10.22.1.2","0.000115000","12003  >  53639 [ACK] Seq=66073 Ack=80301 Win=2047 Len=1460","1514","0.000000000","10.1.1.2","0.000115000","TCP"
"271","3.548979","3.548979000","0.000053000","0.000049000","10.22.1.2","0.000053000","12003  >  53639 [ACK] Seq=67533 Ack=80301 Win=2047 Len=2920","2974","0.000000000","10.1.1.2","0.000049000","TCP"
"276","3.619535","3.619535000","0.000060000","0.000060000","10.22.1.2","0.000060000","12003  >  53639 [ACK] Seq=70453 Ack=83221 Win=2070 Len=4380","4434","0.000000000","10.1.1.2","0.000060000","TCP"
"280","3.624827","3.624827000","0.000030000","0.000030000","10.22.1.2","0.000030000","12003  >  53639 [ACK] Seq=74833 Ack=87601 Win=2070 Len=0","54","0.000000000","10.1.1.2","0.000030000","TCP"
"283","3.626158","3.626158000","0.000030000","0.000030000","10.22.1.2","0.000030000","12003  >  53639 [ACK] Seq=74833 Ack=90521 Win=2070 Len=0","54","0.000000000","10.1.1.2","0.000030000","TCP"
"287","3.648803","3.648803000","0.000039000","0.000039000","10.22.1.2","0.000039000","12003  >  53639 [ACK] Seq=74833 Ack=94901 Win=2070 Len=0","54","0.000000000","10.1.1.2","0.000039000","TCP"
"310","3.925566","3.836378000","0.376636000","0.039791000","10.22.1.2","0.376636000","[TCP Retransmission] 12002  >  53640 [PSH, ACK] Seq=21597 Ack=1 Win=253 Len=1460","1514","0.000000000","10.1.1.2","0.039791000","TCP"
"315","3.967043","3.877855000","0.000135000","0.000135000","10.22.1.2","0.000135000","12002  >  53640 [ACK] Seq=30397 Ack=1 Win=253 Len=7300","7354","0.000000000","10.1.1.2","0.000135000","TCP"
"321","4.266483","4.266483000","0.000054000","0.000054000","10.22.1.2","0.000054000","12003  >  53639 [ACK] Seq=74833 Ack=94901 Win=2070 Len=4380","4434","0.000000000","10.1.1.2","0.000054000","TCP"
"323","4.269132","4.269132000","0.000048000","0.000048000","10.22.1.2","0.000048000","12003  >  53639 [ACK] Seq=79213 Ack=94901 Win=2070 Len=4380","4434","0.000000000","10.1.1.2","0.000048000","TCP"
"325","4.364966","4.364966000","0.000034000","0.000034000","10.22.1.2","0.000034000","12003  >  53639 [ACK] Seq=83593 Ack=94901 Win=2070 Len=4380","4434","0.000000000","10.1.1.2","0.000034000","TCP"
"328","4.426193","4.426193000","0.000028000","0.000028000","10.22.1.2","0.000028000","12003  >  53639 [ACK] Seq=87973 Ack=94901 Win=2070 Len=2920","2974","0.000000000","10.1.1.2","0.000028000","TCP"
"333","4.432886","4.432886000","0.000055000","0.000055000","10.22.1.2","0.000055000","12003  >  53639 [ACK] Seq=90893 Ack=100741 Win=2053 Len=1460","1514","0.000000000","10.1.1.2","0.000055000","TCP"
"339","4.470148","4.470148000","0.000044000","0.000044000","10.22.1.2","0.000044000","12003  >  53639 [ACK] Seq=92353 Ack=108041 Win=2053 Len=0","54","0.000000000","10.1.1.2","0.000044000","TCP"
"368","4.774979","4.685791000","0.000043000","0.000043000","10.22.1.2","0.000043000","12002  >  53640 [PSH, ACK] Seq=37697 Ack=1 Win=253 Len=3964","4018","0.000000000","10.1.1.2","0.000043000","TCP"
"377","5.070495","5.070495000","0.000038000","0.000038000","10.22.1.2","0.000038000","12003  >  53639 [ACK] Seq=92353 Ack=108041 Win=2053 Len=4380","4434","0.000000000","10.1.1.2","0.000038000","TCP"
"379","5.078473","5.078473000","0.000029000","0.000029000","10.22.1.2","0.000029000","12003  >  53639 [ACK] Seq=96733 Ack=108041 Win=2053 Len=4380","4434","0.000000000","10.1.1.2","0.000029000","TCP"
"381","5.171711","5.171711000","0.000071000","0.000071000","10.22.1.2","0.000071000","12003  >  53639 [ACK] Seq=101113 Ack=108041 Win=2053 Len=5840","5894","0.000000000","10.1.1.2","0.000071000","TCP"
"383","5.235596","5.235596000","0.000061000","0.000061000","10.22.1.2","0.000061000","12003  >  53639 [ACK] Seq=106953 Ack=108041 Win=2053 Len=2920","2974","0.000000000","10.1.1.2","0.000061000","TCP"
"386","5.238248","5.238248000","0.000059000","0.000059000","10.22.1.2","0.000059000","12003  >  53639 [ACK] Seq=109873 Ack=110961 Win=2041 Len=1460","1514","0.000000000","10.1.1.2","0.000059000","TCP"
"389","5.240887","5.240887000","0.000037000","0.000037000","10.22.1.2","0.000037000","12003  >  53639 [ACK] Seq=111333 Ack=113881 Win=2030 Len=0","54","0.000000000","10.1.1.2","0.000037000","TCP"
"396","5.280825","5.280825000","0.000038000","0.000038000","10.22.1.2","0.000038000","12003  >  53639 [ACK] Seq=111333 Ack=116801 Win=2024 Len=0","54","0.000000000","10.1.1.2","0.000038000","TCP"
"401","5.283485","5.283485000","0.000034000","0.000034000","10.22.1.2","0.000034000","12003  >  53639 [ACK] Seq=111333 Ack=122641 Win=2024 Len=0","54","0.000000000","10.1.1.2","0.000034000","TCP"
"425","5.580419","5.491231000","0.000118000","0.000118000","10.22.1.2","0.000118000","12002  >  53640 [ACK] Seq=41661 Ack=1 Win=253 Len=10220","10274","0.000000000","10.1.1.2","0.000118000","TCP"
"434","5.877205","5.877205000","0.000048000","0.000048000","10.22.1.2","0.000048000","12003  >  53639 [ACK] Seq=111333 Ack=122641 Win=2024 Len=2920","2974","0.000000000","10.1.1.2","0.000048000","TCP"
"436","5.883836","5.883836000","0.000029000","0.000029000","10.22.1.2","0.000029000","12003  >  53639 [ACK] Seq=114253 Ack=122641 Win=2024 Len=5840","5894","0.000000000","10.1.1.2","0.000029000","TCP"
"438","5.989006","5.989006000","0.000032000","0.000032000","10.22.1.2","0.000032000","12003  >  53639 [ACK] Seq=120093 Ack=122641 Win=2024 Len=2920","2974","0.000000000","10.1.1.2","0.000032000","TCP"
"443","6.028937","6.028937000","0.000029000","0.000029000","10.22.1.2","0.000029000","12003  >  53639 [ACK] Seq=123013 Ack=122641 Win=2024 Len=2920","2974","0.000000000","10.1.1.2","0.000029000","TCP"
"447","6.042282","6.042282000","0.000055000","0.000055000","10.22.1.2","0.000055000","12003  >  53639 [PSH, ACK] Seq=125933 Ack=125561 Win=2013 Len=5840","5894","0.000000000","10.1.1.2","0.000055000","TCP"
"450","6.044913","6.044913000","0.000031000","0.000031000","10.22.1.2","0.000031000","12003  >  53639 [ACK] Seq=131773 Ack=128481 Win=2007 Len=0","54","0.000000000","10.1.1.2","0.000031000","TCP"
"458","6.092875","6.092875000","0.000050000","0.000050000","10.22.1.2","0.000050000","12003  >  53639 [ACK] Seq=131773 Ack=138701 Win=2001 Len=0","54","0.000000000","10.1.1.2","0.000050000","TCP"
"459","6.092936","6.092936000","0.000061000","0.000061000","10.22.1.2","0.000061000","[TCP Window Update] 12003  >  53639 [ACK] Seq=131773 Ack=138701 Win=2007 Len=0","54","0.000000000","10.1.1.2","0.000061000","TCP"
"484","6.397686","6.308498000","0.000039000","0.000039000","10.22.1.2","0.000039000","12002  >  53640 [PSH, ACK] Seq=51881 Ack=1 Win=253 Len=4036","4090","0.000000000","10.1.1.2","0.000039000","TCP"
"493","6.682556","6.682556000","0.000036000","0.000036000","10.22.1.2","0.000036000","12003  >  53639 [ACK] Seq=131773 Ack=138701 Win=2007 Len=2920","2974","0.000000000","10.1.1.2","0.000036000","TCP"
"495","6.693190","6.693190000","0.000025000","0.000025000","10.22.1.2","0.000025000","12003  >  53639 [ACK] Seq=134693 Ack=138701 Win=2007 Len=4380","4434","0.000000000","10.1.1.2","0.000025000","TCP"
"501","6.829008","6.829008000","0.000052000","0.000052000","10.22.1.2","0.000052000","12003  >  53639 [ACK] Seq=139073 Ack=138701 Win=2007 Len=4380","4434","0.000000000","10.1.1.2","0.000052000","TCP"
"503","6.840966","6.840966000","0.000034000","0.000034000","10.22.1.2","0.000034000","12003  >  53639 [ACK] Seq=143453 Ack=138701 Win=2007 Len=2920","2974","0.000000000","10.1.1.2","0.000034000","TCP"
"505","6.850353","6.850353000","0.000097000","0.000097000","10.22.1.2","0.000097000","12003  >  53639 [ACK] Seq=146373 Ack=140161 Win=2001 Len=4380","4434","0.000000000","10.1.1.2","0.000097000","TCP"
"510","6.859635","6.859635000","0.000057000","0.000057000","10.22.1.2","0.000057000","12003  >  53639 [ACK] Seq=150753 Ack=144541 Win=1996 Len=2920","2974","0.000000000","10.1.1.2","0.000057000","TCP"
"517","6.914219","6.914219000","0.000057000","0.000057000","10.22.1.2","0.000057000","12003  >  53639 [ACK] Seq=153673 Ack=153301 Win=1996 Len=0","54","0.000000000","10.1.1.2","0.000057000","TCP"
"535","7.116102","7.116102000","0.200626000","0.177952000","10.22.1.2","0.200626000","12003  >  53639 [ACK] Seq=153673 Ack=154761 Win=1996 Len=0","54","0.000000000","10.1.1.2","0.177952000","TCP"
"557","7.410793","7.321605000","0.000116000","0.000116000","10.22.1.2","0.000116000","12002  >  53640 [ACK] Seq=55917 Ack=1 Win=253 Len=11680","11734","0.000000000","10.1.1.2","0.000116000","TCP"
"559","7.486590","7.486590000","0.000036000","0.000036000","10.22.1.2","0.000036000","12003  >  53639 [PSH, ACK] Seq=153673 Ack=154761 Win=1996 Len=2920","2974","0.000000000","10.1.1.2","0.000036000","TCP"
"561","7.499887","7.499887000","0.000025000","0.000025000","10.22.1.2","0.000025000","12003  >  53639 [ACK] Seq=156593 Ack=154761 Win=1996 Len=2920","2974","0.000000000","10.1.1.2","0.000025000","TCP"
"567","7.642337","7.642337000","0.000035000","0.000035000","10.22.1.2","0.000035000","12003  >  53639 [ACK] Seq=159513 Ack=154761 Win=1996 Len=5840","5894","0.000000000","10.1.1.2","0.000035000","TCP"
"569","7.644983","7.644983000","0.000022000","0.000022000","10.22.1.2","0.000022000","12003  >  53639 [ACK] Seq=165353 Ack=154761 Win=1996 Len=2920","2974","0.000000000","10.1.1.2","0.000022000","TCP"
"572","7.667651","7.667651000","0.000052000","0.000052000","10.22.1.2","0.000052000","12003  >  53639 [ACK] Seq=168273 Ack=156221 Win=1990 Len=4380","4434","0.000000000","10.1.1.2","0.000052000","TCP"
"574","7.684937","7.684937000","0.000040000","0.000040000","10.22.1.2","0.000040000","12003  >  53639 [ACK] Seq=172653 Ack=157681 Win=1984 Len=2920","2974","0.000000000","10.1.1.2","0.000040000","TCP"
"578","7.694259","7.694259000","0.000038000","0.000038000","10.22.1.2","0.000038000","12003  >  53639 [ACK] Seq=175573 Ack=162061 Win=1984 Len=0","54","0.000000000","10.1.1.2","0.000038000","TCP"
"580","7.718219","7.718219000","0.000040000","0.000040000","10.22.1.2","0.000040000","12003  >  53639 [ACK] Seq=175573 Ack=163521 Win=1984 Len=1460","1514","0.000000000","10.1.1.2","0.000040000","TCP"
"584","7.719555","7.719555000","0.000037000","0.000037000","10.22.1.2","0.000037000","12003  >  53639 [ACK] Seq=177033 Ack=167901 Win=1984 Len=0","54","0.000000000","10.1.1.2","0.000037000","TCP"
"587","7.726226","7.726226000","0.000052000","0.000052000","10.22.1.2","0.000052000","12003  >  53639 [ACK] Seq=177033 Ack=170821 Win=1984 Len=0","54","0.000000000","10.1.1.2","0.000052000","TCP"
"641","8.122980","8.122980000","0.201805000","0.062037000","10.22.1.2","0.201805000","12003  >  53639 [ACK] Seq=177033 Ack=172281 Win=1978 Len=0","54","0.000000000","10.1.1.2","0.062037000","TCP"
"646","8.219404","8.130216000","0.000044000","0.000044000","10.22.1.2","0.000044000","12002  >  53640 [PSH, ACK] Seq=67597 Ack=1 Win=253 Len=4864","4918","0.000000000","10.1.1.2","0.000044000","TCP"
"652","8.293948","8.293948000","0.000046000","0.000046000","10.22.1.2","0.000046000","12003  >  53639 [ACK] Seq=177033 Ack=172281 Win=1978 Len=2920","2974","0.000000000","10.1.1.2","0.000046000","TCP"
"654","8.319225","8.319225000","0.000030000","0.000030000","10.22.1.2","0.000030000","12003  >  53639 [ACK] Seq=179953 Ack=172281 Win=1978 Len=2920","2974","0.000000000","10.1.1.2","0.000030000","TCP"
"656","8.448409","8.448409000","0.000078000","0.000078000","10.22.1.2","0.000078000","12003  >  53639 [ACK] Seq=182873 Ack=172281 Win=1978 Len=4380","4434","0.000000000","10.1.1.2","0.000078000","TCP"
"658","8.455003","8.455003000","0.000029000","0.000029000","10.22.1.2","0.000029000","12003  >  53639 [ACK] Seq=187253 Ack=172281 Win=1978 Len=2920","2974","0.000000000","10.1.1.2","0.000029000","TCP"
"661","8.477674","8.477674000","0.000065000","0.000065000","10.22.1.2","0.000065000","12003  >  53639 [ACK] Seq=190173 Ack=173741 Win=1973 Len=5840","5894","0.000000000","10.1.1.2","0.000065000","TCP"
"664","8.505607","8.505607000","0.000044000","0.000044000","10.22.1.2","0.000044000","12003  >  53639 [ACK] Seq=196013 Ack=176661 Win=1961 Len=4380","4434","0.000000000","10.1.1.2","0.000044000","TCP"
"667","8.506931","8.506931000","0.000037000","0.000037000","10.22.1.2","0.000037000","12003  >  53639 [ACK] Seq=200393 Ack=179581 Win=1950 Len=0","54","0.000000000","10.1.1.2","0.000037000","TCP"
"670","8.522904","8.522904000","0.000036000","0.000036000","10.22.1.2","0.000036000","12003  >  53639 [ACK] Seq=200393 Ack=182501 Win=1939 Len=1460","1514","0.000000000","10.1.1.2","0.000036000","TCP"
"674","8.524236","8.524236000","0.000032000","0.000032000","10.22.1.2","0.000032000","12003  >  53639 [ACK] Seq=201853 Ack=186881 Win=1921 Len=0","54","0.000000000","10.1.1.2","0.000032000","TCP"
"680","8.537554","8.537554000","0.000041000","0.000037000","10.22.1.2","0.000041000","12003  >  53639 [ACK] Seq=201853 Ack=189801 Win=1916 Len=0","54","0.000000000","10.1.1.2","0.000037000","TCP"
"723","9.046117","8.956929000","0.000099000","0.000099000","10.22.1.2","0.000099000","12002  >  53640 [PSH, ACK] Seq=72461 Ack=1 Win=253 Len=13728","13782","0.000000000","10.1.1.2","0.000099000","TCP"
"725","9.099296","9.099296000","0.000028000","0.000028000","10.22.1.2","0.000028000","12003  >  53639 [ACK] Seq=201853 Ack=191261 Win=1916 Len=2920","2974","0.000000000","10.1.1.2","0.000028000","TCP"
"727","9.132580","9.132580000","0.000032000","0.000032000","10.22.1.2","0.000032000","12003  >  53639 [ACK] Seq=204773 Ack=191261 Win=1916 Len=2920","2974","0.000000000","10.1.1.2","0.000032000","TCP"
"734","9.272355","9.272355000","0.000030000","0.000030000","10.22.1.2","0.000030000","12003  >  53639 [ACK] Seq=207693 Ack=191261 Win=1916 Len=5840","5894","0.000000000","10.1.1.2","0.000030000","TCP"
"736","9.287007","9.287007000","0.000045000","0.000045000","10.22.1.2","0.000045000","12003  >  53639 [PSH, ACK] Seq=213533 Ack=192721 Win=1910 Len=7300","7354","0.000000000","10.1.1.2","0.000045000","TCP"
"738","9.316287","9.316287000","0.000037000","0.000037000","10.22.1.2","0.000037000","12003  >  53639 [ACK] Seq=220833 Ack=194181 Win=1904 Len=1460","1514","0.000000000","10.1.1.2","0.000037000","TCP"
"742","9.318952","9.318952000","0.000036000","0.000036000","10.22.1.2","0.000036000","12003  >  53639 [ACK] Seq=222293 Ack=198561 Win=1887 Len=2920","2974","0.000000000","10.1.1.2","0.000036000","TCP"
"747","9.341594","9.341594000","0.000042000","0.000042000","10.22.1.2","0.000042000","12003  >  53639 [ACK] Seq=225213 Ack=204401 Win=1864 Len=1460","1514","0.000000000","10.1.1.2","0.000042000","TCP"
"752","9.342919","9.342919000","0.000036000","0.000036000","10.22.1.2","0.000036000","12003  >  53639 [ACK] Seq=226673 Ack=208781 Win=1859 Len=0","54","0.000000000","10.1.1.2","0.000036000","TCP"
"774","9.552728","9.552728000","0.200536000","0.024807000","10.22.1.2","0.200536000","12003  >  53639 [ACK] Seq=226673 Ack=210241 Win=1859 Len=0","54","0.000000000","10.1.1.2","0.024807000","TCP"
"798","9.852746","9.763558000","0.000027000","0.000027000","10.22.1.2","0.000027000","12002  >  53640 [PSH, ACK] Seq=86189 Ack=1 Win=253 Len=176","230","0.000000000","10.1.1.2","0.000027000","TCP"
"801","9.862115","9.772927000","0.000084000","0.000084000","10.22.1.2","0.000084000","12002  >  53640 [PSH, ACK] Seq=86365 Ack=1 Win=253 Len=7568","7622","0.000000000","10.1.1.2","0.000084000","TCP"
"803","9.903350","9.903350000","0.000046000","0.000046000","10.22.1.2","0.000046000","12003  >  53639 [ACK] Seq=226673 Ack=211701 Win=1887 Len=4380","4434","0.000000000","10.1.1.2","0.000046000","TCP"
"805","9.936606","9.936606000","0.000025000","0.000025000","10.22.1.2","0.000025000","12003  >  53639 [ACK] Seq=231053 Ack=211701 Win=1887 Len=2920","2974","0.000000000","10.1.1.2","0.000025000","TCP"
"812","10.077757","10.077757000","0.000060000","0.000060000","10.22.1.2","0.000060000","12003  >  53639 [ACK] Seq=233973 Ack=211701 Win=1887 Len=4380","4434","0.000000000","10.1.1.2","0.000060000","TCP"
"817","10.097717","10.097717000","0.000060000","0.000060000","10.22.1.2","0.000060000","12003  >  53639 [ACK] Seq=238353 Ack=213161 Win=1882 Len=8760","8814","0.000000000","10.1.1.2","0.000060000","TCP"
"819","10.128326","10.128326000","0.000052000","0.000052000","10.22.1.2","0.000052000","12003  >  53639 [ACK] Seq=247113 Ack=214621 Win=1876 Len=1460","1514","0.000000000","10.1.1.2","0.000052000","TCP"
"823","10.137638","10.137638000","0.000042000","0.000042000","10.22.1.2","0.000042000","12003  >  53639 [ACK] Seq=248573 Ack=219001 Win=1859 Len=2920","2974","0.000000000","10.1.1.2","0.000042000","TCP"
"832","10.160296","10.160296000","0.000055000","0.000055000","10.22.1.2","0.000055000","12003  >  53639 [ACK] Seq=251493 Ack=230681 Win=1819 Len=1460","1514","0.000000000","10.1.1.2","0.000055000","TCP"
"833","10.160357","10.160357000","0.000061000","0.000061000","10.22.1.2","0.000061000","[TCP Window Update] 12003  >  53639 [ACK] Seq=252953 Ack=230681 Win=1830 Len=0","54","0.000000000","10.1.1.2","0.000061000","TCP"
"868","10.571322","10.571322000","0.202107000","0.013075000","10.22.1.2","0.202107000","12003  >  53639 [ACK] Seq=252953 Ack=232141 Win=1864 Len=0","54","0.000000000","10.1.1.2","0.013075000","TCP"
"872","10.670121","10.580933000","0.000058000","0.000058000","10.22.1.2","0.000058000","12002  >  53640 [PSH, ACK] Seq=93933 Ack=1 Win=253 Len=528","582","0.000000000","10.1.1.2","0.000058000","TCP"
"873","10.670193","10.581005000","0.000072000","0.000072000","10.22.1.2","0.000072000","12002  >  53640 [PSH, ACK] Seq=94461 Ack=1 Win=253 Len=6688","6742","0.000000000","10.1.1.2","0.000072000","TCP"
"875","10.707381","10.707381000","0.000046000","0.000046000","10.22.1.2","0.000046000","12003  >  53639 [PSH, ACK] Seq=252953 Ack=233601 Win=1859 Len=4380","4434","0.000000000","10.1.1.2","0.000046000","TCP"
"877","10.743318","10.743318000","0.000037000","0.000037000","10.22.1.2","0.000037000","12003  >  53639 [ACK] Seq=257333 Ack=233601 Win=1859 Len=4380","4434","0.000000000","10.1.1.2","0.000037000","TCP"
"886","10.883081","10.883081000","0.000028000","0.000028000","10.22.1.2","0.000028000","12003  >  53639 [ACK] Seq=261713 Ack=233601 Win=1859 Len=2920","2974","0.000000000","10.1.1.2","0.000028000","TCP"
"889","10.908387","10.908387000","0.000039000","0.000039000","10.22.1.2","0.000039000","12003  >  53639 [ACK] Seq=264633 Ack=235061 Win=1853 Len=2920","2974","0.000000000","10.1.1.2","0.000039000","TCP"
"890","10.908433","10.908433000","0.000046000","0.000046000","10.22.1.2","0.000046000","12003  >  53639 [ACK] Seq=267553 Ack=235061 Win=1853 Len=1460","1514","0.000000000","10.1.1.2","0.000046000","TCP"
"891","10.908442","10.908442000","0.000009000","0.000009000","10.22.1.2","0.000009000","12003  >  53639 [ACK] Seq=269013 Ack=235061 Win=1853 Len=1460","1514","0.000000000","10.1.1.2","0.000009000","TCP"
"892","10.908447","10.908447000","0.000005000","0.000005000","10.22.1.2","0.000005000","12003  >  53639 [ACK] Seq=270473 Ack=235061 Win=1853 Len=1460","1514","0.000000000","10.1.1.2","0.000005000","TCP"
"894","10.948311","10.948311000","0.000032000","0.000032000","10.22.1.2","0.000032000","12003  >  53639 [ACK] Seq=271933 Ack=235061 Win=1853 Len=1460","1514","0.000000000","10.1.1.2","0.000032000","TCP"
"901","10.949665","10.949665000","0.000044000","0.000044000","10.22.1.2","0.000044000","12003  >  53639 [ACK] Seq=273393 Ack=236521 Win=1847 Len=1460","1514","0.000000000","10.1.1.2","0.000044000","TCP"
"902","10.949690","10.949690000","0.000025000","0.000025000","10.22.1.2","0.000025000","12003  >  53639 [ACK] Seq=274853 Ack=240901 Win=1830 Len=0","54","0.000000000","10.1.1.2","0.000025000","TCP"
"909","10.970940","10.970940000","0.000030000","0.000030000","10.22.1.2","0.000030000","12003  >  53639 [ACK] Seq=274853 Ack=243821 Win=1819 Len=0","54","0.000000000","10.1.1.2","0.000030000","TCP"
"912","10.972276","10.972276000","0.000032000","0.000032000","10.22.1.2","0.000032000","12003  >  53639 [ACK] Seq=274853 Ack=246741 Win=1807 Len=0","54","0.000000000","10.1.1.2","0.000032000","TCP"
"916","10.973604","10.973604000","0.000027000","0.000027000","10.22.1.2","0.000027000","12003  >  53639 [ACK] Seq=274853 Ack=251121 Win=1790 Len=0","54","0.000000000","10.1.1.2","0.000027000","TCP"
"931","11.173901","11.173901000","0.193674000","0.096484000","10.22.1.2","0.193674000","12003  >  53639 [ACK] Seq=274853 Ack=252581 Win=1785 Len=0","54","0.000000000","10.1.1.2","0.096484000","TCP"
"958","11.475473","11.386285000","0.000045000","0.000045000","10.22.1.2","0.000045000","12002  >  53640 [PSH, ACK] Seq=101149 Ack=1 Win=253 Len=1056","1110","0.000000000","10.1.1.2","0.000045000","TCP"
"959","11.475536","11.386348000","0.000063000","0.000063000","10.22.1.2","0.000063000","12002  >  53640 [PSH, ACK] Seq=102205 Ack=1 Win=253 Len=5984","6038","0.000000000","10.1.1.2","0.000063000","TCP"
"965","11.511424","11.511424000","0.000044000","0.000044000","10.22.1.2","0.000044000","[TCP Fast Retransmission] 12003  >  53639 [ACK] Seq=244193 Ack=254041 Win=1779 Len=1460","1514","0.000000000","10.1.1.2","0.000044000","TCP"
"966","11.511453","11.511453000","0.000029000","0.000029000","10.22.1.2","0.000029000","12003  >  53639 [ACK] Seq=274853 Ack=256961 Win=1767 Len=0","54","0.000000000","10.1.1.2","0.000029000","TCP"
"970","11.555335","11.555335000","0.000033000","0.000033000","10.22.1.2","0.000033000","12003  >  53639 [ACK] Seq=274853 Ack=256961 Win=1767 Len=1460","1514","0.000000000","10.1.1.2","0.000033000","TCP"
"971","11.555354","11.555354000","0.000019000","0.000019000","10.22.1.2","0.000019000","12003  >  53639 [ACK] Seq=276313 Ack=256961 Win=1767 Len=1460","1514","0.000000000","10.1.1.2","0.000019000","TCP"
"984","11.688507","11.688507000","0.000073000","0.000073000","10.22.1.2","0.000073000","12003  >  53639 [ACK] Seq=277773 Ack=256961 Win=1767 Len=1460","1514","0.000000000","10.1.1.2","0.000073000","TCP"
"985","11.688532","11.688532000","0.000025000","0.000025000","10.22.1.2","0.000025000","12003  >  53639 [ACK] Seq=279233 Ack=256961 Win=1767 Len=1460","1514","0.000000000","10.1.1.2","0.000025000","TCP"
"988","11.715075","11.715075000","0.000032000","0.000032000","10.22.1.2","0.000032000","12003  >  53639 [ACK] Seq=280693 Ack=256961 Win=1767 Len=1460","1514","0.000000000","10.1.1.2","0.000032000","TCP"
"989","11.715095","11.715095000","0.000020000","0.000020000","10.22.1.2","0.000020000","12003  >  53639 [ACK] Seq=282153 Ack=256961 Win=1767 Len=1460","1514","0.000000000","10.1.1.2","0.000020000","TCP"
"991","11.719063","11.719063000","0.000029000","0.000029000","10.22.1.2","0.000029000","12003  >  53639 [ACK] Seq=283613 Ack=256961 Win=1767 Len=1460","1514","0.000000000","10.1.1.2","0.000029000","TCP"
"995","11.720422","11.720422000","0.000054000","0.000054000","10.22.1.2","0.000054000","12003  >  53639 [ACK] Seq=285073 Ack=258421 Win=1762 Len=1460","1514","0.000000000","10.1.1.2","0.000054000","TCP"
"996","11.720440","11.720440000","0.000018000","0.000018000","10.22.1.2","0.000018000","12003  >  53639 [ACK] Seq=286533 Ack=258421 Win=1762 Len=1460","1514","0.000000000","10.1.1.2","0.000018000","TCP"
"998","11.752363","11.752363000","0.000045000","0.000045000","10.22.1.2","0.000045000","12003  >  53639 [ACK] Seq=287993 Ack=258421 Win=1762 Len=1460","1514","0.000000000","10.1.1.2","0.000045000","TCP"
"1004","11.765662","11.765662000","0.000033000","0.000033000","10.22.1.2","0.000033000","12003  >  53639 [ACK] Seq=289453 Ack=258421 Win=1762 Len=1460","1514","0.000000000","10.1.1.2","0.000033000","TCP"
"1005","11.765693","11.765693000","0.000031000","0.000031000","10.22.1.2","0.000031000","12003  >  53639 [ACK] Seq=290913 Ack=261341 Win=1750 Len=0","54","0.000000000","10.1.1.2","0.000031000","TCP"
"1008","11.773654","11.773654000","0.000037000","0.000037000","10.22.1.2","0.000037000","12003  >  53639 [ACK] Seq=290913 Ack=264261 Win=1739 Len=0","54","0.000000000","10.1.1.2","0.000037000","TCP"
"1014","11.782981","11.782981000","0.000039000","0.000039000","10.22.1.2","0.000039000","12003  >  53639 [ACK] Seq=290913 Ack=271561 Win=1710 Len=0","54","0.000000000","10.1.1.2","0.000039000","TCP"
"1017","11.784297","11.784297000","0.000031000","0.000031000","10.22.1.2","0.000031000","12003  >  53639 [ACK] Seq=290913 Ack=274481 Win=1699 Len=0","54","0.000000000","10.1.1.2","0.000031000","TCP"
"1042","11.998135","11.998135000","0.018188000","0.007499000","10.22.1.2","0.018188000","[TCP Fast Retransmission] 12003  >  53639 [ACK] Seq=244193 Ack=275941 Win=1693 Len=1460","1514","0.000000000","10.1.1.2","0.007499000","TCP"
"1057","12.287505","12.198317000","0.000053000","0.000053000","10.22.1.2","0.000053000","12002  >  53640 [PSH, ACK] Seq=108189 Ack=1 Win=253 Len=1232","1286","0.000000000","10.1.1.2","0.000053000","TCP"
"1058","12.287589","12.198401000","0.000084000","0.000084000","10.22.1.2","0.000084000","12002  >  53640 [PSH, ACK] Seq=109421 Ack=1 Win=253 Len=6160","6214","0.000000000","10.1.1.2","0.000084000","TCP"
"1060","12.314105","12.314105000","0.000033000","0.000033000","10.22.1.2","0.000033000","12003  >  53639 [ACK] Seq=290913 Ack=275941 Win=1693 Len=1460","1514","0.000000000","10.1.1.2","0.000033000","TCP"
"1061","12.314114","12.314114000","0.000009000","0.000009000","10.22.1.2","0.000009000","12003  >  53639 [ACK] Seq=292373 Ack=275941 Win=1693 Len=1460","1514","0.000000000","10.1.1.2","0.000009000","TCP"
"1062","12.314223","12.314223000","0.000109000","0.000109000","10.22.1.2","0.000109000","[TCP Out-Of-Order] 12003  >  53639 [ACK] Seq=274853 Ack=275941 Win=1693 Len=7300","7354","0.000000000","10.1.1.2","0.000109000","TCP"
"1066","12.315453","12.315453000","0.000042000","0.000042000","10.22.1.2","0.000042000","12003  >  53639 [ACK] Seq=282153 Ack=280321 Win=1676 Len=0","54","0.000000000","10.1.1.2","0.000042000","TCP"
"1072","12.363356","12.363356000","0.000030000","0.000030000","10.22.1.2","0.000030000","[TCP Retransmission] 12003  >  53639 [ACK] Seq=282153 Ack=281781 Win=1671 Len=2920","2974","0.000000000","10.1.1.2","0.000030000","TCP"
"1081","12.490185","12.400997000","0.000169000","0.000169000","10.22.1.2","0.000169000","12002  >  53640 [PSH, ACK] Seq=115581 Ack=1 Win=253 Len=1584","1638","0.000000000","10.1.1.2","0.000169000","TCP"
"1083","12.498112","12.498112000","0.000041000","0.000041000","10.22.1.2","0.000041000","[TCP Retransmission] 12003  >  53639 [ACK] Seq=285073 Ack=281781 Win=1671 Len=5840","5894","0.000000000","10.1.1.2","0.000041000","TCP"
"1088","12.522074","12.522074000","0.000041000","0.000041000","10.22.1.2","0.000041000","[TCP Retransmission] 12003  >  53639 [ACK] Seq=290913 Ack=281781 Win=1671 Len=2920","2974","0.000000000","10.1.1.2","0.000041000","TCP"
"1090","12.535403","12.535403000","0.000059000","0.000059000","10.22.1.2","0.000059000","12003  >  53639 [ACK] Seq=293833 Ack=283241 Win=1665 Len=2920","2974","0.000000000","10.1.1.2","0.000059000","TCP"
"1092","12.556709","12.556709000","0.000059000","0.000059000","10.22.1.2","0.000059000","12003  >  53639 [ACK] Seq=296753 Ack=283241 Win=1665 Len=2920","2974","0.000000000","10.1.1.2","0.000059000","TCP"
"1095","12.580658","12.580658000","0.000052000","0.000052000","10.22.1.2","0.000052000","12003  >  53639 [ACK] Seq=299673 Ack=286161 Win=1653 Len=1460","1514","0.000000000","10.1.1.2","0.000052000","TCP"
"1098","12.587290","12.587290000","0.000028000","0.000028000","10.22.1.2","0.000028000","12003  >  53639 [ACK] Seq=301133 Ack=289081 Win=1642 Len=0","54","0.000000000","10.1.1.2","0.000028000","TCP"
