"No.","Time","Time since first frame in this TCP stream","segment delta","Time delta from previous captured frame","Destination","Delta Time (conv)","Info","Length","Time shift for this packet","Source","Time delta from previous captured frame","Protocol"
"6","9.340601","0.073568000","0.073568000","0.073568000","10.22.1.2","0.073568000","12000  >  53626 [PSH, ACK] Seq=1 Ack=135 Win=252 Len=82","136","0.000000000","10.1.1.2","0.073568000","TCP"
"8","9.944662","0.677629000","0.000054000","0.000054000","10.22.1.2","0.000054000","12000  >  53626 [PSH, ACK] Seq=83 Ack=135 Win=252 Len=134","188","0.000000000","10.1.1.2","0.000054000","TCP"
"11","10.771074","1.504041000","0.191491000","0.191491000","10.22.1.2","0.191491000","12000  >  53626 [ACK] Seq=217 Ack=209 Win=251 Len=7300","7354","0.000000000","10.1.1.2","0.191491000","TCP"
"13","11.174686","1.907653000","0.000068000","0.000068000","10.22.1.2","0.000068000","12000  >  53626 [ACK] Seq=7517 Ack=367 Win=251 Len=1460","1514","0.000000000","10.1.1.2","0.000068000","TCP"
"15","11.183975","1.916942000","0.000039000","0.000039000","10.22.1.2","0.000039000","12000  >  53626 [PSH, ACK] Seq=8977 Ack=367 Win=251 Len=2630","2684","0.000000000","10.1.1.2","0.000039000","TCP"
"18","11.588674","2.321641000","0.000056000","0.000056000","10.22.1.2","0.000056000","12000  >  53626 [PSH, ACK] Seq=11607 Ack=367 Win=251 Len=138","192","0.000000000","10.1.1.2","0.000056000","TCP"
"20","12.018866","2.751833000","0.021585000","0.021585000","10.22.1.2","0.021585000","12000  >  53626 [PSH, ACK] Seq=11745 Ack=417 Win=251 Len=630","684","0.000000000","10.1.1.2","0.021585000","TCP"
"22","12.441284","3.174251000","0.006033000","0.006033000","10.22.1.2","0.006033000","12000  >  53626 [PSH, ACK] Seq=12375 Ack=485 Win=256 Len=141","195","0.000000000","10.1.1.2","0.006033000","TCP"
"24","12.861251","3.594218000","0.017331000","0.017331000","10.22.1.2","0.017331000","12000  >  53626 [PSH, ACK] Seq=12516 Ack=535 Win=256 Len=604","658","0.000000000","10.1.1.2","0.017331000","TCP"
"26","13.278650","4.011617000","0.010079000","0.010079000","10.22.1.2","0.010079000","12000  >  53626 [PSH, ACK] Seq=13120 Ack=585 Win=256 Len=714","768","0.000000000","10.1.1.2","0.010079000","TCP"
"28","13.686765","4.419732000","0.004193000","0.004193000","10.22.1.2","0.004193000","12000  >  53626 [PSH, ACK] Seq=13834 Ack=653 Win=255 Len=49","103","0.000000000","10.1.1.2","0.004193000","TCP"
"30","14.105732","4.838699000","0.003846000","0.003846000","10.22.1.2","0.003846000","12000  >  53626 [PSH, ACK] Seq=13883 Ack=721 Win=255 Len=49","103","0.000000000","10.1.1.2","0.003846000","TCP"
"34","14.552890","5.285857000","0.034338000","0.034338000","10.22.1.2","0.034338000","12000  >  53626 [PSH, ACK] Seq=13932 Ack=789 Win=255 Len=49","103","0.000000000","10.1.1.2","0.034338000","TCP"
"36","15.014691","5.747658000","0.034224000","0.034224000","10.22.1.2","0.034224000","12000  >  53626 [PSH, ACK] Seq=13981 Ack=857 Win=255 Len=49","103","0.000000000","10.1.1.2","0.034224000","TCP"
"38","15.423459","6.156426000","0.006360000","0.006360000","10.22.1.2","0.006360000","12000  >  53626 [PSH, ACK] Seq=14030 Ack=925 Win=254 Len=187","241","0.000000000","10.1.1.2","0.006360000","TCP"
"40","15.847330","6.580297000","0.010908000","0.010908000","10.22.1.2","0.010908000","12000  >  53626 [PSH, ACK] Seq=14217 Ack=975 Win=254 Len=714","768","0.000000000","10.1.1.2","0.010908000","TCP"
"43","17.093855","0.201806000","0.201806000","0.201806000","10.22.1.2","0.201806000","8800  >  53622 [ACK] Seq=1 Ack=188 Win=254 Len=0","54","0.000000000","10.1.1.2","0.201806000","TCP"
"44","18.324757","1.432708000","1.230902000","1.230902000","10.22.1.2","1.230902000","8800  >  53622 [PSH, ACK] Seq=1 Ack=188 Win=254 Len=4619","4673","0.000000000","10.1.1.2","1.230902000","TCP"
"45","18.357154","1.465105000","0.032397000","0.032397000","10.22.1.2","0.032397000","8800  >  53622 [PSH, ACK] Seq=4620 Ack=188 Win=254 Len=3785","3839","0.000000000","10.1.1.2","0.032397000","TCP"
"49","18.742554","0.000171000","0.000171000","0.000171000","10.22.1.2","0.000171000","12003  >  53627 [SYN, ACK] Seq=0 Ack=1 Win=8192 Len=0 MSS=1460 WS=256 SACK_PERM=1","66","0.000000000","10.1.1.2","0.000171000","TCP"
"54","18.813031","9.545998000","0.006314000","0.006314000","10.22.1.2","0.006314000","12000  >  53626 [PSH, ACK] Seq=14931 Ack=1043 Win=254 Len=187","241","0.000000000","10.1.1.2","0.006314000","TCP"
"62","19.318113","10.051080000","0.097386000","0.026836000","10.22.1.2","0.097386000","12000  >  53626 [PSH, ACK] Seq=15118 Ack=1643 Win=252 Len=131","185","0.000000000","10.1.1.2","0.026836000","TCP"
"64","19.371777","0.629394000","0.200304000","0.037564000","10.22.1.2","0.200304000","12003  >  53627 [ACK] Seq=1 Ack=314 Win=65536 Len=0","54","0.000000000","10.1.1.2","0.037564000","TCP"
"67","19.691090","0.948707000","0.319313000","0.000000000","10.22.1.2","0.319313000","12003  >  53627 [PSH, ACK] Seq=1 Ack=314 Win=65536 Len=932","986","0.000000000","10.1.1.2","0.000000000","TCP"
"69","19.726624","10.459591000","0.000057000","0.000057000","10.22.1.2","0.000057000","12000  >  53626 [PSH, ACK] Seq=15249 Ack=1693 Win=251 Len=940","994","0.000000000","10.1.1.2","0.000057000","TCP"
"74","20.117075","1.374692000","0.011123000","0.005859000","10.22.1.2","0.011123000","12003  >  53627 [PSH, ACK] Seq=933 Ack=440 Win=65536 Len=326","380","0.000000000","10.1.1.2","0.005859000","TCP"
"76","20.338981","11.071948000","0.000059000","0.000059000","10.22.1.2","0.000059000","12000  >  53626 [PSH, ACK] Seq=16189 Ack=1693 Win=251 Len=714","768","0.000000000","10.1.1.2","0.000059000","TCP"
"83","20.529320","0.000050000","0.000050000","0.000048000","10.22.1.2","0.000050000","12001  >  53628 [SYN, ACK] Seq=0 Ack=1 Win=8192 Len=0 MSS=1460 WS=256 SACK_PERM=1","66","0.000000000","10.1.1.2","0.000048000","TCP"
"84","20.529353","0.000081000","0.000081000","0.000033000","10.22.1.2","0.000081000","12002  >  53629 [SYN, ACK] Seq=0 Ack=1 Win=8192 Len=0 MSS=1460 WS=256 SACK_PERM=1","66","0.000000000","10.1.1.2","0.000033000","TCP"
"97","21.014236","0.484966000","0.047004000","0.033965000","10.22.1.2","0.047004000","12001  >  53628 [PSH, ACK] Seq=1 Ack=314 Win=65536 Len=932","986","0.000000000","10.1.1.2","0.033965000","TCP"
"98","21.021168","0.491896000","0.053934000","0.006932000","10.22.1.2","0.053934000","12002  >  53629 [PSH, ACK] Seq=1 Ack=314 Win=65536 Len=932","986","0.000000000","10.1.1.2","0.006932000","TCP"
"104","21.063104","2.320721000","0.000031000","0.000031000","10.22.1.2","0.000031000","12003  >  53627 [ACK] Seq=1259 Ack=3360 Win=65536 Len=0","54","0.000000000","10.1.1.2","0.000031000","TCP"
"116","21.447586","0.918316000","0.006459000","0.006457000","10.22.1.2","0.006459000","12001  >  53628 [PSH, ACK] Seq=933 Ack=440 Win=65536 Len=286","340","0.000000000","10.1.1.2","0.006457000","TCP"
"117","21.453206","0.923934000","0.012077000","0.005620000","10.22.1.2","0.012077000","12002  >  53629 [PSH, ACK] Seq=933 Ack=440 Win=65536 Len=286","340","0.000000000","10.1.1.2","0.005620000","TCP"
"122","21.469127","2.726744000","0.000034000","0.000034000","10.22.1.2","0.000034000","12003  >  53627 [ACK] Seq=1259 Ack=9200 Win=65536 Len=0","54","0.000000000","10.1.1.2","0.000034000","TCP"
"129","21.873813","3.131430000","0.000042000","0.000042000","10.22.1.2","0.000042000","12003  >  53627 [ACK] Seq=1259 Ack=11791 Win=65536 Len=0","54","0.000000000","10.1.1.2","0.000042000","TCP"
"130","21.912275","3.169892000","0.038462000","0.038462000","10.22.1.2","0.038462000","12003  >  53627 [ACK] Seq=1259 Ack=11791 Win=65536 Len=2920","2974","0.000000000","10.1.1.2","0.038462000","TCP"
"136","22.062305","1.533033000","0.201842000","0.020814000","10.22.1.2","0.201842000","12002  >  53629 [ACK] Seq=1219 Ack=1015 Win=64768 Len=0","54","0.000000000","10.1.1.2","0.020814000","TCP"
"140","22.090826","5.198777000","3.329398000","0.022678000","10.22.1.2","3.329398000","8800  >  53622 [PSH, ACK] Seq=8405 Ack=188 Win=254 Len=60","114","0.000000000","10.1.1.2","0.022678000","TCP"
"141","22.132610","1.603340000","0.202934000","0.041784000","10.22.1.2","0.202934000","12001  >  53628 [ACK] Seq=1219 Ack=612 Win=65280 Len=0","54","0.000000000","10.1.1.2","0.041784000","TCP"
"147","22.327731","3.585348000","0.000035000","0.000035000","10.22.1.2","0.000035000","12003  >  53627 [ACK] Seq=4179 Ack=11791 Win=65536 Len=5840","5894","0.000000000","10.1.1.2","0.000035000","TCP"
"159","22.739052","3.996669000","0.000021000","0.000021000","10.22.1.2","0.000021000","12003  >  53627 [PSH, ACK] Seq=10019 Ack=11791 Win=65536 Len=2566","2620","0.000000000","10.1.1.2","0.000021000","TCP"
"175","23.412958","4.670575000","0.200026000","0.085975000","10.22.1.2","0.200026000","12003  >  53627 [ACK] Seq=12585 Ack=11897 Win=65536 Len=0","54","0.000000000","10.1.1.2","0.085975000","TCP"
"185","23.759038","5.016655000","0.346080000","0.000273000","10.22.1.2","0.346080000","12003  >  53627 [PSH, ACK] Seq=12585 Ack=11897 Win=65536 Len=121","175","0.000000000","10.1.1.2","0.000273000","TCP"
"197","23.787327","5.044944000","0.028289000","0.000595000","10.22.1.2","0.028289000","12003  >  53627 [PSH, ACK] Seq=12706 Ack=11897 Win=65536 Len=13840","13894","0.000000000","10.1.1.2","0.000595000","TCP"
"202","23.792020","5.049637000","0.000021000","0.000021000","10.22.1.2","0.000021000","12003  >  53627 [ACK] Seq=26546 Ack=16277 Win=65536 Len=0","54","0.000000000","10.1.1.2","0.000021000","TCP"
"205","23.794678","5.052295000","0.000019000","0.000019000","10.22.1.2","0.000019000","12003  >  53627 [ACK] Seq=26546 Ack=19197 Win=65536 Len=0","54","0.000000000","10.1.1.2","0.000019000","TCP"
"211","23.796019","5.053636000","0.000020000","0.000020000","10.22.1.2","0.000020000","12003  >  53627 [ACK] Seq=26546 Ack=25894 Win=65536 Len=0","54","0.000000000","10.1.1.2","0.000020000","TCP"
"213","23.816863","3.287593000","1.684253000","0.005913000","10.22.1.2","1.684253000","12001  >  53628 [PSH, ACK] Seq=1219 Ack=612 Win=65280 Len=172","226","0.000000000","10.1.1.2","0.005913000","TCP"
"214","23.819095","3.289823000","1.756790000","0.002232000","10.22.1.2","1.756790000","12002  >  53629 [PSH, ACK] Seq=1219 Ack=1015 Win=64768 Len=176","230","0.000000000","10.1.1.2","0.002232000","TCP"
"217","23.991589","3.462317000","0.172494000","0.055820000","10.22.1.2","0.172494000","12002  >  53629 [PSH, ACK] Seq=1395 Ack=1015 Win=64768 Len=1584","1638","0.000000000","10.1.1.2","0.055820000","TCP"
"222","24.181052","3.651780000","0.189463000","0.016322000","10.22.1.2","0.189463000","12002  >  53629 [PSH, ACK] Seq=2979 Ack=1015 Win=64768 Len=1584","1638","0.000000000","10.1.1.2","0.016322000","TCP"
"230","24.221628","5.479245000","0.019625000","0.000961000","10.22.1.2","0.019625000","12003  >  53627 [PSH, ACK] Seq=26546 Ack=26015 Win=65536 Len=121","175","0.000000000","10.1.1.2","0.000961000","TCP"
"236","24.243920","3.714650000","0.016628000","0.000620000","10.22.1.2","0.016628000","12001  >  53628 [PSH, ACK] Seq=1391 Ack=976 Win=65024 Len=342","396","0.000000000","10.1.1.2","0.000620000","TCP"
"239","24.268593","3.739323000","0.000029000","0.000029000","10.22.1.2","0.000029000","12001  >  53628 [ACK] Seq=1733 Ack=3896 Win=65536 Len=0","54","0.000000000","10.1.1.2","0.000029000","TCP"
"243","24.351932","3.822660000","0.170880000","0.070035000","10.22.1.2","0.170880000","12002  >  53629 [PSH, ACK] Seq=4563 Ack=1015 Win=64768 Len=794","848","0.000000000","10.1.1.2","0.070035000","TCP"
"248","24.395138","3.865866000","0.000096000","0.000096000","10.22.1.2","0.000096000","12002  >  53629 [PSH, ACK] Seq=5357 Ack=1015 Win=64768 Len=1142","1196","0.000000000","10.1.1.2","0.000096000","TCP"
"251","24.561000","4.031728000","0.165862000","0.110003000","10.22.1.2","0.165862000","12002  >  53629 [PSH, ACK] Seq=6499 Ack=1015 Win=64768 Len=1584","1638","0.000000000","10.1.1.2","0.110003000","TCP"
"253","24.586759","4.057487000","0.000044000","0.000044000","10.22.1.2","0.000044000","12002  >  53629 [PSH, ACK] Seq=8083 Ack=1015 Win=64768 Len=176","230","0.000000000","10.1.1.2","0.000044000","TCP"
"260","24.630341","5.887958000","0.005024000","0.000983000","10.22.1.2","0.005024000","12003  >  53627 [PSH, ACK] Seq=26667 Ack=26136 Win=65280 Len=594","648","0.000000000","10.1.1.2","0.000983000","TCP"
"266","24.671946","4.142676000","0.000029000","0.000029000","10.22.1.2","0.000029000","12001  >  53628 [ACK] Seq=1733 Ack=9251 Win=65536 Len=0","54","0.000000000","10.1.1.2","0.000029000","TCP"
"270","24.687564","4.158294000","0.014323000","0.000980000","10.22.1.2","0.014323000","12001  >  53628 [PSH, ACK] Seq=1733 Ack=10711 Win=65536 Len=4022","4076","0.000000000","10.1.1.2","0.000980000","TCP"
"275","24.769926","4.240654000","0.183167000","0.082009000","10.22.1.2","0.183167000","12002  >  53629 [PSH, ACK] Seq=8259 Ack=1015 Win=64768 Len=1584","1638","0.000000000","10.1.1.2","0.082009000","TCP"
"278","24.799737","4.270465000","0.000035000","0.000035000","10.22.1.2","0.000035000","12002  >  53629 [PSH, ACK] Seq=9843 Ack=1015 Win=64768 Len=176","230","0.000000000","10.1.1.2","0.000035000","TCP"
"281","24.960368","4.431096000","0.160631000","0.087426000","10.22.1.2","0.160631000","12002  >  53629 [PSH, ACK] Seq=10019 Ack=1015 Win=64768 Len=1584","1638","0.000000000","10.1.1.2","0.087426000","TCP"
"283","24.979472","4.450200000","0.000053000","0.000053000","10.22.1.2","0.000053000","12002  >  53629 [PSH, ACK] Seq=11603 Ack=1015 Win=64768 Len=176","230","0.000000000","10.1.1.2","0.000053000","TCP"
"289","25.036695","6.294312000","0.000041000","0.000041000","10.22.1.2","0.000041000","12003  >  53627 [PSH, ACK] Seq=27261 Ack=26850 Win=64512 Len=121","175","0.000000000","10.1.1.2","0.000041000","TCP"
"300","25.078020","4.548750000","0.000069000","0.000069000","10.22.1.2","0.000069000","12001  >  53628 [ACK] Seq=5755 Ack=20931 Win=64000 Len=0","54","0.000000000","10.1.1.2","0.000069000","TCP"
"301","25.078104","4.548834000","0.000084000","0.000084000","10.22.1.2","0.000084000","[TCP Window Update] 12001  >  53628 [ACK] Seq=5755 Ack=20931 Win=65536 Len=0","54","0.000000000","10.1.1.2","0.000084000","TCP"
"304","25.092590","4.563320000","0.000028000","0.000028000","10.22.1.2","0.000028000","12001  >  53628 [PSH, ACK] Seq=5755 Ack=23851 Win=65536 Len=2920","2974","0.000000000","10.1.1.2","0.000028000","TCP"
"307","25.093912","4.564642000","0.000020000","0.000020000","10.22.1.2","0.000020000","12001  >  53628 [PSH, ACK] Seq=8675 Ack=23851 Win=65536 Len=1240","1294","0.000000000","10.1.1.2","0.000020000","TCP"
"318","25.097226","4.567956000","0.003314000","0.000526000","10.22.1.2","0.003314000","12001  >  53628 [PSH, ACK] Seq=9915 Ack=23851 Win=65536 Len=2521","2575","0.000000000","10.1.1.2","0.000526000","TCP"
"319","25.169614","4.640342000","0.190142000","0.072388000","10.22.1.2","0.190142000","12002  >  53629 [PSH, ACK] Seq=11779 Ack=1015 Win=64768 Len=1584","1638","0.000000000","10.1.1.2","0.072388000","TCP"
"322","25.205736","4.676464000","0.000023000","0.000023000","10.22.1.2","0.000023000","12002  >  53629 [PSH, ACK] Seq=13363 Ack=1015 Win=64768 Len=176","230","0.000000000","10.1.1.2","0.000023000","TCP"
"327","25.378498","4.849226000","0.172762000","0.102232000","10.22.1.2","0.172762000","12002  >  53629 [PSH, ACK] Seq=13539 Ack=1015 Win=64768 Len=1584","1638","0.000000000","10.1.1.2","0.102232000","TCP"
"334","25.445357","6.702974000","0.000031000","0.000031000","10.22.1.2","0.000031000","12003  >  53627 [PSH, ACK] Seq=27382 Ack=27443 Win=65536 Len=715","769","0.000000000","10.1.1.2","0.000031000","TCP"
"342","25.485312","4.956042000","0.000038000","0.000038000","10.22.1.2","0.000038000","12001  >  53628 [PSH, ACK] Seq=12436 Ack=31151 Win=65536 Len=414","468","0.000000000","10.1.1.2","0.000038000","TCP"
"346","25.486630","4.957360000","0.000031000","0.000031000","10.22.1.2","0.000031000","12001  >  53628 [ACK] Seq=12850 Ack=35531 Win=65536 Len=0","54","0.000000000","10.1.1.2","0.000031000","TCP"
"349","25.487956","4.958686000","0.000028000","0.000028000","10.22.1.2","0.000028000","12001  >  53628 [ACK] Seq=12850 Ack=38451 Win=65536 Len=0","54","0.000000000","10.1.1.2","0.000028000","TCP"
"352","25.499937","4.970667000","0.000032000","0.000032000","10.22.1.2","0.000032000","12001  >  53628 [ACK] Seq=12850 Ack=41371 Win=65536 Len=0","54","0.000000000","10.1.1.2","0.000032000","TCP"
"369","25.510772","4.981502000","0.010835000","0.001418000","10.22.1.2","0.010835000","12001  >  53628 [ACK] Seq=12850 Ack=41371 Win=65536 Len=7300","7354","0.000000000","10.1.1.2","0.001418000","TCP"
"374","25.514602","4.985332000","0.000044000","0.000044000","10.22.1.2","0.000044000","12001  >  53628 [ACK] Seq=20150 Ack=45751 Win=65536 Len=4380","4434","0.000000000","10.1.1.2","0.000044000","TCP"
"375","25.549279","5.020007000","0.170511000","0.034677000","10.22.1.2","0.170511000","12002  >  53629 [PSH, ACK] Seq=15123 Ack=1015 Win=64768 Len=1584","1638","0.000000000","10.1.1.2","0.034677000","TCP"
"377","25.575836","5.046564000","0.000053000","0.000053000","10.22.1.2","0.000053000","12002  >  53629 [PSH, ACK] Seq=16707 Ack=1015 Win=64768 Len=176","230","0.000000000","10.1.1.2","0.000053000","TCP"
"382","25.707639","5.178369000","0.000056000","0.000056000","10.22.1.2","0.000056000","12001  >  53628 [ACK] Seq=24530 Ack=45751 Win=65536 Len=2920","2974","0.000000000","10.1.1.2","0.000056000","TCP"
"383","25.758248","5.228976000","0.182412000","0.050609000","10.22.1.2","0.182412000","12002  >  53629 [PSH, ACK] Seq=16883 Ack=1015 Win=64768 Len=1584","1638","0.000000000","10.1.1.2","0.050609000","TCP"
"385","25.784816","5.255544000","0.000037000","0.000037000","10.22.1.2","0.000037000","12002  >  53629 [PSH, ACK] Seq=18467 Ack=1015 Win=64768 Len=176","230","0.000000000","10.1.1.2","0.000037000","TCP"
"394","25.873599","7.131216000","0.018269000","0.000930000","10.22.1.2","0.018269000","12003  >  53627 [PSH, ACK] Seq=28097 Ack=28036 Win=65024 Len=594","648","0.000000000","10.1.1.2","0.000930000","TCP"
"397","25.889982","5.360712000","0.000037000","0.000037000","10.22.1.2","0.000037000","12001  >  53628 [PSH, ACK] Seq=27450 Ack=48671 Win=65536 Len=408","462","0.000000000","10.1.1.2","0.000037000","TCP"
"403","25.891318","5.362048000","0.000034000","0.000034000","10.22.1.2","0.000034000","12001  >  53628 [ACK] Seq=27858 Ack=55971 Win=65536 Len=0","54","0.000000000","10.1.1.2","0.000034000","TCP"
"406","25.892629","5.363359000","0.000023000","0.000023000","10.22.1.2","0.000023000","12001  >  53628 [ACK] Seq=27858 Ack=58891 Win=65536 Len=0","54","0.000000000","10.1.1.2","0.000023000","TCP"
"409","25.897962","5.368692000","0.000030000","0.000030000","10.22.1.2","0.000030000","12001  >  53628 [ACK] Seq=27858 Ack=61811 Win=65536 Len=0","54","0.000000000","10.1.1.2","0.000030000","TCP"
"414","25.899301","5.370031000","0.000033000","0.000033000","10.22.1.2","0.000033000","12001  >  53628 [ACK] Seq=27858 Ack=67651 Win=65536 Len=0","54","0.000000000","10.1.1.2","0.000033000","TCP"
"423","25.905980","5.376710000","0.000044000","0.000044000","10.22.1.2","0.000044000","12001  >  53628 [ACK] Seq=27858 Ack=79331 Win=62720 Len=0","54","0.000000000","10.1.1.2","0.000044000","TCP"
"424","25.906037","5.376767000","0.000057000","0.000057000","10.22.1.2","0.000057000","[TCP Window Update] 12001  >  53628 [ACK] Seq=27858 Ack=79331 Win=65536 Len=0","54","0.000000000","10.1.1.2","0.000057000","TCP"
"440","25.919310","5.390040000","0.000066000","0.000022000","10.22.1.2","0.000066000","12001  >  53628 [ACK] Seq=27858 Ack=79331 Win=65536 Len=5840","5894","0.000000000","10.1.1.2","0.000022000","TCP"
"456","25.924581","5.395311000","0.000028000","0.000028000","10.22.1.2","0.000028000","12001  >  53628 [PSH, ACK] Seq=33698 Ack=79331 Win=65536 Len=1310","1364","0.000000000","10.1.1.2","0.000028000","TCP"
"460","25.931249","5.401979000","0.000035000","0.000035000","10.22.1.2","0.000035000","12001  >  53628 [ACK] Seq=35008 Ack=83711 Win=65536 Len=0","54","0.000000000","10.1.1.2","0.000035000","TCP"
"464","25.932571","5.403301000","0.000026000","0.000026000","10.22.1.2","0.000026000","12001  >  53628 [ACK] Seq=35008 Ack=88091 Win=65536 Len=0","54","0.000000000","10.1.1.2","0.000026000","TCP"
"466","25.948710","5.419438000","0.163894000","0.012179000","10.22.1.2","0.163894000","12002  >  53629 [PSH, ACK] Seq=18643 Ack=1015 Win=64768 Len=1584","1638","0.000000000","10.1.1.2","0.012179000","TCP"
"472","26.138165","5.608893000","0.184329000","0.021919000","10.22.1.2","0.184329000","12002  >  53629 [PSH, ACK] Seq=20227 Ack=1015 Win=64768 Len=1584","1638","0.000000000","10.1.1.2","0.021919000","TCP"
"474","26.166860","5.637588000","0.000034000","0.000034000","10.22.1.2","0.000034000","12002  >  53629 [PSH, ACK] Seq=21811 Ack=1015 Win=64768 Len=176","230","0.000000000","10.1.1.2","0.000034000","TCP"
"478","26.188172","5.658900000","0.000043000","0.000040000","10.22.1.2","0.000043000","12002  >  53629 [PSH, ACK] Seq=21987 Ack=1015 Win=64768 Len=176","230","0.000000000","10.1.1.2","0.000040000","TCP"
"481","26.293552","5.764282000","0.000248000","0.000248000","10.22.1.2","0.000248000","12001  >  53628 [ACK] Seq=35008 Ack=89551 Win=65536 Len=23360","23414","0.000000000","10.1.1.2","0.000248000","TCP"
"484","26.296723","5.767453000","0.000029000","0.000029000","10.22.1.2","0.000029000","12001  >  53628 [ACK] Seq=58368 Ack=92471 Win=65536 Len=0","54","0.000000000","10.1.1.2","0.000029000","TCP"
"489","26.302099","5.772829000","0.000031000","0.000031000","10.22.1.2","0.000031000","12001  >  53628 [ACK] Seq=58368 Ack=98125 Win=65536 Len=0","54","0.000000000","10.1.1.2","0.000031000","TCP"
"496","26.308765","5.779495000","0.000036000","0.000036000","10.22.1.2","0.000036000","12001  >  53628 [ACK] Seq=58368 Ack=106885 Win=65536 Len=0","54","0.000000000","10.1.1.2","0.000036000","TCP"
"507","26.310122","5.780852000","0.000047000","0.000047000","10.22.1.2","0.000047000","12001  >  53628 [ACK] Seq=58368 Ack=121485 Win=59648 Len=0","54","0.000000000","10.1.1.2","0.000047000","TCP"
"508","26.310183","5.780913000","0.000061000","0.000061000","10.22.1.2","0.000061000","[TCP Window Update] 12001  >  53628 [ACK] Seq=58368 Ack=121485 Win=65536 Len=0","54","0.000000000","10.1.1.2","0.000061000","TCP"
"514","26.311424","5.782154000","0.000032000","0.000032000","10.22.1.2","0.000032000","12001  >  53628 [ACK] Seq=58368 Ack=128785 Win=65536 Len=0","54","0.000000000","10.1.1.2","0.000032000","TCP"
"519","26.312732","5.783462000","0.000017000","0.000017000","10.22.1.2","0.000017000","12001  >  53628 [ACK] Seq=58368 Ack=134625 Win=65536 Len=0","54","0.000000000","10.1.1.2","0.000017000","TCP"
"525","26.315416","5.786146000","0.000032000","0.000032000","10.22.1.2","0.000032000","12001  >  53628 [ACK] Seq=58368 Ack=141925 Win=65536 Len=0","54","0.000000000","10.1.1.2","0.000032000","TCP"
"528","26.320728","5.791458000","0.000027000","0.000027000","10.22.1.2","0.000027000","12001  >  53628 [ACK] Seq=58368 Ack=144845 Win=65536 Len=0","54","0.000000000","10.1.1.2","0.000027000","TCP"
"603","26.336834","5.807564000","0.000139000","0.000020000","10.22.1.2","0.000139000","12001  >  53628 [PSH, ACK] Seq=58368 Ack=152145 Win=65536 Len=6529","6583","0.000000000","10.1.1.2","0.000020000","TCP"
"609","26.346606","5.817334000","0.158434000","0.007274000","10.22.1.2","0.158434000","12002  >  53629 [PSH, ACK] Seq=22163 Ack=1015 Win=64768 Len=1584","1638","0.000000000","10.1.1.2","0.007274000","TCP"
"616","26.540996","6.011726000","0.201664000","0.055232000","10.22.1.2","0.201664000","12001  >  53628 [ACK] Seq=64897 Ack=153605 Win=65536 Len=0","54","0.000000000","10.1.1.2","0.055232000","TCP"
"618","26.545705","6.016433000","0.000039000","0.000039000","10.22.1.2","0.000039000","12002  >  53629 [PSH, ACK] Seq=23747 Ack=1015 Win=64768 Len=1408","1462","0.000000000","10.1.1.2","0.000039000","TCP"
"624","26.590964","6.061692000","0.000035000","0.000034000","10.22.1.2","0.000035000","12002  >  53629 [PSH, ACK] Seq=25155 Ack=1015 Win=64768 Len=352","406","0.000000000","10.1.1.2","0.000034000","TCP"
"639","26.718793","6.189523000","0.000046000","0.000046000","10.22.1.2","0.000046000","12001  >  53628 [ACK] Seq=64897 Ack=166955 Win=62720 Len=0","54","0.000000000","10.1.1.2","0.000046000","TCP"
"640","26.718850","6.189580000","0.000057000","0.000057000","10.22.1.2","0.000057000","[TCP Window Update] 12001  >  53628 [ACK] Seq=64897 Ack=166955 Win=65536 Len=0","54","0.000000000","10.1.1.2","0.000057000","TCP"
"645","26.720092","6.190822000","0.000030000","0.000030000","10.22.1.2","0.000030000","12001  >  53628 [ACK] Seq=64897 Ack=172471 Win=65536 Len=0","54","0.000000000","10.1.1.2","0.000030000","TCP"
"652","26.730473","6.201203000","0.010381000","0.001027000","10.22.1.2","0.010381000","12001  >  53628 [PSH, ACK] Seq=64897 Ack=172471 Win=65536 Len=3040","3094","0.000000000","10.1.1.2","0.001027000","TCP"
"659","26.746615","6.217343000","0.155651000","0.005266000","10.22.1.2","0.155651000","12002  >  53629 [PSH, ACK] Seq=25507 Ack=1015 Win=64768 Len=1584","1638","0.000000000","10.1.1.2","0.005266000","TCP"
"674","26.750841","6.221571000","0.000168000","0.000166000","10.22.1.2","0.000168000","12001  >  53628 [ACK] Seq=67937 Ack=172471 Win=65536 Len=61320","61374","0.000000000","10.1.1.2","0.000166000","TCP"
"676","26.917512","6.388240000","0.166837000","0.130900000","10.22.1.2","0.166837000","12002  >  53629 [PSH, ACK] Seq=27091 Ack=1015 Win=64768 Len=1584","1638","0.000000000","10.1.1.2","0.130900000","TCP"
"680","26.999638","6.470366000","0.000037000","0.000037000","10.22.1.2","0.000037000","12002  >  53629 [PSH, ACK] Seq=28675 Ack=1015 Win=64768 Len=704","758","0.000000000","10.1.1.2","0.000037000","TCP"
"686","27.122109","6.592839000","0.000030000","0.000030000","10.22.1.2","0.000030000","12001  >  53628 [ACK] Seq=129257 Ack=179771 Win=104960 Len=0","54","0.000000000","10.1.1.2","0.000030000","TCP"
"698","27.123477","6.594207000","0.000049000","0.000049000","10.22.1.2","0.000049000","12001  >  53628 [ACK] Seq=129257 Ack=195831 Win=97792 Len=0","54","0.000000000","10.1.1.2","0.000049000","TCP"
"699","27.123540","6.594270000","0.000063000","0.000063000","10.22.1.2","0.000063000","[TCP Window Update] 12001  >  53628 [ACK] Seq=129257 Ack=195831 Win=104960 Len=0","54","0.000000000","10.1.1.2","0.000063000","TCP"
"702","27.124760","6.595490000","0.000024000","0.000024000","10.22.1.2","0.000024000","12001  >  53628 [ACK] Seq=129257 Ack=197534 Win=104960 Len=0","54","0.000000000","10.1.1.2","0.000024000","TCP"
"707","27.132746","6.603476000","0.000029000","0.000029000","10.22.1.2","0.000029000","12001  >  53628 [PSH, ACK] Seq=129257 Ack=197769 Win=104704 Len=1479","1533","0.000000000","10.1.1.2","0.000029000","TCP"
"719","27.140767","6.611497000","0.000061000","0.000061000","10.22.1.2","0.000061000","12001  >  53628 [ACK] Seq=130736 Ack=197769 Win=104704 Len=1460","1514","0.000000000","10.1.1.2","0.000061000","TCP"
"721","27.152727","6.623455000","0.000039000","0.000039000","10.22.1.2","0.000039000","12002  >  53629 [PSH, ACK] Seq=29379 Ack=1015 Win=64768 Len=1232","1286","0.000000000","10.1.1.2","0.000039000","TCP"
"747","27.164701","6.635431000","0.000032000","0.000030000","10.22.1.2","0.000032000","12001  >  53628 [ACK] Seq=132196 Ack=197769 Win=104704 Len=4380","4434","0.000000000","10.1.1.2","0.000030000","TCP"
"751","27.176677","6.647407000","0.000026000","0.000026000","10.22.1.2","0.000026000","12001  >  53628 [PSH, ACK] Seq=136576 Ack=197769 Win=104704 Len=2209","2263","0.000000000","10.1.1.2","0.000026000","TCP"
"762","27.315920","6.786648000","0.163193000","0.094013000","10.22.1.2","0.163193000","12002  >  53629 [PSH, ACK] Seq=30611 Ack=1015 Win=64768 Len=1584","1638","0.000000000","10.1.1.2","0.094013000","TCP"
"769","27.506349","6.977077000","0.180610000","0.062132000","10.22.1.2","0.180610000","12002  >  53629 [PSH, ACK] Seq=32195 Ack=1015 Win=64768 Len=1584","1638","0.000000000","10.1.1.2","0.062132000","TCP"
"776","27.538786","7.009516000","0.000046000","0.000046000","10.22.1.2","0.000046000","12001  >  53628 [ACK] Seq=138785 Ack=203609 Win=98816 Len=0","54","0.000000000","10.1.1.2","0.000046000","TCP"
"783","27.540116","7.010846000","0.000037000","0.000037000","10.22.1.2","0.000037000","12001  >  53628 [ACK] Seq=138785 Ack=212369 Win=90112 Len=0","54","0.000000000","10.1.1.2","0.000037000","TCP"
"788","27.541441","7.012171000","0.000039000","0.000039000","10.22.1.2","0.000039000","12001  >  53628 [ACK] Seq=138785 Ack=215529 Win=87040 Len=0","54","0.000000000","10.1.1.2","0.000039000","TCP"
"789","27.542146","7.012876000","0.000705000","0.000705000","10.22.1.2","0.000705000","12001  >  53628 [PSH, ACK] Seq=138785 Ack=215529 Win=87040 Len=18774","18828","0.000000000","10.1.1.2","0.000705000","TCP"
"801","27.556068","7.026796000","0.000033000","0.000033000","10.22.1.2","0.000033000","12002  >  53629 [PSH, ACK] Seq=33779 Ack=1015 Win=64768 Len=352","406","0.000000000","10.1.1.2","0.000033000","TCP"
"828","27.586876","7.057606000","0.000222000","0.000222000","10.22.1.2","0.000222000","12001  >  53628 [PSH, ACK] Seq=157559 Ack=215880 Win=86528 Len=17000","17054","0.000000000","10.1.1.2","0.000222000","TCP"
"832","27.714876","7.185604000","0.158808000","0.003006000","10.22.1.2","0.158808000","12002  >  53629 [PSH, ACK] Seq=34131 Ack=1015 Win=64768 Len=1584","1638","0.000000000","10.1.1.2","0.003006000","TCP"
"835","27.886270","7.356998000","0.163837000","0.130552000","10.22.1.2","0.163837000","12002  >  53629 [PSH, ACK] Seq=35715 Ack=1015 Win=64768 Len=1584","1638","0.000000000","10.1.1.2","0.130552000","TCP"
"854","27.962083","7.432813000","0.000030000","0.000030000","10.22.1.2","0.000030000","12001  >  53628 [ACK] Seq=174559 Ack=221720 Win=80896 Len=0","54","0.000000000","10.1.1.2","0.000030000","TCP"
"868","27.963463","7.434193000","0.000055000","0.000055000","10.22.1.2","0.000055000","12001  >  53628 [ACK] Seq=174559 Ack=234394 Win=68096 Len=0","54","0.000000000","10.1.1.2","0.000055000","TCP"
"869","27.964100","7.434830000","0.000637000","0.000637000","10.22.1.2","0.000637000","12001  >  53628 [PSH, ACK] Seq=174559 Ack=234394 Win=68096 Len=20398","20452","0.000000000","10.1.1.2","0.000637000","TCP"
"898","27.998083","7.468813000","0.000096000","0.000096000","10.22.1.2","0.000096000","12001  >  53628 [PSH, ACK] Seq=194957 Ack=234394 Win=68096 Len=15630","15684","0.000000000","10.1.1.2","0.000096000","TCP"
"902","28.012666","7.483396000","0.000031000","0.000031000","10.22.1.2","0.000031000","12001  >  53628 [ACK] Seq=210587 Ack=236517 Win=66048 Len=0","54","0.000000000","10.1.1.2","0.000031000","TCP"
"903","28.076865","7.547593000","0.164073000","0.064199000","10.22.1.2","0.164073000","12002  >  53629 [PSH, ACK] Seq=37299 Ack=1015 Win=64768 Len=1584","1638","0.000000000","10.1.1.2","0.064199000","TCP"
"908","28.125843","7.596571000","0.000056000","0.000056000","10.22.1.2","0.000056000","12002  >  53629 [PSH, ACK] Seq=38883 Ack=1015 Win=64768 Len=176","230","0.000000000","10.1.1.2","0.000056000","TCP"
"909","28.285722","7.756450000","0.159879000","0.159879000","10.22.1.2","0.159879000","12002  >  53629 [PSH, ACK] Seq=39059 Ack=1015 Win=64768 Len=1584","1638","0.000000000","10.1.1.2","0.159879000","TCP"
"943","28.388062","7.858792000","0.000032000","0.000032000","10.22.1.2","0.000032000","12001  >  53628 [ACK] Seq=210587 Ack=242357 Win=67072 Len=0","54","0.000000000","10.1.1.2","0.000032000","TCP"
"946","28.389387","7.860117000","0.000029000","0.000029000","10.22.1.2","0.000029000","12001  >  53628 [ACK] Seq=210587 Ack=245277 Win=67072 Len=0","54","0.000000000","10.1.1.2","0.000029000","TCP"
"950","28.392053","7.862783000","0.000030000","0.000030000","10.22.1.2","0.000030000","12001  >  53628 [ACK] Seq=210587 Ack=249657 Win=67072 Len=0","54","0.000000000","10.1.1.2","0.000030000","TCP"
"961","28.393422","7.864152000","0.000053000","0.000051000","10.22.1.2","0.000053000","12001  >  53628 [ACK] Seq=210587 Ack=258282 Win=67072 Len=0","54","0.000000000","10.1.1.2","0.000051000","TCP"
"969","28.404105","7.874835000","0.000106000","0.000106000","10.22.1.2","0.000106000","12001  >  53628 [PSH, ACK] Seq=210587 Ack=258282 Win=67072 Len=25832","25886","0.000000000","10.1.1.2","0.000106000","TCP"
"973","28.417342","7.888072000","0.000029000","0.000029000","10.22.1.2","0.000029000","12001  >  53628 [ACK] Seq=236419 Ack=260753 Win=67072 Len=0","54","0.000000000","10.1.1.2","0.000029000","TCP"
"974","28.456587","7.927315000","0.164407000","0.039245000","10.22.1.2","0.164407000","12002  >  53629 [PSH, ACK] Seq=40643 Ack=1015 Win=64768 Len=1584","1638","0.000000000","10.1.1.2","0.039245000","TCP"
"976","28.481237","7.951965000","0.000030000","0.000030000","10.22.1.2","0.000030000","12002  >  53629 [PSH, ACK] Seq=42227 Ack=1015 Win=64768 Len=176","230","0.000000000","10.1.1.2","0.000030000","TCP"
"981","28.646054","8.116782000","0.164817000","0.123581000","10.22.1.2","0.164817000","12002  >  53629 [PSH, ACK] Seq=42403 Ack=1015 Win=64768 Len=1584","1638","0.000000000","10.1.1.2","0.123581000","TCP"
"986","28.708872","8.179600000","0.000033000","0.000033000","10.22.1.2","0.000033000","12002  >  53629 [PSH, ACK] Seq=43987 Ack=1015 Win=64768 Len=352","406","0.000000000","10.1.1.2","0.000033000","TCP"
"996","28.802060","8.272790000","0.000034000","0.000034000","10.22.1.2","0.000034000","12001  >  53628 [PSH, ACK] Seq=236419 Ack=263673 Win=69888 Len=183","237","0.000000000","10.1.1.2","0.000034000","TCP"
"999","28.804713","8.275443000","0.000027000","0.000027000","10.22.1.2","0.000027000","12001  >  53628 [ACK] Seq=236602 Ack=266593 Win=69888 Len=0","54","0.000000000","10.1.1.2","0.000027000","TCP"
"1003","28.806052","8.276782000","0.000029000","0.000029000","10.22.1.2","0.000029000","12001  >  53628 [ACK] Seq=236602 Ack=270973 Win=69888 Len=0","54","0.000000000","10.1.1.2","0.000029000","TCP"
"1018","28.810095","8.280825000","0.000060000","0.000059000","10.22.1.2","0.000060000","12001  >  53628 [ACK] Seq=236602 Ack=286039 Win=65024 Len=0","54","0.000000000","10.1.1.2","0.000059000","TCP"
"1019","28.810155","8.280885000","0.000060000","0.000060000","10.22.1.2","0.000060000","[TCP Window Update] 12001  >  53628 [ACK] Seq=236602 Ack=286039 Win=69888 Len=0","54","0.000000000","10.1.1.2","0.000060000","TCP"
"1034","28.850068","8.320798000","0.000117000","0.000117000","10.22.1.2","0.000117000","12001  >  53628 [PSH, ACK] Seq=236602 Ack=286039 Win=69888 Len=13411","13465","0.000000000","10.1.1.2","0.000117000","TCP"
"1036","28.865970","8.336698000","0.000045000","0.000045000","10.22.1.2","0.000045000","12002  >  53629 [PSH, ACK] Seq=44339 Ack=1015 Win=64768 Len=1408","1462","0.000000000","10.1.1.2","0.000045000","TCP"
"1040","29.045505","8.516233000","0.179535000","0.159550000","10.22.1.2","0.179535000","12002  >  53629 [PSH, ACK] Seq=45747 Ack=1015 Win=64768 Len=1584","1638","0.000000000","10.1.1.2","0.159550000","TCP"
"1049","29.216404","8.687132000","0.166784000","0.004377000","10.22.1.2","0.166784000","12002  >  53629 [PSH, ACK] Seq=47331 Ack=1015 Win=64768 Len=1584","1638","0.000000000","10.1.1.2","0.004377000","TCP"
"1056","29.217407","8.688137000","0.000042000","0.000039000","10.22.1.2","0.000042000","12001  >  53628 [ACK] Seq=250013 Ack=294778 Win=71424 Len=0","54","0.000000000","10.1.1.2","0.000039000","TCP"
"1063","29.218741","8.689471000","0.000048000","0.000046000","10.22.1.2","0.000048000","12001  >  53628 [ACK] Seq=250013 Ack=300142 Win=71424 Len=0","54","0.000000000","10.1.1.2","0.000046000","TCP"
"1075","29.261369","8.732099000","0.000076000","0.000070000","10.22.1.2","0.000076000","12001  >  53628 [PSH, ACK] Seq=250013 Ack=300142 Win=71424 Len=723","777","0.000000000","10.1.1.2","0.000070000","TCP"
"1085","29.303964","8.774692000","0.000072000","0.000072000","10.22.1.2","0.000072000","12002  >  53629 [PSH, ACK] Seq=48915 Ack=1015 Win=64768 Len=528","582","0.000000000","10.1.1.2","0.000072000","TCP"
"1086","29.304058","8.774788000","0.000166000","0.000094000","10.22.1.2","0.000166000","12001  >  53628 [PSH, ACK] Seq=250736 Ack=300142 Win=71424 Len=7872","7926","0.000000000","10.1.1.2","0.000094000","TCP"
"1091","29.454335","8.925063000","0.000035000","0.000035000","10.22.1.2","0.000035000","12002  >  53629 [PSH, ACK] Seq=49443 Ack=1015 Win=64768 Len=1408","1462","0.000000000","10.1.1.2","0.000035000","TCP"
"1095","29.615820","9.086548000","0.161485000","0.022960000","10.22.1.2","0.161485000","12002  >  53629 [PSH, ACK] Seq=50851 Ack=1015 Win=64768 Len=1584","1638","0.000000000","10.1.1.2","0.022960000","TCP"
"1107","29.626105","9.096835000","0.000059000","0.000059000","10.22.1.2","0.000059000","12001  >  53628 [ACK] Seq=258608 Ack=313282 Win=67072 Len=0","54","0.000000000","10.1.1.2","0.000059000","TCP"
"1108","29.626171","9.096901000","0.000066000","0.000066000","10.22.1.2","0.000066000","[TCP Window Update] 12001  >  53628 [ACK] Seq=258608 Ack=313282 Win=71424 Len=0","54","0.000000000","10.1.1.2","0.000066000","TCP"
"1114","29.627399","9.098129000","0.000031000","0.000031000","10.22.1.2","0.000031000","12001  >  53628 [ACK] Seq=258608 Ack=319487 Win=71424 Len=0","54","0.000000000","10.1.1.2","0.000031000","TCP"
"1131","29.672845","9.143575000","0.000229000","0.000229000","10.22.1.2","0.000229000","12001  >  53628 [PSH, ACK] Seq=258608 Ack=320213 Win=70656 Len=12527","12581","0.000000000","10.1.1.2","0.000229000","TCP"
"1135","29.805332","9.276060000","0.180640000","0.083465000","10.22.1.2","0.180640000","12002  >  53629 [PSH, ACK] Seq=52435 Ack=1015 Win=64768 Len=1584","1638","0.000000000","10.1.1.2","0.083465000","TCP"
"1140","29.857685","9.328413000","0.000035000","0.000035000","10.22.1.2","0.000035000","12002  >  53629 [PSH, ACK] Seq=54019 Ack=1015 Win=64768 Len=352","406","0.000000000","10.1.1.2","0.000035000","TCP"
"1145","30.014295","9.485023000","0.156610000","0.012767000","10.22.1.2","0.156610000","12002  >  53629 [PSH, ACK] Seq=54371 Ack=1015 Win=64768 Len=1584","1638","0.000000000","10.1.1.2","0.012767000","TCP"
"1148","30.030740","9.501470000","0.000035000","0.000035000","10.22.1.2","0.000035000","12001  >  53628 [ACK] Seq=271135 Ack=323133 Win=71424 Len=0","54","0.000000000","10.1.1.2","0.000035000","TCP"
"1159","30.034758","9.505488000","0.000040000","0.000040000","10.22.1.2","0.000040000","12001  >  53628 [ACK] Seq=271135 Ack=334813 Win=68608 Len=0","54","0.000000000","10.1.1.2","0.000040000","TCP"
"1160","30.034815","9.505545000","0.000057000","0.000057000","10.22.1.2","0.000057000","[TCP Window Update] 12001  >  53628 [ACK] Seq=271135 Ack=334813 Win=71424 Len=0","54","0.000000000","10.1.1.2","0.000057000","TCP"
"1164","30.036068","9.506798000","0.000033000","0.000033000","10.22.1.2","0.000033000","12001  >  53628 [ACK] Seq=271135 Ack=339152 Win=71424 Len=0","54","0.000000000","10.1.1.2","0.000033000","TCP"
"1192","30.079989","9.550719000","0.000031000","0.000031000","10.22.1.2","0.000031000","12001  >  53628 [ACK] Seq=271135 Ack=341757 Win=71424 Len=0","54","0.000000000","10.1.1.2","0.000031000","TCP"
"1198","30.082654","9.553384000","0.000032000","0.000032000","10.22.1.2","0.000032000","[TCP Fast Retransmission] 12001  >  53628 [PSH, ACK] Seq=258036 Ack=341757 Win=71424 Len=1460","1514","0.000000000","10.1.1.2","0.000032000","TCP"
"1202","30.185210","9.655938000","0.170915000","0.098600000","10.22.1.2","0.170915000","12002  >  53629 [PSH, ACK] Seq=55955 Ack=1015 Win=64768 Len=1584","1638","0.000000000","10.1.1.2","0.098600000","TCP"
"1207","30.357572","9.828302000","0.270962000","0.143130000","10.22.1.2","0.270962000","[TCP Retransmission] 12001  >  53628 [PSH, ACK] Seq=258036 Ack=341757 Win=71424 Len=1460","1514","0.000000000","10.1.1.2","0.143130000","TCP"
"1208","30.375643","9.846371000","0.166560000","0.018071000","10.22.1.2","0.166560000","12002  >  53629 [PSH, ACK] Seq=57539 Ack=1015 Win=64768 Len=1584","1638","0.000000000","10.1.1.2","0.018071000","TCP"
"1217","30.418113","9.888841000","0.000037000","0.000037000","10.22.1.2","0.000037000","12002  >  53629 [PSH, ACK] Seq=59123 Ack=1015 Win=64768 Len=352","406","0.000000000","10.1.1.2","0.000037000","TCP"
