"No.","Time","Time since first frame in this TCP stream","segment delta","Time delta from previous captured frame","Destination","Delta Time (conv)","Info","Length","Time shift for this packet","Source","Time delta from previous captured frame","Protocol"
"46","18.357412","0.000000000","0.000000000","0.000258000","10.202.1.2","0.000000000","8800  >  51343 [PSH, ACK] Seq=1 Ack=1 Win=255 Len=7541","7595","0.000000000","10.1.1.2","0.000258000","TCP"
"56","18.866735","0.000103000","0.000103000","0.000103000","10.202.1.2","0.000103000","12003  >  51348 [SYN, ACK] Seq=0 Ack=1 Win=8192 Len=0 MSS=1460 WS=256 SACK_PERM=1","66","0.000000000","10.1.1.2","0.000103000","TCP"
"63","19.334213","0.000000000","0.000000000","0.016100000","10.202.1.2","0.000000000","12000  >  51347 [PSH, ACK] Seq=1 Ack=1 Win=254 Len=708","762","0.000000000","10.1.1.2","0.016100000","TCP"
"65","19.492882","0.626250000","0.201605000","0.121105000","10.202.1.2","0.201605000","12003  >  51348 [ACK] Seq=1 Ack=314 Win=65536 Len=0","54","0.000000000","10.1.1.2","0.121105000","TCP"
"66","19.691090","0.824458000","0.198208000","0.198208000","10.202.1.2","0.198208000","12003  >  51348 [PSH, ACK] Seq=1 Ack=314 Win=65536 Len=932","986","0.000000000","10.1.1.2","0.198208000","TCP"
"73","20.111216","1.244584000","0.006594000","0.005264000","10.202.1.2","0.006594000","12003  >  51348 [PSH, ACK] Seq=933 Ack=440 Win=65536 Len=326","380","0.000000000","10.1.1.2","0.005264000","TCP"
"79","20.521463","0.000168000","0.000168000","0.000165000","10.202.1.2","0.000168000","12001  >  51349 [SYN, ACK] Seq=0 Ack=1 Win=8192 Len=0 MSS=1460 WS=256 SACK_PERM=1","66","0.000000000","10.1.1.2","0.000165000","TCP"
"80","20.521551","0.000253000","0.000253000","0.000088000","10.202.1.2","0.000253000","12002  >  51350 [SYN, ACK] Seq=0 Ack=1 Win=8192 Len=0 MSS=1460 WS=256 SACK_PERM=1","66","0.000000000","10.1.1.2","0.000088000","TCP"
"95","20.972038","0.450743000","0.026109000","0.004804000","10.202.1.2","0.026109000","12001  >  51349 [PSH, ACK] Seq=1 Ack=314 Win=65536 Len=932","986","0.000000000","10.1.1.2","0.004804000","TCP"
"96","20.980271","0.458973000","0.035673000","0.008233000","10.202.1.2","0.035673000","12002  >  51350 [PSH, ACK] Seq=1 Ack=314 Win=65536 Len=932","986","0.000000000","10.1.1.2","0.008233000","TCP"
"101","21.029843","2.163211000","0.000045000","0.000045000","10.202.1.2","0.000045000","12003  >  51348 [ACK] Seq=1259 Ack=3360 Win=65536 Len=0","54","0.000000000","10.1.1.2","0.000045000","TCP"
"107","21.397121","0.875826000","0.006575000","0.006574000","10.202.1.2","0.006575000","12001  >  51349 [PSH, ACK] Seq=933 Ack=440 Win=65536 Len=286","340","0.000000000","10.1.1.2","0.006574000","TCP"
"108","21.402733","0.881435000","0.012186000","0.005612000","10.202.1.2","0.012186000","12002  >  51350 [PSH, ACK] Seq=933 Ack=440 Win=65536 Len=286","340","0.000000000","10.1.1.2","0.005612000","TCP"
"113","21.435835","2.569203000","0.000026000","0.000026000","10.202.1.2","0.000026000","12003  >  51348 [ACK] Seq=1259 Ack=9200 Win=65536 Len=0","54","0.000000000","10.1.1.2","0.000026000","TCP"
"126","21.869831","3.003199000","0.000053000","0.000053000","10.202.1.2","0.000053000","12003  >  51348 [ACK] Seq=1259 Ack=11766 Win=65536 Len=0","54","0.000000000","10.1.1.2","0.000053000","TCP"
"131","21.917918","3.051286000","0.048087000","0.005643000","10.202.1.2","0.048087000","12003  >  51348 [ACK] Seq=1259 Ack=11766 Win=65536 Len=2920","2974","0.000000000","10.1.1.2","0.005643000","TCP"
"139","22.068148","1.546850000","0.000029000","0.000029000","10.202.1.2","0.000029000","12002  >  51350 [ACK] Seq=1219 Ack=2570 Win=65536 Len=0","54","0.000000000","10.1.1.2","0.000029000","TCP"
"142","22.242964","1.721669000","0.201473000","0.110354000","10.202.1.2","0.201473000","12001  >  51349 [ACK] Seq=1219 Ack=612 Win=65280 Len=0","54","0.000000000","10.1.1.2","0.110354000","TCP"
"145","22.323744","3.457112000","0.000040000","0.000040000","10.202.1.2","0.000040000","12003  >  51348 [ACK] Seq=4179 Ack=11766 Win=65536 Len=5840","5894","0.000000000","10.1.1.2","0.000040000","TCP"
"148","22.444173","1.922875000","0.196349000","0.116442000","10.202.1.2","0.196349000","12002  >  51350 [ACK] Seq=1219 Ack=3799 Win=64256 Len=0","54","0.000000000","10.1.1.2","0.116442000","TCP"
"151","22.472872","1.951574000","0.000063000","0.000063000","10.202.1.2","0.000063000","12002  >  51350 [ACK] Seq=1219 Ack=5914 Win=65536 Len=0","54","0.000000000","10.1.1.2","0.000063000","TCP"
"154","22.627306","2.106008000","0.000071000","0.000071000","10.202.1.2","0.000071000","12002  >  51350 [ACK] Seq=1219 Ack=7498 Win=65536 Len=0","54","0.000000000","10.1.1.2","0.000071000","TCP"
"157","22.729744","3.863112000","0.000031000","0.000031000","10.202.1.2","0.000031000","12003  >  51348 [PSH, ACK] Seq=10019 Ack=11766 Win=65536 Len=2591","2645","0.000000000","10.1.1.2","0.000031000","TCP"
"163","22.870852","2.349554000","0.000029000","0.000029000","10.202.1.2","0.000029000","12002  >  51350 [ACK] Seq=1219 Ack=9610 Win=65536 Len=0","54","0.000000000","10.1.1.2","0.000029000","TCP"
"170","23.206324","2.685026000","0.000043000","0.000042000","10.202.1.2","0.000043000","12002  >  51350 [ACK] Seq=1219 Ack=12602 Win=65536 Len=0","54","0.000000000","10.1.1.2","0.000042000","TCP"
"174","23.326983","3.992770000","0.003562000","0.003562000","10.202.1.2","0.003562000","12000  >  51347 [PSH, ACK] Seq=709 Ack=137 Win=253 Len=201","255","0.000000000","10.1.1.2","0.003562000","TCP"
"176","23.412977","4.546345000","0.206695000","0.000019000","10.202.1.2","0.206695000","12003  >  51348 [ACK] Seq=12610 Ack=11872 Win=65536 Len=0","54","0.000000000","10.1.1.2","0.000019000","TCP"
"179","23.449933","2.928635000","0.000045000","0.000045000","10.202.1.2","0.000045000","12002  >  51350 [ACK] Seq=1219 Ack=14714 Win=65536 Len=0","54","0.000000000","10.1.1.2","0.000045000","TCP"
"184","23.758765","4.892133000","0.000040000","0.000040000","10.202.1.2","0.000040000","12003  >  51348 [ACK] Seq=12610 Ack=16252 Win=65536 Len=0","54","0.000000000","10.1.1.2","0.000040000","TCP"
"193","23.760116","4.893484000","0.000046000","0.000046000","10.202.1.2","0.000046000","12003  >  51348 [ACK] Seq=12610 Ack=26010 Win=64512 Len=0","54","0.000000000","10.1.1.2","0.000046000","TCP"
"196","23.786732","3.265434000","0.000048000","0.000048000","10.202.1.2","0.000048000","12002  >  51350 [ACK] Seq=1219 Ack=17677 Win=65536 Len=0","54","0.000000000","10.1.1.2","0.000048000","TCP"
"198","23.788335","3.267040000","1.545371000","0.001008000","10.202.1.2","1.545371000","12001  >  51349 [PSH, ACK] Seq=1219 Ack=612 Win=65280 Len=172","226","0.000000000","10.1.1.2","0.001008000","TCP"
"212","23.810950","4.944318000","0.050834000","0.014931000","10.202.1.2","0.050834000","12003  >  51348 [PSH, ACK] Seq=12610 Ack=26010 Win=64512 Len=13865","13919","0.000000000","10.1.1.2","0.014931000","TCP"
"220","24.047627","3.526329000","0.000036000","0.000036000","10.202.1.2","0.000036000","12002  >  51350 [ACK] Seq=1219 Ack=19965 Win=65536 Len=0","54","0.000000000","10.1.1.2","0.000036000","TCP"
"229","24.220667","5.354035000","0.000029000","0.000029000","10.202.1.2","0.000029000","12003  >  51348 [PSH, ACK] Seq=26475 Ack=26458 Win=64000 Len=121","175","0.000000000","10.1.1.2","0.000029000","TCP"
"235","24.243300","3.722005000","0.000032000","0.000032000","10.202.1.2","0.000032000","12001  >  51349 [PSH, ACK] Seq=1391 Ack=954 Win=65024 Len=364","418","0.000000000","10.1.1.2","0.000032000","TCP"
"242","24.281897","3.760602000","0.000025000","0.000025000","10.202.1.2","0.000025000","12001  >  51349 [ACK] Seq=1755 Ack=3874 Win=65536 Len=0","54","0.000000000","10.1.1.2","0.000025000","TCP"
"245","24.368450","3.847152000","0.000047000","0.000047000","10.202.1.2","0.000047000","12002  >  51350 [ACK] Seq=1219 Ack=22657 Win=65536 Len=0","54","0.000000000","10.1.1.2","0.000047000","TCP"
"250","24.450997","3.929699000","0.000052000","0.000052000","10.202.1.2","0.000052000","12002  >  51350 [ACK] Seq=1219 Ack=23485 Win=64768 Len=0","54","0.000000000","10.1.1.2","0.000052000","TCP"
"258","24.629344","4.108046000","0.000033000","0.000032000","10.202.1.2","0.000033000","12002  >  51350 [ACK] Seq=1219 Ack=25069 Win=65536 Len=0","54","0.000000000","10.1.1.2","0.000032000","TCP"
"259","24.629358","5.762726000","0.000046000","0.000014000","10.202.1.2","0.000046000","12003  >  51348 [PSH, ACK] Seq=26596 Ack=27052 Win=65536 Len=121","175","0.000000000","10.1.1.2","0.000014000","TCP"
"262","24.648950","4.127655000","0.367053000","0.001003000","10.202.1.2","0.367053000","12001  >  51349 [PSH, ACK] Seq=1755 Ack=3874 Win=65536 Len=3551","3605","0.000000000","10.1.1.2","0.001003000","TCP"
"269","24.686584","4.165289000","0.000032000","0.000032000","10.202.1.2","0.000032000","12001  >  51349 [PSH, ACK] Seq=5306 Ack=5334 Win=65536 Len=1123","1177","0.000000000","10.1.1.2","0.000032000","TCP"
"274","24.687917","4.166622000","0.000028000","0.000028000","10.202.1.2","0.000028000","12001  >  51349 [ACK] Seq=6429 Ack=9714 Win=65536 Len=0","54","0.000000000","10.1.1.2","0.000028000","TCP"
"280","24.872942","4.351644000","0.000025000","0.000025000","10.202.1.2","0.000025000","12002  >  51350 [ACK] Seq=1219 Ack=27005 Win=65536 Len=0","54","0.000000000","10.1.1.2","0.000025000","TCP"
"286","25.027421","4.506123000","0.000069000","0.000069000","10.202.1.2","0.000069000","12002  >  51350 [ACK] Seq=1219 Ack=28589 Win=65536 Len=0","54","0.000000000","10.1.1.2","0.000069000","TCP"
"290","25.037328","6.170696000","0.003337000","0.000633000","10.202.1.2","0.003337000","12003  >  51348 [PSH, ACK] Seq=26717 Ack=27173 Win=65536 Len=593","647","0.000000000","10.1.1.2","0.000633000","TCP"
"292","25.055331","4.534036000","0.000037000","0.000037000","10.202.1.2","0.000037000","12001  >  51349 [PSH, ACK] Seq=6429 Ack=9714 Win=65536 Len=2409","2463","0.000000000","10.1.1.2","0.000037000","TCP"
"305","25.093779","4.572484000","0.038448000","0.001189000","10.202.1.2","0.038448000","12001  >  51349 [ACK] Seq=8838 Ack=9714 Win=65536 Len=4380","4434","0.000000000","10.1.1.2","0.001189000","TCP"
"316","25.096630","4.575335000","0.000054000","0.000054000","10.202.1.2","0.000054000","12001  >  51349 [ACK] Seq=13218 Ack=21394 Win=62720 Len=1460","1514","0.000000000","10.1.1.2","0.000054000","TCP"
"317","25.096700","4.575405000","0.000070000","0.000070000","10.202.1.2","0.000070000","[TCP Window Update] 12001  >  51349 [ACK] Seq=14678 Ack=21394 Win=65536 Len=0","54","0.000000000","10.1.1.2","0.000070000","TCP"
"325","25.207074","4.685776000","0.000027000","0.000027000","10.202.1.2","0.000027000","12002  >  51350 [ACK] Seq=1219 Ack=30173 Win=65536 Len=0","54","0.000000000","10.1.1.2","0.000027000","TCP"
"330","25.432040","4.910742000","0.000026000","0.000026000","10.202.1.2","0.000026000","12002  >  51350 [ACK] Seq=1219 Ack=32109 Win=65536 Len=0","54","0.000000000","10.1.1.2","0.000026000","TCP"
"332","25.441364","6.574732000","0.000032000","0.000032000","10.202.1.2","0.000032000","12003  >  51348 [PSH, ACK] Seq=27310 Ack=27888 Win=64768 Len=121","175","0.000000000","10.1.1.2","0.000032000","TCP"
"336","25.461335","4.940040000","0.000035000","0.000035000","10.202.1.2","0.000035000","12001  >  51349 [ACK] Seq=14678 Ack=21394 Win=65536 Len=5840","5894","0.000000000","10.1.1.2","0.000035000","TCP"
"359","25.507954","4.986659000","0.000049000","0.000049000","10.202.1.2","0.000049000","12001  >  51349 [PSH, ACK] Seq=20518 Ack=30154 Win=62720 Len=3831","3885","0.000000000","10.1.1.2","0.000049000","TCP"
"360","25.508014","4.986719000","0.000060000","0.000060000","10.202.1.2","0.000060000","[TCP Window Update] 12001  >  51349 [ACK] Seq=24349 Ack=30154 Win=65536 Len=0","54","0.000000000","10.1.1.2","0.000060000","TCP"
"367","25.509275","4.987980000","0.000038000","0.000038000","10.202.1.2","0.000038000","12001  >  51349 [ACK] Seq=24349 Ack=38914 Win=62720 Len=0","54","0.000000000","10.1.1.2","0.000038000","TCP"
"368","25.509354","4.988059000","0.000079000","0.000079000","10.202.1.2","0.000079000","[TCP Window Update] 12001  >  51349 [ACK] Seq=24349 Ack=38914 Win=65536 Len=0","54","0.000000000","10.1.1.2","0.000079000","TCP"
"380","25.607796","5.086498000","0.000052000","0.000052000","10.202.1.2","0.000052000","12002  >  51350 [ACK] Seq=1219 Ack=33693 Win=65536 Len=0","54","0.000000000","10.1.1.2","0.000052000","TCP"
"388","25.788800","5.267502000","0.000028000","0.000028000","10.202.1.2","0.000028000","12002  >  51350 [ACK] Seq=1219 Ack=35277 Win=65536 Len=0","54","0.000000000","10.1.1.2","0.000028000","TCP"
"393","25.872669","7.006037000","0.000034000","0.000034000","10.202.1.2","0.000034000","12003  >  51348 [PSH, ACK] Seq=27431 Ack=28482 Win=64256 Len=1186","1240","0.000000000","10.1.1.2","0.000034000","TCP"
"427","25.913941","5.392646000","0.000035000","0.000035000","10.202.1.2","0.000035000","12001  >  51349 [ACK] Seq=24349 Ack=41834 Win=65536 Len=0","54","0.000000000","10.1.1.2","0.000035000","TCP"
"431","25.917927","5.396632000","0.000028000","0.000028000","10.202.1.2","0.000028000","12001  >  51349 [ACK] Seq=24349 Ack=46214 Win=65536 Len=0","54","0.000000000","10.1.1.2","0.000028000","TCP"
"439","25.919288","5.397993000","0.000045000","0.000044000","10.202.1.2","0.000045000","12001  >  51349 [ACK] Seq=24349 Ack=53514 Win=65536 Len=0","54","0.000000000","10.1.1.2","0.000044000","TCP"
"441","25.919735","5.398440000","0.000447000","0.000425000","10.202.1.2","0.000447000","12001  >  51349 [ACK] Seq=24349 Ack=53514 Win=65536 Len=26280","26334","0.000000000","10.1.1.2","0.000425000","TCP"
"444","25.921924","5.400629000","0.000030000","0.000030000","10.202.1.2","0.000030000","12001  >  51349 [ACK] Seq=50629 Ack=56434 Win=65536 Len=0","54","0.000000000","10.1.1.2","0.000030000","TCP"
"453","25.923277","5.401982000","0.000037000","0.000037000","10.202.1.2","0.000037000","12001  >  51349 [ACK] Seq=50629 Ack=66977 Win=64000 Len=0","54","0.000000000","10.1.1.2","0.000037000","TCP"
"454","25.923332","5.402037000","0.000055000","0.000055000","10.202.1.2","0.000055000","[TCP Window Update] 12001  >  51349 [ACK] Seq=50629 Ack=66977 Win=65536 Len=0","54","0.000000000","10.1.1.2","0.000055000","TCP"
"470","26.007116","5.485818000","0.000027000","0.000027000","10.202.1.2","0.000027000","12002  >  51350 [ACK] Seq=1219 Ack=37213 Win=65536 Len=0","54","0.000000000","10.1.1.2","0.000027000","TCP"
"479","26.188183","5.666885000","0.000051000","0.000011000","10.202.1.2","0.000051000","12002  >  51350 [ACK] Seq=1219 Ack=38797 Win=65536 Len=0","54","0.000000000","10.1.1.2","0.000011000","TCP"
"533","26.322079","5.800784000","0.000041000","0.000041000","10.202.1.2","0.000041000","[TCP Dup ACK 453#1] 12001  >  51349 [ACK] Seq=50629 Ack=66977 Win=65536 Len=0 SLE=68437 SRE=69897","66","0.000000000","10.1.1.2","0.000041000","TCP"
"534","26.322097","5.800802000","0.000018000","0.000018000","10.202.1.2","0.000018000","[TCP Dup ACK 453#2] 12001  >  51349 [ACK] Seq=50629 Ack=66977 Win=65536 Len=0 SLE=68437 SRE=71357","66","0.000000000","10.1.1.2","0.000018000","TCP"
"535","26.322111","5.800816000","0.000014000","0.000014000","10.202.1.2","0.000014000","[TCP Dup ACK 453#3] 12001  >  51349 [ACK] Seq=50629 Ack=66977 Win=65536 Len=0 SLE=68437 SRE=72817","66","0.000000000","10.1.1.2","0.000014000","TCP"
"536","26.322125","5.800830000","0.000014000","0.000014000","10.202.1.2","0.000014000","[TCP Dup ACK 453#4] 12001  >  51349 [ACK] Seq=50629 Ack=66977 Win=65536 Len=0 SLE=68437 SRE=74277","66","0.000000000","10.1.1.2","0.000014000","TCP"
"540","26.323385","5.802090000","0.000020000","0.000020000","10.202.1.2","0.000020000","[TCP Dup ACK 453#5] 12001  >  51349 [ACK] Seq=50629 Ack=66977 Win=65536 Len=0 SLE=68437 SRE=75737","66","0.000000000","10.1.1.2","0.000020000","TCP"
"541","26.323400","5.802105000","0.000015000","0.000015000","10.202.1.2","0.000015000","[TCP Dup ACK 453#6] 12001  >  51349 [ACK] Seq=50629 Ack=66977 Win=65536 Len=0 SLE=68437 SRE=77197","66","0.000000000","10.1.1.2","0.000015000","TCP"
"542","26.323413","5.802118000","0.000013000","0.000013000","10.202.1.2","0.000013000","[TCP Dup ACK 453#7] 12001  >  51349 [ACK] Seq=50629 Ack=66977 Win=65536 Len=0 SLE=68437 SRE=78657","66","0.000000000","10.1.1.2","0.000013000","TCP"
"546","26.324724","5.803429000","0.000025000","0.000025000","10.202.1.2","0.000025000","[TCP Dup ACK 453#8] 12001  >  51349 [ACK] Seq=50629 Ack=66977 Win=65536 Len=0 SLE=68437 SRE=80117","66","0.000000000","10.1.1.2","0.000025000","TCP"
"547","26.324741","5.803446000","0.000017000","0.000017000","10.202.1.2","0.000017000","[TCP Dup ACK 453#9] 12001  >  51349 [ACK] Seq=50629 Ack=66977 Win=65536 Len=0 SLE=68437 SRE=81577","66","0.000000000","10.1.1.2","0.000017000","TCP"
"548","26.324755","5.803460000","0.000014000","0.000014000","10.202.1.2","0.000014000","[TCP Dup ACK 453#10] 12001  >  51349 [ACK] Seq=50629 Ack=66977 Win=65536 Len=0 SLE=68437 SRE=83037","66","0.000000000","10.1.1.2","0.000014000","TCP"
"553","26.326049","5.804754000","0.000020000","0.000020000","10.202.1.2","0.000020000","[TCP Dup ACK 453#11] 12001  >  51349 [ACK] Seq=50629 Ack=66977 Win=65536 Len=0 SLE=68437 SRE=84497","66","0.000000000","10.1.1.2","0.000020000","TCP"
"554","26.326064","5.804769000","0.000015000","0.000015000","10.202.1.2","0.000015000","[TCP Dup ACK 453#12] 12001  >  51349 [ACK] Seq=50629 Ack=66977 Win=65536 Len=0 SLE=68437 SRE=85957","66","0.000000000","10.1.1.2","0.000015000","TCP"
"555","26.326077","5.804782000","0.000013000","0.000013000","10.202.1.2","0.000013000","[TCP Dup ACK 453#13] 12001  >  51349 [ACK] Seq=50629 Ack=66977 Win=65536 Len=0 SLE=68437 SRE=87417","66","0.000000000","10.1.1.2","0.000013000","TCP"
"556","26.326092","5.804797000","0.000015000","0.000015000","10.202.1.2","0.000015000","[TCP Dup ACK 453#14] 12001  >  51349 [ACK] Seq=50629 Ack=66977 Win=65536 Len=0 SLE=68437 SRE=88877","66","0.000000000","10.1.1.2","0.000015000","TCP"
"560","26.330050","5.808755000","0.000028000","0.000028000","10.202.1.2","0.000028000","[TCP Dup ACK 453#15] 12001  >  51349 [ACK] Seq=50629 Ack=66977 Win=65536 Len=0 SLE=68437 SRE=90337","66","0.000000000","10.1.1.2","0.000028000","TCP"
"561","26.330067","5.808772000","0.000017000","0.000017000","10.202.1.2","0.000017000","[TCP Dup ACK 453#16] 12001  >  51349 [ACK] Seq=50629 Ack=66977 Win=65536 Len=0 SLE=68437 SRE=91797","66","0.000000000","10.1.1.2","0.000017000","TCP"
"562","26.330080","5.808785000","0.000013000","0.000013000","10.202.1.2","0.000013000","[TCP Dup ACK 453#17] 12001  >  51349 [ACK] Seq=50629 Ack=66977 Win=65536 Len=0 SLE=68437 SRE=93257","66","0.000000000","10.1.1.2","0.000013000","TCP"
"567","26.331372","5.810077000","0.000018000","0.000018000","10.202.1.2","0.000018000","[TCP Dup ACK 453#18] 12001  >  51349 [ACK] Seq=50629 Ack=66977 Win=65536 Len=0 SLE=68437 SRE=94717","66","0.000000000","10.1.1.2","0.000018000","TCP"
"568","26.331387","5.810092000","0.000015000","0.000015000","10.202.1.2","0.000015000","[TCP Dup ACK 453#19] 12001  >  51349 [ACK] Seq=50629 Ack=66977 Win=65536 Len=0 SLE=68437 SRE=96177","66","0.000000000","10.1.1.2","0.000015000","TCP"
"569","26.331430","5.810135000","0.000043000","0.000043000","10.202.1.2","0.000043000","12001  >  51349 [PSH, ACK] Seq=50629 Ack=66977 Win=65536 Len=24834","24888","0.000000000","10.1.1.2","0.000043000","TCP"
"571","26.332703","5.811408000","0.000025000","0.000025000","10.202.1.2","0.000025000","[TCP Dup ACK 453#20] 12001  >  51349 [ACK] Seq=75463 Ack=66977 Win=65536 Len=0 SLE=68437 SRE=97637","66","0.000000000","10.1.1.2","0.000025000","TCP"
"573","26.334026","5.812731000","0.000018000","0.000018000","10.202.1.2","0.000018000","[TCP Dup ACK 453#21] 12001  >  51349 [ACK] Seq=75463 Ack=66977 Win=65536 Len=0 SLE=68437 SRE=99097","66","0.000000000","10.1.1.2","0.000018000","TCP"
"580","26.335376","5.814081000","0.000022000","0.000022000","10.202.1.2","0.000022000","[TCP Dup ACK 453#22] 12001  >  51349 [ACK] Seq=75463 Ack=66977 Win=65536 Len=0 SLE=68437 SRE=100557","66","0.000000000","10.1.1.2","0.000022000","TCP"
"581","26.335390","5.814095000","0.000014000","0.000014000","10.202.1.2","0.000014000","[TCP Dup ACK 453#23] 12001  >  51349 [ACK] Seq=75463 Ack=66977 Win=65536 Len=0 SLE=68437 SRE=102017","66","0.000000000","10.1.1.2","0.000014000","TCP"
"582","26.335403","5.814108000","0.000013000","0.000013000","10.202.1.2","0.000013000","[TCP Dup ACK 453#24] 12001  >  51349 [ACK] Seq=75463 Ack=66977 Win=65536 Len=0 SLE=68437 SRE=103477","66","0.000000000","10.1.1.2","0.000013000","TCP"
"583","26.335417","5.814122000","0.000014000","0.000014000","10.202.1.2","0.000014000","[TCP Dup ACK 453#25] 12001  >  51349 [ACK] Seq=75463 Ack=66977 Win=65536 Len=0 SLE=68437 SRE=104937","66","0.000000000","10.1.1.2","0.000014000","TCP"
"584","26.335432","5.814137000","0.000015000","0.000015000","10.202.1.2","0.000015000","[TCP Dup ACK 453#26] 12001  >  51349 [ACK] Seq=75463 Ack=66977 Win=65536 Len=0 SLE=68437 SRE=106397","66","0.000000000","10.1.1.2","0.000015000","TCP"
"585","26.335446","5.814151000","0.000014000","0.000014000","10.202.1.2","0.000014000","[TCP Dup ACK 453#27] 12001  >  51349 [ACK] Seq=75463 Ack=66977 Win=65536 Len=0 SLE=68437 SRE=107857","66","0.000000000","10.1.1.2","0.000014000","TCP"
"598","26.336728","5.815433000","0.000029000","0.000029000","10.202.1.2","0.000029000","[TCP Dup ACK 453#28] 12001  >  51349 [ACK] Seq=75463 Ack=66977 Win=65536 Len=0 SLE=68437 SRE=109317","66","0.000000000","10.1.1.2","0.000029000","TCP"
"599","26.336743","5.815448000","0.000015000","0.000015000","10.202.1.2","0.000015000","[TCP Dup ACK 453#29] 12001  >  51349 [ACK] Seq=75463 Ack=66977 Win=65536 Len=0 SLE=68437 SRE=110777","66","0.000000000","10.1.1.2","0.000015000","TCP"
"600","26.336785","5.815490000","0.000042000","0.000042000","10.202.1.2","0.000042000","[TCP Dup ACK 453#30] 12001  >  51349 [ACK] Seq=75463 Ack=66977 Win=65536 Len=0 SLE=68437 SRE=112237","66","0.000000000","10.1.1.2","0.000042000","TCP"
"601","26.336800","5.815505000","0.000015000","0.000015000","10.202.1.2","0.000015000","[TCP Dup ACK 453#31] 12001  >  51349 [ACK] Seq=75463 Ack=66977 Win=65536 Len=0 SLE=68437 SRE=113697","66","0.000000000","10.1.1.2","0.000015000","TCP"
"602","26.336814","5.815519000","0.000014000","0.000014000","10.202.1.2","0.000014000","[TCP Dup ACK 453#32] 12001  >  51349 [ACK] Seq=75463 Ack=66977 Win=65536 Len=0 SLE=68437 SRE=115157","66","0.000000000","10.1.1.2","0.000014000","TCP"
"606","26.338030","5.816735000","0.000024000","0.000024000","10.202.1.2","0.000024000","[TCP Dup ACK 453#33] 12001  >  51349 [ACK] Seq=75463 Ack=66977 Win=65536 Len=0 SLE=68437 SRE=116617","66","0.000000000","10.1.1.2","0.000024000","TCP"
"607","26.338046","5.816751000","0.000016000","0.000016000","10.202.1.2","0.000016000","[TCP Dup ACK 453#34] 12001  >  51349 [ACK] Seq=75463 Ack=66977 Win=65536 Len=0 SLE=68437 SRE=118077","66","0.000000000","10.1.1.2","0.000016000","TCP"
"613","26.384622","5.863324000","0.000025000","0.000025000","10.202.1.2","0.000025000","12002  >  51350 [ACK] Seq=1219 Ack=40352 Win=65536 Len=0","54","0.000000000","10.1.1.2","0.000025000","TCP"
"621","26.559010","6.037712000","0.000027000","0.000027000","10.202.1.2","0.000027000","12002  >  51350 [ACK] Seq=1219 Ack=41878 Win=65536 Len=0","54","0.000000000","10.1.1.2","0.000027000","TCP"
"647","26.728075","6.206780000","0.000035000","0.000035000","10.202.1.2","0.000035000","[TCP Dup ACK 453#35] 12001  >  51349 [ACK] Seq=75463 Ack=66977 Win=65536 Len=0 SLE=68437 SRE=119537","66","0.000000000","10.1.1.2","0.000035000","TCP"
"650","26.729393","6.208098000","0.000020000","0.000020000","10.202.1.2","0.000020000","[TCP Dup ACK 453#36] 12001  >  51349 [ACK] Seq=75463 Ack=66977 Win=65536 Len=0 SLE=68437 SRE=120997","66","0.000000000","10.1.1.2","0.000020000","TCP"
"651","26.729446","6.208151000","0.000053000","0.000053000","10.202.1.2","0.000053000","12001  >  51349 [ACK] Seq=75463 Ack=120997 Win=65536 Len=0","54","0.000000000","10.1.1.2","0.000053000","TCP"
"657","26.738734","6.217439000","0.000035000","0.000035000","10.202.1.2","0.000035000","12001  >  51349 [ACK] Seq=75463 Ack=123917 Win=65536 Len=0","54","0.000000000","10.1.1.2","0.000035000","TCP"
"667","26.746743","6.225448000","0.000049000","0.000049000","10.202.1.2","0.000049000","12001  >  51349 [ACK] Seq=75463 Ack=131217 Win=65536 Len=0","54","0.000000000","10.1.1.2","0.000049000","TCP"
"670","26.748039","6.226741000","0.000028000","0.000028000","10.202.1.2","0.000028000","12002  >  51350 [ACK] Seq=1219 Ack=43638 Win=65536 Len=0","54","0.000000000","10.1.1.2","0.000028000","TCP"
"671","26.748266","6.226971000","0.001523000","0.000227000","10.202.1.2","0.001523000","12001  >  51349 [ACK] Seq=75463 Ack=131217 Win=65536 Len=52560","52614","0.000000000","10.1.1.2","0.000227000","TCP"
"678","26.965039","6.443741000","0.000045000","0.000045000","10.202.1.2","0.000045000","12002  >  51350 [ACK] Seq=1219 Ack=45398 Win=65536 Len=0","54","0.000000000","10.1.1.2","0.000045000","TCP"
"705","27.130089","6.608791000","0.000028000","0.000028000","10.202.1.2","0.000028000","12002  >  51350 [ACK] Seq=1219 Ack=46982 Win=65536 Len=0","54","0.000000000","10.1.1.2","0.000028000","TCP"
"711","27.138087","6.616792000","0.000036000","0.000036000","10.202.1.2","0.000036000","12001  >  51349 [ACK] Seq=128023 Ack=135597 Win=65536 Len=0","54","0.000000000","10.1.1.2","0.000036000","TCP"
"717","27.139419","6.618124000","0.000032000","0.000032000","10.202.1.2","0.000032000","12001  >  51349 [ACK] Seq=128023 Ack=141556 Win=65536 Len=0","54","0.000000000","10.1.1.2","0.000032000","TCP"
"726","27.155384","6.634089000","0.000029000","0.000029000","10.202.1.2","0.000029000","12001  >  51349 [ACK] Seq=128023 Ack=147396 Win=65536 Len=0","54","0.000000000","10.1.1.2","0.000029000","TCP"
"729","27.158034","6.636739000","0.000023000","0.000023000","10.202.1.2","0.000023000","12001  >  51349 [ACK] Seq=128023 Ack=150316 Win=65536 Len=0","54","0.000000000","10.1.1.2","0.000023000","TCP"
"732","27.162033","6.640738000","0.000026000","0.000026000","10.202.1.2","0.000026000","12001  >  51349 [ACK] Seq=128023 Ack=153236 Win=65536 Len=0","54","0.000000000","10.1.1.2","0.000026000","TCP"
"744","27.163448","6.642153000","0.000090000","0.000090000","10.202.1.2","0.000090000","12001  >  51349 [PSH, ACK] Seq=128023 Ack=157616 Win=65536 Len=45230","45284","0.000000000","10.1.1.2","0.000090000","TCP"
"766","27.351063","6.829765000","0.000027000","0.000027000","10.202.1.2","0.000027000","12002  >  51350 [ACK] Seq=1219 Ack=48742 Win=65536 Len=0","54","0.000000000","10.1.1.2","0.000027000","TCP"
"771","27.534783","7.013485000","0.000041000","0.000041000","10.202.1.2","0.000041000","12002  >  51350 [ACK] Seq=1219 Ack=50502 Win=65536 Len=0","54","0.000000000","10.1.1.2","0.000041000","TCP"
"792","27.545413","7.024118000","0.000027000","0.000027000","10.202.1.2","0.000027000","12001  >  51349 [ACK] Seq=173253 Ack=160536 Win=65536 Len=0","54","0.000000000","10.1.1.2","0.000027000","TCP"
"795","27.546749","7.025454000","0.000028000","0.000028000","10.202.1.2","0.000028000","12001  >  51349 [ACK] Seq=173253 Ack=163456 Win=65536 Len=0","54","0.000000000","10.1.1.2","0.000028000","TCP"
"798","27.548080","7.026785000","0.000028000","0.000028000","10.202.1.2","0.000028000","12001  >  51349 [ACK] Seq=173253 Ack=166376 Win=65536 Len=0","54","0.000000000","10.1.1.2","0.000028000","TCP"
"803","27.560048","7.038753000","0.000022000","0.000022000","10.202.1.2","0.000022000","12001  >  51349 [ACK] Seq=173253 Ack=169296 Win=65536 Len=0","54","0.000000000","10.1.1.2","0.000022000","TCP"
"809","27.564067","7.042772000","0.000032000","0.000032000","10.202.1.2","0.000032000","12001  >  51349 [ACK] Seq=173253 Ack=176596 Win=65536 Len=0","54","0.000000000","10.1.1.2","0.000032000","TCP"
"812","27.568047","7.046752000","0.000028000","0.000028000","10.202.1.2","0.000028000","12001  >  51349 [ACK] Seq=173253 Ack=179516 Win=65536 Len=0","54","0.000000000","10.1.1.2","0.000028000","TCP"
"821","27.572068","7.050773000","0.000043000","0.000043000","10.202.1.2","0.000043000","12001  >  51349 [ACK] Seq=173253 Ack=185356 Win=65536 Len=0","54","0.000000000","10.1.1.2","0.000043000","TCP"
"822","27.572236","7.050941000","0.000168000","0.000168000","10.202.1.2","0.000168000","12001  >  51349 [PSH, ACK] Seq=173253 Ack=185356 Win=65536 Len=42942","42996","0.000000000","10.1.1.2","0.000168000","TCP"
"831","27.711870","7.190572000","0.000067000","0.000067000","10.202.1.2","0.000067000","12002  >  51350 [ACK] Seq=1219 Ack=52086 Win=65536 Len=0","54","0.000000000","10.1.1.2","0.000067000","TCP"
"839","27.919475","7.398177000","0.000025000","0.000025000","10.202.1.2","0.000025000","12002  >  51350 [ACK] Seq=1219 Ack=53817 Win=65536 Len=0","54","0.000000000","10.1.1.2","0.000025000","TCP"
"843","27.950109","7.428814000","0.000041000","0.000041000","10.202.1.2","0.000041000","12001  >  51349 [PSH, ACK] Seq=216195 Ack=188276 Win=65536 Len=351","405","0.000000000","10.1.1.2","0.000041000","TCP"
"849","27.955431","7.434136000","0.000030000","0.000030000","10.202.1.2","0.000030000","12001  >  51349 [ACK] Seq=216546 Ack=194756 Win=65536 Len=0","54","0.000000000","10.1.1.2","0.000030000","TCP"
"873","27.970072","7.448777000","0.000033000","0.000033000","10.202.1.2","0.000033000","12001  >  51349 [ACK] Seq=216546 Ack=199136 Win=65536 Len=0","54","0.000000000","10.1.1.2","0.000033000","TCP"
"877","27.971400","7.450105000","0.000030000","0.000030000","10.202.1.2","0.000030000","12001  >  51349 [ACK] Seq=216546 Ack=203516 Win=65536 Len=0","54","0.000000000","10.1.1.2","0.000030000","TCP"
"881","27.974063","7.452768000","0.000031000","0.000031000","10.202.1.2","0.000031000","12001  >  51349 [ACK] Seq=216546 Ack=207896 Win=65536 Len=0","54","0.000000000","10.1.1.2","0.000031000","TCP"
"885","27.978047","7.456752000","0.000024000","0.000024000","10.202.1.2","0.000024000","12001  >  51349 [ACK] Seq=216546 Ack=210066 Win=65536 Len=0","54","0.000000000","10.1.1.2","0.000024000","TCP"
"894","27.987435","7.466140000","0.000100000","0.000100000","10.202.1.2","0.000100000","12001  >  51349 [PSH, ACK] Seq=216546 Ack=210066 Win=65536 Len=18485","18539","0.000000000","10.1.1.2","0.000100000","TCP"
"906","28.117875","7.596577000","0.000062000","0.000062000","10.202.1.2","0.000062000","12002  >  51350 [ACK] Seq=1219 Ack=55577 Win=65536 Len=0","54","0.000000000","10.1.1.2","0.000062000","TCP"
"913","28.297537","7.776239000","0.000031000","0.000031000","10.202.1.2","0.000031000","12002  >  51350 [ACK] Seq=1219 Ack=57161 Win=65536 Len=0","54","0.000000000","10.1.1.2","0.000031000","TCP"
"924","28.368142","7.846847000","0.000062000","0.000062000","10.202.1.2","0.000062000","12001  >  51349 [ACK] Seq=235031 Ack=223206 Win=61184 Len=0","54","0.000000000","10.1.1.2","0.000062000","TCP"
"925","28.368210","7.846915000","0.000068000","0.000068000","10.202.1.2","0.000068000","[TCP Window Update] 12001  >  51349 [ACK] Seq=235031 Ack=223206 Win=65536 Len=0","54","0.000000000","10.1.1.2","0.000068000","TCP"
"926","28.369553","7.848258000","0.001343000","0.001343000","10.202.1.2","0.001343000","12001  >  51349 [PSH, ACK] Seq=235031 Ack=223206 Win=65536 Len=2123","2177","0.000000000","10.1.1.2","0.001343000","TCP"
"930","28.376082","7.854787000","0.000031000","0.000031000","10.202.1.2","0.000031000","12001  >  51349 [ACK] Seq=237154 Ack=227586 Win=65536 Len=0","54","0.000000000","10.1.1.2","0.000031000","TCP"
"937","28.381419","7.860124000","0.000035000","0.000035000","10.202.1.2","0.000035000","12001  >  51349 [ACK] Seq=237154 Ack=235457 Win=65536 Len=0","54","0.000000000","10.1.1.2","0.000035000","TCP"
"966","28.401462","7.880167000","0.000129000","0.000129000","10.202.1.2","0.000129000","12001  >  51349 [PSH, ACK] Seq=237154 Ack=235927 Win=65024 Len=21765","21819","0.000000000","10.1.1.2","0.000129000","TCP"
"979","28.489217","7.967919000","0.000023000","0.000023000","10.202.1.2","0.000023000","12002  >  51350 [ACK] Seq=1219 Ack=58921 Win=65536 Len=0","54","0.000000000","10.1.1.2","0.000023000","TCP"
"984","28.688908","8.167610000","0.000031000","0.000031000","10.202.1.2","0.000031000","12002  >  51350 [ACK] Seq=1219 Ack=60681 Win=65536 Len=0","54","0.000000000","10.1.1.2","0.000031000","TCP"
"988","28.778157","8.256862000","0.000093000","0.000093000","10.202.1.2","0.000093000","12001  >  51349 [PSH, ACK] Seq=258919 Ack=235927 Win=65024 Len=2471","2525","0.000000000","10.1.1.2","0.000093000","TCP"
"992","28.787412","8.266117000","0.000027000","0.000027000","10.202.1.2","0.000027000","12001  >  51349 [ACK] Seq=261390 Ack=240307 Win=65536 Len=0","54","0.000000000","10.1.1.2","0.000027000","TCP"
"1020","28.810880","8.289585000","0.000844000","0.000725000","10.202.1.2","0.000844000","12001  >  51349 [PSH, ACK] Seq=261390 Ack=241573 Win=64256 Len=11080","11134","0.000000000","10.1.1.2","0.000725000","TCP"
"1027","28.818035","8.296740000","0.000032000","0.000032000","10.202.1.2","0.000032000","12001  >  51349 [ACK] Seq=272470 Ack=244493 Win=65536 Len=0","54","0.000000000","10.1.1.2","0.000032000","TCP"
"1032","28.819361","8.298066000","0.000026000","0.000026000","10.202.1.2","0.000026000","12001  >  51349 [ACK] Seq=272470 Ack=249521 Win=65536 Len=0","54","0.000000000","10.1.1.2","0.000026000","TCP"
"1039","28.885955","8.364657000","0.000056000","0.000056000","10.202.1.2","0.000056000","12002  >  51350 [ACK] Seq=1219 Ack=62265 Win=65536 Len=0","54","0.000000000","10.1.1.2","0.000056000","TCP"
"1043","29.048335","8.527037000","0.000040000","0.000040000","10.202.1.2","0.000040000","12002  >  51350 [ACK] Seq=1219 Ack=63849 Win=65536 Len=0","54","0.000000000","10.1.1.2","0.000040000","TCP"
"1047","29.184179","8.662884000","0.000106000","0.000106000","10.202.1.2","0.000106000","12001  >  51349 [PSH, ACK] Seq=272470 Ack=249521 Win=65536 Len=14206","14260","0.000000000","10.1.1.2","0.000106000","TCP"
"1064","29.218783","8.697488000","0.000088000","0.000042000","10.202.1.2","0.000088000","12001  >  51349 [PSH, ACK] Seq=286676 Ack=249521 Win=65536 Len=4507","4561","0.000000000","10.1.1.2","0.000042000","TCP"
"1068","29.228043","8.706748000","0.000035000","0.000035000","10.202.1.2","0.000035000","12001  >  51349 [ACK] Seq=291183 Ack=253901 Win=65536 Len=0","54","0.000000000","10.1.1.2","0.000035000","TCP"
"1071","29.229362","8.708067000","0.000027000","0.000027000","10.202.1.2","0.000027000","12001  >  51349 [ACK] Seq=291183 Ack=256120 Win=65536 Len=0","54","0.000000000","10.1.1.2","0.000027000","TCP"
"1076","29.261387","8.740092000","0.000088000","0.000018000","10.202.1.2","0.000088000","12001  >  51349 [ACK] Seq=291183 Ack=258116 Win=65536 Len=0","54","0.000000000","10.1.1.2","0.000018000","TCP"
"1081","29.279955","8.758657000","0.000036000","0.000036000","10.202.1.2","0.000036000","12002  >  51350 [ACK] Seq=1219 Ack=65785 Win=65536 Len=0","54","0.000000000","10.1.1.2","0.000036000","TCP"
"1089","29.449048","8.927750000","0.000054000","0.000054000","10.202.1.2","0.000054000","12002  >  51350 [ACK] Seq=1219 Ack=67369 Win=65536 Len=0","54","0.000000000","10.1.1.2","0.000054000","TCP"
"1094","29.592860","9.071565000","0.000118000","0.000118000","10.202.1.2","0.000118000","12001  >  51349 [PSH, ACK] Seq=291183 Ack=258116 Win=65536 Len=9567","9621","0.000000000","10.1.1.2","0.000118000","TCP"
"1115","29.627694","9.106399000","0.003000000","0.000295000","10.202.1.2","0.003000000","12001  >  51349 [PSH, ACK] Seq=300750 Ack=258116 Win=65536 Len=6538","6592","0.000000000","10.1.1.2","0.000295000","TCP"
"1122","29.640727","9.119429000","0.000052000","0.000047000","10.202.1.2","0.000052000","12002  >  51350 [ACK] Seq=1219 Ack=68924 Win=65536 Len=0","54","0.000000000","10.1.1.2","0.000047000","TCP"
"1123","29.640738","9.119443000","0.000058000","0.000011000","10.202.1.2","0.000058000","12001  >  51349 [ACK] Seq=307288 Ack=263956 Win=65536 Len=0","54","0.000000000","10.1.1.2","0.000011000","TCP"
"1129","29.642042","9.120747000","0.000032000","0.000032000","10.202.1.2","0.000032000","12001  >  51349 [ACK] Seq=307288 Ack=270643 Win=65536 Len=0","54","0.000000000","10.1.1.2","0.000032000","TCP"
"1138","29.828401","9.307103000","0.000033000","0.000033000","10.202.1.2","0.000033000","12002  >  51350 [ACK] Seq=1219 Ack=70684 Win=65536 Len=0","54","0.000000000","10.1.1.2","0.000033000","TCP"
"1144","30.001528","9.480233000","0.000113000","0.000113000","10.202.1.2","0.000113000","12001  >  51349 [PSH, ACK] Seq=307288 Ack=270643 Win=65536 Len=13475","13529","0.000000000","10.1.1.2","0.000113000","TCP"
"1150","30.033447","9.512152000","0.000082000","0.000082000","10.202.1.2","0.000082000","12001  >  51349 [PSH, ACK] Seq=320763 Ack=270643 Win=65536 Len=1678","1732","0.000000000","10.1.1.2","0.000082000","TCP"
"1166","30.046734","9.525436000","0.000048000","0.000048000","10.202.1.2","0.000048000","12002  >  51350 [ACK] Seq=1219 Ack=72444 Win=65536 Len=0","54","0.000000000","10.1.1.2","0.000048000","TCP"
"1174","30.050749","9.529454000","0.000052000","0.000052000","10.202.1.2","0.000052000","[TCP Dup ACK 1129#1] 12001  >  51349 [ACK] Seq=322441 Ack=270643 Win=65536 Len=0 SLE=272001 SRE=273461","66","0.000000000","10.1.1.2","0.000052000","TCP"
"1175","30.050769","9.529474000","0.000020000","0.000020000","10.202.1.2","0.000020000","[TCP Dup ACK 1129#2] 12001  >  51349 [ACK] Seq=322441 Ack=270643 Win=65536 Len=0 SLE=272001 SRE=274921","66","0.000000000","10.1.1.2","0.000020000","TCP"
"1176","30.050784","9.529489000","0.000015000","0.000015000","10.202.1.2","0.000015000","[TCP Dup ACK 1129#3] 12001  >  51349 [ACK] Seq=322441 Ack=270643 Win=65536 Len=0 SLE=272001 SRE=276381","66","0.000000000","10.1.1.2","0.000015000","TCP"
"1177","30.050798","9.529503000","0.000014000","0.000014000","10.202.1.2","0.000014000","[TCP Dup ACK 1129#4] 12001  >  51349 [ACK] Seq=322441 Ack=270643 Win=65536 Len=0 SLE=272001 SRE=277841","66","0.000000000","10.1.1.2","0.000014000","TCP"
"1178","30.050813","9.529518000","0.000015000","0.000015000","10.202.1.2","0.000015000","[TCP Dup ACK 1129#5] 12001  >  51349 [ACK] Seq=322441 Ack=270643 Win=65536 Len=0 SLE=272001 SRE=279301","66","0.000000000","10.1.1.2","0.000015000","TCP"
"1179","30.050828","9.529533000","0.000015000","0.000015000","10.202.1.2","0.000015000","[TCP Dup ACK 1129#6] 12001  >  51349 [ACK] Seq=322441 Ack=270643 Win=65536 Len=0 SLE=272001 SRE=280761","66","0.000000000","10.1.1.2","0.000015000","TCP"
"1180","30.050842","9.529547000","0.000014000","0.000014000","10.202.1.2","0.000014000","[TCP Dup ACK 1129#7] 12001  >  51349 [ACK] Seq=322441 Ack=270643 Win=65536 Len=0 SLE=272001 SRE=282221","66","0.000000000","10.1.1.2","0.000014000","TCP"
"1185","30.052043","9.530748000","0.000029000","0.000029000","10.202.1.2","0.000029000","[TCP Dup ACK 1129#8] 12001  >  51349 [ACK] Seq=322441 Ack=270643 Win=65536 Len=0 SLE=272001 SRE=283681","66","0.000000000","10.1.1.2","0.000029000","TCP"
"1186","30.052061","9.530766000","0.000018000","0.000018000","10.202.1.2","0.000018000","[TCP Dup ACK 1129#9] 12001  >  51349 [ACK] Seq=322441 Ack=270643 Win=65536 Len=0 SLE=272001 SRE=285141","66","0.000000000","10.1.1.2","0.000018000","TCP"
"1187","30.052075","9.530780000","0.000014000","0.000014000","10.202.1.2","0.000014000","[TCP Dup ACK 1129#10] 12001  >  51349 [ACK] Seq=322441 Ack=270643 Win=65536 Len=0 SLE=272001 SRE=286601","66","0.000000000","10.1.1.2","0.000014000","TCP"
"1188","30.052090","9.530795000","0.000015000","0.000015000","10.202.1.2","0.000015000","[TCP Dup ACK 1129#11] 12001  >  51349 [ACK] Seq=322441 Ack=270643 Win=65536 Len=0 SLE=272001 SRE=287104","66","0.000000000","10.1.1.2","0.000015000","TCP"
"1206","30.214442","9.693144000","0.000033000","0.000033000","10.202.1.2","0.000033000","12002  >  51350 [ACK] Seq=1219 Ack=74028 Win=65536 Len=0","54","0.000000000","10.1.1.2","0.000033000","TCP"
"1211","30.387500","9.866202000","0.000036000","0.000036000","10.202.1.2","0.000036000","12002  >  51350 [ACK] Seq=1219 Ack=75612 Win=65536 Len=0","54","0.000000000","10.1.1.2","0.000036000","TCP"
