"No.","Time","Time since first frame in this TCP stream","segment delta","Time delta from previous captured frame","Destination","Delta Time (conv)","Info","Length","Time shift for this packet","Source","Time delta from previous captured frame","Protocol"
"6","0.000111","0.000108000","0.000105000","0.000019000","10.202.1.2","0.000105000","12002  >  51358 [ACK] Seq=1 Ack=2817 Win=256 Len=0","54","0.000000000","10.1.1.2","0.000019000","TCP"
"19","0.314180","0.314177000","0.000032000","0.000032000","10.202.1.2","0.000032000","12002  >  51358 [ACK] Seq=1 Ack=5633 Win=256 Len=0","54","0.000000000","10.1.1.2","0.000032000","TCP"
"39","0.461953","0.000048000","0.000048000","0.000048000","10.202.1.2","0.000048000","12003  >  51357 [ACK] Seq=7301 Ack=1461 Win=1853 Len=1460","1514","0.000000000","10.1.1.2","0.000048000","TCP"
"45","0.463292","0.001387000","0.000044000","0.000044000","10.202.1.2","0.000044000","12003  >  51357 [ACK] Seq=8761 Ack=8761 Win=1825 Len=7300","7354","0.000000000","10.1.1.2","0.000044000","TCP"
"50","0.587072","0.587069000","0.000032000","0.000032000","10.202.1.2","0.000032000","12002  >  51358 [ACK] Seq=1 Ack=7921 Win=256 Len=0","54","0.000000000","10.1.1.2","0.000032000","TCP"
"57","0.641688","0.179783000","0.000058000","0.000058000","10.202.1.2","0.000058000","12003  >  51357 [ACK] Seq=16061 Ack=13141 Win=1807 Len=0","54","0.000000000","10.1.1.2","0.000058000","TCP"
"61","0.805405","0.805402000","0.000052000","0.000052000","10.202.1.2","0.000052000","12002  >  51358 [ACK] Seq=1 Ack=9857 Win=256 Len=0","54","0.000000000","10.1.1.2","0.000052000","TCP"
"74","1.119539","1.119536000","0.000029000","0.000029000","10.202.1.2","0.000029000","12002  >  51358 [ACK] Seq=1 Ack=12673 Win=256 Len=0","54","0.000000000","10.1.1.2","0.000029000","TCP"
"94","1.267322","0.805417000","0.000051000","0.000051000","10.202.1.2","0.000051000","12003  >  51357 [ACK] Seq=16061 Ack=14601 Win=1802 Len=2920","2974","0.000000000","10.1.1.2","0.000051000","TCP"
"97","1.269968","0.808063000","0.000034000","0.000034000","10.202.1.2","0.000034000","12003  >  51357 [ACK] Seq=18981 Ack=17521 Win=1790 Len=1460","1514","0.000000000","10.1.1.2","0.000034000","TCP"
"102","1.271314","0.809409000","0.000043000","0.000043000","10.202.1.2","0.000043000","12003  >  51357 [ACK] Seq=20441 Ack=21901 Win=1773 Len=5840","5894","0.000000000","10.1.1.2","0.000043000","TCP"
"111","1.435032","1.435029000","0.000031000","0.000031000","10.202.1.2","0.000031000","12002  >  51358 [ACK] Seq=1 Ack=15489 Win=256 Len=0","54","0.000000000","10.1.1.2","0.000031000","TCP"
"115","1.447020","0.985115000","0.000037000","0.000037000","10.202.1.2","0.000037000","12003  >  51357 [PSH, ACK] Seq=26281 Ack=24821 Win=1762 Len=1166","1220","0.000000000","10.1.1.2","0.000037000","TCP"
"118","1.452331","0.990426000","0.000028000","0.000028000","10.202.1.2","0.000028000","12003  >  51357 [ACK] Seq=27447 Ack=27741 Win=1750 Len=0","54","0.000000000","10.1.1.2","0.000028000","TCP"
"122","1.694652","1.694649000","0.000059000","0.000059000","10.202.1.2","0.000059000","12002  >  51358 [ACK] Seq=1 Ack=17777 Win=256 Len=0","54","0.000000000","10.1.1.2","0.000059000","TCP"
"133","1.924908","1.924905000","0.000030000","0.000030000","10.202.1.2","0.000030000","12002  >  51358 [ACK] Seq=1 Ack=19713 Win=256 Len=0","54","0.000000000","10.1.1.2","0.000030000","TCP"
"155","2.074037","1.612132000","0.000066000","0.000066000","10.202.1.2","0.000066000","12003  >  51357 [ACK] Seq=27447 Ack=29201 Win=1745 Len=1460","1514","0.000000000","10.1.1.2","0.000066000","TCP"
"158","2.076670","1.614765000","0.000038000","0.000038000","10.202.1.2","0.000038000","12003  >  51357 [ACK] Seq=28907 Ack=32121 Win=1733 Len=2920","2974","0.000000000","10.1.1.2","0.000038000","TCP"
"162","2.079335","1.617430000","0.000039000","0.000039000","10.202.1.2","0.000039000","12003  >  51357 [ACK] Seq=31827 Ack=36501 Win=1716 Len=1460","1514","0.000000000","10.1.1.2","0.000039000","TCP"
"164","2.085976","1.624071000","0.000031000","0.000031000","10.202.1.2","0.000031000","12003  >  51357 [ACK] Seq=33287 Ack=36501 Win=1716 Len=2920","2974","0.000000000","10.1.1.2","0.000031000","TCP"
"171","2.244399","2.244396000","0.000037000","0.000037000","10.202.1.2","0.000037000","12002  >  51358 [ACK] Seq=1 Ack=22529 Win=256 Len=0","54","0.000000000","10.1.1.2","0.000037000","TCP"
"175","2.261732","1.799827000","0.000063000","0.000063000","10.202.1.2","0.000063000","12003  >  51357 [ACK] Seq=36207 Ack=39421 Win=1705 Len=2920","2974","0.000000000","10.1.1.2","0.000063000","TCP"
"179","2.263036","1.801131000","0.000035000","0.000035000","10.202.1.2","0.000035000","12003  >  51357 [ACK] Seq=39127 Ack=43801 Win=1688 Len=0","54","0.000000000","10.1.1.2","0.000035000","TCP"
"185","2.554573","2.554570000","0.000046000","0.000046000","10.202.1.2","0.000046000","12002  >  51358 [ACK] Seq=1 Ack=25221 Win=256 Len=0","54","0.000000000","10.1.1.2","0.000046000","TCP"
"195","2.731597","2.731594000","0.000029000","0.000029000","10.202.1.2","0.000029000","12002  >  51358 [ACK] Seq=1 Ack=26049 Win=253 Len=0","54","0.000000000","10.1.1.2","0.000029000","TCP"
"219","2.814142","2.814139000","0.000035000","0.000035000","10.202.1.2","0.000035000","12002  >  51358 [ACK] Seq=1 Ack=27633 Win=256 Len=0","54","0.000000000","10.1.1.2","0.000035000","TCP"
"229","2.880753","2.418848000","0.000079000","0.000079000","10.202.1.2","0.000079000","12003  >  51357 [ACK] Seq=39127 Ack=45261 Win=1682 Len=1460","1514","0.000000000","10.1.1.2","0.000079000","TCP"
"231","2.882033","2.420128000","0.000037000","0.000037000","10.202.1.2","0.000037000","12003  >  51357 [ACK] Seq=40587 Ack=46721 Win=1676 Len=1460","1514","0.000000000","10.1.1.2","0.000037000","TCP"
"234","2.883364","2.421459000","0.000035000","0.000035000","10.202.1.2","0.000035000","12003  >  51357 [ACK] Seq=42047 Ack=48655 Win=1669 Len=0","54","0.000000000","10.1.1.2","0.000035000","TCP"
"238","2.886041","2.424136000","0.000046000","0.000046000","10.202.1.2","0.000046000","12003  >  51357 [ACK] Seq=42047 Ack=53035 Win=1652 Len=4380","4434","0.000000000","10.1.1.2","0.000046000","TCP"
"240","2.890008","2.428103000","0.000027000","0.000027000","10.202.1.2","0.000027000","12003  >  51357 [ACK] Seq=46427 Ack=53035 Win=1652 Len=2920","2974","0.000000000","10.1.1.2","0.000027000","TCP"
"246","3.056436","3.056433000","0.000047000","0.000047000","10.202.1.2","0.000047000","12002  >  51358 [ACK] Seq=1 Ack=29569 Win=256 Len=0","54","0.000000000","10.1.1.2","0.000047000","TCP"
"249","3.068438","2.606533000","0.000067000","0.000067000","10.202.1.2","0.000067000","12003  >  51357 [ACK] Seq=49347 Ack=55955 Win=1640 Len=1460","1514","0.000000000","10.1.1.2","0.000067000","TCP"
"253","3.079069","2.617164000","0.000050000","0.000050000","10.202.1.2","0.000050000","12003  >  51357 [ACK] Seq=50807 Ack=60335 Win=1623 Len=1460","1514","0.000000000","10.1.1.2","0.000050000","TCP"
"261","3.359936","3.359933000","0.000043000","0.000043000","10.202.1.2","0.000043000","12002  >  51358 [ACK] Seq=1 Ack=32385 Win=256 Len=0","54","0.000000000","10.1.1.2","0.000043000","TCP"
"273","3.618215","3.618212000","0.000065000","0.000065000","10.202.1.2","0.000065000","12002  >  51358 [ACK] Seq=1 Ack=34321 Win=256 Len=0","54","0.000000000","10.1.1.2","0.000065000","TCP"
"290","3.690089","3.228184000","0.000058000","0.000058000","10.202.1.2","0.000058000","12003  >  51357 [ACK] Seq=52267 Ack=63255 Win=1612 Len=2920","2974","0.000000000","10.1.1.2","0.000058000","TCP"
"294","3.692715","3.230810000","0.000026000","0.000026000","10.202.1.2","0.000026000","12003  >  51357 [ACK] Seq=55187 Ack=67635 Win=1595 Len=1460","1514","0.000000000","10.1.1.2","0.000026000","TCP"
"299","3.694044","3.232139000","0.000025000","0.000025000","10.202.1.2","0.000025000","12003  >  51357 [ACK] Seq=56647 Ack=70555 Win=1583 Len=7300","7354","0.000000000","10.1.1.2","0.000025000","TCP"
"302","3.757982","3.757979000","0.000058000","0.000058000","10.202.1.2","0.000058000","12002  >  51358 [ACK] Seq=1 Ack=35905 Win=256 Len=0","54","0.000000000","10.1.1.2","0.000058000","TCP"
"304","3.875108","3.413203000","0.000051000","0.000051000","10.202.1.2","0.000051000","12003  >  51357 [ACK] Seq=63947 Ack=72015 Win=1577 Len=1460","1514","0.000000000","10.1.1.2","0.000051000","TCP"
"309","3.885775","3.423870000","0.000056000","0.000056000","10.202.1.2","0.000056000","12003  >  51357 [ACK] Seq=65407 Ack=77855 Win=1555 Len=1460","1514","0.000000000","10.1.1.2","0.000056000","TCP"
"313","3.935013","3.935010000","0.000051000","0.000051000","10.202.1.2","0.000051000","12002  >  51358 [ACK] Seq=1 Ack=37460 Win=256 Len=0","54","0.000000000","10.1.1.2","0.000051000","TCP"
"319","4.165305","4.165302000","0.000048000","0.000048000","10.202.1.2","0.000048000","12002  >  51358 [ACK] Seq=1 Ack=39396 Win=256 Len=0","54","0.000000000","10.1.1.2","0.000048000","TCP"
"342","4.474123","4.474120000","0.000033000","0.000033000","10.202.1.2","0.000033000","12002  >  51358 [ACK] Seq=1 Ack=42212 Win=256 Len=0","54","0.000000000","10.1.1.2","0.000033000","TCP"
"344","4.496768","4.034863000","0.000050000","0.000050000","10.202.1.2","0.000050000","12003  >  51357 [ACK] Seq=66867 Ack=79315 Win=1549 Len=1460","1514","0.000000000","10.1.1.2","0.000050000","TCP"
"353","4.506159","4.044254000","0.000092000","0.000092000","10.202.1.2","0.000092000","12003  >  51357 [ACK] Seq=68327 Ack=89535 Win=1509 Len=11680","11734","0.000000000","10.1.1.2","0.000092000","TCP"
"356","4.680507","4.218602000","0.000073000","0.000073000","10.202.1.2","0.000073000","12003  >  51357 [ACK] Seq=80007 Ack=90995 Win=1503 Len=1460","1514","0.000000000","10.1.1.2","0.000073000","TCP"
"358","4.691119","4.229214000","0.000050000","0.000050000","10.202.1.2","0.000050000","12003  >  51357 [ACK] Seq=81467 Ack=92455 Win=1498 Len=1460","1514","0.000000000","10.1.1.2","0.000050000","TCP"
"362","4.697775","4.235870000","0.000039000","0.000039000","10.202.1.2","0.000039000","12003  >  51357 [ACK] Seq=82927 Ack=96835 Win=1480 Len=0","54","0.000000000","10.1.1.2","0.000039000","TCP"
"365","4.699099","4.699096000","0.000038000","0.000038000","10.202.1.2","0.000038000","12002  >  51358 [ACK] Seq=1 Ack=44148 Win=256 Len=0","54","0.000000000","10.1.1.2","0.000038000","TCP"
"372","4.884123","4.884120000","0.000031000","0.000031000","10.202.1.2","0.000031000","12002  >  51358 [ACK] Seq=1 Ack=45732 Win=256 Len=0","54","0.000000000","10.1.1.2","0.000031000","TCP"
"375","5.054533","5.054530000","0.000044000","0.000044000","10.202.1.2","0.000044000","12002  >  51358 [ACK] Seq=1 Ack=47316 Win=256 Len=0","54","0.000000000","10.1.1.2","0.000044000","TCP"
"393","5.278178","5.278175000","0.000048000","0.000048000","10.202.1.2","0.000048000","12002  >  51358 [ACK] Seq=1 Ack=49252 Win=256 Len=0","54","0.000000000","10.1.1.2","0.000048000","TCP"
"404","5.316799","4.854894000","0.000068000","0.000068000","10.202.1.2","0.000068000","12003  >  51357 [PSH, ACK] Seq=82927 Ack=98295 Win=1475 Len=13140","13194","0.000000000","10.1.1.2","0.000068000","TCP"
"407","5.318097","4.856192000","0.000036000","0.000036000","10.202.1.2","0.000036000","12003  >  51357 [ACK] Seq=96067 Ack=101215 Win=1463 Len=0","54","0.000000000","10.1.1.2","0.000036000","TCP"
"414","5.322107","4.860202000","0.000039000","0.000039000","10.202.1.2","0.000039000","12003  >  51357 [ACK] Seq=96067 Ack=109975 Win=1429 Len=0","54","0.000000000","10.1.1.2","0.000039000","TCP"
"416","5.487169","5.025264000","0.000050000","0.000050000","10.202.1.2","0.000050000","12003  >  51357 [ACK] Seq=96067 Ack=111435 Win=1423 Len=1460","1514","0.000000000","10.1.1.2","0.000050000","TCP"
"418","5.496472","5.034567000","0.000038000","0.000038000","10.202.1.2","0.000038000","12003  >  51357 [ACK] Seq=97527 Ack=112895 Win=1418 Len=2920","2974","0.000000000","10.1.1.2","0.000038000","TCP"
"423","5.511131","5.049226000","0.000044000","0.000042000","10.202.1.2","0.000044000","12003  >  51357 [ACK] Seq=100447 Ack=117275 Win=1401 Len=0","54","0.000000000","10.1.1.2","0.000042000","TCP"
"428","5.597638","5.597635000","0.000030000","0.000030000","10.202.1.2","0.000030000","12002  >  51358 [ACK] Seq=1 Ack=52068 Win=256 Len=0","54","0.000000000","10.1.1.2","0.000030000","TCP"
"432","5.818681","5.818678000","0.000081000","0.000081000","10.202.1.2","0.000081000","12002  >  51358 [ACK] Seq=1 Ack=54004 Win=256 Len=0","54","0.000000000","10.1.1.2","0.000081000","TCP"
"441","5.994343","5.994340000","0.000042000","0.000042000","10.202.1.2","0.000042000","12002  >  51358 [ACK] Seq=1 Ack=55588 Win=256 Len=0","54","0.000000000","10.1.1.2","0.000042000","TCP"
"465","6.127544","5.665639000","0.000107000","0.000107000","10.202.1.2","0.000107000","12003  >  51357 [ACK] Seq=100447 Ack=123115 Win=1378 Len=13140","13194","0.000000000","10.1.1.2","0.000107000","TCP"
"471","6.128805","5.666900000","0.000044000","0.000044000","10.202.1.2","0.000044000","12003  >  51357 [ACK] Seq=113587 Ack=130415 Win=1349 Len=0","54","0.000000000","10.1.1.2","0.000044000","TCP"
"474","6.180764","6.180761000","0.000080000","0.000080000","10.202.1.2","0.000080000","12002  >  51358 [ACK] Seq=1 Ack=57172 Win=256 Len=0","54","0.000000000","10.1.1.2","0.000080000","TCP"
"476","6.315213","5.853308000","0.000089000","0.000089000","10.202.1.2","0.000089000","12003  >  51357 [ACK] Seq=113587 Ack=131875 Win=1344 Len=1460","1514","0.000000000","10.1.1.2","0.000089000","TCP"
"482","6.319171","5.857266000","0.000053000","0.000053000","10.202.1.2","0.000053000","12003  >  51357 [ACK] Seq=115047 Ack=139175 Win=1315 Len=4380","4434","0.000000000","10.1.1.2","0.000053000","TCP"
"488","6.404338","6.404335000","0.000033000","0.000033000","10.202.1.2","0.000033000","12002  >  51358 [ACK] Seq=1 Ack=59108 Win=256 Len=0","54","0.000000000","10.1.1.2","0.000033000","TCP"
"498","6.713174","6.713171000","0.000034000","0.000034000","10.202.1.2","0.000034000","12002  >  51358 [ACK] Seq=1 Ack=61924 Win=256 Len=0","54","0.000000000","10.1.1.2","0.000034000","TCP"
"521","6.934152","6.934149000","0.000036000","0.000036000","10.202.1.2","0.000036000","12002  >  51358 [ACK] Seq=1 Ack=63860 Win=256 Len=0","54","0.000000000","10.1.1.2","0.000036000","TCP"
"526","6.935507","6.473602000","0.000054000","0.000054000","10.202.1.2","0.000054000","12003  >  51357 [ACK] Seq=119427 Ack=145015 Win=1292 Len=1460","1514","0.000000000","10.1.1.2","0.000054000","TCP"
"530","6.936830","6.474925000","0.000049000","0.000049000","10.202.1.2","0.000049000","12003  >  51357 [ACK] Seq=120887 Ack=149395 Win=1275 Len=11680","11734","0.000000000","10.1.1.2","0.000049000","TCP"
"534","6.938150","6.476245000","0.000038000","0.000038000","10.202.1.2","0.000038000","12003  >  51357 [ACK] Seq=132567 Ack=152315 Win=1264 Len=0","54","0.000000000","10.1.1.2","0.000038000","TCP"
"538","7.121851","7.121848000","0.000040000","0.000040000","10.202.1.2","0.000040000","12002  >  51358 [ACK] Seq=1 Ack=65444 Win=256 Len=0","54","0.000000000","10.1.1.2","0.000040000","TCP"
"540","7.123184","6.661279000","0.000044000","0.000044000","10.202.1.2","0.000044000","12003  >  51357 [ACK] Seq=132567 Ack=153775 Win=1258 Len=1460","1514","0.000000000","10.1.1.2","0.000044000","TCP"
"542","7.133835","6.671930000","0.000044000","0.000044000","10.202.1.2","0.000044000","12003  >  51357 [ACK] Seq=134027 Ack=153775 Win=1258 Len=1460","1514","0.000000000","10.1.1.2","0.000044000","TCP"
"548","7.140526","6.678621000","0.000063000","0.000063000","10.202.1.2","0.000063000","12003  >  51357 [ACK] Seq=135487 Ack=161075 Win=1230 Len=0","54","0.000000000","10.1.1.2","0.000063000","TCP"
"551","7.141844","6.679939000","0.000061000","0.000061000","10.202.1.2","0.000061000","12003  >  51357 [ACK] Seq=135487 Ack=162535 Win=1224 Len=1460","1514","0.000000000","10.1.1.2","0.000061000","TCP"
"555","7.313576","7.313573000","0.000068000","0.000068000","10.202.1.2","0.000068000","12002  >  51358 [ACK] Seq=1 Ack=67028 Win=256 Len=0","54","0.000000000","10.1.1.2","0.000068000","TCP"
"564","7.517208","7.517205000","0.000037000","0.000037000","10.202.1.2","0.000037000","12002  >  51358 [ACK] Seq=1 Ack=68840 Win=256 Len=0","54","0.000000000","10.1.1.2","0.000037000","TCP"
"588","7.727453","7.727450000","0.202295000","0.001227000","10.202.1.2","0.202295000","12002  >  51358 [ACK] Seq=1 Ack=68964 Win=256 Len=0","54","0.000000000","10.1.1.2","0.001227000","TCP"
"596","7.742216","7.280311000","0.000057000","0.000057000","10.202.1.2","0.000057000","12003  >  51357 [ACK] Seq=136947 Ack=168375 Win=1201 Len=0","54","0.000000000","10.1.1.2","0.000057000","TCP"
"607","7.749503","7.287598000","0.000038000","0.000038000","10.202.1.2","0.000038000","12003  >  51357 [ACK] Seq=136947 Ack=172755 Win=1184 Len=0","54","0.000000000","10.1.1.2","0.000038000","TCP"
"608","7.749548","7.287643000","0.000045000","0.000045000","10.202.1.2","0.000045000","[TCP Fast Retransmission] 12003  >  51357 [ACK] Seq=115047 Ack=172755 Win=1184 Len=1460","1514","0.000000000","10.1.1.2","0.000045000","TCP"
"609","7.749560","7.287655000","0.000012000","0.000012000","10.202.1.2","0.000012000","12003  >  51357 [ACK] Seq=136947 Ack=172755 Win=1184 Len=1460","1514","0.000000000","10.1.1.2","0.000012000","TCP"
"610","7.749578","7.287673000","0.000018000","0.000018000","10.202.1.2","0.000018000","12003  >  51357 [ACK] Seq=138407 Ack=172755 Win=1184 Len=1460","1514","0.000000000","10.1.1.2","0.000018000","TCP"
"611","7.749595","7.287690000","0.000017000","0.000017000","10.202.1.2","0.000017000","12003  >  51357 [ACK] Seq=139867 Ack=172755 Win=1184 Len=1460","1514","0.000000000","10.1.1.2","0.000017000","TCP"
"612","7.749610","7.287705000","0.000015000","0.000015000","10.202.1.2","0.000015000","12003  >  51357 [ACK] Seq=141327 Ack=172755 Win=1184 Len=1460","1514","0.000000000","10.1.1.2","0.000015000","TCP"
"613","7.749626","7.287721000","0.000016000","0.000016000","10.202.1.2","0.000016000","12003  >  51357 [ACK] Seq=142787 Ack=172755 Win=1184 Len=1460","1514","0.000000000","10.1.1.2","0.000016000","TCP"
"616","7.753489","7.291584000","0.000041000","0.000041000","10.202.1.2","0.000041000","12003  >  51357 [ACK] Seq=144247 Ack=175675 Win=1172 Len=0","54","0.000000000","10.1.1.2","0.000041000","TCP"
"619","7.838750","7.838747000","0.000091000","0.000091000","10.202.1.2","0.000091000","12002  >  51358 [ACK] Seq=1 Ack=71780 Win=256 Len=0","54","0.000000000","10.1.1.2","0.000091000","TCP"
"624","7.933203","7.471298000","0.000049000","0.000049000","10.202.1.2","0.000049000","12003  >  51357 [ACK] Seq=144247 Ack=175675 Win=1172 Len=1460","1514","0.000000000","10.1.1.2","0.000049000","TCP"
"626","7.945164","7.483259000","0.000032000","0.000032000","10.202.1.2","0.000032000","12003  >  51357 [ACK] Seq=145707 Ack=177135 Win=1167 Len=1460","1514","0.000000000","10.1.1.2","0.000032000","TCP"
"629","7.949161","7.487256000","0.000035000","0.000035000","10.202.1.2","0.000035000","12003  >  51357 [ACK] Seq=147167 Ack=180055 Win=1155 Len=0","54","0.000000000","10.1.1.2","0.000035000","TCP"
"636","7.950514","7.488609000","0.000041000","0.000041000","10.202.1.2","0.000041000","12003  >  51357 [ACK] Seq=147167 Ack=185895 Win=1133 Len=0","54","0.000000000","10.1.1.2","0.000041000","TCP"
"637","7.950542","7.488637000","0.000028000","0.000028000","10.202.1.2","0.000028000","12003  >  51357 [ACK] Seq=147167 Ack=185895 Win=1133 Len=1460","1514","0.000000000","10.1.1.2","0.000028000","TCP"
"639","8.054332","8.054329000","0.000041000","0.000041000","10.202.1.2","0.000041000","12002  >  51358 [ACK] Seq=1 Ack=73592 Win=256 Len=0","54","0.000000000","10.1.1.2","0.000041000","TCP"
"642","8.142507","7.680602000","0.191965000","0.019527000","10.202.1.2","0.191965000","12003  >  51357 [ACK] Seq=148627 Ack=187355 Win=1127 Len=0","54","0.000000000","10.1.1.2","0.019527000","TCP"
"643","8.163022","7.701117000","0.020515000","0.020515000","10.202.1.2","0.020515000","[TCP Retransmission] 12003  >  51357 [ACK] Seq=115047 Ack=187355 Win=1127 Len=1460","1514","0.000000000","10.1.1.2","0.020515000","TCP"
"650","8.234033","8.234030000","0.000034000","0.000034000","10.202.1.2","0.000034000","12002  >  51358 [ACK] Seq=1 Ack=75300 Win=256 Len=0","54","0.000000000","10.1.1.2","0.000034000","TCP"
"681","8.537564","8.537561000","0.000047000","0.000010000","10.202.1.2","0.000047000","12002  >  51358 [ACK] Seq=1 Ack=77940 Win=256 Len=0","54","0.000000000","10.1.1.2","0.000010000","TCP"
"685","8.550871","8.088966000","0.000042000","0.000042000","10.202.1.2","0.000042000","12003  >  51357 [ACK] Seq=116507 Ack=191735 Win=1110 Len=0","54","0.000000000","10.1.1.2","0.000042000","TCP"
"689","8.558842","8.096937000","0.000031000","0.000031000","10.202.1.2","0.000031000","12003  >  51357 [ACK] Seq=116507 Ack=196115 Win=1093 Len=0","54","0.000000000","10.1.1.2","0.000031000","TCP"
"695","8.561527","8.099622000","0.000048000","0.000048000","10.202.1.2","0.000048000","[TCP Retransmission] 12003  >  51357 [ACK] Seq=144247 Ack=200495 Win=1076 Len=7300","7354","0.000000000","10.1.1.2","0.000048000","TCP"
"698","8.722581","8.722578000","0.000033000","0.000033000","10.202.1.2","0.000033000","12002  >  51358 [ACK] Seq=1 Ack=79524 Win=256 Len=0","54","0.000000000","10.1.1.2","0.000033000","TCP"
"700","8.751885","8.289980000","0.000055000","0.000055000","10.202.1.2","0.000055000","12003  >  51357 [PSH, ACK] Seq=151547 Ack=201955 Win=1070 Len=4380","4434","0.000000000","10.1.1.2","0.000055000","TCP"
"703","8.754520","8.292615000","0.000029000","0.000029000","10.202.1.2","0.000029000","12003  >  51357 [ACK] Seq=155927 Ack=204875 Win=1058 Len=0","54","0.000000000","10.1.1.2","0.000029000","TCP"
"706","8.757186","8.295281000","0.000031000","0.000031000","10.202.1.2","0.000031000","12003  >  51357 [ACK] Seq=155927 Ack=207795 Win=1047 Len=0","54","0.000000000","10.1.1.2","0.000031000","TCP"
"709","8.758516","8.296611000","0.000028000","0.000028000","10.202.1.2","0.000028000","12003  >  51357 [ACK] Seq=155927 Ack=210715 Win=1036 Len=0","54","0.000000000","10.1.1.2","0.000028000","TCP"
"713","8.950227","8.488322000","0.000052000","0.000052000","10.202.1.2","0.000052000","12003  >  51357 [ACK] Seq=155927 Ack=212175 Win=1030 Len=1460","1514","0.000000000","10.1.1.2","0.000052000","TCP"
"716","8.956857","8.956854000","0.000027000","0.000027000","10.202.1.2","0.000027000","12002  >  51358 [ACK] Seq=1 Ack=81512 Win=256 Len=0","54","0.000000000","10.1.1.2","0.000027000","TCP"
"721","9.039390","9.039387000","0.000028000","0.000028000","10.202.1.2","0.000028000","12002  >  51358 [ACK] Seq=1 Ack=81812 Win=255 Len=0","54","0.000000000","10.1.1.2","0.000028000","TCP"
"730","9.155211","9.155208000","0.000031000","0.000031000","10.202.1.2","0.000031000","12002  >  51358 [ACK] Seq=1 Ack=83396 Win=256 Len=0","54","0.000000000","10.1.1.2","0.000031000","TCP"
"731","9.160121","8.698216000","0.191310000","0.004910000","10.202.1.2","0.191310000","12003  >  51357 [ACK] Seq=157387 Ack=213635 Win=1024 Len=0","54","0.000000000","10.1.1.2","0.004910000","TCP"
"762","9.364258","9.364255000","0.000074000","0.000063000","10.202.1.2","0.000074000","12002  >  51358 [ACK] Seq=1 Ack=85156 Win=256 Len=0","54","0.000000000","10.1.1.2","0.000063000","TCP"
"763","9.364271","8.902366000","0.000076000","0.000013000","10.202.1.2","0.000076000","12003  >  51357 [ACK] Seq=157387 Ack=222395 Win=990 Len=0","54","0.000000000","10.1.1.2","0.000013000","TCP"
"771","9.368222","8.906317000","0.000042000","0.000042000","10.202.1.2","0.000042000","12003  >  51357 [ACK] Seq=157387 Ack=226775 Win=973 Len=0","54","0.000000000","10.1.1.2","0.000042000","TCP"
"772","9.368263","8.906358000","0.000041000","0.000041000","10.202.1.2","0.000041000","12003  >  51357 [ACK] Seq=157387 Ack=226775 Win=973 Len=2920","2974","0.000000000","10.1.1.2","0.000041000","TCP"
"777","9.557258","9.095353000","0.000061000","0.000061000","10.202.1.2","0.000061000","12003  >  51357 [ACK] Seq=160307 Ack=228235 Win=967 Len=1460","1514","0.000000000","10.1.1.2","0.000061000","TCP"
"778","9.557298","9.095393000","0.000040000","0.000040000","10.202.1.2","0.000040000","12003  >  51357 [ACK] Seq=161767 Ack=228235 Win=967 Len=1460","1514","0.000000000","10.1.1.2","0.000040000","TCP"
"781","9.567888","9.105983000","0.000040000","0.000040000","10.202.1.2","0.000040000","12003  >  51357 [ACK] Seq=163227 Ack=231155 Win=956 Len=0","54","0.000000000","10.1.1.2","0.000040000","TCP"
"786","9.574552","9.112647000","0.000047000","0.000047000","10.202.1.2","0.000047000","12003  >  51357 [ACK] Seq=163227 Ack=236995 Win=933 Len=0","54","0.000000000","10.1.1.2","0.000047000","TCP"
"789","9.663725","9.663722000","0.000032000","0.000032000","10.202.1.2","0.000032000","12002  >  51358 [ACK] Seq=1 Ack=87796 Win=256 Len=0","54","0.000000000","10.1.1.2","0.000032000","TCP"
"791","9.754260","9.292355000","0.000046000","0.000046000","10.202.1.2","0.000046000","12003  >  51357 [ACK] Seq=163227 Ack=236995 Win=933 Len=1460","1514","0.000000000","10.1.1.2","0.000046000","TCP"
"795","9.834120","9.834117000","0.000036000","0.000036000","10.202.1.2","0.000036000","12002  >  51358 [ACK] Seq=1 Ack=89380 Win=256 Len=0","54","0.000000000","10.1.1.2","0.000036000","TCP"
"806","9.956054","9.494149000","0.200514000","0.019448000","10.202.1.2","0.200514000","12003  >  51357 [ACK] Seq=164687 Ack=238455 Win=927 Len=0","54","0.000000000","10.1.1.2","0.019448000","TCP"
"810","9.964574","9.502669000","0.000035000","0.000035000","10.202.1.2","0.000035000","12003  >  51357 [ACK] Seq=164687 Ack=241375 Win=916 Len=0","54","0.000000000","10.1.1.2","0.000035000","TCP"
"815","10.095032","10.095029000","0.000038000","0.000038000","10.202.1.2","0.000038000","12002  >  51358 [ACK] Seq=1 Ack=91668 Win=256 Len=0","54","0.000000000","10.1.1.2","0.000038000","TCP"
"842","10.177572","9.715667000","0.000036000","0.000036000","10.202.1.2","0.000036000","12003  >  51357 [ACK] Seq=164687 Ack=250135 Win=882 Len=0","54","0.000000000","10.1.1.2","0.000036000","TCP"
"845","10.178881","9.716976000","0.000024000","0.000024000","10.202.1.2","0.000024000","12003  >  51357 [ACK] Seq=164687 Ack=253055 Win=870 Len=0","54","0.000000000","10.1.1.2","0.000024000","TCP"
"849","10.273410","10.273407000","0.000035000","0.000035000","10.202.1.2","0.000035000","12002  >  51358 [ACK] Seq=1 Ack=93252 Win=256 Len=0","54","0.000000000","10.1.1.2","0.000035000","TCP"
"856","10.373247","9.911342000","0.000030000","0.000030000","10.202.1.2","0.000030000","12003  >  51357 [ACK] Seq=164687 Ack=255975 Win=859 Len=0","54","0.000000000","10.1.1.2","0.000030000","TCP"
"857","10.373278","9.911373000","0.000031000","0.000031000","10.202.1.2","0.000031000","12003  >  51357 [ACK] Seq=164687 Ack=258895 Win=847 Len=0","54","0.000000000","10.1.1.2","0.000031000","TCP"
"862","10.389256","9.927351000","0.000057000","0.000057000","10.202.1.2","0.000057000","12003  >  51357 [ACK] Seq=164687 Ack=264735 Win=825 Len=0","54","0.000000000","10.1.1.2","0.000057000","TCP"
"866","10.474423","10.474420000","0.000039000","0.000039000","10.202.1.2","0.000039000","12002  >  51358 [ACK] Seq=1 Ack=95012 Win=256 Len=0","54","0.000000000","10.1.1.2","0.000039000","TCP"
"869","10.601599","10.139694000","0.043352000","0.030277000","10.202.1.2","0.043352000","[TCP Retransmission] 12003  >  51357 [ACK] Seq=153007 Ack=264735 Win=825 Len=1460","1514","0.000000000","10.1.1.2","0.030277000","TCP"
"881","10.775262","10.775259000","0.000032000","0.000032000","10.202.1.2","0.000032000","12002  >  51358 [ACK] Seq=1 Ack=97652 Win=256 Len=0","54","0.000000000","10.1.1.2","0.000032000","TCP"
"884","10.777922","10.316017000","0.000030000","0.000030000","10.202.1.2","0.000030000","12003  >  51357 [ACK] Seq=154467 Ack=269115 Win=807 Len=0","54","0.000000000","10.1.1.2","0.000030000","TCP"
"905","10.956301","10.956298000","0.000032000","0.000032000","10.202.1.2","0.000032000","12002  >  51358 [ACK] Seq=1 Ack=99236 Win=256 Len=0","54","0.000000000","10.1.1.2","0.000032000","TCP"
"921","10.982932","10.521027000","0.000035000","0.000035000","10.202.1.2","0.000035000","12003  >  51357 [ACK] Seq=154467 Ack=273495 Win=790 Len=0","54","0.000000000","10.1.1.2","0.000035000","TCP"
"924","10.984253","10.522348000","0.000028000","0.000028000","10.202.1.2","0.000028000","12003  >  51357 [ACK] Seq=154467 Ack=276415 Win=779 Len=0","54","0.000000000","10.1.1.2","0.000028000","TCP"
"927","10.988255","10.526350000","0.000038000","0.000038000","10.202.1.2","0.000038000","12003  >  51357 [ACK] Seq=154467 Ack=277875 Win=773 Len=0 SLE=279335 SRE=280795","66","0.000000000","10.1.1.2","0.000038000","TCP"
"929","10.989569","10.527664000","0.000024000","0.000024000","10.202.1.2","0.000024000","12003  >  51357 [ACK] Seq=154467 Ack=277875 Win=773 Len=0 SLE=279335 SRE=282255","66","0.000000000","10.1.1.2","0.000024000","TCP"
"936","11.186628","10.724723000","0.000054000","0.000054000","10.202.1.2","0.000054000","12003  >  51357 [ACK] Seq=154467 Ack=277875 Win=773 Len=0 SLE=279335 SRE=283715","66","0.000000000","10.1.1.2","0.000054000","TCP"
"937","11.186646","10.724741000","0.000018000","0.000018000","10.202.1.2","0.000018000","12003  >  51357 [ACK] Seq=154467 Ack=277875 Win=773 Len=0 SLE=279335 SRE=285175","66","0.000000000","10.1.1.2","0.000018000","TCP"
"938","11.186660","10.724755000","0.000014000","0.000014000","10.202.1.2","0.000014000","12003  >  51357 [ACK] Seq=154467 Ack=277875 Win=773 Len=0 SLE=279335 SRE=286635","66","0.000000000","10.1.1.2","0.000014000","TCP"
"939","11.186675","10.724770000","0.000015000","0.000015000","10.202.1.2","0.000015000","12003  >  51357 [ACK] Seq=154467 Ack=277875 Win=773 Len=0 SLE=279335 SRE=288095","66","0.000000000","10.1.1.2","0.000015000","TCP"
"941","11.194567","10.732662000","0.000022000","0.000022000","10.202.1.2","0.000022000","12003  >  51357 [ACK] Seq=154467 Ack=277875 Win=773 Len=0 SLE=279335 SRE=289555","66","0.000000000","10.1.1.2","0.000022000","TCP"
"943","11.197232","10.735327000","0.000024000","0.000024000","10.202.1.2","0.000024000","12003  >  51357 [ACK] Seq=154467 Ack=277875 Win=773 Len=0 SLE=279335 SRE=291015","66","0.000000000","10.1.1.2","0.000024000","TCP"
"946","11.198563","10.736658000","0.000021000","0.000021000","10.202.1.2","0.000021000","12003  >  51357 [ACK] Seq=154467 Ack=277875 Win=773 Len=0 SLE=279335 SRE=292475","66","0.000000000","10.1.1.2","0.000021000","TCP"
"947","11.198578","10.736673000","0.000015000","0.000015000","10.202.1.2","0.000015000","12003  >  51357 [ACK] Seq=154467 Ack=277875 Win=773 Len=0 SLE=279335 SRE=293935","66","0.000000000","10.1.1.2","0.000015000","TCP"
"950","11.213219","11.213216000","0.000034000","0.000034000","10.202.1.2","0.000034000","12002  >  51358 [ACK] Seq=1 Ack=101524 Win=256 Len=0","54","0.000000000","10.1.1.2","0.000034000","TCP"
"954","11.396917","11.396914000","0.000029000","0.000029000","10.202.1.2","0.000029000","12002  >  51358 [ACK] Seq=1 Ack=103108 Win=256 Len=0","54","0.000000000","10.1.1.2","0.000029000","TCP"
"956","11.406239","10.944334000","0.000035000","0.000035000","10.202.1.2","0.000035000","12003  >  51357 [ACK] Seq=164687 Ack=277875 Win=773 Len=7300","7354","0.000000000","10.1.1.2","0.000035000","TCP"
"974","11.583282","11.121377000","0.000029000","0.000029000","10.202.1.2","0.000029000","[TCP Dup ACK 927#1] 12003  >  51357 [ACK] Seq=171987 Ack=277875 Win=773 Len=0 SLE=279335 SRE=295395","66","0.000000000","10.1.1.2","0.000029000","TCP"
"977","11.588600","11.126695000","0.000022000","0.000022000","10.202.1.2","0.000022000","[TCP Dup ACK 927#2] 12003  >  51357 [ACK] Seq=171987 Ack=277875 Win=773 Len=0 SLE=279335 SRE=296855","66","0.000000000","10.1.1.2","0.000022000","TCP"
"978","11.588616","11.126711000","0.000016000","0.000016000","10.202.1.2","0.000016000","[TCP Dup ACK 927#3] 12003  >  51357 [ACK] Seq=171987 Ack=277875 Win=773 Len=0 SLE=279335 SRE=298315","66","0.000000000","10.1.1.2","0.000016000","TCP"
"980","11.595262","11.595259000","0.000028000","0.000028000","10.202.1.2","0.000028000","12002  >  51358 [ACK] Seq=1 Ack=104744 Win=256 Len=0","54","0.000000000","10.1.1.2","0.000028000","TCP"
"1000","11.760338","11.760335000","0.000037000","0.000037000","10.202.1.2","0.000037000","12002  >  51358 [ACK] Seq=1 Ack=105924 Win=252 Len=0","54","0.000000000","10.1.1.2","0.000037000","TCP"
"1021","11.788298","11.326393000","0.000036000","0.000036000","10.202.1.2","0.000036000","[TCP Dup ACK 927#4] 12003  >  51357 [ACK] Seq=171987 Ack=277875 Win=773 Len=0 SLE=279335 SRE=299775","66","0.000000000","10.1.1.2","0.000036000","TCP"
"1022","11.788316","11.326411000","0.000018000","0.000018000","10.202.1.2","0.000018000","[TCP Dup ACK 927#5] 12003  >  51357 [ACK] Seq=171987 Ack=277875 Win=773 Len=0 SLE=279335 SRE=301235","66","0.000000000","10.1.1.2","0.000018000","TCP"
"1023","11.788331","11.326426000","0.000015000","0.000015000","10.202.1.2","0.000015000","[TCP Dup ACK 927#6] 12003  >  51357 [ACK] Seq=171987 Ack=277875 Win=773 Len=0 SLE=279335 SRE=302695","66","0.000000000","10.1.1.2","0.000015000","TCP"
"1027","11.797606","11.335701000","0.000026000","0.000026000","10.202.1.2","0.000026000","[TCP Dup ACK 927#7] 12003  >  51357 [ACK] Seq=171987 Ack=277875 Win=773 Len=0 SLE=279335 SRE=304155","66","0.000000000","10.1.1.2","0.000026000","TCP"
"1028","11.797622","11.335717000","0.000016000","0.000016000","10.202.1.2","0.000016000","[TCP Dup ACK 927#8] 12003  >  51357 [ACK] Seq=171987 Ack=277875 Win=773 Len=0 SLE=279335 SRE=305615","66","0.000000000","10.1.1.2","0.000016000","TCP"
"1031","11.798931","11.337026000","0.000024000","0.000024000","10.202.1.2","0.000024000","[TCP Dup ACK 927#9] 12003  >  51357 [ACK] Seq=171987 Ack=277875 Win=773 Len=0 SLE=279335 SRE=307075","66","0.000000000","10.1.1.2","0.000024000","TCP"
"1032","11.798948","11.337043000","0.000017000","0.000017000","10.202.1.2","0.000017000","[TCP Dup ACK 927#10] 12003  >  51357 [ACK] Seq=171987 Ack=277875 Win=773 Len=0 SLE=279335 SRE=308535","66","0.000000000","10.1.1.2","0.000017000","TCP"
"1035","11.894788","11.894785000","0.000034000","0.000034000","10.202.1.2","0.000034000","12002  >  51358 [ACK] Seq=1 Ack=107508 Win=256 Len=0","54","0.000000000","10.1.1.2","0.000034000","TCP"
"1041","11.990636","11.528731000","0.000034000","0.000034000","10.202.1.2","0.000034000","[TCP Fast Retransmission] 12003  >  51357 [ACK] Seq=164687 Ack=277875 Win=773 Len=1460","1514","0.000000000","10.1.1.2","0.000034000","TCP"
"1049","12.074498","12.074495000","0.000036000","0.000036000","10.202.1.2","0.000036000","12002  >  51358 [ACK] Seq=1 Ack=109092 Win=256 Len=0","54","0.000000000","10.1.1.2","0.000036000","TCP"
"1052","12.214267","11.752362000","0.000033000","0.000033000","10.202.1.2","0.000033000","12003  >  51357 [ACK] Seq=171987 Ack=277875 Win=773 Len=1460","1514","0.000000000","10.1.1.2","0.000033000","TCP"
"1054","12.219582","11.757677000","0.000026000","0.000026000","10.202.1.2","0.000026000","12003  >  51357 [ACK] Seq=173447 Ack=277875 Win=773 Len=1460","1514","0.000000000","10.1.1.2","0.000026000","TCP"
"1070","12.335406","12.335403000","0.000033000","0.000033000","10.202.1.2","0.000033000","12002  >  51358 [ACK] Seq=1 Ack=111380 Win=256 Len=0","54","0.000000000","10.1.1.2","0.000033000","TCP"
"1074","12.391314","11.929409000","0.000034000","0.000034000","10.202.1.2","0.000034000","[TCP Dup ACK 927#11] 12003  >  51357 [ACK] Seq=174907 Ack=277875 Win=773 Len=0 SLE=279335 SRE=309995","66","0.000000000","10.1.1.2","0.000034000","TCP"
"1078","12.396637","11.934732000","0.000027000","0.000027000","10.202.1.2","0.000027000","[TCP Dup ACK 927#12] 12003  >  51357 [ACK] Seq=174907 Ack=277875 Win=773 Len=0 SLE=279335 SRE=311455","66","0.000000000","10.1.1.2","0.000027000","TCP"
"1079","12.396679","11.934774000","0.000042000","0.000042000","10.202.1.2","0.000042000","12003  >  51357 [ACK] Seq=174907 Ack=311455 Win=642 Len=0","54","0.000000000","10.1.1.2","0.000042000","TCP"
"1086","12.514126","12.514123000","0.000070000","0.000070000","10.202.1.2","0.000070000","12002  >  51358 [ACK] Seq=1 Ack=112964 Win=256 Len=0","54","0.000000000","10.1.1.2","0.000070000","TCP"
"1108","12.592601","12.130696000","0.000022000","0.000022000","10.202.1.2","0.000022000","12003  >  51357 [ACK] Seq=174907 Ack=314375 Win=631 Len=0","54","0.000000000","10.1.1.2","0.000022000","TCP"
"1111","12.593954","12.132049000","0.000037000","0.000037000","10.202.1.2","0.000037000","12003  >  51357 [ACK] Seq=174907 Ack=317295 Win=619 Len=0","54","0.000000000","10.1.1.2","0.000037000","TCP"
"1116","12.604606","12.142701000","0.000036000","0.000036000","10.202.1.2","0.000036000","12003  >  51357 [ACK] Seq=174907 Ack=323135 Win=596 Len=0","54","0.000000000","10.1.1.2","0.000036000","TCP"
"1123","12.834905","12.834902000","0.000044000","0.000044000","10.202.1.2","0.000044000","12002  >  51358 [ACK] Seq=1 Ack=115780 Win=256 Len=0","54","0.000000000","10.1.1.2","0.000044000","TCP"
"1125","12.894791","12.432886000","0.000028000","0.000028000","10.202.1.2","0.000028000","[TCP Dup ACK 1116#1] 12003  >  51357 [ACK] Seq=174907 Ack=323135 Win=596 Len=0 SLE=277875 SRE=279335","66","0.000000000","10.1.1.2","0.000028000","TCP"
"1129","13.022591","13.022588000","0.000036000","0.000036000","10.202.1.2","0.000036000","12002  >  51358 [ACK] Seq=1 Ack=117364 Win=256 Len=0","54","0.000000000","10.1.1.2","0.000036000","TCP"
"1131","13.023930","12.562025000","0.000044000","0.000044000","10.202.1.2","0.000044000","12003  >  51357 [ACK] Seq=174907 Ack=323135 Win=596 Len=4380","4434","0.000000000","10.1.1.2","0.000044000","TCP"
"1152","13.202319","13.202316000","0.000048000","0.000048000","10.202.1.2","0.000048000","12002  >  51358 [ACK] Seq=1 Ack=118948 Win=256 Len=0","54","0.000000000","10.1.1.2","0.000048000","TCP"
"1158","13.203637","12.741732000","0.000026000","0.000026000","10.202.1.2","0.000026000","[TCP Dup ACK 1116#2] 12003  >  51357 [ACK] Seq=179287 Ack=323135 Win=596 Len=0 SLE=311455 SRE=312915","66","0.000000000","10.1.1.2","0.000026000","TCP"
"1159","13.203652","12.741747000","0.000015000","0.000015000","10.202.1.2","0.000015000","[TCP Dup ACK 1116#3] 12003  >  51357 [ACK] Seq=179287 Ack=323135 Win=596 Len=0 SLE=312915 SRE=314375","66","0.000000000","10.1.1.2","0.000015000","TCP"
"1160","13.203663","12.741758000","0.000011000","0.000011000","10.202.1.2","0.000011000","[TCP Dup ACK 1116#4] 12003  >  51357 [ACK] Seq=179287 Ack=323135 Win=596 Len=0 SLE=314375 SRE=315835","66","0.000000000","10.1.1.2","0.000011000","TCP"
"1161","13.203673","12.741768000","0.000010000","0.000010000","10.202.1.2","0.000010000","[TCP Dup ACK 1116#5] 12003  >  51357 [ACK] Seq=179287 Ack=323135 Win=596 Len=0 SLE=315835 SRE=317295","66","0.000000000","10.1.1.2","0.000010000","TCP"
"1162","13.203683","12.741778000","0.000010000","0.000010000","10.202.1.2","0.000010000","[TCP Dup ACK 1116#6] 12003  >  51357 [ACK] Seq=179287 Ack=323135 Win=596 Len=0 SLE=317295 SRE=318755","66","0.000000000","10.1.1.2","0.000010000","TCP"
"1185","13.400659","12.938754000","0.000039000","0.000039000","10.202.1.2","0.000039000","[TCP Dup ACK 1116#7] 12003  >  51357 [ACK] Seq=179287 Ack=323135 Win=596 Len=0 SLE=318755 SRE=320215","66","0.000000000","10.1.1.2","0.000039000","TCP"
"1186","13.400673","12.938768000","0.000014000","0.000014000","10.202.1.2","0.000014000","[TCP Dup ACK 1116#8] 12003  >  51357 [ACK] Seq=179287 Ack=323135 Win=596 Len=0 SLE=320215 SRE=321675","66","0.000000000","10.1.1.2","0.000014000","TCP"
"1191","13.401988","12.940083000","0.000039000","0.000039000","10.202.1.2","0.000039000","12003  >  51357 [ACK] Seq=179287 Ack=327515 Win=579 Len=0","54","0.000000000","10.1.1.2","0.000039000","TCP"
"1197","13.411303","12.949398000","0.000035000","0.000035000","10.202.1.2","0.000035000","12003  >  51357 [ACK] Seq=179287 Ack=333355 Win=564 Len=0","54","0.000000000","10.1.1.2","0.000035000","TCP"
"1207","13.455284","13.455281000","0.000075000","0.000075000","10.202.1.2","0.000075000","12002  >  51358 [ACK] Seq=1 Ack=121236 Win=256 Len=0","54","0.000000000","10.1.1.2","0.000075000","TCP"
"1210","13.640321","13.640318000","0.000081000","0.000081000","10.202.1.2","0.000081000","12002  >  51358 [ACK] Seq=1 Ack=122820 Win=256 Len=0","54","0.000000000","10.1.1.2","0.000081000","TCP"
