"No.","Time","Time since first frame in this TCP stream","segment delta","Time delta from previous captured frame","Destination","Delta Time (conv)","Info","Length","Time shift for this packet","Source","Time delta from previous captured frame","Protocol"
"10","2.534722","0.000000000","0.000000000","0.008281000","10.202.1.2","0.000000000","8800  >  51351 [PSH, ACK] Seq=1 Ack=1 Win=255 Len=10918","10972","0.000000000","10.1.1.2","0.008281000","TCP"
"25","4.792155","2.257433000","1.244564000","0.001626000","10.202.1.2","1.244564000","8800  >  51351 [PSH, ACK] Seq=10919 Ack=1 Win=255 Len=3674","3728","0.000000000","10.1.1.2","0.001626000","TCP"
"100","33.375578","30.840856000","27.777954000","0.000296000","10.202.1.2","27.777954000","8800  >  51351 [PSH, ACK] Seq=14593 Ack=1 Win=255 Len=7541","7595","0.000000000","10.1.1.2","0.000296000","TCP"
"108","34.203437","0.000049000","0.000049000","0.000049000","10.202.1.2","0.000049000","12001  >  51356 [SYN, ACK] Seq=0 Ack=1 Win=8192 Len=0 MSS=1460 WS=256 SACK_PERM=1","66","0.000000000","10.1.1.2","0.000049000","TCP"
"117","35.110625","0.000000000","0.000000000","0.031953000","10.202.1.2","0.000000000","12000  >  51355 [PSH, ACK] Seq=1 Ack=1 Win=254 Len=708","762","0.000000000","10.1.1.2","0.031953000","TCP"
"119","35.229529","1.026141000","0.195454000","0.050774000","10.202.1.2","0.195454000","12001  >  51356 [ACK] Seq=1 Ack=314 Win=65536 Len=0","54","0.000000000","10.1.1.2","0.050774000","TCP"
"121","35.493354","1.289966000","0.263825000","0.000000000","10.202.1.2","0.263825000","12001  >  51356 [PSH, ACK] Seq=1 Ack=314 Win=65536 Len=932","986","0.000000000","10.1.1.2","0.000000000","TCP"
"127","36.312095","2.108707000","0.006759000","0.002774000","10.202.1.2","0.006759000","12001  >  51356 [PSH, ACK] Seq=933 Ack=440 Win=65536 Len=326","380","0.000000000","10.1.1.2","0.002774000","TCP"
"137","37.129369","0.000040000","0.000040000","0.000039000","10.202.1.2","0.000040000","12003  >  51357 [SYN, ACK] Seq=0 Ack=1 Win=8192 Len=0 MSS=1460 WS=256 SACK_PERM=1","66","0.000000000","10.1.1.2","0.000039000","TCP"
"138","37.129403","0.000073000","0.000073000","0.000034000","10.202.1.2","0.000073000","12002  >  51358 [SYN, ACK] Seq=0 Ack=1 Win=8192 Len=0 MSS=1460 WS=256 SACK_PERM=1","66","0.000000000","10.1.1.2","0.000034000","TCP"
"146","37.660505","3.457117000","0.000033000","0.000033000","10.202.1.2","0.000033000","12001  >  51356 [ACK] Seq=1259 Ack=3360 Win=65536 Len=0","54","0.000000000","10.1.1.2","0.000033000","TCP"
"157","37.980394","0.851064000","0.019077000","0.005516000","10.202.1.2","0.019077000","12002  >  51358 [PSH, ACK] Seq=1 Ack=314 Win=65536 Len=932","986","0.000000000","10.1.1.2","0.005516000","TCP"
"158","38.001445","0.872116000","0.040128000","0.021051000","10.202.1.2","0.040128000","12003  >  51357 [PSH, ACK] Seq=1 Ack=314 Win=65536 Len=932","986","0.000000000","10.1.1.2","0.021051000","TCP"
"167","38.465870","4.262482000","0.000032000","0.000032000","10.202.1.2","0.000032000","12001  >  51356 [ACK] Seq=1259 Ack=6280 Win=65536 Len=0","54","0.000000000","10.1.1.2","0.000032000","TCP"
"170","38.479176","4.275788000","0.000026000","0.000026000","10.202.1.2","0.000026000","12001  >  51356 [ACK] Seq=1259 Ack=9200 Win=65536 Len=0","54","0.000000000","10.1.1.2","0.000026000","TCP"
"174","38.804050","1.674720000","0.010743000","0.005729000","10.202.1.2","0.010743000","12002  >  51358 [PSH, ACK] Seq=933 Ack=440 Win=65536 Len=286","340","0.000000000","10.1.1.2","0.005729000","TCP"
"176","38.818164","1.688835000","0.006222000","0.006222000","10.202.1.2","0.006222000","12003  >  51357 [PSH, ACK] Seq=933 Ack=440 Win=65536 Len=286","340","0.000000000","10.1.1.2","0.006222000","TCP"
"186","39.293905","5.090517000","0.000060000","0.000060000","10.202.1.2","0.000060000","12001  >  51356 [ACK] Seq=1259 Ack=11766 Win=65536 Len=0","54","0.000000000","10.1.1.2","0.000060000","TCP"
"187","39.310315","5.106927000","0.016410000","0.016410000","10.202.1.2","0.016410000","12001  >  51356 [ACK] Seq=1259 Ack=11766 Win=65536 Len=2920","2974","0.000000000","10.1.1.2","0.016410000","TCP"
"195","39.734504","2.605174000","0.000044000","0.000044000","10.202.1.2","0.000044000","12002  >  51358 [ACK] Seq=1219 Ack=2570 Win=65536 Len=0","54","0.000000000","10.1.1.2","0.000044000","TCP"
"197","39.890835","2.761506000","0.204297000","0.070311000","10.202.1.2","0.204297000","12003  >  51357 [ACK] Seq=1219 Ack=612 Win=65280 Len=0","54","0.000000000","10.1.1.2","0.070311000","TCP"
"201","40.116548","5.913160000","0.000042000","0.000042000","10.202.1.2","0.000042000","12001  >  51356 [ACK] Seq=4179 Ack=11766 Win=65536 Len=5840","5894","0.000000000","10.1.1.2","0.000042000","TCP"
"202","40.121315","2.991985000","0.200497000","0.004767000","10.202.1.2","0.200497000","12002  >  51358 [ACK] Seq=1219 Ack=3799 Win=64256 Len=0","54","0.000000000","10.1.1.2","0.004767000","TCP"
"208","40.541187","3.411857000","0.000033000","0.000033000","10.202.1.2","0.000033000","12002  >  51358 [ACK] Seq=1219 Ack=8059 Win=65536 Len=0","54","0.000000000","10.1.1.2","0.000033000","TCP"
"210","40.921937","6.718549000","0.000056000","0.000056000","10.202.1.2","0.000056000","12001  >  51356 [PSH, ACK] Seq=10019 Ack=11766 Win=65536 Len=2591","2645","0.000000000","10.1.1.2","0.000056000","TCP"
"214","40.924569","3.795239000","0.000038000","0.000038000","10.202.1.2","0.000038000","12002  >  51358 [ACK] Seq=1219 Ack=10517 Win=65536 Len=0","54","0.000000000","10.1.1.2","0.000038000","TCP"
"222","41.346573","4.217243000","0.000049000","0.000049000","10.202.1.2","0.000049000","12002  >  51358 [ACK] Seq=1219 Ack=15874 Win=65536 Len=0","54","0.000000000","10.1.1.2","0.000049000","TCP"
"224","41.547179","4.417849000","0.198001000","0.198001000","10.202.1.2","0.198001000","12002  >  51358 [ACK] Seq=1219 Ack=16650 Win=64768 Len=0","54","0.000000000","10.1.1.2","0.198001000","TCP"
"230","41.737920","4.608590000","0.000034000","0.000034000","10.202.1.2","0.000034000","12002  >  51358 [ACK] Seq=1219 Ack=20170 Win=65536 Len=0","54","0.000000000","10.1.1.2","0.000034000","TCP"
"234","41.926411","6.815786000","0.003494000","0.003494000","10.202.1.2","0.003494000","12000  >  51355 [PSH, ACK] Seq=709 Ack=137 Win=253 Len=201","255","0.000000000","10.1.1.2","0.003494000","TCP"
"236","42.007150","7.803762000","0.193390000","0.009758000","10.202.1.2","0.193390000","12001  >  51356 [ACK] Seq=12610 Ack=11872 Win=65536 Len=0","54","0.000000000","10.1.1.2","0.009758000","TCP"
"240","42.154621","5.025291000","0.000064000","0.000064000","10.202.1.2","0.000064000","12002  >  51358 [ACK] Seq=1219 Ack=23690 Win=65536 Len=0","54","0.000000000","10.1.1.2","0.000064000","TCP"
"244","42.315666","8.112278000","0.000042000","0.000042000","10.202.1.2","0.000042000","12001  >  51356 [ACK] Seq=12610 Ack=16252 Win=65536 Len=0","54","0.000000000","10.1.1.2","0.000042000","TCP"
"252","42.317008","8.113620000","0.000042000","0.000042000","10.202.1.2","0.000042000","12001  >  51356 [ACK] Seq=12610 Ack=25889 Win=64768 Len=0","54","0.000000000","10.1.1.2","0.000042000","TCP"
"271","42.351735","5.222406000","2.460900000","0.004094000","10.202.1.2","2.460900000","12003  >  51357 [PSH, ACK] Seq=1219 Ack=612 Win=65280 Len=172","226","0.000000000","10.1.1.2","0.004094000","TCP"
"272","42.354098","8.150710000","0.037090000","0.002363000","10.202.1.2","0.037090000","12001  >  51356 [PSH, ACK] Seq=12610 Ack=25889 Win=64768 Len=121","175","0.000000000","10.1.1.2","0.002363000","TCP"
"275","42.360920","5.231590000","0.000040000","0.000040000","10.202.1.2","0.000040000","12002  >  51358 [ACK] Seq=1219 Ack=25450 Win=65536 Len=0","54","0.000000000","10.1.1.2","0.000040000","TCP"
"278","42.543316","5.413986000","0.000056000","0.000056000","10.202.1.2","0.000056000","12002  >  51358 [ACK] Seq=1219 Ack=27210 Win=65536 Len=0","54","0.000000000","10.1.1.2","0.000056000","TCP"
"283","42.959946","5.830616000","0.000033000","0.000033000","10.202.1.2","0.000033000","12002  >  51358 [ACK] Seq=1219 Ack=30906 Win=65536 Len=0","54","0.000000000","10.1.1.2","0.000033000","TCP"
"294","43.177253","8.973865000","0.054938000","0.000515000","10.202.1.2","0.054938000","12001  >  51356 [PSH, ACK] Seq=12731 Ack=26487 Win=65536 Len=13957","14011","0.000000000","10.1.1.2","0.000515000","TCP"
"300","43.248166","6.118837000","0.896431000","0.000637000","10.202.1.2","0.896431000","12003  >  51357 [PSH, ACK] Seq=1391 Ack=612 Win=65280 Len=2803","2857","0.000000000","10.1.1.2","0.000637000","TCP"
"303","43.255465","6.126135000","0.000033000","0.000033000","10.202.1.2","0.000033000","12002  >  51358 [ACK] Seq=1219 Ack=33546 Win=65536 Len=0","54","0.000000000","10.1.1.2","0.000033000","TCP"
"310","43.364608","6.235279000","0.000022000","0.000022000","10.202.1.2","0.000022000","12003  >  51357 [PSH, ACK] Seq=4194 Ack=612 Win=65280 Len=525","579","0.000000000","10.1.1.2","0.000022000","TCP"
"313","43.457805","6.328475000","0.000031000","0.000031000","10.202.1.2","0.000031000","12002  >  51358 [ACK] Seq=1219 Ack=35306 Win=65536 Len=0","54","0.000000000","10.1.1.2","0.000031000","TCP"
"320","43.765314","6.635984000","0.000037000","0.000037000","10.202.1.2","0.000037000","12002  >  51358 [ACK] Seq=1219 Ack=37946 Win=65536 Len=0","54","0.000000000","10.1.1.2","0.000037000","TCP"
"324","43.984955","9.781567000","0.000035000","0.000035000","10.202.1.2","0.000035000","12001  >  51356 [PSH, ACK] Seq=26688 Ack=26729 Win=65280 Len=121","175","0.000000000","10.1.1.2","0.000035000","TCP"
"328","44.024891","6.895562000","0.000035000","0.000035000","10.202.1.2","0.000035000","12003  >  51357 [PSH, ACK] Seq=4719 Ack=977 Win=65024 Len=90","144","0.000000000","10.1.1.2","0.000035000","TCP"
"333","44.060604","6.931275000","0.006464000","0.001101000","10.202.1.2","0.006464000","12003  >  51357 [PSH, ACK] Seq=4809 Ack=977 Win=65024 Len=2877","2931","0.000000000","10.1.1.2","0.001101000","TCP"
"337","44.060839","6.931510000","0.000037000","0.000037000","10.202.1.2","0.000037000","12003  >  51357 [ACK] Seq=7686 Ack=2532 Win=65536 Len=0","54","0.000000000","10.1.1.2","0.000037000","TCP"
"342","44.075471","6.946141000","0.000029000","0.000029000","10.202.1.2","0.000029000","12002  >  51358 [ACK] Seq=1219 Ack=40762 Win=65536 Len=0","54","0.000000000","10.1.1.2","0.000029000","TCP"
"350","44.335356","7.206027000","0.202674000","0.029556000","10.202.1.2","0.202674000","12003  >  51357 [ACK] Seq=7686 Ack=3992 Win=65536 Len=0","54","0.000000000","10.1.1.2","0.029556000","TCP"
"356","44.376311","7.246981000","0.000024000","0.000024000","10.202.1.2","0.000024000","12002  >  51358 [ACK] Seq=1219 Ack=43402 Win=65536 Len=0","54","0.000000000","10.1.1.2","0.000024000","TCP"
"362","44.576000","7.446670000","0.000034000","0.000034000","10.202.1.2","0.000034000","12002  >  51358 [ACK] Seq=1219 Ack=45162 Win=65536 Len=0","54","0.000000000","10.1.1.2","0.000034000","TCP"
"366","44.789045","10.585657000","0.000083000","0.000016000","10.202.1.2","0.000083000","12001  >  51356 [PSH, ACK] Seq=26809 Ack=27444 Win=64512 Len=121","175","0.000000000","10.1.1.2","0.000016000","TCP"
"376","44.868900","7.739571000","0.000065000","0.000012000","10.202.1.2","0.000065000","12003  >  51357 [ACK] Seq=7686 Ack=6912 Win=65536 Len=0","54","0.000000000","10.1.1.2","0.000012000","TCP"
"385","44.887494","7.758164000","0.000029000","0.000029000","10.202.1.2","0.000029000","12002  >  51358 [ACK] Seq=1219 Ack=47802 Win=65536 Len=0","54","0.000000000","10.1.1.2","0.000029000","TCP"
"394","45.140435","8.011106000","0.000046000","0.000046000","10.202.1.2","0.000046000","12003  >  51357 [ACK] Seq=7686 Ack=9832 Win=65536 Len=0","54","0.000000000","10.1.1.2","0.000046000","TCP"
"401","45.169220","8.039891000","0.028785000","0.002187000","10.202.1.2","0.028785000","12003  >  51357 [ACK] Seq=7686 Ack=9832 Win=65536 Len=10220","10274","0.000000000","10.1.1.2","0.002187000","TCP"
"405","45.196329","8.066999000","0.000031000","0.000031000","10.202.1.2","0.000031000","12002  >  51358 [ACK] Seq=1219 Ack=50618 Win=65536 Len=0","54","0.000000000","10.1.1.2","0.000031000","TCP"
"411","45.495853","8.366523000","0.000037000","0.000037000","10.202.1.2","0.000037000","12002  >  51358 [ACK] Seq=1219 Ack=53258 Win=65536 Len=0","54","0.000000000","10.1.1.2","0.000037000","TCP"
"413","45.594376","11.390988000","0.000058000","0.000058000","10.202.1.2","0.000058000","12001  >  51356 [PSH, ACK] Seq=26930 Ack=28280 Win=65536 Len=714","768","0.000000000","10.1.1.2","0.000058000","TCP"
"426","45.675627","8.546298000","0.000084000","0.000018000","10.202.1.2","0.000084000","12003  >  51357 [ACK] Seq=17906 Ack=15672 Win=65536 Len=0","54","0.000000000","10.1.1.2","0.000018000","TCP"
"439","45.695569","8.566239000","0.000070000","0.000013000","10.202.1.2","0.000070000","12002  >  51358 [ACK] Seq=1219 Ack=55018 Win=65536 Len=0","54","0.000000000","10.1.1.2","0.000013000","TCP"
"449","45.944458","8.815129000","0.000037000","0.000037000","10.202.1.2","0.000037000","12003  >  51357 [ACK] Seq=17906 Ack=18592 Win=65536 Len=0","54","0.000000000","10.1.1.2","0.000037000","TCP"
"453","45.945784","8.816455000","0.000029000","0.000029000","10.202.1.2","0.000029000","12003  >  51357 [ACK] Seq=17906 Ack=21512 Win=65536 Len=0","54","0.000000000","10.1.1.2","0.000029000","TCP"
"465","45.975126","8.845797000","0.000075000","0.000049000","10.202.1.2","0.000075000","12003  >  51357 [ACK] Seq=17906 Ack=21512 Win=65536 Len=1460","1514","0.000000000","10.1.1.2","0.000049000","TCP"
"466","45.975143","8.845814000","0.000017000","0.000017000","10.202.1.2","0.000017000","12003  >  51357 [ACK] Seq=19366 Ack=21512 Win=65536 Len=1460","1514","0.000000000","10.1.1.2","0.000017000","TCP"
"467","45.975162","8.845833000","0.000019000","0.000019000","10.202.1.2","0.000019000","[TCP Fast Retransmission] 12003  >  51357 [ACK] Seq=9146 Ack=21512 Win=65536 Len=1460","1514","0.000000000","10.1.1.2","0.000019000","TCP"
"468","45.975173","8.845844000","0.000011000","0.000011000","10.202.1.2","0.000011000","12003  >  51357 [ACK] Seq=20826 Ack=21512 Win=65536 Len=1460","1514","0.000000000","10.1.1.2","0.000011000","TCP"
"470","45.976394","8.847065000","0.000027000","0.000027000","10.202.1.2","0.000027000","12003  >  51357 [PSH, ACK] Seq=22286 Ack=21512 Win=65536 Len=1460","1514","0.000000000","10.1.1.2","0.000027000","TCP"
"474","46.000362","8.871032000","0.000029000","0.000029000","10.202.1.2","0.000029000","12002  >  51358 [ACK] Seq=1219 Ack=57658 Win=65536 Len=0","54","0.000000000","10.1.1.2","0.000029000","TCP"
"481","46.315857","9.186527000","0.000034000","0.000034000","10.202.1.2","0.000034000","12002  >  51358 [ACK] Seq=1219 Ack=60474 Win=65536 Len=0","54","0.000000000","10.1.1.2","0.000034000","TCP"
"483","46.403733","12.200345000","0.000053000","0.000053000","10.202.1.2","0.000053000","12001  >  51356 [PSH, ACK] Seq=27644 Ack=29116 Win=64768 Len=835","889","0.000000000","10.1.1.2","0.000053000","TCP"
"488","46.426759","12.223371000","0.023026000","0.003054000","10.202.1.2","0.023026000","12001  >  51356 [PSH, ACK] Seq=28479 Ack=29116 Win=64768 Len=1992","2046","0.000000000","10.1.1.2","0.003054000","TCP"
"493","46.482274","9.352945000","0.000047000","0.000047000","10.202.1.2","0.000047000","12003  >  51357 [ACK] Seq=23746 Ack=27352 Win=65536 Len=0","54","0.000000000","10.1.1.2","0.000047000","TCP"
"497","46.483595","9.354266000","0.000040000","0.000040000","10.202.1.2","0.000040000","12003  >  51357 [ACK] Seq=23746 Ack=30272 Win=65536 Len=0","54","0.000000000","10.1.1.2","0.000040000","TCP"
"501","46.487570","9.358241000","0.000029000","0.000029000","10.202.1.2","0.000029000","12003  >  51357 [ACK] Seq=23746 Ack=33192 Win=65536 Len=0","54","0.000000000","10.1.1.2","0.000029000","TCP"
"534","46.615370","9.486040000","0.000029000","0.000029000","10.202.1.2","0.000029000","12002  >  51358 [ACK] Seq=1219 Ack=63114 Win=65536 Len=0","54","0.000000000","10.1.1.2","0.000029000","TCP"
"537","46.748537","9.619208000","0.000068000","0.000068000","10.202.1.2","0.000068000","12003  >  51357 [ACK] Seq=23746 Ack=36112 Win=65536 Len=0","54","0.000000000","10.1.1.2","0.000068000","TCP"
"540","46.749827","9.620498000","0.000037000","0.000037000","10.202.1.2","0.000037000","12003  >  51357 [ACK] Seq=23746 Ack=39032 Win=65536 Len=0","54","0.000000000","10.1.1.2","0.000037000","TCP"
"545","46.751166","9.621837000","0.000036000","0.000036000","10.202.1.2","0.000036000","12003  >  51357 [ACK] Seq=23746 Ack=44872 Win=65536 Len=0","54","0.000000000","10.1.1.2","0.000036000","TCP"
"565","46.784446","9.655117000","0.000046000","0.000046000","10.202.1.2","0.000046000","12003  >  51357 [PSH, ACK] Seq=23746 Ack=44872 Win=65536 Len=755","809","0.000000000","10.1.1.2","0.000046000","TCP"
"566","46.784534","9.655205000","0.000088000","0.000088000","10.202.1.2","0.000088000","12003  >  51357 [ACK] Seq=24501 Ack=44872 Win=65536 Len=5840","5894","0.000000000","10.1.1.2","0.000088000","TCP"
"570","46.816378","9.687048000","0.000030000","0.000030000","10.202.1.2","0.000030000","12002  >  51358 [ACK] Seq=1219 Ack=64874 Win=65536 Len=0","54","0.000000000","10.1.1.2","0.000030000","TCP"
"579","47.121229","9.991899000","0.000039000","0.000039000","10.202.1.2","0.000039000","12002  >  51358 [ACK] Seq=1219 Ack=67514 Win=65536 Len=0","54","0.000000000","10.1.1.2","0.000039000","TCP"
"582","47.207770","13.004382000","0.000057000","0.000057000","10.202.1.2","0.000057000","12001  >  51356 [PSH, ACK] Seq=30471 Ack=29710 Win=64256 Len=1186","1240","0.000000000","10.1.1.2","0.000057000","TCP"
"596","47.296949","10.167620000","0.000040000","0.000040000","10.202.1.2","0.000040000","12003  >  51357 [ACK] Seq=30341 Ack=50712 Win=65536 Len=0","54","0.000000000","10.1.1.2","0.000040000","TCP"
"603","47.299602","10.170273000","0.000034000","0.000034000","10.202.1.2","0.000034000","12003  >  51357 [ACK] Seq=30341 Ack=53632 Win=65536 Len=0","54","0.000000000","10.1.1.2","0.000034000","TCP"
"614","47.300968","10.171639000","0.000046000","0.000046000","10.202.1.2","0.000046000","12003  >  51357 [ACK] Seq=30341 Ack=68232 Win=59648 Len=0","54","0.000000000","10.1.1.2","0.000046000","TCP"
"615","47.301055","10.171726000","0.000087000","0.000087000","10.202.1.2","0.000087000","[TCP Window Update] 12003  >  51357 [ACK] Seq=30341 Ack=68232 Win=65536 Len=0","54","0.000000000","10.1.1.2","0.000087000","TCP"
"663","47.431376","13.227988000","0.000026000","0.000026000","10.202.1.2","0.000026000","12001  >  51356 [PSH, ACK] Seq=31657 Ack=30898 Win=65536 Len=593","647","0.000000000","10.1.1.2","0.000026000","TCP"
"666","47.436699","10.307369000","0.000024000","0.000024000","10.202.1.2","0.000024000","12002  >  51358 [ACK] Seq=1219 Ack=70330 Win=65536 Len=0","54","0.000000000","10.1.1.2","0.000024000","TCP"
"673","47.553873","10.424544000","0.000044000","0.000044000","10.202.1.2","0.000044000","12003  >  51357 [ACK] Seq=30341 Ack=74072 Win=65536 Len=0","54","0.000000000","10.1.1.2","0.000044000","TCP"
"676","47.555185","10.425856000","0.000032000","0.000032000","10.202.1.2","0.000032000","12003  >  51357 [ACK] Seq=30341 Ack=76992 Win=65536 Len=0","54","0.000000000","10.1.1.2","0.000032000","TCP"
"681","47.556521","10.427192000","0.000032000","0.000032000","10.202.1.2","0.000032000","12003  >  51357 [ACK] Seq=30341 Ack=81891 Win=65536 Len=0","54","0.000000000","10.1.1.2","0.000032000","TCP"
"687","47.591126","10.461797000","0.000035000","0.000035000","10.202.1.2","0.000035000","12003  >  51357 [ACK] Seq=30341 Ack=81891 Win=65536 Len=4380","4434","0.000000000","10.1.1.2","0.000035000","TCP"
"689","47.592444","10.463115000","0.000022000","0.000022000","10.202.1.2","0.000022000","12003  >  51357 [ACK] Seq=34721 Ack=81891 Win=65536 Len=2920","2974","0.000000000","10.1.1.2","0.000022000","TCP"
"709","47.737593","10.608263000","0.000059000","0.000059000","10.202.1.2","0.000059000","12002  >  51358 [ACK] Seq=1219 Ack=72846 Win=65536 Len=0","54","0.000000000","10.1.1.2","0.000059000","TCP"
"714","47.925258","10.795928000","0.000037000","0.000037000","10.202.1.2","0.000037000","12002  >  51358 [ACK] Seq=1219 Ack=73146 Win=65280 Len=0","54","0.000000000","10.1.1.2","0.000037000","TCP"
"717","47.939888","10.810558000","0.000027000","0.000027000","10.202.1.2","0.000027000","12002  >  51358 [ACK] Seq=1219 Ack=74730 Win=65536 Len=0","54","0.000000000","10.1.1.2","0.000027000","TCP"
"736","48.104973","10.975644000","0.000036000","0.000036000","10.202.1.2","0.000036000","12003  >  51357 [ACK] Seq=37641 Ack=89191 Win=65536 Len=0","54","0.000000000","10.1.1.2","0.000036000","TCP"
"742","48.106319","10.976990000","0.000047000","0.000047000","10.202.1.2","0.000047000","12003  >  51357 [ACK] Seq=37641 Ack=96491 Win=65536 Len=0","54","0.000000000","10.1.1.2","0.000047000","TCP"
"745","48.107618","10.978289000","0.000026000","0.000026000","10.202.1.2","0.000026000","12003  >  51357 [ACK] Seq=37641 Ack=99411 Win=65536 Len=0","54","0.000000000","10.1.1.2","0.000026000","TCP"
"756","48.109023","10.979694000","0.000079000","0.000023000","10.202.1.2","0.000079000","12003  >  51357 [ACK] Seq=37641 Ack=109631 Win=64000 Len=0","54","0.000000000","10.1.1.2","0.000023000","TCP"
"757","48.109769","10.980440000","0.000746000","0.000746000","10.202.1.2","0.000746000","[TCP Window Update] 12003  >  51357 [ACK] Seq=37641 Ack=109631 Win=65536 Len=0","54","0.000000000","10.1.1.2","0.000746000","TCP"
"761","48.112955","10.983626000","0.000034000","0.000034000","10.202.1.2","0.000034000","12003  >  51357 [ACK] Seq=37641 Ack=112551 Win=65536 Len=0","54","0.000000000","10.1.1.2","0.000034000","TCP"
"764","48.114274","10.984945000","0.000026000","0.000026000","10.202.1.2","0.000026000","12003  >  51357 [ACK] Seq=37641 Ack=115471 Win=65536 Len=0","54","0.000000000","10.1.1.2","0.000026000","TCP"
"781","48.119746","10.990417000","0.000153000","0.000023000","10.202.1.2","0.000153000","12003  >  51357 [ACK] Seq=37641 Ack=118391 Win=65536 Len=0","54","0.000000000","10.1.1.2","0.000023000","TCP"
"784","48.120927","10.991598000","0.000023000","0.000023000","10.202.1.2","0.000023000","12003  >  51357 [ACK] Seq=37641 Ack=120056 Win=65536 Len=0","54","0.000000000","10.1.1.2","0.000023000","TCP"
"788","48.213442","14.010054000","0.200364000","0.035299000","10.202.1.2","0.200364000","12001  >  51356 [ACK] Seq=32250 Ack=32086 Win=64512 Len=0","54","0.000000000","10.1.1.2","0.035299000","TCP"
"792","48.243403","11.114073000","0.000028000","0.000028000","10.202.1.2","0.000028000","12002  >  51358 [ACK] Seq=1219 Ack=77370 Win=65536 Len=0","54","0.000000000","10.1.1.2","0.000028000","TCP"
"801","48.363218","11.233889000","0.000040000","0.000040000","10.202.1.2","0.000040000","12003  >  51357 [ACK] Seq=37641 Ack=122976 Win=65536 Len=0","54","0.000000000","10.1.1.2","0.000040000","TCP"
"805","48.364546","11.235217000","0.000031000","0.000031000","10.202.1.2","0.000031000","12003  >  51357 [ACK] Seq=37641 Ack=127095 Win=65536 Len=0","54","0.000000000","10.1.1.2","0.000031000","TCP"
"812","48.399163","11.269834000","0.000044000","0.000044000","10.202.1.2","0.000044000","12003  >  51357 [ACK] Seq=37641 Ack=127095 Win=65536 Len=8760","8814","0.000000000","10.1.1.2","0.000044000","TCP"
"816","48.440417","14.237029000","0.000030000","0.000030000","10.202.1.2","0.000030000","12001  >  51356 [PSH, ACK] Seq=32250 Ack=32086 Win=64512 Len=593","647","0.000000000","10.1.1.2","0.000030000","TCP"
"823","48.554903","11.425573000","0.000032000","0.000032000","10.202.1.2","0.000032000","12002  >  51358 [ACK] Seq=1219 Ack=80186 Win=65536 Len=0","54","0.000000000","10.1.1.2","0.000032000","TCP"
"828","48.742605","11.613275000","0.000032000","0.000032000","10.202.1.2","0.000032000","12002  >  51358 [ACK] Seq=1219 Ack=81594 Win=64256 Len=0","54","0.000000000","10.1.1.2","0.000032000","TCP"
"849","48.927660","11.798331000","0.000050000","0.000050000","10.202.1.2","0.000050000","12003  >  51357 [ACK] Seq=46401 Ack=130015 Win=65536 Len=0","54","0.000000000","10.1.1.2","0.000050000","TCP"
"855","48.935627","11.806298000","0.000031000","0.000031000","10.202.1.2","0.000031000","12003  >  51357 [ACK] Seq=46401 Ack=136678 Win=65536 Len=0","54","0.000000000","10.1.1.2","0.000031000","TCP"
"867","49.055428","11.926098000","0.000032000","0.000032000","10.202.1.2","0.000032000","12002  >  51358 [ACK] Seq=1219 Ack=84586 Win=65536 Len=0","54","0.000000000","10.1.1.2","0.000032000","TCP"
"875","49.169946","12.040617000","0.000053000","0.000053000","10.202.1.2","0.000053000","12003  >  51357 [ACK] Seq=46401 Ack=143978 Win=65536 Len=0","54","0.000000000","10.1.1.2","0.000053000","TCP"
"880","49.209841","12.080512000","0.000032000","0.000032000","10.202.1.2","0.000032000","12003  >  51357 [ACK] Seq=46401 Ack=144569 Win=65024 Len=8760","8814","0.000000000","10.1.1.2","0.000032000","TCP"
"887","49.360280","12.230950000","0.000041000","0.000041000","10.202.1.2","0.000041000","12002  >  51358 [ACK] Seq=1219 Ack=87226 Win=65536 Len=0","54","0.000000000","10.1.1.2","0.000041000","TCP"
"918","49.749638","12.620308000","0.203037000","0.000700000","10.202.1.2","0.203037000","12002  >  51358 [ACK] Seq=1219 Ack=88458 Win=64256 Len=0","54","0.000000000","10.1.1.2","0.000700000","TCP"
"926","49.750323","12.620994000","0.000036000","0.000036000","10.202.1.2","0.000036000","12003  >  51357 [ACK] Seq=55161 Ack=155684 Win=64768 Len=0","54","0.000000000","10.1.1.2","0.000036000","TCP"
"936","49.859469","12.730139000","0.000034000","0.000034000","10.202.1.2","0.000034000","12002  >  51358 [ACK] Seq=1219 Ack=91626 Win=65536 Len=0","54","0.000000000","10.1.1.2","0.000034000","TCP"
"945","50.017927","12.888598000","0.000080000","0.000080000","10.202.1.2","0.000080000","12003  >  51357 [ACK] Seq=55161 Ack=157625 Win=65536 Len=2920","2974","0.000000000","10.1.1.2","0.000080000","TCP"
"951","50.020526","12.891197000","0.000025000","0.000025000","10.202.1.2","0.000025000","12003  >  51357 [ACK] Seq=58081 Ack=157625 Win=65536 Len=7300","7354","0.000000000","10.1.1.2","0.000025000","TCP"
"960","50.176283","13.046953000","0.000032000","0.000032000","10.202.1.2","0.000032000","12002  >  51358 [ACK] Seq=1219 Ack=94442 Win=65536 Len=0","54","0.000000000","10.1.1.2","0.000032000","TCP"
"980","50.555664","13.426334000","0.000028000","0.000028000","10.202.1.2","0.000028000","12002  >  51358 [ACK] Seq=1219 Ack=97610 Win=65536 Len=0","54","0.000000000","10.1.1.2","0.000028000","TCP"
"986","50.558343","13.429014000","0.000035000","0.000035000","10.202.1.2","0.000035000","12003  >  51357 [ACK] Seq=65381 Ack=164925 Win=65536 Len=0","54","0.000000000","10.1.1.2","0.000035000","TCP"
"990","50.563690","13.434361000","0.000057000","0.000057000","10.202.1.2","0.000057000","12003  >  51357 [ACK] Seq=65381 Ack=168137 Win=65536 Len=0","54","0.000000000","10.1.1.2","0.000057000","TCP"
"1011","50.716769","13.587439000","0.000050000","0.000050000","10.202.1.2","0.000050000","12002  >  51358 [ACK] Seq=1219 Ack=99194 Win=65536 Len=0","54","0.000000000","10.1.1.2","0.000050000","TCP"
"1022","50.832600","13.703271000","0.000065000","0.000065000","10.202.1.2","0.000065000","12003  >  51357 [ACK] Seq=65381 Ack=173977 Win=65536 Len=0 SLE=175437 SRE=175972","66","0.000000000","10.1.1.2","0.000065000","TCP"
"1023","50.832636","13.703307000","0.000036000","0.000036000","10.202.1.2","0.000036000","12003  >  51357 [ACK] Seq=65381 Ack=173977 Win=65536 Len=11680","11734","0.000000000","10.1.1.2","0.000036000","TCP"
"1041","50.981708","13.852378000","0.000075000","0.000075000","10.202.1.2","0.000075000","12002  >  51358 [ACK] Seq=1219 Ack=101482 Win=65536 Len=0","54","0.000000000","10.1.1.2","0.000075000","TCP"
"1061","51.362365","14.233035000","0.000030000","0.000030000","10.202.1.2","0.000030000","12002  >  51358 [ACK] Seq=1219 Ack=104826 Win=65536 Len=0","54","0.000000000","10.1.1.2","0.000030000","TCP"
"1068","51.371708","14.242379000","0.000042000","0.000042000","10.202.1.2","0.000042000","[TCP Dup ACK 1022#1] 12003  >  51357 [ACK] Seq=77061 Ack=173977 Win=65536 Len=0 SLE=175437 SRE=177432","66","0.000000000","10.1.1.2","0.000042000","TCP"
"1069","51.371726","14.242397000","0.000018000","0.000018000","10.202.1.2","0.000018000","[TCP Dup ACK 1022#2] 12003  >  51357 [ACK] Seq=77061 Ack=173977 Win=65536 Len=0 SLE=175437 SRE=178892","66","0.000000000","10.1.1.2","0.000018000","TCP"
"1070","51.371742","14.242413000","0.000016000","0.000016000","10.202.1.2","0.000016000","[TCP Dup ACK 1022#3] 12003  >  51357 [ACK] Seq=77061 Ack=173977 Win=65536 Len=0 SLE=175437 SRE=180352","66","0.000000000","10.1.1.2","0.000016000","TCP"
"1071","51.371758","14.242429000","0.000016000","0.000016000","10.202.1.2","0.000016000","[TCP Dup ACK 1022#4] 12003  >  51357 [ACK] Seq=77061 Ack=173977 Win=65536 Len=0 SLE=175437 SRE=181812","66","0.000000000","10.1.1.2","0.000016000","TCP"
"1072","51.371774","14.242445000","0.000016000","0.000016000","10.202.1.2","0.000016000","[TCP Dup ACK 1022#5] 12003  >  51357 [ACK] Seq=77061 Ack=173977 Win=65536 Len=0 SLE=175437 SRE=183272","66","0.000000000","10.1.1.2","0.000016000","TCP"
"1073","51.371790","14.242461000","0.000016000","0.000016000","10.202.1.2","0.000016000","[TCP Dup ACK 1022#6] 12003  >  51357 [ACK] Seq=77061 Ack=173977 Win=65536 Len=0 SLE=175437 SRE=184732","66","0.000000000","10.1.1.2","0.000016000","TCP"
"1076","51.380988","14.251659000","0.000020000","0.000020000","10.202.1.2","0.000020000","[TCP Dup ACK 1022#7] 12003  >  51357 [ACK] Seq=77061 Ack=173977 Win=65536 Len=0 SLE=175437 SRE=186192","66","0.000000000","10.1.1.2","0.000020000","TCP"
"1077","51.381003","14.251674000","0.000015000","0.000015000","10.202.1.2","0.000015000","[TCP Dup ACK 1022#8] 12003  >  51357 [ACK] Seq=77061 Ack=173977 Win=65536 Len=0 SLE=175437 SRE=186357","66","0.000000000","10.1.1.2","0.000015000","TCP"
"1084","51.644587","14.515258000","0.000045000","0.000045000","10.202.1.2","0.000045000","12003  >  51357 [ACK] Seq=77061 Ack=173977 Win=65536 Len=2920","2974","0.000000000","10.1.1.2","0.000045000","TCP"
"1086","51.645898","14.516569000","0.000027000","0.000027000","10.202.1.2","0.000027000","12003  >  51357 [PSH, ACK] Seq=79981 Ack=173977 Win=65536 Len=10220","10274","0.000000000","10.1.1.2","0.000027000","TCP"
"1093","51.668539","14.539209000","0.000034000","0.000034000","10.202.1.2","0.000034000","12002  >  51358 [ACK] Seq=1219 Ack=107466 Win=65536 Len=0","54","0.000000000","10.1.1.2","0.000034000","TCP"
"1099","51.837609","14.708279000","0.000041000","0.000041000","10.202.1.2","0.000041000","12002  >  51358 [ACK] Seq=1219 Ack=109050 Win=65536 Len=0","54","0.000000000","10.1.1.2","0.000041000","TCP"
"1119","52.167715","15.038385000","0.000021000","0.000021000","10.202.1.2","0.000021000","12002  >  51358 [ACK] Seq=1219 Ack=111214 Win=65536 Len=0","54","0.000000000","10.1.1.2","0.000021000","TCP"
"1122","52.178406","15.049077000","0.000054000","0.000054000","10.202.1.2","0.000054000","12003  >  51357 [ACK] Seq=90201 Ack=186357 Win=65536 Len=0","54","0.000000000","10.1.1.2","0.000054000","TCP"
"1127","52.374748","15.245418000","0.204391000","0.056565000","10.202.1.2","0.204391000","12002  >  51358 [ACK] Seq=1219 Ack=111866 Win=65024 Len=0","54","0.000000000","10.1.1.2","0.056565000","TCP"
"1129","52.452605","15.323276000","0.000035000","0.000035000","10.202.1.2","0.000035000","12003  >  51357 [ACK] Seq=90201 Ack=186357 Win=65536 Len=2920","2974","0.000000000","10.1.1.2","0.000035000","TCP"
"1131","52.453957","15.324628000","0.000059000","0.000059000","10.202.1.2","0.000059000","12003  >  51357 [ACK] Seq=93121 Ack=186357 Win=65536 Len=8760","8814","0.000000000","10.1.1.2","0.000059000","TCP"
"1136","52.475233","15.345903000","0.000030000","0.000030000","10.202.1.2","0.000030000","12002  >  51358 [ACK] Seq=1219 Ack=114682 Win=65536 Len=0","54","0.000000000","10.1.1.2","0.000030000","TCP"
"1147","52.657623","15.528294000","0.000047000","0.000047000","10.202.1.2","0.000047000","12003  >  51357 [ACK] Seq=101881 Ack=186357 Win=65536 Len=1460","1514","0.000000000","10.1.1.2","0.000047000","TCP"
"1150","52.774779","15.645449000","0.000052000","0.000052000","10.202.1.2","0.000052000","12002  >  51358 [ACK] Seq=1219 Ack=117322 Win=65536 Len=0","54","0.000000000","10.1.1.2","0.000052000","TCP"
"1152","52.789388","15.660059000","0.000029000","0.000029000","10.202.1.2","0.000029000","[TCP Dup ACK 1122#1] 12003  >  51357 [ACK] Seq=103341 Ack=186357 Win=65536 Len=0 SLE=173977 SRE=175437","66","0.000000000","10.1.1.2","0.000029000","TCP"
"1171","52.983763","15.854433000","0.000048000","0.000047000","10.202.1.2","0.000048000","12002  >  51358 [ACK] Seq=1219 Ack=119082 Win=65536 Len=0","54","0.000000000","10.1.1.2","0.000047000","TCP"
"1174","52.985077","15.855748000","0.000030000","0.000030000","10.202.1.2","0.000030000","12003  >  51357 [ACK] Seq=103341 Ack=190737 Win=65536 Len=0","54","0.000000000","10.1.1.2","0.000030000","TCP"
"1177","52.987740","15.858411000","0.000030000","0.000030000","10.202.1.2","0.000030000","12003  >  51357 [ACK] Seq=103341 Ack=193657 Win=65536 Len=0","54","0.000000000","10.1.1.2","0.000030000","TCP"
"1183","53.180794","16.051464000","0.000055000","0.000055000","10.202.1.2","0.000055000","12002  >  51358 [ACK] Seq=1219 Ack=120842 Win=65536 Len=0","54","0.000000000","10.1.1.2","0.000055000","TCP"
"1185","53.258005","16.128676000","0.000058000","0.000058000","10.202.1.2","0.000058000","12003  >  51357 [ACK] Seq=103341 Ack=193657 Win=65536 Len=4380","4434","0.000000000","10.1.1.2","0.000058000","TCP"
"1188","53.260622","16.131293000","0.000025000","0.000025000","10.202.1.2","0.000025000","12003  >  51357 [ACK] Seq=107721 Ack=193657 Win=65536 Len=8760","8814","0.000000000","10.1.1.2","0.000025000","TCP"
"1196","53.359152","16.229822000","0.000042000","0.000042000","10.202.1.2","0.000042000","12002  >  51358 [ACK] Seq=1219 Ack=122426 Win=65536 Len=0","54","0.000000000","10.1.1.2","0.000042000","TCP"
"1199","53.596085","16.466755000","0.000030000","0.000030000","10.202.1.2","0.000030000","12002  >  51358 [ACK] Seq=1219 Ack=124414 Win=65536 Len=0","54","0.000000000","10.1.1.2","0.000030000","TCP"
"1202","53.658649","16.529320000","0.000028000","0.000028000","10.202.1.2","0.000028000","12003  >  51357 [ACK] Seq=116481 Ack=193657 Win=65536 Len=1460","1514","0.000000000","10.1.1.2","0.000028000","TCP"
"1204","53.789154","16.659824000","0.000058000","0.000058000","10.202.1.2","0.000058000","12002  >  51358 [ACK] Seq=1219 Ack=125594 Win=64512 Len=0","54","0.000000000","10.1.1.2","0.000058000","TCP"
"1209","53.791788","16.662459000","0.000038000","0.000038000","10.202.1.2","0.000038000","12003  >  51357 [ACK] Seq=117941 Ack=199497 Win=65536 Len=0","54","0.000000000","10.1.1.2","0.000038000","TCP"
"1215","53.793109","16.663780000","0.000031000","0.000031000","10.202.1.2","0.000031000","12003  >  51357 [ACK] Seq=117941 Ack=206797 Win=65536 Len=0","54","0.000000000","10.1.1.2","0.000031000","TCP"
"1222","53.895629","16.766299000","0.000054000","0.000054000","10.202.1.2","0.000054000","12002  >  51358 [ACK] Seq=1219 Ack=127178 Win=65536 Len=0","54","0.000000000","10.1.1.2","0.000054000","TCP"
"1227","54.002740","16.873411000","0.201681000","0.019310000","10.202.1.2","0.201681000","12003  >  51357 [ACK] Seq=117941 Ack=208257 Win=65536 Len=0","54","0.000000000","10.1.1.2","0.019310000","TCP"
"1229","54.069988","16.940659000","0.000031000","0.000031000","10.202.1.2","0.000031000","12003  >  51357 [ACK] Seq=117941 Ack=208257 Win=65536 Len=2920","2974","0.000000000","10.1.1.2","0.000031000","TCP"
"1231","54.075299","16.945970000","0.000021000","0.000021000","10.202.1.2","0.000021000","12003  >  51357 [ACK] Seq=120861 Ack=208257 Win=65536 Len=4380","4434","0.000000000","10.1.1.2","0.000021000","TCP"
"1233","54.076629","16.947300000","0.000020000","0.000020000","10.202.1.2","0.000020000","12003  >  51357 [PSH, ACK] Seq=125241 Ack=208257 Win=65536 Len=7300","7354","0.000000000","10.1.1.2","0.000020000","TCP"
"1236","54.104596","16.975266000","0.000027000","0.000027000","10.202.1.2","0.000027000","12002  >  51358 [ACK] Seq=1219 Ack=128938 Win=65536 Len=0","54","0.000000000","10.1.1.2","0.000027000","TCP"
"1247","54.295010","17.165680000","0.000066000","0.000066000","10.202.1.2","0.000066000","12002  >  51358 [ACK] Seq=1219 Ack=130698 Win=65536 Len=0","54","0.000000000","10.1.1.2","0.000066000","TCP"
"1250","54.476033","17.346703000","0.000055000","0.000055000","10.202.1.2","0.000055000","12002  >  51358 [ACK] Seq=1219 Ack=132282 Win=65536 Len=0","54","0.000000000","10.1.1.2","0.000055000","TCP"
"1254","54.597162","17.467833000","0.000054000","0.000054000","10.202.1.2","0.000054000","12003  >  51357 [ACK] Seq=132541 Ack=211177 Win=65536 Len=1460","1514","0.000000000","10.1.1.2","0.000054000","TCP"
"1259","54.599806","17.470477000","0.000030000","0.000030000","10.202.1.2","0.000030000","12003  >  51357 [ACK] Seq=134001 Ack=217017 Win=65536 Len=0","54","0.000000000","10.1.1.2","0.000030000","TCP"
"1265","54.609129","17.479800000","0.000035000","0.000035000","10.202.1.2","0.000035000","12003  >  51357 [ACK] Seq=134001 Ack=222262 Win=65536 Len=0","54","0.000000000","10.1.1.2","0.000035000","TCP"
"1272","54.699635","17.570305000","0.000028000","0.000028000","10.202.1.2","0.000028000","12002  >  51358 [ACK] Seq=1219 Ack=133866 Win=65536 Len=0","54","0.000000000","10.1.1.2","0.000028000","TCP"
"1277","54.834130","17.704800000","0.000055000","0.000055000","10.202.1.2","0.000055000","12002  >  51358 [ACK] Seq=1219 Ack=135450 Win=65536 Len=0","54","0.000000000","10.1.1.2","0.000055000","TCP"
"1280","54.884698","17.755369000","0.000050000","0.000050000","10.202.1.2","0.000050000","12003  >  51357 [ACK] Seq=134001 Ack=222262 Win=65536 Len=7300","7354","0.000000000","10.1.1.2","0.000050000","TCP"
"1282","54.886009","17.756680000","0.000041000","0.000041000","10.202.1.2","0.000041000","12003  >  51357 [ACK] Seq=141301 Ack=222262 Win=65536 Len=8760","8814","0.000000000","10.1.1.2","0.000041000","TCP"
"1288","55.016469","17.887139000","0.000037000","0.000037000","10.202.1.2","0.000037000","12002  >  51358 [ACK] Seq=1219 Ack=137034 Win=65536 Len=0","54","0.000000000","10.1.1.2","0.000037000","TCP"
"1292","55.216151","18.086821000","0.000039000","0.000039000","10.202.1.2","0.000039000","12002  >  51358 [ACK] Seq=1219 Ack=138794 Win=65536 Len=0","54","0.000000000","10.1.1.2","0.000039000","TCP"
"1296","55.415883","18.286553000","0.000084000","0.000084000","10.202.1.2","0.000084000","12002  >  51358 [ACK] Seq=1219 Ack=140554 Win=65536 Len=0","54","0.000000000","10.1.1.2","0.000084000","TCP"
"1300","55.417173","18.287844000","0.000054000","0.000054000","10.202.1.2","0.000054000","12003  >  51357 [ACK] Seq=150061 Ack=226642 Win=65536 Len=1460","1514","0.000000000","10.1.1.2","0.000054000","TCP"
"1307","55.418476","18.289147000","0.000025000","0.000025000","10.202.1.2","0.000025000","12003  >  51357 [ACK] Seq=151521 Ack=235402 Win=65536 Len=0","54","0.000000000","10.1.1.2","0.000025000","TCP"
"1312","55.427794","18.298465000","0.000027000","0.000027000","10.202.1.2","0.000027000","12003  >  51357 [ACK] Seq=151521 Ack=241242 Win=65536 Len=0","54","0.000000000","10.1.1.2","0.000027000","TCP"
"1315","55.429125","18.299796000","0.000029000","0.000029000","10.202.1.2","0.000029000","12003  >  51357 [ACK] Seq=151521 Ack=244162 Win=65536 Len=0","54","0.000000000","10.1.1.2","0.000029000","TCP"
"1323","55.595540","18.466210000","0.000042000","0.000042000","10.202.1.2","0.000042000","12002  >  51358 [ACK] Seq=1219 Ack=142138 Win=65536 Len=0","54","0.000000000","10.1.1.2","0.000042000","TCP"
"1326","55.691380","18.562051000","0.000038000","0.000038000","10.202.1.2","0.000038000","12003  >  51357 [ACK] Seq=151521 Ack=244162 Win=65536 Len=5840","5894","0.000000000","10.1.1.2","0.000038000","TCP"
"1328","55.692713","18.563384000","0.000048000","0.000048000","10.202.1.2","0.000048000","12003  >  51357 [ACK] Seq=157361 Ack=244162 Win=65536 Len=1460","1514","0.000000000","10.1.1.2","0.000048000","TCP"
"1329","55.692719","18.563390000","0.000006000","0.000006000","10.202.1.2","0.000006000","12003  >  51357 [ACK] Seq=158821 Ack=244162 Win=65536 Len=1460","1514","0.000000000","10.1.1.2","0.000006000","TCP"
